ScreenName,AuthorID,TweetID,Text,TweetDate,isReply,RetweetCount,ReplyCount,LikeCount,QuoteCount,Language,PossibleSensitive,Source,1stURLStart,1stURLEnd,1stURL,1stURLExp,2ndURLStart,2ndURLEnd,2ndURL,2ndURLExp,3rdURLStart,3rdURLEnd,3rdURL,3rdURLExp
RepAdamSchiff,29501253,1325465777949073408,"Now, the work begins:
 
Getting this pandemic under control. Rebuilding our economy. Expanding health care. Fighting climate change. 
Protecting our democracy. Bolstering truth and accountability. Restoring our standing in the eyes of the world. 
https://t.co/E5ZmzUc1VS",2020-11-08 15:50:42+00:00,False,1964,1291,14726,282,en,False,Twitter for iPhone,247,270,https://t.co/E5ZmzUc1VS,https://www.latimes.com/opinion/story/2020-11-07/op-ed-adam-schiff-biden-has-his-work-cut-out-for-him,NA,NA,NA,NA,NA,NA,NA,NA
RepAdamSchiff,29501253,1325181302157537280,"Over the last four years, our democracy was tested in ways we never imagined.

At times it seemed to falter, the guardrails tumbling down.

But in the end, our democracy proved resilient.

Because truth mattered, right mattered, and decency mattered. 

Because of you.",2020-11-07 21:00:17+00:00,False,9261,4411,70996,1246,en,False,Twitter for iPhone,NA,NA,NA,NA,NA,NA,NA,NA,NA,NA,NA,NA
RepAdamSchiff,29501253,1325115531196854272,"Joe Biden’s story is one of loss, perseverance and human decency.

His victory, and Kamala’s, shows that in America, those qualities still matter.

That right still matters. Truth still matters. And decency still matters.

Rebuilding won't be quick or easy.

Let’s get to work.",2020-11-07 16:38:56+00:00,False,5372,1280,38803,523,en,False,Twitter for iPhone,NA,NA,NA,NA,NA,NA,NA,NA,NA,NA,NA,NA
RepAdamSchiff,29501253,1324509858448789504,"What we just saw was the most dishonest and anti-democratic moment in the history of the presidency.

Donald Trump lied incessantly about our election and undermined the very foundation of our democracy.

We will count every vote. No matter what he says.",2020-11-06 00:32:13+00:00,False,20920,8904,122336,2445,en,False,Twitter for iPhone,NA,NA,NA,NA,NA,NA,NA,NA,NA,NA,NA,NA
RepAdamSchiff,29501253,1324132225668075522,"Let’s recap.

Trump spent months spreading lies about vote by mail so his supporters wouldn’t use it.

Then Republicans blocked proposals to allow mail ballots to be counted quickly.

Now Trump claims the counting of valid mail ballots is fraud.

Enough. We will count every vote.",2020-11-04 23:31:38+00:00,False,17203,2604,89733,1484,en,False,Twitter for iPhone,NA,NA,NA,NA,NA,NA,NA,NA,NA,NA,NA,NA
RepAdamSchiff,29501253,1324018382757396487,"Good morning.
 
The election isn't over until every vote is counted.
 
No matter what the President says.
 
Every vote counts, and every vote must be counted.
 
Count every vote.",2020-11-04 15:59:16+00:00,False,4147,1085,32865,385,en,False,Twitter for iPhone,NA,NA,NA,NA,NA,NA,NA,NA,NA,NA,NA,NA
RepAdamSchiff,29501253,1323895064200884224,"Once again, the President is lying to the American people and acting like a would-be despot.

We will count every vote. And ignore the noise.",2020-11-04 07:49:14+00:00,False,10799,2202,76622,799,en,False,Twitter for iPhone,NA,NA,NA,NA,NA,NA,NA,NA,NA,NA,NA,NA
RepAdamSchiff,29501253,1323762249979351045,"History will not be kind to Donald Trump.

Because whenever we have departed from the values of our nation, we have come to regret it.

And that regret is written all over the pages of our history.

It may be midnight in Washington, but the sun will rise again.

And soon. https://t.co/vSii6e31bW",2020-11-03 23:01:29+00:00,False,2743,1711,17330,459,en,False,Twitter Media Studio,273,296,https://t.co/vSii6e31bW,https://twitter.com/RepAdamSchiff/status/1323762249979351045/video/1,NA,NA,NA,NA,NA,NA,NA,NA
RepAdamSchiff,29501253,1323709780679077888,"You know you can't trust this President to do what's right for this country.

You can only trust he'll do what's right for Donald Trump.
 
But here, in America:
 
Right matters.
 
Truth matters.
 
Decency matters.
 
If not, no Constitution can save us. If not, we are lost. https://t.co/sY61cAEfaR",2020-11-03 19:32:59+00:00,False,2863,1454,14245,546,en,False,Twitter Media Studio,274,297,https://t.co/sY61cAEfaR,https://twitter.com/RepAdamSchiff/status/1323709780679077888/video/1,NA,NA,NA,NA,NA,NA,NA,NA
RepAdamSchiff,29501253,1323677145135222784,"During the impeachment trial, I asked this rhetorical question to Republican Senators:

How much damage can Trump do between now and the next election?

I answered: A lot. A lot of damage.

With over 230,000 Americans now dead, we had no idea just how great the damage would be. https://t.co/T929aE1MdF",2020-11-03 17:23:18+00:00,False,6224,1475,26176,730,en,False,Twitter Media Studio,279,302,https://t.co/T929aE1MdF,https://twitter.com/RepAdamSchiff/status/1323677145135222784/video/1,NA,NA,NA,NA,NA,NA,NA,NA
RepAdamSchiff,29501253,1323656094363865088,"Here are three simple rules to follow for Election Day:

Rule 1: If you haven’t voted already, do so. Now.

Rule 2: Be patient. We may not know the result tonight.

Rule 3: The election isn’t over until every vote is counted! https://t.co/14l2PqavwU",2020-11-03 15:59:39+00:00,False,1881,664,10272,194,en,False,Twitter Media Studio,226,249,https://t.co/14l2PqavwU,https://twitter.com/RepAdamSchiff/status/1323656094363865088/video/1,NA,NA,NA,NA,NA,NA,NA,NA
RepAdamSchiff,29501253,1322997625348653061,"Dr. Fauci’s loyalty is to truth, science, and the American people. Just as it should be.

We could have saved tens of thousands of lives if Trump listened to him. We still can.

But for Trump, truth isn’t truth, science is suspect, and personal interest comes before saving lives. https://t.co/k0w5bJuCGW",2020-11-01 20:23:08+00:00,False,4623,1867,20866,543,en,False,Twitter for iPhone,281,304,https://t.co/k0w5bJuCGW,https://twitter.com/CNNPolitics/status/1322746699450884097,NA,NA,NA,NA,NA,NA,NA,NA
RepAdamSchiff,29501253,1322343308576903171,"No country has ever recorded 100,000 positive tests in a day. We’re about to. 

Hospitalizations and deaths are rising too.

Trump has given up fighting the virus. Even worse, he’s actively spreading it through his campaign rallies.

It didn’t have to be this way.",2020-10-31 01:03:07+00:00,False,13461,7870,50404,2071,en,False,Twitter for iPhone,NA,NA,NA,NA,NA,NA,NA,NA,NA,NA,NA,NA
RepAdamSchiff,29501253,1321836307539238914,"Donald Trump, who has financial interests in Turkey, won’t stand up to Erdogan. Ever.

He even interfered in a DOJ investigation of a Turkish bank suspected of funding Iran’s nuclear program.

Trump cares only about his own interests, not America’s. 

https://t.co/o55aBBtnt5",2020-10-29 15:28:28+00:00,False,5402,1709,17122,719,en,False,Twitter for iPhone,252,275,https://t.co/o55aBBtnt5,https://www.nytimes.com/2020/10/29/us/politics/trump-erdogan-halkbank.html,NA,NA,NA,NA,NA,NA,NA,NA
RepAdamSchiff,29501253,1321491734317117440,"From the president that brought you “truth isn’t truth” and “alternative facts” comes his most monstrous lie:

The pandemic is over.

Meanwhile almost 1,000 Americans are still dying from it each day and cases are rising.

No, the pandemic isn't over. But his presidency must be. https://t.co/rOGlsJBjww",2020-10-28 16:39:16+00:00,False,4189,1965,14219,618,en,False,Twitter for iPhone,280,303,https://t.co/rOGlsJBjww,https://twitter.com/CNNPolitics/status/1321393049705029633,NA,NA,NA,NA,NA,NA,NA,NA
RepAdamSchiff,29501253,1321299312505200642,"Finally, something not only good, but great to come out of 2020 — 

Congrats @Dodgers!

It took thirty-two years, but what a World Series win!",2020-10-28 03:54:39+00:00,False,759,1226,11796,144,en,False,Twitter for iPhone,NA,NA,NA,NA,NA,NA,NA,NA,NA,NA,NA,NA
RepAdamSchiff,29501253,1321232759516528640,"There is no limit to this Administration’s corruption and self-dealing.

Trump compelled the government to patronize his own resorts, charging taxpayers millions for rooms, food and more.

He even billed us for water he drank at his own resort.

Trump must be held accountable. https://t.co/if4cTwlGXi",2020-10-27 23:30:11+00:00,False,10502,5572,30505,1520,en,False,Twitter for iPhone,278,301,https://t.co/if4cTwlGXi,https://twitter.com/Fahrenthold/status/1321138640794378242,NA,NA,NA,NA,NA,NA,NA,NA
RepAdamSchiff,29501253,1320845614897389568,"This rushed confirmation is more than just a hypocritical power grab.

It’s more than an effort to deny voters a say.

It's an assault on your healthcare, LGBTQ rights, a woman's right to choose, voting rights, clean water and air, and more.

The new Congress must fight back.",2020-10-26 21:51:49+00:00,False,12279,6850,58010,1718,en,False,Twitter for iPhone,NA,NA,NA,NA,NA,NA,NA,NA,NA,NA,NA,NA
RepAdamSchiff,29501253,1320423340616617985,"Yesterday, I spoke with Armenia’s foreign minister, @ZMnatsakanyan, about the efforts to secure a ceasefire in Artsakh, and Azerbaijan and Turkey’s continued deadly aggression.

The United States must keep up the pressure on Aliyev and Erdogan to end this war.",2020-10-25 17:53:51+00:00,False,1359,1343,5206,519,en,False,Twitter for iPhone,NA,NA,NA,NA,NA,NA,NA,NA,NA,NA,NA,NA
RepAdamSchiff,29501253,1320400850834149380,"This is what failed leadership looks like:

“We’re not going to control the pandemic.”

The scientists are idiots, Trump claims, even as thousands are dying.

Trump never had a plan. He never will have a plan. https://t.co/GniQv7AOJ7",2020-10-25 16:24:29+00:00,False,5773,1702,21233,727,en,False,Twitter for iPhone,210,233,https://t.co/GniQv7AOJ7,https://twitter.com/atrupar/status/1320353720132128768,NA,NA,NA,NA,NA,NA,NA,NA
RepAdamSchiff,29501253,1319813518217142272,"Liddle, pencil neck, leakin’ monster of no control, sick puppy, sleazy, Shifty, and now...watermelonhead?

Doesn’t Trump know the cardinal rule of childish nicknames—pick one and stick with it?

Come on, Donald. You’re a terrible President but you’re supposed to be good at this. https://t.co/v6uQlOPwP1",2020-10-24 01:30:38+00:00,False,5613,4911,43775,1230,en,False,Twitter for iPhone,280,303,https://t.co/v6uQlOPwP1,https://twitter.com/DJJudd/status/1319801134840774657,NA,NA,NA,NA,NA,NA,NA,NA
RepAdamSchiff,29501253,1319723293973368832,"I am formally calling for U.S. recognition of the Independent Republic of Artsakh.

The United States will not stand idly by as Azerbaijan and Turkey wage war on Artsakh, killing hundreds of soldiers and civilians, and displacing tens of thousands.
 
I stand with Artsakh. https://t.co/cPzMjNoMeF",2020-10-23 19:32:07+00:00,False,2180,2300,7916,1490,en,False,Twitter Web App,273,296,https://t.co/cPzMjNoMeF,https://twitter.com/RepAdamSchiff/status/1319723293973368832/photo/1,NA,NA,NA,NA,NA,NA,NA,NA
RepAdamSchiff,29501253,1319648340871708672,"It didn’t have to be this way.

But now we must live with the enormous and unimaginable loss. Americans will carry this collective grief for decades.

In honor of all the lives cut tragically, needlessly short:

Wear a mask. Social distance. Stay home and stay safe.

And vote. https://t.co/PPchXoOj8u",2020-10-23 14:34:17+00:00,False,2308,1342,10703,250,en,False,Twitter Web App,278,301,https://t.co/PPchXoOj8u,https://twitter.com/carlzimmer/status/1319048869523705856,NA,NA,NA,NA,NA,NA,NA,NA
RepAdamSchiff,29501253,1319356069433511936,"Trump doesn’t have a healthcare plan. He’s never had one and never will.

All the rest is an empty promise.

But American families can’t pay their bills or keep their loved ones protected with empty promises.

Tens of millions will lose their healthcare. That’s their only plan. https://t.co/jqfq4ylWhk",2020-10-22 19:12:54+00:00,False,2061,1027,8469,242,en,False,Twitter for iPhone,279,302,https://t.co/jqfq4ylWhk,https://twitter.com/kylegriffin1/status/1319306305027280897,NA,NA,NA,NA,NA,NA,NA,NA
RepAdamSchiff,29501253,1319275845094043648,"Days before the election, Republicans are trying to give an extreme nominee a lifetime appointment, to strike down health care, voting rights, and more.

They refuse to let Americans have a say.

It’s an illegitimate power grab and Democrats are right to boycott.",2020-10-22 13:54:07+00:00,False,11224,5981,51473,1504,en,False,Twitter for iPhone,NA,NA,NA,NA,NA,NA,NA,NA,NA,NA,NA,NA
RepAdamSchiff,29501253,1319059267434012672,"It's on, @USRepKCastor and @RepCharlieCrist!
 
Luckily, I already have a few #Dodgers masks on hand. Looking forward to seeing you both sporting Dodger Blue on the House Floor soon.
 
It's time for Dodger baseball! #ITFDB https://t.co/75Sddf0UE6",2020-10-21 23:33:30+00:00,False,104,309,920,18,en,False,Twitter for iPhone,222,245,https://t.co/75Sddf0UE6,https://twitter.com/RepJimmyGomez/status/1319021014991372288,NA,NA,NA,NA,NA,NA,NA,NA
RepAdamSchiff,29501253,1318941370673958914,"The Trump Administration has adopted many cruel and callous policies. 

But none was more shameful than family separation, which orphaned more than 500 migrant children.

And for what? To use their suffering for political gain?

America is better than this. 

We have to be. https://t.co/o6WcLttfAW",2020-10-21 15:45:02+00:00,False,3621,1607,13352,352,en,False,Twitter for iPhone,275,298,https://t.co/o6WcLttfAW,https://twitter.com/kylegriffin1/status/1318680898271768576,NA,NA,NA,NA,NA,NA,NA,NA
RepAdamSchiff,29501253,1318667529464795137,"It’s time to stop playing games, Mitch McConnell. 

The coronavirus crisis is far from over. Millions of Americans need help. Desperately. 

They’ve spent months waiting for you to act, and all for naught.

People’s lives and livelihoods are on the line. Act like it. https://t.co/gtkinb4jgp",2020-10-20 21:36:53+00:00,False,5529,2072,17335,509,en,False,Twitter for iPhone,268,291,https://t.co/gtkinb4jgp,https://twitter.com/nytimes/status/1318651959205912581,NA,NA,NA,NA,NA,NA,NA,NA
RepAdamSchiff,29501253,1318579343199789059,"Journalists across the world are harassed, arrested, and even murdered for their reporting.

The Jamal Khashoggi Press Freedom Accountability Act will ensure that the U.S. holds perpetrators accountable.

Standing up for democracy means standing up for a free press. https://t.co/rEnVV2mqen",2020-10-20 15:46:28+00:00,False,4257,1041,15783,203,en,False,Twitter Web App,267,290,https://t.co/rEnVV2mqen,https://twitter.com/RepAdamSchiff/status/1318579343199789059/photo/1,NA,NA,NA,NA,NA,NA,NA,NA
RepAdamSchiff,29501253,1318256295871434755,"Anticipating the harsh judgment of history, Trump’s enablers are lashing out. At everyone.

It will be said that when they found they lacked the courage to confront the most dangerous, unethical president in American history,

They consoled themselves by attacking those who did.",2020-10-19 18:22:47+00:00,False,18392,8428,63341,1608,en,False,Twitter for iPhone,NA,NA,NA,NA,NA,NA,NA,NA,NA,NA,NA,NA
RepAdamSchiff,29501253,1318228125067694080,"220,000 Americans are dead and infection rates are climbing in 43 states. 

After deceptively using Dr. Fauci’s words in a TV ad last week, now Trump is attacking him as a “disaster.”

For what? For telling the truth.

We all know who the disaster is here, Mr. President.

You. https://t.co/WjC0Uw4VbF",2020-10-19 16:30:51+00:00,False,9302,2269,30727,496,en,False,Twitter for iPhone,278,301,https://t.co/WjC0Uw4VbF,https://twitter.com/nytimes/status/1318222145248514048,NA,NA,NA,NA,NA,NA,NA,NA
RepAdamSchiff,29501253,1317867748245016576,"For months, Dr. Fauci and others have warned how difficult this fall could be if we didn’t get the virus under control.
 
Fall is here, and the virus is spreading fast.

Despite the glaring absence of presidential leadership, we all must do our part. 

Mask. Distance. Stay safe. https://t.co/8El5CY3r1g",2020-10-18 16:38:50+00:00,False,2680,1033,8046,165,en,False,Twitter for iPhone,280,303,https://t.co/8El5CY3r1g,https://twitter.com/DrTomFrieden/status/1317250975489527809,NA,NA,NA,NA,NA,NA,NA,NA
RepAdamSchiff,29501253,1317169231604162561,"The election is only a few weeks away, and the stakes couldn't be higher.

Angelenos: Have you made a plan to vote yet? If not, I'll walk you through your options in less than 2 minutes.

Your voice matters. You can make a difference. Vote. https://t.co/aK7MbuD64b",2020-10-16 18:23:11+00:00,False,845,1499,2782,134,en,False,Twitter Media Studio,241,264,https://t.co/aK7MbuD64b,https://twitter.com/RepAdamSchiff/status/1317169231604162561/video/1,NA,NA,NA,NA,NA,NA,NA,NA
RepAdamSchiff,29501253,1317140906139582470,"During the worst fire season ever, the Trump Administration is denying disaster aid to California.

When it comes to disasters, there is no “red” or “blue” America: We are one America.

Withholding help for political reasons is heartless and immoral.

We’ll fight this decision. https://t.co/bumTdZ8JyI",2020-10-16 16:30:37+00:00,False,10330,2871,32459,805,en,False,Twitter for iPhone,279,302,https://t.co/bumTdZ8JyI,https://twitter.com/latimes/status/1316953780118802433,NA,NA,NA,NA,NA,NA,NA,NA
RepAdamSchiff,29501253,1316903924251693058,"This isn’t hard:

QAnon is a crazy, dangerous, fringe conspiracy theory. I denounce it.

Trump refuses to say the same — simply because most of its followers support him.

Worse, Trump amplifies QAnon, which can lead to real world consequences and violence.

Enough already.",2020-10-16 00:48:57+00:00,False,7752,9671,31796,1623,en,False,Twitter for iPhone,NA,NA,NA,NA,NA,NA,NA,NA,NA,NA,NA,NA
RepAdamSchiff,29501253,1316750410250682368,"For more than a year, Trump has been desperate to create a scandal around his opponent.

He even tried to extort a foreign country into smearing Joe Biden, but failed.

Trump was caught and impeached over it.  Now he’s at it again.

Different scheme. Same corrupt president.",2020-10-15 14:38:56+00:00,False,17859,8118,61805,1521,en,False,Twitter for iPhone,NA,NA,NA,NA,NA,NA,NA,NA,NA,NA,NA,NA
RepAdamSchiff,29501253,1315671746528382977,"Election Day is in 22 days.

But the election itself is already underway. Millions have cast their ballots.

The American people deserve a say in the future of the Supreme Court, and with it healthcare, voting rights and reproductive choice.

No confirmation before inauguration.",2020-10-12 15:12:43+00:00,False,6402,2954,23952,468,en,False,Twitter for iPhone,NA,NA,NA,NA,NA,NA,NA,NA,NA,NA,NA,NA
RepAdamSchiff,29501253,1315655002514485250,"This season was unlike any other:

A legend taken before his time. A pandemic and season played in a bubble. Another superstar leading our team.

Congrats to the Lakers and all their fans on their 17th championship. Thanks for giving us reason to cheer.",2020-10-12 14:06:10+00:00,False,544,350,4495,31,en,False,Twitter for iPhone,NA,NA,NA,NA,NA,NA,NA,NA,NA,NA,NA,NA
RepAdamSchiff,29501253,1314988085248172039,"It was illegal for Donald Trump to hold his nominating convention at the White House in August.

And it is morally bankrupt for Donald Trump to hold another super-spreader rally at the White House today.

The law and ethics don’t matter to this President. Nor does our health.",2020-10-10 17:56:05+00:00,False,30810,13750,124911,2451,en,False,Twitter for iPhone,NA,NA,NA,NA,NA,NA,NA,NA,NA,NA,NA,NA
RepAdamSchiff,29501253,1314717732592652288,"Donald Trump held a super-spreader event at the White House. Now he wants to hold another big rally there, and still refuses to wear a mask.

I don’t think Donald Trump wants even more Americans to be infected with COVID-19.

But if he did, would he be doing anything different? https://t.co/g5kGsSpKP4",2020-10-10 00:01:48+00:00,False,2476,1405,8936,186,en,False,Twitter for iPhone,279,302,https://t.co/g5kGsSpKP4,https://twitter.com/kylegriffin1/status/1314702185272238080,NA,NA,NA,NA,NA,NA,NA,NA
RepAdamSchiff,29501253,1314567418434519046,"Ambassador, what's missing from your misleading thread is a renunciation of Azerbaijan‘s use of military force to settle the issues around Artsakh.

So, I have questions for you and @RTErdogan.

Do you support a ceasefire and return to negotiations? Or do you want war? https://t.co/gnPUHUrlXn",2020-10-09 14:04:30+00:00,False,1236,571,3413,173,en,False,Twitter Web App,270,293,https://t.co/gnPUHUrlXn,https://twitter.com/serdarkilic9/status/1314267736252571652,NA,NA,NA,NA,NA,NA,NA,NA
RepAdamSchiff,29501253,1313905162092785665,"The Trump Administration intentionally separated children from their parents.

Even took away infants from mothers who were breastfeeding them.

They just didn’t care. Then tried to hide their complicity.

This will forever be a stain on our nation, and all those involved. https://t.co/vaO9TmhO9t",2020-10-07 18:12:56+00:00,False,5521,1398,13692,281,en,False,Twitter for iPhone,274,297,https://t.co/vaO9TmhO9t,https://twitter.com/shearm/status/1313623941165002752,NA,NA,NA,NA,NA,NA,NA,NA
RepAdamSchiff,29501253,1313840803274465283,"In the past year, Erdogan’s Turkey has:
 
☑️ Aided and abetted Azerbaijan’s deadly attacks on Artsakh with foreign fighters
☑️ Endangered our troops in Syria
☑️ Cozied up to Iran 
☑️ Installed Russian S400 missiles
 
What kind of an ally does this? Time to get tough with Turkey.",2020-10-07 13:57:12+00:00,False,2627,1071,7369,493,en,False,Twitter for iPhone,NA,NA,NA,NA,NA,NA,NA,NA,NA,NA,NA,NA
RepAdamSchiff,29501253,1313567451590922241,"America is in crisis. We need a deal to provide relief to families and small businesses.

But Trump just stopped negotiating.

No stimulus checks. No unemployment assistance. Small businesses closing.

Trump claimed to be a great deal maker.

He’s not. Just a great grifter.",2020-10-06 19:51:00+00:00,False,19990,9988,70387,1999,en,False,Twitter for iPhone,NA,NA,NA,NA,NA,NA,NA,NA,NA,NA,NA,NA
RepAdamSchiff,29501253,1313505278407651329,"Trump knew this wasn’t true in February when he told Bob Woodward it’s worse than any flu.

And he knows it’s not true now. 

210,00 are dead and Trump himself was sent to Walter Reed. Most Americans are not so lucky to receive that level of care.

Trump’s incompetence is deadly. https://t.co/HW3U1hJgAc",2020-10-06 15:43:56+00:00,False,2195,640,6773,112,en,False,Twitter Web App,281,304,https://t.co/HW3U1hJgAc,https://twitter.com/RepAdamSchiff/status/1313505278407651329/photo/1,NA,NA,NA,NA,NA,NA,NA,NA
RepAdamSchiff,29501253,1313485529485381632,"This is chilling. 

Two Supreme Court Justices made clear that they want to overturn marriage equality.

America won’t go backwards.

Trump’s effort to stack the court couldn’t be more insidious and the stakes couldn’t be higher.
 
No confirmation before inauguration. https://t.co/413YvAzflK",2020-10-06 14:25:28+00:00,False,4973,833,16193,227,en,False,Twitter Web App,269,292,https://t.co/413YvAzflK,https://twitter.com/scotusreporter/status/1313129839071813633,NA,NA,NA,NA,NA,NA,NA,NA
RepAdamSchiff,29501253,1313176915356909570,"At an event to celebrate a nominee who will dismantle healthcare for millions,

Republicans gathered unmasked. Now, tragically, a dozen are sick.  

Including the President.

As the Bard wrote:

“If this were played upon a stage now, I could condemn it as an improbable fiction.”",2020-10-05 17:59:08+00:00,False,7906,1566,32943,318,en,False,Twitter for iPhone,NA,NA,NA,NA,NA,NA,NA,NA,NA,NA,NA,NA
RepAdamSchiff,29501253,1312763740736102400,"Republican leaders don’t want you to vote, and they’re doing everything they can to make it hard.

They falsely claim that fraud is rampant and that you can’t trust the results.

Which Russia is more than happy to amplify.

The best way to counter this disinformation?
 
Vote. https://t.co/tS66tozupz",2020-10-04 14:37:20+00:00,False,5244,1854,15432,372,en,False,Twitter Media Studio,277,300,https://t.co/tS66tozupz,https://twitter.com/RepAdamSchiff/status/1312763740736102400/video/1,NA,NA,NA,NA,NA,NA,NA,NA
