ScreenName,AuthorID,TweetID,Text,TweetDate,isReply,RetweetCount,ReplyCount,LikeCount,QuoteCount,Language,PossibleSensitive,Source,1stURLStart,1stURLEnd,1stURL,1stURLExp,2ndURLStart,2ndURLEnd,2ndURL,2ndURLExp,3rdURLStart,3rdURLEnd,3rdURL,3rdURLExp
RepAdamSchiff,29501253,1477780593345708037,"Grateful to have a White House standing shoulder-to-shoulder with our democratic ally, Ukraine,

And standing up to Putin.

We must carry the mantle of championing democracy — both at home and abroad. https://t.co/qjDQM70C51",2022-01-02 23:15:23+00:00,False,1085,552,6456,60,en,False,Twitter for iPhone,201,224,https://t.co/qjDQM70C51,https://twitter.com/NatashaBertrand/status/1477761580007833609,NA,NA,NA,NA,NA,NA,NA,NA
RepAdamSchiff,29501253,1477327508970246151,"May 2022 be our best year yet:
 
A year of progress. Of healing and hope.
 
A year spent with loved ones, old and new.
 
A year that we will remember fondly, forever.

Happy New Year, everyone!",2022-01-01 17:15:00+00:00,False,1374,1107,13848,92,en,False,Twitter Web App,NA,NA,NA,NA,NA,NA,NA,NA,NA,NA,NA,NA
RepAdamSchiff,29501253,1477048168307171330,"2021 was defined by remarkable challenges and perseverance.
 
And I end this year with an abundance of gratitude:
 
For the health of my family and friends.
For the communities I serve in Washington. 
And for the promise of a better year ahead.",2021-12-31 22:45:00+00:00,False,830,525,8563,42,en,False,Twitter Web App,NA,NA,NA,NA,NA,NA,NA,NA,NA,NA,NA,NA
RepAdamSchiff,29501253,1474790793927962625,"I want to wish a very Merry Christmas to all those celebrating!

May your day be full of joy, peace, and love.

Stay safe, and have a wonderful holiday.",2021-12-25 17:15:00+00:00,False,1078,889,15779,64,en,False,Twitter Web App,NA,NA,NA,NA,NA,NA,NA,NA,NA,NA,NA,NA
RepAdamSchiff,29501253,1473722859520417805,"Thank you, @POTUS. Extending the pause on student loan payments is a wonderful holiday gift for millions of people.

The only thing better?

Canceling $50,000 of that debt for every borrower. Now, that would be a Christmas miracle!",2021-12-22 18:31:24+00:00,False,3661,1711,26837,272,en,False,Twitter for iPhone,NA,NA,NA,NA,NA,NA,NA,NA,NA,NA,NA,NA
RepAdamSchiff,29501253,1472626549283168261,"Americans elected us to legislate like our future depended on it.

We can’t live up to that obligation by killing action on climate change.

Ending help for children, families, and seniors.

We must find another way to get the job done. 

Too much depends on it.",2021-12-19 17:55:04+00:00,False,2241,1278,12630,138,en,False,Twitter for iPhone,NA,NA,NA,NA,NA,NA,NA,NA,NA,NA,NA,NA
RepAdamSchiff,29501253,1471975311285833729,"There’s a lot we don’t know about the omicron variant.
 
But here’s what we do know about the pandemic:
 
Getting vaccinated and boosted is the best way to stay healthy.
 
It’s free. It’s safe. And it’s the best way to protect you and your family.",2021-12-17 22:47:16+00:00,False,1491,668,8442,69,en,False,Twitter Web App,NA,NA,NA,NA,NA,NA,NA,NA,NA,NA,NA,NA
RepAdamSchiff,29501253,1471496233487253514,".@RonWyden and I call for sanctions against mercenary tech companies enabling human rights abuses.
 
By selling surveillance services to authoritarian regimes, they threaten journalists and dissidents.
 
We must stand up to human rights abusers and those who enable them.",2021-12-16 15:03:35+00:00,False,817,408,3829,31,en,False,Twitter Web App,NA,NA,NA,NA,NA,NA,NA,NA,NA,NA,NA,NA
RepAdamSchiff,29501253,1471149976667500551,"Millions of young people will soon have to begin making student loan payments again.

Payments they cannot afford.

We need to continue the freeze on repayments until the pandemic is over. 

Better yet, we should cancel $50,000 in debt for every student.",2021-12-15 16:07:41+00:00,False,4783,4670,25588,707,en,False,Twitter for iPhone,NA,NA,NA,NA,NA,NA,NA,NA,NA,NA,NA,NA
RepAdamSchiff,29501253,1470968815211237380,"Last week, Mark Meadows informed @January6thCmte he would not cooperate further – abandoning his duty to country.

Tonight, the House voted him in contempt and referred him for criminal prosecution.

We acted with urgency.

The Justice Department must do the same.",2021-12-15 04:07:49+00:00,False,9170,2264,45694,536,en,False,Twitter for iPhone,NA,NA,NA,NA,NA,NA,NA,NA,NA,NA,NA,NA
RepAdamSchiff,29501253,1470930750652493825,"Like so many forms of bigotry, Islamophobia is, tragically, on the rise.

Our Muslim friends and neighbors deserve to feel safe at home and abroad, at school, at work, at worship – everywhere.

Which is why I support a special envoy to root out anti-Muslim hate.",2021-12-15 01:36:34+00:00,False,1295,638,8726,57,en,False,Twitter for iPhone,NA,NA,NA,NA,NA,NA,NA,NA,NA,NA,NA,NA
RepAdamSchiff,29501253,1470815854543589378,"Today, the House holds a moment of silence for the 800,000 lost to COVID-19.
 
If we held one minute for each individual, we'd be silent for a year and a half.
 
Honor their memory by protecting yourself and your loved ones.
 
Please, go get vaccinated (and boosted).",2021-12-14 18:00:00+00:00,False,4385,984,21822,226,en,False,Twitter Web App,NA,NA,NA,NA,NA,NA,NA,NA,NA,NA,NA,NA
RepAdamSchiff,29501253,1470564973764136960,"Republican Members of Congress were texting Mark Meadows before, during, and after the insurrection.

None of this is privileged. All of it is damning. All of it must be exposed. 

And if he refuses to discuss it, he should answer for it.",2021-12-14 01:23:06+00:00,False,11871,2852,49078,556,en,False,Twitter for iPhone,NA,NA,NA,NA,NA,NA,NA,NA,NA,NA,NA,NA
RepAdamSchiff,29501253,1470556382432837637,"Mark Meadows' decision to stonewall the @January6thCmte has forced us to proceed with a contempt referral.
 
A refusal to appear when subpoenaed by Congress will result in potential prosecution and jail time.

No one is above the law.",2021-12-14 00:48:57+00:00,False,5204,1692,30274,261,en,False,Twitter Web App,NA,NA,NA,NA,NA,NA,NA,NA,NA,NA,NA,NA
RepAdamSchiff,29501253,1470046984572706824,"My heart breaks for the communities devastated by these catastrophic tornadoes.

I join millions of individuals across the nation in praying for your swift recovery and for the continued safety of your loved ones.

We are with you.",2021-12-12 15:04:47+00:00,False,607,226,5848,23,en,False,Twitter for iPhone,NA,NA,NA,NA,NA,NA,NA,NA,NA,NA,NA,NA
RepAdamSchiff,29501253,1469738110237958147,"Workers who go on strike to fight for the wages and hours they deserve should never be permanently replaced. Period.

It’s unacceptable for Kellogg’s — or any company — to retaliate and threaten their livelihoods.",2021-12-11 18:37:26+00:00,False,3334,812,16731,145,en,False,Twitter for iPhone,NA,NA,NA,NA,NA,NA,NA,NA,NA,NA,NA,NA
RepAdamSchiff,29501253,1469367107934724098,"A political high court is putting the right to choose in danger.

Playing games with Roe as Republicans desperately seek new ways to control women’s health.

We can’t let them.

Losing the right to choose will place thousands of women at risk.",2021-12-10 18:03:12+00:00,False,2202,781,10436,93,en,False,Twitter for iPhone,NA,NA,NA,NA,NA,NA,NA,NA,NA,NA,NA,NA
RepAdamSchiff,29501253,1469336210388705283,"Yesterday, a Republican said he’d be excited if I would share the facts of Trump’s Russia collusion with him.

I was more than happy to take him up on his offer.

He was less happy when I did. https://t.co/D74zC044at",2021-12-10 16:00:26+00:00,False,4909,1904,22278,348,en,False,Twitter Media Studio,193,216,https://t.co/D74zC044at,https://twitter.com/RepAdamSchiff/status/1469336210388705283/video/1,NA,NA,NA,NA,NA,NA,NA,NA
RepAdamSchiff,29501253,1469062582334115841,"By passing the #ProtectingOurDemocracy Act, the House has delivered an unequivocal message:
 
Our democracy is worth fighting for.
 
Now, the Senate must show the same conviction to root out corruption and end presidential abuses of power.
 
The price of inaction is calamity.",2021-12-09 21:53:08+00:00,False,2595,528,10595,104,en,False,Twitter for iPhone,NA,NA,NA,NA,NA,NA,NA,NA,NA,NA,NA,NA
RepAdamSchiff,29501253,1468987052553347077,"Protecting our democracy must be a whole of government effort.

Because the task before us is much bigger than any one branch, person, or party.

It’s going to take all of us to get the job done.

I’m grateful to the @WhiteHouse for supporting the #ProtectingOurDemocracy Act.",2021-12-09 16:53:00+00:00,False,1073,486,5186,45,en,False,Twitter for iPhone,NA,NA,NA,NA,NA,NA,NA,NA,NA,NA,NA,NA
RepAdamSchiff,29501253,1468921041506426883,"Today, the House will take up the #ProtectingOurDemocracy Act.
 
It will root out corruption, curtail presidential abuses of power, and strengthen our system of checks and balances.
 
Our democracy is in a moment of great peril.
 
Time to do something about it.",2021-12-09 12:30:42+00:00,False,3643,1248,18100,216,en,False,Twitter for iPhone,NA,NA,NA,NA,NA,NA,NA,NA,NA,NA,NA,NA
RepAdamSchiff,29501253,1468698422211399683,"Before I log off, I want to cover how the #ProtectingOurDemocracy Act will strengthen the emoluments clauses of the Constitution. 

@RepRaskin, can I tap you in for this one?",2021-12-08 21:46:05+00:00,True,146,80,837,4,en,False,Twitter Web App,NA,NA,NA,NA,NA,NA,NA,NA,NA,NA,NA,NA
RepAdamSchiff,29501253,1468656627242962949,"Hi folks.
 
I've got some time, so I'll be taking a few minutes to respond to your questions on the Protecting Our Democracy Act.
 
Drop a question below or use #ProtectingOurDemocracy and I'll do my best to answer as many as possible. 👇 https://t.co/SyiNPZ1mjr",2021-12-08 19:00:00+00:00,False,1019,733,3899,56,en,False,Twitter Web App,238,261,https://t.co/SyiNPZ1mjr,https://twitter.com/RepAdamSchiff/status/1468566242160168960,NA,NA,NA,NA,NA,NA,NA,NA
RepAdamSchiff,29501253,1468637373814779910,"The House votes on the #ProtectingOurDemocracy Act tomorrow.

A bill I wrote with @RepCohen, @GerryConnolly, @RepDean, @RepJeffries, @RepTedLieu, @RepKatiePorter, @RepRaskin, @RepMGS, @RepSpeier, @RepSwalwell, &amp; @RepAnnaEshoo.

We're ready to get this done.

Democracy demands it.",2021-12-08 17:43:30+00:00,False,1616,427,6954,80,en,False,Twitter for iPhone,NA,NA,NA,NA,NA,NA,NA,NA,NA,NA,NA,NA
RepAdamSchiff,29501253,1468566242160168960,"The House is set to vote on the #ProtectingOurDemocracy Act - legislation to root out corruption and protect against abuses of power.
 
These reforms will help secure our democracy. And today, I’ll answer your questions on PODA. #AMA, and I’ll bring in some House colleagues too!",2021-12-08 13:00:51+00:00,False,1587,617,7506,74,en,False,Twitter for iPhone,NA,NA,NA,NA,NA,NA,NA,NA,NA,NA,NA,NA
RepAdamSchiff,29501253,1468410463738281986,"Tonight's vote paves the way for increasing the debt limit, so we can pay the bills we’ve already incurred.
 
Playing games with the faith and credit of the U.S. could cost millions of individuals their jobs.
 
That's what's at stake here.

The GOP would do well to remember that.",2021-12-08 02:41:50+00:00,False,1010,524,5748,53,en,False,Twitter for iPhone,NA,NA,NA,NA,NA,NA,NA,NA,NA,NA,NA,NA
RepAdamSchiff,29501253,1468347376205275138,"Today, the @January6thCmte learned that Mark Meadows will not further cooperate.

Why he can discuss Jan 6 in a book, but not with Congress, is inexplicable. His deposition will proceed as planned.

If he fails to appear, he will be subject to criminal contempt.",2021-12-07 22:31:09+00:00,False,7477,3401,42402,550,en,False,Twitter for iPhone,NA,NA,NA,NA,NA,NA,NA,NA,NA,NA,NA,NA
RepAdamSchiff,29501253,1467977468447502345,"As Hanukkah comes to a close, I’m wishing everyone observing in California and beyond a joyful, peaceful evening of celebration.

Enjoy your last round of latkes and sufganiyot — and above all else, the time with family.

Have a wonderful night.",2021-12-06 22:01:16+00:00,False,276,133,3114,11,en,False,Twitter Web App,NA,NA,NA,NA,NA,NA,NA,NA,NA,NA,NA,NA
RepAdamSchiff,29501253,1466869213394522117,"Trump put a target on the backs of two nonpartisan election workers.

Both got death threats. It’s sick. Sadly, I know what it’s like to be threatened because of Trump’s lies.

After Jan 6, people need to wake up to the threat of political violence.

It’s real - and increasing. https://t.co/43d7DYtwOL",2021-12-03 20:37:28+00:00,False,2246,767,6475,103,en,False,Twitter for iPhone,279,302,https://t.co/43d7DYtwOL,https://twitter.com/Reuters/status/1466577357448306690,NA,NA,NA,NA,NA,NA,NA,NA
RepAdamSchiff,29501253,1466537420535439365,"The House just averted a government shutdown.

This continuing resolution will ensure that we uphold our promise to workers, families, veterans, and seniors.

And it will allow us to stay focused on passing critical legislation like expanding child care and improving health care.",2021-12-02 22:39:02+00:00,False,1050,433,7944,43,en,False,Twitter Web App,NA,NA,NA,NA,NA,NA,NA,NA,NA,NA,NA,NA
RepAdamSchiff,29501253,1466201005507420166,"The Jan 6 committee just voted to recommend the House hold Jeffrey Clark in contempt. 
 
Clark has direct knowledge of Trump’s efforts to utilize the DOJ to prevent a peaceful transfer of power.
 
By refusing to appear, he's violating the law. He will be held accountable.",2021-12-02 00:22:15+00:00,False,4233,1653,27579,234,en,False,Twitter Web App,NA,NA,NA,NA,NA,NA,NA,NA,NA,NA,NA,NA
RepAdamSchiff,29501253,1466183210308714499,"It's time to say ""no more"" and mean it.

No more families with empty chairs at their kitchen tables.

No more missed graduations and weddings.

No more broken communities.

No more trauma. No more violence. No more death.

We have the power to break the cycle.

Let's do it.

5/5",2021-12-01 23:11:32+00:00,True,340,148,1941,18,en,False,Twitter Web App,NA,NA,NA,NA,NA,NA,NA,NA,NA,NA,NA,NA
RepAdamSchiff,29501253,1466183209276878848,"Getting these laws through the Senate may seem difficult.

It doesn't have to be. The difficulty is of our own making. And a belief that an archaic rule is more important than our children’s safety.

If we end the filibuster, we can pass these gun safety laws and more.

4/5",2021-12-01 23:11:32+00:00,True,338,59,1775,15,en,False,Twitter Web App,NA,NA,NA,NA,NA,NA,NA,NA,NA,NA,NA,NA
RepAdamSchiff,29501253,1466183208291258370,"Then, we must hold gun manufacturers accountable when they act negligently.

I have a bill that will put an end to the liability shield allowing manufacturers &amp; dealers to get away with murder.

We should give victims their day in court.

(President Biden supports it, too!)

3/5",2021-12-01 23:11:31+00:00,True,254,47,1236,8,en,False,Twitter Web App,NA,NA,NA,NA,NA,NA,NA,NA,NA,NA,NA,NA
RepAdamSchiff,29501253,1466183207116759043,"First, we should enact commonsense measures that already enjoy broad support:

-Universal background checks.
-Closing the ""Charleston"" loophole.
-Banning assault-style weapons.
-Red flag laws to keep guns away from abusers.

These are the bare minimum. Not the end.

2/5",2021-12-01 23:11:31+00:00,True,221,28,1114,7,en,False,Twitter Web App,NA,NA,NA,NA,NA,NA,NA,NA,NA,NA,NA,NA
RepAdamSchiff,29501253,1466183206047301632,"Yesterday, yet another horrific act of violence changed a community forever.

It doesn’t have to be this way. And yet it is.

Because Republicans refuse to act.

We have the power to end the scourge of gun violence.

Here’s how we can start:

1/5",2021-12-01 23:11:31+00:00,False,926,272,4242,43,en,False,Twitter Web App,NA,NA,NA,NA,NA,NA,NA,NA,NA,NA,NA,NA
RepAdamSchiff,29501253,1466146203750604801,"PrEP and PEP are highly effective at preventing HIV.

But too often, these medications are out of reach for those who need them most. 

That's why I just introduced legislation to make these life-saving medications available to all in need.

Because everyone deserves protection. https://t.co/QGal0zuo8B",2021-12-01 20:44:29+00:00,False,251,62,1257,16,en,False,Twitter Web App,280,303,https://t.co/QGal0zuo8B,https://twitter.com/RepAdamSchiff/status/1466146203750604801/photo/1,NA,NA,NA,NA,NA,NA,NA,NA
RepAdamSchiff,29501253,1466103572689473539,"Today, the Supreme Court considered a case that could ultimately overturn Roe.

A “conservative” court would uphold precedent. But a “partisan” court may not — and this may be the most partisan court in history.

We must protect a woman’s right to choose.",2021-12-01 17:55:05+00:00,False,5446,1200,28497,241,en,False,Twitter for iPhone,NA,NA,NA,NA,NA,NA,NA,NA,NA,NA,NA,NA
RepAdamSchiff,29501253,1465806461397835776,"I'm closely monitoring the news out of Oxford, Michigan.

And I am praying for the survivors and victims of this horrific attack.

It's every parent's worst nightmare. And a devastating reality for far too many.

Gun violence is killing our children.",2021-11-30 22:14:28+00:00,False,1279,757,8692,86,en,False,Twitter for iPhone,NA,NA,NA,NA,NA,NA,NA,NA,NA,NA,NA,NA
RepAdamSchiff,29501253,1465742362014060545,"Mark Meadows has a legal and moral obligation to cooperate with our committee.

I’m glad he has now agreed to appear and has already provided documents. 

We will evaluate the extent of his compliance after his testimony. 

We must reveal the full truth of what led to January 6.",2021-11-30 17:59:45+00:00,False,4172,1569,24679,218,en,False,Twitter for iPhone,NA,NA,NA,NA,NA,NA,NA,NA,NA,NA,NA,NA
RepAdamSchiff,29501253,1465082433334743044,"During Hanukkah we celebrate the many miracles in our lives with the ones we love most.

And tonight, millions of families will light the first candle on their menorah and welcome in this special holiday.

So from my family to yours: Hanukkah Sameach!",2021-11-28 22:17:26+00:00,False,548,220,6054,12,en,False,Twitter for iPhone,NA,NA,NA,NA,NA,NA,NA,NA,NA,NA,NA,NA
RepAdamSchiff,29501253,1463982444638453784,"Wishing you all a happy, healthy Thanksgiving.
 
Today, I'm thankful for the everyday things: Meals shared with family. Long hikes under blue skies. The health of loved ones.
 
I hope your day is also filled with blessings and joy.",2021-11-25 21:26:28+00:00,False,670,380,9103,28,en,False,Twitter for iPhone,NA,NA,NA,NA,NA,NA,NA,NA,NA,NA,NA,NA
RepAdamSchiff,29501253,1463651482301976579,"What’s actually in the Build Back Better Act?

🖍 Universal pre-k.
👪 Affordable, quality childcare and paid family leave.
🏘️ Rental and down payment assistance.
🌎 Clean energy investments and climate action.

It will cut your costs and help your family. And it’s just the start.",2021-11-24 23:31:21+00:00,False,1131,449,4334,43,en,False,Twitter for iPhone,NA,NA,NA,NA,NA,NA,NA,NA,NA,NA,NA,NA
RepAdamSchiff,29501253,1463593441250529281,"Our justice system too often fails Black individuals.

But today, truth prevailed and Ahmaud Arbery’s murderers are being held to account.

We know this verdict won’t erase the grief of Ahmaud’s family and friends.

But I pray it will bring comfort to know justice was served.",2021-11-24 19:40:43+00:00,False,1402,467,12071,54,en,False,Twitter for iPhone,NA,NA,NA,NA,NA,NA,NA,NA,NA,NA,NA,NA
RepAdamSchiff,29501253,1461745607211692035,"It's impossible to overstate the magnitude of this moment.

We just passed this generation's New Deal. 

It will help every family. In a big way.

This is a promises made, promises kept moment.

Democrats have delivered for the country. And for the people.",2021-11-19 17:18:05+00:00,False,3395,1046,18999,195,en,False,Twitter for iPhone,NA,NA,NA,NA,NA,NA,NA,NA,NA,NA,NA,NA
RepAdamSchiff,29501253,1461710527319715841,"I just voted YES on President Biden’s Build Back Better agenda:

Establishing universal pre-k.
Lowering prescription drug costs.
Expanding family leave.
Protecting our planet.
Expanding health care. 
Cutting child poverty.

The Senate must act. Without delay.",2021-11-19 14:58:41+00:00,False,3193,695,21566,153,en,False,Twitter Web App,NA,NA,NA,NA,NA,NA,NA,NA,NA,NA,NA,NA
RepAdamSchiff,29501253,1461681008357560325,"Good morning!

It’s a beautiful day for the House to make the biggest investment in the American people since the New Deal.

I’ve had my caffeine. And I’m ready to vote yes. 

Let’s do this.",2021-11-19 13:01:23+00:00,False,3496,1036,33517,147,en,False,Twitter for iPhone,NA,NA,NA,NA,NA,NA,NA,NA,NA,NA,NA,NA
RepAdamSchiff,29501253,1461544489357651977,"If you took the worst orator in the world

Gave him the worst speech in the world

And made him read it for the longest time in the world 

That would be a lot like listening to Kevin McCarthy tonight. 

Except, probably better.",2021-11-19 03:58:55+00:00,False,11505,3142,68642,874,en,False,Twitter for iPhone,NA,NA,NA,NA,NA,NA,NA,NA,NA,NA,NA,NA
RepAdamSchiff,29501253,1461385296059248645,"Building Back Better isn't just a slogan.

It's a promise.

A promise of expanded, affordable health care.
A promise of climate action and green jobs.
A promise of paid leave and child care.

A promise of a brighter future – for everyone.

We must make good on that promise.",2021-11-18 17:26:20+00:00,False,1277,457,6156,65,en,False,Twitter for iPhone,NA,NA,NA,NA,NA,NA,NA,NA,NA,NA,NA,NA
RepAdamSchiff,29501253,1461085091594125319,"Paul Gosar made a video about killing one of our colleagues.

That’s just wrong. But the GOP thinks otherwise.

Hell, they’re more upset about members who voted for a BIPARTISAN infrastructure package.

In any other workplace, he’d be punished or out. 

Should be the same here.",2021-11-17 21:33:26+00:00,False,5663,1582,33663,232,en,False,Twitter for iPhone,NA,NA,NA,NA,NA,NA,NA,NA,NA,NA,NA,NA
RepAdamSchiff,29501253,1461001162732322817,"Two million students go to school without the glasses they need.

How can kids succeed if they can’t see the board at the front of the classroom?

Today @RepJahanaHayes &amp; I introduced a bill to bring no-cost optometry care to students.

Because every child deserves to thrive.",2021-11-17 15:59:55+00:00,False,1818,443,9440,85,en,False,Twitter Web App,NA,NA,NA,NA,NA,NA,NA,NA,NA,NA,NA,NA
RepAdamSchiff,29501253,1460358106240667650,"President Biden just signed the infrastructure deal. 

And let me just say: It’s a big deal.

Roads and bridges, yes. But also clean water, broadband and climate investments.

We need to keep up the momentum, and pass the Build Back Better Act. ASAP.

Nothing less will do.",2021-11-15 21:24:39+00:00,False,3737,782,24767,123,en,False,Twitter Web App,NA,NA,NA,NA,NA,NA,NA,NA,NA,NA,NA,NA
RepAdamSchiff,29501253,1459924515396464644,"If our law is to mean anything, it has to be applied equally.

Steve Bannon’s indictment is a badly needed affirmation of that principle. And Congress’ oversight power.

It sends a clear message to every prospective witness:

Refusal to obey a subpoena is not an option. https://t.co/isPjTflP8v",2021-11-14 16:41:43+00:00,False,1575,1174,8404,107,en,False,Twitter Media Studio,271,294,https://t.co/isPjTflP8v,https://twitter.com/RepAdamSchiff/status/1459924515396464644/video/1,NA,NA,NA,NA,NA,NA,NA,NA
RepAdamSchiff,29501253,1459278425118625794,"A grand jury just indicted Steve Bannon for contempt of Congress.

Let this send a message to all those with knowledge of the attack on our democracy:

The days of defying subpoenas with impunity are over.

We will expose those responsible for Jan 6.

No one is above the law.",2021-11-12 21:54:23+00:00,False,8928,4206,46035,746,en,False,Twitter for iPhone,NA,NA,NA,NA,NA,NA,NA,NA,NA,NA,NA,NA
RepAdamSchiff,29501253,1458826290644099082,"Veterans and service members are the best of us.
 
Their selfless commitment to defending our country deserves nothing less than our utmost respect and gratitude.
 
So on this Veterans Day, let's all join together to thank these brave individuals for their service and sacrifice.",2021-11-11 15:57:46+00:00,False,472,303,2857,22,en,False,Twitter for iPhone,NA,NA,NA,NA,NA,NA,NA,NA,NA,NA,NA,NA
RepAdamSchiff,29501253,1458223540507926529,"After Columbine, the NRA faced a choice: reckon with their role in a massacre or double down.

We know what they chose.
                                          
231 school shootings later, they're running the same play:

No remorse. No accountability. No regard for human life. https://t.co/N700LC3vQq",2021-11-10 00:02:39+00:00,False,2170,804,7260,73,en,False,Twitter for iPhone,280,303,https://t.co/N700LC3vQq,https://twitter.com/NPR/status/1458057008943411200,NA,NA,NA,NA,NA,NA,NA,NA
RepAdamSchiff,29501253,1458123175779315718,"There was a time when making light of murdering a colleague would elicit unified outrage.

But not in McCarthy’s GOP.

In McCarthy’s GOP they want to punish members who voted for infrastructure.

That’s right, infrastructure.

But condoning violence — that’s A-okay.

It’s sick.",2021-11-09 17:23:50+00:00,False,17763,4393,66807,1134,en,False,Twitter for iPhone,NA,NA,NA,NA,NA,NA,NA,NA,NA,NA,NA,NA
RepAdamSchiff,29501253,1457024778393505795,"– Funds to repair crumbling roads &amp; bridges
– Broadband access for students &amp; rural communities
– Green energy infrastructure investments
– And much more

And it's just our first act.

We're committed to passing the Build Back Better agenda to complete the investments in people.",2021-11-06 16:39:12+00:00,True,338,202,2057,11,en,False,Twitter for iPhone,NA,NA,NA,NA,NA,NA,NA,NA,NA,NA,NA,NA
RepAdamSchiff,29501253,1457024777353375750,"This $1 trillion investment in infrastructure will reach all communities, both big and small, creating a stronger economy that lifts up workers and families.

It will mean:

– Clean drinking water for all
– Largest-ever investment in transit
– Two million new good-paying jobs",2021-11-06 16:39:11+00:00,True,347,153,1976,10,en,False,Twitter for iPhone,NA,NA,NA,NA,NA,NA,NA,NA,NA,NA,NA,NA
