ScreenName,AuthorID,TweetID,Text,TweetDate,isReply,RetweetCount,ReplyCount,LikeCount,QuoteCount,Language,PossibleSensitive,Source,1stURLStart,1stURLEnd,1stURL,1stURLExp,2ndURLStart,2ndURLEnd,2ndURL,2ndURLExp,3rdURLStart,3rdURLEnd,3rdURL,3rdURLExp
RepAdamSchiff,29501253,1342952489692250112,"While the President golfs:

Over 10 million people are going to lose unemployment benefits.

States aren’t getting funding to distribute vaccines.

The eviction moratorium will soon expire.

Families are hungry.

Does he know? Does he care?

Get off the golf cart. Sign the bill.",2020-12-26 21:56:39+00:00,False,11862,4964,50110,1149,en,False,Twitter for iPhone,NA,NA,NA,NA,NA,NA,NA,NA,NA,NA,NA,NA
RepAdamSchiff,29501253,1342530979601108992,"To everyone celebrating today, I want to wish you a very Merry Christmas, even if your celebrations look different than usual and you're joining loved ones by Zoom.
 
This has been a long and difficult year, but I hope this holiday brings you and your loved ones peace and joy.",2020-12-25 18:01:43+00:00,False,1601,1793,21509,271,en,False,Twitter for iPhone,NA,NA,NA,NA,NA,NA,NA,NA,NA,NA,NA,NA
RepAdamSchiff,29501253,1342216881223163906,"Black Americans get worse medical care because of the color of their skin.

Even a medical degree couldn't save Dr. Moore from this injustice.

I introduced the Equal Health Care For All Act, because equitable care is a civil right.

It’s time we treated it that way. https://t.co/kKrI0v2XbH",2020-12-24 21:13:36+00:00,False,1667,921,6187,156,en,False,Twitter Web App,268,291,https://t.co/kKrI0v2XbH,https://twitter.com/jeligon/status/1341934275868946438,NA,NA,NA,NA,NA,NA,NA,NA
RepAdamSchiff,29501253,1341918166729932801,"During the Mueller investigation, Trump’s lawyer floated a pardon to Manafort.

Manafort withdrew his cooperation with prosecutors, lied, was convicted, and then Trump praised him for not “ratting.”

Trump’s pardon now completes the corrupt scheme.

Lawless until the bitter end.",2020-12-24 01:26:37+00:00,False,21906,9220,102030,1972,en,False,Twitter for iPhone,NA,NA,NA,NA,NA,NA,NA,NA,NA,NA,NA,NA
RepAdamSchiff,29501253,1341778693249613825,"Listen, Democrats have been fighting for bigger relief checks for months.

All while Trump was missing in action — playing golf, lying about the election, pardoning crooks.

If he’s serious about the checks, he needs to get Republicans out of the way. 

Let’s make this happen.",2020-12-23 16:12:24+00:00,False,8411,10309,43050,1719,en,False,Twitter for iPhone,NA,NA,NA,NA,NA,NA,NA,NA,NA,NA,NA,NA
RepAdamSchiff,29501253,1341545102896820227,"Lie to cover up for the president? You get a pardon.

Corrupt politician who endorsed Trump? You get a pardon.

Murder innocent civilians? You get a pardon.

Elect a corrupt man as president?

You get a corrupt result.",2020-12-23 00:44:11+00:00,False,12152,2395,50145,716,en,False,Twitter for iPhone,NA,NA,NA,NA,NA,NA,NA,NA,NA,NA,NA,NA
RepAdamSchiff,29501253,1341209105101254657,"I voted YES to provide:

$300 per week in supplemental unemployment benefits.

$600 in direct payments to most Americans.

Billions for small businesses, renters and vaccines.

It’s not enough—and should’ve been done months ago—but this deal will help Americans get through this.",2020-12-22 02:29:03+00:00,False,2397,7444,19244,1052,en,False,Twitter for iPhone,NA,NA,NA,NA,NA,NA,NA,NA,NA,NA,NA,NA
RepAdamSchiff,29501253,1340762822402166784,"This week, Republicans objected to giving workers $1,200 checks to pay rent and feed their families.

Why? 

“The deficit.”

They didn’t care about the deficit when they passed $2 trillion in tax cuts for big corporations and millionaires.

The biggest deficit is in their values.",2020-12-20 20:55:41+00:00,False,33527,5354,155342,2399,en,False,Twitter for iPhone,NA,NA,NA,NA,NA,NA,NA,NA,NA,NA,NA,NA
RepAdamSchiff,29501253,1340349770112516096,"Another day, another scandalous betrayal of our national security by this president.

Another dishonest tweet that sounds like it could have been written in the Kremlin.

Another obsequious display towards Putin.

And yet another reason that Trump can’t leave office fast enough. https://t.co/ILNh3KnfbT",2020-12-19 17:34:22+00:00,False,6142,2382,27076,540,en,False,Twitter for iPhone,280,303,https://t.co/ILNh3KnfbT,https://twitter.com/realDonaldTrump/status/1340333618691002368,NA,NA,NA,NA,NA,NA,NA,NA
RepAdamSchiff,29501253,1340103842910752768,"I held a virtual town hall last night with Dr. Armand Dorian of @KeckMedUSC, and I was so moved by what he said:

""It took me 20 years of education to have the honor of saving lives. But you have the ability to save a life by just wearing a mask.""

Trust in science. Wear a mask. https://t.co/fUiFpbvsYr",2020-12-19 01:17:08+00:00,False,1167,285,4948,71,en,False,Twitter Media Studio,280,303,https://t.co/fUiFpbvsYr,https://twitter.com/RepAdamSchiff/status/1340103842910752768/video/1,NA,NA,NA,NA,NA,NA,NA,NA
RepAdamSchiff,29501253,1339979575028305922,"A year ago today, Donald Trump became only the third president in American history to be impeached.

We knew that conviction was an uphill battle, but we also knew the damage he’d do if left in office.

In America, we fight for our democracy. 

Because in America, right matters. https://t.co/tU2rrUCFgS",2020-12-18 17:03:20+00:00,False,5071,3142,26366,769,en,False,Twitter Media Studio,280,303,https://t.co/tU2rrUCFgS,https://twitter.com/RepAdamSchiff/status/1339979575028305922/video/1,NA,NA,NA,NA,NA,NA,NA,NA
RepAdamSchiff,29501253,1339275264199589888,"Eight months ago, Americans got $1200 checks.
 
Since then, Democrats have been fighting to get more.
 
More unemployment help. More for money to pay for food and rent.
 
But Mitch McConnell just kept saying no, no, no.
 
Americans need help, and we must get it to them now.",2020-12-16 18:24:40+00:00,False,5305,1676,25700,502,en,False,Twitter for iPhone,NA,NA,NA,NA,NA,NA,NA,NA,NA,NA,NA,NA
RepAdamSchiff,29501253,1338949319446020096,"That multiple effective vaccines were developed and produced within 1 year is miraculous. 

It's also a testament to science.
 
To decades of vaccine research. To the dedication of scientists and researchers. To the courage of clinical trial volunteers.

We will get through this.",2020-12-15 20:49:28+00:00,False,2089,1324,20022,349,en,False,Twitter for iPhone,NA,NA,NA,NA,NA,NA,NA,NA,NA,NA,NA,NA
RepAdamSchiff,29501253,1338653698818416640,"The electoral college has spoken. Our democracy endures.

Despite rampant misinformation and baseless claims,

We, the people, made our voices heard.

But we have also seen that our democracy is not guaranteed. Every generation must protect and defend it.

And we will.",2020-12-15 01:14:47+00:00,False,4132,1851,29838,412,en,False,Twitter for iPhone,NA,NA,NA,NA,NA,NA,NA,NA,NA,NA,NA,NA
RepAdamSchiff,29501253,1338630539922706432,"Attorney General Bill Barr:

Lied to cover for Trump.

Launched political investigations. 
Subverted justice and the rule of law. 
And violently cracked down on protestors.

So good riddance. 
Now, the work of restoring a credible and independent justice system must begin.",2020-12-14 23:42:45+00:00,False,9429,3687,58105,1301,en,False,Twitter for iPhone,NA,NA,NA,NA,NA,NA,NA,NA,NA,NA,NA,NA
RepAdamSchiff,29501253,1337803436843155459,"The authorization of the first vaccine against COVID is an incredible milestone that will save countless lives.

But this is not time to relax. The virus is spreading at a higher rate than ever before.

Mask. Social distance. Stay healthy and protect others. We can do it. https://t.co/uCl0FsuQS0",2020-12-12 16:56:09+00:00,False,496,395,3029,59,en,False,Twitter for iPhone,273,296,https://t.co/uCl0FsuQS0,https://twitter.com/nytimes/status/1337582860908326912,NA,NA,NA,NA,NA,NA,NA,NA
RepAdamSchiff,29501253,1337596074844798977,"The Texas case was not a close call. At all.

Just an effort to overturn a democratic election dressed up in shabby legal clothing. 

Republicans who supported it compromised their beliefs, ideology, and oaths.

They stand for nothing. Care about nothing.

Except themselves.",2020-12-12 03:12:10+00:00,False,13021,5385,98964,1774,en,False,Twitter for iPhone,NA,NA,NA,NA,NA,NA,NA,NA,NA,NA,NA,NA
RepAdamSchiff,29501253,1337195328190242817,"Hanukkah may look a little different this year, but even if you're lighting the menorah and frying up the first batch of latkes over Zoom, I hope you and your loved ones can find moments of joy and light tonight.
 
From my family to yours, wishing you a Happy Hanukkah!",2020-12-11 00:39:44+00:00,False,592,382,8249,57,en,False,Twitter for iPhone,NA,NA,NA,NA,NA,NA,NA,NA,NA,NA,NA,NA
RepAdamSchiff,29501253,1337168678693945346,"This isn’t a game. Trump lost. End of story.

But he’s still trying to drag down our democracy, invalidate millions of votes, and overturn the election.

And for what? To raise money? To run again?

These members of Congress should be ashamed. History will remember the enablers. https://t.co/5VqzHbEKoA",2020-12-10 22:53:51+00:00,False,6245,14550,30143,2898,en,False,Twitter for iPhone,280,303,https://t.co/5VqzHbEKoA,https://twitter.com/johnkruzel/status/1337135543373733889,NA,NA,NA,NA,NA,NA,NA,NA
RepAdamSchiff,29501253,1336790252963303425,"Demanding governors overturn results.

Coercing state election officials.

Insisting state legislators appoint new electors.
 
Trump lost, and these attacks will not succeed. 
 
But if you believe in democracy, silence is complicity.",2020-12-09 21:50:07+00:00,False,14215,11644,74719,3112,en,False,Twitter for iPhone,NA,NA,NA,NA,NA,NA,NA,NA,NA,NA,NA,NA
RepAdamSchiff,29501253,1336398164018999298,"Biden so far:
 
A economic team focused on helping workers, raising wages, and improving the economy for all.
 
A healthcare team that will trust science and listen to the experts.
 
A national security team that is experienced and ethical.
 
What a difference. In a great way.",2020-12-08 19:52:06+00:00,False,3411,1245,20776,341,en,False,Twitter for iPhone,NA,NA,NA,NA,NA,NA,NA,NA,NA,NA,NA,NA
RepAdamSchiff,29501253,1336362087661101062,"It's been eight long months since the last direct payments for COVID relief were made to Americans.
 
Families and workers are hurting. Cases are rising and the economy is stalling.
 
It's clear Americans need financial support—now.
 
Let's get it done.",2020-12-08 17:28:44+00:00,False,3168,1154,17762,397,en,False,Twitter for iPhone,NA,NA,NA,NA,NA,NA,NA,NA,NA,NA,NA,NA
RepAdamSchiff,29501253,1336098591388151812,"When given the opportunity to purchase additional vaccine doses, Trump passed.
 
And now, fewer Americans will be vaccinated before June.
 
Make no mistake, Trump's incompetence will cost American lives. It already has.
 
So much for America first. https://t.co/fN8Ii64Aif",2020-12-08 00:01:42+00:00,False,10200,2391,34554,1348,en,False,Twitter for iPhone,249,272,https://t.co/fN8Ii64Aif,https://twitter.com/nytimes/status/1336062026515410946,NA,NA,NA,NA,NA,NA,NA,NA
RepAdamSchiff,29501253,1335626187020840961,"The surge in COVID cases in our region is dangerous. Hospitals are becoming overwhelmed, deaths are rising.

A vaccine is coming, but it’s not here yet. We have to stop the spread. Stay home if you can. Wear your mask. Follow public health guidance.

We can do this. We have to.",2020-12-06 16:44:32+00:00,False,2995,1000,17723,263,en,False,Twitter for iPhone,NA,NA,NA,NA,NA,NA,NA,NA,NA,NA,NA,NA
RepAdamSchiff,29501253,1334935846940790791,"I just voted to end federal criminalization of marijuana, and allow expungement of many convictions.

For too long, prosecution of minor marijuana offenses led to disproportionate incarceration of Black and brown communities.

Decriminalization makes our justice system more fair. https://t.co/MPapbN1Tr8",2020-12-04 19:01:22+00:00,False,2587,978,19003,427,en,False,Twitter for iPhone,281,304,https://t.co/MPapbN1Tr8,https://twitter.com/NBCNews/status/1334924404791406595,NA,NA,NA,NA,NA,NA,NA,NA
RepAdamSchiff,29501253,1334885788849467394,"Our economic recovery is stalling, just as we enter winter with record infections and deaths.

We have a responsibility to get the American people the help they need. Now.

The $900 billion Senate compromise is a good starting point. Let’s get it done. https://t.co/Llcfgni5ax",2020-12-04 15:42:27+00:00,False,912,625,4827,102,en,False,Twitter for iPhone,253,276,https://t.co/Llcfgni5ax,https://twitter.com/MSNBC/status/1334854938791469057,NA,NA,NA,NA,NA,NA,NA,NA
RepAdamSchiff,29501253,1334213858710450180,"Each time Trump and his enablers spread baseless conspiracies, they endanger real people.

Civil servants. Nonpartisan appointees. Decent Americans.

People shouldn’t face violence and intimidation for doing their jobs.

All those who don’t speak out are complicit. It must end. https://t.co/qya3dPqzbN",2020-12-02 19:12:27+00:00,False,2045,1088,9634,237,en,False,Twitter for iPhone,279,302,https://t.co/qya3dPqzbN,https://twitter.com/ABC/status/1333885609027514372,NA,NA,NA,NA,NA,NA,NA,NA
RepAdamSchiff,29501253,1334191812223905792,"Trump's presidency began with false claims of voter fraud. Fitting that he'll end his presidency that way too.

His baseless claims may be the last gasps of a sore loser, but they're doing real damage:

The mistrust will be long-lasting. He is poisoning the well of our democracy. https://t.co/gARxMhXV4f",2020-12-02 17:44:50+00:00,False,1590,1170,7864,193,en,False,Twitter Media Studio,281,304,https://t.co/gARxMhXV4f,https://twitter.com/RepAdamSchiff/status/1334191812223905792/video/1,NA,NA,NA,NA,NA,NA,NA,NA
RepAdamSchiff,29501253,1333891380050087938,If you've even lost Bill Barr... it’s time to pack it up.  Voters made an overwhelming statement about who they want to be our next President. (And it wasn't Trump.)  America has important work and serious challenges ahead. It's time to stop paying attention to his sideshow. https://t.co/BsiCjO2ZYr,2020-12-01 21:51:02+00:00,False,1864,753,11779,158,en,False,Twitter for iPhone,276,299,https://t.co/BsiCjO2ZYr,https://twitter.com/ZekeJMiller/status/1333851919316619264,NA,NA,NA,NA,NA,NA,NA,NA
RepAdamSchiff,29501253,1333849897964105728,"In America, and under our Constitution, no one is above the law.

A self-pardon would be a fitting abuse to end Trump’s presidency. 

It would also be corrupt, illegitimate, and void.

We are a nation of laws, not individuals.",2020-12-01 19:06:12+00:00,False,7774,2949,46640,879,en,False,Twitter for iPhone,NA,NA,NA,NA,NA,NA,NA,NA,NA,NA,NA,NA
RepAdamSchiff,29501253,1332777156573741056,"It's a massive failure that Congress hasn't acted to help millions of food insecure Americans.
 
During this pandemic, I've spent time delivering and distributing meals to our neighbors in need. If you're able, consider helping out, too.

But that's not enough. Congress must act. https://t.co/lYej4xCMBx",2020-11-28 20:03:30+00:00,False,2891,1245,14847,383,en,False,Twitter for iPhone,281,304,https://t.co/lYej4xCMBx,https://twitter.com/RepAdamSchiff/status/1332777156573741056/photo/1,281,304,https://t.co/lYej4xCMBx,https://twitter.com/RepAdamSchiff/status/1332777156573741056/photo/1,281,304,https://t.co/lYej4xCMBx,https://twitter.com/RepAdamSchiff/status/1332777156573741056/photo/1
RepAdamSchiff,29501253,1332708190757269504,"Loujain al-Hathloul has endured torture and abuse for over 2 years while detained.
 
The only just outcome would be her immediate, unconditional release. Any restrictions on her ability to travel or communicate would be unacceptable.
 
We stand by her. https://t.co/DFZQSNfDa3",2020-11-28 15:29:27+00:00,False,1180,280,4830,93,en,False,Twitter for iPhone,253,276,https://t.co/DFZQSNfDa3,https://twitter.com/nytimes/status/1331840121885368321,NA,NA,NA,NA,NA,NA,NA,NA
RepAdamSchiff,29501253,1331710650490478593,"Donald Trump has repeatedly abused the pardon power to reward friends and protect those who covered up for him.

This time he pardons Michael Flynn, who lied to hide his dealings with the Russians.

It’s no surprise that Trump would go out as he came in —

Crooked to the end.",2020-11-25 21:25:35+00:00,False,16922,23790,102117,5010,en,False,Twitter for iPhone,NA,NA,NA,NA,NA,NA,NA,NA,NA,NA,NA,NA
RepAdamSchiff,29501253,1331658657344446466,"This Thanksgiving, tens of thousands of Americans are waiting in hours-long lines at local food banks.
 
In a nation as prosperous as ours, the rise in hunger is a terrible policy failure.
 
But the fact McConnell won’t act to help these families? That failure is a moral one.",2020-11-25 17:58:59+00:00,False,5253,1482,21397,666,en,False,Twitter for iPhone,NA,NA,NA,NA,NA,NA,NA,NA,NA,NA,NA,NA
RepAdamSchiff,29501253,1330998058709110788,"The national security team that @JoeBiden announced today is exactly what we need — compassionate, experienced, ethical.

It’s already apparent that the Biden Administration will value expertise and will respect the law, a welcome departure from the past four years.",2020-11-23 22:14:00+00:00,False,4391,1986,32686,430,en,False,Twitter for iPhone,NA,NA,NA,NA,NA,NA,NA,NA,NA,NA,NA,NA
RepAdamSchiff,29501253,1330968740142444546,"Dear @GSAEmily,
 
Your refusal to recognize Biden’s win will do serious long-term harm.
 
To national security, our fight against COVID, and more.
 
Trump’s frivolous lawsuits and baseless conspiracies to overturn the people’s mandate will not succeed.
 
Do your duty. Right now. https://t.co/jQ3RRQMVq7",2020-11-23 20:17:30+00:00,False,5564,9835,27422,2336,en,False,Twitter Web App,280,303,https://t.co/jQ3RRQMVq7,https://twitter.com/RepAdamSchiff/status/1330968740142444546/photo/1,280,303,https://t.co/jQ3RRQMVq7,https://twitter.com/RepAdamSchiff/status/1330968740142444546/photo/1,NA,NA,NA,NA
RepAdamSchiff,29501253,1330552938033459202,"The day after Christmas, 12 million will lose unemployment benefits.
 
On New Year’s Eve, eviction moratoriums, small business relief and more will expire.
 
The House has acted, and is willing to compromise. So is Trump.
 
So far, nothing but a lump of coal from Mitch McConnell.",2020-11-22 16:45:15+00:00,False,7578,1336,25402,950,en,False,Twitter for iPhone,NA,NA,NA,NA,NA,NA,NA,NA,NA,NA,NA,NA
RepAdamSchiff,29501253,1330170424228016130,So no one told you life was gonna be this way... https://t.co/Y900JG9Bi3,2020-11-21 15:25:17+00:00,False,3608,1444,38935,502,en,False,Twitter for iPhone,49,72,https://t.co/Y900JG9Bi3,https://twitter.com/simko_bednarski/status/1329804750280388610,NA,NA,NA,NA,NA,NA,NA,NA
RepAdamSchiff,29501253,1329994279972970497,"During impeachment, Republicans argued that, although Trump may be guilty, the voters should decide.

Well, voters decided. Overwhelmingly.

And now Trump is trying to overturn the will of voters.

Republicans’ new ideology?

Never mind the Constitution. Just do what Trump wants. https://t.co/cixGQVhSys",2020-11-21 03:45:21+00:00,False,8358,2531,33708,1072,en,False,Twitter Media Studio,281,304,https://t.co/cixGQVhSys,https://twitter.com/RepAdamSchiff/status/1329994279972970497/video/1,NA,NA,NA,NA,NA,NA,NA,NA
RepAdamSchiff,29501253,1329610711430017026,"We’re at a crossroads in our fight against coronavirus.

The virus is spreading as rapidly as it was in the spring.

I know it’s tough. But now is the time to make sacrifices so we can save lives.

Mask. Social distance. Limit travel and gatherings.

Stay safe, Californians. https://t.co/ImtDPSFGGk",2020-11-20 02:21:11+00:00,False,569,566,3738,67,en,False,Twitter for iPhone,276,299,https://t.co/ImtDPSFGGk,https://twitter.com/GavinNewsom/status/1329549279967334401,NA,NA,NA,NA,NA,NA,NA,NA
RepAdamSchiff,29501253,1329124421441818626,"Countless public servants have tried to determine how to ethically serve a deeply unethical president.
 
Many have failed, but some have stood up when it mattered.
 
@GSAEmily can still stand up to protect our democracy. Because waiting could cost lives.
 
Do the right thing. https://t.co/gwz5zMjCvR",2020-11-18 18:08:50+00:00,False,1641,722,6859,214,en,False,Twitter for iPhone,277,300,https://t.co/gwz5zMjCvR,https://twitter.com/jeremyherb/status/1329063047944691715,NA,NA,NA,NA,NA,NA,NA,NA
RepAdamSchiff,29501253,1329110778851565574,"Trump only knows how to put his own interests first.
 
He can't understand Chris Krebs or others, like our brave service members, who put duty and service to the country above all else.

Trump doesn't understand patriotism. And he never will. https://t.co/JQFIPc2o8u",2020-11-18 17:14:38+00:00,False,1845,933,8988,191,en,False,Twitter Media Studio,243,266,https://t.co/JQFIPc2o8u,https://twitter.com/RepAdamSchiff/status/1329110778851565574/video/1,NA,NA,NA,NA,NA,NA,NA,NA
RepAdamSchiff,29501253,1328862142846656512,"Director Krebs worked diligently to safeguard our elections from interference and misinformation.

He protected our democracy. And spoke truth to power.

That’s why Trump retaliated and fired him.

It’s pathetic and predictable from a president who views truth as his enemy.",2020-11-18 00:46:38+00:00,False,11740,12804,73067,3013,en,False,Twitter for iPhone,NA,NA,NA,NA,NA,NA,NA,NA,NA,NA,NA,NA
RepAdamSchiff,29501253,1328781614495756289,"Joe Biden can cancel student debt on day 1. He doesn't need to wait for Congress.

And millions of Americans saddled with debt can't wait, either.
 
It's good policy, too — and will stimulate the economy quickly.
 
We need to think big to build a better, fairer economy for all.",2020-11-17 19:26:39+00:00,False,6031,2613,42511,939,en,False,Twitter for iPhone,NA,NA,NA,NA,NA,NA,NA,NA,NA,NA,NA,NA
RepAdamSchiff,29501253,1328712667029180416,"You count every vote. Sometimes you win. Sometimes you lose. It’s the essence of our democracy.

Unless you’re Trump’s GOP.

Then you either win, or cry fraud and try to get legal votes thrown out.

Biden won. The only question now is how much damage Trump will do on his way out. https://t.co/RbOcmh2kBH",2020-11-17 14:52:40+00:00,False,4991,2907,24775,611,en,False,Twitter for iPhone,281,304,https://t.co/RbOcmh2kBH,https://twitter.com/AmyEGardner/status/1328464861454622721,NA,NA,NA,NA,NA,NA,NA,NA
RepAdamSchiff,29501253,1327323497673199617,"Spreading misinformation. Undermining our standing abroad. Delaying critical national security preparedness.
 
Trump seems determined to burn down the house on his way out the door. We must not let him succeed.
 
https://t.co/GPP6Ps1w9l",2020-11-13 18:52:36+00:00,False,2632,2272,10866,451,en,False,Twitter for iPhone,213,236,https://t.co/GPP6Ps1w9l,https://www.usatoday.com/story/opinion/2020/11/13/trump-endgame-puts-national-security-risk-adam-schiff-column/6276508002/,NA,NA,NA,NA,NA,NA,NA,NA
RepAdamSchiff,29501253,1327309079564398593,"Trump always puts his personal interests first. He doesn't care what it means for the country.
 
If he can sabotage the Biden Administration, he'll do it.
 
If he can punish his enemies, he'll do it.
 
If he can stay in power, he'll do it.
 
But he will not succeed. https://t.co/jdxhJ24RYq",2020-11-13 17:55:19+00:00,False,1977,2024,10481,379,en,False,Twitter Media Studio,267,290,https://t.co/jdxhJ24RYq,https://twitter.com/RepAdamSchiff/status/1327309079564398593/video/1,NA,NA,NA,NA,NA,NA,NA,NA
RepAdamSchiff,29501253,1327082436954558464,"A tragic milestone: California now has 1 million cases of COVID-19.

It didn’t have to be this way. But we’re not powerless against this virus.

Be as cautious, if not more, as you were in March. Wear a mask. Limit travel. Social distance.

We can save lives. But we have to act. https://t.co/LlrFOnAcC1",2020-11-13 02:54:43+00:00,False,1122,1057,5369,183,en,False,Twitter for iPhone,280,303,https://t.co/LlrFOnAcC1,https://twitter.com/AP/status/1327040762857598981,NA,NA,NA,NA,NA,NA,NA,NA
RepAdamSchiff,29501253,1326566259446702082,"Imagine if this happened in another country:

A leader refusing to concede, alleging fraud without evidence, resisting a peaceful transition of power.

We would condemn it.

It’s no different here. Trump lost. Biden won. America cherishes her democracy. It’s time we show it.",2020-11-11 16:43:37+00:00,False,19772,6456,106442,2210,en,False,Twitter for iPhone,NA,NA,NA,NA,NA,NA,NA,NA,NA,NA,NA,NA
RepAdamSchiff,29501253,1326229305802825729,"Trump fired the Secretary of Defense by tweet.

He removed a top climate scientist from his post.

And his Attorney General is doing Trump’s bidding, sowing doubt in the election.

There will be more blood-letting before the end, as Trump lashes out. 

But a new day is coming. https://t.co/CTevijLKJY",2020-11-10 18:24:41+00:00,False,2136,1295,10514,257,en,False,Twitter Media Studio,278,301,https://t.co/CTevijLKJY,https://twitter.com/RepAdamSchiff/status/1326229305802825729/video/1,NA,NA,NA,NA,NA,NA,NA,NA
RepAdamSchiff,29501253,1326185580238155781,"Today, Trump is in the Supreme Court trying to dismantle the Affordable Care Act.  
Trump wants to end healthcare for millions — during a pandemic. It’s unconscionable.
 
Access to healthcare is a human right and we will fight not only to protect it, but to make it universal.",2020-11-10 15:30:56+00:00,False,8532,3113,36965,1053,en,False,Twitter for iPhone,NA,NA,NA,NA,NA,NA,NA,NA,NA,NA,NA,NA
RepAdamSchiff,29501253,1325874424378257414,"Some good news to start your week: Pfizer's COVID-19 vaccine may be more than 90% effective.

There’s light at the end of the tunnel, but the virus is still spreading.

As scientists continue to work on a vaccine, we all have to do our part. Wear a mask. Social distance. Be safe. https://t.co/Si1AXphitd",2020-11-09 18:54:30+00:00,False,801,711,6789,111,en,False,Twitter for iPhone,281,304,https://t.co/Si1AXphitd,https://twitter.com/nytimes/status/1325767520092102659,NA,NA,NA,NA,NA,NA,NA,NA
