ScreenName,AuthorID,TweetID,Text,TweetDate,isReply,RetweetCount,ReplyCount,LikeCount,QuoteCount,Language,PossibleSensitive,Source,1stURLStart,1stURLEnd,1stURL,1stURLExp,2ndURLStart,2ndURLEnd,2ndURL,2ndURLExp,3rdURLStart,3rdURLEnd,3rdURL,3rdURLExp
RepAdamSchiff,29501253,1457024775960907779,"Last night, the House passed the bipartisan infrastructure package. It’s on its way to the President’s desk.

There’s no understating the importance of this moment.

This is a historic investment – the first chapter of a new, New Deal, that Democrats are writing for this country.",2021-11-06 16:39:11+00:00,False,1371,522,8679,56,en,False,Twitter for iPhone,NA,NA,NA,NA,NA,NA,NA,NA,NA,NA,NA,NA
RepAdamSchiff,29501253,1456824943010791431,"I just voted yes on the infrastructure package. It will benefit millions of workers and families. 

But unless we invest in our people too, the job is not even half finished.

We can’t stop until we pass the Build Back Better Act.

We need a new, New Deal.",2021-11-06 03:25:07+00:00,False,3791,1016,28082,123,en,False,Twitter for iPhone,NA,NA,NA,NA,NA,NA,NA,NA,NA,NA,NA,NA
RepAdamSchiff,29501253,1456638645402746884,"We’re on the verge of passing bills that will benefit every single person in this country.

So naturally, Republicans are trying to adjourn Congress before that happens.

If they want to sit this out, so be it.

But Democrats showed up to work today. And we’re getting this done.",2021-11-05 15:04:50+00:00,False,3224,1059,16026,183,en,False,Twitter for iPhone,NA,NA,NA,NA,NA,NA,NA,NA,NA,NA,NA,NA
RepAdamSchiff,29501253,1456614918485118983,"Today’s job numbers show our recovery is continuing. 

And once we pass the Build Back Better agenda, we’ll create even more good-paying jobs.

2 million of them.

Jobs in clean energy, IT, infrastructure, and child care.

Jobs that will change lives and bring us into the future.",2021-11-05 13:30:33+00:00,False,858,413,4339,41,en,False,Twitter for iPhone,NA,NA,NA,NA,NA,NA,NA,NA,NA,NA,NA,NA
RepAdamSchiff,29501253,1455990747157737477,"Time for a reality check:
 
Senate Republicans will NEVER vote to protect voting rights.
 
We have to stop waiting for the fever to break. It’s time to end the filibuster and start legislating like our democracy is on the line.
 
Because it is.",2021-11-03 20:10:19+00:00,False,14918,4076,58782,1133,en,False,Twitter for iPhone,NA,NA,NA,NA,NA,NA,NA,NA,NA,NA,NA,NA
RepAdamSchiff,29501253,1455961328359723013,"Domestic terrorism is one of the gravest threats to America.

But we cannot separate that threat from the white supremacist movement that often fuels it.

We must break the cycle of radicalization, and keep America safe — for everyone. https://t.co/8UvK5KLW5V",2021-11-03 18:13:25+00:00,False,801,757,3284,79,en,False,Twitter Media Studio,236,259,https://t.co/8UvK5KLW5V,https://twitter.com/RepAdamSchiff/status/1455961328359723013/video/1,NA,NA,NA,NA,NA,NA,NA,NA
RepAdamSchiff,29501253,1455928214908506112,"Look, I get it. It’s easy to be cynical these days. But we have a lot to be hopeful about.

We’re going to pass a New Deal-level investment in people.

We’re going to put our children and grandchildren on a course for a better future.

We’re going to get this done. We have to.",2021-11-03 16:01:50+00:00,False,2100,2492,13980,275,en,False,Twitter Web App,NA,NA,NA,NA,NA,NA,NA,NA,NA,NA,NA,NA
RepAdamSchiff,29501253,1455629211172053000,"Democrats have been working for years to lower our nation’s unconscionably high prescription drug prices.

Pharma has fought us every step of the way.

And now, we are — at long last — on the precipice of delivering real relief.

This is how you truly Build Back Better.",2021-11-02 20:13:42+00:00,False,1341,561,7440,70,en,False,Twitter for iPhone,NA,NA,NA,NA,NA,NA,NA,NA,NA,NA,NA,NA
RepAdamSchiff,29501253,1455587451825754112,"An election is an election, whether for candidates or ballot measures.

That the FEC would allow foreign money and interference in our elections is utterly incomprehensible. 

It would set a dangerous precedent ripe for abuse.

Americans must decide American elections.",2021-11-02 17:27:46+00:00,False,1287,394,4976,65,en,False,Twitter for iPhone,NA,NA,NA,NA,NA,NA,NA,NA,NA,NA,NA,NA
RepAdamSchiff,29501253,1455567672670830592,"If you've ever had a pet, you know how special the bond is between families and their four legged friends.
 
And how devastating it is when that tie is broken.
 
My Pets Belong with Families Act would end the impossible choice between beloved companions and secure housing.",2021-11-02 16:09:10+00:00,False,2393,747,14969,179,en,False,Twitter Web App,NA,NA,NA,NA,NA,NA,NA,NA,NA,NA,NA,NA
RepAdamSchiff,29501253,1455265774399102979,"The climate crisis is the single most dire threat we face.
 
Now is the time for aggressive action.
 
President Biden just showed the world the U.S. recognizes the urgency of this moment.

And the unimaginable peril that lies ahead should we fail.

Let's get this done.",2021-11-01 20:09:32+00:00,False,1277,1027,7263,114,en,False,Twitter Web App,NA,NA,NA,NA,NA,NA,NA,NA,NA,NA,NA,NA
RepAdamSchiff,29501253,1453868929252798486,"The GOP's flirtation with white supremacy didn't end after January 6.
 
No. It's at the core of their efforts to overturn our democracy.
 
It fuels their media ecosystem. It energizes their base.
 
And unless they cast it out, it will take hold of their party for good. https://t.co/ldTUqMLpwj",2021-10-28 23:38:58+00:00,False,992,784,3390,87,en,False,Twitter for iPhone,270,293,https://t.co/ldTUqMLpwj,https://twitter.com/RepAdamSchiff/status/1453868929252798486/video/1,NA,NA,NA,NA,NA,NA,NA,NA
RepAdamSchiff,29501253,1453369510065487883,"The GOP calls Build Back Better a ""liberal wish list.""

What they’re really saying is they’re against paid family leave and childcare, health care, and climate action.
 
As for me, I don’t view this as a wish list.

It’s a to-do list — and one that needs to get done right now.",2021-10-27 14:34:28+00:00,False,5417,1071,23255,213,en,False,Twitter for iPhone,NA,NA,NA,NA,NA,NA,NA,NA,NA,NA,NA,NA
RepAdamSchiff,29501253,1453090975744659461,"The Facebook Papers are shocking and yet, not surprising.

The industry is built on engagement, which grows with anger and hate.

They have a multi-billion dollar incentive to stay the course.

And with over 35% of the world using their platform -

What could go possibly wrong?",2021-10-26 20:07:40+00:00,False,1437,412,6601,62,en,False,Twitter for iPhone,NA,NA,NA,NA,NA,NA,NA,NA,NA,NA,NA,NA
RepAdamSchiff,29501253,1453031874142646274,"Federal law protects against discrimination in housing, schooling and employment.

Health care, however, remains broadly unprotected.
 
That omission costs lives.
 
Our #EqualHealthCareforAll Act makes health care a civil right, ensuring equitable care for all.",2021-10-26 16:12:49+00:00,False,501,178,2092,10,en,False,Twitter Web App,NA,NA,NA,NA,NA,NA,NA,NA,NA,NA,NA,NA
RepAdamSchiff,29501253,1451350258596859907,"Holding Steve Bannon in criminal contempt was an early test of our democracy’s recovery. 

Now, it is in the hands of the Department of Justice. 

To do justice. https://t.co/isp9KkW121",2021-10-22 00:50:41+00:00,False,2627,1018,12019,213,en,False,Twitter Media Studio,162,185,https://t.co/isp9KkW121,https://twitter.com/RepAdamSchiff/status/1451350258596859907/video/1,NA,NA,NA,NA,NA,NA,NA,NA
RepAdamSchiff,29501253,1451281686822522887,"Today, the House found Steve Bannon in criminal contempt for defying a subpoena.

That charge will now be sent to the Justice Department for prosecution. 

The DOJ should take the matter before the grand jury without delay and bring Bannon to justice.

No one is above the law.",2021-10-21 20:18:12+00:00,False,5734,2064,32573,459,en,False,Twitter for iPhone,NA,NA,NA,NA,NA,NA,NA,NA,NA,NA,NA,NA
RepAdamSchiff,29501253,1450951431993835523,"Today Senate Republicans blocked a bill to expand the right to vote, end partisan gerrymandering, and expose dark money in politics.

They wouldn’t even allow debate.

Why?

Because Republicans know that when people vote — they lose.

It’s as simple as that.",2021-10-20 22:25:53+00:00,False,6822,1798,24185,369,en,False,Twitter for iPhone,NA,NA,NA,NA,NA,NA,NA,NA,NA,NA,NA,NA
RepAdamSchiff,29501253,1450612312407257089,"Steve Bannon was given every opportunity to comply with a lawful subpoena.

He chose instead to make specious claims of executive privilege.

Tonight, we voted to hold him in criminal contempt.

Despite what he and Trump may believe, no one is above the law.",2021-10-19 23:58:21+00:00,False,5976,2474,34051,475,en,False,Twitter Web App,NA,NA,NA,NA,NA,NA,NA,NA,NA,NA,NA,NA
RepAdamSchiff,29501253,1450151766872502272,"General Colin Powell was a man of deep intellect, courage and patriotism, whose life was defined by service to country. 

America will miss him dearly – but his incomparable legacy will live on. 

My prayers are with his family and friends, and those he inspired to service.",2021-10-18 17:28:18+00:00,False,1091,324,9302,38,en,False,Twitter for iPhone,NA,NA,NA,NA,NA,NA,NA,NA,NA,NA,NA,NA
RepAdamSchiff,29501253,1449424463561437194,"This isn’t a “moderate” vs. “progressive” thing.

This is a “survival” vs. “complete and utter catastrophe” thing.

Reconciliation might be our last, best chance to fight climate change through transformative investments.

The next generation looks to us.

We can’t let them down.",2021-10-16 17:18:15+00:00,False,6744,1466,29076,277,en,False,Twitter for iPhone,NA,NA,NA,NA,NA,NA,NA,NA,NA,NA,NA,NA
RepAdamSchiff,29501253,1449167771921788932,"Here’s why this matters:

The Biden Administration has already waived executive privilege on many documents, and allowed top former DOJ officials to testify.

Now Biden supports strong enforcement of lawful subpoenas.

Accountability is back, along with the rule of law. https://t.co/vK5xnflNDW",2021-10-16 00:18:15+00:00,False,997,570,4887,59,en,False,Twitter for iPhone,271,294,https://t.co/vK5xnflNDW,https://twitter.com/kaitlancollins/status/1449143591432069125,NA,NA,NA,NA,NA,NA,NA,NA
RepAdamSchiff,29501253,1449048122118782977,"A minority can use the Electoral College to elect a president who loses the popular vote.

A minority can gerrymander control of the House.

A minority can stop the majority from governing the Senate.

Does that sound like a successful democracy to you?",2021-10-15 16:22:48+00:00,False,13492,4927,52803,1191,en,False,Twitter for iPhone,NA,NA,NA,NA,NA,NA,NA,NA,NA,NA,NA,NA
RepAdamSchiff,29501253,1448708053348540425,"We’ve said it before, and we’ll say it again:

We’re not messing around here.

People with relevant information to our investigation into January 6 must comply with lawful subpoenas.

If they don’t, we will use all the tools at our disposal — including criminal contempt.",2021-10-14 17:51:30+00:00,False,7552,5477,43623,773,en,False,Twitter for iPhone,NA,NA,NA,NA,NA,NA,NA,NA,NA,NA,NA,NA
RepAdamSchiff,29501253,1448659694826835982,"You’ve probably heard a lot about the reconciliation debate.

But chances are you haven’t heard what’s actually IN the bill:

- Paid family medical leave.
- Childcare.
- Lower drug prices.
- Expanded Medicare.
- Climate action.

And so much more.

Enough noise. Let’s get it done.",2021-10-14 14:39:20+00:00,False,7407,1211,23736,320,en,False,Twitter for iPhone,NA,NA,NA,NA,NA,NA,NA,NA,NA,NA,NA,NA
RepAdamSchiff,29501253,1448068098075004929,"Tonight, Democrats voted to avert a default, which would have sent our economy into a tailspin.
 
Republicans instead proved they’re just fine with chaos, even a default – and the harsh consequences to families – if it moves them closer to power.",2021-10-12 23:28:33+00:00,False,2186,705,8796,106,en,False,Twitter for iPhone,NA,NA,NA,NA,NA,NA,NA,NA,NA,NA,NA,NA
RepAdamSchiff,29501253,1447999566301761541,"History will not be kind to today’s Republican Party.

A party whose members endorse sedition.

A party that lionizes insurrectionists.

A party that eagerly blocks progress on everything from climate to health care.

So much for the party of Lincoln.",2021-10-12 18:56:13+00:00,False,5511,2771,23715,510,en,False,Twitter for iPhone,NA,NA,NA,NA,NA,NA,NA,NA,NA,NA,NA,NA
RepAdamSchiff,29501253,1447728813144776707,"Thanks for the shout-out, Mr. Former President.

As for your statement that the attack on the Capitol would never have happened if “the people in charge had done their job”

You do realize that you were in charge on January 6th? Right?

Just checking.",2021-10-12 01:00:21+00:00,False,19573,4059,88096,1391,en,False,Twitter for iPhone,NA,NA,NA,NA,NA,NA,NA,NA,NA,NA,NA,NA
RepAdamSchiff,29501253,1447269383286497286,"It’s a simple question with a simpler answer: Was the 2020 election stolen from Donald Trump?

No. Unequivocally no.

But Republicans are so beholden to their disgraced demagogue that they dare not speak the truth.

They are an authoritarian cult. And a danger to our democracy.",2021-10-10 18:34:44+00:00,False,8868,2953,36351,602,en,False,Twitter for iPhone,NA,NA,NA,NA,NA,NA,NA,NA,NA,NA,NA,NA
RepAdamSchiff,29501253,1446854565857484803,"Proud to join @POTUS yesterday as he signed my bill, the HAVANA Act, into law.

Every day, brave diplomats, intelligence officers, and servicemembers make great sacrifices.

We must care for them as we investigate these troubling incidents and hold those responsible to account. https://t.co/mqcSOYfSeO",2021-10-09 15:06:24+00:00,False,1214,338,7371,42,en,False,Twitter for iPhone,279,302,https://t.co/mqcSOYfSeO,https://twitter.com/RepAdamSchiff/status/1446854565857484803/photo/1,279,302,https://t.co/mqcSOYfSeO,https://twitter.com/RepAdamSchiff/status/1446854565857484803/photo/1,NA,NA,NA,NA
RepAdamSchiff,29501253,1446207086556295173,"The former president is still trying to stonewall subpoenas.

But this time, we have a Justice Department devoted to the rule of law.

This time, lawbreaking witnesses must weigh the prospect of criminal prosecution.

Americans deserve answers. We will make sure they get them. https://t.co/19Ls6aYNhp",2021-10-07 20:13:33+00:00,False,2228,1973,9437,260,en,False,Twitter for iPhone,278,301,https://t.co/19Ls6aYNhp,https://twitter.com/kyledcheney/status/1446161704589697030,NA,NA,NA,NA,NA,NA,NA,NA
RepAdamSchiff,29501253,1446157265531191297,"Donald Trump tried to overturn the 2020 election.

He weaponized our government against the American people. And the worst part? He almost succeeded.

Republican leaders in Congress know all of this.

They just don’t care. And they continue to stand by as his attacks continue.",2021-10-07 16:55:35+00:00,False,5488,2075,20431,392,en,False,Twitter for iPhone,NA,NA,NA,NA,NA,NA,NA,NA,NA,NA,NA,NA
RepAdamSchiff,29501253,1445934694286209027,"A federal judge just affirmed what so many of us already knew:

Texas’s abortion ban is morally wrong — and legally wrong.

This marks important progress in the ongoing effort to protect the right to choose. 

We will not go back. https://t.co/yTLKpRuVCb",2021-10-07 02:11:09+00:00,False,1139,353,6123,58,en,False,Twitter for iPhone,231,254,https://t.co/yTLKpRuVCb,https://twitter.com/ZoeTillman/status/1445912486709010432,NA,NA,NA,NA,NA,NA,NA,NA
RepAdamSchiff,29501253,1445867597400985606,"Four of Donald Trump’s associates have been subpoenaed to testify about January 6.

If they refuse to comply, they can be subject to criminal contempt.

What are they hiding? What are they afraid of?

The truth will come out. We will make certain of that.",2021-10-06 21:44:32+00:00,False,4380,3348,23033,424,en,False,Twitter for iPhone,NA,NA,NA,NA,NA,NA,NA,NA,NA,NA,NA,NA
RepAdamSchiff,29501253,1445517279270031365,They. Tried. To. Kill. You. Mister. Vice. President. https://t.co/K6xsd2oBpr,2021-10-05 22:32:30+00:00,False,9803,3700,44181,841,en,False,Twitter for iPhone,53,76,https://t.co/K6xsd2oBpr,https://twitter.com/washingtonpost/status/1445427096264880130,NA,NA,NA,NA,NA,NA,NA,NA
RepAdamSchiff,29501253,1445142123062431751,"Today, @IATSE members voted to authorize a strike.
  
This is the next chapter in their efforts to secure living wages and better working conditions.
 
It is my hope an agreement can be struck soon, and that this will lead to badly-needed changes for these talented individuals.",2021-10-04 21:41:46+00:00,False,370,107,2356,12,en,False,Twitter for iPhone,NA,NA,NA,NA,NA,NA,NA,NA,NA,NA,NA,NA
RepAdamSchiff,29501253,1445110885136097283,"According to this Facebook whistleblower, shutting down the civic integrity team and turning off election misinformation tools contributed to the Jan 6 insurrection. 

The Select Committee will need to hear from her, and get internal info from Facebook to flesh out their role. https://t.co/b9ZLhf9lMX",2021-10-04 19:37:38+00:00,False,4342,637,14247,177,en,False,Twitter for iPhone,278,301,https://t.co/b9ZLhf9lMX,https://twitter.com/VICE/status/1445036000300969985,NA,NA,NA,NA,NA,NA,NA,NA
RepAdamSchiff,29501253,1443934977322795013,"The death of our democracy begins with deliberate attacks on truth.

The erasure of norms and elimination of checks and balances.

We can’t allow our democracy to falter. We must shore up our institutions against those who would destroy them.

#ProtectingOurDemocracyAct. https://t.co/9SVCs7ea7o",2021-10-01 13:45:00+00:00,False,1191,512,4138,54,en,False,Twitter Web App,272,295,https://t.co/9SVCs7ea7o,https://twitter.com/BostonGlobe/status/1442564729403101185,NA,NA,NA,NA,NA,NA,NA,NA
RepAdamSchiff,29501253,1443738664396369923,"Behind-the-scenes workers are the heart of the entertainment industry.
 
Yet their work often goes unrecognized – and should be fairly compensated.
 
Living wages and humane working conditions must be the standard.
 
We must have dignity and respect for all. https://t.co/5eWtHwwg7i",2021-10-01 00:44:55+00:00,False,384,180,1987,31,en,False,Twitter for iPhone,259,282,https://t.co/5eWtHwwg7i,https://twitter.com/RepAdamSchiff/status/1443738664396369923/photo/1,NA,NA,NA,NA,NA,NA,NA,NA
RepAdamSchiff,29501253,1443598835171971075,"I'm in awe of my colleagues, Cori, Barbara, and Pramila, for sharing their personal stories.

They have shown such courage and strength by speaking out.

Their truths are a powerful statement on why we can't lose an inch in the ongoing fight to protect the right to choose. https://t.co/6CSx3K8IHK",2021-09-30 15:29:17+00:00,False,547,151,3531,9,en,False,Twitter for iPhone,274,297,https://t.co/6CSx3K8IHK,https://twitter.com/RepCori/status/1443582375733051411,NA,NA,NA,NA,NA,NA,NA,NA
RepAdamSchiff,29501253,1443344392098619399,"Democrats will make sure we don’t default on our debt.

GOP leaders in Congress just don’t care. 

They will torpedo our economy if they think it will help them. 

It won’t. It will just harm the American people.

The GOP must never be allowed to govern.

Because they can’t.",2021-09-29 22:38:13+00:00,False,3523,833,13376,161,en,False,Twitter for iPhone,NA,NA,NA,NA,NA,NA,NA,NA,NA,NA,NA,NA
