ScreenName,AuthorID,TweetID,Text,TweetDate,isReply,RetweetCount,ReplyCount,LikeCount,QuoteCount,Language,PossibleSensitive,Source,1stURLStart,1stURLEnd,1stURL,1stURLExp,2ndURLStart,2ndURLEnd,2ndURL,2ndURLExp,3rdURLStart,3rdURLEnd,3rdURL,3rdURLExp
CoryBooker,15808765,1458624258075246594,"For 20 years NJ Senate President Steve Sweeney fought tirelessly for our state’s most vulnerable residents, especially disability and workers rights. Thank you Steve for your distinguished career in public service, improving the lives of all New Jerseyans. https://t.co/mkD2eI40mQ",2021-11-11 02:34:57+00:00,False,41,51,249,2,en,False,Twitter for iPhone,257,280,https://t.co/mkD2eI40mQ,https://newjerseyglobe.com/legislature/statements-on-steve-sweeneys-concession/,NA,NA,NA,NA,NA,NA,NA,NA
CoryBooker,15808765,1458477440012103680,"From Bruce's poetry to the Big Man's solos, Born to Run is a work of art that transcends the lines that divide us.
https://t.co/VwgBJ6tf7P",2021-11-10 16:51:33+00:00,False,40,18,288,5,en,False,Twitter Web App,115,138,https://t.co/VwgBJ6tf7P,https://www.app.com/in-depth/entertainment/music/2021/11/10/bruce-springsteen-born-to-run-1975-album-meaning/8180785002/,NA,NA,NA,NA,NA,NA,NA,NA
CoryBooker,15808765,1458236204017651718,Since joining congress @AOC has worked tirelessly to improve the lives of all Americans. For her own colleagues to spread vitriol and hate instead of engaging on the issues is wrong and amoral. https://t.co/LMt2j9uy2O,2021-11-10 00:52:58+00:00,False,266,115,2412,12,en,False,Twitter for iPhone,194,217,https://t.co/LMt2j9uy2O,https://twitter.com/AOC/status/1457886208563032066,NA,NA,NA,NA,NA,NA,NA,NA
CoryBooker,15808765,1456033660776423436,"Congratulations to my friend and our great Governor @PhilMurphyNJ on winning re-election. You have moved our state forward in the midst of an unprecedented crisis. For New Jersey, and your leadership, our best days are ahead.",2021-11-03 23:00:51+00:00,False,642,209,7270,28,en,False,Twitter for iPhone,NA,NA,NA,NA,NA,NA,NA,NA,NA,NA,NA,NA
CoryBooker,15808765,1455533991134699529,"New Jersey, today is the day! Get out and vote for @PhilMurphyNJ and democrats up and down the ballot. https://t.co/jaDlmrraLG",2021-11-02 13:55:20+00:00,False,494,228,1777,31,en,False,Twitter Web App,103,126,https://t.co/jaDlmrraLG,https://twitter.com/CoryBooker/status/1455533991134699529/video/1,NA,NA,NA,NA,NA,NA,NA,NA
CoryBooker,15808765,1455311188170985472,"In some states and towns across the country, including right here in New Jersey, tomorrow is election day! Make a plan to vote in person or return your ballot: https://t.co/JT8m0Fppyo",2021-11-01 23:10:00+00:00,False,86,36,361,2,en,False,Twitter Web App,160,183,https://t.co/JT8m0Fppyo,http://iwillvote.com,NA,NA,NA,NA,NA,NA,NA,NA
CoryBooker,15808765,1454896018705821699,Because you can see right through them.,2021-10-31 19:40:16+00:00,True,50,96,1512,9,en,False,Twitter for iPhone,NA,NA,NA,NA,NA,NA,NA,NA,NA,NA,NA,NA
CoryBooker,15808765,1454895735527378944,Why can't ghosts lie?,2021-10-31 19:39:08+00:00,False,118,102,1306,36,en,False,Twitter for iPhone,NA,NA,NA,NA,NA,NA,NA,NA,NA,NA,NA,NA
CoryBooker,15808765,1454190540384358400,"Proud to support @JoyceCraigNH for Mayor. As a former Mayor, I'm inspired by her leadership for Manchester. Please join me in supporting her: https://t.co/CIigoWo6EU",2021-10-29 20:56:57+00:00,False,44,31,175,3,en,False,Twitter for iPhone,142,165,https://t.co/CIigoWo6EU,https://secure.actblue.com/donate/cbooker_1029?refcode=cbooker_1029,NA,NA,NA,NA,NA,NA,NA,NA
CoryBooker,15808765,1453489685817438217,"Virginia!! I need you to get out and vote for our incredible candidate for governor, and my friend @TerryMcAuliffe. The stakes are too high for you to sit on the sidelines—VOTE!! https://t.co/O0mObC3v0z",2021-10-27 22:32:00+00:00,False,1891,432,5847,100,en,False,Twitter Media Studio,179,202,https://t.co/O0mObC3v0z,https://twitter.com/CoryBooker/status/1453489685817438217/video/1,NA,NA,NA,NA,NA,NA,NA,NA
CoryBooker,15808765,1453468777866203146,"Don’t miss @AndyKimNJ, @Malinowski and I going where no elected official has gone before, debating the merits of Star Trek and Star Wars.  
https://t.co/tn8mTWwtW6",2021-10-27 21:08:55+00:00,False,27,41,134,3,en,False,Twitter Web App,140,163,https://t.co/tn8mTWwtW6,https://www.facebook.com/NJ.com/videos/419619789662135,NA,NA,NA,NA,NA,NA,NA,NA
CoryBooker,15808765,1453440005544763396,"My former classmate and friend David Pepper's new book shows the stakes of the continued attacks on voting rights in state after state. We must continue the work on this vital issue.

https://t.co/ayYRvphQXy https://t.co/60ON75JLeT",2021-10-27 19:14:35+00:00,False,81,21,218,3,en,False,Twitter Web App,184,207,https://t.co/ayYRvphQXy,http://laboratoriesofautocracy.com,208,231,https://t.co/60ON75JLeT,https://twitter.com/DavidPepper/status/1451538768930934785,NA,NA,NA,NA
CoryBooker,15808765,1452730189830569986,"“Love recognizes no barriers. It jumps hurdles, leaps fences, penetrates walls to arrive at its destination full of hope."" - Maya Angelou...one of my heroes",2021-10-25 20:14:02+00:00,False,237,86,1832,12,en,False,Twitter Web App,NA,NA,NA,NA,NA,NA,NA,NA,NA,NA,NA,NA
CoryBooker,15808765,1452288676713705472,For the first time ever we can vote early in New Jersey! Don't wait—get to the polls today. https://t.co/5skVT2Wi7o,2021-10-24 14:59:37+00:00,False,758,126,2937,24,en,False,Twitter Web App,92,115,https://t.co/5skVT2Wi7o,https://twitter.com/CoryBooker/status/1452288676713705472/video/1,NA,NA,NA,NA,NA,NA,NA,NA
CoryBooker,15808765,1451192773873262604,My friend @Clarke4Senate is a tireless advocate for issues that matter to our community. I'm thrilled she is running for State Senate in NJ LD26! Join me in support her campaign at https://t.co/XoDXDRJtEZ.,2021-10-21 14:24:53+00:00,False,58,24,163,10,en,False,Twitter Web App,181,204,https://t.co/XoDXDRJtEZ,https://tinyurl.com/CoryforChristineClarke,NA,NA,NA,NA,NA,NA,NA,NA
CoryBooker,15808765,1451000162684481540,"Kamala is my friend and sister. She is a woman of staggering brilliance; has an epic work ethic; has deep down, solid rock virtues that guide her life; and she has a love of people that fuel her commitment to service.

Happy birthday @KamalaHarris!! https://t.co/rcPyR4IHN1",2021-10-21 01:39:31+00:00,False,707,201,12428,36,en,False,Twitter for iPhone,250,273,https://t.co/rcPyR4IHN1,https://twitter.com/CoryBooker/status/1451000162684481540/photo/1,NA,NA,NA,NA,NA,NA,NA,NA
CoryBooker,15808765,1450930918458281987,Deeply disappointed that my Republican colleagues opposed legislation to ensure every American’s right to vote is protected. We must continue to do everything we can to stop the ongoing assault on voting rights and ensure our democracy works for the people.https://t.co/cpqicCAgcF,2021-10-20 21:04:22+00:00,False,159,123,789,20,en,False,Twitter for iPhone,257,280,https://t.co/cpqicCAgcF,https://www.nytimes.com/2021/10/20/us/senate-voting-rights-filibuster.html?smid=url-share,NA,NA,NA,NA,NA,NA,NA,NA
CoryBooker,15808765,1450122018658164746,Colin Powell embodied civic grace and a commitment to public service. A history-maker whose accomplishments won’t be soon forgotten.,2021-10-18 15:30:05+00:00,False,229,114,2718,16,en,False,Twitter for iPhone,NA,NA,NA,NA,NA,NA,NA,NA,NA,NA,NA,NA
CoryBooker,15808765,1449457985525276675,"8 years ago today New Jersey put their trust in me and elected me to the Senate. Feeling especially humble and grateful thinking of the supporters, team, and voters who sent me here to work for them.

Representing my fellow New Jerseyans is an incredible privilege and honor. https://t.co/ahdFSy4lDN",2021-10-16 19:31:28+00:00,False,137,131,2446,13,en,False,Twitter for iPhone,276,299,https://t.co/ahdFSy4lDN,https://twitter.com/CoryBooker/status/1449457985525276675/photo/1,NA,NA,NA,NA,NA,NA,NA,NA
CoryBooker,15808765,1448103419261161481,"In New Jersey, the Republican candidate for Governor headlined a “Stop the Steal” rally, paving the way for Trump to undermine our elections. 

This November we must re-elect @PhilMurphyNJ. #NJGovDebate",2021-10-13 01:48:54+00:00,False,295,103,1307,9,en,False,Twitter for iPhone,NA,NA,NA,NA,NA,NA,NA,NA,NA,NA,NA,NA
CoryBooker,15808765,1448093196110684165,"Across the country our democracy is being undermined by Trump and his allies. We need leaders like @PhilMurphyNJ, who is strengthening our democracy by lifting up communities and defending our right to vote. #NJGovDebate",2021-10-13 01:08:16+00:00,False,138,130,680,15,en,False,Twitter for iPhone,NA,NA,NA,NA,NA,NA,NA,NA,NA,NA,NA,NA
CoryBooker,15808765,1448022122559938563,"Ok. I have to admit, this made me crack up. https://t.co/d0NpJI6hza",2021-10-12 20:25:51+00:00,False,920,207,8385,78,en,False,Twitter for iPhone,44,67,https://t.co/d0NpJI6hza,https://twitter.com/PhilMurphyNJ/status/1447598478633357316,NA,NA,NA,NA,NA,NA,NA,NA
CoryBooker,15808765,1447966177662230536,"New Jersey today is the last day to register to vote in our November state and municipal elections! You can register right now, or if you’re already registered send this link to friends and family: https://t.co/DyUbcBohlF",2021-10-12 16:43:33+00:00,False,122,24,272,5,en,False,Twitter for iPhone,198,221,https://t.co/DyUbcBohlF,https://nj.gov/state/elections/voter-registration.shtml,NA,NA,NA,NA,NA,NA,NA,NA
CoryBooker,15808765,1447337903894503426,Take a look at this epic new book by @andreafelliott which tells the gripping and unforgettable story of a homeless girl named Dasani. https://t.co/h6HE25lo0e,2021-10-10 23:07:01+00:00,False,50,19,235,3,en,False,Twitter for iPhone,135,158,https://t.co/h6HE25lo0e,https://www.nytimes.com/2021/09/30/books/review/invisible-child-dasani-andrea-elliott.amp.html,NA,NA,NA,NA,NA,NA,NA,NA
CoryBooker,15808765,1446500099236958208,I have been so fortunate to work closely with @KarenBassLA. She’s a true champion for progress and advocate for justice. She will make an incredible mayor. Join me in supporting her campaign today.  https://t.co/3mAwpA9RXj,2021-10-08 15:37:52+00:00,False,39,19,208,5,en,False,Twitter for iPhone,199,222,https://t.co/3mAwpA9RXj,https://act.myngp.com/Forms/-3258485426439713024,NA,NA,NA,NA,NA,NA,NA,NA
CoryBooker,15808765,1445931807090909188,This is the right decision. These continued attacks on abortion and reproductive freedoms are a blatant violation of human and constitutional rights. https://t.co/qksy5qabk1,2021-10-07 01:59:41+00:00,False,94,62,810,5,en,False,Twitter for iPhone,150,173,https://t.co/qksy5qabk1,https://www.texastribune.org/2021/10/01/texas-abortion-law-blocked/,NA,NA,NA,NA,NA,NA,NA,NA
CoryBooker,15808765,1445544408288423946,Tonight @SheilaOliverNJ showed us how much is at stake in this election. We must re-elect the @PhilMurphyNJ and Oliver team. Together they are delivering everyday for New Jerseyans.,2021-10-06 00:20:18+00:00,False,85,47,441,1,en,False,Twitter for iPhone,NA,NA,NA,NA,NA,NA,NA,NA,NA,NA,NA,NA
CoryBooker,15808765,1445171238880649218,An inspiring leader on and off the track. Congratulations to @BubbaWallace and the entire @23XIRacing team! https://t.co/njNiPdFiZU,2021-10-04 23:37:27+00:00,False,109,30,958,6,en,False,Twitter for iPhone,108,131,https://t.co/njNiPdFiZU,https://twitter.com/NASCAR/status/1445123647086149632,NA,NA,NA,NA,NA,NA,NA,NA
CoryBooker,15808765,1443616891696816132,"If you believe in our mission to spread love, demand justice, and expand opportunity, then join our team before tonight's FEC deadline: https://t.co/M1INJXQHMf",2021-09-30 16:41:02+00:00,False,41,52,195,4,en,False,Twitter Web App,136,159,https://t.co/M1INJXQHMf,https://secure.actblue.com/donate/cab-sep2021-social,NA,NA,NA,NA,NA,NA,NA,NA
CoryBooker,15808765,1443229234172997637,I am so excited about my friend's important and urgent book: https://t.co/DGoLVT7MkG,2021-09-29 15:00:37+00:00,False,28,26,116,1,en,False,Twitter for iPhone,61,84,https://t.co/DGoLVT7MkG,https://twitter.com/jacobhelberg/status/1401956111373287427,NA,NA,NA,NA,NA,NA,NA,NA
CoryBooker,15808765,1442984774730231809,As Republican-led states advance all-out assaults on voting rights — targeting Black and Brown communities — @PhilMurphyNJ is showing true leadership by expanding access to the ballot box. Proud to support his reelection this year. #NJGovDebate,2021-09-28 22:49:14+00:00,False,174,98,956,6,en,False,Twitter for iPhone,NA,NA,NA,NA,NA,NA,NA,NA,NA,NA,NA,NA
CoryBooker,15808765,1442931327884349447,"We must #ActOnClimate—with policy, biz, agriculture, behavior change, all. Project Green Challenge is a great way for students to get educated, inspired, mobilized. Join @TurningGreenOrg &amp; tens of thousands of youth globally. It starts 10/1. Sign up today: https://t.co/yXICnNg4Y8 https://t.co/bzut6mKst8",2021-09-28 19:16:51+00:00,False,80,28,318,2,en,False,Twitter for iPhone,261,284,https://t.co/yXICnNg4Y8,http://projectgreenchallenge.com,285,308,https://t.co/bzut6mKst8,https://twitter.com/TurningGreenOrg/status/1441447347649658880,NA,NA,NA,NA
CoryBooker,15808765,1442497292234227716,"Passing transformative policies is not about partisanship, it's about investing in our future, in communities across the country. https://t.co/SkeCnNfjv3",2021-09-27 14:32:09+00:00,False,112,86,518,15,en,False,Twitter Media Studio,130,153,https://t.co/SkeCnNfjv3,https://twitter.com/CoryBooker/status/1442497292234227716/video/1,NA,NA,NA,NA,NA,NA,NA,NA
CoryBooker,15808765,1441824247500861443,Yesss! Let's get the band back together! You got the drums Schatz. You are indeed a drum major for justice. https://t.co/i7RhzrObbu,2021-09-25 17:57:43+00:00,False,44,40,330,2,en,False,Twitter for iPhone,108,131,https://t.co/i7RhzrObbu,https://twitter.com/brianschatz/status/1441782932104826884,NA,NA,NA,NA,NA,NA,NA,NA
CoryBooker,15808765,1441177557760724993,"I owe so much to college football and team sports, but we must do more to ensure those who are generating billions in revenue benefit from it. Thanks to @voxdotcom for giving me the platform to share my perspective. https://t.co/eYU9STLj7L",2021-09-23 23:08:00+00:00,False,50,29,295,2,en,False,Twitter Web App,216,239,https://t.co/eYU9STLj7L,https://twitter.com/voxdotcom/status/1440738917888577537,NA,NA,NA,NA,NA,NA,NA,NA
CoryBooker,15808765,1441134878657966093,This is a once in a generation shot to invest in the genius of our children. We must rise to this opportunity. https://t.co/D29yNwDB6h,2021-09-23 20:18:24+00:00,False,125,73,735,11,en,False,Twitter Web App,111,134,https://t.co/D29yNwDB6h,https://twitter.com/CoryBooker/status/1441134878657966093/video/1,NA,NA,NA,NA,NA,NA,NA,NA
CoryBooker,15808765,1440289173114548234,So excited that Joe is running for office. He’s an incredible young leader who will serve his community well. https://t.co/MoE4kR6F6P,2021-09-21 12:17:52+00:00,False,138,35,912,7,en,False,Twitter for iPhone,110,133,https://t.co/MoE4kR6F6P,https://twitter.com/JoeVogel_/status/1439959230170206210,NA,NA,NA,NA,NA,NA,NA,NA
CoryBooker,15808765,1440122560344170496,"The treatment of Haitians at our border is unconscionable and goes against the very ideals that should define America.

Everyone who represents the United States government should be treating these people with the respect and dignity they deserve.",2021-09-21 01:15:49+00:00,False,1019,410,5805,76,en,False,Twitter for iPhone,NA,NA,NA,NA,NA,NA,NA,NA,NA,NA,NA,NA
CoryBooker,15808765,1438868424520785922,This makes me so proud and happy. Please watch. https://t.co/1kPEsrPxPz,2021-09-17 14:12:19+00:00,False,128,38,827,8,en,False,Twitter for iPhone,48,71,https://t.co/1kPEsrPxPz,https://twitter.com/CBSEveningNews/status/1438638043716591618,NA,NA,NA,NA,NA,NA,NA,NA
CoryBooker,15808765,1438241405802008588,"This #HispanicHeritageMonth we must commit ourselves to learning and listening about the incredibly rich and diverse history of Hispanics, as well as embracing their cultural contributions.",2021-09-15 20:40:47+00:00,False,63,33,391,5,en,False,Twitter for iPhone,NA,NA,NA,NA,NA,NA,NA,NA,NA,NA,NA,NA
CoryBooker,15808765,1438211774457729032,May all who observe have an easy and meaningful fast this Yom Kippur.,2021-09-15 18:43:02+00:00,False,82,17,1065,2,en,False,Twitter for iPhone,NA,NA,NA,NA,NA,NA,NA,NA,NA,NA,NA,NA
CoryBooker,15808765,1437788804937568264,Today is the day California–vote no! @GavinNewsom is a true leader and a great friend. You can defeat this partisan recall!,2021-09-14 14:42:18+00:00,False,460,185,3091,25,en,False,Twitter for iPhone,NA,NA,NA,NA,NA,NA,NA,NA,NA,NA,NA,NA
CoryBooker,15808765,1437588614662299650,The expanded Child Tax Credit is one of the most transformative policies since FDR. It will cut child poverty rates in half. We can’t go backwards – we must renew the CTC for years to come.,2021-09-14 01:26:49+00:00,False,436,99,3209,24,en,False,Twitter for iPhone,NA,NA,NA,NA,NA,NA,NA,NA,NA,NA,NA,NA
CoryBooker,15808765,1437452779195355137,https://t.co/wX4MtMkGaY,2021-09-13 16:27:03+00:00,False,40,22,623,4,und,False,Twitter for iPhone,0,23,https://t.co/wX4MtMkGaY,https://twitter.com/CoryBooker/status/1437452779195355137/photo/1,0,23,https://t.co/wX4MtMkGaY,https://twitter.com/CoryBooker/status/1437452779195355137/photo/1,0,23,https://t.co/wX4MtMkGaY,https://twitter.com/CoryBooker/status/1437452779195355137/photo/1
CoryBooker,15808765,1436737263606681608,"Let us strive to show the same courage in our compassion; strength in our empathy; grit in generosity and invincibility in our love for one another as those did on that day, who died, who responded, who stood up when they tried to knock our nation down. https://t.co/xj5C1cBWeP",2021-09-11 17:03:51+00:00,False,124,35,878,5,en,False,Twitter for iPhone,254,277,https://t.co/xj5C1cBWeP,https://twitter.com/CoryBooker/status/1436737263606681608/video/1,NA,NA,NA,NA,NA,NA,NA,NA
CoryBooker,15808765,1436663030209728512,"20 years ago we lost mothers and fathers, sisters and brothers, sons and daughters, in a horrific attack on our country.

This September 11th I'm thinking about the families and communities they left behind, and how their memory continues to live on through them.",2021-09-11 12:08:52+00:00,False,134,36,1621,9,en,False,Twitter for iPhone,NA,NA,NA,NA,NA,NA,NA,NA,NA,NA,NA,NA
CoryBooker,15808765,1436367655997423616,"California, democracy is not a spectator sport—vote no on the recall!",2021-09-10 16:35:10+00:00,False,1418,186,9125,50,en,False,Twitter for iPhone,NA,NA,NA,NA,NA,NA,NA,NA,NA,NA,NA,NA
CoryBooker,15808765,1436067104151805952,"Amy, I am in awe of your incredible strength and endless resilience. Blessed to have you as a friend. https://t.co/VLfk7rIpc0",2021-09-09 20:40:53+00:00,False,69,36,1304,4,en,False,Twitter for iPhone,102,125,https://t.co/VLfk7rIpc0,https://twitter.com/amyklobuchar/status/1435932792240676878,NA,NA,NA,NA,NA,NA,NA,NA
CoryBooker,15808765,1435751757485854728,"Our most fundamental right—the right of all Americans to participate in our democracy—is under relentless attack by Republican legislatures across the country. 

The Senate must act to ensure fair access to voting and stop laws like this that threaten it.
https://t.co/JqTGgtkcUK",2021-09-08 23:47:48+00:00,False,131,100,576,13,en,False,Twitter Web App,256,279,https://t.co/JqTGgtkcUK,https://abcnews.go.com/Politics/texas-gov-greg-abbott-signs-gop-backed-voting/story?id=79872587,NA,NA,NA,NA,NA,NA,NA,NA
CoryBooker,15808765,1435595874290348034,"Thank you @JoeBiden for coming to see the destruction in New Jersey fro Ida firsthand. Our state's recovery is only possible with federal, state, and local agencies working together. 
https://t.co/nfe9t0Dt79",2021-09-08 13:28:23+00:00,False,88,33,813,3,en,False,Twitter for iPhone,184,207,https://t.co/nfe9t0Dt79,https://www.nj.com/news/2021/09/were-extremely-grateful-family-tells-biden-as-president-consoles-residents-of-devastated-nj-neighborhood.html,NA,NA,NA,NA,NA,NA,NA,NA
CoryBooker,15808765,1434991231495442434,Shana Tova to all who celebrate! May this new year bring you health and happiness!,2021-09-06 21:25:45+00:00,False,105,36,1476,3,en,False,Twitter for iPhone,NA,NA,NA,NA,NA,NA,NA,NA,NA,NA,NA,NA
CoryBooker,15808765,1434866973821882369,"Every day I am grateful for the generations of dedication and perseverance from workers, unions, and activists to ensure safety and prosperity for all. #LaborDay",2021-09-06 13:11:59+00:00,False,141,43,1534,6,en,False,Twitter for iPhone,NA,NA,NA,NA,NA,NA,NA,NA,NA,NA,NA,NA
CoryBooker,15808765,1433110404033564673,"Texas' abortion ban, which denies women their constitutionally protected rights, is the product of a decades-long effort from right-wing activists to overturn Roe v. Wade.

We must stand up for those freedoms—in the states, in Congress, and in the courts.
https://t.co/v9f4nCnrNZ",2021-09-01 16:52:00+00:00,False,166,123,960,16,en,False,Twitter Web App,256,279,https://t.co/v9f4nCnrNZ,https://www.nbcnews.com/politics/politics-news/texas-abortion-clinics-turning-away-patients-ahead-draconian-new-law-n1278184,NA,NA,NA,NA,NA,NA,NA,NA
CoryBooker,15808765,1431016892056080386,Devastated by the loss of American and Afghan lives in this heinous act of terrorism. I grieve for the U.S. service members we lost and their families. I'm grateful for our service members and diplomats' continued bravery as they carry out this humanitarian evacuation.,2021-08-26 22:13:08+00:00,False,197,116,2001,9,en,False,Twitter Web App,NA,NA,NA,NA,NA,NA,NA,NA,NA,NA,NA,NA
CoryBooker,15808765,1429918796827987968,"Today is a great day to schedule your free, safe and effective COVID-19 vaccine to protect yourself and your loved ones. https://t.co/3T8mfa1EQr",2021-08-23 21:29:42+00:00,False,209,84,1139,10,en,False,Twitter for iPhone,121,144,https://t.co/3T8mfa1EQr,https://www.nj.com/news/2021/08/pfizer-covid-19-vaccine-gets-full-approval-by-fda.html,NA,NA,NA,NA,NA,NA,NA,NA
CoryBooker,15808765,1428458011811536903,Thank you as always to the Capitol Police and our emergency responders. https://t.co/EBaOx3iQoc,2021-08-19 20:45:04+00:00,False,131,74,1236,5,en,False,Twitter Web App,72,95,https://t.co/EBaOx3iQoc,https://www.politico.com/news/2021/08/19/hill-office-buildings-evacuated-bomb-threat-506246,NA,NA,NA,NA,NA,NA,NA,NA
CoryBooker,15808765,1427271416865599488,"Have you received your child tax credit payment? If not, you can confirm eligibility, find information for non-filers, and even estimate your payments here: https://t.co/sZ1IJ8zPFD",2021-08-16 14:09:57+00:00,False,45,47,123,4,en,False,Twitter Web App,157,180,https://t.co/sZ1IJ8zPFD,http://childtaxcredit.gov,NA,NA,NA,NA,NA,NA,NA,NA
CoryBooker,15808765,1426702999821430788,Praying for the people of Haiti as they recover from this devastating earthquake. https://t.co/DRAovICfup,2021-08-15 00:31:16+00:00,False,152,57,1195,10,en,False,Twitter for iPhone,82,105,https://t.co/DRAovICfup,https://www.nytimes.com/live/2021/08/14/world/haiti-earthquake,NA,NA,NA,NA,NA,NA,NA,NA
CoryBooker,15808765,1426200707422638082,"But in order for this progress to continue, we must now make the Child Tax Credit expansion permanent—please join us in calling on lawmakers to get this done.",2021-08-13 15:15:20+00:00,True,33,17,232,1,en,False,Twitter Web App,NA,NA,NA,NA,NA,NA,NA,NA,NA,NA,NA,NA
CoryBooker,15808765,1426200706042716169,And it’s not just families with children that are benefiting from these expanded payments—our entire economy is going to be lifted. https://t.co/6n3ZohuK8K,2021-08-13 15:15:20+00:00,True,26,14,178,3,en,False,Twitter Web App,132,155,https://t.co/6n3ZohuK8K,https://finance.yahoo.com/news/expanded-child-tax-credit-provides-225557198.html,NA,NA,NA,NA,NA,NA,NA,NA
CoryBooker,15808765,1426200704658681856,"Back home in New Jersey, families are now able to pay off burdensome medical bills and debt. 
https://t.co/V9NMBbhVbS",2021-08-13 15:15:20+00:00,True,8,2,25,0,en,False,Twitter Web App,94,117,https://t.co/V9NMBbhVbS,https://pix11.com/news/local-news/new-jersey/nj-senators-push-to-keep-child-tax-credit-going-helping-families/,NA,NA,NA,NA,NA,NA,NA,NA
CoryBooker,15808765,1426200703303884803,"In Alaska, after a long pandemic home with two kids, a single mother will finally have the funds to cover the basic costs of living. 
https://t.co/MveLi2toue",2021-08-13 15:15:19+00:00,True,7,2,27,0,en,False,Twitter Web App,134,157,https://t.co/MveLi2toue,https://www.ktoo.org/2021/08/02/federal-child-tax-credit-expected-to-cut-child-poverty-in-alaska/,NA,NA,NA,NA,NA,NA,NA,NA
CoryBooker,15808765,1426200702033014790,"To get her child to daycare, a New Hampshire mom can finally afford a new car that won’t break down.
https://t.co/CNuLvs60Aj",2021-08-13 15:15:19+00:00,True,5,1,24,1,en,False,Twitter Web App,101,124,https://t.co/CNuLvs60Aj,https://apnews.com/article/joe-biden-business-9aa874d709064440b806f9352215a3f2,NA,NA,NA,NA,NA,NA,NA,NA
CoryBooker,15808765,1426200700694974469,"90% of families will ultimately benefit from the expanded Child Tax Credit—and millions have already started to see its impact. In Virginia, families have been able to purchase clothes for the upcoming school year and pay rent. 
https://t.co/cfVb9ApM6h",2021-08-13 15:15:19+00:00,True,8,5,22,0,en,False,Twitter Web App,229,252,https://t.co/cfVb9ApM6h,https://fredericksburg.com/news/local/fredericksburg-area-residents-say-new-child-tax-credit-is-needed-lifeline/article_db63567e-02ee-5da7-a5d7-eb550718cb98.html,NA,NA,NA,NA,NA,NA,NA,NA
CoryBooker,15808765,1426200697947705344,"The expanded Child Tax Credit is the most transformative policy to come out of Washington since FDR’s time. Starting today, the next round of payments are going directly to American families, and its effects are already being felt across the country → https://t.co/pNNTU7cbZA",2021-08-13 15:15:18+00:00,False,74,52,345,8,en,False,Twitter Web App,252,275,https://t.co/pNNTU7cbZA,https://twitter.com/CoryBooker/status/1426200697947705344/photo/1,NA,NA,NA,NA,NA,NA,NA,NA
