ScreenName,AuthorID,TweetID,Text,TweetDate,isReply,RetweetCount,ReplyCount,LikeCount,QuoteCount,Language,PossibleSensitive,Source,1stURLStart,1stURLEnd,1stURL,1stURLExp,2ndURLStart,2ndURLEnd,2ndURL,2ndURLExp,3rdURLStart,3rdURLEnd,3rdURL,3rdURLExp
CoryBooker,15808765,1425194690236796940,"This landmark infrastructure package will allow New Jersey and our country to modernize our rail and transit systems, fix our crumbling bridges, tunnels and roads, combat climate change, and so much more. Grateful it passed the Senate today. https://t.co/M9O1PfVRyo",2021-08-10 20:37:47+00:00,False,107,133,747,9,en,False,Twitter Web App,242,265,https://t.co/M9O1PfVRyo,https://www.nj.com/politics/2021/08/senate-passes-huge-bipartisan-infrastructure-bill-with-12b-for-nj.html,NA,NA,NA,NA,NA,NA,NA,NA
CoryBooker,15808765,1424871556619116546,We can’t wait any longer to deal with rising wealth inequality in this country. Baby bonds is a powerful tool that can level the playing field and help close this gap while also making significant progress toward closing the racial wealth gap. https://t.co/l0CBqex4Q1,2021-08-09 23:13:46+00:00,False,121,117,623,10,en,False,Twitter Web App,244,267,https://t.co/l0CBqex4Q1,https://newrepublic.com/article/163188/cory-booker-baby-bonds-budget-reconciliation,NA,NA,NA,NA,NA,NA,NA,NA
CoryBooker,15808765,1424178738460303362,"Congratulations to Jessica Springsteen and the entire USA Equestrian Team! #JerseyPride
https://t.co/MoA5SBmGRQ",2021-08-08 01:20:45+00:00,False,94,41,1440,6,en,False,Twitter Web App,88,111,https://t.co/MoA5SBmGRQ,https://www.espn.com/olympics/story/_/id/31979341/jessica-springsteen-us-equestrian-team-win-silver-medal-sweden,NA,NA,NA,NA,NA,NA,NA,NA
CoryBooker,15808765,1424161185402867714,"Congratulations to @athiiing and @GoSydGo for winning more gold in Tokyo! #JerseyPride 
https://t.co/Ct3K16SMhx",2021-08-08 00:11:00+00:00,False,49,16,595,0,en,False,Twitter Web App,88,111,https://t.co/Ct3K16SMhx,https://twitter.com/NBCOlympics/status/1423986024200478726,NA,NA,NA,NA,NA,NA,NA,NA
CoryBooker,15808765,1424080414566756358,"The most impactful thing you can do today is help someone make the live-saving decision to get their free, safe and effective COVID-19 vaccine. These conversations may be hard or uncomfortable, but we must have them to end this pandemic.",2021-08-07 18:50:03+00:00,False,259,111,1619,10,en,False,Twitter for iPhone,NA,NA,NA,NA,NA,NA,NA,NA,NA,NA,NA,NA
CoryBooker,15808765,1423739603345883138,"As we recognize the anniversary of the Voting Rights Act, we see that today—decades after this landmark bill became law—the right to vote for so many across our nation is still at risk. It is on all of us to stand up for our democracy and pass new voting rights legislation. https://t.co/zaHZgH43Zl",2021-08-06 20:15:47+00:00,False,170,127,792,22,en,False,Twitter Web App,275,298,https://t.co/zaHZgH43Zl,https://twitter.com/CAPAction/status/1422628425077084162,NA,NA,NA,NA,NA,NA,NA,NA
CoryBooker,15808765,1423323273715126283,"I am devastated by the sudden passing of my friend Richard Trumka. Throughout his remarkable life and through his leadership at @AFLCIO, Richard has been a powerful voice for working families across our nation. He will be deeply missed by so many. https://t.co/LSE1quhJeS",2021-08-05 16:41:27+00:00,False,101,23,592,3,en,False,Twitter Web App,248,271,https://t.co/LSE1quhJeS,https://twitter.com/MSNBC/status/1423320050610618370,NA,NA,NA,NA,NA,NA,NA,NA
CoryBooker,15808765,1422914794009550850,Happy 6-0 to @BarackObama! I am celebrating you and your historical legacy today. https://t.co/xQzq7F0vrf,2021-08-04 13:38:18+00:00,False,449,140,8891,28,en,False,Twitter Web App,82,105,https://t.co/xQzq7F0vrf,https://twitter.com/CoryBooker/status/1422914794009550850/photo/1,NA,NA,NA,NA,NA,NA,NA,NA
CoryBooker,15808765,1422766153219313665,World Record! @GoSydGo is amazing. Another USA gold brought to you by the Garden State. https://t.co/AbDIkCUUm5,2021-08-04 03:47:39+00:00,False,82,17,841,1,en,False,Twitter for iPhone,88,111,https://t.co/AbDIkCUUm5,https://twitter.com/NBCOlympics/status/1422752356253437955,NA,NA,NA,NA,NA,NA,NA,NA
CoryBooker,15808765,1422724705065259013,Incredible! Congratulations to New Jersey-native @athiiing on her amazing performance. #JerseyPride https://t.co/s1jlowFZJm,2021-08-04 01:02:57+00:00,False,182,32,2164,9,en,False,Twitter Web App,100,123,https://t.co/s1jlowFZJm,https://twitter.com/NBCOlympics/status/1422724392681869315,NA,NA,NA,NA,NA,NA,NA,NA
CoryBooker,15808765,1422704834201980928,"Officers Gunther Hashida and Kyle DeFreytag are heroes who bravely answered the call to protect the Capitol and defend our democracy on January 6th. Praying for them and their loved ones during this difficult time.   
https://t.co/J1JDC02d3g",2021-08-03 23:43:59+00:00,False,139,42,885,8,en,False,Twitter for iPhone,218,241,https://t.co/J1JDC02d3g,https://www.cnn.com/2021/08/02/politics/dc-metropolitan-police-officer-suicide-january-6-capitol-riot/index.html,NA,NA,NA,NA,NA,NA,NA,NA
CoryBooker,15808765,1421089838976143361,"Be Kind

Everyone 
   Is going through 
Something 
   That you know 
Nothing
   About.",2021-07-30 12:46:34+00:00,False,1691,275,12335,131,en,False,Twitter for iPhone,NA,NA,NA,NA,NA,NA,NA,NA,NA,NA,NA,NA
CoryBooker,15808765,1420791733898649600,"Marijuana reform is backed by Americans of all backgrounds, in red states and blue states. We can come together to get this done.",2021-07-29 17:02:01+00:00,False,439,161,4278,34,en,False,Twitter Web App,NA,NA,NA,NA,NA,NA,NA,NA,NA,NA,NA,NA
CoryBooker,15808765,1420018546030039040,"Let's not forget that New Jersey is the state with the highest population per capita in the country... in other words, everyone wants to live here! Happy #NationalNewJerseyDay! #JerseyPride https://t.co/U8ZvA5S84I",2021-07-27 13:49:38+00:00,False,99,112,911,36,en,False,Twitter Web App,190,213,https://t.co/U8ZvA5S84I,https://twitter.com/njdotcom/status/1419988837745451009,NA,NA,NA,NA,NA,NA,NA,NA
CoryBooker,15808765,1419754120936935426,"We have delayed infrastructure investment for too long. We need to act now.
https://t.co/T2nekFoPRS",2021-07-26 20:18:54+00:00,False,87,45,543,7,en,False,Twitter Web App,76,99,https://t.co/T2nekFoPRS,https://www.cnn.com/2021/07/23/politics/infrastructure-extreme-weather-climate-change/index.html,NA,NA,NA,NA,NA,NA,NA,NA
CoryBooker,15808765,1419326675746164746,Emmett Till would have turned 80 today. His life was cut short by white supremacists when he was just 14 years old. Today violence against Black lives remains a national emergency that we must confront by changing our laws—including passing our Emmett Till Anti-Lynching Act.,2021-07-25 16:00:23+00:00,False,866,146,5383,22,en,False,Twitter Web App,NA,NA,NA,NA,NA,NA,NA,NA,NA,NA,NA,NA
CoryBooker,15808765,1418691303928389641,"For the first time ever, the Senate Majority Leader supports a bill to end the federal prohibition of marijuana—this is a big deal. That support will help us build momentum for our bill and make significant progress on the issue. Help us get there. #MarijuanaJustice https://t.co/gH5UHi9tx3",2021-07-23 21:55:39+00:00,False,104,48,556,2,en,False,Twitter Web App,267,290,https://t.co/gH5UHi9tx3,https://twitter.com/CastleMcLaughli/status/1417635213954461697,NA,NA,NA,NA,NA,NA,NA,NA
CoryBooker,15808765,1418690703534739459,The War on Drugs has been a war on people—particularly people of color. Before we move on a bill that will largely benefit industry we must take care of the people most impacted by our failed marijuana policies. This doesn’t have to be an either or proposition. #MarijuanaJustice https://t.co/rPg88bZGHu,2021-07-23 21:53:16+00:00,False,56,27,338,10,en,False,Twitter Web App,280,303,https://t.co/rPg88bZGHu,https://twitter.com/RichardErb13/status/1417853167379877892,NA,NA,NA,NA,NA,NA,NA,NA
CoryBooker,15808765,1418689681387044864,"This is not about headlines, this is about justice. Now that our discussion draft has been released we will work hard to build support for our bill and take feedback from stakeholders, industry, and advocates. #MarijuanaJustice https://t.co/ppyHSiLFCH",2021-07-23 21:49:12+00:00,False,28,12,163,1,en,False,Twitter Web App,228,251,https://t.co/ppyHSiLFCH,https://twitter.com/JohnCol88713480/status/1418001783238979585,NA,NA,NA,NA,NA,NA,NA,NA
CoryBooker,15808765,1418688794790875136,Our bill would create an Opportunity Trust Fund that will fund three grant programs to create opportunity for those harmed by our failed drug war. We must provide resources to small minority-owned marijuana businesses and diversify the market. #MarijuanaJustice https://t.co/YPFI9MElIn,2021-07-23 21:45:41+00:00,False,33,12,138,1,en,False,Twitter Web App,262,285,https://t.co/YPFI9MElIn,https://twitter.com/CPEARCoalition/status/1417178665285267457,NA,NA,NA,NA,NA,NA,NA,NA
CoryBooker,15808765,1418688381001867266,"Our bill would solve the banking issue by descheduling marijuana. Also, our legislation would allow small marijuana businesses with less than $20 million in sales annually to get a 50 percent reduction in their tax rate, via a tax credit. #MarijuanaJustice https://t.co/AqDuWqkf6x",2021-07-23 21:44:02+00:00,False,34,10,217,3,en,False,Twitter Web App,257,280,https://t.co/AqDuWqkf6x,https://twitter.com/redwolfanon/status/1417182819881824267,NA,NA,NA,NA,NA,NA,NA,NA
CoryBooker,15808765,1418688027996704768,We cannot enact marijuana reform without real restorative justice for those most harmed by the drug war. Red states and blue states are leading the way and legalizing marijuana. It is time for the federal government to catch up. #MarijuanaJustice https://t.co/CmCUKFAIWK,2021-07-23 21:42:38+00:00,False,55,12,310,4,en,False,Twitter Web App,247,270,https://t.co/CmCUKFAIWK,https://twitter.com/pangea_observer/status/1417165174604238869,NA,NA,NA,NA,NA,NA,NA,NA
CoryBooker,15808765,1418687460649967620,The cannabis industry must become more diverse and our bill would help achieve that. #MarijuanaJustice,2021-07-23 21:40:23+00:00,True,25,12,218,7,en,False,Twitter Web App,NA,NA,NA,NA,NA,NA,NA,NA,NA,NA,NA,NA
CoryBooker,15808765,1418687458825355265,Restorative justice is a critical component of our bill which would create an Opportunity Trust Fund from tax revenue generated from marijuana sales &amp; reinvest that money in communities most impacted by the failed drug war. #MarijuanaJustice https://t.co/gh4IuEnp3F,2021-07-23 21:40:22+00:00,False,50,27,247,13,en,False,Twitter Web App,246,269,https://t.co/gh4IuEnp3F,https://twitter.com/Black_Action/status/1417161227965394946,NA,NA,NA,NA,NA,NA,NA,NA
CoryBooker,15808765,1418686978565021696,"Our bill would deschedule marijuana, thereby ending the federal prohibition. In other words, our legislation would legalize marijuana at the federal level. #MarijuanaJustice https://t.co/NYfK2cZNCe",2021-07-23 21:38:28+00:00,False,78,13,418,4,en,False,Twitter Web App,174,197,https://t.co/NYfK2cZNCe,https://t.co/NYfK2cZNCe,NA,NA,NA,NA,NA,NA,NA,NA
CoryBooker,15808765,1418686239490838529,"Our bill requires a motion to be filed with the sentencing court by the individual, BOP, attorney for the gov’t, or the court. In the case where an individual is indigent our bill requires counsel be appointed to represent him/her. #MarijuanaJustice https://t.co/KbJVQiqnl6",2021-07-23 21:35:32+00:00,False,18,12,106,0,en,False,Twitter Web App,250,273,https://t.co/KbJVQiqnl6,https://twitter.com/pokerchessman/status/1417151956192317444,NA,NA,NA,NA,NA,NA,NA,NA
CoryBooker,15808765,1418685948351680516,That is not to mention that our bill would take tax revenue generated from the sale of marijuana and reinvest that money into communities most impacted by the War on Drugs. #MarijuanaJustice,2021-07-23 21:34:22+00:00,True,39,11,237,0,en,False,Twitter Web App,NA,NA,NA,NA,NA,NA,NA,NA,NA,NA,NA,NA
CoryBooker,15808765,1418685946975997954,"Our bill would deschedule marijuana, which solves the banking issue. Additionally, our legislation would allow small marijuana producers with less than $20 million in sales annually to get a 50 percent reduction in their tax rate, via a tax credit. #MarijuanaJustice https://t.co/cmU5WWmswb",2021-07-23 21:34:22+00:00,False,72,17,364,7,en,False,Twitter Web App,267,290,https://t.co/cmU5WWmswb,https://twitter.com/B_Funk_/status/1417151624955506693,NA,NA,NA,NA,NA,NA,NA,NA
CoryBooker,15808765,1418685537880350720,We must take tax revenue from marijuana sales &amp; reinvest them into communities most impacted by the War on Drugs—our bill would create an Opportunity Trust Fund that will fund 3 grant programs to create opportunity for those harmed by our failed drug war. #MarijuanaJustice https://t.co/FiOPWQjgQR,2021-07-23 21:32:44+00:00,False,28,16,191,2,en,False,Twitter Web App,278,301,https://t.co/FiOPWQjgQR,https://twitter.com/philasem/status/1417150011683573764,NA,NA,NA,NA,NA,NA,NA,NA
CoryBooker,15808765,1418684931513987073,Red states and blue states across the country are legalizing marijuana. This issue has bipartisan support and we will work to translate that into bipartisan support in Congress. #MarijuanaJustice https://t.co/3WvJvN6aK4,2021-07-23 21:30:20+00:00,False,34,13,228,0,en,False,Twitter Web App,196,219,https://t.co/3WvJvN6aK4,https://twitter.com/dave_schramm/status/1417148147361538050,NA,NA,NA,NA,NA,NA,NA,NA
CoryBooker,15808765,1418684613157953541,Our legislation would create a Cannabis Opportunity Program run by the Small Business Administration which would make loans to assist small businesses in the marijuana industry owned by individuals unfairly impacted by the War on Drugs. #MarijuanaJustice https://t.co/jhIHMQ9xVn,2021-07-23 21:29:04+00:00,False,26,15,155,4,en,False,Twitter Web App,255,278,https://t.co/jhIHMQ9xVn,https://twitter.com/jenmakesthings/status/1417147733480148992,NA,NA,NA,NA,NA,NA,NA,NA
CoryBooker,15808765,1418683485972312066,Our bill would allow people who are in federal prison for a marijuana offense to receive a resentencing. Our bill also allows for federal marijuana crimes to be expunged. These are critical provisions of our bill. #MarijuanaJustice https://t.co/ySEkCCISz3,2021-07-23 21:24:35+00:00,False,89,13,448,6,en,False,Twitter Web App,232,255,https://t.co/ySEkCCISz3,https://twitter.com/CMD_ESQ/status/1417147008922624001,NA,NA,NA,NA,NA,NA,NA,NA
CoryBooker,15808765,1418682952536440836,Now that a discussion draft of our legislation has been released we will start having conversations with the White House to get them behind our proposal. #MarijuanaJustice https://t.co/1wMbkcfhFb,2021-07-23 21:22:28+00:00,False,49,24,228,4,en,False,Twitter Web App,172,195,https://t.co/1wMbkcfhFb,https://twitter.com/beemused55/status/1417152063251828737,NA,NA,NA,NA,NA,NA,NA,NA
CoryBooker,15808765,1418637924795568135,It’s going to take all of us to root out and confront white supremacist hate around this country. I’m grateful for my friend @CoriBush and her leadership and conviction to speak her truth. https://t.co/MH0qHrHGiB,2021-07-23 18:23:32+00:00,False,154,74,917,15,en,False,Twitter for iPhone,189,212,https://t.co/MH0qHrHGiB,https://twitter.com/CoriBush/status/1418222877409742848,NA,NA,NA,NA,NA,NA,NA,NA
CoryBooker,15808765,1418565961020489732,"My friend and colleague @ChrisMurphyCT’s book “The Violence Inside Us” is a powerful read to better understand the gun violence epidemic that plagues this country.
https://t.co/dIF5z8E91h",2021-07-23 13:37:35+00:00,False,81,24,271,2,en,False,Twitter Web App,164,187,https://t.co/dIF5z8E91h,https://www.penguinrandomhouse.com/books/604373/the-violence-inside-us-by-chris-murphy/,NA,NA,NA,NA,NA,NA,NA,NA
