ScreenName,AuthorID,TweetID,Text,TweetDate,isReply,RetweetCount,ReplyCount,LikeCount,QuoteCount,Language,PossibleSensitive,Source,1stURLStart,1stURLEnd,1stURL,1stURLExp,2ndURLStart,2ndURLEnd,2ndURL,2ndURLExp,3rdURLStart,3rdURLEnd,3rdURL,3rdURLExp
CoryBooker,15808765,1384180277300187148,"Scientific study and scrutiny tell us that these vaccines are safe and extremely effective, not only at lowering your risk of getting the virus, but also at preventing severe cases that require hospitalization.",2021-04-19 16:21:09+00:00,True,11,1,104,0,en,False,Twitter Web App,NA,NA,NA,NA,NA,NA,NA,NA,NA,NA,NA,NA
CoryBooker,15808765,1384180276062945291,"For over a year our country and the world have been combatting a global pandemic unprecedented in our lifetimes. We’ve completely changed how we work, play, and celebrate. This week, at long last, every American adult is eligible to receive a vaccine against this deadly virus.",2021-04-19 16:21:09+00:00,False,178,39,1604,8,en,False,Twitter Web App,NA,NA,NA,NA,NA,NA,NA,NA,NA,NA,NA,NA
CoryBooker,15808765,1383152939179642881,"As we close out Black Maternal Health Week I am thinking of all the incredible care workers trying to make a difference right now. We need to recruit more to the maternal health workforce, and give them the tools they need to provide more access and better care. #BMHW21",2021-04-16 20:18:53+00:00,False,97,38,677,0,en,False,Twitter Web App,NA,NA,NA,NA,NA,NA,NA,NA,NA,NA,NA,NA
CoryBooker,15808765,1383088331626573829,"It is an incredible achievement that next week vaccine availability will open to most Americans, but we know that members of vulnerable communities are still trying to get appointments. If you can, please help them get appointments as soon as possible.
https://t.co/l0rLYO8aWX",2021-04-16 16:02:09+00:00,False,42,26,183,2,en,False,Twitter Web App,253,276,https://t.co/l0rLYO8aWX,https://covid19.nj.gov/pages/finder,NA,NA,NA,NA,NA,NA,NA,NA
CoryBooker,15808765,1383053374313086978,"It has been 13 years to the day since the then worst-ever mass shooting at Virginia Tech, and the federal government has not done anything to prevent these tragedies. 

It is far past time for us to act — to do nothing is to be complicit.",2021-04-16 13:43:14+00:00,True,228,87,1629,6,en,False,Twitter Web App,NA,NA,NA,NA,NA,NA,NA,NA,NA,NA,NA,NA
CoryBooker,15808765,1383053240758112258,"I'm devastated by the overnight news of yet another mass shooting in America. These Americans were working the overnight shift at a delivery facility — one of the hardest jobs in America.

My heart breaks for the victims and their families in Indianapolis. https://t.co/1OAmu1sFPg",2021-04-16 13:42:43+00:00,False,215,67,1678,15,en,False,Twitter Web App,257,280,https://t.co/1OAmu1sFPg,https://www.indystar.com/story/news/crime/2021/04/16/fedex-shooting-indianapolis/7249099002/,NA,NA,NA,NA,NA,NA,NA,NA
CoryBooker,15808765,1382845869616140291,Adam Toledo had his hands in the air when an officer shot him point blank in the chest. Adam was just 13 years old—a child. Adam’s family deserves justice. We need to end police violence. https://t.co/YDB0l4rrDo,2021-04-15 23:58:42+00:00,False,859,184,5085,30,en,False,Twitter for iPhone,188,211,https://t.co/YDB0l4rrDo,https://twitter.com/chicagotribune/status/1382779778206470150,NA,NA,NA,NA,NA,NA,NA,NA
CoryBooker,15808765,1382752659082465281,"Black women are 3-4 times more likely to die from pregnancy-related causes than white women, but they aren’t the only affected community. Hispanic, Indigenous, AAPI, Veterans, rural communities — suffer from a lack of maternal care. The #Momnibus addresses these systemic issues.",2021-04-15 17:48:18+00:00,False,282,65,1542,19,en,False,Twitter Web App,NA,NA,NA,NA,NA,NA,NA,NA,NA,NA,NA,NA
CoryBooker,15808765,1382715024708403201,I love this time of year in DC. The cherry blossoms remind me of Newark — the real cherry blossom capital of the US!,2021-04-15 15:18:46+00:00,False,342,279,8044,60,en,False,Twitter Web App,NA,NA,NA,NA,NA,NA,NA,NA,NA,NA,NA,NA
CoryBooker,15808765,1382471865076232199,This interview got very deep very quick. I appreciated the real talk John. I hope folks listen in. @jheil https://t.co/ZBVcawVUGx,2021-04-14 23:12:32+00:00,False,348,96,1726,16,en,False,Twitter for iPhone,106,129,https://t.co/ZBVcawVUGx,https://twitter.com/jheil/status/1382116558848278531,NA,NA,NA,NA,NA,NA,NA,NA
CoryBooker,15808765,1382318829779488777,"Not only do we lead the world in maternal mortality rates, but we have the only rate that is RISING. This crisis is getting worse — not better. We must act now. #BMHW21",2021-04-14 13:04:25+00:00,False,214,72,1784,8,en,False,Twitter Web App,NA,NA,NA,NA,NA,NA,NA,NA,NA,NA,NA,NA
CoryBooker,15808765,1382129563564716037,We know that Black people are more than 3 times as likely to die from pregnancy-related causes. We need to make critical investments for and by these communities to end this crisis. #BMHW21,2021-04-14 00:32:21+00:00,False,198,41,1736,7,en,False,Twitter Web App,NA,NA,NA,NA,NA,NA,NA,NA,NA,NA,NA,NA
CoryBooker,15808765,1382100704807026689,The Congressional Black Caucus Fam’s first visit to the White House in four long years. https://t.co/gXcKnX8tXU,2021-04-13 22:37:40+00:00,False,3365,607,34304,286,en,False,Twitter Web App,88,111,https://t.co/gXcKnX8tXU,https://twitter.com/CoryBooker/status/1382100704807026689/photo/1,NA,NA,NA,NA,NA,NA,NA,NA
CoryBooker,15808765,1382052184620158978,"Ramadan is a season of piety and purification through fasting, service to others, and prayer. Wishing all those who observe, Ramadan Mubarak.",2021-04-13 19:24:52+00:00,False,158,22,1449,4,en,False,Twitter Web App,NA,NA,NA,NA,NA,NA,NA,NA,NA,NA,NA,NA
CoryBooker,15808765,1381781336181067776,America has the highest maternal mortality rate compared to our peer countries. To bring that down we must address the Black Maternal Health Crisis. I am proud to work with @LaurenUnderwood and @AlmaforCongress on the #Momnibus to do just that. #BMHW21,2021-04-13 01:28:37+00:00,False,102,41,1010,4,en,False,Twitter Web App,NA,NA,NA,NA,NA,NA,NA,NA,NA,NA,NA,NA
CoryBooker,15808765,1381768574629523467,Daunte Wright should still be alive. This epidemic of injustice that Black Americans face daily must end. His life mattered. #BlackLivesMatter,2021-04-13 00:37:54+00:00,False,3899,523,26011,119,en,False,Twitter for iPhone,NA,NA,NA,NA,NA,NA,NA,NA,NA,NA,NA,NA
CoryBooker,15808765,1380511815113666562,"In the flush of love’s light
we dare be brave
And suddenly we see
that love costs all we are
and will ever be.
Yet it is only love
which sets us free.
- Maya Angelou",2021-04-09 13:24:00+00:00,False,473,107,4051,23,en,False,Twitter Web App,NA,NA,NA,NA,NA,NA,NA,NA,NA,NA,NA,NA
CoryBooker,15808765,1380221484371689490,I applaud @JoeBiden for taking this important first step to end the gun violence epidemic in this country. Congress must act to protect Americans. https://t.co/z5eqd8NBAG,2021-04-08 18:10:19+00:00,False,220,109,2218,11,en,False,Twitter Web App,147,170,https://t.co/z5eqd8NBAG,https://www.washingtonpost.com/politics/biden-gun-control-actions/2021/04/08/6a4cb1d0-9869-11eb-a6d0-13d207aadb78_story.html,NA,NA,NA,NA,NA,NA,NA,NA
CoryBooker,15808765,1380149753602842625,"As more vaccines continue to become available across our country, please regularly check to see what is available in your community. If you already have a vaccine, reach out to friends and neighbors to see if they need help finding an appointment.",2021-04-08 13:25:17+00:00,False,218,42,1500,9,en,False,Twitter Web App,NA,NA,NA,NA,NA,NA,NA,NA,NA,NA,NA,NA
CoryBooker,15808765,1379099462614843394,Voting rights are under continued attack in states across our country — we must fight back and push for reforms that would increase participation in our democracy. I’m proud to see New Jersey expand access to the ballot box. https://t.co/wvDOezGbSj,2021-04-05 15:51:48+00:00,False,157,84,913,10,en,False,Twitter Web App,225,248,https://t.co/wvDOezGbSj,https://www.nbcnews.com/politics/elections/new-jersey-s-democratic-governor-signs-early-voting-expansion-calls-n1262464,NA,NA,NA,NA,NA,NA,NA,NA
CoryBooker,15808765,1378862700743233542,Congratulations @StanfordWBB – National Champions!! #GoStanford https://t.co/ZnvC1okdOe,2021-04-05 00:11:00+00:00,False,74,32,1053,1,en,False,Twitter for iPhone,64,87,https://t.co/ZnvC1okdOe,https://twitter.com/StanfordWBB/status/1378862487068499968,NA,NA,NA,NA,NA,NA,NA,NA
CoryBooker,15808765,1378818407617945600,"I celebrate the hard work of every athlete who participated in #MarchMadness, especially @StanfordWBB. But we can’t lose sight of the greater struggle for justice for these athletes—the NCAA must change and allow these athletes to share in the profits they helped create.",2021-04-04 21:15:00+00:00,False,77,56,1027,5,en,False,Twitter Web App,NA,NA,NA,NA,NA,NA,NA,NA,NA,NA,NA,NA
CoryBooker,15808765,1378758512881373187,Thinking of Officer Evans and his loved ones today. The entire Capitol community mourns this devastating loss. https://t.co/cQoWCvrSUO,2021-04-04 17:17:00+00:00,False,154,44,1380,6,en,False,Twitter Web App,111,134,https://t.co/cQoWCvrSUO,https://www.usatoday.com/story/news/politics/2021/04/02/staggered-capitol-police-take-another-hit-officer-william-evans-death/7066295002/,NA,NA,NA,NA,NA,NA,NA,NA
CoryBooker,15808765,1378685280299884545,"To all who celebrate, I wish you a joyous and Happy Easter!",2021-04-04 12:26:00+00:00,False,231,124,6006,16,en,False,Twitter Web App,NA,NA,NA,NA,NA,NA,NA,NA,NA,NA,NA,NA
CoryBooker,15808765,1378066214510071808,"I mourn the loss of a Capitol Police Officer today and pray for the recovery of the officer who was injured.

My heart is with their families and the entire US Capitol Police force. Forever grateful for their sacrifice and service. https://t.co/lmkJs0avWK",2021-04-02 19:26:03+00:00,False,408,93,3740,12,en,False,Twitter for iPhone,232,255,https://t.co/lmkJs0avWK,https://apnews.com/article/car-rams-capitol-barricade-add0fea76244f1755344aa856ee64ecd,NA,NA,NA,NA,NA,NA,NA,NA
CoryBooker,15808765,1377745054261989376,"The American Jobs Plan makes the critical investments we need for a 21st Century workforce. From care workers to infrastructure, we need to deliver this funding.",2021-04-01 22:09:52+00:00,False,215,71,1613,8,en,False,Twitter for iPhone,NA,NA,NA,NA,NA,NA,NA,NA,NA,NA,NA,NA
CoryBooker,15808765,1377366311722835971,"Senate Republicans only need to flip one of these seats to take back the majority. If we want more big, bold plans like the American Rescue Plan &amp; the American Jobs plan we need to protect these key Senators: https://t.co/mbfSmmj8Or",2021-03-31 21:04:53+00:00,False,246,80,947,13,en,False,Twitter for iPhone,213,236,https://t.co/mbfSmmj8Or,https://secure.actblue.com/donate/mwh-ccm-rw-mk,NA,NA,NA,NA,NA,NA,NA,NA
CoryBooker,15808765,1376526052923748354,"COVID-19 vaccines are proven to be safe and effective. If you have the opportunity to get vaccinated, please don’t hesitate—the sooner we all get vaccinated the safer our grandparents and our loved ones will be from this deadly virus, and the sooner we can return to normal.",2021-03-29 13:26:00+00:00,False,395,115,3193,26,en,False,Twitter Web App,NA,NA,NA,NA,NA,NA,NA,NA,NA,NA,NA,NA
CoryBooker,15808765,1376299308664774656,"I am forever in awe of my friend @StaceyAbrams. They may try and stop her movement for voting and civil rights—but still she rises. She is the latest in a long line of Georgia heroes to this fight for our democracy, justice and equality for all. #WomensHistoryMonth https://t.co/zYp03I8w7W",2021-03-28 22:25:00+00:00,False,2246,354,25178,106,en,False,Twitter Web App,266,289,https://t.co/zYp03I8w7W,https://twitter.com/CoryBooker/status/1376299308664774656/photo/1,NA,NA,NA,NA,NA,NA,NA,NA
CoryBooker,15808765,1375919556288421890,"Happy Passover to all who celebrate. May this celebration of freedom provide you nourishment and strength, and may the story of Passover remind us of the power of resilience, hope and faith in overcoming the biggest challenges and creating a better tomorrow. Chag Sameach!",2021-03-27 21:16:00+00:00,False,123,46,1289,4,en,False,TweetDeck,NA,NA,NA,NA,NA,NA,NA,NA,NA,NA,NA,NA
CoryBooker,15808765,1375832986046894084,"In Georgia, you can buy a gun with no waiting period, but they want to limit how you distribute water—a basic human need—to someone waiting in line to vote.",2021-03-27 15:32:00+00:00,False,11006,2074,64016,586,en,False,TweetDeck,NA,NA,NA,NA,NA,NA,NA,NA,NA,NA,NA,NA
CoryBooker,15808765,1375807502596575233,We’ve also taken a historic step towards justice by providing more than $5 billion in debt relief &amp; assistance to Black farmers who have faced longstanding discrimination &amp; worse outcomes during the pandemic.,2021-03-27 13:50:44+00:00,True,31,42,265,1,en,False,Twitter Web App,NA,NA,NA,NA,NA,NA,NA,NA,NA,NA,NA,NA
CoryBooker,15808765,1375807274124509186,"We’ve expanded the EITC &amp; Child Tax Credit, food assistance, UI &amp; the child care tax credit—together, we’ll reduce Black poverty by 37% this year. For black children, poverty will be cut 54%.",2021-03-27 13:49:50+00:00,True,44,27,322,6,en,False,Twitter Web App,NA,NA,NA,NA,NA,NA,NA,NA,NA,NA,NA,NA
CoryBooker,15808765,1375807100560015364,"The bill also includes a provision based on my MOMMIES Act to help prevent maternal deaths. It also expands access to health coverage, behavioral health care &amp; funding to get vaccines to all Americans.",2021-03-27 13:49:08+00:00,True,23,5,128,2,en,False,Twitter Web App,NA,NA,NA,NA,NA,NA,NA,NA,NA,NA,NA,NA
CoryBooker,15808765,1375806931877687296,"The pandemic has devastated communities of color and placed a harsh light on existing systemic inequities. To address the health impacts of COVID-19, the bill will send $7.6 billion to community health centers, $3.3 billion for the Indian Health Service, $50 million for Title X. https://t.co/30tQeAqwri",2021-03-27 13:48:28+00:00,False,93,97,512,15,en,False,Twitter Web App,280,303,https://t.co/30tQeAqwri,https://twitter.com/Black_Action/status/1374031563164315650,NA,NA,NA,NA,NA,NA,NA,NA
CoryBooker,15808765,1375806635382353923,"Most Social Security retirement &amp; disability beneficiaries &amp; those who received veterans' benefits in 2020 shouldn't need to take any action to receive payment. As with the first two stimulus payments, the IRS will send new payments the same way benefits are normally paid. https://t.co/rWdxUiGsgn",2021-03-27 13:47:17+00:00,False,49,43,205,4,en,False,Twitter Web App,282,305,https://t.co/rWdxUiGsgn,https://twitter.com/Bettie003/status/1374011534662307845,NA,NA,NA,NA,NA,NA,NA,NA
CoryBooker,15808765,1375806414258589699,"The Rescue Plan will not help you get a date. No Senator suggested a Bumble or Tinder option. 

In all seriousness, based on income you may be eligible for the $1,400 stimulus &amp; expanded EITC. It also makes health care more affordable by expanding subsidies &amp; subsidizing COBRA. https://t.co/LFfPKYO7Dp",2021-03-27 13:46:25+00:00,False,50,38,453,9,en,False,Twitter Web App,287,310,https://t.co/LFfPKYO7Dp,https://twitter.com/chicojimj/status/1374049772244467719,NA,NA,NA,NA,NA,NA,NA,NA
CoryBooker,15808765,1375805144844095498,The rescue plan includes a $10 billion mortgage assistance program to help homeowners in need along with housing counseling assistance &amp; help with utility bills. I’ll keep pushing in Congress for other ways to support housing security &amp; expand homeownership. https://t.co/uj7NiysFld,2021-03-27 13:41:22+00:00,False,42,18,230,1,en,False,Twitter Web App,267,290,https://t.co/uj7NiysFld,https://twitter.com/PierreErnstJus1/status/1374045905981149187,NA,NA,NA,NA,NA,NA,NA,NA
CoryBooker,15808765,1375804370072317952,"The child tax credit expansion should be made permanent, and I’m fighting alongside @SherrodBrown, @MichaelBennet and @ReverendWarnock to make sure that happens. https://t.co/RMb8oV0QtF",2021-03-27 13:38:17+00:00,False,68,15,508,1,en,False,Twitter Web App,162,185,https://t.co/RMb8oV0QtF,https://twitter.com/randompodcaster/status/1374045071184695299,NA,NA,NA,NA,NA,NA,NA,NA
CoryBooker,15808765,1375803687445131268,"I share this concern. The best way to stop variants &amp; end the pandemic is to get everyone vaccinated. The rescue plan provides $20 billion for vaccination efforts, funding for the CDC to track variants of the virus &amp; funding for USDA to track &amp; prevent virus spread in animals. https://t.co/s27BAW3XZk",2021-03-27 13:35:34+00:00,False,58,24,271,2,en,False,Twitter Web App,290,313,https://t.co/s27BAW3XZk,https://t.co/s27BAW3XZk,NA,NA,NA,NA,NA,NA,NA,NA
CoryBooker,15808765,1375802686457708544,"Yes — and we’ve increased the Child Tax Credit for up to $3,600/year per child. Checks will go out as early as July. https://t.co/TNaLJVSHl4",2021-03-27 13:31:36+00:00,False,85,30,598,1,en,False,Twitter Web App,117,140,https://t.co/TNaLJVSHl4,https://twitter.com/michellesplant/status/1374027454348619782,NA,NA,NA,NA,NA,NA,NA,NA
CoryBooker,15808765,1375653450156027915,"Yes
You 
Are

#GardenStateGreat https://t.co/WyovLovtSL",2021-03-27 03:38:35+00:00,False,38,41,585,2,en,False,Twitter for iPhone,32,55,https://t.co/WyovLovtSL,https://twitter.com/StvenGoldstein/status/1375095402979024903,NA,NA,NA,NA,NA,NA,NA,NA
CoryBooker,15808765,1375619284089585669,This is a serious inflection point for the United States of America. This is not just about Georgia. This is about the character and culture of American democracy. https://t.co/ZSeb6oTMcV,2021-03-27 01:22:49+00:00,False,461,134,2556,38,en,False,Twitter Media Studio,164,187,https://t.co/ZSeb6oTMcV,https://twitter.com/CoryBooker/status/1375619284089585669/video/1,NA,NA,NA,NA,NA,NA,NA,NA
CoryBooker,15808765,1375549326290784257,"I've served with many people at many levels of government and EASILY @brianschatz is one of the most impressive people I've ever known in elected office. 

He is also one of my best friends in The Senate. 

If you are able, please support him/contribute. 

I already have. https://t.co/c3XC1chWbi",2021-03-26 20:44:50+00:00,False,399,51,2715,13,en,False,Twitter for iPhone,273,296,https://t.co/c3XC1chWbi,https://twitter.com/brianschatz/status/1375543028430077952,NA,NA,NA,NA,NA,NA,NA,NA
CoryBooker,15808765,1375471022720307206,"Outraged and disgusted. @Cannonfor58 did not deserve this. Georgia does not deserve this. 

We will continue her fight in the Senate to ensure voting rights are protected for all Americans—it’s time to pass the John Lewis Voting Rights Advancement Act and the #ForThePeople Act https://t.co/rr71vlMBHv",2021-03-26 15:33:41+00:00,False,568,146,2220,40,en,False,Twitter Web App,278,301,https://t.co/rr71vlMBHv,https://twitter.com/ABC/status/1375401672202203138,NA,NA,NA,NA,NA,NA,NA,NA
CoryBooker,15808765,1375220138547556357,"This is an affront to our American values, rights, and freedoms. These are not the first lawmakers to pass unapologetically racist and undemocratic legislation—but the Senate must pass the For the People Act and the John Lewis Voting Rights Advancement Act to make them the last. https://t.co/Pi3j0DDbDv",2021-03-25 22:56:46+00:00,False,713,122,3004,27,en,False,Twitter for iPhone,280,303,https://t.co/Pi3j0DDbDv,https://twitter.com/AriBerman/status/1375196933514493960,NA,NA,NA,NA,NA,NA,NA,NA
CoryBooker,15808765,1374849513597370370,We need more leaders like @TammyforIL &amp; @KamalaHarris in the highest levels of our government to ensure Americans get the representation they deserve.,2021-03-24 22:24:02+00:00,True,61,33,499,4,en,False,Twitter Web App,NA,NA,NA,NA,NA,NA,NA,NA,NA,NA,NA,NA
CoryBooker,15808765,1374849512339091457,"Tammy’s comments have been misinterpreted by some but I know where her heart is—when it comes to AAPI representation in our government, we simply can’t be satisfied with the status quo. She is an American hero and one of our communities' strongest fighters in Congress.",2021-03-24 22:24:01+00:00,True,49,21,416,1,en,False,Twitter Web App,NA,NA,NA,NA,NA,NA,NA,NA,NA,NA,NA,NA
CoryBooker,15808765,1374849511479246863,My friend @TammyforIL has spent her career fighting for underrepresented communities—and that includes ensuring we have an inclusive government that represents the views of all Americans. This is something Democrats fight for because we know it makes our democracy stronger.,2021-03-24 22:24:01+00:00,False,81,45,656,4,en,False,Twitter Web App,NA,NA,NA,NA,NA,NA,NA,NA,NA,NA,NA,NA
CoryBooker,15808765,1374823560464769024,I am very excited about @withlovecleo 's book. https://t.co/7PIlDovtGJ,2021-03-24 20:40:54+00:00,False,17,12,92,0,en,False,Twitter for iPhone,47,70,https://t.co/7PIlDovtGJ,https://twitter.com/Variety/status/1372560470465515522,NA,NA,NA,NA,NA,NA,NA,NA
CoryBooker,15808765,1374807449019035653,"We are so close to the end of this global pandemic, but it’s clear we have not taken near enough steps to end the mass shooting epidemic in America.",2021-03-24 19:36:53+00:00,False,661,193,8051,27,en,False,Twitter Web App,NA,NA,NA,NA,NA,NA,NA,NA,NA,NA,NA,NA
CoryBooker,15808765,1374450593922646023,"A return to normalcy cannot mean a return to mass shooting after mass shooting. 

We have the power to stop this.",2021-03-23 19:58:52+00:00,False,2679,754,23699,151,en,False,Twitter Web App,NA,NA,NA,NA,NA,NA,NA,NA,NA,NA,NA,NA
CoryBooker,15808765,1374379353455218700,1 in 3 people in this country living in poverty are children. We need to make the American Rescue Plan's expansion of the child tax credit permanent to lift families and end this national tragedy. https://t.co/10491w2xtN,2021-03-23 15:15:47+00:00,False,158,68,800,7,en,False,Twitter Web App,197,220,https://t.co/10491w2xtN,https://twitter.com/nowthisnews/status/1374205008665788419/video/1,NA,NA,NA,NA,NA,NA,NA,NA
CoryBooker,15808765,1374165070440194050,"A horrific tragedy. My heart is with the community in Boulder and families of the victims of this senseless act of gun violence.

We can - we need to - end this. https://t.co/B9F6OPersv",2021-03-23 01:04:18+00:00,False,405,148,3819,17,en,False,Twitter for iPhone,162,185,https://t.co/B9F6OPersv,https://twitter.com/denverpost/status/1374162794808025093,NA,NA,NA,NA,NA,NA,NA,NA
CoryBooker,15808765,1374059915279491072,Grateful for all of your questions about the #AmericanRescuePlan. I enjoyed answering many of them this afternoon—I’ll return later today to answer a few more.,2021-03-22 18:06:27+00:00,False,36,61,418,1,en,False,Twitter for iPhone,NA,NA,NA,NA,NA,NA,NA,NA,NA,NA,NA,NA
CoryBooker,15808765,1374058626751602689,"Republicans do like it. The American Rescue Plan is supported by the majority of Republicans.

Congressional Republicans don't like that Why?

I can eat an entire large vegan pizza
I can sing all the lyrics to most 80s TV shoes
I can out pun 99 US Senators
But I can't answer that https://t.co/wtZ6Y4oDnf",2021-03-22 18:01:20+00:00,False,71,70,561,8,en,False,Twitter for iPhone,281,304,https://t.co/wtZ6Y4oDnf,https://twitter.com/geraldshaffer17/status/1374055796070318082,NA,NA,NA,NA,NA,NA,NA,NA
CoryBooker,15808765,1374057485758300160,"Virginia was in this situation &amp; voters voted out leaders preventing expansion &amp; hundreds of thousands of people got health coverage; lives were saved; and sick people getting healthy actually ADDED TO the strength of their economy.

Please don't give up working for change in TN. https://t.co/H0l7T6GD32",2021-03-22 17:56:48+00:00,False,85,11,352,5,en,False,Twitter for iPhone,289,312,https://t.co/H0l7T6GD32,https://twitter.com/KarenConsiders/status/1374052127711051779,NA,NA,NA,NA,NA,NA,NA,NA
CoryBooker,15808765,1374056549379870723,Agree! Now let’s make the expanded CTC &amp; EITC permanent. https://t.co/oDc9qM3v5D,2021-03-22 17:53:04+00:00,False,72,13,500,3,en,False,Twitter for iPhone,61,84,https://t.co/oDc9qM3v5D,https://twitter.com/ThirdWayKessler/status/1374005023215132672,NA,NA,NA,NA,NA,NA,NA,NA
CoryBooker,15808765,1374055660489428993,"Yes, I would concede that the @backstreetboys have a higher level of awesomeness than me.

As for opening my mouth: AWESOME SAUCE is vegan (non GMO, Organic, Cruelty Free, Gluten Free, Locally Sourced, with no MSG) so I am hoping to up my awesome game in 2021 by consuming a lot. https://t.co/CEtOt6t1TH",2021-03-22 17:49:32+00:00,False,20,25,215,7,en,False,Twitter for iPhone,280,303,https://t.co/CEtOt6t1TH,https://twitter.com/bastiennevdzb/status/1374053368251957249,NA,NA,NA,NA,NA,NA,NA,NA
CoryBooker,15808765,1374053901910093834,"So so much more would get done that the MAJORITY of Americans - Republican, Democratic and Independents - agree with: 

From a minimum wage increase to common sense universal gun background checks to giving DREAMERS a pathway to full citizenship. https://t.co/E6hhaa67MC",2021-03-22 17:42:33+00:00,False,72,34,351,1,en,False,Twitter for iPhone,247,270,https://t.co/E6hhaa67MC,https://twitter.com/JackPeter124/status/1374053042123898884,NA,NA,NA,NA,NA,NA,NA,NA
CoryBooker,15808765,1374053092770086917,"The IRS will use your 2020 tax return or the most recent one they have on file. Payments have already started going out, so if you haven’t filed your 2020 taxes they will use the 2019 taxes. You can see the status of your EIP here: https://t.co/Z72eHzdRis https://t.co/SCy8Y67ejs",2021-03-22 17:39:20+00:00,False,50,22,145,1,en,False,Twitter for iPhone,232,255,https://t.co/Z72eHzdRis,https://www.irs.gov/coronavirus/get-my-payment,256,279,https://t.co/SCy8Y67ejs,https://twitter.com/madnonna1951/status/1374000976848330755,NA,NA,NA,NA
CoryBooker,15808765,1374052694546059265,The American Rescue Plan directed the Treasury Department to start the periodic payments of the CTC in July -- I’ll be working with the Treasury Department to make those payments monthly https://t.co/xxoC9dSHvK,2021-03-22 17:37:45+00:00,False,33,16,194,5,en,False,Twitter for iPhone,187,210,https://t.co/xxoC9dSHvK,https://twitter.com/hopejmj2/status/1373996800668004354,NA,NA,NA,NA,NA,NA,NA,NA
