ScreenName,AuthorID,TweetID,Text,TweetDate,isReply,RetweetCount,ReplyCount,LikeCount,QuoteCount,Language,PossibleSensitive,Source,1stURLStart,1stURLEnd,1stURL,1stURLExp,2ndURLStart,2ndURLEnd,2ndURL,2ndURLExp,3rdURLStart,3rdURLEnd,3rdURL,3rdURLExp
CoryBooker,15808765,1374051432874266627,The loss of our SALT deductions was used to pay for Trump's awful tax cut for the wealthy. It punished states that send more in taxes than they receive in investments in their state. Senator Menendez &amp; I are committed to lifting this unfair cap on NJyans: https://t.co/TFP3DJ6kPl https://t.co/kV0QZuxwts,2021-03-22 17:32:44+00:00,False,78,37,347,7,en,False,Twitter for iPhone,260,283,https://t.co/TFP3DJ6kPl,https://north-jerseynews.com/2021/02/12/legislation-for-restoration-of-full-salt-deduction-introduced-by-new-jersey-federal-lawmakers/,284,307,https://t.co/kV0QZuxwts,https://twitter.com/durbinwatson09/status/1373997198220869641,NA,NA,NA,NA
CoryBooker,15808765,1374050688297222156,"For those who lost their job &amp; want to stay on their health plan, the ARPA fully subsidizes COBRA premiums through Sept. 2021. Federal agencies will soon be providing guidance on implementing this provision—in the meantime, visit this site for more info: https://t.co/fjrNUYYUd0 https://t.co/JwQ3HpmXfo",2021-03-22 17:29:47+00:00,False,52,6,150,2,en,False,Twitter for iPhone,259,282,https://t.co/fjrNUYYUd0,https://www.kff.org/health-reform/issue-brief/how-the-american-rescue-plan-will-improve-affordability-of-private-health-coverage/,283,306,https://t.co/JwQ3HpmXfo,https://twitter.com/hotelkeys/status/1373997026749386755,NA,NA,NA,NA
CoryBooker,15808765,1374049757119848450,"More awesome than the Backsteet Boys 

But not quite as awesome as The Jackson 5. https://t.co/f4C3vyybou",2021-03-22 17:26:05+00:00,False,38,26,351,5,en,False,Twitter for iPhone,82,105,https://t.co/f4C3vyybou,https://twitter.com/peterh32/status/1374049286896250887,NA,NA,NA,NA,NA,NA,NA,NA
CoryBooker,15808765,1374047749184831494,"• Eliminating the upper age limit on the credit, allowing qualifying childless workers who are age 65 &amp; above to benefit.
• Increasing the amount of the childless EITC by doubling the phase-in &amp; phase-out percentages, increasing both the earned income &amp; phase-out amounts",2021-03-22 17:18:06+00:00,True,27,4,115,0,en,False,Twitter for iPhone,NA,NA,NA,NA,NA,NA,NA,NA,NA,NA,NA,NA
CoryBooker,15808765,1374047670675865600,"Thank you for your work &amp; care for your clients. 

This plan will expand the EITC for taxpayers with no qualifying children by:
• Almost tripling the max credit in 2021
• Reducing the min age to claim the credit for these workers from 25 to 19 (except for full-time students) https://t.co/vk5d92GRFL",2021-03-22 17:17:47+00:00,False,32,6,158,0,en,False,Twitter for iPhone,280,303,https://t.co/vk5d92GRFL,https://twitter.com/bramblefae/status/1373997667399868419,NA,NA,NA,NA,NA,NA,NA,NA
CoryBooker,15808765,1374047104126087175,"Well done Bill. Proud of you for that one. 

What do you call a guy like me, without kids who tells lots of dad jokes?

A Faux Pa https://t.co/610vBi2lxP",2021-03-22 17:15:32+00:00,False,46,30,741,6,en,False,Twitter for iPhone,130,153,https://t.co/610vBi2lxP,https://twitter.com/Bill_Palmer/status/1374045805934301188,NA,NA,NA,NA,NA,NA,NA,NA
CoryBooker,15808765,1374045640532037635,"If you never received your 1st or 2nd payment, you can claim the Recovery Rebate Credit when you file your 2020 tax return. For more info on how to claim your prior payment, visit:

https://t.co/j63h1A4y5W https://t.co/dBrQI6T1rw",2021-03-22 17:09:43+00:00,False,85,21,208,5,en,False,Twitter for iPhone,182,205,https://t.co/j63h1A4y5W,https://www.irs.gov/newsroom/recovery-rebate-credit,206,229,https://t.co/dBrQI6T1rw,https://twitter.com/MelinaBrown/status/1373997951601758208,NA,NA,NA,NA
CoryBooker,15808765,1374045364777594880,"Sorry I'm fuming on this. 

I have a burning question - 

I wasn't too ""flame-ous"" when I played at Standord but...

When was the PAC-12 not on fire. 

We just keep taking things to new ""farenheits."" https://t.co/mcymHO2jSn",2021-03-22 17:08:38+00:00,False,20,17,211,9,en,False,Twitter for iPhone,200,223,https://t.co/mcymHO2jSn,https://twitter.com/MattMurph24/status/1374043505727827972,NA,NA,NA,NA,NA,NA,NA,NA
CoryBooker,15808765,1374044150216155139,"I'm spending the next 30 minutes or so on Twitter answering your questions about the American Rescue Plan. If you have questions, please reply to this tweet or use #AmericanRescuePlan and will do my best to answer as many as possible.",2021-03-22 17:03:48+00:00,False,180,370,1473,16,en,False,Twitter Web App,NA,NA,NA,NA,NA,NA,NA,NA,NA,NA,NA,NA
CoryBooker,15808765,1374025116456194052,"Today around 1pm ET, I'll answer your questions about the American Rescue Plan and how it’s helping American families—from relief checks to unemployment assistance to expanding the child tax credit. If you have a question, please tag me or use #AmericanRescuePlan.",2021-03-22 15:48:10+00:00,False,62,38,428,8,en,False,Twitter Web App,NA,NA,NA,NA,NA,NA,NA,NA,NA,NA,NA,NA
CoryBooker,15808765,1373996527442657282,"Many of my constituents in New Jersey and Americans across the country have reached out asking about the American Rescue Plan—so today around 1pm ET, I’d like to answer some of your questions here on Twitter. Have a question? Just tag me or use #AmericanRescuePlan.",2021-03-22 13:54:34+00:00,False,141,68,787,7,en,False,Twitter Web App,NA,NA,NA,NA,NA,NA,NA,NA,NA,NA,NA,NA
CoryBooker,15808765,1373634751139962882,"We are not going to stamp out bigotry, and hate, and violence by abandoning our virtues — instead we need to double down on love. 

It is harder, but ultimately it is the best way to heal, to empower, to strengthen, to overcome.",2021-03-21 13:57:00+00:00,False,932,253,7871,77,en,False,Twitter Web App,NA,NA,NA,NA,NA,NA,NA,NA,NA,NA,NA,NA
CoryBooker,15808765,1373420338386661383,"With her inspiring words, @TheAmandaGorman got a nation to pause and listen. Grateful for her voice. #WomensHistoryMonth https://t.co/7vm0wuNeMU",2021-03-20 23:45:00+00:00,False,372,43,5706,4,en,False,Twitter Web App,121,144,https://t.co/7vm0wuNeMU,https://twitter.com/CoryBooker/status/1373420338386661383/photo/1,NA,NA,NA,NA,NA,NA,NA,NA
CoryBooker,15808765,1373304576158277637,"In awe of these women, doing everything they can to support a person's right to choose. We need to repeal the Hyde Amendment, make Roe v. Wade law, and end this assault on reproductive rights. https://t.co/hW7r0849hg",2021-03-20 16:05:00+00:00,False,227,77,1705,19,en,False,Twitter Web App,193,216,https://t.co/hW7r0849hg,https://www.youtube.com/watch?v=sOBYS47_ke0,NA,NA,NA,NA,NA,NA,NA,NA
CoryBooker,15808765,1372958042312962050,"Millions of dollars will be made during the NCAA #MarchMadness tournament, by sponsors, TV Networks, Colleges, the NCAA, and — who knows? — maybe even you if you put together a winning bracket. 
Players will not see one dime of this. This is wrong and must change.",2021-03-19 17:08:00+00:00,False,310,155,2116,26,en,False,Twitter Web App,NA,NA,NA,NA,NA,NA,NA,NA,NA,NA,NA,NA
CoryBooker,15808765,1372611134730145792,"If you have questions, the experts have the answers. 

Get answers and get vaccinated: https://t.co/JyB51m2Glw",2021-03-18 18:09:31+00:00,False,87,28,320,4,en,False,Twitter Web App,87,110,https://t.co/JyB51m2Glw,http://BetweenUsAboutUs.org,NA,NA,NA,NA,NA,NA,NA,NA
CoryBooker,15808765,1372228844212588544,"My heart breaks for the victims of yet another hateful act of gun violence. Keeping the victims and their loved ones, the people of Atlanta, and the AAPI community in my prayers. https://t.co/h7W0OhTpal",2021-03-17 16:50:25+00:00,False,158,39,1263,13,en,False,Twitter Web App,179,202,https://t.co/h7W0OhTpal,http://ajc.com/news/breaking-multiple-shootings-shut-down-busy-woodstock-highway/OLE23RVIO5BE3ELWBZAA6GVSSA/,NA,NA,NA,NA,NA,NA,NA,NA
CoryBooker,15808765,1371606637400748032,Congratulations to the Lucas Brothers on their Oscar nomination for Judas and the Black Messiah. Making Brick City proud! #NewarkIsForArtists https://t.co/wpKtG9IwxO,2021-03-15 23:38:00+00:00,False,67,40,614,0,en,False,Twitter Web App,142,165,https://t.co/wpKtG9IwxO,https://twitter.com/lucasbros/status/1371488556418482176,NA,NA,NA,NA,NA,NA,NA,NA
CoryBooker,15808765,1371572442477563912,Those vegan tacos...they guac my world. https://t.co/n1aM2B77id,2021-03-15 21:22:07+00:00,False,295,165,5507,61,en,False,Twitter for iPhone,40,63,https://t.co/n1aM2B77id,https://twitter.com/Emilylgoodin/status/1371554695433572356,NA,NA,NA,NA,NA,NA,NA,NA
CoryBooker,15808765,1371544486829043723,"My friend @GavinNewsom has been a leader throughout this crisis. Now an unpopular, partisan recall will waste critical taxpayer dollars when they’re needed most. 

Stop the recall: https://t.co/prW3U6l700",2021-03-15 19:31:02+00:00,False,824,828,4459,154,en,False,Twitter Web App,181,204,https://t.co/prW3U6l700,https://twitter.com/GavinNewsom/status/1371478840963264516,NA,NA,NA,NA,NA,NA,NA,NA
CoryBooker,15808765,1371236699833913348,The House has once again passed the George Floyd Justice in Policing Act. It is now on the Senate to deliver the reform and action the American people have been demanding.https://t.co/fTEYie49Ud,2021-03-14 23:08:00+00:00,False,536,125,3052,40,en,False,Twitter Web App,171,194,https://t.co/fTEYie49Ud,https://www.washingtonpost.com/politics/george-floyd-police-reform-bill-vote/2021/03/03/5ea9ba3a-7c6c-11eb-85cd-9b7fa90c8873_story.html,NA,NA,NA,NA,NA,NA,NA,NA
CoryBooker,15808765,1370803092715753477,"New Jersey Resident Alice Paul dedicated her life to true equality for women. She made so much progress in her lifetime, and the @AlicePaulInstit continues this critical work today. https://t.co/ufxkva3HSn",2021-03-13 18:25:00+00:00,False,225,49,2060,12,en,False,Twitter Web App,182,205,https://t.co/ufxkva3HSn,https://twitter.com/CoryBooker/status/1370803092715753477/photo/1,NA,NA,NA,NA,NA,NA,NA,NA
CoryBooker,15808765,1370450771548979202,"Governor @PhilMurphyNJ has had our back throughout this pandemic, now we need to have his. Sign here to get him on the ballot →
https://t.co/xO8VUrogC9",2021-03-12 19:05:00+00:00,False,84,98,403,22,en,False,Twitter Web App,128,151,https://t.co/xO8VUrogC9,https://na4.docusign.net/Member/PowerFormSigning.aspx?PowerFormId=e5f4a84e-fb59-499a-8c41-8a921f3a01c7&env=na4&acct=772b7c6a-ea98-4fd1-b952-9428b3c99f97&v=2,NA,NA,NA,NA,NA,NA,NA,NA
CoryBooker,15808765,1370393141501517828,"Serve each other.

Sacrifice for each other.

Love each other.",2021-03-12 15:16:00+00:00,False,2175,359,20507,120,en,False,Twitter Web App,NA,NA,NA,NA,NA,NA,NA,NA,NA,NA,NA,NA
CoryBooker,15808765,1370114566877745152,"After a year in lockdown, we still have a long road ahead — millions of at risk Americans still need vaccines, businesses across the country are struggling to stay afloat, and too many of us are mourning someone we've lost. This plan puts on a path to get out of this crisis.",2021-03-11 20:49:02+00:00,True,41,22,455,1,en,False,Twitter Web App,NA,NA,NA,NA,NA,NA,NA,NA,NA,NA,NA,NA
CoryBooker,15808765,1370114564575084550,Because the President signed this into law today many Americans will receive desperately needed stimulus checks this weekend. https://t.co/LQO1IyDZaS,2021-03-11 20:49:02+00:00,True,82,33,566,3,en,False,Twitter Web App,126,149,https://t.co/LQO1IyDZaS,https://www.cnbc.com/2021/03/11/stimulus-checks-could-start-hitting-bank-accounts-this-weekend-white-house-says.html,NA,NA,NA,NA,NA,NA,NA,NA
CoryBooker,15808765,1370114561836204038,Communities and towns that have been stretched far too thin are finally going to get the help they need. New Jersey alone will receive over $10 billion in aid to help communities across our state. https://t.co/nfEX4l2BZI,2021-03-11 20:49:01+00:00,True,12,3,69,1,en,False,Twitter Web App,197,220,https://t.co/nfEX4l2BZI,https://newjerseyglobe.com/congress/more-than-10-billion-in-federal-aid-headed-new-jerseys-way/,NA,NA,NA,NA,NA,NA,NA,NA
CoryBooker,15808765,1370114556287143937,"An issue I care about deeply is ending the violence of poverty. The American Rescue Plan reduces poverty across the board, and will move us one step closer to putting an end to this crisis. https://t.co/58jwAfaWYV",2021-03-11 20:49:00+00:00,True,16,5,96,1,en,False,Twitter Web App,190,213,https://t.co/58jwAfaWYV,https://twitter.com/CoryBooker/status/1370114556287143937/photo/1,NA,NA,NA,NA,NA,NA,NA,NA
CoryBooker,15808765,1370114549404295172,"I was proud to vote for the American Rescue Plan, and I am thrilled that @POTUS signed it into law earlier today. This is just a start on our road to recovery — there is a lot to be excited about in this bill: https://t.co/hlVIcqTtQY",2021-03-11 20:48:58+00:00,False,169,86,1770,9,en,False,Twitter Web App,210,233,https://t.co/hlVIcqTtQY,https://twitter.com/POTUS/status/1370089088502562818,NA,NA,NA,NA,NA,NA,NA,NA
CoryBooker,15808765,1369757861484654592,"I’m grateful for all Matt has done for the people of New Jersey &amp; for our country. He's helped improve the lives of countless Americans—and he's just getting started.

Please join me in congratulating @mattklapper on the next step of his journey to help fulfill America’s promise.",2021-03-10 21:11:37+00:00,True,90,38,1170,4,en,False,Twitter Web App,NA,NA,NA,NA,NA,NA,NA,NA,NA,NA,NA,NA
CoryBooker,15808765,1369757860402507779,"Of course, I’m grieving Matt’s departure. Over the years, he's become my brother. He’s someone who I’ve relied on during our toughest challenges. He’s built and led an incredible, diverse and inclusive team in the Senate—to say he’ll be missed is an understatement.",2021-03-10 21:11:37+00:00,True,69,10,929,1,en,False,Twitter Web App,NA,NA,NA,NA,NA,NA,NA,NA,NA,NA,NA,NA
CoryBooker,15808765,1369757859370725376,"Matt is the rare leader who can build coalitions &amp; who has the integrity, intellect &amp; grit to always do what’s right &amp; make a difference. He's going to do great things at DOJ &amp; continue the fight for social, racial &amp; economic justice. I’m excited for him, AG Garland &amp; our nation.",2021-03-10 21:11:37+00:00,True,45,5,618,0,en,False,Twitter Web App,NA,NA,NA,NA,NA,NA,NA,NA,NA,NA,NA,NA
CoryBooker,15808765,1369757857680420875,"21 years ago, a young @MattKlapper joined me on a mission to advance civil rights &amp; opportunity. After decades in the trenches &amp; years as my chief of staff, Matt joined DOJ in January—with today’s confirmation, he'll officially serve as AG Garland's COS. I'm so proud of him. https://t.co/94c8xIhds2",2021-03-10 21:11:36+00:00,False,637,126,10875,77,en,False,Twitter Web App,284,307,https://t.co/94c8xIhds2,https://twitter.com/CoryBooker/status/1369757857680420875/photo/1,NA,NA,NA,NA,NA,NA,NA,NA
CoryBooker,15808765,1369718445667799043,"We need to keep delivering real results, like the American Rescue Plan, not just for Democrats, but for Americans. https://t.co/g7ByDQO0lj",2021-03-10 18:35:00+00:00,False,156,67,1010,6,en,False,Twitter Media Studio,115,138,https://t.co/g7ByDQO0lj,https://twitter.com/CoryBooker/status/1369718445667799043/video/1,NA,NA,NA,NA,NA,NA,NA,NA
CoryBooker,15808765,1369422164886224904,"Get vaccinated for your community.
 
Get vaccinated to put kids back in school.

Get vaccinated for first responders.

Get vaccinated to see your grandparents.

Get vaccinated.",2021-03-09 22:57:41+00:00,False,3617,949,27722,222,en,False,Twitter for iPhone,NA,NA,NA,NA,NA,NA,NA,NA,NA,NA,NA,NA
CoryBooker,15808765,1368932517181460480,"On International Women's Day I want to honor an American trailblazer and hero who continues to inspire the next generation of new leaders. I'm grateful to call her one of my closest friends, @VP Kamala Harris. https://t.co/0r5lXJAw3x",2021-03-08 14:32:00+00:00,False,2162,133,20079,72,en,False,Twitter Web App,210,233,https://t.co/0r5lXJAw3x,https://twitter.com/CoryBooker/status/1368932517181460480/photo/1,NA,NA,NA,NA,NA,NA,NA,NA
CoryBooker,15808765,1368568870714368005,"We drink deeply from wells of freedom &amp; liberty that we did not dig. Thinking today of the giants who came before us, marching toward justice, and especially missing my mentor and friend John Lewis. https://t.co/3C6U4TugTy",2021-03-07 14:27:00+00:00,False,3016,227,22325,103,en,False,Twitter Web App,203,226,https://t.co/3C6U4TugTy,https://twitter.com/CoryBooker/status/1368568870714368005/photo/1,NA,NA,NA,NA,NA,NA,NA,NA
CoryBooker,15808765,1367914786722353158,"In New Jersey and across the country, the American Rescue Plan will provide critical relief to individuals and communities struggling in this pandemic. It brings us one step closer to getting out of this crisis.",2021-03-05 19:07:54+00:00,False,307,123,2527,17,en,False,Twitter Web App,NA,NA,NA,NA,NA,NA,NA,NA,NA,NA,NA,NA
