ScreenName,AuthorID,TweetID,Text,TweetDate,isReply,RetweetCount,ReplyCount,LikeCount,QuoteCount,Language,PossibleSensitive,Source,1stURLStart,1stURLEnd,1stURL,1stURLExp,2ndURLStart,2ndURLEnd,2ndURL,2ndURLExp,3rdURLStart,3rdURLEnd,3rdURL,3rdURLExp
ChrisMurphyCT,150078976,1486008836708356097,"But we all understand the complexity of integrated air defense systems, right? The kind that would be effective in shooting down Russian missiles or planes? You can’t just ship that to the Ukrainian army and turn it on. https://t.co/Mdw6bRNiJb",2022-01-25 16:11:30+00:00,False,59,41,229,5,en,False,Twitter for iPhone,220,243,https://t.co/Mdw6bRNiJb,https://twitter.com/ChristopherJM/status/1486004066715062274,NA,NA,NA,NA,NA,NA,NA,NA
ChrisMurphyCT,150078976,1485819504617742339,Amazing. https://t.co/ynxtD881pv,2022-01-25 03:39:09+00:00,False,45,37,379,6,en,False,Twitter for iPhone,9,32,https://t.co/ynxtD881pv,https://twitter.com/Phil_Lewis_/status/1484890911364554755,NA,NA,NA,NA,NA,NA,NA,NA
ChrisMurphyCT,150078976,1485814014919774209,"More guns don't save lives. Why do we know this? Because the data is crystal clear.

For every 1% increase in gun ownership in a community, a 1% increase in gun deaths comes with it.
https://t.co/auoi2ctmMv",2022-01-25 03:17:20+00:00,False,293,95,812,19,en,False,Twitter Web App,183,206,https://t.co/auoi2ctmMv,https://ajph.aphapublications.org/doi/10.2105/AJPH.2013.301409,NA,NA,NA,NA,NA,NA,NA,NA
ChrisMurphyCT,150078976,1485811930321334278,"Let's stop pretending we don't know what to do.

In states with universal background checks, the firearm mortality rate is 35% lower than in states without universal background checks. Lives are saved in states that do a better job controlling the flow of illegal guns. https://t.co/gCMUbemlwL",2022-01-25 03:09:03+00:00,False,1619,169,6630,52,en,False,Twitter Web App,270,293,https://t.co/gCMUbemlwL,https://twitter.com/AP/status/1485794638598488065,NA,NA,NA,NA,NA,NA,NA,NA
ChrisMurphyCT,150078976,1485799905562181632,This is good. https://t.co/GYYJPy46Dp,2022-01-25 02:21:16+00:00,False,127,115,1552,10,en,False,Twitter Web App,14,37,https://t.co/GYYJPy46Dp,https://twitter.com/oliverdarcy/status/1485797174407581696,NA,NA,NA,NA,NA,NA,NA,NA
ChrisMurphyCT,150078976,1485799753677946883,"With millions in Afghanistan on the brink of famine, this humanitarian crisis could kill more people than the past 20 years of war there.

I am recommending we find ways to send humanitarian aid, going around the Taliban. It's hard but not impossible.
https://t.co/f504ciKzq2",2022-01-25 02:20:40+00:00,False,41,22,201,1,en,False,Twitter Web App,252,275,https://t.co/f504ciKzq2,https://www.washingtonpost.com/world/2022/01/24/afghanistan-humanitarian-crisis-hunger/?tid=ss_tw,NA,NA,NA,NA,NA,NA,NA,NA
ChrisMurphyCT,150078976,1485717202217189379,I’m still trying to figure if what I watched last night was the greatest game ever or just the worst defensive performance ever. https://t.co/QAQiRkvhOp,2022-01-24 20:52:38+00:00,False,7,32,145,1,en,False,Twitter for iPhone,129,152,https://t.co/QAQiRkvhOp,https://twitter.com/BillSimmons/status/1485655938182705154,NA,NA,NA,NA,NA,NA,NA,NA
ChrisMurphyCT,150078976,1485709989952069632,"Huge congratulations to @SaxeMS on being selected one of the winners of @NASA’s TechRise contest. Such a cool opportunity. NASA will actually test their experiment in-flight, either on a suborbital rocket or high-altitude balloon. https://t.co/lbvVKa09oV",2022-01-24 20:23:59+00:00,False,11,2,110,1,en,False,Twitter for iPhone,231,254,https://t.co/lbvVKa09oV,https://twitter.com/DavidGusitsch/status/1484598051159302153,NA,NA,NA,NA,NA,NA,NA,NA
ChrisMurphyCT,150078976,1485648934303322120,⬇️⬇️⬇️ https://t.co/Bom6ySK3oK,2022-01-24 16:21:22+00:00,False,35,10,146,0,und,False,Twitter for iPhone,7,30,https://t.co/Bom6ySK3oK,https://twitter.com/toddntucker/status/1485644029006159878,NA,NA,NA,NA,NA,NA,NA,NA
ChrisMurphyCT,150078976,1485603441892376577,"On Friday I visited @CCATInc in East Hartford. Congress is finally realizing that we need an industrial policy, linking the public and private sectors together, in order to compete w China. That’s what CCAT has been doing for years. I learned a lot during my visit. https://t.co/73IYstQAKx",2022-01-24 13:20:36+00:00,False,13,36,94,3,en,False,Twitter for iPhone,266,289,https://t.co/73IYstQAKx,https://twitter.com/ChrisMurphyCT/status/1485603441892376577/photo/1,NA,NA,NA,NA,NA,NA,NA,NA
ChrisMurphyCT,150078976,1485601774459367429,"Listen, not all Republicans think things like this, but many do. And if the Gingrich/Taylor Greene wing of the party takes over (if they already haven't), then our democracy might be gone. https://t.co/h17pajVBzp",2022-01-24 13:13:58+00:00,False,629,343,3449,34,en,False,Twitter Web App,189,212,https://t.co/h17pajVBzp,https://twitter.com/RonFilipkowski/status/1485313965177589770,NA,NA,NA,NA,NA,NA,NA,NA
ChrisMurphyCT,150078976,1485600975775797256,"A reminder that prior the this shipment, the U.S. had already sent $2 billion of military aid into Ukraine, and has had troops there training Ukrainian forces for almost a decade.

We can and should do more, but no country has done more to help Ukraine defend itself than the U.S. https://t.co/RuOXGm8q1Q",2022-01-24 13:10:48+00:00,False,106,36,454,7,en,False,Twitter Web App,281,304,https://t.co/RuOXGm8q1Q,https://twitter.com/USEmbassyKyiv/status/1484709938807070721,NA,NA,NA,NA,NA,NA,NA,NA
ChrisMurphyCT,150078976,1485597890693275649,"Listen, these guys know better because people have begged them to stop doing this over and over. It’s not some series of random slip ups. 

But they keep belittling and diminishing the Holocaust by comparing it to vaccines. https://t.co/6KQxoiOPqo",2022-01-24 12:58:32+00:00,False,163,63,913,4,en,False,Twitter for iPhone,224,247,https://t.co/6KQxoiOPqo,https://twitter.com/oneunderscore__/status/1485338127442984960,NA,NA,NA,NA,NA,NA,NA,NA
ChrisMurphyCT,150078976,1485093979251163136,"Trump’s withdrawal from the JCPOA, a decision opposed by his Secretary of State and Secretary of Defense, will go down as one of the dumbest, most dangerous foreign policy decisions of the last fifty years. https://t.co/jo6qW206gn",2022-01-23 03:36:11+00:00,False,1558,179,4609,57,en,False,Twitter for iPhone,207,230,https://t.co/jo6qW206gn,https://twitter.com/CrisisGroup/status/1485042344110047232,NA,NA,NA,NA,NA,NA,NA,NA
ChrisMurphyCT,150078976,1485011210936504321,"When evaluating Ukraine/Russia policy options, ask - does it divide or unite NATO? I’m not saying there aren’t times when the U.S. must act unilaterally, but Putin’s top goal is to destroy NATO, and he’s always seen his actions in Ukraine as a means toward his most important end. https://t.co/CjIxD8zYwA",2022-01-22 22:07:17+00:00,False,76,44,285,5,en,False,Twitter for iPhone,281,304,https://t.co/CjIxD8zYwA,https://twitter.com/IgnatiusPost/status/1484838127646691330,NA,NA,NA,NA,NA,NA,NA,NA
ChrisMurphyCT,150078976,1484713745356136448,These strikes aren’t proportional. They aren’t legal. The Saudi coalition needs to end this offensive now.  https://t.co/md5hw4GLrP,2022-01-22 02:25:16+00:00,False,105,90,383,26,en,False,Twitter for iPhone,108,131,https://t.co/md5hw4GLrP,https://www.washingtonpost.com/world/2022/01/21/least-60-killed-including-children-airstrikes-yemen/,NA,NA,NA,NA,NA,NA,NA,NA
ChrisMurphyCT,150078976,1484580854206763009,"This is my first try @brianschatz. I think I’m a natural. 

⬜🟨⬜🟨⬜
🟩🟩⬜⬜⬜
🟩🟩⬜⬜🟩
🟩🟩🟩🟩🟩 https://t.co/dv84PVyMlz",2022-01-21 17:37:12+00:00,False,6,21,349,2,en,False,Twitter for iPhone,84,107,https://t.co/dv84PVyMlz,https://twitter.com/brianschatz/status/1484395223954309121,NA,NA,NA,NA,NA,NA,NA,NA
ChrisMurphyCT,150078976,1484578528150626308,"Thanks to @Matt_Blumenthal and @JillianG_CT for organizing today’s press conference to show Connecticut’s support for Roe v. Wade and the right to free and safe abortion. 

Also, great to see two generations of Blumenthals fighting for choice! https://t.co/v39x5s339O",2022-01-21 17:27:57+00:00,False,47,47,313,6,en,False,Twitter for iPhone,244,267,https://t.co/v39x5s339O,https://twitter.com/ChrisMurphyCT/status/1484578528150626308/photo/1,NA,NA,NA,NA,NA,NA,NA,NA
ChrisMurphyCT,150078976,1484575691312144384,My heart is still breaking for the Sport and Medical Sciences Academy family for their loss last week. I went there today to learn more about how we can keep kids away from poisonous drugs like fentanyl. I learned a lot. https://t.co/MDuM6GSRmb,2022-01-21 17:16:41+00:00,False,19,53,293,0,en,False,Twitter for iPhone,221,244,https://t.co/MDuM6GSRmb,https://twitter.com/ChrisMurphyCT/status/1484575691312144384/photo/1,NA,NA,NA,NA,NA,NA,NA,NA
ChrisMurphyCT,150078976,1484326485238247434,"Whenever I travel overseas, on the plane back I write a behind-the-scenes account of the trip. My way to try to prompt a candid conversation about the importance of smart national security policy. 

Here’s my report from Ukraine.  https://t.co/1KJ0JlpHfg",2022-01-21 00:46:26+00:00,False,82,34,408,25,en,False,Twitter for iPhone,231,254,https://t.co/1KJ0JlpHfg,https://chrismurphyct.medium.com/24-hours-in-ukraine-86cbfcaf51e4,NA,NA,NA,NA,NA,NA,NA,NA
ChrisMurphyCT,150078976,1484245133851873280,"When U.S. drone strikes kill civilians abroad, it’s both a moral failure and a national security liability.

Senator Warren and I got our colleagues together and sent a letter to President Biden with a simple message: we must do better. https://t.co/1FZGuuXr4U",2022-01-20 19:23:10+00:00,False,112,71,721,23,en,False,Twitter Web App,237,260,https://t.co/1FZGuuXr4U,https://twitter.com/ChrisMurphyCT/status/1484245133851873280/photo/1,237,260,https://t.co/1FZGuuXr4U,https://twitter.com/ChrisMurphyCT/status/1484245133851873280/photo/1,237,260,https://t.co/1FZGuuXr4U,https://twitter.com/ChrisMurphyCT/status/1484245133851873280/photo/1
ChrisMurphyCT,150078976,1484241338824642560,"""11 senators and 39 members of the House, led by Senators Elizabeth Warren and Christopher S. Murphy, cited the botched Kabul drone strike as “emblematic of this systemic failure that has persisted across decades and administrations.”
https://t.co/1nItS30Ch7",2022-01-20 19:08:05+00:00,False,35,8,158,0,en,False,Twitter Web App,235,258,https://t.co/1nItS30Ch7,https://www.nytimes.com/2022/01/20/us/politics/democrats-biden-civilian-casualties.html?smid=tw-share,NA,NA,NA,NA,NA,NA,NA,NA
ChrisMurphyCT,150078976,1484212055347548163,"Five years ago today. My then 5 year old getting ready for the women's march, with his bin of Transformers close by. https://t.co/dpB7HpkfFF",2022-01-20 17:11:43+00:00,False,39,59,1255,2,en,False,Twitter Web App,117,140,https://t.co/dpB7HpkfFF,https://twitter.com/ChrisMurphyCT/status/1484212055347548163/photo/1,NA,NA,NA,NA,NA,NA,NA,NA
ChrisMurphyCT,150078976,1484202935219367943,"This is why we care so much about the #FreedomtoVoteAct. 

The mainstream of the Republican Party doesn’t think a Democrat can ever legitimately win an election and is making sure it will never happen in key races. 

This would be an end to American democracy. https://t.co/JWDyIUtXvk",2022-01-20 16:35:29+00:00,False,190,58,644,7,en,False,Twitter for iPhone,261,284,https://t.co/JWDyIUtXvk,https://twitter.com/DKElections/status/1484202072438415362,NA,NA,NA,NA,NA,NA,NA,NA
ChrisMurphyCT,150078976,1484161762408779777,"Russia’s short term goal is to get Ukraine back into its orbit.

Russia’s long term goal is to smash NATO.

Biden understands that Putin is using the short term goal as a wedge to achieve the long term goal.

That’s why we must get NATO unified on Ukraine policy.",2022-01-20 13:51:53+00:00,False,202,47,981,9,en,False,Twitter for iPhone,NA,NA,NA,NA,NA,NA,NA,NA,NA,NA,NA,NA
ChrisMurphyCT,150078976,1484010782388105219,"""Our democracy is a tiny, fragile port in a raging storm, and none of us should be surprised that once in a while, some Americans, drawn to the old system of control by the strong and powerful, decide it’s time to give up and submit to the battering winds."" https://t.co/nTsBMq97GP",2022-01-20 03:51:56+00:00,False,153,91,864,15,en,False,Twitter Media Studio,258,281,https://t.co/nTsBMq97GP,https://twitter.com/ChrisMurphyCT/status/1484010782388105219/video/1,NA,NA,NA,NA,NA,NA,NA,NA
ChrisMurphyCT,150078976,1484010143666819079,Please check this out tomorrow. https://t.co/TFNYZl1S0g,2022-01-20 03:49:24+00:00,False,21,6,94,0,en,False,Twitter Web App,32,55,https://t.co/TFNYZl1S0g,https://www.eventbrite.com/e/we-are-all-newtown-a-national-conversation-on-gun-violence-tickets-243129576107,NA,NA,NA,NA,NA,NA,NA,NA
ChrisMurphyCT,150078976,1483962976465993729,Joining @JoyAnnReid on @thereidout in a few minutes to talk Ukraine and voting rights. Big day in the Senate.,2022-01-20 00:41:58+00:00,False,21,35,223,1,en,False,Twitter for iPhone,NA,NA,NA,NA,NA,NA,NA,NA,NA,NA,NA,NA
ChrisMurphyCT,150078976,1483945697657470977,Our democracy is in peril. It just is. Today’s vote is one of the most important I will cast as a Senator. https://t.co/z2SIcabepZ,2022-01-19 23:33:19+00:00,False,221,136,1147,20,en,False,Twitter Media Studio,107,130,https://t.co/z2SIcabepZ,https://twitter.com/ChrisMurphyCT/status/1483945697657470977/video/1,NA,NA,NA,NA,NA,NA,NA,NA
ChrisMurphyCT,150078976,1483896046786916358,"Republican Senators keep reciting the part of the Constitution that says states set voting rules

but they stop reading the clause halfway through so they don’t have to say the second half:

“but the Congress may at any time by Law make or alter such Regulations”.

Just amazing.",2022-01-19 20:16:01+00:00,False,15719,1408,52668,725,en,False,Twitter for iPhone,NA,NA,NA,NA,NA,NA,NA,NA,NA,NA,NA,NA
ChrisMurphyCT,150078976,1483834197378744325,"Just finished a meeting with @POTUS on our trip to Ukraine. I conveyed to him my impression that the Ukrainian people are ready to fight, but they will need clear signals that the U.S. is committed to the long fight for Ukrainian sovereignty. @POTUS gets it.",2022-01-19 16:10:15+00:00,False,378,128,3088,35,en,False,Twitter for iPhone,NA,NA,NA,NA,NA,NA,NA,NA,NA,NA,NA,NA
ChrisMurphyCT,150078976,1483657100261826560,"They are telling you - proudly and openly - what they plan to do.

""The vote counter is more important than the candidate.""

Trump Republicans don't plan on winning the election. They plan on installing their people in power whether they win or lose.

Pass the #FreedomToVoteAct. https://t.co/MfSfz11n3Z",2022-01-19 04:26:32+00:00,False,1188,223,3235,81,en,False,Twitter Web App,280,303,https://t.co/MfSfz11n3Z,https://twitter.com/RonFilipkowski/status/1482355548565745670,NA,NA,NA,NA,NA,NA,NA,NA
ChrisMurphyCT,150078976,1483605449161248775,I will be on @andersoncooper @AC360 at 8:15 tonight to talk about my recent trip to Ukraine and the path forward on protecting voting rights. Tune in.,2022-01-19 01:01:17+00:00,False,32,40,353,7,en,False,Twitter for iPhone,NA,NA,NA,NA,NA,NA,NA,NA,NA,NA,NA,NA
ChrisMurphyCT,150078976,1483544987069464590,"Wheels down from 24 hours in Ukraine. If Putin thinks he’s marching to Kiev without a bloody, perhaps never ending fight, he has greatly underestimated the Ukrainian people and is getting terrible advice. https://t.co/i8yiOHMU8I",2022-01-18 21:01:02+00:00,False,119,70,668,11,en,False,Twitter for iPhone,205,228,https://t.co/i8yiOHMU8I,https://twitter.com/alexbward/status/1483493456785850370,NA,NA,NA,NA,NA,NA,NA,NA
ChrisMurphyCT,150078976,1483319699618287618,Wheels up from Ukraine. Our big bipartisan delegation (pictured here w President Zelensky) returns committed to finding a path forward to keep both parties together in support of Ukraine’s sovereignty. https://t.co/vBEIvY1WAn,2022-01-18 06:05:49+00:00,False,251,96,2201,17,en,False,Twitter for iPhone,202,225,https://t.co/vBEIvY1WAn,https://twitter.com/ChrisMurphyCT/status/1483319699618287618/photo/1,NA,NA,NA,NA,NA,NA,NA,NA
ChrisMurphyCT,150078976,1483181663639199745,I said it’s my 7th trip to Russia. Of course I meant Ukraine!,2022-01-17 20:57:19+00:00,True,18,46,327,12,en,False,Twitter for iPhone,NA,NA,NA,NA,NA,NA,NA,NA,NA,NA,NA,NA
ChrisMurphyCT,150078976,1483180650630946818,A beautiful Kiev snow shower as we enter the Ambassador’s residence for a working dinner with the Ukrainian Defense Minister and his team. https://t.co/Dw4lFfCy8O,2022-01-17 20:53:17+00:00,False,120,79,1037,18,en,False,Twitter for iPhone,139,162,https://t.co/Dw4lFfCy8O,https://twitter.com/ChrisMurphyCT/status/1483180650630946818/video/1,NA,NA,NA,NA,NA,NA,NA,NA
ChrisMurphyCT,150078976,1483173824166342657,Speaking with the Ukrainian press after our meeting with President Zelensky. We made clear to Zelensky that the United States Congress will give President Biden the authority he needs to build a set of massive deterrent sanctions to dissuade Russia from further invading Ukraine. https://t.co/ra6TQsEsAB,2022-01-17 20:26:10+00:00,False,163,60,820,12,en,False,Twitter for iPhone,280,303,https://t.co/ra6TQsEsAB,https://twitter.com/ChrisMurphyCT/status/1483173824166342657/photo/1,NA,NA,NA,NA,NA,NA,NA,NA
