ScreenName,AuthorID,TweetID,Text,TweetDate,isReply,RetweetCount,ReplyCount,LikeCount,QuoteCount,Language,PossibleSensitive,Source,1stURLStart,1stURLEnd,1stURL,1stURLExp,2ndURLStart,2ndURLEnd,2ndURL,2ndURLExp,3rdURLStart,3rdURLEnd,3rdURL,3rdURLExp
RepMaxineWaters,36686040,1262566985860288513,"AG Barr is a threat &amp; danger to the rule of law and he’s destroying our democracy! He’s simply a lap dog for the President! I join w/ the 2,000 former prosecutors &amp; DOJ attys in calling for his resignation. His constant protection of Trump is moving us closer to a dictatorship!",2020-05-19 02:13:21+00:00,False,6394,1192,22792,316,en,False,Twitter for iPhone,NA,NA,NA,NA,NA,NA,NA,NA,NA,NA,NA,NA
RepMaxineWaters,36686040,1260752053653168128,"Trump doesn’t care about the 80,000+ people who’ve died from #Coronavirus! He only wants to open up the economy so he can go back to having his white power pep rallies! The death &amp; economic devastation we are facing is b/c Trump failed to act early &amp; called #COVID19 a HOAX!",2020-05-14 02:01:27+00:00,False,8850,5038,32661,1073,en,False,Twitter for iPhone,NA,NA,NA,NA,NA,NA,NA,NA,NA,NA,NA,NA
RepMaxineWaters,36686040,1260220131147493376,HOT 🔥🔥 oral arguments in #SCOTUS RIGHT NOW on important case on whether my @fscdems can subpoena financial records of the President from Deutsche Bank. The future of Congressional oversight is at stake! Tune in now on @cspan!,2020-05-12 14:47:47+00:00,False,653,435,3059,47,en,False,Twitter for iPhone,NA,NA,NA,NA,NA,NA,NA,NA,NA,NA,NA,NA
RepMaxineWaters,36686040,1259200654251343872,I’m in a state of shock over the death of Andre Harrell. We were just on the phone a few days ago discussing he &amp; P. Diddy’s Vote or Die initiative. A brilliant music exec &amp; visionary. It’s hard to believe he’s gone. My prayers are w/ his son &amp; family https://t.co/5FRD3IAKTe,2020-05-09 19:16:45+00:00,False,325,182,1734,15,en,False,Twitter for iPhone,264,287,https://t.co/5FRD3IAKTe,https://waters.house.gov/media-center/press-releases/rep-waters-statement-death-andre-harrell,NA,NA,NA,NA,NA,NA,NA,NA
RepMaxineWaters,36686040,1255596363523469312,🚨ALERT! The SBA has opened up an opportunity 4 small businesses btw 4 pm ET &amp; Midnight tonight. They’ll be accepting loan applications ONLY from smaller banks &amp; lenders to help ensure loans reach small biz. I’m trying hard to help small biz &amp; nonprofits receive these PPP loans!,2020-04-29 20:34:35+00:00,False,1534,316,2755,71,en,False,Twitter for iPhone,NA,NA,NA,NA,NA,NA,NA,NA,NA,NA,NA,NA
RepMaxineWaters,36686040,1253850414178541568,"Another key figure in the Trump Admin, Dr. Rick Bright, Dir of Biomedical Advanced R&amp;D, was removed for refusing to push #Hydroxychloroquine. Can you imagine firing an expert responsible for developing a vaccine that could save our lives? This president must be OUT OF HIS MIND!",2020-04-25 00:56:48+00:00,False,1179,576,3218,108,en,False,Twitter for iPhone,NA,NA,NA,NA,NA,NA,NA,NA,NA,NA,NA,NA
RepMaxineWaters,36686040,1253849981280292864,"If pushing #Hydroxychloroquine wasn’t enough, Trump is now suggesting disinfectant &amp; ultraviolet light as a COVID19 treatment! Trump is endangering the lives of people who believe &amp; follow his advice! He needs to shut up &amp; be denied TV time w/ his unhinged cures &amp; remedies!",2020-04-25 00:55:05+00:00,False,831,598,3214,83,en,False,Twitter for iPhone,NA,NA,NA,NA,NA,NA,NA,NA,NA,NA,NA,NA
RepMaxineWaters,36686040,1253849658239180801,Gov Kemp followed the advice of Trump &amp; his protestors &amp; “liberated” his state &amp; opened up the businesses that have the most personal contact w/ individuals in a state w escalating COVID19 sickness &amp; death. His actions will cause more infections. Stupid Kemp should know better!,2020-04-25 00:53:48+00:00,False,1259,858,5206,135,en,False,Twitter for iPhone,NA,NA,NA,NA,NA,NA,NA,NA,NA,NA,NA,NA
RepMaxineWaters,36686040,1253848751493591048,"We’ve passed an emergency bill to assist small bus., support hospitals &amp; create widespread testing. I’ve warned everyone we must include my $100b plan to protect renters from evictions &amp; my $75b plan to help homeowners. I’m prepared to fight till hell freezes over to get it done!",2020-04-25 00:50:12+00:00,False,1429,436,5530,87,en,False,Twitter for iPhone,NA,NA,NA,NA,NA,NA,NA,NA,NA,NA,NA,NA
RepMaxineWaters,36686040,1253847741597462533,GSA better not renegotiate Trump’s lease on his DC hotel. That property belongs to the fed govt! He should never have gotten that lease. What about every other fed bldg leased by other businesses? Will GSA reduce rent on those leases? GSA better stand up to this corrupt bully!,2020-04-25 00:46:11+00:00,False,1515,190,4353,47,en,False,Twitter for iPhone,NA,NA,NA,NA,NA,NA,NA,NA,NA,NA,NA,NA
RepMaxineWaters,36686040,1253846152522465280,"Trump, when are you going to say a word of sympathy &amp; condolences to the families &amp; friends of the 50k coronavirus victims who’ve died in our country &amp; even the others who’ve died around the world? Have you no empathy? Have you no compassion or decency?",2020-04-25 00:39:52+00:00,False,9785,4848,51107,1244,en,False,Twitter for iPhone,NA,NA,NA,NA,NA,NA,NA,NA,NA,NA,NA,NA
RepMaxineWaters,36686040,1251949156404531204,"Trump, stop politicking! Most of the mayors &amp; governors agree they are desperate for testing. Do not believe this country can open up businesses w/o testing, testing, testing! The real test numbers must be revealed!",2020-04-19 19:01:53+00:00,False,1660,700,5421,113,en,False,Twitter for iPhone,NA,NA,NA,NA,NA,NA,NA,NA,NA,NA,NA,NA
RepMaxineWaters,36686040,1251948820658819072,"Twitter family, please use the power and influence of Twitter to demand testing, testing, testing!",2020-04-19 19:00:33+00:00,False,21379,2703,68316,1615,en,False,Twitter for iPhone,NA,NA,NA,NA,NA,NA,NA,NA,NA,NA,NA,NA
RepMaxineWaters,36686040,1250257509891420161,"People beware! Trump is slow walking America to dictatorship. Press attacks, owns AG Barr, controlling our courts including Supreme Court, firing inspector generals, complimenting Putin &amp; Kim Jong Un, now trying to defund US Postal Service, &amp; opposing vote by mail!",2020-04-15 02:59:53+00:00,False,15272,3647,43531,1144,en,False,Twitter for iPhone,NA,NA,NA,NA,NA,NA,NA,NA,NA,NA,NA,NA
RepMaxineWaters,36686040,1250257164490465281,lying about his absence in responding to expert  information early in January; threatening governors he claims are not appreciative enough of him; Wapo documented constantly lying 18k times to the American people..whats next? Absolute surveillance?,2020-04-15 02:58:31+00:00,True,340,131,1264,10,en,False,Twitter for iPhone,NA,NA,NA,NA,NA,NA,NA,NA,NA,NA,NA,NA
RepMaxineWaters,36686040,1250257006876938242,"If that is not enough, commandeering medical equipment meant for first responders, doctors, nurses &amp; health personnel, recommending untested medicine, claiming authority to determine when to open up schools &amp; when COVID19 is no longer a threat;",2020-04-15 02:57:53+00:00,False,612,169,1946,25,en,False,Twitter for iPhone,NA,NA,NA,NA,NA,NA,NA,NA,NA,NA,NA,NA
RepMaxineWaters,36686040,1250256814664540163,Whaaaat? Don’t dirty up the economic impact payments w/ Don the Con’s name on the checks that are being sent to American families to get thru the crisis. People may think it’s a BOGUS check from a BOGUS president!,2020-04-15 02:57:07+00:00,False,3345,2850,16674,521,en,False,Twitter for iPhone,NA,NA,NA,NA,NA,NA,NA,NA,NA,NA,NA,NA
RepMaxineWaters,36686040,1250256452154986497,"COVID19 is changing our lives in ways we never dreamed. Dedicated doctors, nurses, orderlies, &amp; other health care workers saving our lives in ways we can never repay. Call the hospital CEOs, presidents &amp; leadership &amp; have them tell their personnel that people are appreciative!",2020-04-15 02:55:41+00:00,False,250,90,1027,6,en,False,Twitter for iPhone,NA,NA,NA,NA,NA,NA,NA,NA,NA,NA,NA,NA
RepMaxineWaters,36686040,1250256237691678720,"Take a chance. Remind an unmasked person to put on a mask &amp; if they become angry, smile and say “6ft away” &amp; keep going.",2020-04-15 02:54:50+00:00,False,640,791,3318,129,en,False,Twitter for iPhone,NA,NA,NA,NA,NA,NA,NA,NA,NA,NA,NA,NA
RepMaxineWaters,36686040,1250255236591124481,"The statistics &amp; data are emerging about #COVID19 racial disparities, including infections &amp; death. This Admin had better not play around w/a lack of testing, lack of sufficient PPE at hospitals in these communities, &amp; lack of support for the homeless &amp; healthcare resources.",2020-04-15 02:50:51+00:00,False,229,116,906,10,en,False,Twitter for iPhone,NA,NA,NA,NA,NA,NA,NA,NA,NA,NA,NA,NA
RepMaxineWaters,36686040,1250254721018888193,"Why did Trump decide to defund drive-thru testing in the States, disadvantaging minority communities? Trump HHS reason was unless the states need it. What kind of question is that when testing is lacking all over w/ blacks &amp; minorities dying in huge numbers? We’re fighting back!",2020-04-15 02:48:48+00:00,False,1314,311,3910,62,en,False,Twitter for iPhone,NA,NA,NA,NA,NA,NA,NA,NA,NA,NA,NA,NA
RepMaxineWaters,36686040,1247272463001686017,Wow! Big $ GOP donor Mike Gula leaving his firm to sell medical supplies/PPE! Where is he getting the supplies &amp; how can he fill 100 million orders of masks when states can’t get them? What are his relationships? Will his PPE come from fed stockpile?,2020-04-06 21:18:23+00:00,False,21169,2886,52300,1453,en,False,Twitter for iPhone,NA,NA,NA,NA,NA,NA,NA,NA,NA,NA,NA,NA
RepMaxineWaters,36686040,1247271191519395840,Would Trump dare use #coronavirus as an opportunity to reward big GOP donors &amp; place people in our country in a vulnerable position b/c the PPE hasn’t been available to the states? Very suspicious! Are these new GOP companies getting PPE from what Kushner called “our stockpile”?,2020-04-06 21:13:19+00:00,False,2349,817,5490,189,en,False,Twitter for iPhone,NA,NA,NA,NA,NA,NA,NA,NA,NA,NA,NA,NA
RepMaxineWaters,36686040,1247270929752895500,Is Trump using the federal government to block the states from being able to purchase PPE or forcing them to sale to the federal stockpile? Many states can’t get equip b/c Trump is outbidding them — but then he’s not sending the supplies to all states...WHY?,2020-04-06 21:12:17+00:00,False,7051,2343,18986,595,en,False,Twitter for iPhone,NA,NA,NA,NA,NA,NA,NA,NA,NA,NA,NA,NA
RepMaxineWaters,36686040,1246956849523548163,"Congress legislated the #CARESAct which includes IRS economic impact payments: $1200 for eligible adults, $500 for ea child. Details-&gt; https://t.co/1WZpy24HC9
I’m working on more help for rental assistance, mortgages, &amp; loan mods, &amp; all I can for you during this devastating time!",2020-04-06 00:24:14+00:00,False,349,280,1051,40,en,False,Twitter for iPhone,138,161,https://t.co/1WZpy24HC9,https://www.irs.gov/newsroom/economic-impact-payments-what-you-need-to-know,NA,NA,NA,NA,NA,NA,NA,NA
RepMaxineWaters,36686040,1246955166882037762,Doing all I can to answer questions abt govt response to #COVID19. Over 19k people called in to my 1st #covid19 tele town hall &amp; &gt;15k people called in to my 2nd. Never hesitate to call elected reps or fed agencies to learn how govt is helping U during this crisis! U deserve info!,2020-04-06 00:17:33+00:00,False,612,368,2493,46,en,False,Twitter for iPhone,NA,NA,NA,NA,NA,NA,NA,NA,NA,NA,NA,NA
RepMaxineWaters,36686040,1246954945544323075,"What the hell, Jared Kushner! What do you mean our stockpile vs state stockpile of health equipment? This is the UNITED STATES OF AMERICA! This is a CRISIS! U &amp; your inept father in law have bungled the response. You better get the PPE, respirators, ventilators to the states NOW!",2020-04-06 00:16:40+00:00,False,20069,4950,93355,1379,en,False,Twitter for iPhone,NA,NA,NA,NA,NA,NA,NA,NA,NA,NA,NA,NA
RepMaxineWaters,36686040,1246953119168319490,"Do not listen to 45 when he suggests untested #Hydroxychloroquine to treat #COVID19 - listen to Fauci. Don’t listen to 45 when he says heat will kill the virus; or he won’t wear a mask; or when he calls hospital workers thieves, or refuses natl lockdown! 45 just can’t be trusted!",2020-04-06 00:09:25+00:00,False,14532,19041,56555,4012,en,False,Twitter for iPhone,NA,NA,NA,NA,NA,NA,NA,NA,NA,NA,NA,NA
RepMaxineWaters,36686040,1244732533943799809,"Trump, you incompetent idiot! You sent 18 tons of PPE to China early but ignored warnings &amp; called COVID19 concerns a hoax. You've endangered doctors, nurses, aids, orderlies, &amp; janitors - all risking their lives to save ours. Pray 4 forgiveness for the harm that you're causing!",2020-03-30 21:05:36+00:00,False,45966,18802,162606,6135,en,False,Twitter for iPhone,NA,NA,NA,NA,NA,NA,NA,NA,NA,NA,NA,NA
RepMaxineWaters,36686040,1244732123724099584,"Trump, so now you’re expanding the social distancing order? Another correction b/c of your ignorant hunches. You said we'd be safe by Easter! Experts always have to clean up after your ""hunches."" Keep your hunches 2 yourself &amp; don’t waste experts' time correcting your stupidity!",2020-03-30 21:03:58+00:00,False,3715,798,13081,298,en,False,Twitter for iPhone,NA,NA,NA,NA,NA,NA,NA,NA,NA,NA,NA,NA
RepMaxineWaters,36686040,1244731877950402569,"Trump, Gov Whitmer, the governor you called ""that woman"", is what you think of ALL women, period! We women are all “that woman”! We are mothers &amp; working professionals; we're doctors &amp; lawyers; &amp; we're elected officials, even governors, &amp; you will show us the respect we deserve!",2020-03-30 21:03:00+00:00,False,7447,1533,33360,556,en,False,Twitter for iPhone,NA,NA,NA,NA,NA,NA,NA,NA,NA,NA,NA,NA
RepMaxineWaters,36686040,1244731602414034944,"Trump, stop congratulating yourself! You’re a failure &amp; you've mishandled this #COVID19 disaster! You're not knowledgeable &amp; you don’t know more than experts &amp; generals. Your ignorance &amp; incompetence are appalling &amp; you continue to demonstrate that every time you open your mouth!",2020-03-30 21:01:54+00:00,False,8065,2188,25514,965,en,False,Twitter for iPhone,NA,NA,NA,NA,NA,NA,NA,NA,NA,NA,NA,NA
RepMaxineWaters,36686040,1244731264789291008,"Trump, weren't you taught at an early age that self congratulations are improper? When you're doing a good job, you will be commended. When you have to congratulate yourself it's b/c of incompetence &amp; insecurity. No one values hubris. A lesson you should've learned long ago.",2020-03-30 21:00:34+00:00,False,5230,1116,20766,457,en,False,Twitter for iPhone,NA,NA,NA,NA,NA,NA,NA,NA,NA,NA,NA,NA
RepMaxineWaters,36686040,1244730919195377665,"Trump, since you destroyed the WH unit designed to plan for pandemics like #COVID19, you need to stop being duplicitous about the DPA &amp; get more corps to develop masks, respirators, &amp; everything needed to protect hospital workers trying to save lives. Get your act together!",2020-03-30 20:59:11+00:00,False,1721,455,5728,98,en,False,Twitter for iPhone,NA,NA,NA,NA,NA,NA,NA,NA,NA,NA,NA,NA
RepMaxineWaters,36686040,1243638730889592832,"The $2T passed today doesn’t have all the housing &amp; consumer relief that was in my @FSCDems plan, but it was important for Congress to act NOW b/c so many people are struggling. Help is on the way &amp; there’s more to come! We won’t stop until we help all Americans thru this crisis! https://t.co/rHE7LX2Vgt",2020-03-27 20:39:13+00:00,False,492,301,2199,36,en,False,Twitter Web App,289,312,https://t.co/rHE7LX2Vgt,https://twitter.com/RepMaxineWaters/status/1243638730889592832/photo/1,289,312,https://t.co/rHE7LX2Vgt,https://twitter.com/RepMaxineWaters/status/1243638730889592832/photo/1,NA,NA,NA,NA
RepMaxineWaters,36686040,1241840166853058560,"I’ve been working around the clock w/ the Sen &amp; House to ensure my @FSCDems #coronavirus plan is made law. My plan calls for $2k to ea American, $15bn (updated) to fight homelessness, a freeze on evictions/foreclosures, &amp; no neg credit reporting during crisis! Let’s get it done! https://t.co/X2bmYYzpwf",2020-03-22 21:32:22+00:00,False,2053,805,6588,253,en,False,Twitter Web App,288,311,https://t.co/X2bmYYzpwf,https://twitter.com/RepMaxineWaters/status/1241840166853058560/photo/1,288,311,https://t.co/X2bmYYzpwf,https://twitter.com/RepMaxineWaters/status/1241840166853058560/photo/1,NA,NA,NA,NA
RepMaxineWaters,36686040,1241837811579392001,"My #coronavirus relief plan puts families, consumers, &amp; workers first. My plan recognizes that so many people in this country are worried about what happens when their mortgage/rent/car payments/bills are due! That's why I'm working w/ the House &amp; Senate to get my plan passed!",2020-03-22 21:23:01+00:00,False,2377,738,10392,149,en,False,Twitter Web App,NA,NA,NA,NA,NA,NA,NA,NA,NA,NA,NA,NA
RepMaxineWaters,36686040,1241837590942277633,"The Senate bailout bill must protect employees! There should be no firings, no layoffs, no cut in pay, no cut hrs, or diminishing health benefits/pensions. The bailout must not increase pay for CEOs, give bonuses, or allow for stock buybacks! America's workers MUST come first.",2020-03-22 21:22:08+00:00,False,2325,266,6666,121,en,False,Twitter Web App,NA,NA,NA,NA,NA,NA,NA,NA,NA,NA,NA,NA
RepMaxineWaters,36686040,1241837193657712644,"Trump is duplicitous &amp; causes confusion every time he opens up his lying mouth! He claimed to invoke the Defense Prod. Act, but later said he was waiting for the ""worst case scenario."" How many more people have to get sick or DIE until Trump exercises the full power of the DPA?",2020-03-22 21:20:33+00:00,False,1756,389,5638,120,en,False,Twitter Web App,NA,NA,NA,NA,NA,NA,NA,NA,NA,NA,NA,NA
RepMaxineWaters,36686040,1241837068013244418,"Our hospitals are out of gloves, masks, gowns, respirators, protective shoe coverings, and basic supplies!  What the hell more is Trump waiting for? Hey stupid, this is the worst case scenario!",2020-03-22 21:20:03+00:00,False,24592,16449,100435,4146,en,False,Twitter Web App,NA,NA,NA,NA,NA,NA,NA,NA,NA,NA,NA,NA
RepMaxineWaters,36686040,1241836936546877446,The way Dr. Fauci bowed his head in shame &amp; disgust listening to Trump spout his Fox News talking points is how all of us feel. People in this country are suffering enough. Why would media subject the American public to Trump’s daily LIES? Fauci should lead all pressers. Period!,2020-03-22 21:19:32+00:00,False,5552,1308,23678,355,en,False,Twitter Web App,NA,NA,NA,NA,NA,NA,NA,NA,NA,NA,NA,NA
RepMaxineWaters,36686040,1241836819362299906,"Shout out to @GavinNewsom &amp; @NYGovCuomo! This is what real leadership looks like. They are kicking ass &amp; doing so w/ empathy &amp; respect, taking care of our citizens while Trump is trying to make us believe he changed his mind about calling the #Coronavirus a hoax!",2020-03-22 21:19:04+00:00,False,1063,200,4057,69,en,False,Twitter Web App,NA,NA,NA,NA,NA,NA,NA,NA,NA,NA,NA,NA
