ScreenName,AuthorID,TweetID,Text,TweetDate,isReply,RetweetCount,ReplyCount,LikeCount,QuoteCount,Language,PossibleSensitive,Source,1stURLStart,1stURLEnd,1stURL,1stURLExp,2ndURLStart,2ndURLEnd,2ndURL,2ndURLExp,3rdURLStart,3rdURLEnd,3rdURL,3rdURLExp
RepMaxineWaters,36686040,1290281573938532352,"Trump put Postmaster DeJoy in charge of the postal service to dismantle the USPS &amp; sabotage vote by mail. New procedures are causing massive delays. Trump &amp; Repubs don’t believe in free &amp; fair elections. They’ll lie, cheat, &amp; steal to stay in power. We’ve got to fight back!",2020-08-03 13:41:14+00:00,False,13092,1928,37549,755,en,False,Twitter for iPhone,NA,NA,NA,NA,NA,NA,NA,NA,NA,NA,NA,NA
RepMaxineWaters,36686040,1290276369570516992,Republicans stop stalling! The $600 unemployement insurance has expired! You are playing political games while people are suffering. You didn’t care about spending money on the #GOPTaxScam but now want to cut benefits when people can’t find work! You’re making this crisis worse!,2020-08-03 13:20:33+00:00,False,1526,264,3854,76,en,False,Twitter for iPhone,NA,NA,NA,NA,NA,NA,NA,NA,NA,NA,NA,NA
RepMaxineWaters,36686040,1290276217904459776,"The federal moratorium on evictions has ended. The thought of children and families in danger of being thrown out on the street after a 30 day notice is unconscionable! We cannot let that happen. Republicans, have some compassion! Negotiate in good faith &amp; protect people in need!",2020-08-03 13:19:57+00:00,False,373,76,1182,26,en,False,Twitter for iPhone,NA,NA,NA,NA,NA,NA,NA,NA,NA,NA,NA,NA
RepMaxineWaters,36686040,1290276009082679296,"Make no mistake, a wannabe dictator who’ll tear gas his own citizens, invade American cities w/ unidentified federal troops, while using DOJ to get his criminal friends out of jail, will stop at nothing to stay in power! Trump won’t leave WH willingly. We must prepare now!",2020-08-03 13:19:07+00:00,False,4986,824,15307,288,en,False,Twitter for iPhone,NA,NA,NA,NA,NA,NA,NA,NA,NA,NA,NA,NA
RepMaxineWaters,36686040,1290030671381970946,"16THDAY! Trump, it’s been 16DAYS since I sent Cabinet a letter asking U to use the Defense Production Act to get more personal protective equipment to our hospitals &amp; clinics so desperately in need of equipment to deal with surge in #Coronavirus infections.#NoresponsePeopleRDying",2020-08-02 21:04:14+00:00,False,3242,491,9018,183,en,False,Twitter for iPhone,NA,NA,NA,NA,NA,NA,NA,NA,NA,NA,NA,NA
RepMaxineWaters,36686040,1289612538221649928,"15THDAY! Trump, it’s been 15DAYS since I sent Cabinet a letter asking U to use the Defense Production Act to get more personal protective equipment to our hospitals &amp; clinics so desperately in need of equipment to deal with surge in #Coronavirus infections.#NoresponsePeopleRDying",2020-08-01 17:22:43+00:00,False,1627,344,4410,86,en,False,Twitter for iPhone,NA,NA,NA,NA,NA,NA,NA,NA,NA,NA,NA,NA
RepMaxineWaters,36686040,1289236025080856580,"14THDAY! Trump, it’s been 14DAYS since I sent Cabinet a letter asking U to use the Defense Production Act to get more personal protective equipment to our hospitals &amp; clinics so desperately in need of equipment to deal with surge in #Coronavirus infections.#NoresponsePeopleRDying",2020-07-31 16:26:35+00:00,False,1542,301,4453,92,en,False,Twitter for iPhone,NA,NA,NA,NA,NA,NA,NA,NA,NA,NA,NA,NA
RepMaxineWaters,36686040,1288769631642161152,"13THDAY! Trump, it’s been 13DAYS since I sent Cabinet a letter asking U to use the Defense Production Act to get more personal protective equipment to our hospitals &amp; clinics so desperately in need of equipment to deal with surge in #Coronavirus infections.#NoresponsePeopleRDying",2020-07-30 09:33:19+00:00,False,1802,391,6067,99,en,False,Twitter for iPhone,NA,NA,NA,NA,NA,NA,NA,NA,NA,NA,NA,NA
RepMaxineWaters,36686040,1288203546266087424,"12THDAY! Trump, it’s been 12DAYS since I sent Cabinet a letter asking U to use the Defense Production Act to get more personal protective equipment to our hospitals &amp; clinics so desperately in need of equipment to deal with surge in #Coronavirus infections.#NoresponsePeopleRDying",2020-07-28 20:03:53+00:00,False,1193,316,3847,64,en,False,Twitter for iPhone,NA,NA,NA,NA,NA,NA,NA,NA,NA,NA,NA,NA
RepMaxineWaters,36686040,1287566414124113921,"11THDAY! Trump, it’s been 11DAYS since I sent Cabinet a letter asking U to use the Defense Production Act to get more personal protective equipment to our hospitals &amp; clinics so desperately in need of equipment to deal with surge in #Coronavirus infections.#NoresponsePeopleRDying",2020-07-27 01:52:09+00:00,False,3028,540,8922,136,en,False,Twitter for iPhone,NA,NA,NA,NA,NA,NA,NA,NA,NA,NA,NA,NA
RepMaxineWaters,36686040,1287085181581565953,"10THDAY! Trump, it’s been 10DAYS since I sent Cabinet a letter asking U to use the Defense Production Act to get more personal protective equipment to our hospitals &amp; clinics so desperately in need of equipment to deal with surge in #Coronavirus infections.#NoresponsePeopleRDying",2020-07-25 17:59:54+00:00,False,3151,471,8609,171,en,False,Twitter for iPhone,NA,NA,NA,NA,NA,NA,NA,NA,NA,NA,NA,NA
RepMaxineWaters,36686040,1286408911508176896,"8TH DAY! Trump, it’s been 8 DAYS since I sent Cabinet a letter asking U to use the Defense Production Act to get more personal protective equipment to our hospitals &amp; clinics so desperately in need of equipment to deal with surge in #Coronavirus infections.#NoresponsePeopleRDying",2020-07-23 21:12:39+00:00,False,2501,422,7002,125,en,False,Twitter for iPhone,NA,NA,NA,NA,NA,NA,NA,NA,NA,NA,NA,NA
RepMaxineWaters,36686040,1286078287824003072,"7TH DAY! Trump, it’s been 7 DAYS since I sent Cabinet a letter asking U to use the Defense Production Act to get more personal protective equipment to our hospitals &amp; clinics so desperately in need of equipment to deal with surge in #Coronavirus infections.#NoresponsePeopleRDying",2020-07-22 23:18:52+00:00,False,1865,344,5362,77,en,False,Twitter for iPhone,NA,NA,NA,NA,NA,NA,NA,NA,NA,NA,NA,NA
RepMaxineWaters,36686040,1285492212936171523,"Maxine Waters pulls over to check on cops making traffic stop https://www.daily
https://t.co/hlKgM6MYtT via @MailOnline",2020-07-21 08:30:01+00:00,False,345,310,2280,36,en,False,Twitter for Android,80,103,https://t.co/hlKgM6MYtT,http://mail.co.uk/video/news/video-2213544/Video-Maxine-Waters-pulls-check-cops-making-traffiuc-stop.html,NA,NA,NA,NA,NA,NA,NA,NA
RepMaxineWaters,36686040,1284368374299078656,"Rep. John Lewis has passed. It is not enough to say he was a revered civil rights icon. He was a man of impeccable integrity who dedicated his life to fighting against racism, discrimination &amp; injustice. John was a true leader who inspired us all to have the courage to fight.",2020-07-18 06:04:17+00:00,False,9067,565,49544,287,en,False,Twitter for iPhone,NA,NA,NA,NA,NA,NA,NA,NA,NA,NA,NA,NA
RepMaxineWaters,36686040,1283567019036741633,Hospitals! Trump is now telling you NOT to report #coronavirus data to the CDC. Tell him to GO TO HELL! Doesn’t he understand people are dying?? Report! Report! Report!,2020-07-16 00:59:59+00:00,False,24585,3182,80430,1487,en,False,Twitter for iPhone,NA,NA,NA,NA,NA,NA,NA,NA,NA,NA,NA,NA
RepMaxineWaters,36686040,1282785858987397121,Now this President is attempting to discredit our top medical expert Dr Fauci! Trump is shameless! He will attempt to destroy anyone who disagrees with him or interferes with his political agenda. Let’s not let this happen. Let’s use all our social media platforms to crush Trump!,2020-07-13 21:15:56+00:00,False,6375,1121,22140,423,en,False,Twitter for iPhone,NA,NA,NA,NA,NA,NA,NA,NA,NA,NA,NA,NA
RepMaxineWaters,36686040,1281794009560645632,"No surprise! Trump commutes Roger Stone’s sentence. B4 Trump leaves office, he’ll ensure all his crooked friends are free to launder $, commit fraud, do dirty deals w/ Russians, tax evasion, commit treason, &amp; sell out our democracy! Dems impeached, Rep Senators failed to remove!",2020-07-11 03:34:41+00:00,False,5689,1711,22058,351,en,False,Twitter for iPhone,NA,NA,NA,NA,NA,NA,NA,NA,NA,NA,NA,NA
RepMaxineWaters,36686040,1281735295281569796,#SCOTUS has now laid out a 4 part test that our subpoenas must meet and remanded the case back to the district court for further proceedings. I will continue to move forward with the case and am confident we will meet the standards set by the Court.,2020-07-10 23:41:22+00:00,False,261,153,1215,14,en,False,Twitter for iPhone,NA,NA,NA,NA,NA,NA,NA,NA,NA,NA,NA,NA
RepMaxineWaters,36686040,1281734982084579328,"Dirty DOG Barr is scheduled to come before the Judiciary Committee. It’s hard to believe Trump will even allow him to testify. Don’t forget, Barr is Trump’s puppet &amp; Trump may still do what he’s done w/ others &amp; deny Barr’s appearance. They are afraid the truth will come out!",2020-07-10 23:40:07+00:00,False,658,393,2287,54,en,False,Twitter for iPhone,NA,NA,NA,NA,NA,NA,NA,NA,NA,NA,NA,NA
RepMaxineWaters,36686040,1281734627347107841,"I believe former US Atty Berman told the truth about Dirty Dog Barr. Barr was following thru w/ his dirty deeds for the president, pressuring Berman to quit &amp; telling him that if he would not resign, his career would be ruined! Dirty Dog Barr always up to his dirty tricks!",2020-07-10 23:38:43+00:00,False,1153,353,4719,85,en,False,Twitter for iPhone,NA,NA,NA,NA,NA,NA,NA,NA,NA,NA,NA,NA
RepMaxineWaters,36686040,1281397488646316034,.@JoyAnnReid is one of the most articulate &amp; brilliant writers &amp; broadcasters that has ever graced the screen of any network. I’m so proud of MSNBC for recognizing her intellect &amp; value to millions of people in this country! Congratulations Joy!,2020-07-10 01:19:03+00:00,False,1011,320,8490,56,en,False,Twitter for iPhone,NA,NA,NA,NA,NA,NA,NA,NA,NA,NA,NA,NA
RepMaxineWaters,36686040,1280716900108886016,"Trump said 99% of #COVID19 cases are harmless. Trump is a 99% LIAR! First he called it a hoax, then told people to drink disinfectant; then he said it would disappear. Where are the masks, gloves, &amp; PPE? Everyone knows Trump is a liar. Ignore his advice! We’ll get him out in Nov!",2020-07-08 04:14:38+00:00,False,9384,2142,40871,589,en,False,Twitter for iPhone,NA,NA,NA,NA,NA,NA,NA,NA,NA,NA,NA,NA
RepMaxineWaters,36686040,1277995050916405248,"The revelation that Trump denied support &amp; protection for American troops can be squarely placed on the shoulders of hardcore GOP Trump lovers who accepted his lies, his love of dictators, &amp; the disregard for the Constitution he’s demonstrated throughout his tenure.",2020-06-30 15:58:58+00:00,False,2230,570,6445,111,en,False,Twitter for iPhone,NA,NA,NA,NA,NA,NA,NA,NA,NA,NA,NA,NA
RepMaxineWaters,36686040,1277963281634713603,"Trump still refuses to wear a mask. Trump’s FAILED leadership &amp; his unfortunate followers not wearing masks &amp; not social distancing is responsible for the growing infections, death, &amp; surge in #coronavirus cases.",2020-06-30 13:52:44+00:00,False,587,334,2096,52,en,False,Twitter for iPhone,NA,NA,NA,NA,NA,NA,NA,NA,NA,NA,NA,NA
RepMaxineWaters,36686040,1277963001534939138,"All should be worried about the overcrowding of ICUs in our hospitals &amp; the inability for individuals to self isolate that will cause even more #coronavirus infections. Mayors &amp; city councilmembers, please negotiate for unused hotel rooms paid for by the feds 4 patient isolation!",2020-06-30 13:51:37+00:00,False,256,121,864,9,en,False,Twitter for iPhone,NA,NA,NA,NA,NA,NA,NA,NA,NA,NA,NA,NA
RepMaxineWaters,36686040,1277962687142486027,"This Administration encouraged the opening up of businesses, disregarded medical experts’ advice, &amp; denounced governors who were cautious and now GA, AZ, TX, &amp; FL infection cases are surging with skyrocketing numbers!",2020-06-30 13:50:22+00:00,False,633,240,1832,50,en,False,Twitter for iPhone,NA,NA,NA,NA,NA,NA,NA,NA,NA,NA,NA,NA
RepMaxineWaters,36686040,1277962095452057602,"Thank you @GavinNewsom for all that he has tried to do to fight #COVID19 &amp; now realizes that he must get even tougher &amp; is now closing nightclubs and bars, shutting down beaches, insisting on masks, and is determined to flatten the curve!",2020-06-30 13:48:01+00:00,False,426,281,3013,35,en,False,Twitter for iPhone,NA,NA,NA,NA,NA,NA,NA,NA,NA,NA,NA,NA
RepMaxineWaters,36686040,1277961836852211712,My early warnings about Trump &amp; his love &amp; defense of Putin have become more evident as Trump is lying about his knowledge of Putin’s BOUNTY on our soldiers in Afghanistan!Trump has failed the most important indication of patriotism to our country!,2020-06-30 13:46:59+00:00,False,1059,234,4033,62,en,False,Twitter for iPhone,NA,NA,NA,NA,NA,NA,NA,NA,NA,NA,NA,NA
RepMaxineWaters,36686040,1277960700057403393,Why can’t the elected officials chosen by their constituents realize Trump has long been compromised by Putin &amp; is simply a Russian asset? He will never denounce Putin! Trump made a deal w/ the devil in exchange for Putin’s help in his election campaign. He sold out our country!,2020-06-30 13:42:28+00:00,False,4995,1093,15478,395,en,False,Twitter for iPhone,NA,NA,NA,NA,NA,NA,NA,NA,NA,NA,NA,NA
RepMaxineWaters,36686040,1277960351716278272,Trump retweeted a supporter at The Villages golf course who shouted WHITE POWER. Trump’s campaign w/ key strategist Bannon was organized on the bet that racism &amp; an appeal to white supremacists is a winning formula. The Trump white power retweet is consistent w/ his strategy.,2020-06-30 13:41:05+00:00,False,472,181,1846,26,en,False,Twitter for iPhone,NA,NA,NA,NA,NA,NA,NA,NA,NA,NA,NA,NA
RepMaxineWaters,36686040,1274138321556574209,"Why we celebrate #Juneteenth: It was on June 19, 1865, 2 1/2 years after Lincoln signed the Emancipation Proclamation, that Black slaves learned about their freedom. Trump needs to stop lying about what he does not know. He is a hopeless case.",2020-06-20 00:33:42+00:00,False,401,344,1715,35,en,False,Twitter for iPhone,NA,NA,NA,NA,NA,NA,NA,NA,NA,NA,NA,NA
RepMaxineWaters,36686040,1274137928478994432,"On this #JuneteenthDay, I want to pay a special tribute to my friend, the late former Rep. Al Edwards (D-TX) who was responsible for making Juneteenth a state holiday in Texas. He was a trailblazer &amp; knew how important it was to honor black history. Thank you Al Edwards!",2020-06-20 00:32:09+00:00,False,317,98,1561,7,en,False,Twitter for iPhone,NA,NA,NA,NA,NA,NA,NA,NA,NA,NA,NA,NA
RepMaxineWaters,36686040,1274136780091129857,"Tonight, I will speak to several thousand CA college &amp; university graduates. Juneteenth was chosen by the organizers of #Brunch2Bomb to remind the graduates from whence we’ve come, how far we’ve come, &amp; how much further these young brilliant minds are going to take us!",2020-06-20 00:27:35+00:00,False,109,101,640,6,en,False,Twitter for iPhone,NA,NA,NA,NA,NA,NA,NA,NA,NA,NA,NA,NA
RepMaxineWaters,36686040,1274136033693761536,"One must understand that if right wing war hawk Bolton has turned against Trump, &amp; is revealing conversations he heard of Trump soliciting Pres Xi to help him win reelection in 2020, that Trump is worse than you ever thought: a deplorable underminer of our democracy &amp; a traitor!",2020-06-20 00:24:37+00:00,False,944,327,3513,55,en,False,Twitter for iPhone,NA,NA,NA,NA,NA,NA,NA,NA,NA,NA,NA,NA
RepMaxineWaters,36686040,1274134361839935491,Trump threatening protestors from exercising their constitutional right to freedom of assembly. He’s goading the protestors &amp; will be responsible for confrontation &amp; violence in Tulsa. He’s not beyond tear gassing &amp; probably has the military on alert. Mad man needs to be stopped!,2020-06-20 00:17:58+00:00,False,3805,1246,13941,289,en,False,Twitter for iPhone,NA,NA,NA,NA,NA,NA,NA,NA,NA,NA,NA,NA
RepMaxineWaters,36686040,1272657926461718529,"Watch the video of the killing of #RayshardBrooks. A senseless &amp; needless killing by a murderous cop! Police reform is NOT ENOUGH. Getting rid of serial, racist, ignorant, &amp; stupid cops must be a top priority. Let’s call them out! Police protective unions, you’ve got to go too!",2020-06-15 22:31:09+00:00,False,1438,1370,5279,206,en,False,Twitter for iPhone,NA,NA,NA,NA,NA,NA,NA,NA,NA,NA,NA,NA
RepMaxineWaters,36686040,1272654388566384641,"SCOTUS got it right! The quest for fairness &amp; non discrimination towards the LGBTQ community has been a tough fight, but when you fight, you win! Kudos to the LGBTQ community for its principled uncompromising struggle that will benefit so many in our society! The fight continues!",2020-06-15 22:17:05+00:00,False,333,153,2032,12,en,False,Twitter for iPhone,NA,NA,NA,NA,NA,NA,NA,NA,NA,NA,NA,NA
RepMaxineWaters,36686040,1271223847224848387,Kudos to Defense Sec Esper &amp; Joint Chiefs Chm Milley! They’re resisting Trump who believes he can use the military agst. American protestors. These officials have put their careers on the line to protect our democracy! We must all rally agst. the draft dodging Commander in Chief!,2020-06-11 23:32:38+00:00,False,1923,370,7345,89,en,False,Twitter for iPhone,NA,NA,NA,NA,NA,NA,NA,NA,NA,NA,NA,NA
RepMaxineWaters,36686040,1271220922410770432,"Forty percent of #COVID19 deaths are the elderly in nursing homes. I’m demanding more tests &amp; PPE for workers &amp; patients, higher wages, and 2-weeks paid leave for nursing home workers. Both workers &amp; patients are dying! This is America! We can do better than this!",2020-06-11 23:21:00+00:00,False,860,281,3068,48,en,False,Twitter for iPhone,NA,NA,NA,NA,NA,NA,NA,NA,NA,NA,NA,NA
RepMaxineWaters,36686040,1270151898763538435,WATCH: Avalon Gardens Public Housing Mask Distribution with Rep. Maxine Waters &amp; @HACLA1938 via  @CBSLA https://t.co/w8YHqBV5h8,2020-06-09 00:33:05+00:00,False,70,113,270,10,en,False,Twitter for iPhone,108,131,https://t.co/w8YHqBV5h8,https://youtu.be/JBSX_AzzZtg,NA,NA,NA,NA,NA,NA,NA,NA
RepMaxineWaters,36686040,1270146856228659202,We can’t forget about our public housing residents &amp; their need to be safe. @HACLA1938 President Doug Guthrie &amp; I distributed masks and a list of COVID-19 testing sites to Avalon Gardens Public Housing Development residents in my District. More info: https://t.co/qznnmxpgD9 https://t.co/arKCVXVgAT,2020-06-09 00:13:03+00:00,False,150,147,822,17,en,False,Twitter for iPhone,259,282,https://t.co/qznnmxpgD9,https://waters.house.gov/media-center/press-releases/rep-maxine-waters-hacla-deliver-masks-covid-19-testing-info-avalon,283,306,https://t.co/arKCVXVgAT,https://twitter.com/RepMaxineWaters/status/1270146856228659202/photo/1,283,306,https://t.co/arKCVXVgAT,https://twitter.com/RepMaxineWaters/status/1270146856228659202/photo/1
RepMaxineWaters,36686040,1269038626911944709,"Trump brought in the FBI, Homeland Security, Natl Guard, active duty military troops, &amp; helicopters to use against our citizens &amp; our young people protesting against the killing of unarmed people of color. He is amassing the power of a dictator. Stop him! Join the resistance!",2020-06-05 22:49:20+00:00,False,7730,1435,23363,389,en,False,Twitter for iPhone,NA,NA,NA,NA,NA,NA,NA,NA,NA,NA,NA,NA
RepMaxineWaters,36686040,1269038270064844801,Is there one brave member of Trump’s cabinet who would move to initiate the 25th amendment to remove him from office? Now is the time to save our country before this would-be dictator takes us all down!,2020-06-05 22:47:55+00:00,False,32427,18764,154180,5028,en,False,Twitter for iPhone,NA,NA,NA,NA,NA,NA,NA,NA,NA,NA,NA,NA
RepMaxineWaters,36686040,1269037172637786114,"As the world focuses on protests &amp; unites in the denouncement of the killings of unarmed black people, #BreonnaTaylor is not forgotten. Had she lived, she would’ve been 27 yrs old today. Breonna, your death was not in vain. We are fighting for you.",2020-06-05 22:43:34+00:00,False,962,126,3449,30,en,False,Twitter for iPhone,NA,NA,NA,NA,NA,NA,NA,NA,NA,NA,NA,NA
RepMaxineWaters,36686040,1266824298095955970,"Trump is removing the US from the World Health Organization. He did this on Paris climate agreement, Iran nuclear deal, TransPacificPartnership, NAFTA, open skies treaty &amp; is threatening to w/draw from WTO. Pulling US from WHO during pandemic is a would-be dictator on the move!",2020-05-30 20:10:23+00:00,False,8860,1905,29482,540,en,False,Twitter for iPhone,NA,NA,NA,NA,NA,NA,NA,NA,NA,NA,NA,NA
RepMaxineWaters,36686040,1266819445726556160,"Instead of Trump instigating, threatening, &amp; being anxious to call out the military, he should tell the truth abt the number of people dying from #COVID19 &amp; ensure medical &amp; survival equipment reach hospitals &amp; clinics. Trump has failed on his duty &amp; responsibility to our country",2020-05-30 19:51:06+00:00,False,894,363,2648,76,en,False,Twitter for iPhone,NA,NA,NA,NA,NA,NA,NA,NA,NA,NA,NA,NA
RepMaxineWaters,36686040,1266817790197075968,"The Constitution guarantees us the right to free speech, assembly, &amp; the right to protest. The Constitution has been strengthened by amendments &amp; Court decisions to guarantee equal rights for ALL people. I get my inspiration from Patrick Henry: “Give me liberty or give me death!”",2020-05-30 19:44:32+00:00,False,777,323,2682,60,en,False,Twitter for iPhone,NA,NA,NA,NA,NA,NA,NA,NA,NA,NA,NA,NA
RepMaxineWaters,36686040,1266814451245813760,"According to the Constitution, Barr should be the people’s attorney, but he’s Trump’s lackey. Who would ever believe George Floyd’s family &amp; blacks will ever get justice from this racist president or anyone in his admin that he controls, including his majority on Supreme Court.",2020-05-30 19:31:16+00:00,False,2414,346,7052,99,en,False,Twitter for iPhone,NA,NA,NA,NA,NA,NA,NA,NA,NA,NA,NA,NA
RepMaxineWaters,36686040,1266812840326897665,"George Floyd cried out “I can’t breathe!” In his dying moments, he called for his mom. Black moms all over America must be struck by the realization that could’ve been their unarmed black son being killed by a murderous cop.",2020-05-30 19:24:52+00:00,False,3013,368,10853,171,en,False,Twitter for iPhone,NA,NA,NA,NA,NA,NA,NA,NA,NA,NA,NA,NA
RepMaxineWaters,36686040,1266811993983537164,"Trump threatened protestors in front of WH that he would call out vicious dogs &amp; ominous weapons. Trump’s the most VICIOUS DOG we know &amp;
we’re not afraid of him! He’s dog whistling to white supremacists that he’ll save them from black people. We all need to be saved from Trump!",2020-05-30 19:21:30+00:00,False,4021,1113,13008,253,en,False,Twitter for iPhone,NA,NA,NA,NA,NA,NA,NA,NA,NA,NA,NA,NA
RepMaxineWaters,36686040,1266809613388824577,ALERT-Let’s all be smart. Don’t allow Crazy Trump to sucker us into confrontations that allows him to realize his threat to call out the military in response to protests in Minn &amp; around the country. Attn must be focused on the murder of George Floyd! Protests are LEGAL!,2020-05-30 19:12:02+00:00,False,8232,1630,31523,417,en,False,Twitter for iPhone,NA,NA,NA,NA,NA,NA,NA,NA,NA,NA,NA,NA
RepMaxineWaters,36686040,1264749041327525889,"Trump claims to be taking #Hydroxychloroquine but why should we believe him when he lies all the time? Maybe it’s just a good marketing job to get others to take it so that he can profit from his investment. Latest info on #hydroxychloroquine is that it causes death, SOOOO??",2020-05-25 02:44:04+00:00,False,1479,1145,5723,174,en,False,Twitter for iPhone,NA,NA,NA,NA,NA,NA,NA,NA,NA,NA,NA,NA
RepMaxineWaters,36686040,1264748058979467271,"Trump is a dangerous example for children and those who tend to follow him. Not wearing a mask and not social distancing is dangerous. Do not follow his example. Protect yourself. Coronavirus kills! Maybe this ignoramus doesn’t care, but you should care about yourself!",2020-05-25 02:40:09+00:00,False,1289,376,4628,79,en,False,Twitter for iPhone,NA,NA,NA,NA,NA,NA,NA,NA,NA,NA,NA,NA
RepMaxineWaters,36686040,1264747712416751617,"Trump owns AG Barr; Pompeo at State Dept; &amp; Kushner at FEMA, controlling PPE. NOW he’s undermined the US Postal Service &amp; installed a GOP fundraiser to run it. Control of the USPS is control of vote by mail! HELL NO! We’re not going to let Trump get away w/ dismantling the USPS!",2020-05-25 02:38:47+00:00,False,5838,964,16250,360,en,False,Twitter for iPhone,NA,NA,NA,NA,NA,NA,NA,NA,NA,NA,NA,NA
RepMaxineWaters,36686040,1264747145246187520,"Trump slammed Obama for playing golf after 2nd US Ebola case in 2014 &amp; today Trump was on his 2nd golf day as US approaches 100,000 #coronavirus deaths. Trump has implied COVID19 deaths may be his price for repairing the economy. He has no conscience! No empathy. No humanity!",2020-05-25 02:36:31+00:00,False,2099,380,6510,110,en,False,Twitter for iPhone,NA,NA,NA,NA,NA,NA,NA,NA,NA,NA,NA,NA
RepMaxineWaters,36686040,1264746662783746054,"A word of caution to the filthy people purposely spitting &amp; coughing in the faces of grocery clerks, law enforcement, &amp; others: cease &amp; desist this horrible behavior! Not everybody is going to be nonviolent! Just stop it!",2020-05-25 02:34:36+00:00,False,11559,1862,58089,1076,en,False,Twitter for iPhone,NA,NA,NA,NA,NA,NA,NA,NA,NA,NA,NA,NA
RepMaxineWaters,36686040,1262567699432996864,"Trump says he’s been taking #Hydroxychloroquine for almost 2 wks. Don’t do as Trump does or suggests. Any disinfectant, like bleach or Lysol, &amp; ultraviolet light are not remedies. His unhinged notions could cause your death. He’d just say you sacrificed your life for the economy!",2020-05-19 02:16:11+00:00,False,2509,1816,9425,282,en,False,Twitter for iPhone,NA,NA,NA,NA,NA,NA,NA,NA,NA,NA,NA,NA
