ScreenName,AuthorID,TweetID,Text,TweetDate,isReply,RetweetCount,ReplyCount,LikeCount,QuoteCount,Language,PossibleSensitive,Source,1stURLStart,1stURLEnd,1stURL,1stURLExp,2ndURLStart,2ndURLEnd,2ndURL,2ndURLExp,3rdURLStart,3rdURLEnd,3rdURL,3rdURLExp
MarcoRubio,15745368,1501355402633617412,"#Maduro took American hostages to use as a chit when the time came to take advantage of a weak President

He will gladly trade them &amp; agree to negotiations with the opposition that will lead to nothing to get his hands of millions of $ in sanctions relief https://t.co/R0MO1eDKAu",2022-03-09 00:33:16+00:00,False,227,147,545,17,en,False,Twitter for iPad,260,283,https://t.co/R0MO1eDKAu,https://www.nytimes.com/2022/03/08/world/americas/venezuela-american-prisoner-release.html,NA,NA,NA,NA,NA,NA,NA,NA
MarcoRubio,15745368,1501353197302079489,"#Putin doesn’t have many economic weapons at his disposal

But he has a few:

- @Boeing⁩ buys much of its titanium from #Russia 

- #India gets much of its fertilizer from Russia 

-#Egypt &amp; #Lebanon get much of their wheat from Russia &amp; #Ukraine
 https://t.co/QCi8SR9Evt",2022-03-09 00:24:30+00:00,False,112,120,419,7,en,False,Twitter for iPad,256,279,https://t.co/QCi8SR9Evt,https://www.wsj.com/articles/russia-set-to-ban-commodity-exports-following-western-sanctions-11646768260,NA,NA,NA,NA,NA,NA,NA,NA
MarcoRubio,15745368,1501350559164551172,"Tonight I passed yet another bill 

The Senate just passed my South Florida Clean Coastal Waters Act which will assess the causes of algal blooms in Lake Okeechobee &amp; #Florida’s southern coastlines,identify needed resources &amp; develop a plan of action to address it 

#AnotherOne",2022-03-09 00:14:01+00:00,False,106,356,1022,30,en,False,Twitter for iPad,NA,NA,NA,NA,NA,NA,NA,NA,NA,NA,NA,NA
MarcoRubio,15745368,1501348317959180292,"I hope the Saudis &amp; Emiratis reconsider

But the message here to Biden is very clear

If you are going to demand they exercise “restraint” when they get attacked by #Iran, they are also going to exercise “restraint” when #Russia attacks a European country
 https://t.co/jLOQu5hQKH",2022-03-09 00:05:07+00:00,False,319,290,874,72,en,False,Twitter for iPad,261,284,https://t.co/jLOQu5hQKH,https://www.wsj.com/articles/saudi-emirati-leaders-decline-calls-with-biden-during-ukraine-crisis-11646779430?mod=e2tw,NA,NA,NA,NA,NA,NA,NA,NA
MarcoRubio,15745368,1501310881702973447,"#Putin believes his destiny is to restore #Russia as a great power

He believes they can’t be a great power without #Ukraine &amp; invasion was the only way to achieve it

He expected little resistance &amp; quick victory

And now he realizes he’s in trouble if he is seen as backing down",2022-03-08 21:36:21+00:00,False,319,349,1599,30,en,False,Twitter for iPad,NA,NA,NA,NA,NA,NA,NA,NA,NA,NA,NA,NA
MarcoRubio,15745368,1501306332485337089,"#Putin knew we was going to get sanctioned after he invaded 

He was planning on using #Russia’s reserves as a buffer 

But according to @StateDept virtually all of their foreign currency reserves are frozen &amp; inaccessible to them",2022-03-08 21:18:17+00:00,False,358,262,1863,38,en,False,Twitter for iPad,NA,NA,NA,NA,NA,NA,NA,NA,NA,NA,NA,NA
MarcoRubio,15745368,1501299527659274247,"DANGER!!!
This is how #Russia sets up false flags 

If there is a biological weapons incident in #Ukraine be 100% certain its the Russians who did it https://t.co/r5F0q0rUvr",2022-03-08 20:51:14+00:00,False,780,598,2075,148,en,False,Twitter for iPad,150,173,https://t.co/r5F0q0rUvr,https://twitter.com/marcorubio/status/1501299527659274247/photo/1,NA,NA,NA,NA,NA,NA,NA,NA
MarcoRubio,15745368,1501234713662525447,"In the areas of #Ukraine that #Russia now “controls” their military units are in need of reinforcement &amp; they face a hostile population &amp; constant ambushes of long supply lines 

This is increasingly forcing them to pick between new advances &amp; holding on to areas they “control” https://t.co/o3AfXLj63p",2022-03-08 16:33:41+00:00,False,213,218,675,16,en,False,Twitter for iPad,291,314,https://t.co/o3AfXLj63p,https://twitter.com/marcorubio/status/1501234713662525447/photo/1,NA,NA,NA,NA,NA,NA,NA,NA
MarcoRubio,15745368,1501219231165255683,"Estados Unidos no necesita una sola gota de petróleo de #Maduro, podemos producir más que suficiente aquí si Biden lo permitiera 

#Venezuela https://t.co/O1BWCeiqYd",2022-03-08 15:32:10+00:00,False,1199,345,2479,122,es,False,Twitter for iPad,142,165,https://t.co/O1BWCeiqYd,https://twitter.com/marcorubio/status/1501219231165255683/video/1,NA,NA,NA,NA,NA,NA,NA,NA
MarcoRubio,15745368,1501216660115570693,"I am glad Biden finally cut off the oil from #Russia 

Now replace it with American oil https://t.co/6SUfb465QD",2022-03-08 15:21:57+00:00,False,788,713,4384,95,en,False,Twitter for iPad,88,111,https://t.co/6SUfb465QD,https://twitter.com/marcorubio/status/1501216660115570693/video/1,NA,NA,NA,NA,NA,NA,NA,NA
MarcoRubio,15745368,1501213159935426566,"#Iran oil is fueling Russia's war crimes

Reviving the failed #IranDeal,will fill the coffers of a murderous,terrorist regime, without putting an end to Iran’s nuclear weaponization

 https://t.co/8FuHuyuAOu #FoxNews",2022-03-08 15:08:03+00:00,False,145,132,472,12,en,False,Twitter for iPad,184,207,https://t.co/8FuHuyuAOu,https://www.foxnews.com/opinion/iran-oil-russia-war-machine-us-sanctions-tehran-sen-marco-rubio,NA,NA,NA,NA,NA,NA,NA,NA
MarcoRubio,15745368,1501195430587158537,"#Venezuela produces less than 1% of the worlds oil because it is mismanaged by corrupt &amp; incompetent criminals

An oil deal with the #Maduro to will have an insignificant impact on our gas prices

But it will provide #MaduroRegime with millions of dollars for them to steal",2022-03-08 13:57:36+00:00,False,424,224,1474,24,en,False,Twitter for iPad,NA,NA,NA,NA,NA,NA,NA,NA,NA,NA,NA,NA
MarcoRubio,15745368,1501194241397215241,"We import 200,000 barrels of oil a day from #Russia 

America can easily produce another 200,000 barrels a day

We don’t need oil from a terrorist Ayatollah in #Iran or narco-terror #MaduroRegime in #Venezuela",2022-03-08 13:52:52+00:00,False,1956,864,9944,131,en,False,Twitter for iPad,NA,NA,NA,NA,NA,NA,NA,NA,NA,NA,NA,NA
MarcoRubio,15745368,1501189641151696898,"Stop importing Russian oil

Start producing more American oil again 

That’s the plan",2022-03-08 13:34:35+00:00,False,1128,1474,8079,177,en,False,Twitter for iPad,NA,NA,NA,NA,NA,NA,NA,NA,NA,NA,NA,NA
MarcoRubio,15745368,1501189287164928006,"“Our Father in heaven,hallowed be your name,your kingdom come,your will be done,on earth as in heaven.Give us today our daily bread;and forgive us our debts,as we forgive our debtors;and do not subject us to the final test,but deliver us from the evil one”

Matthew 6:9-13",2022-03-08 13:33:11+00:00,False,238,597,2064,52,en,False,Twitter for iPad,NA,NA,NA,NA,NA,NA,NA,NA,NA,NA,NA,NA
MarcoRubio,15745368,1501038590528262148,"Aquí está, como les dije antes, la Casa Blanca ofreció abandonar a quienes buscan la libertad de #Venezuela a cambio de una cantidad insignificante de petróleo y este anuncio del narcodictador #Maduro https://t.co/9tKX0vknKG",2022-03-08 03:34:22+00:00,False,221,156,400,32,es,False,Twitter for iPad,201,224,https://t.co/9tKX0vknKG,https://twitter.com/ReporteYa/status/1501030346703486982,NA,NA,NA,NA,NA,NA,NA,NA
MarcoRubio,15745368,1501038220712325122,"Here it is, as I told you earlier the White House offered to abandon those seeking freedom from #Venezuela in exchange for an insignificant amount of oil &amp; this announcement below from the narco-dictator #Maduro https://t.co/9tKX0vknKG",2022-03-08 03:32:54+00:00,False,235,174,619,16,en,False,Twitter for iPad,216,239,https://t.co/9tKX0vknKG,https://twitter.com/ReporteYa/status/1501030346703486982,NA,NA,NA,NA,NA,NA,NA,NA
MarcoRubio,15745368,1501031799811710977,"#Ukraine is a complicated &amp; unpredictable crisis

#Putin is facing either a costly military victory &amp; occupation or a quagmire

His economy is falling  &amp; discontent is rising

And if this invasion ends in humiliation or the perception he backed down he will be removed from power",2022-03-08 03:07:23+00:00,False,236,260,1350,20,en,False,Twitter for iPad,NA,NA,NA,NA,NA,NA,NA,NA,NA,NA,NA,NA
MarcoRubio,15745368,1501029874491875334,"#Putin now has a substantial majority of his total conventional military forces deployed inside of #Ukraine 

If enough of these deployed assets are captured, destroyed or stuck there, #Russia will be left vulnerable along all its other borders for a long time",2022-03-08 02:59:44+00:00,False,638,421,3161,66,en,False,Twitter for iPad,NA,NA,NA,NA,NA,NA,NA,NA,NA,NA,NA,NA
MarcoRubio,15745368,1501028230718967817,"I am working on legislation that would impose sanctions on #China if we catch trying to use their Cross-Border International Payments System (CIPS) to help #Russia get around SWIFT sanctions

 https://t.co/SWFg8pr7Vp",2022-03-08 02:53:12+00:00,False,623,257,1735,103,en,False,Twitter for iPad,193,216,https://t.co/SWFg8pr7Vp,https://www.marketplace.org/2022/03/01/could-chinas-payments-system-be-a-swift-workaround-for-russia/,NA,NA,NA,NA,NA,NA,NA,NA
MarcoRubio,15745368,1501025896966332417,"This isn’t the war #Russia planned for

#Putin envisioned air dominance in first 24 hrs,taking #Kyiv in 72hrs &amp; installing a puppet govt within a week

Instead he is in a quagmire &amp; his best possible outcome now is a costly victory &amp; a long military occupation battling insurgents",2022-03-08 02:43:56+00:00,False,286,225,1571,17,en,False,Twitter for iPad,NA,NA,NA,NA,NA,NA,NA,NA,NA,NA,NA,NA
MarcoRubio,15745368,1501003481804644356,"Biden envió a su equipo a una reunión secreta con #Maduro en #Venezuela

Y le hicieron una vergonzosa oferta al narco-dictador https://t.co/M2oIC1kkEj",2022-03-08 01:14:52+00:00,False,3156,1539,5608,635,es,False,Twitter for iPad,127,150,https://t.co/M2oIC1kkEj,https://twitter.com/marcorubio/status/1501003481804644356/video/1,NA,NA,NA,NA,NA,NA,NA,NA
MarcoRubio,15745368,1501002803862548485,The only country Biden wont buy more oil from is America https://t.co/5aXZUHVgSy,2022-03-08 01:12:10+00:00,False,896,944,3985,106,en,False,Twitter for iPad,57,80,https://t.co/5aXZUHVgSy,https://twitter.com/marcorubio/status/1501002803862548485/video/1,NA,NA,NA,NA,NA,NA,NA,NA
MarcoRubio,15745368,1500997574324629510,"Biden is begging to buy more oil from Saudi Arabia

Biden is offering to buy more oil from #MaduroRegime 

Biden is desperate to buy more oil from #Iran

The only ones he refuses to buy more oil from is Americans",2022-03-08 00:51:23+00:00,False,1303,947,5739,100,en,False,Twitter for iPad,NA,NA,NA,NA,NA,NA,NA,NA,NA,NA,NA,NA
MarcoRubio,15745368,1500997002502590465,"Biden’s people told #Maduro they would lift sanctions if he sells us some oil &amp; announces a future date for negotiations with opposition 

#Venezuela doesn’t produce enough oil to make a difference

And Maduro has repeatedly used negotiations to buy time &amp; divide the opposition",2022-03-08 00:49:07+00:00,False,294,209,1006,32,en,False,Twitter for iPad,NA,NA,NA,NA,NA,NA,NA,NA,NA,NA,NA,NA
MarcoRubio,15745368,1500940810455502861,#Putin would not hesitate to stage or carry out a biological weapon false flag in #Ukraine and this is the kind of messaging you would see as a prelude to him doing that https://t.co/a8OpRu7hyF,2022-03-07 21:05:50+00:00,False,489,379,1460,69,en,False,Twitter for iPad,170,193,https://t.co/a8OpRu7hyF,https://twitter.com/marcorubio/status/1500940810455502861/photo/1,NA,NA,NA,NA,NA,NA,NA,NA
MarcoRubio,15745368,1500870017847635972,"#Venezuela’s oil industry is in shambles 

Because of marxist incompetence &amp; corruption it will takes years before they can produce enough to even come close to replacing #PutinOil

Biden is just using this as an excuse to cut the deal with the #Maduro he has wanted all along https://t.co/xbmx0nBKor",2022-03-07 16:24:31+00:00,False,320,376,896,37,en,False,Twitter for iPad,281,304,https://t.co/xbmx0nBKor,https://twitter.com/marcorubio/status/1500870017847635972/photo/1,NA,NA,NA,NA,NA,NA,NA,NA
MarcoRubio,15745368,1500868947251445761,Apparently Biden thinks producing more of our own oil in America is bad for the climate but somehow producing more oil in #Venezuela is not https://t.co/D8h6hvaeWu,2022-03-07 16:20:16+00:00,False,1513,1026,6444,166,en,False,Twitter for iPad,140,163,https://t.co/D8h6hvaeWu,https://twitter.com/marcorubio/status/1500868947251445761/photo/1,NA,NA,NA,NA,NA,NA,NA,NA
MarcoRubio,15745368,1500868219120332805,Que Biden organice reuniones secretas con el narcoterrorista #Maduro sin siquiera informar a los venezolanos que han sufrido y arriesgado todo oponiéndose a Maduro es una vil traición #Venezuela https://t.co/JNyF8osfy7,2022-03-07 16:17:22+00:00,False,401,197,957,47,es,False,Twitter for iPad,195,218,https://t.co/JNyF8osfy7,https://twitter.com/marcorubio/status/1500868219120332805/photo/1,NA,NA,NA,NA,NA,NA,NA,NA
MarcoRubio,15745368,1500857367323455506,"America can easily replace #PutinOil by producing more of our own 

Instead the Biden plan is to beg Saudi Arabia to produce more,buy more from a narco terrorist #MaduroRegime in #Venezuela &amp; cut a deal with the worlds leading state sponsor of terror in #Iran",2022-03-07 15:34:15+00:00,False,846,735,3158,117,en,False,Twitter for iPad,NA,NA,NA,NA,NA,NA,NA,NA,NA,NA,NA,NA
MarcoRubio,15745368,1500841266808078342,"Biden Admin secret meeting with #Maduro was a huge PR boost for #MaduroRegime

And a demoralizing betrayal of those who have risked everything to oppose Maduro &amp; weren’t even told this was happening

And for what?The amount of oil #Venezuela can produce right now is insignificant",2022-03-07 14:30:16+00:00,False,860,550,3068,77,en,False,Twitter for iPad,NA,NA,NA,NA,NA,NA,NA,NA,NA,NA,NA,NA
MarcoRubio,15745368,1500835807548035074,"Thank you to the first responders from various agencies who helped rescue our veterans from their nursing home that was being threatened by the NW #Florida wildfire 

https://t.co/JmxEHifLEu",2022-03-07 14:08:35+00:00,False,47,69,362,3,en,False,Twitter for iPad,167,190,https://t.co/JmxEHifLEu,https://www.wjhg.com/2022/03/07/nations-heroes-successfully-rescued-wildfire-near-nursing-home/,NA,NA,NA,NA,NA,NA,NA,NA
MarcoRubio,15745368,1500834611462656007,"#Putin has a long history of terrorizing local populations to break their spirit &amp; will to resist

That is why you see #Russia bombing civilian areas &amp; taking advantage of ceasefires to use snipers to kill fleeing innocents",2022-03-07 14:03:50+00:00,False,270,238,1042,17,en,False,Twitter for iPad,NA,NA,NA,NA,NA,NA,NA,NA,NA,NA,NA,NA
MarcoRubio,15745368,1500833395022176258,"“For I was hungry and you gave me food, I was thirsty and you gave me drink, a stranger and you welcomed me,naked and you clothed me, ill and you cared for me, in prison and you visited me.”

Matthew 25:35-36",2022-03-07 13:59:00+00:00,False,463,5118,4382,508,en,False,Twitter for iPad,NA,NA,NA,NA,NA,NA,NA,NA,NA,NA,NA,NA
MarcoRubio,15745368,1500662649251667971,"STATUS REPORT 
Now on day 11 of #Putin’s criminal invasion of #Ukraine:

-troops stuck &amp; running out of supplies NE &amp; N of #Kyiv

-they keep losing tanks,planes,helo’s &amp; soldiers

-economy in free fall

-country an international pariah state

-using “ceasefires”to kill civilians",2022-03-07 02:40:31+00:00,False,451,474,1704,28,en,False,Twitter for iPad,NA,NA,NA,NA,NA,NA,NA,NA,NA,NA,NA,NA
MarcoRubio,15745368,1500660140307099649,"Like I said a week ago, #Russia has been planning a CBW and/or nuclear false flag in #Ukraine  

Well now #Putin govt is falsely reporting that Ukraine has rigged a reactor in #Kharkov 

ANY NUKE,CHEMICAL OR BIOLOGICAL INCIDENT IN UKRAINE IS A RUSSIAN FALSE FLAG",2022-03-07 02:30:33+00:00,False,1218,962,4416,243,en,False,Twitter for iPad,NA,NA,NA,NA,NA,NA,NA,NA,NA,NA,NA,NA
MarcoRubio,15745368,1500659078309285891,Some people in the Biden Administration want an #Iran deal so badly they would be willing to entertain a secret quid pro quo arrangement with #Russia over sanctions if #Putin helps seal the deal with the terrorist government in Tehran,2022-03-07 02:26:19+00:00,False,802,821,2362,106,en,False,Twitter for iPad,NA,NA,NA,NA,NA,NA,NA,NA,NA,NA,NA,NA
MarcoRubio,15745368,1500653400916115456,Las charlas secretas de #Biden con el régimen d #Maduro no se trata d reemplazar el petróleo d 🇷🇺.La industria petrolera d 🇻🇪 es un desastre q produce el 10% de lo q exporta 🇨🇺.🇺🇦 es solo una excusa para los ex-empleados pro-izquierdistas d Obama q querían acercarse a Maduro y 🇨🇺,2022-03-07 02:03:46+00:00,False,421,275,1131,39,es,False,Twitter for iPad,NA,NA,NA,NA,NA,NA,NA,NA,NA,NA,NA,NA
MarcoRubio,15745368,1500647359210000385,"#Biden secret talks with #MaduroRegime isn’t about replacing #Russia’s oil 

#Venezuela’s oil industry is an incompetent mess that produces 10% of what Russia exports

Ukraine is just an excuse for pro-leftist former Obama staffers who already wanted to get close to Maduro &amp; Cuba",2022-03-07 01:39:45+00:00,False,725,550,2351,70,en,False,Twitter for iPad,NA,NA,NA,NA,NA,NA,NA,NA,NA,NA,NA,NA
MarcoRubio,15745368,1500642584020013066,"10 days into #Russia’s invasion of #Ukraine one thing is obvious for all to see, #Putin will never be able to successfully occupy &amp; govern the country 

As long as Russians are there, they will face bombs, snipers and death",2022-03-07 01:20:47+00:00,False,324,272,1748,18,en,False,Twitter for iPad,NA,NA,NA,NA,NA,NA,NA,NA,NA,NA,NA,NA
MarcoRubio,15745368,1500638433718542336,"Thank you to the brave firefighters battling a 9,800-acre fire in NW #Florida 

It has already forced 1,100 households in Bay County to evacuate &amp; is still very dangerous",2022-03-07 01:04:17+00:00,False,73,112,705,3,en,False,Twitter for iPad,NA,NA,NA,NA,NA,NA,NA,NA,NA,NA,NA,NA
MarcoRubio,15745368,1500636845897568259,"If God forbid there are any chemical or biological weapons used or any nuclear incidents in #Ukraine have zero doubt who is behind it 

#Putin’s #Russia",2022-03-07 00:57:59+00:00,False,641,2342,3485,539,en,False,Twitter for iPad,NA,NA,NA,NA,NA,NA,NA,NA,NA,NA,NA,NA
MarcoRubio,15745368,1500635697857933313,Biden Admin thinking they are going to pull #Venezuela away from #Russia by reaching out to the #MaduroRegime is a reminder that many of our so called career “foreign policy experts” are stupid people https://t.co/muc3GyMlFw,2022-03-07 00:53:25+00:00,False,780,555,2764,100,en,False,Twitter for iPad,201,224,https://t.co/muc3GyMlFw,https://twitter.com/marcorubio/status/1500635697857933313/video/1,NA,NA,NA,NA,NA,NA,NA,NA
MarcoRubio,15745368,1500613335347204096,"We need to replace the oil we buy from #Russia with American oil 

Why are we helping pay for #Putin’s war crimes? https://t.co/J3dadRGaiN",2022-03-06 23:24:33+00:00,False,909,779,4275,75,en,False,Twitter for iPad,115,138,https://t.co/J3dadRGaiN,https://twitter.com/marcorubio/status/1500613335347204096/video/1,NA,NA,NA,NA,NA,NA,NA,NA
MarcoRubio,15745368,1500613129620893701,For years the West underestimated what #Putin would be willing to do https://t.co/WlBu5DgqjG,2022-03-06 23:23:44+00:00,False,194,289,859,18,en,False,Twitter for iPad,69,92,https://t.co/WlBu5DgqjG,https://twitter.com/marcorubio/status/1500613129620893701/video/1,NA,NA,NA,NA,NA,NA,NA,NA
MarcoRubio,15745368,1500486804650307588,"Censorship may limit what many Russians know about what #Russia is doing in #Ukraine  

But #Putin will not be able to hide the mounting casualties from Russian families",2022-03-06 15:01:46+00:00,False,442,1033,2393,40,en,False,Twitter for iPad,NA,NA,NA,NA,NA,NA,NA,NA,NA,NA,NA,NA
MarcoRubio,15745368,1500485195383951366,"In addition to 1.5 million refugees there are roughly 200,000 people who have had to flee one part of #Ukraine for another

This is mothers &amp; children whose husbands,fathers &amp; brothers stayed behind to fight &amp; have no home or jobs to return to when the war ends",2022-03-06 14:55:22+00:00,False,226,470,1001,29,en,False,Twitter for iPad,NA,NA,NA,NA,NA,NA,NA,NA,NA,NA,NA,NA
MarcoRubio,15745368,1500475577383497731,"Get familiar with #Transnistria 

You will soon be hearing a lot more about it https://t.co/TnsAcMLc0w",2022-03-06 14:17:09+00:00,False,951,670,2838,144,en,False,Twitter for iPad,79,102,https://t.co/TnsAcMLc0w,https://twitter.com/marcorubio/status/1500475577383497731/photo/1,NA,NA,NA,NA,NA,NA,NA,NA
MarcoRubio,15745368,1500471421390176263,Growing probability that #Russia will expand the #Ukraine invasion to involve the separatist Moldovan region of #Transnistria,2022-03-06 14:00:38+00:00,False,594,536,1970,55,en,False,Twitter for iPad,NA,NA,NA,NA,NA,NA,NA,NA,NA,NA,NA,NA
MarcoRubio,15745368,1500457713205141505,"#Putin is targeting civilian populations (just like they did in Syria &amp; Chechnya) to terrorize the population into fleeing or submitting

#Russia is facing dire supply &amp; logistical challenges so we will see an increase in these horrifying tactics",2022-03-06 13:06:10+00:00,False,632,532,1931,49,en,False,Twitter for iPad,NA,NA,NA,NA,NA,NA,NA,NA,NA,NA,NA,NA
MarcoRubio,15745368,1500456194812620806,"Terrible conditions right now in #Mariupol 

Teetering on the verge of humanitarian cataclysm 

If #Russia is struggling to feed &amp; supply their own troops just imagine how terrible conditions are for civilians",2022-03-06 13:00:08+00:00,False,359,306,1415,13,en,False,Twitter for iPad,NA,NA,NA,NA,NA,NA,NA,NA,NA,NA,NA,NA
MarcoRubio,15745368,1500455206856839171,"#Russia spent 8 missiles on a singe airport in #Vinnytsya #Ukraine and reportedly completely destroyed it 

They know you can’t send fighter jets to Ukraine if they don’t have somewhere to land &amp; operate them from https://t.co/rf3CHnQvJh",2022-03-06 12:56:13+00:00,False,279,293,869,23,en,False,Twitter for iPad,218,241,https://t.co/rf3CHnQvJh,https://twitter.com/marcorubio/status/1500455206856839171/photo/1,NA,NA,NA,NA,NA,NA,NA,NA
MarcoRubio,15745368,1500452610767208454,"Biden esta usando a #Rusia como una excusa para hacer el acuerdo q siempre quiso hacer de todos modos con el régimen d #Maduro. En vez d producir más petróleo estadounidense, quiere reemplazar el petróleo q le compramos a un dictador asesino con petróleo de otro dictador asesino. https://t.co/CIFsVIOFYf",2022-03-06 12:45:54+00:00,False,1227,714,2339,188,es,False,Twitter for iPad,281,304,https://t.co/CIFsVIOFYf,https://twitter.com/marcorubio/status/1500452610767208454/photo/1,NA,NA,NA,NA,NA,NA,NA,NA
MarcoRubio,15745368,1500451104865325056,"#Putin uses everything, even humanitarian corridors as a weapon 

I pray efforts like those supposed to happen today in #Mariupol are successful 

But I fear #Russia will use them as an opportunity to stage false flag attacks on civilians &amp; blame it on #Ukraine &amp; NATO",2022-03-06 12:39:55+00:00,False,222,287,1002,19,en,False,Twitter for iPad,NA,NA,NA,NA,NA,NA,NA,NA,NA,NA,NA,NA
MarcoRubio,15745368,1500449188190035971,"Joe Biden using #Russia as an excuse to do the deal they always wanted to do anyway with the #MaduroRegime 

Rather than produce more American oil he wants to replace the oil we buy from one murderous dictator with oil from another murderous dictator

https://t.co/HA7X71r2Mn",2022-03-06 12:32:18+00:00,False,719,860,1792,103,en,False,Twitter for iPad,252,275,https://t.co/HA7X71r2Mn,https://www.nytimes.com/2022/03/05/world/americas/venezuela-russia-usa.html?smid=url-share,NA,NA,NA,NA,NA,NA,NA,NA
MarcoRubio,15745368,1500259911078400000,"#Russia isn’t a economic superpower or a conventional military superpower

#Putin’s geopolitical power is entirely built on Nuclear Weapons &amp; being a major exporter of oil &amp; natural gas 

We can’t do much about the nukes

But we can diminish the importance of his energy exports",2022-03-06 00:00:10+00:00,False,701,1937,3827,97,en,False,Twitter for iPad,NA,NA,NA,NA,NA,NA,NA,NA,NA,NA,NA,NA
MarcoRubio,15745368,1500257876270628866,"The economy of #Russia is smaller than 3 states in the U.S. &amp; about the size of Italy 

Even before sanctions #Putin couldn’t afford a costly military quagmire in #Ukraine",2022-03-05 23:52:05+00:00,False,670,893,3680,64,en,False,Twitter for iPad,NA,NA,NA,NA,NA,NA,NA,NA,NA,NA,NA,NA
MarcoRubio,15745368,1500253752376315909,"Fire in NW #Florida continues to be a grave danger

Please follow all evacuation orders issued by local authorities https://t.co/ilFmqiagAV",2022-03-05 23:35:42+00:00,False,45,286,248,9,en,False,Twitter for iPad,116,139,https://t.co/ilFmqiagAV,https://twitter.com/WJHG_TV/status/1500248579251843074,NA,NA,NA,NA,NA,NA,NA,NA
MarcoRubio,15745368,1500251834040127494,"#Russia’s invaders are facing a dire logistical and resupply crisis in northern #Ukraine 

It’s almost at a tipping point now",2022-03-05 23:28:05+00:00,False,722,1541,4620,163,en,False,Twitter for iPad,NA,NA,NA,NA,NA,NA,NA,NA,NA,NA,NA,NA
MarcoRubio,15745368,1500250824546697217,This is the week that proved that being dependent on a criminal like #Putin for our oil is a bigger threat to America than climate change,2022-03-05 23:24:04+00:00,False,1340,1725,7688,191,en,False,Twitter for iPad,NA,NA,NA,NA,NA,NA,NA,NA,NA,NA,NA,NA
MarcoRubio,15745368,1500156643560112130,"As before the invasion of #Ukraine foreign leaders continue to fly to Moscow to talk to #Putin

And Putin will continue to play them",2022-03-05 17:09:50+00:00,False,580,3556,3039,158,en,False,Twitter for iPad,NA,NA,NA,NA,NA,NA,NA,NA,NA,NA,NA,NA
