ScreenName,AuthorID,TweetID,Text,TweetDate,isReply,RetweetCount,ReplyCount,LikeCount,QuoteCount,Language,PossibleSensitive,Source,1stURLStart,1stURLEnd,1stURL,1stURLExp,2ndURLStart,2ndURLEnd,2ndURL,2ndURLExp,3rdURLStart,3rdURLEnd,3rdURL,3rdURLExp
MarcoRubio,15745368,1500135466431094786,"Weaponizing migration &amp; attacks on nuke plants are akin to a declaration of war too

The problem is NATO would quickly annihilate #Russia’s conventional forces &amp; Putin would then use chemical,biological &amp; non-strategic nukes to freeze the conflict https://t.co/3nbYorDvZh",2022-03-05 15:45:41+00:00,False,419,1139,1702,77,en,False,Twitter for iPad,260,283,https://t.co/3nbYorDvZh,https://www.reuters.com/world/europe/putin-says-western-sanctions-are-akin-declaration-war-2022-03-05/,NA,NA,NA,NA,NA,NA,NA,NA
MarcoRubio,15745368,1500131720225558534,"Monitoring fires in Bay County, #Florida 

Please stay tuned to local news and heed the orders of the Forest Service and Bay County Emergency Services https://t.co/F06VWmhlri",2022-03-05 15:30:47+00:00,False,37,251,265,9,en,False,Twitter for iPad,151,174,https://t.co/F06VWmhlri,https://twitter.com/WJHG_TV/status/1500126606400098305,NA,NA,NA,NA,NA,NA,NA,NA
MarcoRubio,15745368,1500130781506723845,"#Russia’s Air Force is having their worst day yet in #Ukraine 

Multiple shoot downs and dead and captured pilots",2022-03-05 15:27:04+00:00,False,1177,877,6720,90,en,False,Twitter for iPad,NA,NA,NA,NA,NA,NA,NA,NA,NA,NA,NA,NA
MarcoRubio,15745368,1500120431382175750,On zoom call now with President Zelensky of #Ukraine https://t.co/xhgbpIwVD9,2022-03-05 14:45:56+00:00,False,1385,38273,13016,2984,en,False,Twitter for iPad,53,76,https://t.co/xhgbpIwVD9,https://twitter.com/marcorubio/status/1500120431382175750/photo/1,NA,NA,NA,NA,NA,NA,NA,NA
MarcoRubio,15745368,1499986178157731850,"We are now entering the most dangerous phase of the #UkraineRussianWar 

#Russia can’t financially or logistically sustain another 9 days like the last 9 days 

And #Putin can’t survive being humiliated or being seen as backing down",2022-03-05 05:52:27+00:00,False,1304,911,5624,139,en,False,Twitter for iPad,NA,NA,NA,NA,NA,NA,NA,NA,NA,NA,NA,NA
MarcoRubio,15745368,1499981972646641672,"Something changed for the Russian forces North &amp; NW of #Kyiv over the last 12 hours 

Whatever it is, it was not for the better",2022-03-05 05:35:45+00:00,False,763,664,4821,89,en,False,Twitter for iPad,NA,NA,NA,NA,NA,NA,NA,NA,NA,NA,NA,NA
MarcoRubio,15745368,1499902687831334913,"#Russia troops have begun moving towards the #Yuzhnoukrainsk nuclear facility &amp; are less than 31 km away 

It has 3 water reactors &amp; is the 2nd largest in #Ukraine",2022-03-05 00:20:42+00:00,False,689,370,1931,100,en,False,Twitter for iPad,NA,NA,NA,NA,NA,NA,NA,NA,NA,NA,NA,NA
MarcoRubio,15745368,1499893186587770884,"Growing indications that #Russia faces some kind of imminent supply crisis in #Ukraine 

If this is the case we could see a dramatic escalation of attacks over the new 72 hours",2022-03-04 23:42:57+00:00,False,754,321,3085,68,en,False,Twitter for iPad,NA,NA,NA,NA,NA,NA,NA,NA,NA,NA,NA,NA
MarcoRubio,15745368,1499788179435659265,"#Ukraine says they have retaken the military air field at #Mykolaiv in the south 60km north of the Black Sea

A reminder that one thing is for #Russia to “take” a territory, another is to hold it. 

 https://t.co/xh3SqdWGbR",2022-03-04 16:45:41+00:00,False,562,228,2684,44,en,False,Twitter for iPad,200,223,https://t.co/xh3SqdWGbR,https://twitter.com/DefenceU/status/1499778118718050304/video/1,NA,NA,NA,NA,NA,NA,NA,NA
MarcoRubio,15745368,1499748032144887810,"Biden will not allow America to produce more of its own oil 

But we are still buying oil from a war criminal in #Russia 

And are apparently only days away from also buying oil from a terrorist government in #Iran 

https://t.co/pdUEd7nBI7",2022-03-04 14:06:09+00:00,False,381,505,1056,56,en,False,Twitter for iPad,217,240,https://t.co/pdUEd7nBI7,https://freebeacon.com/national-security/russia-involved-in-plot-to-help-iran-bust-us-oil-sanctions/,NA,NA,NA,NA,NA,NA,NA,NA
MarcoRubio,15745368,1499745671905218564,In many of the areas #Russia has “control” they are facing costly hit &amp; run operations &amp; ambushes that are complicating their ability to move supplies &amp; reinforcements https://t.co/Fneupi2BT4,2022-03-04 13:56:46+00:00,False,237,137,983,12,en,False,Twitter for iPad,180,203,https://t.co/Fneupi2BT4,https://twitter.com/marcorubio/status/1499745671905218564/photo/1,NA,NA,NA,NA,NA,NA,NA,NA
MarcoRubio,15745368,1499741978120138753,"America doesn’t need #Putin’s oil,even if it is being sold at a sharp discount

We have our own, lets use it",2022-03-04 13:42:06+00:00,False,1911,1118,15766,141,en,False,Twitter for iPad,NA,NA,NA,NA,NA,NA,NA,NA,NA,NA,NA,NA
MarcoRubio,15745368,1499740159469932545,"President Biden and NATO need to make clear to #Belarus that it would be a terrible mistake to send troops into #Ukraine

Prudence limits our options against #Russia

Belarus is not Russia",2022-03-04 13:34:52+00:00,False,391,305,2324,39,en,False,Twitter for iPad,NA,NA,NA,NA,NA,NA,NA,NA,NA,NA,NA,NA
MarcoRubio,15745368,1499727811413790720,"There will be a steady increase of internal restrictions in #Russia over the next few days

In less than a week Russians will be living under Stalin era rules",2022-03-04 12:45:48+00:00,False,427,216,2020,21,en,False,Twitter for iPad,NA,NA,NA,NA,NA,NA,NA,NA,NA,NA,NA,NA
MarcoRubio,15745368,1499724319538221058,"“This is my commandment: love one another as I love you. No one has greater love than this,to lay down one’s life for one’s friends.”

John 15:12-13",2022-03-04 12:31:55+00:00,False,244,427,2168,40,en,False,Twitter for iPad,NA,NA,NA,NA,NA,NA,NA,NA,NA,NA,NA,NA
MarcoRubio,15745368,1499596009130893313,"It would be a catastrophic mistake to make decisions based on the #Putin of the past 

The sense of grievance,the suspicions,the hubris of viewing himself as #Russia the obsession with control, have all gotten worse &amp; he will do things now he would have never done before",2022-03-04 04:02:04+00:00,True,366,293,1902,36,en,False,Twitter for iPad,NA,NA,NA,NA,NA,NA,NA,NA,NA,NA,NA,NA
MarcoRubio,15745368,1499590616430350336,"I can’t emphasize enough how much #Putin &amp; his risk calculus have changed

He will push Belarus into war,use chemical or biological weapons,slaughter millions &amp; impose Stalinist restrictions in #Russia to avoid humiliation or the perception that he was forced to back down",2022-03-04 03:40:38+00:00,False,1084,1054,4418,223,en,False,Twitter for iPad,NA,NA,NA,NA,NA,NA,NA,NA,NA,NA,NA,NA
MarcoRubio,15745368,1499557618603507713,"There is all sorts of contradictory information from officials in #Ukraine 

This is understandable given the fact their country is being invaded and at war 

An accurate damage assessment and determination about the danger of a leak, if any, will not be available for hours https://t.co/FvqiZCWKRV",2022-03-04 01:29:31+00:00,False,282,229,1011,32,en,False,Twitter for iPad,275,298,https://t.co/FvqiZCWKRV,https://twitter.com/iaeaorg/status/1499552874719850549,NA,NA,NA,NA,NA,NA,NA,NA
MarcoRubio,15745368,1499555737533657111,"Second Ukraine official just now says reactor was “hit” &amp; is inactive with fuel inside but that its the admin building which is on fire

He had received no information about elevated radiation levels 

Says meltdown unlikely but leak is possible 

No other verified info available",2022-03-04 01:22:02+00:00,False,1064,403,3185,156,en,False,Twitter for iPad,NA,NA,NA,NA,NA,NA,NA,NA,NA,NA,NA,NA
MarcoRubio,15745368,1499553144065429509,"Ukrainian TV is reporting that a reactor is on fire at  #Zaporizhzhia but that it is not currently operating 

But it does have nuclear fuel inside",2022-03-04 01:11:44+00:00,False,600,212,1641,78,en,False,Twitter for iPad,NA,NA,NA,NA,NA,NA,NA,NA,NA,NA,NA,NA
MarcoRubio,15745368,1499551916069695488,"#Ukraine energy officials telling  the media and U.S. officials that elevated radiation levels are being detected at  #Zaporizhzhia 

There is no independent confirmation of this nor are any levels  being provided or available at the moment",2022-03-04 01:06:51+00:00,False,634,244,1727,104,en,False,Twitter for iPad,NA,NA,NA,NA,NA,NA,NA,NA,NA,NA,NA,NA
MarcoRubio,15745368,1499546355479588888,"Like most nuke plants the one in #Ukraine under attack is built to withstand a direct hit from an airplane crash 

The problem is a loss of power or a shell draining the pools used to store spent fuel

If that fuel isn’t cooled it can melt &amp; release large amounts of radioactivity",2022-03-04 00:44:46+00:00,False,1495,754,4342,172,en,False,Twitter for iPad,NA,NA,NA,NA,NA,NA,NA,NA,NA,NA,NA,NA
MarcoRubio,15745368,1499543863974838279,"Russian soldiers have breached the main building of the  #Zaporizhzhia nuke plant in #Ukraine 

Active firefight is going on inside a facility that is already on fire and controls 6 reactors 

Firefighters unable to fight the fire because they are in the middle of a combat zone",2022-03-04 00:34:52+00:00,False,813,236,1806,131,en,False,Twitter for iPad,NA,NA,NA,NA,NA,NA,NA,NA,NA,NA,NA,NA
MarcoRubio,15745368,1499543192047427586,"#Russian soldiers have entered in nuclear plant in #Ukraine

There is an growing fire on the site and now a firefight occurring inside the 9th largest nuclear power plant in the world.",2022-03-04 00:32:11+00:00,False,1826,914,5245,329,en,False,Twitter for iPad,NA,NA,NA,NA,NA,NA,NA,NA,NA,NA,NA,NA
MarcoRubio,15745368,1499541885739806721,"#Zaporizhzhia nuclear power plant in #Ukraine has 6 reactors, is the largest one in all of Europe, and the 9th largest on earth 

#Russia is currently attacking it with mortars and RPGs

Portions of the plan are currently on fire 

Russians firing on the Firefighters too",2022-03-04 00:27:00+00:00,False,1324,487,2578,211,en,False,Twitter for iPad,NA,NA,NA,NA,NA,NA,NA,NA,NA,NA,NA,NA
MarcoRubio,15745368,1499539156728434693,"#Russian invaders are shelling the largest nuke plant in Europe

Reports now that portions of the plant are now on fire

https://t.co/CKHcOIT9tz",2022-03-04 00:16:09+00:00,True,126,71,338,31,en,False,Twitter for iPad,121,144,https://t.co/CKHcOIT9tz,https://youtu.be/X14cRHLb-bU,NA,NA,NA,NA,NA,NA,NA,NA
MarcoRubio,15745368,1499535852929695744,"I have nothing against “renewables” but you can’t power a 21st century economy yet without natural gas &amp; oil 

God has blessed America wit gas &amp; oil, so lets use it https://t.co/9lgUTUXJyc",2022-03-04 00:03:02+00:00,False,320,359,1656,31,en,False,Twitter for iPad,173,196,https://t.co/9lgUTUXJyc,https://twitter.com/marcorubio/status/1499535852929695744/video/1,NA,NA,NA,NA,NA,NA,NA,NA
MarcoRubio,15745368,1499533055794499586,Live feed of #Russia’s invaders &amp; #Ukraine patriots battle for control of the largest nuclear power plant in Europe  https://t.co/pNaYET5wTn,2022-03-03 23:51:55+00:00,False,312,130,938,34,en,False,Twitter for iPad,121,144,https://t.co/pNaYET5wTn,https://youtu.be/fYUT36YGOh8,NA,NA,NA,NA,NA,NA,NA,NA
MarcoRubio,15745368,1499487368411332612,"#Russia is obviously a major military power, but they don’t have an unlimited supply of guided rockets &amp; missiles

For the first time there are indications they are reaching the number set aside for this invasion",2022-03-03 20:50:22+00:00,False,828,426,4736,111,en,False,Twitter for iPad,NA,NA,NA,NA,NA,NA,NA,NA,NA,NA,NA,NA
MarcoRubio,15745368,1499480362522660880,Russian convoy just south of #Hostomel &amp; NW of #Kyiv has been stationary for several days with soldiers sleeping outdoors on the ground and eating expired rations,2022-03-03 20:22:32+00:00,False,455,317,2298,47,en,False,Twitter for iPad,NA,NA,NA,NA,NA,NA,NA,NA,NA,NA,NA,NA
MarcoRubio,15745368,1499468554852311041,"This answer today from the White House is “truthy” 

But it does not capture the full reality

A work in progress https://t.co/NpouBAg3Uv",2022-03-03 19:35:36+00:00,False,42,96,269,4,en,False,Twitter for iPad,114,137,https://t.co/NpouBAg3Uv,https://twitter.com/alexbward/status/1499461908189097986,NA,NA,NA,NA,NA,NA,NA,NA
MarcoRubio,15745368,1499425034141589509,The chances of #Belarus joining in the invasion of #Ukraine are very high and (in my opinion) near certain https://t.co/YUzbq7wF3l,2022-03-03 16:42:40+00:00,False,341,358,1520,38,en,False,Twitter for iPad,107,130,https://t.co/YUzbq7wF3l,https://twitter.com/marcorubio/status/1499425034141589509/photo/1,NA,NA,NA,NA,NA,NA,NA,NA
MarcoRubio,15745368,1499418324551311366,"IMPORTANT WARNING 
In 2018 #Putin used propaganda war to blame rebels for Assad’s chemical weapons attacks 

High probability he could carry out real or staged biological/chemical attacks in #Ukraine &amp; blame it on NATO or Ukrainian forces https://t.co/2NJVHh3BYx",2022-03-03 16:16:01+00:00,False,241,136,626,25,en,False,Twitter for iPad,243,266,https://t.co/2NJVHh3BYx,https://www.telegraph.co.uk/world-news/2022/03/03/targeted-russias-wartime-propaganda-machine-syria-should-afraid/,NA,NA,NA,NA,NA,NA,NA,NA
MarcoRubio,15745368,1499377586174058499,"#Putin faces:
 
-either a costly military victory/occupation or a quagmire 

-increasing domestic unrest over a full scale war &amp; economic meltdown

He will respond with:

- a horrifying escalation in #Ukraine; &amp;/or

- creating a new crisis;and

- Stalinist restrictions in #Russia",2022-03-03 13:34:08+00:00,False,242,216,980,16,en,False,Twitter for iPad,NA,NA,NA,NA,NA,NA,NA,NA,NA,NA,NA,NA
MarcoRubio,15745368,1499371658167136263,"Inside of #Russia the once unimaginable is now possible

The quality of life is rapidly deteriorating

Everyone who can afford to leave is leaving

And increasingly people are realizing that #Putin has plunged them into a full scale war in #Ukraine &amp; destroyed their economy",2022-03-03 13:10:34+00:00,False,316,173,1418,20,en,False,Twitter for iPad,NA,NA,NA,NA,NA,NA,NA,NA,NA,NA,NA,NA
MarcoRubio,15745368,1499369403250626560,"Awake! Why do you sleep, O Lord? Rise up! Do not reject us forever! Why do you hide your face;why forget our pain and misery? For our soul has been humiliated in the dust;our belly is pressed to the earth. Rise up, help us! Redeem us in your mercy.

Psalms 44:24-27",2022-03-03 13:01:37+00:00,False,178,362,1685,28,en,False,Twitter for iPad,NA,NA,NA,NA,NA,NA,NA,NA,NA,NA,NA,NA
MarcoRubio,15745368,1499359002806861826,"Today and everyday for the foreseeable future  America will buy 600,000 barrels of oil from the butcher #Putin

Lets stop buying oil of #Russia and replace it with oil we produce right here in America",2022-03-03 12:20:17+00:00,False,2161,998,12328,187,en,False,Twitter for iPad,NA,NA,NA,NA,NA,NA,NA,NA,NA,NA,NA,NA
MarcoRubio,15745368,1499357247738200065,Keep an eye on the decreased readiness of troops sitting in a 40km long traffic jam for 3 days now https://t.co/HYgt1fJPAU,2022-03-03 12:13:19+00:00,False,153,125,793,7,en,False,Twitter for iPad,99,122,https://t.co/HYgt1fJPAU,https://twitter.com/marcorubio/status/1499357247738200065/video/1,NA,NA,NA,NA,NA,NA,NA,NA
MarcoRubio,15745368,1499232543996002304,"The Soviets lost 13,000 soldiers over a decade during and after the invasion of Afghanistan

#Putin could lose 13,000 after just 5 to 7 weeks in #Ukraine",2022-03-03 03:57:47+00:00,False,548,346,2959,57,en,False,Twitter for iPad,NA,NA,NA,NA,NA,NA,NA,NA,NA,NA,NA,NA
