ScreenName,AuthorID,TweetID,Text,TweetDate,isReply,RetweetCount,ReplyCount,LikeCount,QuoteCount,Language,PossibleSensitive,Source,1stURLStart,1stURLEnd,1stURL,1stURLExp,2ndURLStart,2ndURLEnd,2ndURL,2ndURLExp,3rdURLStart,3rdURLEnd,3rdURL,3rdURLExp
GovRonDeSantis,1058807868,1494769745425543177,"This week, FEMA denied Florida’s request for Individual Assistance for Floridians displaced by tornadoes in Charlotte and Lee counties.

We urge FEMA to reconsider its decision. Floridians shouldn’t be punished for a disaster outside of their control due to White House politics. https://t.co/lHUtznMDsb",2022-02-18 20:24:13+00:00,False,2440,2345,10090,253,en,False,Twitter for iPhone,280,303,https://t.co/lHUtznMDsb,https://twitter.com/GovRonDeSantis/status/1494769745425543177/photo/1,NA,NA,NA,NA,NA,NA,NA,NA
GovRonDeSantis,1058807868,1494705244739014656,Governor DeSantis criticizes the Biden Administration for denying Florida’s request for Individual Assistance for those displaced by tornadoes in Charlotte and Lee counties. https://t.co/Kjh3THItJj,2022-02-18 16:07:55+00:00,False,795,1040,3654,67,en,False,Periscope,174,197,https://t.co/Kjh3THItJj,https://twitter.com/i/broadcasts/1gqxvldrQwWGB,NA,NA,NA,NA,NA,NA,NA,NA
GovRonDeSantis,1058807868,1493713034933641224,"In 2021, nearly 118 million Americans visited Florida, the highest number of domestic travelers in the history of our state.

Our fellow Americans know that, in Florida, they can expect sunshine, great hospitality, and freedom.",2022-02-15 22:25:14+00:00,False,10811,5787,84760,998,en,False,Twitter Web App,NA,NA,NA,NA,NA,NA,NA,NA,NA,NA,NA,NA
GovRonDeSantis,1058807868,1493681333737979906,"Governor DeSantis announces Florida had 30.9 million visitors from October to December, the second consecutive quarter where visitation has topped pre-pandemic levels. https://t.co/fPkB78roLp",2022-02-15 20:19:15+00:00,False,633,699,4714,72,en,False,Periscope,168,191,https://t.co/fPkB78roLp,https://twitter.com/i/broadcasts/1YpKkZeYjAoxj,NA,NA,NA,NA,NA,NA,NA,NA
GovRonDeSantis,1058807868,1493642896528056324,https://t.co/tuTF1OOrfh,2022-02-15 17:46:31+00:00,False,924,1251,5581,106,und,False,Twitter Web App,0,23,https://t.co/tuTF1OOrfh,https://twitter.com/GovRonDeSantis/status/1493642896528056324/photo/1,NA,NA,NA,NA,NA,NA,NA,NA
GovRonDeSantis,1058807868,1493306642166910977,"Happy Valentine’s Day to my better half @FLCaseyDeSantis. 

I’m truly blessed to have such a strong, courageous and loving wife. I love you! https://t.co/UbypROZE0n",2022-02-14 19:30:22+00:00,False,1883,1579,34752,128,en,False,Twitter Web App,141,164,https://t.co/UbypROZE0n,https://twitter.com/GovRonDeSantis/status/1493306642166910977/photo/1,141,164,https://t.co/UbypROZE0n,https://twitter.com/GovRonDeSantis/status/1493306642166910977/photo/1,NA,NA,NA,NA
GovRonDeSantis,1058807868,1493242729861685251,"Today marks the fourth anniversary of the tragic Parkland massacre, where 17 Floridians were murdered.
  
The Capitol has been lit since Friday in their honor, and our prayers are with the families, loved ones, and those in the Parkland community in mourning. https://t.co/hpRZv8A8ru",2022-02-14 15:16:24+00:00,False,579,1307,5106,83,en,False,Twitter Web App,260,283,https://t.co/hpRZv8A8ru,https://twitter.com/GovRonDeSantis/status/1493242729861685251/photo/1,NA,NA,NA,NA,NA,NA,NA,NA
GovRonDeSantis,1058807868,1492938287656448003,"Enjoyed stopping in at Unfiltered in Bartow for some fresh coffee. 

Great environment – try it out: https://t.co/bO90ku7ha5 https://t.co/meFVcvnPWY",2022-02-13 19:06:39+00:00,False,528,1192,6562,50,en,False,Twitter for iPhone,101,124,https://t.co/bO90ku7ha5,http://unfilteredbartow.com,125,148,https://t.co/meFVcvnPWY,https://twitter.com/GovRonDeSantis/status/1492938287656448003/photo/1,NA,NA,NA,NA
GovRonDeSantis,1058807868,1492515084282695689,"Had a lot of fun with @FLCaseyDeSantis, Madison and Mason at the State Fair in Tampa. Make sure to visit before it ends on February 21st. https://t.co/wev7QV0Vrw",2022-02-12 15:05:00+00:00,False,397,1074,5265,42,en,False,Twitter Web App,138,161,https://t.co/wev7QV0Vrw,https://twitter.com/GovRonDeSantis/status/1492515084282695689/photo/1,138,161,https://t.co/wev7QV0Vrw,https://twitter.com/GovRonDeSantis/status/1492515084282695689/photo/1,138,161,https://t.co/wev7QV0Vrw,https://twitter.com/GovRonDeSantis/status/1492515084282695689/photo/1
GovRonDeSantis,1058807868,1492513838809427971,"Kicked off the State Fair in Tampa this week. Bring your families by to enjoy some good food, fun rides, and freedom. https://t.co/Kja9sVmbLN",2022-02-12 15:00:03+00:00,False,855,1492,8301,88,en,False,Twitter Web App,118,141,https://t.co/Kja9sVmbLN,https://twitter.com/GovRonDeSantis/status/1492513838809427971/photo/1,NA,NA,NA,NA,NA,NA,NA,NA
GovRonDeSantis,1058807868,1492252533049511947,"Happy to award over $91 million to communities throughout Northwest Florida for infrastructure projects, including over $60 million in Jackson County. https://t.co/7yNYgbVo7A",2022-02-11 21:41:43+00:00,False,482,2996,5184,283,en,False,Twitter for iPhone,151,174,https://t.co/7yNYgbVo7A,https://twitter.com/GovRonDeSantis/status/1492252533049511947/photo/1,NA,NA,NA,NA,NA,NA,NA,NA
GovRonDeSantis,1058807868,1492199764607135750,Governor DeSantis is in Jackson County to award $91 million to infrastructure projects that will protect against future storm damage. https://t.co/2IBeMLF5Tu,2022-02-11 18:12:02+00:00,False,387,1092,2772,69,en,False,Periscope,134,157,https://t.co/2IBeMLF5Tu,https://twitter.com/i/broadcasts/1rmxPgREEogJN,NA,NA,NA,NA,NA,NA,NA,NA
GovRonDeSantis,1058807868,1491902505143390214,"Today, I visited a replica cattle car used by Nazi Germany during the Holocaust to persecute and attempt to exterminate the Jewish people.

Florida will continue to be a leader in Holocaust education and in fighting antisemitism.
 
We will never forget. https://t.co/80edHoBxVW",2022-02-10 22:30:50+00:00,False,2693,3664,20955,454,en,False,Twitter Web App,254,277,https://t.co/80edHoBxVW,https://twitter.com/GovRonDeSantis/status/1491902505143390214/photo/1,NA,NA,NA,NA,NA,NA,NA,NA
GovRonDeSantis,1058807868,1491185076377243648,Florida has awarded nearly $1 billion for long-term recovery and infrastructure improvements in hurricane-affected communities. https://t.co/8x9X7WCPw2,2022-02-08 23:00:01+00:00,False,386,1600,3907,99,en,False,Twitter Media Studio,128,151,https://t.co/8x9X7WCPw2,https://twitter.com/GovRonDeSantis/status/1491185076377243648/photo/1,NA,NA,NA,NA,NA,NA,NA,NA
GovRonDeSantis,1058807868,1491166389117534209,Thank you to the men and women who have served in Florida’s National Guard. Your consistent readiness and significant contributions to keeping our communities safe do not go unnoticed. #FloridaNationalGuardDay https://t.co/lAtf9nQ4Yh,2022-02-08 21:45:46+00:00,False,291,565,2773,8,en,False,Twitter Web App,210,233,https://t.co/lAtf9nQ4Yh,https://twitter.com/GovRonDeSantis/status/1491166389117534209/photo/1,NA,NA,NA,NA,NA,NA,NA,NA
GovRonDeSantis,1058807868,1491144498163900422,"The medical science on forced masking children didn’t change — the political science did. In Florida, we never imposed state mask mandates, and we liberated children and parents from the local authorities that did. We hope every jurisdiction will follow suit. https://t.co/Dz4SgObVJx",2022-02-08 20:18:47+00:00,False,8154,2278,37145,643,en,False,Twitter Media Studio,260,283,https://t.co/Dz4SgObVJx,https://twitter.com/GovRonDeSantis/status/1491144498163900422/video/1,NA,NA,NA,NA,NA,NA,NA,NA
GovRonDeSantis,1058807868,1491103761359523841,Governor DeSantis is in Polk County to award $64 million for infrastructure improvements for communities across Florida. https://t.co/hPEK9mZ8sv,2022-02-08 17:36:54+00:00,False,384,1432,2780,100,en,False,Periscope,121,144,https://t.co/hPEK9mZ8sv,https://twitter.com/i/broadcasts/1LyxBobXrErKN,NA,NA,NA,NA,NA,NA,NA,NA
GovRonDeSantis,1058807868,1490835232999809038,"We’re working to increase patient protections in Florida. 

If you’re in a hospital or long-term care facility, you have a right to have loved ones visit so individuals can have the human connection they need. https://t.co/FM7R4DS1NL",2022-02-07 23:49:52+00:00,False,3789,2006,20996,431,en,False,Twitter Media Studio,210,233,https://t.co/FM7R4DS1NL,https://twitter.com/GovRonDeSantis/status/1490835232999809038/video/1,NA,NA,NA,NA,NA,NA,NA,NA
GovRonDeSantis,1058807868,1490815135497142273,"The Biden Administration’s immigration policies have created a human smuggling operation that has increased human, sex and drug trafficking. 

Proud to join with Cuban-American exiles to oppose these reckless policies. https://t.co/7orhWkRzQY",2022-02-07 22:30:00+00:00,False,995,672,4886,53,en,False,Twitter Web App,219,242,https://t.co/7orhWkRzQY,https://twitter.com/GovRonDeSantis/status/1490815135497142273/photo/1,NA,NA,NA,NA,NA,NA,NA,NA
GovRonDeSantis,1058807868,1490783564966756353,Governor DeSantis hosted a roundtable on the effects of the ongoing Biden Border Crisis. https://t.co/m0pJmqXWIV,2022-02-07 20:24:33+00:00,False,495,898,2644,37,en,False,Periscope,89,112,https://t.co/m0pJmqXWIV,https://twitter.com/i/broadcasts/1mrxmabyeNvxy,NA,NA,NA,NA,NA,NA,NA,NA
GovRonDeSantis,1058807868,1490723621815345156,"Governor DeSantis is hosting a roundtable on the effects of the ongoing Biden Border Crisis. 

https://t.co/zjjCLpoMwZ",2022-02-07 16:26:22+00:00,False,324,862,2208,37,en,False,Twitter Web App,95,118,https://t.co/zjjCLpoMwZ,https://fb.watch/b10pfhjzc8/,NA,NA,NA,NA,NA,NA,NA,NA
GovRonDeSantis,1058807868,1489978237304426501,"It is a fraud for @gofundme to commandeer $9M in donations sent to support truckers and give it to causes of their own choosing. 

I will work with @AGAshleyMoody to investigate these deceptive practices — these donors should be given a refund.",2022-02-05 15:04:28+00:00,False,23119,8134,105048,2373,en,False,Twitter for iPhone,NA,NA,NA,NA,NA,NA,NA,NA,NA,NA,NA,NA
GovRonDeSantis,1058807868,1489633711721271304,"The Florida legislature is contemplating legislation to protect the licensure and board certifications of physicians from sanction along these lines, and I support this effort.",2022-02-04 16:15:27+00:00,True,1338,820,10110,70,en,False,Twitter Web App,NA,NA,NA,NA,NA,NA,NA,NA,NA,NA,NA,NA
GovRonDeSantis,1058807868,1489633673989210114,"Physicians in Florida should be able to practice medicine and express opinions without facing sanctions simply because they are not parroting the prevailing ""narrative.""",2022-02-04 16:15:18+00:00,False,10044,3709,61045,684,en,False,Twitter Web App,NA,NA,NA,NA,NA,NA,NA,NA,NA,NA,NA,NA
GovRonDeSantis,1058807868,1489388230877265926,"Cancer is the second leading cause of death in Florida. 

I have recommended to the Legislature $100 million for cancer research so we can fight this terrible disease.",2022-02-04 00:00:00+00:00,False,3743,4591,40565,505,en,False,Twitter Web App,NA,NA,NA,NA,NA,NA,NA,NA,NA,NA,NA,NA
GovRonDeSantis,1058807868,1489373139083616256,"Floridians should not have their data used by Big Tech without providing affirmative consent, and I urge the Legislature to protect the data privacy of all Floridians. https://t.co/TjT17d32GD",2022-02-03 23:00:02+00:00,False,2066,1205,13279,144,en,False,Twitter Media Studio,168,191,https://t.co/TjT17d32GD,https://twitter.com/GovRonDeSantis/status/1489373139083616256/video/1,NA,NA,NA,NA,NA,NA,NA,NA
GovRonDeSantis,1058807868,1489360037969551365,"This Seaports Day, I want to thank all of the people working to keep our ports open 24/7 to ensure that goods are getting from ship to shelf efficiently in order to combat our nation’s supply chain crisis. https://t.co/fvBFhM8eiG",2022-02-03 22:07:58+00:00,False,426,656,3205,23,en,False,Twitter for iPhone,206,229,https://t.co/fvBFhM8eiG,https://twitter.com/GovRonDeSantis/status/1489360037969551365/photo/1,NA,NA,NA,NA,NA,NA,NA,NA
GovRonDeSantis,1058807868,1489032074589843459,"Since 2019, we have invested more than $3.5 billion in workforce education across Florida.

We are well on our way to reaching our goal of becoming the number one state in the nation for workforce education by 2030. https://t.co/u1AmjuRuDB",2022-02-03 00:24:46+00:00,False,489,1110,4428,42,en,False,Twitter Web App,216,239,https://t.co/u1AmjuRuDB,https://twitter.com/GovRonDeSantis/status/1489032074589843459/photo/1,NA,NA,NA,NA,NA,NA,NA,NA
GovRonDeSantis,1058807868,1488957980028686336,"Tom Brady was the greatest athlete to have ever put on a pair of football spikes. 

Congratulations on your retirement. Thank you for two great seasons in Tampa Bay! https://t.co/JLbE2bHd6Y",2022-02-02 19:30:20+00:00,False,1014,1412,10896,92,en,False,Twitter Media Studio,166,189,https://t.co/JLbE2bHd6Y,https://twitter.com/GovRonDeSantis/status/1488957980028686336/video/1,NA,NA,NA,NA,NA,NA,NA,NA
GovRonDeSantis,1058807868,1488889520699310084,Governor DeSantis invests $89 million into workforce education and training initiatives for Floridians. https://t.co/PEGHnbqpSW,2022-02-02 14:58:18+00:00,False,511,991,3436,60,en,False,Periscope,104,127,https://t.co/PEGHnbqpSW,https://twitter.com/i/broadcasts/1DXxyDlllXYJM,NA,NA,NA,NA,NA,NA,NA,NA
GovRonDeSantis,1058807868,1488671230827929600,"Because of our coordinated efforts, Florida will be able to protect our coastal and inland infrastructure for the first time ever while also having the dedicated funding to keep projects moving. https://t.co/AfoqQI55v1",2022-02-02 00:30:54+00:00,False,608,1825,5999,133,en,False,Twitter Web App,195,218,https://t.co/AfoqQI55v1,https://twitter.com/GovRonDeSantis/status/1488671230827929600/photo/1,NA,NA,NA,NA,NA,NA,NA,NA
GovRonDeSantis,1058807868,1488557773847683075,https://t.co/BD9rguhSBJ,2022-02-01 17:00:04+00:00,False,13397,2662,73499,966,und,False,Twitter Web App,0,23,https://t.co/BD9rguhSBJ,https://twitter.com/GovRonDeSantis/status/1488557773847683075/photo/1,NA,NA,NA,NA,NA,NA,NA,NA
GovRonDeSantis,1058807868,1488546571285192705,Governor DeSantis announces funding for 113 projects across the state through the Resilient Florida Grant Program. https://t.co/sY2txmTgEt,2022-02-01 16:15:33+00:00,False,289,676,1779,26,en,False,Periscope,115,138,https://t.co/sY2txmTgEt,https://twitter.com/i/broadcasts/1djxXPXDXbdxZ,NA,NA,NA,NA,NA,NA,NA,NA
GovRonDeSantis,1058807868,1488522565412872197,"At my direction, Florida prioritized our portion of the EAA Reservoir Project, which will reduce harmful discharges and send more water south.

Now, the Biden Administration must fund and start their portion ASAP to get relief to our estuary communities and the Everglades. https://t.co/nHhU8IBpbI",2022-02-01 14:40:09+00:00,False,372,585,2676,26,en,False,Twitter Media Studio,274,297,https://t.co/nHhU8IBpbI,https://twitter.com/GovRonDeSantis/status/1488522565412872197/video/1,NA,NA,NA,NA,NA,NA,NA,NA
GovRonDeSantis,1058807868,1488511598511550464,Governor DeSantis unveils more than $404 million in funding for resilience projects statewide. https://t.co/Hl8lG4Otxu,2022-02-01 13:56:34+00:00,False,223,566,1530,25,en,False,Periscope,95,118,https://t.co/Hl8lG4Otxu,https://twitter.com/i/broadcasts/1MYxNnzQgLZxw,NA,NA,NA,NA,NA,NA,NA,NA
GovRonDeSantis,1058807868,1488302538051006472,"I am calling on the Biden Administration to include at least $725 million for Everglades restoration in the upcoming FY 2023 budget request.

This level of investment is necessary to keep pace with Florida’s investment in the Everglades and move key projects forward. https://t.co/vvo3Fk8xBN",2022-02-01 00:05:51+00:00,False,734,2733,5783,207,en,False,Twitter Web App,268,291,https://t.co/vvo3Fk8xBN,https://twitter.com/GovRonDeSantis/status/1488302538051006472/photo/1,NA,NA,NA,NA,NA,NA,NA,NA
GovRonDeSantis,1058807868,1488242111434551297,Governor DeSantis calls on the Biden Administration to allocate funds to advance the EAA Reservoir project. https://t.co/539sETaW8T,2022-01-31 20:05:44+00:00,False,397,1265,2716,56,en,False,Periscope,108,131,https://t.co/539sETaW8T,https://twitter.com/i/broadcasts/1YqJDqbmQMQxV,NA,NA,NA,NA,NA,NA,NA,NA
GovRonDeSantis,1058807868,1487179006688563208,"This weekend will bring extreme cold temperatures throughout the state, with many counties below freezing. To prepare, @FLSERT is working with the FL Dept. of Citrus to monitor potential damage to crops &amp; county emergency managers to prepare.",2022-01-28 21:41:20+00:00,False,697,1816,5852,100,en,False,Twitter for iPhone,NA,NA,NA,NA,NA,NA,NA,NA,NA,NA,NA,NA
