ScreenName,AuthorID,TweetID,Text,TweetDate,isReply,RetweetCount,ReplyCount,LikeCount,QuoteCount,Language,PossibleSensitive,Source,1stURLStart,1stURLEnd,1stURL,1stURLExp,2ndURLStart,2ndURLEnd,2ndURL,2ndURLExp,3rdURLStart,3rdURLEnd,3rdURL,3rdURLExp
GovRonDeSantis,1058807868,1506740013307940870,"Grabbed a Polar Cup at the Dairy Kurl in Clearwater. 

I didn’t know these were still around! https://t.co/i6RvggKqId",2022-03-23 21:09:47+00:00,False,303,807,5327,58,en,False,Twitter for iPhone,94,117,https://t.co/i6RvggKqId,https://twitter.com/GovRonDeSantis/status/1506740013307940870/photo/1,NA,NA,NA,NA,NA,NA,NA,NA
GovRonDeSantis,1058807868,1506315576674865153,"By allowing men to compete in women's sports, the NCAA is destroying opportunities for women, making a mockery of its championships, and perpetuating a fraud.

In Florida, we reject these lies and recognize Sarasota's Emma Weyant as the best women's swimmer in the 500y freestyle. https://t.co/tBmFxFE3q6",2022-03-22 17:03:14+00:00,False,25531,7602,134597,3738,en,False,Twitter for iPhone,281,304,https://t.co/tBmFxFE3q6,https://twitter.com/GovRonDeSantis/status/1506315576674865153/photo/1,NA,NA,NA,NA,NA,NA,NA,NA
GovRonDeSantis,1058807868,1506279660023431171,"Governor DeSantis signs bill requiring all Florida high school students to fulfill a financial literacy class before graduation. 

https://t.co/SBurjOlNgq",2022-03-22 14:40:30+00:00,False,1859,1696,18371,417,en,False,Twitter Web App,131,154,https://t.co/SBurjOlNgq,https://fb.watch/bVCkvwz5lF/,NA,NA,NA,NA,NA,NA,NA,NA
GovRonDeSantis,1058807868,1505937821952999424,Governor DeSantis provides $800 million to raise teacher pay across the state. https://t.co/Ux7t3pjCQf,2022-03-21 16:02:10+00:00,False,509,1188,3958,87,en,False,Periscope,79,102,https://t.co/Ux7t3pjCQf,https://twitter.com/i/broadcasts/1LyGBoBPVPOJN,NA,NA,NA,NA,NA,NA,NA,NA
GovRonDeSantis,1058807868,1505897876739674113,Governor DeSantis is putting $800 million towards raising Florida teachers’ salaries. https://t.co/s4Hhtnidgx,2022-03-21 13:23:26+00:00,False,1365,2043,9798,203,en,False,Periscope,86,109,https://t.co/s4Hhtnidgx,https://twitter.com/i/broadcasts/1LyxBoBeryWKN,NA,NA,NA,NA,NA,NA,NA,NA
GovRonDeSantis,1058807868,1504805337362145281,Governor DeSantis announces more than $1.1 million for residents of Charlotte and Lee counties who were impacted by tornadoes. https://t.co/TOEyb9JXgD,2022-03-18 13:02:05+00:00,False,301,1578,2295,35,en,False,Periscope,127,150,https://t.co/TOEyb9JXgD,https://twitter.com/i/broadcasts/1mrGmaeQndQGy,NA,NA,NA,NA,NA,NA,NA,NA
GovRonDeSantis,1058807868,1504460003079385090,Governor DeSantis is in Okaloosa County with parents and teachers to champion progress monitoring in the classroom. https://t.co/bvzdGH1itU,2022-03-17 14:09:50+00:00,False,345,1174,2393,30,en,False,Periscope,116,139,https://t.co/bvzdGH1itU,https://twitter.com/i/broadcasts/1eaKbNPOVlBKX,NA,NA,NA,NA,NA,NA,NA,NA
GovRonDeSantis,1058807868,1504238582764036099,"Had a great sandwich at @FrankysDeli - a family-owned and operated deli that has been in Hialeah for almost 20 years.

Make sure to check it out: https://t.co/JIttHCtxbX https://t.co/fbGfUzve97",2022-03-16 23:30:00+00:00,False,223,770,2600,26,en,False,Twitter Media Studio,146,169,https://t.co/JIttHCtxbX,http://frankysdeli.com,170,193,https://t.co/fbGfUzve97,https://twitter.com/GovRonDeSantis/status/1504238582764036099/photo/1,NA,NA,NA,NA
GovRonDeSantis,1058807868,1504200839858204676,"In Florida, this is the year of the parent. https://t.co/7EAZtKJlCd",2022-03-16 21:00:01+00:00,False,2113,2057,18799,184,en,False,Twitter Media Studio,44,67,https://t.co/7EAZtKJlCd,https://twitter.com/GovRonDeSantis/status/1504200839858204676/photo/1,NA,NA,NA,NA,NA,NA,NA,NA
GovRonDeSantis,1058807868,1504160494864773122,"Our $289 million investment in education programs statewide focuses on improving student achievement and will go far in helping students who need extra assistance.

We remain committed to seeing all of our students succeed. https://t.co/uDnQKAL06C",2022-03-16 18:19:42+00:00,False,393,986,3149,25,en,False,Twitter Web App,224,247,https://t.co/uDnQKAL06C,https://twitter.com/GovRonDeSantis/status/1504160494864773122/photo/1,NA,NA,NA,NA,NA,NA,NA,NA
GovRonDeSantis,1058807868,1504103960675708934,$289 Million to Improve Learning for Students https://t.co/cyQTPem44j,2022-03-16 14:35:03+00:00,False,345,1053,2650,38,en,False,Periscope,46,69,https://t.co/cyQTPem44j,https://twitter.com/i/broadcasts/1zqJVBbMzqMJB,NA,NA,NA,NA,NA,NA,NA,NA
GovRonDeSantis,1058807868,1503820787131822095,"By replacing the FSA with progress monitoring, teachers will spend more time teaching, not testing &amp; parents will be kept up to date with their child’s progress. This will enable better feedback while ensuring appropriate accountability. 

Florida is leading the way in education. https://t.co/hONZCC8Ypo",2022-03-15 19:49:49+00:00,False,1646,2289,10832,193,en,False,Twitter Media Studio,285,308,https://t.co/hONZCC8Ypo,https://twitter.com/GovRonDeSantis/status/1503820787131822095/video/1,NA,NA,NA,NA,NA,NA,NA,NA
GovRonDeSantis,1058807868,1503752887507333130,Governor DeSantis officially eliminates the FSA in all public schools across Florida. https://t.co/JWWoUCfrAg,2022-03-15 15:20:01+00:00,False,1996,2252,11054,185,en,False,Periscope,86,109,https://t.co/JWWoUCfrAg,https://twitter.com/i/broadcasts/1lDxLLRRQPbxm,NA,NA,NA,NA,NA,NA,NA,NA
GovRonDeSantis,1058807868,1503416886289072129,Governor DeSantis closes out the 2022 Legislative Session. https://t.co/B3zfI7EAED,2022-03-14 17:04:52+00:00,False,382,1672,2943,37,en,False,Periscope,59,82,https://t.co/B3zfI7EAED,https://twitter.com/i/broadcasts/1jMJgeYrPQwKL,NA,NA,NA,NA,NA,NA,NA,NA
GovRonDeSantis,1058807868,1502404984419328008,"The Biden administration is using spiking energy prices as a pretext to legitimize the Maduro regime. 

The U.S. has massive energy reserves and we should expand production in the U.S., not trade one dictator’s oil for another dictator’s oil. https://t.co/rKqrGpS3NY",2022-03-11 22:03:56+00:00,False,4174,4054,18606,237,en,False,Twitter for iPhone,243,266,https://t.co/rKqrGpS3NY,https://twitter.com/GovRonDeSantis/status/1502404984419328008/photo/1,NA,NA,NA,NA,NA,NA,NA,NA
GovRonDeSantis,1058807868,1502349360574566402,Expand American Energy: Don't Line Maduro's Pockets https://t.co/e5CkkTxR6D,2022-03-11 18:22:54+00:00,False,836,1559,3580,46,en,False,Periscope,52,75,https://t.co/e5CkkTxR6D,https://twitter.com/i/broadcasts/1BdGYwPBQYQxX,NA,NA,NA,NA,NA,NA,NA,NA
GovRonDeSantis,1058807868,1501969719347269632,"The U.S. hit another 40-year inflation high in February. Bidenflation is driven by skyrocketing energy prices, which fuel price increases throughout the economy, not just for gas. 

Biden needs to unleash American energy production! https://t.co/4Wn1bR6gYQ",2022-03-10 17:14:20+00:00,False,2635,3722,12966,205,en,False,Twitter Web App,233,256,https://t.co/4Wn1bR6gYQ,https://twitter.com/GovRonDeSantis/status/1501969719347269632/photo/1,NA,NA,NA,NA,NA,NA,NA,NA
GovRonDeSantis,1058807868,1501581145544220676,"There is no place in Florida for COVID theater. 

These experts agree – no masking, no mandates and no medical censorship. https://t.co/Vx27FxSCNj",2022-03-09 15:30:17+00:00,False,4370,4522,19687,438,en,False,Twitter Media Studio,123,146,https://t.co/Vx27FxSCNj,https://twitter.com/GovRonDeSantis/status/1501581145544220676/video/1,NA,NA,NA,NA,NA,NA,NA,NA
GovRonDeSantis,1058807868,1501339480254472193,"At my direction, @FLDEO is working to provide $6.1 million to help Northwest Florida families get back on their feet after these devastating fires. 

We stand with you. https://t.co/jIfTYivQv7",2022-03-08 23:30:00+00:00,False,321,1549,2748,50,en,False,Twitter Media Studio,169,192,https://t.co/jIfTYivQv7,https://twitter.com/GovRonDeSantis/status/1501339480254472193/video/1,NA,NA,NA,NA,NA,NA,NA,NA
GovRonDeSantis,1058807868,1501331938086293511,"The Biden Administration needs to listen to Americans &amp; increase domestic energy instead of relying on authoritarian regimes to fuel our country. Gas prices are out of control &amp; people are getting hammered at the pump. 

The time is now to make America energy independent - again.",2022-03-08 23:00:02+00:00,False,9856,5649,50173,595,en,False,Twitter Web App,NA,NA,NA,NA,NA,NA,NA,NA,NA,NA,NA,NA
GovRonDeSantis,1058807868,1501309928367017984,Governor DeSantis announces additional state resources for families impacted by the Bay County fires. https://t.co/lhtd4OIv4Q,2022-03-08 21:32:34+00:00,False,172,1071,1394,20,en,False,Periscope,102,125,https://t.co/lhtd4OIv4Q,https://twitter.com/i/broadcasts/1YqKDqAqMwzGV,NA,NA,NA,NA,NA,NA,NA,NA
GovRonDeSantis,1058807868,1500958603645276161,"In Florida, we protect the rights of Floridians to make decisions for themselves and their children.
 
We reject narratives and hysteria in favor of truth and data. There is no place in Florida for COVID theater.",2022-03-07 22:16:32+00:00,False,10508,6961,60705,934,en,False,Twitter Web App,NA,NA,NA,NA,NA,NA,NA,NA,NA,NA,NA,NA
GovRonDeSantis,1058807868,1500945966366531587,Gov. DeSantis Designates Strawberry Shortcake as the Official Dessert of Florida https://t.co/kzNDVGa61U,2022-03-07 21:26:19+00:00,False,518,2043,4592,273,en,False,Periscope,81,104,https://t.co/kzNDVGa61U,https://twitter.com/i/broadcasts/1kvJpAdRAvaxE,NA,NA,NA,NA,NA,NA,NA,NA
GovRonDeSantis,1058807868,1500886696396832769,"We had a great discussion with renowned scientists that debunked many false narratives about COVID. 

Watch it before YouTube takes it down:

https://t.co/QriBrJ9hrA",2022-03-07 17:30:48+00:00,False,3602,1967,11327,232,en,False,Twitter Web App,142,165,https://t.co/QriBrJ9hrA,https://youtu.be/iulvEmAmtcQ,NA,NA,NA,NA,NA,NA,NA,NA
GovRonDeSantis,1058807868,1500848850088591365,Governor DeSantis hosts a roundtable with physicians nationwide on ending COVID theater once and for all. https://t.co/dYRGpMEVS7,2022-03-07 15:00:24+00:00,False,3193,1942,10792,305,en,False,Periscope,106,129,https://t.co/dYRGpMEVS7,https://twitter.com/i/broadcasts/1ZkKzbqrjVLKv,NA,NA,NA,NA,NA,NA,NA,NA
GovRonDeSantis,1058807868,1500631934468333571,"It is wrong for the Biden Administration to beg for oil from Venezuela &amp; legitimize Maduro’s communist regime during an official visit. 

The U.S. should hold Maduro accountable while increasing domestic energy production so we won’t need to rely on hostile regimes for energy.",2022-03-07 00:38:28+00:00,False,9469,4302,45608,626,en,False,Twitter for iPhone,NA,NA,NA,NA,NA,NA,NA,NA,NA,NA,NA,NA
GovRonDeSantis,1058807868,1500608131562356746,Florida’s best are working 24/7 to stop the wildfires in Bay County. Evacuations may be needed if winds shift so please follow local guidance. Stay up-to-date on conditions with @FLSERT. https://t.co/c384L6Xvvf,2022-03-06 23:03:53+00:00,False,313,688,2624,27,en,False,Twitter for iPhone,187,210,https://t.co/c384L6Xvvf,https://twitter.com/GovRonDeSantis/status/1500608131562356746/photo/1,NA,NA,NA,NA,NA,NA,NA,NA
GovRonDeSantis,1058807868,1500581128037486592,Gov. DeSantis Addresses Wildfire Response Efforts in Bay County https://t.co/G2Mai7sVGg,2022-03-06 21:16:35+00:00,False,136,567,1068,15,en,False,Periscope,64,87,https://t.co/G2Mai7sVGg,https://twitter.com/i/broadcasts/1vOxwygVajrGB,NA,NA,NA,NA,NA,NA,NA,NA
GovRonDeSantis,1058807868,1500564091987013636,Bay County has the full support of my administration as we work with local officials to stop the wildfires ravaging their community. Please stay alert if you’re in the area and follow local guidance on evacuations and road closures. Follow @FLSERT for the latest updates. https://t.co/YrYjr04ZHr,2022-03-06 20:08:53+00:00,False,223,826,1873,24,en,False,Twitter for iPhone,272,295,https://t.co/YrYjr04ZHr,https://twitter.com/GovRonDeSantis/status/1500564091987013636/photo/1,NA,NA,NA,NA,NA,NA,NA,NA
GovRonDeSantis,1058807868,1500135206904156161,Gov. DeSantis Is in Bay County Responding to Wildfire Damages https://t.co/ylHp9T4PtA,2022-03-05 15:44:39+00:00,False,241,1075,1727,35,en,False,Periscope,62,85,https://t.co/ylHp9T4PtA,https://twitter.com/i/broadcasts/1mrGmaNggaVGy,NA,NA,NA,NA,NA,NA,NA,NA
GovRonDeSantis,1058807868,1499864368510611458,"Bay County is currently battling several wildfires. If you are in the area, please stay safe and follow guidance from local officials. 

@FLSERT is on the ground providing support.",2022-03-04 21:48:26+00:00,False,280,966,2138,30,en,False,Twitter for iPhone,NA,NA,NA,NA,NA,NA,NA,NA,NA,NA,NA,NA
GovRonDeSantis,1058807868,1499777168754167808,"Governor DeSantis announces that global shipping company, Sea-Lead Shipping, is moving part of their operations from California to Jacksonville. https://t.co/oXZHSDAjqX",2022-03-04 16:01:56+00:00,False,1976,1507,11494,179,en,False,Periscope,145,168,https://t.co/oXZHSDAjqX,https://twitter.com/i/broadcasts/1nAKEYMkXpYKL,NA,NA,NA,NA,NA,NA,NA,NA
GovRonDeSantis,1058807868,1499769316618772486,I will veto the congressional reapportionment plan currently being debated by the House. DOA.,2022-03-04 15:30:44+00:00,False,1905,2545,17889,305,en,False,Twitter for iPhone,NA,NA,NA,NA,NA,NA,NA,NA,NA,NA,NA,NA
GovRonDeSantis,1058807868,1499474417403019269,Excited to share this update about First Lady @FLCaseyDeSantis’ health: https://t.co/HsMjWwPHIv,2022-03-03 19:58:54+00:00,False,4395,5668,47116,840,en,False,Twitter Media Studio,72,95,https://t.co/HsMjWwPHIv,https://twitter.com/GovRonDeSantis/status/1499474417403019269/video/1,NA,NA,NA,NA,NA,NA,NA,NA
GovRonDeSantis,1058807868,1499417406384398342,Governor DeSantis holds a press conference to address the importance of protecting the freedom of speech for Florida’s health practitioners. https://t.co/hD1LLkI8sL,2022-03-03 16:12:22+00:00,False,1370,2964,7244,175,en,False,Periscope,141,164,https://t.co/hD1LLkI8sL,https://twitter.com/i/broadcasts/1jMKgeZleWwJL,NA,NA,NA,NA,NA,NA,NA,NA
GovRonDeSantis,1058807868,1499397188505387014,"Dr. Ladapo on New Florida Right to Try Guidance: It’s been a tragedy that the medical community has stuck with the CDC and Fauci instead of relying on clinical wisdom and expertise. 

Now doctors can decide what’s the best treatment for their patients in Florida. https://t.co/U4uB5Q8ncg",2022-03-03 14:52:01+00:00,False,3263,2676,12479,328,en,False,Twitter Media Studio,264,287,https://t.co/U4uB5Q8ncg,https://twitter.com/GovRonDeSantis/status/1499397188505387014/video/1,NA,NA,NA,NA,NA,NA,NA,NA
GovRonDeSantis,1058807868,1499142635222704130,"Our $20 million investment in cybersecurity workforce education will double enrollment in cybersecurity and IT pathways to more than 300,000 by 2024.",2022-03-02 22:00:31+00:00,False,869,2055,8731,82,en,False,Twitter Web App,NA,NA,NA,NA,NA,NA,NA,NA,NA,NA,NA,NA
GovRonDeSantis,1058807868,1499044549951246341,Governor DeSantis is at the University of South Florida to announce investments in cybersecurity workforce education. https://t.co/hfcVPmDacb,2022-03-02 15:30:46+00:00,False,1132,9360,6259,499,en,False,Periscope,118,141,https://t.co/hfcVPmDacb,https://twitter.com/i/broadcasts/1eaKbNRZlokKX,NA,NA,NA,NA,NA,NA,NA,NA
GovRonDeSantis,1058807868,1498845889485586436,https://t.co/LF6R4E0kGM,2022-03-02 02:21:21+00:00,False,3469,5534,29314,921,und,False,Twitter Web App,0,23,https://t.co/LF6R4E0kGM,https://twitter.com/GovRonDeSantis/status/1498845889485586436/photo/1,NA,NA,NA,NA,NA,NA,NA,NA
GovRonDeSantis,1058807868,1498810315492016129,"Florida businesses need to stop relying on outdated CDC forced masking of worker requirements. @FLSurgeonGen Ladapo has put out new guidance for Florida workers liberating them from 8 hour forced mask workdays. 

A 9 to 5 job should not be a N-95 job. https://t.co/QeLo2hUfJk",2022-03-02 00:00:00+00:00,False,2634,2887,13598,335,en,False,Twitter Media Studio,252,275,https://t.co/QeLo2hUfJk,https://twitter.com/GovRonDeSantis/status/1498810315492016129/video/1,NA,NA,NA,NA,NA,NA,NA,NA
GovRonDeSantis,1058807868,1498705260021493764,"As this legislative session continues, I am asking for $300 million in funding to make sure that we can continue to fund vital infrastructure and advance workforce training. https://t.co/rz5ouC9xXp",2022-03-01 17:02:33+00:00,False,293,1209,2645,32,en,False,Twitter Web App,174,197,https://t.co/rz5ouC9xXp,https://twitter.com/GovRonDeSantis/status/1498705260021493764/photo/1,NA,NA,NA,NA,NA,NA,NA,NA
GovRonDeSantis,1058807868,1498403930916548609,Governor Ron DeSantis is in Indian River County announcing $4.45 million in small community infrastructure investments. https://t.co/5AnUaSG7X1,2022-02-28 21:05:10+00:00,False,271,1476,2193,81,en,False,Periscope,120,143,https://t.co/5AnUaSG7X1,https://twitter.com/i/broadcasts/1yNGaYdrpzVGj,NA,NA,NA,NA,NA,NA,NA,NA
GovRonDeSantis,1058807868,1498372506578608129,"Last week, the Biden Administration requested the assistance of State National Guards to deploy to Washington D.C. I have rejected this request — there will be no @FLGuard sent to D.C. for Biden’s State of the Union.",2022-02-28 19:00:18+00:00,False,10302,31876,70361,4813,en,False,Twitter Web App,NA,NA,NA,NA,NA,NA,NA,NA,NA,NA,NA,NA
GovRonDeSantis,1058807868,1498062891328708615,"Force-masking employees for the appearance of safety is not a sufficient justification. 

COVID theater has no place in Florida. https://t.co/jzkIX67c9y",2022-02-27 22:30:00+00:00,False,3879,1950,21838,330,en,False,Twitter Media Studio,129,152,https://t.co/jzkIX67c9y,https://twitter.com/GovRonDeSantis/status/1498062891328708615/video/1,NA,NA,NA,NA,NA,NA,NA,NA
GovRonDeSantis,1058807868,1497677852690497546,"Doctors have the authority to decide what treatments to give their COVID patients in Florida. 

This ability should not be circumscribed due to politics. https://t.co/axFgKhcXJP",2022-02-26 21:00:00+00:00,False,3339,1923,16862,242,en,False,Twitter Media Studio,154,177,https://t.co/axFgKhcXJP,https://twitter.com/GovRonDeSantis/status/1497677852690497546/video/1,NA,NA,NA,NA,NA,NA,NA,NA
GovRonDeSantis,1058807868,1497589629972881410,"Barbara has made profound contributions to pediatric health care in Florida and beyond, raising over $160 million through the Nicklaus Children’s Health Care Foundation. Thanks to Barbara for setting the standard for community service!",2022-02-26 15:09:26+00:00,True,119,408,1721,5,en,False,Twitter for iPhone,NA,NA,NA,NA,NA,NA,NA,NA,NA,NA,NA,NA
GovRonDeSantis,1058807868,1497589581033746440,"I was proud to award Barbara Nicklaus, the First Lady of Golf, with the Governor’s Medal of Freedom. https://t.co/yhZ5ltM8MD",2022-02-26 15:09:14+00:00,False,308,746,3555,24,en,False,Twitter for iPhone,101,124,https://t.co/yhZ5ltM8MD,https://twitter.com/GovRonDeSantis/status/1497589581033746440/photo/1,NA,NA,NA,NA,NA,NA,NA,NA
GovRonDeSantis,1058807868,1497356638352809985,Excited to stop by the Honda Classic in Palm Beach Gardens with Mason today. Hope everyone has a great time. https://t.co/ENTk3sB6WV,2022-02-25 23:43:36+00:00,False,231,734,3446,27,en,False,Twitter for iPhone,109,132,https://t.co/ENTk3sB6WV,https://twitter.com/GovRonDeSantis/status/1497356638352809985/photo/1,109,132,https://t.co/ENTk3sB6WV,https://twitter.com/GovRonDeSantis/status/1497356638352809985/photo/1,NA,NA,NA,NA
GovRonDeSantis,1058807868,1497308184343564290,Governor DeSantis awards Barbara Nicklaus with the Governor’s Medal of Freedom. https://t.co/2UIwqWyqrx,2022-02-25 20:31:04+00:00,False,187,619,1661,19,en,False,Periscope,80,103,https://t.co/2UIwqWyqrx,https://twitter.com/i/broadcasts/1dRJZlRQbjvKB,NA,NA,NA,NA,NA,NA,NA,NA
GovRonDeSantis,1058807868,1497224651763761180,Thank you to Sen. Broxson and @braddrake5 for protecting the free speech of doctors and bucking the politicized medical establishment. Looking forward to these bills hitting my desk.,2022-02-25 14:59:08+00:00,False,681,1083,4943,36,en,False,Twitter Web App,NA,NA,NA,NA,NA,NA,NA,NA,NA,NA,NA,NA
GovRonDeSantis,1058807868,1496984787801751558,"Too many workers, especially in service and retail industries, have been made to toil under corporate forced masking policies, creating a two-tiered society. 

Thanks to the @FLSurgeonGen for issuing new guidance recommending against corporate forced masking policies. https://t.co/ELcrsVdR7V",2022-02-24 23:06:00+00:00,False,1605,2278,7008,205,en,False,Twitter Media Studio,269,292,https://t.co/ELcrsVdR7V,https://twitter.com/GovRonDeSantis/status/1496984787801751558/video/1,NA,NA,NA,NA,NA,NA,NA,NA
GovRonDeSantis,1058807868,1496935881558528009,"People want to live freely in Florida without corporate masking creating a two-tier society, overbearing isolation for their children, and their health care practitioners having the freedom to follow science, not outdated and politicized “guidance.”

https://t.co/AeWlJ0d0lS",2022-02-24 19:51:40+00:00,False,2162,2479,15659,211,en,False,Twitter Web App,251,274,https://t.co/AeWlJ0d0lS,https://www.flgov.com/2022/02/24/governor-ron-desantis-and-surgeon-general-dr-joe-ladapo-buck-cdc-with-new-official-state-guidance/,NA,NA,NA,NA,NA,NA,NA,NA
GovRonDeSantis,1058807868,1496867147640942593,"My administration created the Rural Infrastructure Fund to invest in the growth of communities across the state.

Our $1 million investment in Glades County will improve the county's infrastructure for current residents while also building future opportunities. https://t.co/rWUXgwlNu4",2022-02-24 15:18:33+00:00,False,274,955,2632,33,en,False,Twitter Web App,262,285,https://t.co/rWUXgwlNu4,https://twitter.com/GovRonDeSantis/status/1496867147640942593/photo/1,NA,NA,NA,NA,NA,NA,NA,NA
GovRonDeSantis,1058807868,1496588488057131009,Governor DeSantis awards more than $1 million to Glades County through the Rural Infrastructure Fund. https://t.co/lxWALa8RNo,2022-02-23 20:51:15+00:00,False,238,872,2008,23,en,False,Periscope,102,125,https://t.co/lxWALa8RNo,https://twitter.com/i/broadcasts/1dRKZlRnQLAJB,NA,NA,NA,NA,NA,NA,NA,NA
GovRonDeSantis,1058807868,1495911213607243778,Thank you to Grumpy’s Diner for hosting me and Madison today! Check them out if you’re looking for a great spot in North Central Florida: https://t.co/3TK8YiVVk8 https://t.co/W22EQ4qIxc,2022-02-22 00:00:00+00:00,False,312,1098,4048,30,en,False,Twitter Media Studio,138,161,https://t.co/3TK8YiVVk8,https://www.grumpysdinermadison.com,162,185,https://t.co/W22EQ4qIxc,https://twitter.com/GovRonDeSantis/status/1495911213607243778/photo/1,NA,NA,NA,NA
GovRonDeSantis,1058807868,1495805638181535754,My administration is committed to supporting rural communities &amp; our small cities with the funds they need to improve infrastructure that benefits Florida families &amp; small businesses. Glad to be in Madison County to award nearly $11 million for communities across North Florida. https://t.co/tLieQQqZCD,2022-02-21 17:00:29+00:00,False,402,1132,3317,52,en,False,Twitter Web App,287,310,https://t.co/tLieQQqZCD,https://twitter.com/GovRonDeSantis/status/1495805638181535754/photo/1,NA,NA,NA,NA,NA,NA,NA,NA
GovRonDeSantis,1058807868,1495782556410818565,"All presidents are not created equal, and while we colloquially call today Presidents Day, the holiday is codified in law solely to commemorate Washington’s birthday. This is appropriate, as Washington is America’s indispensable man. Happy Birthday to the father of our country!",2022-02-21 15:28:46+00:00,True,1024,608,8570,54,en,False,Twitter Web App,NA,NA,NA,NA,NA,NA,NA,NA,NA,NA,NA,NA
GovRonDeSantis,1058807868,1495782555374735365,George Washington guided the nation through revolution and the launching of a new ship of state under a written constitution. His great feats — especially his voluntary and repeated relinquishment of power — exemplify character and leadership traits that have never been matched.,2022-02-21 15:28:46+00:00,False,1999,1254,14719,119,en,False,Twitter Web App,NA,NA,NA,NA,NA,NA,NA,NA,NA,NA,NA,NA
GovRonDeSantis,1058807868,1495775738661908493,"Gov. Ron DeSantis announces nearly $11 million for rural North Florida communities that will help improve infrastructure and create opportunities for future business growth.
Watch Live: https://t.co/MDPu2lJFhi",2022-02-21 15:01:40+00:00,False,205,740,1727,69,en,False,Twitter Web App,186,209,https://t.co/MDPu2lJFhi,https://www.facebook.com/watch/live/?ref=search&v=505566724328439,NA,NA,NA,NA,NA,NA,NA,NA
GovRonDeSantis,1058807868,1495518625981034500,"Too many businesses, particularly corporate chains, force their employees to wear masks all day. 

This is unfair to the employees, who should have the same choices as everyone else. It's past time for these workers to be liberated from corporate forced masking policies. https://t.co/elOgvLq0rZ",2022-02-20 22:00:00+00:00,False,7458,4107,36332,919,en,False,Twitter Media Studio,272,295,https://t.co/elOgvLq0rZ,https://twitter.com/GovRonDeSantis/status/1495518625981034500/video/1,NA,NA,NA,NA,NA,NA,NA,NA
GovRonDeSantis,1058807868,1495458230021111813,Great to visit the Gulfarium Marine Adventure Park and to see the penguins! https://t.co/fJ9FC8javY,2022-02-20 18:00:00+00:00,False,398,1144,6025,39,en,False,Twitter Media Studio,76,99,https://t.co/fJ9FC8javY,https://twitter.com/GovRonDeSantis/status/1495458230021111813/photo/1,NA,NA,NA,NA,NA,NA,NA,NA
GovRonDeSantis,1058807868,1495073254779887620,"Florida’s history runs deep at the Silver Spurs Rodeo, the largest rodeo east of the Mississippi River. 

Thank you for a great evening and having me for the start of the 148th season. https://t.co/odcMSCwp5w",2022-02-19 16:30:15+00:00,False,254,1002,2796,26,en,False,Twitter for iPhone,185,208,https://t.co/odcMSCwp5w,https://twitter.com/GovRonDeSantis/status/1495073254779887620/photo/1,NA,NA,NA,NA,NA,NA,NA,NA
