ScreenName,AuthorID,TweetID,Text,TweetDate,isReply,RetweetCount,ReplyCount,LikeCount,QuoteCount,Language,PossibleSensitive,Source,1stURLStart,1stURLEnd,1stURL,1stURLExp,2ndURLStart,2ndURLEnd,2ndURL,2ndURLExp,3rdURLStart,3rdURLEnd,3rdURL,3rdURLExp
GovRonDeSantis,1058807868,1428785376685084680,"Today, @SFWMD announced the groundbreaking for the construction of an underground seepage wall in the Las Palmas Community, which will mitigate flooding and increase the flow of water south for Everglades restoration. https://t.co/623vISZzbf",2021-08-20 18:25:54+00:00,False,127,765,1437,11,en,False,Twitter Web App,218,241,https://t.co/623vISZzbf,https://twitter.com/GovRonDeSantis/status/1428785376685084680/photo/1,NA,NA,NA,NA,NA,NA,NA,NA
GovRonDeSantis,1058807868,1428764260436434945,"Today, we will be rooting for Martin County North in the Little League World Series.

Make sure to tune in at 3PM on ESPN.",2021-08-20 17:01:59+00:00,False,237,626,3251,19,en,False,Twitter Web App,NA,NA,NA,NA,NA,NA,NA,NA,NA,NA,NA,NA
GovRonDeSantis,1058807868,1428748295753641986,"July was Florida’s best month for job growth in over a year.

Nearly 64,000 private sector jobs were added. https://t.co/PppwZZ5b7E",2021-08-20 15:58:33+00:00,False,1174,1268,8654,129,en,False,Twitter Web App,108,131,https://t.co/PppwZZ5b7E,https://twitter.com/GovRonDeSantis/status/1428748295753641986/photo/1,NA,NA,NA,NA,NA,NA,NA,NA
GovRonDeSantis,1058807868,1428736683852410880,"Watch live: Governor Ron DeSantis opens a new monoclonal treatment site at the Old Bonita Springs Library.
https://t.co/wcNlQXDwJ8",2021-08-20 15:12:24+00:00,False,227,678,1442,44,en,False,Twitter Web App,107,130,https://t.co/wcNlQXDwJ8,https://rumble.com/vlg8g8-gov.-desantis-opens-new-monoclonal-treatment-site-in-bonita-springs.html?mref=k33h9&mrefc=2,NA,NA,NA,NA,NA,NA,NA,NA
GovRonDeSantis,1058807868,1428493268585693190,"A new monoclonal antibody treatment site is now open in the Hudson area at the Fasano Center.
 
It’s open 7 days a week, 9AM-5PM. 
 
You can make an appointment at: https://t.co/SVZEvCb03k https://t.co/xg6PKMT2Xd",2021-08-19 23:05:10+00:00,False,757,1603,4871,100,en,False,Twitter for iPhone,165,188,https://t.co/SVZEvCb03k,http://patientportalfl.com,189,212,https://t.co/xg6PKMT2Xd,https://twitter.com/GovRonDeSantis/status/1428493268585693190/photo/1,NA,NA,NA,NA
GovRonDeSantis,1058807868,1428471462738939912,"Took Madison to Buc-ee’s for the first time. She liked the Beaver Chips and the Cotton Candy Dippin Dots ice cream, but most everything they have is great! https://t.co/b3mjfxv49T",2021-08-19 21:38:31+00:00,False,2031,3690,41128,490,en,False,Twitter for iPhone,156,179,https://t.co/b3mjfxv49T,https://twitter.com/GovRonDeSantis/status/1428471462738939912/photo/1,NA,NA,NA,NA,NA,NA,NA,NA
GovRonDeSantis,1058807868,1428446712998268933,"Another new monoclonal antibody treatment location is open at the Ormond Beach Senior Center.
 
-It’s open 7 days a week, 9AM-5PM.
-Over 300 patients per day can receive treatment at this location.
 
Make an appointment at: https://t.co/SVZEvCb03k https://t.co/lIFtuDMWUR",2021-08-19 20:00:10+00:00,False,712,1272,3932,120,en,False,Twitter for iPhone,224,247,https://t.co/SVZEvCb03k,http://patientportalfl.com,248,271,https://t.co/lIFtuDMWUR,https://twitter.com/GovRonDeSantis/status/1428446712998268933/photo/1,NA,NA,NA,NA
GovRonDeSantis,1058807868,1428406288988450824,"Governor DeSantis opens a new monoclonal antibody treatment site in Hudson. Watch live: 
https://t.co/bQ7AIcAjyA",2021-08-19 17:19:32+00:00,False,332,1041,2574,51,en,False,Twitter Web App,89,112,https://t.co/bQ7AIcAjyA,https://fb.watch/7ui-zt_Okl/,NA,NA,NA,NA,NA,NA,NA,NA
GovRonDeSantis,1058807868,1428143733757857792,.@FLCaseyDeSantis and I are heartbroken to hear of the passing of Officer Raynor. He was a hero who served his community bravely. Today we are praying for his family and the entire @DaytonaBchPD. https://t.co/RFQcVtdiey,2021-08-18 23:56:14+00:00,False,563,897,4156,60,en,False,Twitter for iPhone,196,219,https://t.co/RFQcVtdiey,https://twitter.com/DaytonaBchPD/status/1427789515452788737,NA,NA,NA,NA,NA,NA,NA,NA
GovRonDeSantis,1058807868,1428092964807471104,"Those who try to politicize COVID treatments are doing a disservice to those who may be deterred from seeking life-saving treatments.  

Monoclonal antibody treatments have a proven record of reducing the need for hospitalization and are available free of charge to patients. https://t.co/U5vw2nimfj",2021-08-18 20:34:30+00:00,False,2774,3622,11357,337,en,False,Twitter Media Studio,276,299,https://t.co/U5vw2nimfj,https://twitter.com/GovRonDeSantis/status/1428092964807471104/video/1,NA,NA,NA,NA,NA,NA,NA,NA
GovRonDeSantis,1058807868,1428076372719816711,"Gov. Ron DeSantis visits a new monoclonal antibody testing site in West Palm Beach at West Gate Park.
Watch live: https://t.co/ug1Qj109b3",2021-08-18 19:28:34+00:00,False,188,853,1380,27,en,False,Twitter Web App,114,137,https://t.co/ug1Qj109b3,https://thefloridachannel.org/,NA,NA,NA,NA,NA,NA,NA,NA
GovRonDeSantis,1058807868,1428048480040259587,"Watch live: Gov. Ron DeSantis opens a new monoclonal antibody treatment site in Pembroke Pines.
https://t.co/y8GSspRC8p",2021-08-18 17:37:44+00:00,False,432,1122,3486,55,en,False,Twitter Web App,96,119,https://t.co/y8GSspRC8p,https://fb.watch/7s-Leuc4Vj/,NA,NA,NA,NA,NA,NA,NA,NA
GovRonDeSantis,1058807868,1427767064559857679,"As long as I am Governor, Florida will always be a state that stands with the men and women of law enforcement. https://t.co/ofja1q8gAy",2021-08-17 22:59:29+00:00,False,2576,2651,27583,231,en,False,Twitter Web App,112,135,https://t.co/ofja1q8gAy,https://twitter.com/GovRonDeSantis/status/1427767064559857679/photo/1,NA,NA,NA,NA,NA,NA,NA,NA
GovRonDeSantis,1058807868,1427727023972225025,"My legislative priorities to support law enforcement include: 
- $5,000 signing bonuses for every new officer
- A relocation recruitment program for out-of-state officers looking to move to Florida 
- $5 million per year for a law enforcement academy scholarship program",2021-08-17 20:20:23+00:00,True,345,343,2843,41,en,False,Twitter Web App,NA,NA,NA,NA,NA,NA,NA,NA,NA,NA,NA,NA
GovRonDeSantis,1058807868,1427726959786741762,"At the National FOP Convention, I announced my commitment to recruit and reward high-quality law enforcement officers in Florida through three programs that will be included and prioritized in the upcoming legislative session. https://t.co/EsQL8Krmha",2021-08-17 20:20:07+00:00,False,499,923,4258,38,en,False,Twitter Web App,227,250,https://t.co/EsQL8Krmha,https://twitter.com/GovRonDeSantis/status/1427726959786741762/photo/1,NA,NA,NA,NA,NA,NA,NA,NA
GovRonDeSantis,1058807868,1427614572433874945,"Today, we are opening a new monoclonal antibody treatment site in Merritt Island at Kiwanis Island Park.
 
✔️It’s open from 9AM - 7PM, 7 days a week, and
✔️Has the capacity to serve more than 300 patients per day.
 
Find more info at https://t.co/SVZEvCb03k",2021-08-17 12:53:32+00:00,False,867,2411,5427,197,en,False,Twitter for iPhone,234,257,https://t.co/SVZEvCb03k,http://patientportalfl.com,NA,NA,NA,NA,NA,NA,NA,NA
GovRonDeSantis,1058807868,1427416591042555905,"If you lost power during #Fred, remember to use caution when setting up &amp; running your portable generator.
 
⬇️ Follow the simple tips below to keep you &amp; your family safe. Find more information on generator safety at https://t.co/mMOROvk2aW &amp; https://t.co/ahJA3NoROs. https://t.co/ickUGxWlpg",2021-08-16 23:46:50+00:00,False,134,581,833,16,en,False,Twitter for iPhone,226,249,https://t.co/mMOROvk2aW,http://FloridaDisaster.org,256,279,https://t.co/ahJA3NoROs,http://FloridaHealth.gov,256,279,https://t.co/ahJA3NoROs,http://FloridaHealth.gov
GovRonDeSantis,1058807868,1427410646522638336,"This afternoon, #Fred made landfall in Cape San Blas. This does not mean impacts are over. Tropical storm warnings are still in effect from the Okaloosa/Walton County line to the Steinhatchee River. Residents should continue to avoid flooded roads &amp; listen to local officials. https://t.co/Hnmv3QJ9lW",2021-08-16 23:23:12+00:00,False,108,225,716,5,en,False,Twitter Web App,281,304,https://t.co/Hnmv3QJ9lW,https://twitter.com/GovRonDeSantis/status/1427410646522638336/photo/1,NA,NA,NA,NA,NA,NA,NA,NA
GovRonDeSantis,1058807868,1427390188171505674,"As of today, the Camping World Stadium in Orlando will serve as a monoclonal antibody treatment site, open 7 days a week, with a capacity of 320 patients a day.

Expanding access to this treatment will help our most vulnerable stay out of the hospital and save lives. https://t.co/jGl1ClSj6k",2021-08-16 22:01:55+00:00,False,3066,9496,16155,1999,en,False,Twitter Web App,268,291,https://t.co/jGl1ClSj6k,https://twitter.com/GovRonDeSantis/status/1427390188171505674/photo/1,NA,NA,NA,NA,NA,NA,NA,NA
GovRonDeSantis,1058807868,1427382833920806913,"Tomorrow, Aug. 17th, our monoclonal antibody center is shifting to a long-term site at the Jax Public Library, with triple the capacity of a mobile unit and 300+ spots available daily. It's open 7 days a week, 9am-5pm at 304 N. Main Street. Register here: https://t.co/SVZEvCb03k",2021-08-16 21:32:41+00:00,False,499,914,3078,73,en,False,Twitter for iPhone,256,279,https://t.co/SVZEvCb03k,http://patientportalfl.com,NA,NA,NA,NA,NA,NA,NA,NA
GovRonDeSantis,1058807868,1427338140415635466,"I am in Orlando today with healthcare professionals to discuss the impact of using monoclonal antibody treatments and Florida’s latest expansion of these treatments in Central Florida. 
Watch live: https://t.co/r85Gu6l3U5",2021-08-16 18:35:05+00:00,False,428,1590,3271,137,en,False,Twitter Web App,198,221,https://t.co/r85Gu6l3U5,https://fb.watch/7qqlRNzBkV/,NA,NA,NA,NA,NA,NA,NA,NA
GovRonDeSantis,1058807868,1427325943979327488,"#Fred continues to strengthen as it approaches the Panhandle. Landfall is expected late afternoon and will bring heavy rainfall, strong winds, and storm surge. Residents are reminded not to drive through flooded roadways. https://t.co/3PjBueqPHi",2021-08-16 17:46:38+00:00,False,167,425,1044,10,en,False,Twitter Web App,222,245,https://t.co/3PjBueqPHi,https://twitter.com/GovRonDeSantis/status/1427325943979327488/photo/1,NA,NA,NA,NA,NA,NA,NA,NA
GovRonDeSantis,1058807868,1427035500267835393,My administration and the Florida Legislature support our law enforcement. https://t.co/dbyDoNqp3a,2021-08-15 22:32:30+00:00,False,695,1373,6871,65,en,False,Twitter Web App,75,98,https://t.co/dbyDoNqp3a,https://twitter.com/GovRonDeSantis/status/1427035500267835393/video/1,NA,NA,NA,NA,NA,NA,NA,NA
GovRonDeSantis,1058807868,1426985107156606980,Monoclonal antibody treatments such as Regeneron are an effective early treatment for COVID-19 and have shown to reduce hospitalizations by 70%. https://t.co/XkmsOS3UeF,2021-08-15 19:12:16+00:00,False,2286,3463,11291,502,en,False,Twitter for iPhone,145,168,https://t.co/XkmsOS3UeF,https://twitter.com/GovRonDeSantis/status/1426985107156606980/video/1,NA,NA,NA,NA,NA,NA,NA,NA
GovRonDeSantis,1058807868,1426932688250933249,"#Fred redeveloped into a Tropical Storm this morning. TS warnings have been issued from Navarre to the Wakulla/Jefferson county line. 

These areas should expect heavy rainfall &amp; the possibility of flooding. Turn on weather alerts, follow @FLSERT &amp; monitor local news for updates. https://t.co/TfmWIVS5qJ",2021-08-15 15:43:58+00:00,False,159,644,963,23,en,False,Twitter for iPhone,289,312,https://t.co/TfmWIVS5qJ,https://twitter.com/GovRonDeSantis/status/1426932688250933249/photo/1,NA,NA,NA,NA,NA,NA,NA,NA
GovRonDeSantis,1058807868,1426717345158942721,"For over 175,000 full-time public school teachers and more than 3,600 public school principals across Florida, $1,000 bonus checks are arriving in the mail as a token of appreciation for their dedication to educating our children. https://t.co/eNhYCrzYGr",2021-08-15 01:28:16+00:00,False,1654,2932,12747,371,en,False,Twitter for iPhone,231,254,https://t.co/eNhYCrzYGr,https://twitter.com/GovRonDeSantis/status/1426717345158942721/video/1,NA,NA,NA,NA,NA,NA,NA,NA
GovRonDeSantis,1058807868,1426671504092274692,"Monoclonal antibodies have been used to combat COVID-19 in earnest for almost all of 2021, but they have not received much attention. 

The results have been positive, but the key is having patients receive it in time, early enough in the infection to neutralize the virus. https://t.co/VjFy0qHsDF",2021-08-14 22:26:07+00:00,False,1543,2167,6149,187,en,False,Twitter Web App,274,297,https://t.co/VjFy0qHsDF,https://twitter.com/GovRonDeSantis/status/1426671504092274692/video/1,NA,NA,NA,NA,NA,NA,NA,NA
GovRonDeSantis,1058807868,1426618828709056513,"Here in Florida, we are thankful that our law enforcement has gone above and beyond the call of duty to keep us safe over the last year and a half. https://t.co/bftYi1UU3Q",2021-08-14 18:56:48+00:00,False,1265,1938,10309,101,en,False,Twitter Web App,148,171,https://t.co/bftYi1UU3Q,https://twitter.com/GovRonDeSantis/status/1426618828709056513/video/1,NA,NA,NA,NA,NA,NA,NA,NA
GovRonDeSantis,1058807868,1426392842612756482,"To further honor the legacy of Bobby Bowden, Florida’s Historic Capitol will light up garnet and gold tonight and tomorrow. https://t.co/LfER6qxHDn",2021-08-14 03:58:49+00:00,False,1095,1699,10362,76,en,False,Twitter Web App,124,147,https://t.co/LfER6qxHDn,https://twitter.com/GovRonDeSantis/status/1426392842612756482/photo/1,NA,NA,NA,NA,NA,NA,NA,NA
GovRonDeSantis,1058807868,1426217928513499140,"Today Bobby Bowden lies in honor in the Florida Capitol, and we celebrate his great legacy of leadership, faith, and family. https://t.co/qvpbA6Q1tP",2021-08-13 16:23:46+00:00,False,1099,1786,10582,97,en,False,Twitter Web App,125,148,https://t.co/qvpbA6Q1tP,https://twitter.com/GovRonDeSantis/status/1426217928513499140/photo/1,125,148,https://t.co/qvpbA6Q1tP,https://twitter.com/GovRonDeSantis/status/1426217928513499140/photo/1,125,148,https://t.co/qvpbA6Q1tP,https://twitter.com/GovRonDeSantis/status/1426217928513499140/photo/1
GovRonDeSantis,1058807868,1426207802494701568,"As #Fred approaches, South Florida &amp; Gulf Coast residents should expect heavy rainfall this weekend through Monday.
 
Floridians should have multiple ways to receive weather alerts &amp; avoid flooded areas. Follow @FLSERT &amp; @NHC_Atlantic for updates. https://t.co/bFUMXG739I",2021-08-13 15:43:32+00:00,False,296,886,1655,54,en,False,Twitter for iPhone,260,283,https://t.co/bFUMXG739I,https://twitter.com/GovRonDeSantis/status/1426207802494701568/photo/1,260,283,https://t.co/bFUMXG739I,https://twitter.com/GovRonDeSantis/status/1426207802494701568/photo/1,NA,NA,NA,NA
GovRonDeSantis,1058807868,1425946894287745026,"Very excited for the Tallahassee-Leon Babe Ruth 13U, 14U, and 15U teams headed to the Babe Ruth World Series! There’s no doubt you all have worked very hard and dedicated countless hours in practice, and we are very excited to have such talented teams representing Tallahassee. https://t.co/rroCVxXWwS",2021-08-12 22:26:47+00:00,False,237,1492,2986,33,en,False,Twitter for iPhone,278,301,https://t.co/rroCVxXWwS,https://twitter.com/GovRonDeSantis/status/1425946894287745026/photo/1,278,301,https://t.co/rroCVxXWwS,https://twitter.com/GovRonDeSantis/status/1425946894287745026/photo/1,NA,NA,NA,NA
GovRonDeSantis,1058807868,1425862297835216899,"Monoclonal antibody treatments such as Regeneron have had a major impact in preventing hospitalizations &amp; saved lives. We are utilizing monoclonal antibody strike teams to bring treatment directly to our vulnerable populations in long-term care facilities.
https://t.co/s2L5aOiqdI https://t.co/fB5v1Q4Jj2",2021-08-12 16:50:37+00:00,False,5467,17291,26426,3236,en,False,Twitter for iPhone,261,284,https://t.co/s2L5aOiqdI,https://www.flgov.com/2021/08/12/governor-ron-desantis-announces-expanded-monoclonal-antibody-access-in-florida-with-new-monoclonal-antibody-centers/,285,308,https://t.co/fB5v1Q4Jj2,https://twitter.com/GovRonDeSantis/status/1425862297835216899/photo/1,NA,NA,NA,NA
GovRonDeSantis,1058807868,1425828942041210880,"I’m at the Monoclonal Antibody Response Unit in Jacksonville as part of the state’s effort to expand monoclonal antibody treatments like Regeneron:

https://t.co/p9AUTOFbT2",2021-08-12 14:38:05+00:00,False,672,2294,4339,182,en,False,Twitter for iPhone,149,172,https://t.co/p9AUTOFbT2,https://fb.watch/7kWTHFySzE/,NA,NA,NA,NA,NA,NA,NA,NA
GovRonDeSantis,1058807868,1425540605271216130,"Despite all the challenges of the past year, Lakewood Elementary has gone from an F school in 2019 to an A school in 2021 — the first time since 2013 they scored above D. This turnaround is a testament to the teachers’ hard work, and I was proud to provide them bonuses today. https://t.co/f9pZUTdMgQ",2021-08-11 19:32:20+00:00,False,1524,2975,14020,162,en,False,Twitter for iPhone,277,300,https://t.co/f9pZUTdMgQ,https://twitter.com/GovRonDeSantis/status/1425540605271216130/photo/1,NA,NA,NA,NA,NA,NA,NA,NA
GovRonDeSantis,1058807868,1425506608562515980,"I believe that we should reward our educators across Florida for their dedication to our students’ successes, which is why I am in Bay County today delivering on my promise to provide $1,000 bonuses to our teachers and principals. 

Watch live — https://t.co/LZFvN2HKam",2021-08-11 17:17:14+00:00,False,443,2082,3568,115,en,False,Twitter Web App,246,269,https://t.co/LZFvN2HKam,https://fb.watch/7jLSFgClKD/,NA,NA,NA,NA,NA,NA,NA,NA
GovRonDeSantis,1058807868,1425464565836488706,"I am in Pinellas County today delivering $1,000 bonus checks to our teachers and principals who worked so hard over the past year to serve our students.
Watch live: https://t.co/kzzTxZrfM1",2021-08-11 14:30:11+00:00,False,994,3222,9757,275,en,False,Twitter Web App,165,188,https://t.co/kzzTxZrfM1,https://fb.watch/7jC7jBSmfQ/,NA,NA,NA,NA,NA,NA,NA,NA
GovRonDeSantis,1058807868,1425443892351143947,"PTC #6 developed into Tropical Storm #Fred overnight. This is the sixth named storm of the season &amp; could potentially impact Florida this weekend. 

While it’s too soon to determine exact impacts, Floridians should review their disaster plans &amp; follow @FLSERT for updates. https://t.co/2jtimA0g9L",2021-08-11 13:08:02+00:00,False,432,1309,2097,65,en,False,Twitter for iPhone,281,304,https://t.co/2jtimA0g9L,https://twitter.com/GovRonDeSantis/status/1425443892351143947/photo/1,NA,NA,NA,NA,NA,NA,NA,NA
GovRonDeSantis,1058807868,1425221149944946689,"While other states are defunding the police, we are funding law enforcement in Florida – and today we are giving $1,000 bonuses to show Florida stands with law enforcement. https://t.co/QniLTpnfrz",2021-08-10 22:22:56+00:00,False,3103,3624,22117,417,en,False,Twitter for iPhone,173,196,https://t.co/QniLTpnfrz,https://twitter.com/GovRonDeSantis/status/1425221149944946689/photo/1,NA,NA,NA,NA,NA,NA,NA,NA
GovRonDeSantis,1058807868,1425185433005305858,".@FLCaseyDeSantis and I are in Pensacola thanking our law enforcement and first responders for keeping our neighborhoods safe and secure with $1,000 bonuses. 
Watch: https://t.co/qMRuwIJr7H",2021-08-10 20:01:00+00:00,False,274,2253,2592,125,en,False,Twitter Web App,166,189,https://t.co/qMRuwIJr7H,https://fb.watch/7iAPhEZ8Vx/,NA,NA,NA,NA,NA,NA,NA,NA
GovRonDeSantis,1058807868,1425175496556429314,"More than 49,000 sworn law enforcement officers across the state of Florida will be receiving a $1,000 bonus, including the great men and women of the Jacksonville Sheriff’s Office, for the hard work and dedication they’ve displayed in their communities. https://t.co/y7ijEnJleZ",2021-08-10 19:21:31+00:00,False,4025,2108,30341,482,en,False,Twitter for iPhone,255,278,https://t.co/y7ijEnJleZ,https://twitter.com/GovRonDeSantis/status/1425175496556429314/photo/1,NA,NA,NA,NA,NA,NA,NA,NA
