ScreenName,AuthorID,TweetID,Text,TweetDate,isReply,RetweetCount,ReplyCount,LikeCount,QuoteCount,Language,PossibleSensitive,Source,1stURLStart,1stURLEnd,1stURL,1stURLExp,2ndURLStart,2ndURLEnd,2ndURL,2ndURLExp,3rdURLStart,3rdURLEnd,3rdURL,3rdURLExp
GovRonDeSantis,1058807868,1435335968748457985,In Florida – we back the blue.,2021-09-07 20:15:36+00:00,False,5649,5882,54538,1059,en,False,Twitter Web App,NA,NA,NA,NA,NA,NA,NA,NA,NA,NA,NA,NA
GovRonDeSantis,1058807868,1435296447893811205,"Starting tomorrow, this site will be open every day from 9 a.m. - 5 p.m.

For more information, visit: https://t.co/7Qq1sNv1dQ",2021-09-07 17:38:34+00:00,True,126,339,809,10,en,False,Twitter Web App,103,126,https://t.co/7Qq1sNv1dQ,http://floridahealthcovid19.gov,NA,NA,NA,NA,NA,NA,NA,NA
GovRonDeSantis,1058807868,1435279429547274240,"Governor DeSantis visits the St. Cloud Community Center in Osceola County, which now provides monoclonal antibody treatments for COVID-19 positive individuals. 

Watch Live: https://t.co/dmt6yIuX3x",2021-09-07 16:30:56+00:00,False,360,895,2885,39,en,False,Twitter Web App,174,197,https://t.co/dmt6yIuX3x,https://fb.watch/7TivUri5SF/,NA,NA,NA,NA,NA,NA,NA,NA
GovRonDeSantis,1058807868,1435247578065555457,"Watch Live: Governor DeSantis visits Lakeland to announce his commitment to recruit and reward brave, high quality law enforcement officers in Florida.

https://t.co/mW0z6xcYPB",2021-09-07 14:24:22+00:00,False,220,478,1859,31,en,False,Twitter Web App,153,176,https://t.co/mW0z6xcYPB,https://www.facebook.com/watch/live/?v=2034130266736110&ref=watch_permalink,NA,NA,NA,NA,NA,NA,NA,NA
GovRonDeSantis,1058807868,1434949963402948611,".@FLCaseyDeSantis and I would like to wish all Floridians celebrating #RoshHashanah a very sweet, happy and prosperous new year. L’Shana Tova!",2021-09-06 18:41:46+00:00,False,644,1255,6477,35,en,False,Twitter for iPhone,NA,NA,NA,NA,NA,NA,NA,NA,NA,NA,NA,NA
GovRonDeSantis,1058807868,1434863959408996354,Happy Labor Day! Florida is open for business and our workforce is growing. @FLCaseyDeSantis and I hope everyone stays safe and enjoys the long weekend.,2021-09-06 13:00:01+00:00,False,2056,3808,20397,304,en,False,Twitter Web App,NA,NA,NA,NA,NA,NA,NA,NA,NA,NA,NA,NA
GovRonDeSantis,1058807868,1434577067606224896,"Early Treatment Saves Lives: “36-48 hours after the Regeneron, basically all my symptoms were gone.”  – Brit Noel 

To find a treatment location near you, visit: https://t.co/7Qq1sNv1dQ https://t.co/FwZoOTqJFS",2021-09-05 18:00:00+00:00,False,2049,1902,7822,173,en,False,Twitter Web App,162,185,https://t.co/7Qq1sNv1dQ,http://floridahealthcovid19.gov,186,209,https://t.co/FwZoOTqJFS,https://twitter.com/GovRonDeSantis/status/1434577067606224896/video/1,NA,NA,NA,NA
GovRonDeSantis,1058807868,1434184481833775107,"Monoclonal Antibody Treatments Are Delivering Results: “I was so relieved, because I felt it truly saved my life.” – Joan Grodski

To find a treatment location near you, visit: https://t.co/7Qq1sNMC5o https://t.co/QJoKISD9Ni",2021-09-04 16:00:00+00:00,False,1232,2174,5385,135,en,False,Twitter Web App,177,200,https://t.co/7Qq1sNMC5o,http://floridahealthcovid19.gov,201,224,https://t.co/QJoKISD9Ni,https://twitter.com/GovRonDeSantis/status/1434184481833775107/video/1,NA,NA,NA,NA
GovRonDeSantis,1058807868,1433882493023830019,"Early Treatment Saves Lives: ""Within six hours of having the [monoclonal antibody] injection, I started to feel a difference."" – Melissa Frenyea 

To find a treatment location near you, visit: https://t.co/7Qq1sNv1dQ https://t.co/cYneO19tzd",2021-09-03 20:00:01+00:00,False,1265,1665,4792,133,en,False,Twitter Web App,193,216,https://t.co/7Qq1sNv1dQ,http://floridahealthcovid19.gov,217,240,https://t.co/cYneO19tzd,https://twitter.com/GovRonDeSantis/status/1433882493023830019/video/1,NA,NA,NA,NA
GovRonDeSantis,1058807868,1433862301057175564,"Glad to be in Pensacola today to announce a new monoclonal antibody treatment site. Great news, it will open Sunday!

Bayview Community Center 2001 E. Lloyd St. Pensacola, FL 32503, 7 days a week, 9AM to 5PM. 

Make an appointment: https://t.co/SVZEvCb03k",2021-09-03 18:39:47+00:00,False,1207,1311,7252,105,en,False,Twitter Web App,232,255,https://t.co/SVZEvCb03k,http://patientportalfl.com,NA,NA,NA,NA,NA,NA,NA,NA
GovRonDeSantis,1058807868,1433807937483444238,"Governor DeSantis is in Pensacola to highlight life-saving monoclonal antibody treatments. 
Watch now: https://t.co/af1tTYPFUu",2021-09-03 15:03:45+00:00,False,340,1123,2432,48,en,False,Twitter Web App,103,126,https://t.co/af1tTYPFUu,https://fb.watch/7NYGPkMXIM/,NA,NA,NA,NA,NA,NA,NA,NA
GovRonDeSantis,1058807868,1433784344011673606,"This Saturday, during Labor Day weekend, no license is required to saltwater fish. All Floridians and visitors can take advantage of license-free fishing days and experience why Florida is the Sportfishing Capital of the World!  
https://t.co/XPe23yXypJ",2021-09-03 13:30:00+00:00,False,505,877,3510,86,en,False,Twitter Web App,230,253,https://t.co/XPe23yXypJ,https://myfwc.com/license/recreational/do-i-need-one/free-fishing/,NA,NA,NA,NA,NA,NA,NA,NA
GovRonDeSantis,1058807868,1433565402232078341,"Monoclonal Treatments Are Saving Lives: “I recommend that everybody take advantage of it because it definitely helps you.” – Pauline Becker 

To find a treatment location near you, visit: https://t.co/7Qq1sNMC5o https://t.co/ofZbPEIFbU",2021-09-02 23:00:00+00:00,False,1042,1554,4822,137,en,False,Twitter Web App,188,211,https://t.co/7Qq1sNMC5o,http://floridahealthcovid19.gov,212,235,https://t.co/ofZbPEIFbU,https://twitter.com/GovRonDeSantis/status/1433565402232078341/video/1,NA,NA,NA,NA
GovRonDeSantis,1058807868,1433461307634761735,"Watch Live: Governor DeSantis speaks on the importance of receiving monoclonal antibodies to combat COVID-19 in Palm Beach.
https://t.co/ug1Qj109b3",2021-09-02 16:06:22+00:00,False,299,1092,1881,45,en,False,Twitter Web App,124,147,https://t.co/ug1Qj109b3,https://thefloridachannel.org/,NA,NA,NA,NA,NA,NA,NA,NA
GovRonDeSantis,1058807868,1433135855808483341,"“If you have any symptoms and you test positive, go get the monoclonal antibody treatment.” – @DrNealDunnFL2 https://t.co/UEgfDGccsN",2021-09-01 18:33:09+00:00,False,1846,2151,7892,191,en,False,Twitter Web App,109,132,https://t.co/UEgfDGccsN,https://twitter.com/GovRonDeSantis/status/1433135855808483341/video/1,NA,NA,NA,NA,NA,NA,NA,NA
GovRonDeSantis,1058807868,1433101409608667140,"Live Now: Governor DeSantis is in Brevard County with individuals that have recovered from COVID-19 after receiving monoclonal antibody treatments.
https://t.co/stZTGic2iX",2021-09-01 16:16:16+00:00,False,428,1022,3035,40,en,False,Twitter Web App,148,171,https://t.co/stZTGic2iX,https://fb.watch/7LnmfTJFI2/,NA,NA,NA,NA,NA,NA,NA,NA
GovRonDeSantis,1058807868,1433068618565267466,"Governor DeSantis holds a press conference in Fort Myers discussing the effectiveness of monoclonal antibodies. 
Watch now: https://t.co/WdlByWvuqw",2021-09-01 14:05:58+00:00,False,351,864,2204,45,en,False,Twitter Web App,124,147,https://t.co/WdlByWvuqw,https://fb.watch/7LgAbzjzw1/,NA,NA,NA,NA,NA,NA,NA,NA
GovRonDeSantis,1058807868,1432795327573204998,"“These monoclonal antibodies are preventing severe illness, they're reducing hospitalization, and quite frankly, they're saving lives.” - @LtGovNunez https://t.co/WDDXynAMuV",2021-08-31 20:00:00+00:00,False,1328,2321,6173,169,en,False,Twitter Web App,150,173,https://t.co/WDDXynAMuV,https://twitter.com/GovRonDeSantis/status/1432795327573204998/video/1,NA,NA,NA,NA,NA,NA,NA,NA
GovRonDeSantis,1058807868,1432756328825491463,"""I could not believe what I was hearing, Dr. Kenneth said he would bring in a strike team, facilitated by the Governor's office, to give my father the [monoclonal antibody] infusion at the rehab facility."" – Deborah Levine https://t.co/ZGl6Pu09FV",2021-08-31 17:25:02+00:00,False,1131,1310,4722,111,en,False,Twitter Web App,223,246,https://t.co/ZGl6Pu09FV,https://twitter.com/GovRonDeSantis/status/1432756328825491463/video/1,NA,NA,NA,NA,NA,NA,NA,NA
GovRonDeSantis,1058807868,1432482136976760834,"""I received the Regeneron, and within about 24 to 36 hours, I knew I was going to make it."" - Toma Dean https://t.co/HVSrNuzY80",2021-08-30 23:15:30+00:00,False,1482,1868,6583,157,en,False,Twitter Web App,104,127,https://t.co/HVSrNuzY80,https://twitter.com/GovRonDeSantis/status/1432482136976760834/video/1,NA,NA,NA,NA,NA,NA,NA,NA
GovRonDeSantis,1058807868,1432436494019530753,"When I served in Iraq, I saw firsthand how PTS affected the brave men and women serving. That’s why when I was in Congress, I introduced the PAWS Act, which was signed into law last week to help prevent dependence on opioids, reduce suicide &amp; help get veterans back on their feet.",2021-08-30 20:14:08+00:00,False,3500,1507,27297,148,en,False,Twitter Web App,NA,NA,NA,NA,NA,NA,NA,NA,NA,NA,NA,NA
GovRonDeSantis,1058807868,1432427955431657476,"Watch: Governor DeSantis hosts a press conference in Panama City on the effectiveness of monoclonal antibodies. 
https://t.co/f4ZfHKkSRx",2021-08-30 19:40:12+00:00,False,187,698,1338,30,en,False,Twitter Web App,113,136,https://t.co/f4ZfHKkSRx,https://fb.watch/7IXoyuoBbn/,NA,NA,NA,NA,NA,NA,NA,NA
GovRonDeSantis,1058807868,1432376666739904512,"Live Now: Governor DeSantis is in Tampa with both patients and the loved ones of those who have received monoclonal antibody treatments.

https://t.co/FkPpgopHxx",2021-08-30 16:16:24+00:00,False,463,1062,3454,53,en,False,Twitter for iPhone,138,161,https://t.co/FkPpgopHxx,https://www.facebook.com/watch/live/?v=275832600680332&ref=watch_permalink,NA,NA,NA,NA,NA,NA,NA,NA
GovRonDeSantis,1058807868,1432345547533340678,"Governor DeSantis hosts a press conference in Jacksonville with individuals that have recovered from COVID-19 after receiving monoclonal antibody treatments. 

Watch Live: https://t.co/LlYBMEGF4n",2021-08-30 14:12:44+00:00,False,475,1065,2930,66,en,False,Twitter Web App,172,195,https://t.co/LlYBMEGF4n,https://fb.watch/7IEcGkzsme/,NA,NA,NA,NA,NA,NA,NA,NA
GovRonDeSantis,1058807868,1432119966522912768,We will continue to use all available resources to support impacted areas and communities as needed.,2021-08-29 23:16:22+00:00,True,242,485,3592,17,en,False,Twitter for iPhone,NA,NA,NA,NA,NA,NA,NA,NA,NA,NA,NA,NA
GovRonDeSantis,1058807868,1432119884847136778,Florida stands with our neighbors across the Gulf Coast &amp; @FLSERT is actively assisting with Hurricane #Ida. We’ve deployed and staged Urban Search and Rescue Task Forces 1 &amp; 2 in Mississippi. USAR Task Force 4 and 50 @FLGuard are mobilizing to Louisiana.,2021-08-29 23:16:02+00:00,False,1188,1742,10187,107,en,False,Twitter for iPhone,NA,NA,NA,NA,NA,NA,NA,NA,NA,NA,NA,NA
GovRonDeSantis,1058807868,1432040355361263617,"Stopped in at Miz Kathi’s Cotillion Southern Café &amp; Sweetery in Wildwood and enjoyed their delicious home-cooked southern food. 

Stop by if you’re in the area: https://t.co/NP5CCBY7v0 https://t.co/vIXDa8vyrh",2021-08-29 18:00:01+00:00,False,359,1599,5243,78,en,False,Twitter Web App,165,188,https://t.co/NP5CCBY7v0,http://mizkathis.com,189,212,https://t.co/vIXDa8vyrh,https://twitter.com/GovRonDeSantis/status/1432040355361263617/photo/1,NA,NA,NA,NA
GovRonDeSantis,1058807868,1431693066029580291,"Thank you to Florida’s correctional officers who work hard across the state. 

Your efforts are the cornerstone of our community's safety and security. https://t.co/LiKJyIlb4O",2021-08-28 19:00:01+00:00,False,701,1649,8074,68,en,False,Twitter Web App,152,175,https://t.co/LiKJyIlb4O,https://twitter.com/GovRonDeSantis/status/1431693066029580291/photo/1,NA,NA,NA,NA,NA,NA,NA,NA
GovRonDeSantis,1058807868,1431647773556985862,".@AGAshleyMoody and I secured more than $5 million through a settlement with the Florida Coalition Against Domestic Violence and its former CEO. 

This settlement is a win in our fight to recover money that was intended to help families rebuild after facing domestic violence. https://t.co/QP9R0onhS2",2021-08-28 16:00:02+00:00,False,361,922,2846,29,en,False,Twitter Web App,277,300,https://t.co/QP9R0onhS2,https://twitter.com/GovRonDeSantis/status/1431647773556985862/photo/1,NA,NA,NA,NA,NA,NA,NA,NA
GovRonDeSantis,1058807868,1431617571334201348,"There are now 21 state monoclonal antibody treatment sites across Florida. If you're at risk of COVID-19, this treatment can be accessed free of charge. 

For more information about any of the monoclonal sites, including state-run sites, visit: https://t.co/7Qq1sNMC5o https://t.co/sgH1p64mVU",2021-08-28 14:00:01+00:00,False,2892,6168,12062,1013,en,False,Twitter Web App,245,268,https://t.co/7Qq1sNMC5o,http://floridahealthcovid19.gov,269,292,https://t.co/sgH1p64mVU,https://twitter.com/GovRonDeSantis/status/1431617571334201348/photo/1,NA,NA,NA,NA
GovRonDeSantis,1058807868,1431398622046740481,"Yesterday, I announced a former Winn-Dixie in Immokalee is the latest site where Floridians can receive monoclonal antibodies.  

Over 300 patients a day can be treated at this location. 

For more information, visit: https://t.co/7Qq1sNMC5o",2021-08-27 23:30:00+00:00,False,386,1678,2465,51,en,False,Twitter Web App,218,241,https://t.co/7Qq1sNMC5o,http://floridahealthcovid19.gov,NA,NA,NA,NA,NA,NA,NA,NA
GovRonDeSantis,1058807868,1431375977326776322,".@DHSgov is aiding and abetting a massive illegal migration across the southern border. This is impacting states and the nation, and represents a failure to faithfully execute the law. 

https://t.co/wcD8sfbOZP",2021-08-27 22:00:01+00:00,False,2182,1985,8935,156,en,False,Twitter Web App,187,210,https://t.co/wcD8sfbOZP,https://www.flgov.com/wp-content/uploads/2021/08/SGS-BIZHUB21082608150.pdf,NA,NA,NA,NA,NA,NA,NA,NA
GovRonDeSantis,1058807868,1431361251393822720,"Pinellas County has a state monoclonal antibody treatment site at the Holy Trinity Greek Orthodox Church in Clearwater.

It’s open every day except Sunday, 9 a.m.-5 p.m.

For more information, visit: https://t.co/7Qq1sNv1dQ",2021-08-27 21:01:30+00:00,False,494,1517,2626,56,en,False,Twitter Web App,200,223,https://t.co/7Qq1sNv1dQ,http://floridahealthcovid19.gov,NA,NA,NA,NA,NA,NA,NA,NA
GovRonDeSantis,1058807868,1431005650537132035,"Casey and I are praying for the families of the fallen U.S. Marines and for the safety of our service members, fellow citizens, and Afghan allies in Kabul. Our troops are doing heroic work under dangerous circumstances and they deserve our continued admiration.",2021-08-26 21:28:28+00:00,False,3508,2792,31863,165,en,False,Twitter for iPhone,NA,NA,NA,NA,NA,NA,NA,NA,NA,NA,NA,NA
GovRonDeSantis,1058807868,1430919411662196741,"Watch Live: Governor DeSantis Opens Monoclonal Antibody Site in Collier County
https://t.co/3ARrFx5VaS",2021-08-26 15:45:47+00:00,False,239,1788,2011,62,en,False,Twitter Web App,79,102,https://t.co/3ARrFx5VaS,https://fb.watch/7Dsa0EFn3H/,NA,NA,NA,NA,NA,NA,NA,NA
GovRonDeSantis,1058807868,1430683263438364682,"“I would definitely recommend the monoclonal antibodies if they’re offered to you when you have COVID.” – Sara Keene, Nurse Anesthetist in Panama City https://t.co/4Cf74cjwdy",2021-08-26 00:07:25+00:00,False,1020,2336,4907,122,en,False,Twitter Media Studio,151,174,https://t.co/4Cf74cjwdy,https://twitter.com/GovRonDeSantis/status/1430683263438364682/video/1,NA,NA,NA,NA,NA,NA,NA,NA
GovRonDeSantis,1058807868,1430571248187289607,"Governor DeSantis opens an additional monoclonal antibody treatment site in The Villages. 

Watch live: https://t.co/OYHMA9sLjv",2021-08-25 16:42:18+00:00,False,499,1799,3568,81,en,False,Twitter Web App,104,127,https://t.co/OYHMA9sLjv,https://fb.watch/7Cb5p-XThG/,NA,NA,NA,NA,NA,NA,NA,NA
GovRonDeSantis,1058807868,1430518791318953984,SCOTUS handed down yet another blow to the Biden Administration’s reckless border policies. Reinstating the Remain in Mexico policy that Biden unlawfully rescinded will protect our communities and slow the influx of illegal aliens and illicit drugs at the southern border.,2021-08-25 13:13:52+00:00,False,3177,2244,21389,179,en,False,Twitter for iPhone,NA,NA,NA,NA,NA,NA,NA,NA,NA,NA,NA,NA
GovRonDeSantis,1058807868,1430302872038776834,"Fat Jack’s Deli &amp; Pub, a Lakeland family-run restaurant and local staple. Since 1963 they have been serving some of the best subs in the area. Next time you’re in Polk County, check it out. @fatjacksdeli https://t.co/Hmi4fFWtIR",2021-08-24 22:55:53+00:00,False,568,1814,6423,102,en,False,Twitter Web App,208,231,https://t.co/Hmi4fFWtIR,https://twitter.com/GovRonDeSantis/status/1430302872038776834/photo/1,NA,NA,NA,NA,NA,NA,NA,NA
GovRonDeSantis,1058807868,1430278825552883714,"“I don’t think I would have recovered as fast if I hadn’t gotten the treatment.” – Nick Hall, Patrol Lieutenant with the Bay County Sheriff’s Office https://t.co/nHoxqI153G",2021-08-24 21:20:19+00:00,False,661,1429,3303,85,en,False,Twitter Web App,149,172,https://t.co/nHoxqI153G,https://twitter.com/GovRonDeSantis/status/1430278825552883714/video/1,NA,NA,NA,NA,NA,NA,NA,NA
GovRonDeSantis,1058807868,1429949095561543681,"The Englewood Charlotte Public Library is now equipped to provide monoclonal antibody treatments to over 300 patients starting tomorrow.
 
For more information, visit: https://t.co/GcPgMgN0yJ https://t.co/u1L7cgDzqb",2021-08-23 23:30:06+00:00,False,782,2610,5403,121,en,False,Twitter for iPhone,168,191,https://t.co/GcPgMgN0yJ,http://floridahealthcovid.gov,192,215,https://t.co/u1L7cgDzqb,https://twitter.com/GovRonDeSantis/status/1429949095561543681/photo/1,NA,NA,NA,NA
GovRonDeSantis,1058807868,1429934046398844934,"The Havert L. Fenn Center in Fort Pierce is now a site where Floridians can receive the monoclonal antibody treatment. 

This location is open 7 days a week, from 9AM-5PM. 

For more information, visit: https://t.co/7Qq1sNv1dQ",2021-08-23 22:30:18+00:00,False,301,1043,1668,35,en,False,Twitter Web App,203,226,https://t.co/7Qq1sNv1dQ,http://floridahealthcovid19.gov,NA,NA,NA,NA,NA,NA,NA,NA
GovRonDeSantis,1058807868,1429896634348056586,"Watch: Governor Ron DeSantis is in Englewood opening a monoclonal antibody treatment site.
https://t.co/vKVo5pTB8W",2021-08-23 20:01:38+00:00,False,249,1010,1875,28,en,False,Twitter Web App,91,114,https://t.co/vKVo5pTB8W,https://fb.watch/7zJHwRJNUT/,NA,NA,NA,NA,NA,NA,NA,NA
GovRonDeSantis,1058807868,1429874106112126980,"Another monoclonal antibody treatment site is now open every day in Alachua County at Fellowship Church in High Springs. 

For more information, visit: https://t.co/7Qq1sNv1dQ",2021-08-23 18:32:07+00:00,False,453,1183,2962,42,en,False,Twitter Web App,152,175,https://t.co/7Qq1sNv1dQ,http://floridahealthcovid19.gov,NA,NA,NA,NA,NA,NA,NA,NA
GovRonDeSantis,1058807868,1429548936629526531,"Across the state of Florida, there are 14 monoclonal antibody treatment sites set up to serve COVID-19 positive Floridians—with more to come. 

For more information, visit: https://t.co/7Qq1sNv1dQ https://t.co/rzGX60YtgS",2021-08-22 21:00:00+00:00,False,2729,3133,12299,445,en,False,Twitter Web App,173,196,https://t.co/7Qq1sNv1dQ,http://floridahealthcovid19.gov,197,220,https://t.co/rzGX60YtgS,https://twitter.com/GovRonDeSantis/status/1429548936629526531/photo/1,NA,NA,NA,NA
GovRonDeSantis,1058807868,1429518736180924421,"Stopped by Grandpa's Pizza in Bonita Springs. It's been family-owned and operated for more than 40 years. Great pizza, homemade ingredients, and a best of all — another business thriving in Florida.

Check it out: https://t.co/5fffRAouA5 https://t.co/mV5MeeEXA2",2021-08-22 19:00:00+00:00,False,877,1514,10626,116,en,False,Twitter Web App,214,237,https://t.co/5fffRAouA5,http://grandpaspizzamenu.com,238,261,https://t.co/mV5MeeEXA2,https://twitter.com/GovRonDeSantis/status/1429518736180924421/photo/1,NA,NA,NA,NA
GovRonDeSantis,1058807868,1429488538698096643,"“Monoclonal antibody treatments are a very good therapy for folks that develop COVID-19. It’ll save your life and keep you out of the hospital.” – Dr. Kenneth Scheppke, FDEM Chief Medical Officer https://t.co/BbfNttP5bZ",2021-08-22 17:00:00+00:00,False,2767,1612,9447,220,en,False,Twitter Media Studio,196,219,https://t.co/BbfNttP5bZ,https://twitter.com/GovRonDeSantis/status/1429488538698096643/video/1,NA,NA,NA,NA,NA,NA,NA,NA
GovRonDeSantis,1058807868,1429201646765019137,"Today, I was at the Manatee Memorial Hospital Complex to open a monoclonal antibody treatment site that is operational 7 days a week, from 9AM-5PM.

For more information, visit: https://t.co/7Qq1sNMC5o https://t.co/vptgueLbga",2021-08-21 22:00:00+00:00,False,1230,3456,9264,316,en,False,Twitter Web App,178,201,https://t.co/7Qq1sNMC5o,http://floridahealthcovid19.gov,202,225,https://t.co/vptgueLbga,https://twitter.com/GovRonDeSantis/status/1429201646765019137/photo/1,NA,NA,NA,NA
GovRonDeSantis,1058807868,1429179311748272141,"For more information, visit: https://t.co/7Qq1sNv1dQ",2021-08-21 20:31:15+00:00,True,111,321,736,10,en,False,Twitter Web App,29,52,https://t.co/7Qq1sNv1dQ,http://floridahealthcovid19.gov,NA,NA,NA,NA,NA,NA,NA,NA
GovRonDeSantis,1058807868,1429179215283359752,"An additional monoclonal antibody site is now open in Lakeland at Lakes Church.

-It is free of charge, open 7 days a week from 9AM-5PM.
-Over 300 patients per day can receive treatment at this location daily. 

https://t.co/ndbio3yBAp",2021-08-21 20:30:52+00:00,False,652,1173,3497,90,en,False,Twitter Web App,212,235,https://t.co/ndbio3yBAp,https://rumble.com/vli3qg-gov.-desantis-opens-new-monoclonal-antibody-site-in-lakeland.html,NA,NA,NA,NA,NA,NA,NA,NA
GovRonDeSantis,1058807868,1429151474748207116,"The Tropical Park in the Miami area is now a monoclonal antibody treatment site for Floridians, free of charge.

For more information, visit: https://t.co/7Qq1sNv1dQ",2021-08-21 18:40:38+00:00,False,465,848,2677,56,en,False,Twitter Web App,142,165,https://t.co/7Qq1sNv1dQ,http://floridahealthcovid19.gov,NA,NA,NA,NA,NA,NA,NA,NA
GovRonDeSantis,1058807868,1429128547885625359,"Governor Ron DeSantis visits a new monoclonal antibody treatment site in Bradenton at Manatee Memorial Hospital Complex.

Watch live: https://t.co/BtACib6yT8",2021-08-21 17:09:32+00:00,False,234,766,1864,34,en,False,Twitter for iPhone,134,157,https://t.co/BtACib6yT8,https://fb.watch/7wXcAWV-Tu/,NA,NA,NA,NA,NA,NA,NA,NA
GovRonDeSantis,1058807868,1429098201899053062,"Watch: Governor Ron DeSantis Opens an additional monoclonal antibody treatment site in Lakeland at Lakes Church.
https://t.co/LsJ2I3TXLE",2021-08-21 15:08:57+00:00,False,310,746,2395,45,en,False,Twitter Web App,113,136,https://t.co/LsJ2I3TXLE,https://fb.watch/7wQ6Qe-x6M/,NA,NA,NA,NA,NA,NA,NA,NA
GovRonDeSantis,1058807868,1428867408442310656,"The Northwest Florida Fairgrounds in Fort Walton Beach is another site where Floridians can receive monoclonal antibodies.

-It's open every day from 9AM-5PM.
-This site can treat more than 300 people per day.

For more information, visit: https://t.co/7Qq1sNv1dQ https://t.co/pJPQzEkSpM",2021-08-20 23:51:51+00:00,False,640,1601,3293,99,en,False,Twitter Web App,240,263,https://t.co/7Qq1sNv1dQ,http://floridahealthcovid19.gov,264,287,https://t.co/pJPQzEkSpM,https://twitter.com/GovRonDeSantis/status/1428867408442310656/photo/1,NA,NA,NA,NA
GovRonDeSantis,1058807868,1428843572544118793,"The Biden Administration authorized dangerous criminal aliens to be released into our communities. 

That policy is not only dangerous but violates the law. Yesterday, that was confirmed by a federal judge.",2021-08-20 22:17:08+00:00,False,6171,2313,27240,265,en,False,Twitter Web App,NA,NA,NA,NA,NA,NA,NA,NA,NA,NA,NA,NA
GovRonDeSantis,1058807868,1428829883623514115,"An additional monoclonal antibody site is now open at the Bay County Fairgrounds. 

- It’s open 7 days a week, from 9AM-5PM.
-This site can serve over 300 patients a day.

Watch: https://t.co/bonjS2tZZU",2021-08-20 21:22:45+00:00,False,262,772,1668,48,en,False,Twitter Web App,179,202,https://t.co/bonjS2tZZU,https://www.facebook.com/watch/live/?v=429544881701679&ref=watch_permalink,NA,NA,NA,NA,NA,NA,NA,NA
GovRonDeSantis,1058807868,1428809263535869955,"Thanks to yesterday’s ruling, President Biden's orders are invalidated. 

Criminal aliens should be removed from our streets so law and order can be restored and our communities are kept safe. 

https://t.co/WyHsTNRErN",2021-08-20 20:00:49+00:00,False,1749,1349,8525,116,en,False,Twitter Web App,195,218,https://t.co/WyHsTNRErN,https://www.reuters.com/legal/litigation/us-judge-blocks-bidens-limits-immigrant-arrests-deportation-2021-08-19/,NA,NA,NA,NA,NA,NA,NA,NA
GovRonDeSantis,1058807868,1428805624264019970,"Today we opened a monoclonal antibody treatment site at the Old Bonita Springs Library, with treatment available 7 days a week from 9AM-5PM, free of charge for patients.

For more information, visit: https://t.co/7Qq1sNv1dQ",2021-08-20 19:46:21+00:00,False,380,800,2395,74,en,False,Twitter Web App,200,223,https://t.co/7Qq1sNv1dQ,http://floridahealthcovid19.gov,NA,NA,NA,NA,NA,NA,NA,NA
GovRonDeSantis,1058807868,1428785840478691336,"From day one, I made Everglades restoration &amp; the protection of water resources a top priority &amp; we have secured record investments for these efforts. This groundbreaking further demonstrates our commitment to moving projects forward to send water south.
https://t.co/h5C3vBZKQe",2021-08-20 18:27:44+00:00,True,67,252,818,9,en,False,Twitter Web App,263,286,https://t.co/h5C3vBZKQe,https://www.flgov.com/2021/08/20/governor-ron-desantis-celebrates-groundbreaking-of-underground-wall-to-support-everglades-restoration/,NA,NA,NA,NA,NA,NA,NA,NA
