ScreenName,AuthorID,TweetID,Text,TweetDate,isReply,RetweetCount,ReplyCount,LikeCount,QuoteCount,Language,PossibleSensitive,Source,1stURLStart,1stURLEnd,1stURL,1stURLExp,2ndURLStart,2ndURLEnd,2ndURL,2ndURLExp,3rdURLStart,3rdURLEnd,3rdURL,3rdURLExp
GovRonDeSantis,1058807868,1439995208192626690,"Since Florida opened monoclonal antibody treatment sites in August:
➡️ +100,000 Floridians have received treatments
➡️ COVID hospital admissions have fallen by over 60%
➡️ COVID hospital census has declined for 28 consecutive days
➡️ ER visits for COVID have declined by over 70%",2021-09-20 16:49:46+00:00,False,9284,2514,33074,758,en,False,Twitter for iPhone,NA,NA,NA,NA,NA,NA,NA,NA,NA,NA,NA,NA
GovRonDeSantis,1058807868,1439650499469447170,"F.A.S.T. enables students to spend more time learning and finally gives parents and teachers an opportunity to tailor education to each child. 

Learn more: https://t.co/8ZtzRgOAWZ",2021-09-19 18:00:01+00:00,False,466,1148,3669,31,en,False,Twitter Web App,157,180,https://t.co/8ZtzRgOAWZ,https://www.flgov.com/2021/09/14/governor-desantis-announces-end-of-the-high-stakes-fsa-testing-to-become-the-first-state-in-the-nation-to-fully-transition-to-progress-monitoring/,NA,NA,NA,NA,NA,NA,NA,NA
GovRonDeSantis,1058807868,1439303207147261958,"Earlier this week, I announced the advancement of three key infrastructure projects for the Tampa Bay region. These projects are part of a plan to modernize Tampa’s interstate system, something that will provide benefits to commuters and visitors alike. 

https://t.co/Q1BZ1M5PNZ",2021-09-18 19:00:00+00:00,False,503,1272,4550,42,en,False,Twitter Web App,256,279,https://t.co/Q1BZ1M5PNZ,https://www.flgov.com/2021/09/13/governor-ron-desantis-announces-three-major-transportation-projects-to-improve-and-modernize-tampas-interstate-system/,NA,NA,NA,NA,NA,NA,NA,NA
GovRonDeSantis,1058807868,1439257912157765636,https://t.co/G5SDr94UWO,2021-09-18 16:00:01+00:00,False,628,582,3965,41,und,False,Twitter Media Studio,0,23,https://t.co/G5SDr94UWO,https://twitter.com/GovRonDeSantis/status/1439257912157765636/video/1,NA,NA,NA,NA,NA,NA,NA,NA
GovRonDeSantis,1058807868,1439212746688667657,The Air Force has been protecting our skies and citizens for 74 years. Thank you to the men and women of the Air Force for your continued dedication to keeping our nation free and safe. #AirForceBirthday https://t.co/IFFbjNMVgt,2021-09-18 13:00:32+00:00,False,1096,605,8937,44,en,False,Twitter for iPhone,204,227,https://t.co/IFFbjNMVgt,https://twitter.com/GovRonDeSantis/status/1439212746688667657/photo/1,NA,NA,NA,NA,NA,NA,NA,NA
GovRonDeSantis,1058807868,1438956102394204167,"It has been over two weeks since I sent a letter to several Biden administration officials asking for basic information about the evacuation efforts of Americans trying to exit Afghanistan.
 
Floridians deserve transparency - when can we expect answers? https://t.co/2PgNJYPsVl",2021-09-17 20:00:43+00:00,False,1600,1801,7190,117,en,False,Twitter for iPhone,254,277,https://t.co/2PgNJYPsVl,https://twitter.com/GovRonDeSantis/status/1438956102394204167/photo/1,NA,NA,NA,NA,NA,NA,NA,NA
GovRonDeSantis,1058807868,1438870529646157828,"On #ConstitutionDay, we can reflect on how fortunate we are to have a written Constitution and must be wise to threats facing Constitutional government. As Benjamin Franklin said after the Constitution was created — we have a republic, if you can keep it. https://t.co/OY9epmmx8f",2021-09-17 14:20:41+00:00,False,2374,1391,10474,190,en,False,Twitter Media Studio,256,279,https://t.co/OY9epmmx8f,https://twitter.com/GovRonDeSantis/status/1438870529646157828/video/1,NA,NA,NA,NA,NA,NA,NA,NA
GovRonDeSantis,1058807868,1438676026335408130,I will fight like hell to overcome Biden’s cruel decision to drastically reduce lifesaving monoclonal antibody treatments for Floridians. We've seen steep reductions in hospital admissions due to early treatment efforts. It’s wrong to penalize Florida for his partisan bitterness. https://t.co/24APj0r50K,2021-09-17 01:27:48+00:00,False,6087,4864,24631,782,en,False,Twitter Media Studio,281,304,https://t.co/24APj0r50K,https://twitter.com/GovRonDeSantis/status/1438676026335408130/video/1,NA,NA,NA,NA,NA,NA,NA,NA
GovRonDeSantis,1058807868,1438582658729234435,"Watch Now: Governor DeSantis awards Cuban exile and decorated American veteran Felix Rodríguez the Governor's Medal of Freedom.
https://t.co/nygu1Fnem1",2021-09-16 19:16:48+00:00,False,202,555,1415,16,en,False,Twitter Web App,128,151,https://t.co/nygu1Fnem1,https://fb.watch/83koUUGqPW/,NA,NA,NA,NA,NA,NA,NA,NA
GovRonDeSantis,1058807868,1438571875064483840,"We're going to protect these jobs. 

We're going to protect these people's families. 

We're going to protect their livelihoods. https://t.co/qGvSLplUOF",2021-09-16 18:33:57+00:00,False,1813,1460,11877,175,en,False,Twitter Media Studio,129,152,https://t.co/qGvSLplUOF,https://twitter.com/GovRonDeSantis/status/1438571875064483840/video/1,NA,NA,NA,NA,NA,NA,NA,NA
GovRonDeSantis,1058807868,1438559416161378304,"Gov. DeSantis visits the Lillian S. Wells Women’s Center in Broward to hear from Floridians who recovered from COVID with the help of monoclonal antibody treatments. 
Watch Live: https://t.co/ISjm2aEe4z",2021-09-16 17:44:26+00:00,False,427,776,2423,47,en,False,Twitter Web App,179,202,https://t.co/ISjm2aEe4z,https://fb.watch/83ekyDo__1/,NA,NA,NA,NA,NA,NA,NA,NA
GovRonDeSantis,1058807868,1438314567000600583,Congratulations to the University of Florida for being ranked a top 5 public university. https://t.co/m20om2nPeV,2021-09-16 01:31:30+00:00,False,928,839,11118,98,en,False,Twitter Web App,89,112,https://t.co/m20om2nPeV,https://twitter.com/GovRonDeSantis/status/1438314567000600583/photo/1,NA,NA,NA,NA,NA,NA,NA,NA
GovRonDeSantis,1058807868,1438268983275294727,"Our military is always there for us, and we are proud to support our military installations and communities in Florida.",2021-09-15 22:30:22+00:00,False,1147,844,13196,58,en,False,Twitter for iPhone,NA,NA,NA,NA,NA,NA,NA,NA,NA,NA,NA,NA
GovRonDeSantis,1058807868,1438249575584829452,.@FLCaseyDeSantis and I wish everyone observing #YomKippur an easy and meaningful fast.,2021-09-15 21:13:14+00:00,False,271,436,3121,17,en,False,Twitter Web App,NA,NA,NA,NA,NA,NA,NA,NA,NA,NA,NA,NA
GovRonDeSantis,1058807868,1438144593304985606,"Live Now: Governor DeSantis announces more than $3.4 million in funding for military communities and bases across the state of Florida. 
https://t.co/U8srinIiga",2021-09-15 14:16:05+00:00,False,429,643,3423,38,en,False,Twitter Web App,137,160,https://t.co/U8srinIiga,https://fb.watch/81KqquBm-c/,NA,NA,NA,NA,NA,NA,NA,NA
GovRonDeSantis,1058807868,1437832550253277184,"Florida is the “Education State.” Today I announced our plan to make Florida the first state to fully transition to progress monitoring.

No more FSA testing. No more Common Core. https://t.co/hgFjKLfVig",2021-09-14 17:36:08+00:00,False,2613,2270,14724,510,en,False,Twitter for iPhone,180,203,https://t.co/hgFjKLfVig,https://twitter.com/EducationFL/status/1437801813647011847,NA,NA,NA,NA,NA,NA,NA,NA
GovRonDeSantis,1058807868,1437821413243641858,"Governor DeSantis introduces the new Florida Assessments of Student Thinking (F.A.S.T) progress monitoring for Florida students – individualized, short, check-in assessments that will take hours, not days &amp; reduce overall test time by 75%. 

https://t.co/h44515cgcE",2021-09-14 16:51:53+00:00,False,308,420,2617,35,en,False,Twitter Web App,246,269,https://t.co/h44515cgcE,https://www.facebook.com/watch/live/?v=814108509279217&ref=watch_permalink,NA,NA,NA,NA,NA,NA,NA,NA
GovRonDeSantis,1058807868,1437783143990415363,"Watch Now: Governor Ron DeSantis holds a press conference to announce a bill to eliminate the Florida Standards Assessment – the final step to end Common Core in Florida.

https://t.co/ug1Qj109b3",2021-09-14 14:19:48+00:00,False,572,699,3704,76,en,False,Twitter Web App,172,195,https://t.co/ug1Qj109b3,https://thefloridachannel.org/,NA,NA,NA,NA,NA,NA,NA,NA
GovRonDeSantis,1058807868,1437472408647180300,"Governor DeSantis is in the Tampa Bay area today to announce the advancement of several transportation projects. 

Watch Live: https://t.co/53zjAnqMTr",2021-09-13 17:45:03+00:00,False,221,1064,2294,20,en,False,Twitter Web App,127,150,https://t.co/53zjAnqMTr,https://fb.watch/7-hWvUHizN/,NA,NA,NA,NA,NA,NA,NA,NA
GovRonDeSantis,1058807868,1437432913289793542,"Governor DeSantis holds a press conference to address the recent attacks on Floridians’ freedoms. 

Watch Live: https://t.co/cqihDm4nFg",2021-09-13 15:08:07+00:00,False,737,1922,4531,118,en,False,Twitter Web App,112,135,https://t.co/cqihDm4nFg,https://fb.watch/7-8Iz0YvYT/,NA,NA,NA,NA,NA,NA,NA,NA
GovRonDeSantis,1058807868,1437408466574921730,"Live Now: Governor Ron DeSantis highlights University of Florida’s rise in the U.S. News and World Report rankings.

https://t.co/JwYNrRbLRZ",2021-09-13 13:30:58+00:00,False,282,549,2760,30,en,False,Twitter for iPhone,117,140,https://t.co/JwYNrRbLRZ,https://fb.watch/7-0bClSvFq/,NA,NA,NA,NA,NA,NA,NA,NA
GovRonDeSantis,1058807868,1437220755683659784,"This past week, we awarded $1.9 million to three rural communities to improve infrastructure and expand broadband internet access. 

Glad to assist with these important infrastructure projects.",2021-09-13 01:05:05+00:00,False,1134,1026,12022,66,en,False,Twitter Web App,NA,NA,NA,NA,NA,NA,NA,NA,NA,NA,NA,NA
GovRonDeSantis,1058807868,1437159165047226369,"Perla Baking Co. in Walton County has some great, fresh baked goods.

Make sure to stop by: https://t.co/4e8LNuEmrg https://t.co/z54J9L2NO0",2021-09-12 21:00:20+00:00,False,425,911,4484,41,en,False,Twitter Web App,92,115,https://t.co/4e8LNuEmrg,http://perlabakingco.com,116,139,https://t.co/z54J9L2NO0,https://twitter.com/GovRonDeSantis/status/1437159165047226369/photo/1,NA,NA,NA,NA
GovRonDeSantis,1058807868,1436766619880067072,"Today, we honor those who lost their lives on September 11th and remember the acts of heroism displayed by first responders as well as the passengers of United Flight 93. #NeverForget https://t.co/a0yJdzF1EZ",2021-09-11 19:00:30+00:00,False,1555,1223,13771,55,en,False,Twitter for iPhone,184,207,https://t.co/a0yJdzF1EZ,https://twitter.com/GovRonDeSantis/status/1436766619880067072/photo/1,184,207,https://t.co/a0yJdzF1EZ,https://twitter.com/GovRonDeSantis/status/1436766619880067072/photo/1,184,207,https://t.co/a0yJdzF1EZ,https://twitter.com/GovRonDeSantis/status/1436766619880067072/photo/1
GovRonDeSantis,1058807868,1436676674339450880,We will never forget. #September11 https://t.co/uo8V6YCbWp,2021-09-11 13:03:05+00:00,False,3191,1114,23547,103,en,False,Twitter for iPhone,35,58,https://t.co/uo8V6YCbWp,https://twitter.com/GovRonDeSantis/status/1436676674339450880/photo/1,NA,NA,NA,NA,NA,NA,NA,NA
GovRonDeSantis,1058807868,1436463826594148352,"Today, @FLCaseyDeSantis and I visited Ponte Vedra Beach and Holiday to thank veterans, first responders and their families for their service to our great Country and Constitution. Your sacrifice and dedication is honorable and will not be forgotten. https://t.co/nSGFHJkyQO",2021-09-10 22:57:19+00:00,False,588,1157,5821,46,en,False,Twitter for iPhone,250,273,https://t.co/nSGFHJkyQO,https://twitter.com/GovRonDeSantis/status/1436463826594148352/photo/1,250,273,https://t.co/nSGFHJkyQO,https://twitter.com/GovRonDeSantis/status/1436463826594148352/photo/1,250,273,https://t.co/nSGFHJkyQO,https://twitter.com/GovRonDeSantis/status/1436463826594148352/photo/1
GovRonDeSantis,1058807868,1436402975925211141,"No surprise here - the 1st DCA has restored the right of parents to make the best decisions for their children. 

I will continue to fight for parents’ rights.",2021-09-10 18:55:31+00:00,False,5833,5124,41188,527,en,False,Twitter for iPhone,NA,NA,NA,NA,NA,NA,NA,NA,NA,NA,NA,NA
GovRonDeSantis,1058807868,1436108564775505921,"I had the pleasure of visiting Dominic’s Deli &amp; Eatery in Palm Coast, a local family-owned restaurant. Great food! 

Check it out if you’re in the Palm Coast area: https://t.co/Q9hhFnWfMV https://t.co/tplBwGymOi",2021-09-09 23:25:38+00:00,False,313,1359,3767,45,en,False,Twitter Web App,168,191,https://t.co/Q9hhFnWfMV,http://dominicsdeli.com,192,215,https://t.co/tplBwGymOi,https://twitter.com/GovRonDeSantis/status/1436108564775505921/photo/1,NA,NA,NA,NA
GovRonDeSantis,1058807868,1436102177689423873,"Florida is built for opportunity, just ask our business owners: 
https://t.co/djidcofTXb",2021-09-09 23:00:15+00:00,False,228,713,1882,32,en,False,Twitter Web App,65,88,https://t.co/djidcofTXb,https://storiesofopportunity.com/,NA,NA,NA,NA,NA,NA,NA,NA
GovRonDeSantis,1058807868,1436069711129763850,"My administration is committed to supporting job growth in Florida’s rural communities. 

The $1.1 million infrastructure investment Walton County is receiving today will support nearly 1,000 jobs.

https://t.co/QiI9bfQ0dZ",2021-09-09 20:51:14+00:00,False,322,1022,3084,38,en,False,Twitter Web App,199,222,https://t.co/QiI9bfQ0dZ,https://www.flgov.com/2021/09/09/governor-desantis-announces-nearly-1-9-million-in-awards-to-improve-infrastructure-and-broadband-for-rural-florida-communities/,NA,NA,NA,NA,NA,NA,NA,NA
GovRonDeSantis,1058807868,1436055346158739465,"Governor DeSantis is in Pasco County now to highlight the importance of monoclonal antibody treatments. 

For more information, visit: https://t.co/7Qq1sNv1dQ

https://t.co/TBYDJqmjVY",2021-09-09 19:54:09+00:00,False,386,1237,3035,68,en,False,Twitter Web App,135,158,https://t.co/7Qq1sNv1dQ,http://floridahealthcovid19.gov,160,183,https://t.co/TBYDJqmjVY,https://fb.watch/7W7_v_N9PM/,NA,NA,NA,NA
GovRonDeSantis,1058807868,1436000397399838726,"Watch Live: Governor DeSantis announces that Walton County will receive more than $1.1 million from the Job Growth Grant Fund and Rural Infrastructure Fund.  

https://t.co/Yg8wujRYFR",2021-09-09 16:15:48+00:00,False,126,590,1156,6,en,False,Twitter Web App,160,183,https://t.co/Yg8wujRYFR,https://fb.watch/7VXb_h84gA/,NA,NA,NA,NA,NA,NA,NA,NA
GovRonDeSantis,1058807868,1435702003397705728,"While in Pensacola, Madison and I tried Bagelheads. This local bakery makes their bagels from scratch, and they taste delicious. 

Make sure to try them if you’re in the area: https://t.co/2P6HWpWdPo https://t.co/Ii30oRsW5E",2021-09-08 20:30:06+00:00,False,553,1829,6876,60,en,False,Twitter Web App,176,199,https://t.co/2P6HWpWdPo,http://bagelheads.com,200,223,https://t.co/Ii30oRsW5E,https://twitter.com/GovRonDeSantis/status/1435702003397705728/photo/1,NA,NA,NA,NA
GovRonDeSantis,1058807868,1435615499757424646,"Governor DeSantis talks with monoclonal antibody recipients in Flagler County.

For more information, visit: https://t.co/7Qq1sNv1dQ

Watch now: https://t.co/b6R6eEGqID",2021-09-08 14:46:22+00:00,False,268,995,2051,29,en,False,Twitter Web App,109,132,https://t.co/7Qq1sNv1dQ,http://floridahealthcovid19.gov,145,168,https://t.co/b6R6eEGqID,https://fb.watch/7UxzMddHRH/,NA,NA,NA,NA
GovRonDeSantis,1058807868,1435392440811327493,"As cities across the nation have left law enforcement personnel unsupported and unappreciated, the Sunshine State welcomes qualified professionals because we value those who wear the uniform.",2021-09-08 00:00:00+00:00,False,2715,1673,19863,134,en,False,Twitter Web App,NA,NA,NA,NA,NA,NA,NA,NA,NA,NA,NA,NA
GovRonDeSantis,1058807868,1435384888333463554,"In our upcoming legislative session, I will be prioritizing 3 programs that will focus on recruiting and retaining law enforcement officers. https://t.co/hMWRYfowHI",2021-09-07 23:30:00+00:00,False,356,498,2558,36,en,False,Twitter Web App,141,164,https://t.co/hMWRYfowHI,https://twitter.com/GovRonDeSantis/status/1435384888333463554/photo/1,NA,NA,NA,NA,NA,NA,NA,NA
GovRonDeSantis,1058807868,1435373742121697280,"Here in Florida, the Lakeland Police Department is recruiting officers who were abandoned by jurisdictions that slashed funding of their police departments. https://t.co/zFijusjHQi",2021-09-07 22:45:42+00:00,False,1181,613,6393,87,en,False,Twitter Web App,157,180,https://t.co/zFijusjHQi,https://twitter.com/GovRonDeSantis/status/1435373742121697280/video/1,NA,NA,NA,NA,NA,NA,NA,NA
