ScreenName,AuthorID,TweetID,Text,TweetDate,isReply,RetweetCount,ReplyCount,LikeCount,QuoteCount,Language,PossibleSensitive,Source,1stURLStart,1stURLEnd,1stURL,1stURLExp,2ndURLStart,2ndURLEnd,2ndURL,2ndURLExp,3rdURLStart,3rdURLEnd,3rdURL,3rdURLExp
SenTomCotton,968650362,1453817920367341568,"It's unthinkable to pay a burglar who broke into your home for the ‘psychological trauma’ they endured during the crime. Yet the Biden admin wants to reward migrants who illegally entered our country with up to $450,000 each for just that reason. Insanity. https://t.co/XNTFs9KkLo",2021-10-28 20:16:17+00:00,False,1345,533,3324,128,en,False,Twitter Web App,257,280,https://t.co/XNTFs9KkLo,https://www.cotton.senate.gov/news/press-releases/cotton-statement-on-biden-plan-to-give-illegal-immigrants-hundreds-of-millions-in-cash,NA,NA,NA,NA,NA,NA,NA,NA
SenTomCotton,968650362,1453746875899777038,"Merrick Garland abused his power by sending federal law enforcement to investigate parents simply for having the wrong political opinions.

He needs to go. https://t.co/YN40pv46Vb",2021-10-28 15:33:59+00:00,False,489,433,2011,32,en,False,Twitter Web App,156,179,https://t.co/YN40pv46Vb,https://twitter.com/SenTomCotton/status/1453746875899777038/video/1,NA,NA,NA,NA,NA,NA,NA,NA
SenTomCotton,968650362,1453508006054965248,Merrick Garland has politicized the Department of Justice and it’s time for him to resign. https://t.co/SyRWG8CuMg,2021-10-27 23:44:48+00:00,False,374,744,1698,45,en,False,Twitter for iPhone,91,114,https://t.co/SyRWG8CuMg,https://twitter.com/SenTomCotton/status/1453508006054965248/video/1,NA,NA,NA,NA,NA,NA,NA,NA
SenTomCotton,968650362,1453402756346257409,Merrick Garland's performance as Attorney General has been shameful. He should resign in disgrace. https://t.co/oyRg9Sc2NV,2021-10-27 16:46:34+00:00,False,2606,2822,9669,368,en,False,Twitter Web App,99,122,https://t.co/oyRg9Sc2NV,https://twitter.com/SenTomCotton/status/1453402756346257409/video/1,NA,NA,NA,NA,NA,NA,NA,NA
SenTomCotton,968650362,1453382275857539078,"Semiconductor companies doubling down on investments in China shouldn’t receive CHIPs funds.
https://t.co/HUVZc2bpOL",2021-10-27 15:25:11+00:00,False,244,128,503,12,en,False,Twitter for iPhone,93,116,https://t.co/HUVZc2bpOL,https://www.scmp.com/tech/policy/article/3153896/china-woos-intel-infineon-and-others-chip-investment-push-boost-supply,NA,NA,NA,NA,NA,NA,NA,NA
SenTomCotton,968650362,1453374277600915461,"Eliminating qualified immunity would mean fewer police, less enforcement, and more crime. 

This is the true goal of most critics of qualified immunity. They are seeking to covertly “defund the police” without ever saying those words.

https://t.co/BBEGaodhY3",2021-10-27 14:53:24+00:00,False,73,191,243,14,en,False,Twitter Web App,236,259,https://t.co/BBEGaodhY3,https://www.nationalreview.com/2021/10/in-defense-of-qualified-immunity/,NA,NA,NA,NA,NA,NA,NA,NA
SenTomCotton,968650362,1453351483378999299,"We should protect those who protect us — and that means protecting qualified immunity. 

https://t.co/BBEGaodhY3",2021-10-27 13:22:50+00:00,False,83,359,467,43,en,False,Twitter Web App,89,112,https://t.co/BBEGaodhY3,https://www.nationalreview.com/2021/10/in-defense-of-qualified-immunity/,NA,NA,NA,NA,NA,NA,NA,NA
SenTomCotton,968650362,1453333346407403520,"We're facing the worst crime wave in recent history, but President Biden is trying to eliminate cash bail in the name of ""gender equity."" https://t.co/V2JjjqEmH0",2021-10-27 12:10:46+00:00,False,281,205,860,23,en,False,Twitter Web App,138,161,https://t.co/V2JjjqEmH0,https://twitter.com/SenTomCotton/status/1453333346407403520/video/1,NA,NA,NA,NA,NA,NA,NA,NA
SenTomCotton,968650362,1453069523502968833,"The Democrats may be willing to trade American jobs and wages for the short-sighted political gains of their radical immigration policies, but Americans certainly aren’t.",2021-10-26 18:42:25+00:00,True,55,35,241,5,en,False,Twitter Web App,NA,NA,NA,NA,NA,NA,NA,NA,NA,NA,NA,NA
SenTomCotton,968650362,1453069521812660227,"Democrats aren’t stopping at amnesty. At the bidding of big tech, Democrats want to remove green cards limits. The flood of imported workers would depress American wages &amp; cut off young American STEM graduates from jobs. https://t.co/209ovVX7ot",2021-10-26 18:42:25+00:00,True,152,39,330,11,en,False,Twitter Web App,225,248,https://t.co/209ovVX7ot,https://www.foxnews.com/politics/hagerty-sanders-immigration-expansion-big-tech-dem-reconciliation-bill,NA,NA,NA,NA,NA,NA,NA,NA
SenTomCotton,968650362,1453069520470413313,"Granting amnesty rewards illegal immigrants for breaking our laws. That’s a slap in the face to legal immigrants who waited their turn, and it will encourage more migrants to cross the border illegally. That’s untenable—especially during a crisis. https://t.co/VTP9hjdLqD",2021-10-26 18:42:25+00:00,True,36,6,104,1,en,False,Twitter Web App,248,271,https://t.co/VTP9hjdLqD,https://www.nytimes.com/2021/10/22/us/politics/border-crossings-immigration-record-high.html,NA,NA,NA,NA,NA,NA,NA,NA
SenTomCotton,968650362,1453069518763438084,Amnesty would cost billions of dollars and strain welfare and entitlement programs meant for Americans. But Democrats don’t care. They want to spend more of your money anyway.,2021-10-26 18:42:24+00:00,True,34,6,102,0,en,False,Twitter Web App,NA,NA,NA,NA,NA,NA,NA,NA,NA,NA,NA,NA
SenTomCotton,968650362,1453069517198872588,"Granting amnesty in any form hurts America’s working class. It forces Americans—especially recent legal immigrants—to compete with millions of illegal immigrants for lower wages. Democrats like Senator Bernie Sanders used to understand this. What happened, @SenSanders?",2021-10-26 18:42:24+00:00,True,38,9,110,1,en,False,Twitter Web App,NA,NA,NA,NA,NA,NA,NA,NA,NA,NA,NA,NA
SenTomCotton,968650362,1453069515500163072,Democrats will trade American jobs and wages for amnesty. They don’t mind that it drains welfare programs and they certainly don't care that it will encourage even more illegal immigration. Democrats want amnesty at any cost. https://t.co/ZXc8hHjAuT,2021-10-26 18:42:23+00:00,False,176,118,436,19,en,False,Twitter Web App,226,249,https://t.co/ZXc8hHjAuT,https://www.foxnews.com/politics/dems-pushing-amnesty-reconciliation,NA,NA,NA,NA,NA,NA,NA,NA
SenTomCotton,968650362,1453056213386682368,President Biden bears responsibility for the fiasco in Afghanistan and must be held accountable. https://t.co/8EYyuaqIUz,2021-10-26 17:49:32+00:00,False,307,204,1370,24,en,False,Twitter Media Studio,97,120,https://t.co/8EYyuaqIUz,https://twitter.com/SenTomCotton/status/1453056213386682368/video/1,NA,NA,NA,NA,NA,NA,NA,NA
SenTomCotton,968650362,1453038204513394694,"TikTok is a Trojan Horse used by the Chinese Communist Party to harvest data from Americans and others around the globe. The company should have never been considered as a sponsor for the U.S. Cyber Games.
https://t.co/5lmlwGwaef",2021-10-26 16:37:58+00:00,False,250,66,597,24,en,False,Twitter Web App,206,229,https://t.co/5lmlwGwaef,https://www.cassidy.senate.gov/newsroom/press-releases/cassidy-cotton-force-chinese-run-tiktok-out-of-us-cyber-games-sponsorship,NA,NA,NA,NA,NA,NA,NA,NA
SenTomCotton,968650362,1451621130658267146,"Despite continued evacuations, even more Americans remain now than the Biden administration estimated months ago, along with countless Afghan allies. President Biden must do more to rescue Americans trapped in a disaster of his own making.
https://t.co/A86B0FuUIS",2021-10-22 18:47:02+00:00,True,100,42,295,7,en,False,Twitter Web App,240,263,https://t.co/A86B0FuUIS,https://www.cotton.senate.gov/news/press-releases/biden-administration-wrong-about-evacuation-numbers-must-do-more,NA,NA,NA,NA,NA,NA,NA,NA
SenTomCotton,968650362,1451621129429340172,"Unsurprisingly, the administration either miscalculated, didn’t care, or outright lied about the number of Americans President Biden left behind in Afghanistan.",2021-10-22 18:47:01+00:00,False,390,154,1348,25,en,False,Twitter Web App,NA,NA,NA,NA,NA,NA,NA,NA,NA,NA,NA,NA
SenTomCotton,968650362,1451596275665752064,"It's time for the Biden administration to declare a national emergency at the border.

https://t.co/0vKeSYpOgB",2021-10-22 17:08:16+00:00,False,144,186,650,29,en,False,Twitter Web App,87,110,https://t.co/0vKeSYpOgB,https://www.foxnews.com/opinion/biden-national-emergency-border-need-leadership-sen-tom-cotton,NA,NA,NA,NA,NA,NA,NA,NA
SenTomCotton,968650362,1451563249573445660,"It is time for leadership at the border and accountability in Washington. It’s a shame that President Biden is unwilling to provide it. 
https://t.co/0vKeSYpOgB",2021-10-22 14:57:02+00:00,False,47,61,208,2,en,False,Twitter Web App,137,160,https://t.co/0vKeSYpOgB,https://www.foxnews.com/opinion/biden-national-emergency-border-need-leadership-sen-tom-cotton,NA,NA,NA,NA,NA,NA,NA,NA
SenTomCotton,968650362,1451230202613407750,"Schools should work with parents to support kids. But when it comes to ""gender transition,"" many educators believe they know better and have undermined or even outright lied to parents about their own children’s welfare.
https://t.co/S7spuvVSti",2021-10-21 16:53:37+00:00,False,76,65,393,15,en,False,Twitter Web App,221,244,https://t.co/S7spuvVSti,https://www.foxnews.com/politics/cotton-bill-school-policies-subvert-parental-authority-gender,NA,NA,NA,NA,NA,NA,NA,NA
SenTomCotton,968650362,1451224533420105730,"Schools shouldn't impose radical, harmful ideologies on children—especially without parents’ knowledge and consent. My bill will protect students and ensure that parents are in control of their children’s education.
https://t.co/xfhbrTTiEz",2021-10-21 16:31:05+00:00,False,59,73,291,10,en,False,Twitter Web App,216,239,https://t.co/xfhbrTTiEz,https://www.cotton.senate.gov/news/press-releases/cotton-introduces-bill-to-prevent-schools-from-concealing-gender-transitions-from-parents,NA,NA,NA,NA,NA,NA,NA,NA
SenTomCotton,968650362,1451206961651929089,"The NBA allows its players to kneel during the national anthem, but punishes players for speaking out against human rights violations in China.

Pathetic, but not surprising.
https://t.co/H1CRQB2nUA",2021-10-21 15:21:16+00:00,False,285,191,745,48,en,False,Twitter Web App,175,198,https://t.co/H1CRQB2nUA,https://www.washingtonpost.com/world/2021/10/21/nba-china-boston-celtics-enes-kanter/,NA,NA,NA,NA,NA,NA,NA,NA
SenTomCotton,968650362,1451205421235113997,"Allowing a Chinese state-sponsored data harvesting company to be the lead sponsor for the U.S. Cyber Games is another unbelievable demonstration of this administration’s incompetence.
https://t.co/MOYf57k0ma",2021-10-21 15:15:09+00:00,False,66,35,197,4,en,False,Twitter Web App,184,207,https://t.co/MOYf57k0ma,https://www.foxbusiness.com/politics/cassidy-cotton-blast-biden-chinese-owned-tiktok-founding-sponsor-us-cyber-games,NA,NA,NA,NA,NA,NA,NA,NA
SenTomCotton,968650362,1450848218716250113,Thanks to all the members of the Arkansas Chamber of Commerce who came today—great to have you back in D.C.! https://t.co/ApUQQW2oG1,2021-10-20 15:35:45+00:00,False,17,33,151,4,en,False,Twitter for iPhone,109,132,https://t.co/ApUQQW2oG1,https://twitter.com/SenTomCotton/status/1450848218716250113/photo/1,NA,NA,NA,NA,NA,NA,NA,NA
SenTomCotton,968650362,1450838396759314435,"A democracy that doesn’t tolerate free speech will not remain a democracy for long. It’s essential that we reclaim our colleges and universities so that they provide value to future generations of Americans, not just an exclusive safe haven for radicals.
https://t.co/H5lqvZU4iu",2021-10-20 14:56:43+00:00,False,63,65,268,11,en,False,Twitter Web App,255,278,https://t.co/H5lqvZU4iu,https://www.foxnews.com/opinion/free-speech-college-campuses-protect-sen-tom-cotton-sen-marsha-blackburn,NA,NA,NA,NA,NA,NA,NA,NA
SenTomCotton,968650362,1450834095899041800,"Universities should encourage a variety of viewpoints—but today, colleges and students often silence classmates and faculty who disagree with ideas like Critical Race Theory. The Campus Free Speech Caucus will help return free speech to higher education.
https://t.co/3Dclx6P39T",2021-10-20 14:39:38+00:00,False,73,57,289,9,en,False,Twitter Web App,255,278,https://t.co/3Dclx6P39T,https://www.cotton.senate.gov/news/press-releases/cotton-blackburn-colleagues-fight-for-free-speech-on-college-campuses,NA,NA,NA,NA,NA,NA,NA,NA
SenTomCotton,968650362,1450516159216898048,The Biden administration is trying to hide the consequences of President Biden's disastrous immigration policy. https://t.co/4GR3kFknDw,2021-10-19 17:36:16+00:00,False,71,62,268,6,en,False,Twitter Web App,112,135,https://t.co/4GR3kFknDw,https://twitter.com/SenTomCotton/status/1450516159216898048/video/1,NA,NA,NA,NA,NA,NA,NA,NA
SenTomCotton,968650362,1450479481278406658,"Significant evidence suggests that COVID-19 originated in the Wuhan Institute of Virology, which received gain-of-function research grants. Until the origin of this virus can be confirmed, funding for similar research programs should be halted.
https://t.co/MAQcqCzcXy",2021-10-19 15:10:31+00:00,False,655,173,2153,45,en,False,Twitter Web App,245,268,https://t.co/MAQcqCzcXy,https://www.marshall.senate.gov/press-releases/sen-marshall-legislation-to-halt-viral-gain-of-function-research/,NA,NA,NA,NA,NA,NA,NA,NA
SenTomCotton,968650362,1450176756363694085,Colin Powell was fierce in his convictions and always put his country first. The United States is safer and stronger today for his service. May God grant his loved ones the peace that comes from a life well lived.,2021-10-18 19:07:36+00:00,False,81,86,807,9,en,False,Twitter for iPhone,NA,NA,NA,NA,NA,NA,NA,NA,NA,NA,NA,NA
SenTomCotton,968650362,1449749690749181955,"If Rachael Rollins is confirmed as a U.S. Attorney by the Senate, the residents of Massachusetts, New Hampshire and all of New England would suffer the consequences.
https://t.co/yQEcwBuR9U",2021-10-17 14:50:35+00:00,False,180,148,464,28,en,False,Twitter for iPhone,166,189,https://t.co/yQEcwBuR9U,https://www.bostonherald.com/2021/10/17/cotton-biden-pick-rachael-rollins-poses-threat-to-n-e-if-confirmed/,NA,NA,NA,NA,NA,NA,NA,NA
SenTomCotton,968650362,1449094818433544201,Pete Buttigieg's performance as Secretary of Transportation has been so bad that Americans didn't even realize he spent the last two months absent on paternity leave. https://t.co/0P5EvboXMN,2021-10-15 19:28:22+00:00,False,326,167,1171,29,en,False,Twitter Web App,167,190,https://t.co/0P5EvboXMN,https://twitter.com/SenTomCotton/status/1449094818433544201/video/1,NA,NA,NA,NA,NA,NA,NA,NA
SenTomCotton,968650362,1449028878253625353,"It would be a catastrophe of historic proportions to allow China to invade and annex Taiwan.

The United States must remain steadfast in our commitment to our friends in Taiwan. https://t.co/EZvSI9K9sn",2021-10-15 15:06:20+00:00,False,255,133,732,25,en,False,Twitter Web App,178,201,https://t.co/EZvSI9K9sn,https://twitter.com/SenTomCotton/status/1449028878253625353/video/1,NA,NA,NA,NA,NA,NA,NA,NA
SenTomCotton,968650362,1448758126006657025,"Until Alan Estevez confirms that he will address the threat posed by the Chinese Communist Party, he has no business serving at the Department of Commerce.
https://t.co/uGFCcnO43d",2021-10-14 21:10:28+00:00,False,92,41,216,8,en,False,Twitter Web App,156,179,https://t.co/uGFCcnO43d,https://www.cotton.senate.gov/news/press-releases/cotton-hagerty-demand-that-estevez-confirm-chinese-communist-party-threat,NA,NA,NA,NA,NA,NA,NA,NA
SenTomCotton,968650362,1448729568211357699,"Every American ought to be alarmed by the Democrats' banking surveillance scheme.
https://t.co/EDaB9tz0XD",2021-10-14 19:16:59+00:00,False,104,51,288,9,en,False,Twitter Web App,82,105,https://t.co/EDaB9tz0XD,https://www.arkansasonline.com/news/2021/oct/14/risky-power-grab/,NA,NA,NA,NA,NA,NA,NA,NA
SenTomCotton,968650362,1448692667320258572,These are the kind of domestic terrorists @TheJusticeDept should be investigating—not parents protesting racist school curriculum. https://t.co/uxiW7ixMJ9,2021-10-14 16:50:21+00:00,False,98,69,314,9,en,False,Twitter for iPhone,131,154,https://t.co/uxiW7ixMJ9,https://twitter.com/jennytyoung/status/1448176708180320257,NA,NA,NA,NA,NA,NA,NA,NA
SenTomCotton,968650362,1448646116199653388,"Congratulations, Ms. Saum and Stagecoach Elementary School! Students in Arkansas are lucky to have you. https://t.co/c5gqP8WRvx",2021-10-14 13:45:23+00:00,False,11,8,91,1,en,False,Twitter for iPhone,104,127,https://t.co/c5gqP8WRvx,https://twitter.com/ArkansasEd/status/1448375500565532673,NA,NA,NA,NA,NA,NA,NA,NA
SenTomCotton,968650362,1448641615778680837,"Pete Buttigieg couldn’t organize a one car funeral—he’s not going to organize our ports, railroads, highways, and airports. https://t.co/Fh0NjbgGFx",2021-10-14 13:27:30+00:00,False,368,229,1274,40,en,False,Twitter for iPhone,124,147,https://t.co/Fh0NjbgGFx,https://twitter.com/SenTomCotton/status/1448641615778680837/video/1,NA,NA,NA,NA,NA,NA,NA,NA
