ScreenName,AuthorID,TweetID,Text,TweetDate,isReply,RetweetCount,ReplyCount,LikeCount,QuoteCount,Language,PossibleSensitive,Source,1stURLStart,1stURLEnd,1stURL,1stURLExp,2ndURLStart,2ndURLEnd,2ndURL,2ndURLExp,3rdURLStart,3rdURLEnd,3rdURL,3rdURLExp
SenTomCotton,968650362,1392578570942287873,"More than 10 times as many illegal aliens crossed our border last month than during April 2020. 

President Biden is on track to preside over the highest influx of illegal border crossings in 20 years.
https://t.co/Vl2cUAausf",2021-05-12 20:32:58+00:00,False,50,53,147,6,en,False,Twitter Web App,202,225,https://t.co/Vl2cUAausf,https://www.cbp.gov/newsroom/national-media-release/cbp-announces-april-2021-operational-update,NA,NA,NA,NA,NA,NA,NA,NA
SenTomCotton,968650362,1392563307052212234,"We have a responsibility to protect the most vulnerable, and that means we have an obligation to protect unborn babies with Down syndrome. https://t.co/phdodwB3so",2021-05-12 19:32:19+00:00,False,86,93,446,6,en,False,Twitter Media Studio,139,162,https://t.co/phdodwB3so,https://twitter.com/SenTomCotton/status/1392563307052212234/video/1,NA,NA,NA,NA,NA,NA,NA,NA
SenTomCotton,968650362,1392557374750265345,I submitted these questions and many others to Kristen Clarke ahead of the committee vote tomorrow to advance her nomination. She has yet to respond.,2021-05-12 19:08:45+00:00,True,17,25,103,0,en,False,Twitter Web App,NA,NA,NA,NA,NA,NA,NA,NA,NA,NA,NA,NA
SenTomCotton,968650362,1392557373919797248,Senate Democrats are hell-bent on forcing Clarke’s nomination so she can use the power of the government to advance far-left policies like Critical Race Theory. The Senate should not consent to Clarke’s nomination until we receive truthful and complete answers to these questions.,2021-05-12 19:08:45+00:00,True,20,14,110,1,en,False,Twitter Web App,NA,NA,NA,NA,NA,NA,NA,NA,NA,NA,NA,NA
SenTomCotton,968650362,1392557373072494597,Clarke is nominated to be the head of the Department of Justice’s Civil Rights Division. But how can she represent the United States in court when she’s accused more than 200 current federal judges of being “white male extremists”?,2021-05-12 19:08:44+00:00,True,4,2,13,0,en,False,Twitter Web App,NA,NA,NA,NA,NA,NA,NA,NA,NA,NA,NA,NA
SenTomCotton,968650362,1392557372237877248,"Clarke needs to answer for her incendiary social media presence. Her account is now locked, but last year she called @lisamurkowski “shameful” and accused @Sen_JoeManchin of “hollow words” because he celebrated Martin Luther King but disagreed with one of her political positions.",2021-05-12 19:08:44+00:00,True,3,5,9,0,en,False,Twitter Web App,NA,NA,NA,NA,NA,NA,NA,NA,NA,NA,NA,NA
SenTomCotton,968650362,1392557371260608512,"Clarke must explain why she claimed that she “did not have a speaking or other substantive role” in a conference celebrating cop-killers, when the speakers at the conference thanked her by name for organizing it and moderating a panel.
https://t.co/2d7mVUMv5b",2021-05-12 19:08:44+00:00,True,9,2,15,1,en,False,Twitter Web App,236,259,https://t.co/2d7mVUMv5b,https://freebeacon.com/biden-administration/records-contradict-doj-nominees-testimony-on-controversial-conference/,NA,NA,NA,NA,NA,NA,NA,NA
SenTomCotton,968650362,1392557370287562754,"This week—during Police Week—Senate Democrats will try to advance Kristen Clarke’s nomination to be a top-ranking official at the Department of Justice. Clarke is a radical, anti-law-enforcement nominee, who has openly called to “defund the police.""
https://t.co/eyjqxOzj3J",2021-05-12 19:08:44+00:00,False,75,48,190,4,en,False,Twitter Web App,250,273,https://t.co/eyjqxOzj3J,https://www.newsweek.com/i-prosecuted-police-killings-defund-police-strategic-opinion-1510018,NA,NA,NA,NA,NA,NA,NA,NA
SenTomCotton,968650362,1392528513207607298,"Correctional officers’ jobs are dangerous and difficult enough without prisoners using contraband cellphones to coordinate assaults and drug deals from inside prison walls.

It’s time to allow prisons to jam these cellphones, turning these dangerous devices into paperweights. https://t.co/BOEgguitNC",2021-05-12 17:14:04+00:00,False,55,41,298,6,en,False,Twitter Media Studio,277,300,https://t.co/BOEgguitNC,https://twitter.com/SenTomCotton/status/1392528513207607298/video/1,NA,NA,NA,NA,NA,NA,NA,NA
SenTomCotton,968650362,1392501486823804932,"The international business community shouldn’t view the removal of U.S. sanctions on Iran as a lucrative opportunity.

Reentering the Iranian market would make businesses complicit in the regime’s support of terrorism.
https://t.co/cHHkCC2Vtr",2021-05-12 15:26:40+00:00,False,101,41,292,3,en,False,Twitter Web App,219,242,https://t.co/cHHkCC2Vtr,https://www.foxbusiness.com/politics/senate-republicans-warn-business-groups-iran,NA,NA,NA,NA,NA,NA,NA,NA
SenTomCotton,968650362,1392493391460671489,"It would be a grave mistake for businesses to reengage Iran.

Any new deal or sanctions relief from the Biden administration will be fleeting.
https://t.co/iLzt3DdBTx",2021-05-12 14:54:30+00:00,False,110,33,321,6,en,False,Twitter Web App,143,166,https://t.co/iLzt3DdBTx,https://www.cotton.senate.gov/news/press-releases/cotton-leads-letter-warning-international-business-community-about-resuming-business-with-iran,NA,NA,NA,NA,NA,NA,NA,NA
SenTomCotton,968650362,1392468278635810816,Anthony Fauci and the NIH need to provide answers to the American people about what role they may have played in funding research at laboratories in Wuhan where covid-19 likely originated. https://t.co/DRwuvsX1nc,2021-05-12 13:14:43+00:00,False,223,129,741,25,en,False,Twitter Web App,189,212,https://t.co/DRwuvsX1nc,https://twitter.com/SenTomCotton/status/1392468278635810816/video/1,NA,NA,NA,NA,NA,NA,NA,NA
SenTomCotton,968650362,1392295507863687168,"Offering unilateral concessions only encouraged Houthi aggression, a lesson the administration should remember with the Iranian regime.
https://t.co/uShYKDs2xV",2021-05-12 01:48:11+00:00,False,65,59,182,4,en,False,Twitter for iPhone,136,159,https://t.co/uShYKDs2xV,https://www.bloomberg.com/opinion/articles/2021-05-11/the-u-s-is-getting-a-reality-check-in-yemen-with-iran-backed-houthis,NA,NA,NA,NA,NA,NA,NA,NA
SenTomCotton,968650362,1392291251198779392,"Arkansans in Camden helped build the Iron Dome system that saves lives from terror attacks.

Arkansas stands with Israel. https://t.co/fi73jtg8GU",2021-05-12 01:31:16+00:00,False,130,136,847,18,en,False,Twitter for iPhone,122,145,https://t.co/fi73jtg8GU,https://twitter.com/IDF/status/1392289537594994693,NA,NA,NA,NA,NA,NA,NA,NA
SenTomCotton,968650362,1392288230071017472,"Iran is behind attacks this week in Iraq, Yemen, and Israel—now is absolutely the wrong time lift sanctions and appease the ayatollahs. https://t.co/ezKBqaBCTV",2021-05-12 01:19:16+00:00,False,163,92,524,13,en,False,Twitter for iPhone,136,159,https://t.co/ezKBqaBCTV,https://twitter.com/DavidADaoud/status/1392271901318389764,NA,NA,NA,NA,NA,NA,NA,NA
SenTomCotton,968650362,1392282180131430403,"If Hamas put down their weapons, there would be peace.

If Israel put down their weapons, there would be no Israel.",2021-05-12 00:55:13+00:00,False,2584,1192,9478,588,en,False,Twitter for iPhone,NA,NA,NA,NA,NA,NA,NA,NA,NA,NA,NA,NA
SenTomCotton,968650362,1392214579829149699,"While Iranian-backed terrorists are attacking Israel, President Biden is negotiating to lift U.S. terror sanctions on the regime.

President Biden’s desperation to reach a new deal with Iran will put Israel in even more danger.",2021-05-11 20:26:36+00:00,False,662,324,2278,53,en,False,Twitter for iPhone,NA,NA,NA,NA,NA,NA,NA,NA,NA,NA,NA,NA
SenTomCotton,968650362,1392167235544887301,"Our wealthiest universities have amassed billions of dollars, virtually tax-free, all while indoctrinating our youth with un-American ideas.

My bill will tax mega-endowments to support training programs to create high paying, working-class jobs.
https://t.co/STvd24fYPC",2021-05-11 17:18:28+00:00,False,1116,453,4635,233,en,False,Twitter Web App,247,270,https://t.co/STvd24fYPC,https://www.cotton.senate.gov/news/press-releases/cotton-introduces-bill-to-tax-private-university-mega-endowments-support-workforce-training-programs,NA,NA,NA,NA,NA,NA,NA,NA
SenTomCotton,968650362,1391910028009951233,"Wealthy universities sit on billion dollar endowments—virtually tax free—while indoctrinating students to hate America.

As long as these institutions preach things like Critical Race Theory, a percentage of their endowments should be redirected to support vocational training. https://t.co/pYqnZh7GOz",2021-05-11 00:16:25+00:00,False,202,273,814,75,en,False,Twitter Web App,278,301,https://t.co/pYqnZh7GOz,https://twitter.com/SenTomCotton/status/1391910028009951233/video/1,NA,NA,NA,NA,NA,NA,NA,NA
SenTomCotton,968650362,1391832881413214213,"Hamas’s acts of terror against Israel are despicable. The U.S. must stand with our ally Israel and support its right to defend itself.
https://t.co/v8kFbLJcKr",2021-05-10 19:09:52+00:00,False,201,168,886,28,en,False,Twitter Web App,135,158,https://t.co/v8kFbLJcKr,https://www.reuters.com/world/asia-pacific/violence-erupts-al-aqsa-mosque-israel-marks-jerusalem-day-2021-05-10/,NA,NA,NA,NA,NA,NA,NA,NA
SenTomCotton,968650362,1391443335022317577,"That the US Navy seized another shipment of Iranian weapons bound for Yemen should come as no surprise.

Iran has sought to fuel civil war in Yemen since at least 2013:

https://t.co/YVrSxoAmSB",2021-05-09 17:21:57+00:00,False,312,118,814,34,en,False,Twitter for iPhone,170,193,https://t.co/YVrSxoAmSB,https://www.nytimes.com/2013/03/03/world/middleeast/seized-arms-off-yemen-raise-alarm-over-iran.html?referringSource=articleShare,NA,NA,NA,NA,NA,NA,NA,NA
SenTomCotton,968650362,1391038096930742274,"Actually, it’s the Walt Disney Corporation that benefits from the systemic racism of China’s slave labor in Xinjiang.

They left that out of their critical race theory curriculum. https://t.co/Z8qjhfLnv9",2021-05-08 14:31:41+00:00,False,597,163,1870,45,en,False,Twitter for iPhone,180,203,https://t.co/Z8qjhfLnv9,https://twitter.com/realchrisrufo/status/1390828488949518337,NA,NA,NA,NA,NA,NA,NA,NA
SenTomCotton,968650362,1390660383078293508,"The last thing we need now is higher taxes, mass amnesty, and trillions more in debt.",2021-05-07 13:30:47+00:00,False,953,1979,4478,191,en,False,Twitter for iPhone,NA,NA,NA,NA,NA,NA,NA,NA,NA,NA,NA,NA
SenTomCotton,968650362,1390473359352385536,"Great to speak with the students, faculty, and supporters of @McLennanCC in Waco about public service.

Thank you for coming! https://t.co/p4ll6VLqVW",2021-05-07 01:07:37+00:00,False,22,52,160,4,en,False,Twitter for iPhone,126,149,https://t.co/p4ll6VLqVW,https://twitter.com/SenTomCotton/status/1390473359352385536/photo/1,126,149,https://t.co/p4ll6VLqVW,https://twitter.com/SenTomCotton/status/1390473359352385536/photo/1,126,149,https://t.co/p4ll6VLqVW,https://twitter.com/SenTomCotton/status/1390473359352385536/photo/1
SenTomCotton,968650362,1390369868411703296,"On this National Day of Prayer, let us join together in thanks for the many blessings we enjoy as Americans.",2021-05-06 18:16:23+00:00,False,193,210,1678,20,en,False,Twitter for iPhone,NA,NA,NA,NA,NA,NA,NA,NA,NA,NA,NA,NA
SenTomCotton,968650362,1390064773581180931,"President Biden’s decision to support the TRIPS waiver won’t save lives, but it will jeopardize our vaccine development and hand over America’s medical technology to China and Russia.
https://t.co/CfYMZBCk6J",2021-05-05 22:04:02+00:00,False,56,113,204,8,en,False,Twitter for iPhone,184,207,https://t.co/CfYMZBCk6J,https://www.cotton.senate.gov/news/press-releases/cotton-tillis-statement-on-president-bidens-decision-to-support-the-trips-waiver,NA,NA,NA,NA,NA,NA,NA,NA
SenTomCotton,968650362,1390046161126449160,"The Biden administration is serious about dismantling our immigration enforcement. 

They’re putting the interests of illegal aliens ahead of Americans. https://t.co/r2d33KIdjY",2021-05-05 20:50:05+00:00,False,155,117,498,11,en,False,Twitter for iPhone,153,176,https://t.co/r2d33KIdjY,https://twitter.com/NickMiroff/status/1390022792607842304,NA,NA,NA,NA,NA,NA,NA,NA
SenTomCotton,968650362,1390038675220742146,"My staff and I are in touch with local officials in northwest Arkansas and are continuing to monitor as the community assesses storm damage.

My office remains committed to help. Learn more about the ways we can assist here: https://t.co/kNk4YIcVB8",2021-05-05 20:20:20+00:00,False,13,22,83,1,en,False,Twitter for iPhone,225,248,https://t.co/kNk4YIcVB8,http://Cotton.senate.gov/help/casework,NA,NA,NA,NA,NA,NA,NA,NA
SenTomCotton,968650362,1389935116147961857,"President Biden shouldn’t be lifting sanctions—he should be holding Iran responsible for these acts of terror.
https://t.co/rphfLoG6ER",2021-05-05 13:28:50+00:00,False,187,103,586,16,en,False,Twitter for iPhone,111,134,https://t.co/rphfLoG6ER,https://m.jpost.com/middle-east/iranian-backed-rocket-attacks-on-us-increase-in-iraq-667205,NA,NA,NA,NA,NA,NA,NA,NA
SenTomCotton,968650362,1389633639877652485,"Freeing American hostages in Iran should continue to be a top priority for the U.S. government, but the administration must not pay ransom in any form. That would only beget further hostage-taking by the terrorist Iranian regime.",2021-05-04 17:30:52+00:00,False,234,92,1138,24,en,False,Twitter for iPhone,NA,NA,NA,NA,NA,NA,NA,NA,NA,NA,NA,NA
SenTomCotton,968650362,1389609329150636040,"This morning I spoke with @hughhewitt about how President Biden's tax plan will affect working families.

The promise of ""no taxes for those making under $400,000"" is plainly false.
https://t.co/dGSvCgD9Gp",2021-05-04 15:54:16+00:00,False,50,72,202,8,en,False,Twitter Web App,182,205,https://t.co/dGSvCgD9Gp,https://www.youtube.com/watch?v=igr957fdgjA,NA,NA,NA,NA,NA,NA,NA,NA
SenTomCotton,968650362,1389603789896888320,"President Biden’s policies aren’t compassionate and they aren’t protecting Americans. 

The Biden administration is making it easier for drugs to be smuggled into our country. https://t.co/R3geD9jZey",2021-05-04 15:32:15+00:00,False,78,81,246,6,en,False,Twitter for iPhone,176,199,https://t.co/R3geD9jZey,https://twitter.com/BrianMannADK/status/1389354358454824965,NA,NA,NA,NA,NA,NA,NA,NA
SenTomCotton,968650362,1389378328784670722,Congratulations to Trooper James Ray! Our state is safer for his service. https://t.co/PtM5iA5szp,2021-05-04 00:36:21+00:00,False,46,37,297,2,en,False,Twitter for iPhone,74,97,https://t.co/PtM5iA5szp,https://www.4029tv.com/article/arkansas-state-trooper-james-ray-pursuit/36320876#,NA,NA,NA,NA,NA,NA,NA,NA
SenTomCotton,968650362,1389330252430721024,Increasing the refugee admissions cap will put American jobs and safety at risk. The Biden administration should be focused on getting Americans back to work. https://t.co/4adIUGjVir,2021-05-03 21:25:19+00:00,False,91,209,355,18,en,False,Twitter for iPhone,159,182,https://t.co/4adIUGjVir,https://twitter.com/PunchbowlNews/status/1389309009476337665,NA,NA,NA,NA,NA,NA,NA,NA
SenTomCotton,968650362,1389289229545578507,"The safest place for the world’s most dangerous terrorists is at Guantanamo Bay.

We cannot allow Democrats to close this prison and welcome its detainees to our country. https://t.co/8mB7us7WBe",2021-05-03 18:42:18+00:00,False,91,90,381,12,en,False,Twitter Media Studio,171,194,https://t.co/8mB7us7WBe,https://twitter.com/SenTomCotton/status/1389289229545578507/video/1,NA,NA,NA,NA,NA,NA,NA,NA
SenTomCotton,968650362,1389254137779531780,"The CDC is a thoroughly politicized agency, bending to the call of teachers unions.

Kids should be back in real schools with their teachers—not on zoom. https://t.co/Pc4cHR2j3F",2021-05-03 16:22:52+00:00,False,184,147,719,12,en,False,Twitter Web App,154,177,https://t.co/Pc4cHR2j3F,https://twitter.com/SenTomCotton/status/1389254137779531780/video/1,NA,NA,NA,NA,NA,NA,NA,NA
SenTomCotton,968650362,1389228444421140480,"Melvin's passion and drive is undeniable. I know he'll inspire others at @GoodwillAR Excel Center to succeed just as he has.
https://t.co/H4cBMdm5MY",2021-05-03 14:40:46+00:00,False,12,16,91,0,en,False,Twitter Web App,125,148,https://t.co/H4cBMdm5MY,https://www.arkansasonline.com/news/2021/may/02/dropout-gets-ged-from-goodwill/,NA,NA,NA,NA,NA,NA,NA,NA
SenTomCotton,968650362,1388154263956766721,Illegal border crossings are skyrocketing. This crisis is not “under control.” https://t.co/FiyZBgJTAa,2021-04-30 15:32:21+00:00,False,151,176,594,20,en,False,Twitter for iPhone,79,102,https://t.co/FiyZBgJTAa,https://twitter.com/thehill/status/1388107881824858116,NA,NA,NA,NA,NA,NA,NA,NA
SenTomCotton,968650362,1387912221435510794,"Amazon's decision to pull Justice Thomas' documentary from their streaming service makes it clear Amazon isn't concerned with ""Amplifying Black Voices,"" they're only concerned with ""Amplifying Liberal Black Voices.""
https://t.co/7cv2SKh7mb",2021-04-29 23:30:34+00:00,False,471,152,1229,39,en,False,Twitter Web App,216,239,https://t.co/7cv2SKh7mb,https://www.cotton.senate.gov/news/press-releases/cotton-colleagues-condemn-amazon-for-removing-justice-clarence-thomas-documentary,NA,NA,NA,NA,NA,NA,NA,NA
