ScreenName,AuthorID,TweetID,Text,TweetDate,isReply,RetweetCount,ReplyCount,LikeCount,QuoteCount,Language,PossibleSensitive,Source,1stURLStart,1stURLEnd,1stURL,1stURLExp,2ndURLStart,2ndURLEnd,2ndURL,2ndURLExp,3rdURLStart,3rdURLEnd,3rdURL,3rdURLExp
SenTomCotton,968650362,1398376609372049410,"Joe Biden caves to the radical left again. For almost 40 years, he supported bans on federal funding for abortion.
 
Now? He wants your taxpayer dollars for abortion.
https://t.co/DcA27wOp7N",2021-05-28 20:32:18+00:00,False,123,257,372,20,en,False,Twitter for iPhone,167,190,https://t.co/DcA27wOp7N,https://www.foxnews.com/politics/biden-hyde-amendment-budget-abortion,NA,NA,NA,NA,NA,NA,NA,NA
SenTomCotton,968650362,1398341762930860032,Fauci has a lot of questions to answer. And he needs to stop playing word games. https://t.co/snFXlcpjKP,2021-05-28 18:13:50+00:00,False,292,249,948,24,en,False,Twitter for iPhone,81,104,https://t.co/snFXlcpjKP,https://www.theaustralian.com.au/world/anthony-fauci-backed-virus-experiments-despite-pandemic-risk/news-story/3c604681cfcbfeda88bac25e372a1b8a,NA,NA,NA,NA,NA,NA,NA,NA
SenTomCotton,968650362,1398312654461079553,"Brave Americans wounded in the service of our country deserve every measure of our support. I’m proud to join my colleagues on this important part of a long campaign to care for our men and women in uniform and hold their attackers responsible.
https://t.co/W2hXOCgptB",2021-05-28 16:18:10+00:00,False,29,132,178,6,en,False,Twitter Web App,245,268,https://t.co/W2hXOCgptB,https://www.cotton.senate.gov/news/press-releases/cotton-collins-gillibrand-shaheen-introduce-bill-to-improve-officers-access-to-care-at-walter-reed,NA,NA,NA,NA,NA,NA,NA,NA
SenTomCotton,968650362,1398079010081591298,"Full text of the opinion:

https://t.co/YHXxmE1wmv",2021-05-28 00:49:45+00:00,True,46,25,175,5,en,False,Twitter for iPhone,27,50,https://t.co/YHXxmE1wmv,https://www.opn.ca6.uscourts.gov/opinions.pdf/21a0120p-06.pdf,NA,NA,NA,NA,NA,NA,NA,NA
SenTomCotton,968650362,1398074361366581248,Great ruling from Judge Amul Thapar: State-sanctioned racism violates the Constitution. https://t.co/BtvFdtLAfv,2021-05-28 00:31:17+00:00,False,362,101,1559,31,en,False,Twitter for iPhone,88,111,https://t.co/BtvFdtLAfv,https://twitter.com/SenTomCotton/status/1398074361366581248/photo/1,NA,NA,NA,NA,NA,NA,NA,NA
SenTomCotton,968650362,1398018715309031429,"If you're a member of the military and being taught that the military is a systematically racist institution, that America is a fundamentally racist country, or that any race of Americans is inherently an “oppressor” or “victim,” I want to hear from you.
https://t.co/nLCb2wDiAA",2021-05-27 20:50:10+00:00,True,295,105,650,25,en,False,Twitter Web App,255,278,https://t.co/nLCb2wDiAA,https://www.cotton.senate.gov/contact,NA,NA,NA,NA,NA,NA,NA,NA
SenTomCotton,968650362,1398018710326190080,"Today I met with LtCol Matthew Lohmeier, who was fired for warning about the dangers of Marxism in the military. I was concerned by what I heard and will be pressing senior military leaders for answers. https://t.co/gV6JCzU14I",2021-05-27 20:50:09+00:00,False,627,216,2073,58,en,False,Twitter Web App,203,226,https://t.co/gV6JCzU14I,https://twitter.com/SenTomCotton/status/1398018710326190080/photo/1,NA,NA,NA,NA,NA,NA,NA,NA
SenTomCotton,968650362,1397963716897935364,David Chipman isn’t even trying to hide the fact that he wants to outlaw guns. https://t.co/sRPFtQ9f1D,2021-05-27 17:11:37+00:00,False,73,120,244,7,en,False,Twitter Web App,79,102,https://t.co/sRPFtQ9f1D,https://twitter.com/SenTomCotton/status/1397963716897935364/video/1,NA,NA,NA,NA,NA,NA,NA,NA
SenTomCotton,968650362,1397653095644078080,"Giving Americans money based on their skin color is illegal, racist, and reporters should stop being afraid to say so.
https://t.co/21BRXp4hmt",2021-05-26 20:37:19+00:00,False,243,257,884,47,en,False,Twitter Web App,119,142,https://t.co/21BRXp4hmt,https://www.politico.com/news/2021/05/25/housing-assistance-racial-wealth-gap-490617,NA,NA,NA,NA,NA,NA,NA,NA
SenTomCotton,968650362,1397650116253728769,"Too little, too late.
https://t.co/Lm9KPXmvKn",2021-05-26 20:25:29+00:00,False,167,165,656,19,en,False,Twitter Web App,22,45,https://t.co/Lm9KPXmvKn,https://www.whitehouse.gov/briefing-room/statements-releases/2021/05/26/statement-by-president-joe-biden-on-the-investigation-into-the-origins-of-covid-19/,NA,NA,NA,NA,NA,NA,NA,NA
SenTomCotton,968650362,1397623668075900931,"By law, the United States is barred from giving aid to the terror-sponsoring Palestinian Authority. 

Illegal and immoral.
https://t.co/3bGj38zhuo",2021-05-26 18:40:23+00:00,False,97,106,336,7,en,False,Twitter Web App,123,146,https://t.co/3bGj38zhuo,https://www.axios.com/bidens-gaza-reconstruction-palestinian-authority-bae86c4d-92d1-41d4-aa98-05d18c6e3efd.html?utm_source=twitter&utm_medium=social&utm_campaign=editorial&utm_content=world-gazareconstruction,NA,NA,NA,NA,NA,NA,NA,NA
SenTomCotton,968650362,1397606711108718592,President Biden’s ATF nominee is eager to ban basically every single modern sporting rifle in America today. https://t.co/iFrCUS6GYW,2021-05-26 17:33:00+00:00,False,258,195,662,47,en,False,Twitter Media Studio,109,132,https://t.co/iFrCUS6GYW,https://twitter.com/SenTomCotton/status/1397606711108718592/video/1,NA,NA,NA,NA,NA,NA,NA,NA
SenTomCotton,968650362,1397563665923166213,Tony Fauci needs to come clean to the American people. https://t.co/hCjiLb9AH4,2021-05-26 14:41:58+00:00,False,196,148,729,17,en,False,Twitter Web App,55,78,https://t.co/hCjiLb9AH4,https://twitter.com/SenTomCotton/status/1397563665923166213/video/1,NA,NA,NA,NA,NA,NA,NA,NA
SenTomCotton,968650362,1397344195468308484,"Because the media doesn’t like my politics, they lied to the public about the origin of covid-19.

They ought to be held accountable for covering up for the Chinese Communist Party. https://t.co/ne6hdSsRvc",2021-05-26 00:09:52+00:00,False,321,188,1072,31,en,False,Twitter Web App,182,205,https://t.co/ne6hdSsRvc,https://twitter.com/SenTomCotton/status/1397344195468308484/video/1,NA,NA,NA,NA,NA,NA,NA,NA
SenTomCotton,968650362,1397271547375755267,🤔 https://t.co/536ygN1gC7,2021-05-25 19:21:11+00:00,False,571,153,3949,25,und,False,Twitter for iPhone,2,25,https://t.co/536ygN1gC7,https://twitter.com/washingtonpost/status/1229187459742867465,NA,NA,NA,NA,NA,NA,NA,NA
SenTomCotton,968650362,1397248574879043588,I'm proud to work with @LeaderMcConnell to combat the rise of anti-Semitic hate crimes. https://t.co/I7eZcNwCkT,2021-05-25 17:49:54+00:00,False,52,92,200,7,en,False,Twitter Web App,88,111,https://t.co/I7eZcNwCkT,https://twitter.com/LeaderMcConnell/status/1397242857040269312,NA,NA,NA,NA,NA,NA,NA,NA
SenTomCotton,968650362,1396992540092600324,"If we want closure in the aftermath of this pandemic—and if we want to avert the next one—we must learn about its origin. That means we must look at the lab in Wuhan and the experimental research its scientists performed.

https://t.co/id456z7xAs",2021-05-25 00:52:31+00:00,True,194,118,936,19,en,False,Twitter Web App,223,246,https://t.co/id456z7xAs,https://www.foxnews.com/opinion/biden-fauci-democrats-covid-origins-sen-tom-cotton,NA,NA,NA,NA,NA,NA,NA,NA
SenTomCotton,968650362,1396992539010469894,"Americans also deserve answers from our own public-health officials, such as Dr. Fauci, about U.S. involvement in bat-coronavirus research at the Wuhan lab.

https://t.co/BRZl3z9n48",2021-05-25 00:52:30+00:00,True,182,38,998,14,en,False,Twitter Web App,158,181,https://t.co/BRZl3z9n48,https://nicholaswade.medium.com/origin-of-covid-following-the-clues-6f03564c038,NA,NA,NA,NA,NA,NA,NA,NA
SenTomCotton,968650362,1396992538029043712,"The Wuhan Institute of Virology &amp; Wuhan CDC need to open their doors &amp; databases for a full audit of their research—especially dangerous gain-of-function research.
 
The CCP needs to stop obstructing investigators, destroying evidence, and telling ridiculous lies.",2021-05-25 00:52:30+00:00,True,122,15,668,9,en,False,Twitter Web App,NA,NA,NA,NA,NA,NA,NA,NA,NA,NA,NA,NA
SenTomCotton,968650362,1396992537202659329,"The United States &amp; the world must demand a full, impartial investigation into COVID-19 origins, with a special focus on the Wuhan labs.",2021-05-25 00:52:30+00:00,True,101,14,710,8,en,False,Twitter Web App,NA,NA,NA,NA,NA,NA,NA,NA,NA,NA,NA,NA
SenTomCotton,968650362,1396992536229695494,"The lab-leak hypothesis was always reasonable, but reporters &amp; activists in white lab coats nonetheless spent the better part of a year denouncing it as a “conspiracy theory.” They were wrong.
 
But that’s not what’s most important now. What’s important is truth &amp; accountability.",2021-05-25 00:52:30+00:00,True,150,63,904,21,en,False,Twitter Web App,NA,NA,NA,NA,NA,NA,NA,NA,NA,NA,NA,NA
SenTomCotton,968650362,1396992534623174658,"Evidence of a lab leak has been building for months:
 
—Lax safety conditions at Wuhan Institute of Virology
—Similarities between research at the lab and features of the virus
—Patents for bat cages and other live-animal research tools filed by WIV

https://t.co/gLbpMPrvWX",2021-05-25 00:52:29+00:00,True,88,8,621,2,en,False,Twitter Web App,251,274,https://t.co/gLbpMPrvWX,https://www.hudson.org/research/16762-transcript-the-origins-of-covid-19-policy-implications-and-lessons-for-the-future,NA,NA,NA,NA,NA,NA,NA,NA
SenTomCotton,968650362,1396992533473996803,"Three Wuhan lab researchers went to the hospital with COVID symptoms in November 2019—a month before the first confirmed case of the disease.
 
It’s time for the Chinese Communist Party to come clean about what happened at that lab.

https://t.co/7XZrLRCBFH",2021-05-25 00:52:29+00:00,True,146,10,842,8,en,False,Twitter Web App,234,257,https://t.co/7XZrLRCBFH,https://www.wsj.com/articles/intelligence-on-sick-staff-at-wuhan-lab-fuels-debate-on-covid-19-origin-11621796228,NA,NA,NA,NA,NA,NA,NA,NA
SenTomCotton,968650362,1396992532245057536,"Isn’t it strange that this once-in-a-century bat coronavirus pandemic just happened to emerge within a few miles of China’s biggest laboratory researching bat coronaviruses? 

Shouldn’t we at least look at that lab? 
https://t.co/A1q9Ulxl4t",2021-05-25 00:52:29+00:00,True,151,31,985,12,en,False,Twitter Web App,217,240,https://t.co/A1q9Ulxl4t,https://www.youtube.com/watch?v=ytGIkcCh7T8,NA,NA,NA,NA,NA,NA,NA,NA
SenTomCotton,968650362,1396992531385180165,"The common-sense case for a lab leak is the same as it was in January 2020, when I first mentioned the possibility.",2021-05-25 00:52:29+00:00,False,1318,297,7879,107,en,False,Twitter Web App,NA,NA,NA,NA,NA,NA,NA,NA,NA,NA,NA,NA
SenTomCotton,968650362,1396935304746045440,"Belarus’s aerial piracy and possible Russian involvement demand a swift and strong response from NATO and the EU. That response should start with ending the Nord Stream 2 pipeline project, Russia’s attempt to gain further coercive leverage over Europe.
https://t.co/Yz5XkJwQFB",2021-05-24 21:05:05+00:00,False,53,29,188,6,en,False,Twitter Web App,253,276,https://t.co/Yz5XkJwQFB,https://www.cotton.senate.gov/news/press-releases/cotton-statement-on-airplane-hijacking-in-belarus,NA,NA,NA,NA,NA,NA,NA,NA
SenTomCotton,968650362,1396933334916272132,I’m glad Democrats and public health bureaucrats are finally accepting the most logical explanation—this virus likely originated from the Wuhan virology lab. https://t.co/8D4SM4jo3r,2021-05-24 20:57:15+00:00,False,301,106,837,16,en,False,Twitter Web App,158,181,https://t.co/8D4SM4jo3r,https://twitter.com/SenTomCotton/status/1396933334916272132/video/1,NA,NA,NA,NA,NA,NA,NA,NA
SenTomCotton,968650362,1396919080821604355,"Sharing our vaccines with other countries is benevolent.

Sharing our research technology with the Chinese Communist Party is not. https://t.co/w9USBBYMU8",2021-05-24 20:00:37+00:00,False,145,64,522,4,en,False,Twitter Web App,131,154,https://t.co/w9USBBYMU8,https://twitter.com/SenTomCotton/status/1396919080821604355/video/1,NA,NA,NA,NA,NA,NA,NA,NA
SenTomCotton,968650362,1396490390212067329,The Biden administration must hold the Chinese Communist Party accountable for unleashing covid-19 and demand answers about its origin. https://t.co/vB4tuJoUbd,2021-05-23 15:37:09+00:00,False,689,292,1385,43,en,False,Twitter Web App,136,159,https://t.co/vB4tuJoUbd,https://twitter.com/SenTomCotton/status/1396490390212067329/video/1,NA,NA,NA,NA,NA,NA,NA,NA
SenTomCotton,968650362,1396122175044825095,"Congratulations, @RazorbackBSB! Woo Pig! https://t.co/fQ80saUGHo",2021-05-22 15:13:59+00:00,False,11,32,87,0,en,False,Twitter for iPhone,41,64,https://t.co/fQ80saUGHo,https://twitter.com/RazorbackBSB/status/1395972175547432965,NA,NA,NA,NA,NA,NA,NA,NA
SenTomCotton,968650362,1396109460544921601,"The Air Force’s decision to name the 189th the new home of the C-130J Super Hercules training program is outstanding news.

I’m delighted for our airmen, our Air Force base, and our state.
https://t.co/yqc86OHsPS",2021-05-22 14:23:28+00:00,False,25,37,178,1,en,False,Twitter Web App,189,212,https://t.co/yqc86OHsPS,https://www.cotton.senate.gov/news/press-releases/new-c-130j-super-hercules-coming-to-little-rock-airforce-base,NA,NA,NA,NA,NA,NA,NA,NA
SenTomCotton,968650362,1395885707718283264,The Biden administration has no business forcing Christian colleges to house biological men in girls’ dorms. https://t.co/neH5pxC8Zs,2021-05-21 23:34:21+00:00,False,188,132,730,20,en,False,Twitter for iPhone,109,132,https://t.co/neH5pxC8Zs,https://twitter.com/WashTimes/status/1395346074290868236,NA,NA,NA,NA,NA,NA,NA,NA
SenTomCotton,968650362,1395862417574400005,"Anti-Semitism has no place in the U.S. The DOJ must take immediate, decisive action to stop the shocking rise of hate crimes targeting the American Jewish community.

Our bill will ensure the racist criminals committing these crimes are held accountable.
https://t.co/XZRYP1sRuQ",2021-05-21 22:01:48+00:00,False,74,79,313,13,en,False,Twitter Web App,255,278,https://t.co/XZRYP1sRuQ,https://www.cotton.senate.gov/news/press-releases/cotton-mcconnell-announce-bill-to-combat-anti-semitic-hate-crimes,NA,NA,NA,NA,NA,NA,NA,NA
SenTomCotton,968650362,1395806639446503430,"Congratulations to this C-130 aircrew from Little Rock Air Force Base who were honored for their courageous service.
https://t.co/R96QXABi9U",2021-05-21 18:20:10+00:00,False,23,28,163,0,en,False,Twitter for iPhone,117,140,https://t.co/R96QXABi9U,https://www.airforcemag.com/c-130-crew-receives-dfc-air-medals-for-afghanistan-mission/,NA,NA,NA,NA,NA,NA,NA,NA
SenTomCotton,968650362,1395779935919349767,"Chinese companies—particularly powerful ones—are arms of the CCP &amp; remain ultimately under state control. It’s time our laws recognize that reality. Our bill will close legal loopholes &amp; force lobbyists for Chinese companies to register as foreign agents.
https://t.co/JnuZkJ8n3D",2021-05-21 16:34:03+00:00,False,179,50,377,8,en,False,Twitter Web App,264,287,https://t.co/JnuZkJ8n3D,https://www.cotton.senate.gov/news/press-releases/cotton-gallagher-introduce-bill-to-close-lobbying-loopholes-for-chinese-companies,NA,NA,NA,NA,NA,NA,NA,NA
SenTomCotton,968650362,1395498290007904259,"Reversing its previous decision, the Biden administration now agrees that terrorists threaten the peace and security of Yemen. https://t.co/5L5wG9uy6i",2021-05-20 21:54:54+00:00,False,73,65,265,8,en,False,Twitter for iPhone,127,150,https://t.co/5L5wG9uy6i,https://twitter.com/SecBlinken/status/1395486991148593157,NA,NA,NA,NA,NA,NA,NA,NA
SenTomCotton,968650362,1395446732234833920,"The United States must ensure Israel continues to have the resources it needs to protect Israeli citizens and to defeat its terrorist enemies. 

U.S. assistance headed to areas under Hamas control should be redirected to Israel to resupply the Iron Dome.
https://t.co/qBJ2B1DN3o",2021-05-20 18:30:01+00:00,False,47,50,199,3,en,False,Twitter Web App,255,278,https://t.co/qBJ2B1DN3o,http://www.hagerty.senate.gov/press-releases/hagerty-rubio-cotton-cruz-introduce-legislation-to-resupply-israels-iron-dome-missile-defense/,NA,NA,NA,NA,NA,NA,NA,NA
SenTomCotton,968650362,1395435713966100483,President Biden is caving to the Hamas sympathizers within his party. https://t.co/IFOL8TEBeB,2021-05-20 17:46:14+00:00,False,117,112,405,16,en,False,Twitter Media Studio,70,93,https://t.co/IFOL8TEBeB,https://twitter.com/SenTomCotton/status/1395435713966100483/video/1,NA,NA,NA,NA,NA,NA,NA,NA
SenTomCotton,968650362,1395113507159482378,"Operation Warp Speed’s success shouldn’t be ignored—it should be standardized so that the United States is more prepared next time. 

My bill builds upon the success of Operation Warp Speed and strengthens our ability to fight any future pandemic.
https://t.co/DgOI6bUqR4",2021-05-19 20:25:54+00:00,False,37,158,196,8,en,False,Twitter Web App,248,271,https://t.co/DgOI6bUqR4,https://www.cotton.senate.gov/news/press-releases/cotton-introduces-bill-to-codify-successes-of-operation-warp-speed-prepare-for-future-pandemics,NA,NA,NA,NA,NA,NA,NA,NA
SenTomCotton,968650362,1395105024800350211,Nord Stream 2 should be left incomplete to rust in the Baltic—not rescued by an American president.,2021-05-19 19:52:12+00:00,False,112,63,512,8,en,False,Twitter for iPhone,NA,NA,NA,NA,NA,NA,NA,NA,NA,NA,NA,NA
SenTomCotton,968650362,1395099974350876673,Packing the court would destroy its legitimacy and undermine the rule of law.,2021-05-19 19:32:08+00:00,False,269,3363,1931,318,en,False,Twitter for iPhone,NA,NA,NA,NA,NA,NA,NA,NA,NA,NA,NA,NA
SenTomCotton,968650362,1395097391473246214,Why is President Biden shutting down American pipelines but helping open Russia’s Nord Stream 2? https://t.co/7QuXykK2Ni,2021-05-19 19:21:52+00:00,False,811,390,2063,90,en,False,Twitter Media Studio,97,120,https://t.co/7QuXykK2Ni,https://twitter.com/SenTomCotton/status/1395097391473246214/video/1,NA,NA,NA,NA,NA,NA,NA,NA
SenTomCotton,968650362,1395093343256911877,"Democrats want to deny Israel even the ability to defend itself, as rockets rain down on innocent Israelis.

The United States must supply Israel with the resources it needs to defeat Hamas.
https://t.co/4l6XlsXZqL",2021-05-19 19:05:47+00:00,False,74,146,350,6,en,False,Twitter Web App,191,214,https://t.co/4l6XlsXZqL,https://www.politico.com/news/2021/05/19/liberal-dems-stop-israel-arms-sale-489578,NA,NA,NA,NA,NA,NA,NA,NA
SenTomCotton,968650362,1395044468437487621,The responsibility for the conflict in Israel rests in one place—with Hamas and the Palestinian Islamic Jihad. https://t.co/6iGRaxC5ek,2021-05-19 15:51:34+00:00,False,124,69,486,8,en,False,Twitter Web App,111,134,https://t.co/6iGRaxC5ek,https://twitter.com/SenTomCotton/status/1395044468437487621/video/1,NA,NA,NA,NA,NA,NA,NA,NA
SenTomCotton,968650362,1395006709039513602,There is nothing more destructive to moral than teaching our young troops that some races are inherently privileged or inherently victimized. https://t.co/KywJjBHlvj,2021-05-19 13:21:32+00:00,False,110,152,495,9,en,False,Twitter Media Studio,142,165,https://t.co/KywJjBHlvj,https://twitter.com/SenTomCotton/status/1395006709039513602/video/1,NA,NA,NA,NA,NA,NA,NA,NA
SenTomCotton,968650362,1394764101071433728,"Apple has proudly refused to aid US law enforcement but is eager to compromise its principles for access to China’s market. 

Apple’s priority is its bottomline, not user security.

https://t.co/31aQx2tG8z",2021-05-18 21:17:29+00:00,False,148,67,357,5,en,False,Twitter for iPhone,182,205,https://t.co/31aQx2tG8z,https://www.nytimes.com/2021/05/17/technology/apple-china-censorship-data.html,NA,NA,NA,NA,NA,NA,NA,NA
SenTomCotton,968650362,1394721551937835008,"President Biden is caving to Vladimir Putin.
https://t.co/pPSQ14cgGe",2021-05-18 18:28:25+00:00,False,76,143,252,16,en,False,Twitter Web App,45,68,https://t.co/pPSQ14cgGe,https://www.axios.com/nord-stream-sanction-biden-russia-f6db2ae3-2c89-4343-b326-9f399d674077.html?utm_campaign=organic&utm_medium=socialshare&utm_source=twitter,NA,NA,NA,NA,NA,NA,NA,NA
SenTomCotton,968650362,1394702229265858568,"There are very few differences between al Qaeda, ISIS, and Hamas—the U.S.-designated terrorist organization the @AP has chosen to defend. https://t.co/jw3JsvEDFe",2021-05-18 17:11:38+00:00,False,206,336,678,60,en,False,Twitter Media Studio,138,161,https://t.co/jw3JsvEDFe,https://twitter.com/SenTomCotton/status/1394702229265858568/video/1,NA,NA,NA,NA,NA,NA,NA,NA
SenTomCotton,968650362,1394665431332495367,"Israel should destroy Hamas’s war machine, and the U.S. should provide it with the time, space, and resources to do so. https://t.co/mSYlEcDlEx",2021-05-18 14:45:25+00:00,False,190,178,878,24,en,False,Twitter Web App,120,143,https://t.co/mSYlEcDlEx,https://twitter.com/SenTomCotton/status/1394665431332495367/video/1,NA,NA,NA,NA,NA,NA,NA,NA
SenTomCotton,968650362,1394416293076418562,"President Biden’s moralistic call for a ceasefire is little more than a propaganda win for Hamas.
https://t.co/uRtexiVgoX",2021-05-17 22:15:25+00:00,False,81,212,318,13,en,False,Twitter for iPhone,98,121,https://t.co/uRtexiVgoX,https://www.axios.com/biden-backs-gaza-ceasefire-call-with-netanyahu-befeb26a-2c87-41bb-8f5a-6e8d7652df85.html?stream=politics&utm_source=alert&utm_medium=email&utm_campaign=alerts_politics,NA,NA,NA,NA,NA,NA,NA,NA
SenTomCotton,968650362,1394398934072762368,Hear me clearly: the handwringing calls for a ceasefire are tantamount to Hamas propaganda. https://t.co/GJqUwu4rlF,2021-05-17 21:06:27+00:00,False,113,169,539,9,en,False,Twitter Web App,92,115,https://t.co/GJqUwu4rlF,https://twitter.com/SenTomCotton/status/1394398934072762368/video/1,NA,NA,NA,NA,NA,NA,NA,NA
SenTomCotton,968650362,1394369520266055688,We'll have a ceasefire when Israel defeats its terrorist enemies. https://t.co/jiVmQZTxb8,2021-05-17 19:09:34+00:00,False,279,443,1455,116,en,False,Twitter Web App,66,89,https://t.co/jiVmQZTxb8,https://twitter.com/SenTomCotton/status/1394369520266055688/video/1,NA,NA,NA,NA,NA,NA,NA,NA
SenTomCotton,968650362,1394363039655337984,"Saving innocent Israelis isn’t prolonging this conflict—Hamas’s terrorist attacks are. It’s ridiculous to blame Israel for defending itself against indiscriminate rocket fire.
https://t.co/P2zMu0PDEe",2021-05-17 18:43:49+00:00,False,46,60,230,6,en,False,Twitter Web App,176,199,https://t.co/P2zMu0PDEe,https://www.washingtonpost.com/politics/2021/05/14/israels-iron-dome-defense-system-protects-israeli-lives-it-also-perpetuates-israel-gaza-conflict/,NA,NA,NA,NA,NA,NA,NA,NA
SenTomCotton,968650362,1394361752637386760,It’s time for Roe to go. https://t.co/Ir1nJCvPlb,2021-05-17 18:38:42+00:00,False,95,200,600,32,en,False,Twitter for iPhone,25,48,https://t.co/Ir1nJCvPlb,https://twitter.com/SCOTUSblog/status/1394284425224114176,NA,NA,NA,NA,NA,NA,NA,NA
SenTomCotton,968650362,1394307453928579076,"Instead of giving away our vaccine trade secrets, the Biden administration should arrange for other governments to buy the American-made vaccines we are already on track to produce.
https://t.co/mXeOJYQVnc",2021-05-17 15:02:56+00:00,False,192,204,898,24,en,False,Twitter Web App,182,205,https://t.co/mXeOJYQVnc,https://www.nationalreview.com/2021/05/the-biden-administrations-vaccine-mistake/,NA,NA,NA,NA,NA,NA,NA,NA
SenTomCotton,968650362,1394057643581485056,This team is incredible! Woo Pig! https://t.co/xGx2SXAIE4,2021-05-16 22:30:17+00:00,False,6,40,118,1,en,False,Twitter for iPhone,34,57,https://t.co/xGx2SXAIE4,https://twitter.com/RazorbackBSB/status/1394017603027300352,NA,NA,NA,NA,NA,NA,NA,NA
SenTomCotton,968650362,1393020062580236289,President Biden is inviting hundreds of thousands of illegal aliens into our country each month at the expense of the American taxpayer. https://t.co/ULDwDdHs1m,2021-05-14 01:47:18+00:00,False,186,210,617,22,en,False,Twitter Web App,137,160,https://t.co/ULDwDdHs1m,https://twitter.com/SenTomCotton/status/1393020062580236289/video/1,NA,NA,NA,NA,NA,NA,NA,NA
SenTomCotton,968650362,1392959434628993027,"Families shouldn’t have to sell their businesses or farms after the death of a parent just to afford the 40% estate tax.

My bill would cut that rate in half, making it much easier to preserve a family’s legacy and way of life.
https://t.co/QmxdMjvaVD",2021-05-13 21:46:23+00:00,False,130,140,666,12,en,False,Twitter for iPhone,228,251,https://t.co/QmxdMjvaVD,https://www.cotton.senate.gov/news/press-releases/cotton-boozman-introduce-bill-to-reduce-estate-tax,NA,NA,NA,NA,NA,NA,NA,NA
SenTomCotton,968650362,1392940611523825666,"Arkansas' law seeks to protect babies with Down syndrome from modern-day eugenicists who want to end their lives, simply because of their disability. 

We stand with Arkansas and the unborn, and we will fight to uphold this law at the Supreme Court.
https://t.co/qjwn8uav6k",2021-05-13 20:31:36+00:00,False,40,39,210,7,en,False,Twitter Web App,250,273,https://t.co/qjwn8uav6k,https://www.cotton.senate.gov/news/press-releases/cotton-hinson-file-amicus-brief-to-protect-babies-with-down-syndrome,NA,NA,NA,NA,NA,NA,NA,NA
SenTomCotton,968650362,1392877144410398721,"It was entirely preventable—by China.
https://t.co/3MLMswr92Y",2021-05-13 16:19:24+00:00,False,108,119,468,12,en,False,Twitter Web App,38,61,https://t.co/3MLMswr92Y,https://www.axios.com/report-covid-19-preventable-disaster-who-b1003f08-a9cb-4863-80a4-f05de6159ec5.html,NA,NA,NA,NA,NA,NA,NA,NA
SenTomCotton,968650362,1392587358323847170,"Violent, repeat criminals should be behind bars, not roaming the streets threatening law-abiding citizens. 

The Restoring the Armed Career Criminal Act will give back federal prosecutors the tool they need to lock up hardened, repeat offenders. 

https://t.co/3nongikiBH",2021-05-12 21:07:53+00:00,False,39,72,184,4,en,False,Twitter Web App,248,271,https://t.co/3nongikiBH,https://www.cotton.senate.gov/news/press-releases/cotton-colleagues-reintroduce-the-restoring-armed-career-criminal-act,NA,NA,NA,NA,NA,NA,NA,NA
