ScreenName,AuthorID,TweetID,Text,TweetDate,isReply,RetweetCount,ReplyCount,LikeCount,QuoteCount,Language,PossibleSensitive,Source,1stURLStart,1stURLEnd,1stURL,1stURLExp,2ndURLStart,2ndURLEnd,2ndURL,2ndURLExp,3rdURLStart,3rdURLEnd,3rdURL,3rdURLExp
SenJohnKennedy,816683274076614656,1443605811633311748,"If I go to the store and order 50,000 truckloads of “Tax the Rich” dresses and put them on my credit card, that’s not free.  

The same goes for Democrats’ $3.5T tax-and-spend bill: This neo-socialist agenda is going to cost Americans a lot. https://t.co/nJXZRZZZfT",2021-09-30 15:57:01+00:00,False,98,111,376,8,en,False,Twitter Media Studio,242,265,https://t.co/nJXZRZZZfT,https://twitter.com/SenJohnKennedy/status/1443605811633311748/video/1,NA,NA,NA,NA,NA,NA,NA,NA
SenJohnKennedy,816683274076614656,1443589240533630985,"Marriage promotes healthy families and communities. Democrats should stop trying to discourage marriage with unfair tax hikes.

https://t.co/MVNEiQdCOl",2021-09-30 14:51:10+00:00,False,56,33,215,7,en,False,Twitter Web App,128,151,https://t.co/MVNEiQdCOl,https://www.kennedy.senate.gov/public/press-releases?id=5F243D27-6637-488D-ABE9-DD24B1BCEA96,NA,NA,NA,NA,NA,NA,NA,NA
SenJohnKennedy,816683274076614656,1442946949959716866,"I’ll fight any attempt to subject our Second Amendment right to international interference. The U.N. doesn’t have oversight of America’s constitutional liberties. #2A
 
https://t.co/2RJo3EuEHN",2021-09-28 20:18:56+00:00,False,159,97,588,14,en,False,Twitter Web App,169,192,https://t.co/2RJo3EuEHN,https://www.kennedy.senate.gov/public/press-releases?id=71C28C3B-4D6B-45E3-9678-CEE3CBC533B9,NA,NA,NA,NA,NA,NA,NA,NA
SenJohnKennedy,816683274076614656,1442903864039010308,"Welcoming $4M to help honor veterans and their loved ones in northwest Louisiana.
 
We always remember our nation’s heroes.

https://t.co/SLSqFzd4r4",2021-09-28 17:27:43+00:00,False,24,30,175,3,en,False,Twitter for iPhone,125,148,https://t.co/SLSqFzd4r4,https://www.kennedy.senate.gov/public/press-releases?id=2220A4BD-3743-4019-AD69-7738EB883A7A,NA,NA,NA,NA,NA,NA,NA,NA
SenJohnKennedy,816683274076614656,1442624718381723650,"The Senate just considered a way to keep the government open, maintain flood insurance, and send Louisiana disaster aid—all without giving Democrats a blank check to blow out the national debt.

Democrats immediately blocked this simple solution. https://t.co/2oM0zdjM7S",2021-09-27 22:58:30+00:00,False,300,280,827,38,en,False,Twitter Media Studio,247,270,https://t.co/2oM0zdjM7S,https://twitter.com/SenJohnKennedy/status/1442624718381723650/video/1,NA,NA,NA,NA,NA,NA,NA,NA
SenJohnKennedy,816683274076614656,1442584317696249858,"The Treasury is sitting on $337 million that should be in Louisianians’ pockets. The Unclaimed Savings Bond Act would help our state get this money to its rightful owners.

https://t.co/JOG3zSZzZv",2021-09-27 20:17:57+00:00,False,36,33,170,2,en,False,Twitter Web App,173,196,https://t.co/JOG3zSZzZv,https://www.kennedy.senate.gov/public/press-releases?id=816133B3-94B3-4C63-AFFE-3E2B0080AF04,NA,NA,NA,NA,NA,NA,NA,NA
SenJohnKennedy,816683274076614656,1442567169586470916,"Quick reminder: The deadline to apply for Operation Blue Roof is this Thursday, Sept. 30. 

Louisiana homeowners who need roof reinforcement while they wait for permanent repairs can apply for help here:
 
https://t.co/U64wLRHBXr",2021-09-27 19:09:49+00:00,False,22,14,39,0,en,False,Twitter Web App,206,229,https://t.co/U64wLRHBXr,https://survey123.arcgis.com/share/68358194235145abbf8000ba60386062?portalUrl=https://arcportal-ucop-partners.usace.army.mil/usaceportal,NA,NA,NA,NA,NA,NA,NA,NA
SenJohnKennedy,816683274076614656,1441443537577410563,"Heading back to school can be stressful, especially in the wake of severe hurricanes.
 
If you or someone you love needs help, the free Crisis Text Line is standing by. Just text SCHOOL to 741741. https://t.co/SnXx0rSyjS",2021-09-24 16:44:54+00:00,False,9,19,36,0,en,False,Twitter Web App,197,220,https://t.co/SnXx0rSyjS,https://www.crisistextline.org/school-mental-health/,NA,NA,NA,NA,NA,NA,NA,NA
SenJohnKennedy,816683274076614656,1441079425668468743,"Making insulin and epinephrine more affordable for Louisianians helps keep our state healthier and lower our long-term health care costs.

https://t.co/5kmJOqVlFa",2021-09-23 16:38:03+00:00,False,27,27,151,1,en,False,Twitter Web App,139,162,https://t.co/5kmJOqVlFa,https://www.kennedy.senate.gov/public/press-releases?id=3AD9961C-2B2D-4E7A-87BA-4F4FFB5A09E7,NA,NA,NA,NA,NA,NA,NA,NA
SenJohnKennedy,816683274076614656,1441064120455888896,"Louisiana is an outdoorsman’s paradise, so we have to conserve our wetlands. 

I am pleased to see these resources flow into southeast Louisiana and Vermilion Parish.

https://t.co/Da0ottT0eG",2021-09-23 15:37:14+00:00,False,16,19,108,2,en,False,Twitter for iPhone,168,191,https://t.co/Da0ottT0eG,https://www.kennedy.senate.gov/public/press-releases?id=A6436B7B-0622-44B6-A0AE-9A556A322148,NA,NA,NA,NA,NA,NA,NA,NA
SenJohnKennedy,816683274076614656,1440883481089826816,"All Pres. Biden has to do to fix the #BorderCrisis is go back to what we were doing in December: the remain in Mexico program, the safe third country agreements, the border wall, and deportation. 

It worked then, and it will work now. https://t.co/Kx4CczBGfh",2021-09-23 03:39:26+00:00,False,141,75,589,10,en,False,Twitter Media Studio,236,259,https://t.co/Kx4CczBGfh,https://twitter.com/SenJohnKennedy/status/1440883481089826816/video/1,NA,NA,NA,NA,NA,NA,NA,NA
SenJohnKennedy,816683274076614656,1440789723291684866,"Our people are desperate, and we have to help them. It’s that simple. 

I’m thankful that Sens. Shelby and Collins took the time today to talk with Gov. Edwards and me about getting disaster relief to Louisiana. https://t.co/H1cYq7Azwm",2021-09-22 21:26:53+00:00,False,43,40,281,0,en,False,Twitter Web App,212,235,https://t.co/H1cYq7Azwm,https://twitter.com/SenJohnKennedy/status/1440789723291684866/photo/1,212,235,https://t.co/H1cYq7Azwm,https://twitter.com/SenJohnKennedy/status/1440789723291684866/photo/1,NA,NA,NA,NA
SenJohnKennedy,816683274076614656,1440757412584062982,"CFPB bureaucrats don’t rely on elected officials in Congress for funding. That means the bureau isn’t accountable to American taxpayers in key ways. 

This needs to change.

https://t.co/KGyuDTts6G",2021-09-22 19:18:29+00:00,False,15,18,70,1,en,False,Twitter Web App,174,197,https://t.co/KGyuDTts6G,https://www.kennedy.senate.gov/public/press-releases?id=2A5ED52D-DC8B-4845-BAA5-55628FDFDA46,NA,NA,NA,NA,NA,NA,NA,NA
SenJohnKennedy,816683274076614656,1440728357147082767,"Risk Rating 2.0 is expected to raise flood insurance rates for 80% of policyholders.

We’re again urging @fema not to hike rates in the middle of hurricane season—when Louisianians can least afford to lose their flood insurance.
https://t.co/61x8Oe8kVq",2021-09-22 17:23:02+00:00,False,22,19,88,3,en,False,Twitter Web App,229,252,https://t.co/61x8Oe8kVq,https://www.kennedy.senate.gov/public/press-releases?id=37336E53-BF10-42F4-B9F1-252ABE1B178E,NA,NA,NA,NA,NA,NA,NA,NA
SenJohnKennedy,816683274076614656,1440434048216625157,There's still time to RSVP for this weekend's virtual Service Academy day! https://t.co/ziMLfF1fD0,2021-09-21 21:53:33+00:00,False,5,11,32,0,en,False,Twitter Web App,75,98,https://t.co/ziMLfF1fD0,https://twitter.com/SenJohnKennedy/status/1437499350893137923,NA,NA,NA,NA,NA,NA,NA,NA
SenJohnKennedy,816683274076614656,1439585076879179783,"Louisianians, the deadline for applying to Operation Blue Roof is Sept 30. Find out more here:

https://t.co/TEOKpTZCtN",2021-09-19 13:40:03+00:00,False,28,23,98,2,en,False,Twitter for iPhone,96,119,https://t.co/TEOKpTZCtN,https://www.mvn.usace.army.mil/Missions/Emergency-Operations/Blue-Roof-Information/,NA,NA,NA,NA,NA,NA,NA,NA
SenJohnKennedy,816683274076614656,1439228982768111621,"Hurricanes just battered and drenched Louisiana, and there are easy steps we can take to stay safe after a major flood event:
https://t.co/Axj2dfzSoP",2021-09-18 14:05:03+00:00,False,19,20,109,1,en,False,Twitter for iPhone,126,149,https://t.co/Axj2dfzSoP,https://www.weather.gov/safety/flood-after,NA,NA,NA,NA,NA,NA,NA,NA
SenJohnKennedy,816683274076614656,1438961911513690112,"In Louisiana, flood insurance isn’t for rich people’s beach houses—it’s for family homes and businesses struggling under historic storms.

I’m fighting FEMA like hell to keep flood insurance rates affordable for Louisianians. https://t.co/ir2JzY5rT8",2021-09-17 20:23:48+00:00,False,72,62,425,1,en,False,Twitter Media Studio,226,249,https://t.co/ir2JzY5rT8,https://twitter.com/SenJohnKennedy/status/1438961911513690112/video/1,NA,NA,NA,NA,NA,NA,NA,NA
SenJohnKennedy,816683274076614656,1438892005665525766,"For more information on disaster assistance, Louisianians can take a look at the Small Business Administration’s Customer Service Center.
https://t.co/af982Tnq0E",2021-09-17 15:46:02+00:00,False,16,16,59,0,en,False,Twitter for iPhone,138,161,https://t.co/af982Tnq0E,http://www.sba.gov/services/disasterassistance,NA,NA,NA,NA,NA,NA,NA,NA
SenJohnKennedy,816683274076614656,1438872904440164354,"This idea that anybody who wants to come into the U.S. can just walk right in is lunacy.

The Biden admin is misreading the American people: We support legal immigration, but understand open borders are dangerous. #BorderCrisis https://t.co/ZXjC0zmulP",2021-09-17 14:30:08+00:00,False,231,138,574,31,en,False,Twitter Media Studio,228,251,https://t.co/ZXjC0zmulP,https://twitter.com/SenJohnKennedy/status/1438872904440164354/video/1,NA,NA,NA,NA,NA,NA,NA,NA
SenJohnKennedy,816683274076614656,1438868192391225349,"On this day in 1787, the Constitution helped America realize the dream of a more perfect union and secure the blessings of liberty for future generations. 

I’ve read the Constitution, and I’m a big fan. #ConstitutionDay https://t.co/SulSUcJg6l",2021-09-17 14:11:24+00:00,False,148,89,550,8,en,False,Twitter Web App,221,244,https://t.co/SulSUcJg6l,https://twitter.com/SenJohnKennedy/status/1438868192391225349/photo/1,NA,NA,NA,NA,NA,NA,NA,NA
SenJohnKennedy,816683274076614656,1438622940174688259,"When #HurricaneIda hit, @ATT’s network—including the First Responder Network—failed. 

Louisianians deserve some answers.

https://t.co/Kyo1lHQjpp",2021-09-16 21:56:51+00:00,False,24,24,102,0,en,False,Twitter Web App,123,146,https://t.co/Kyo1lHQjpp,https://www.kennedy.senate.gov/public/press-releases?ID=80F778DF-BFB1-4C03-A4DF-343F805DE3C9,NA,NA,NA,NA,NA,NA,NA,NA
SenJohnKennedy,816683274076614656,1438598347754033164,Need a hot meal in St. John the Baptist Parish? https://t.co/AmZUsoBRsi,2021-09-16 20:19:08+00:00,False,37,19,126,1,en,False,Twitter for iPhone,48,71,https://t.co/AmZUsoBRsi,https://twitter.com/SenJohnKennedy/status/1438598347754033164/photo/1,NA,NA,NA,NA,NA,NA,NA,NA
SenJohnKennedy,816683274076614656,1438575368794001419,"Looking for water in Terrebonne Parish?
 
You can find water trucks at these locations: https://t.co/QsR95q13ir",2021-09-16 18:47:50+00:00,False,29,7,56,0,en,False,Twitter for iPhone,88,111,https://t.co/QsR95q13ir,https://twitter.com/SenJohnKennedy/status/1438575368794001419/photo/1,NA,NA,NA,NA,NA,NA,NA,NA
SenJohnKennedy,816683274076614656,1438545258938257412,"Are you and your family displaced due to the storms? 

You can find free laundry services in the Rouses parking area at 561 Grand Caillou Road in Houma. https://t.co/nEvrqBX59N",2021-09-16 16:48:11+00:00,False,18,7,55,0,en,False,Twitter for iPhone,153,176,https://t.co/nEvrqBX59N,https://twitter.com/SenJohnKennedy/status/1438545258938257412/photo/1,NA,NA,NA,NA,NA,NA,NA,NA
SenJohnKennedy,816683274076614656,1438538228710137870,Receive Jefferson Parish storm and emergency alerts by texting “JPALERT” or “JPNOTICIAS” to 888-777.,2021-09-16 16:20:15+00:00,False,17,9,58,0,en,False,Twitter for iPhone,NA,NA,NA,NA,NA,NA,NA,NA,NA,NA,NA,NA
SenJohnKennedy,816683274076614656,1438276457629954050,"#Nicholas has already caused widespread flooding. You can check road closures in your area here:

https://t.co/YBXgCYOTli",2021-09-15 23:00:04+00:00,False,12,10,50,0,en,False,Twitter for iPhone,98,121,https://t.co/YBXgCYOTli,https://www.google.com/amp/s/www.brproud.com/news/list-road-closures-due-to-tropical-storm-nicholas/amp/,NA,NA,NA,NA,NA,NA,NA,NA
SenJohnKennedy,816683274076614656,1438267364546596868,"Friends in Livingston Parish, you can check local news to stay up to date on flooding in your area and to avoid unsafe roadways.

https://t.co/HRG6RTRf6z",2021-09-15 22:23:56+00:00,False,20,9,79,0,en,False,Twitter for iPhone,130,153,https://t.co/HRG6RTRf6z,https://www.wafb.com/2021/09/15/list-roads-impacted-by-high-water-livingston-parish/,NA,NA,NA,NA,NA,NA,NA,NA
SenJohnKennedy,816683274076614656,1438148991636680713,Looking for sandbags in Ascension Parish? https://t.co/XcB8TSRyIY,2021-09-15 14:33:33+00:00,False,19,4,49,0,en,False,Twitter for iPhone,42,65,https://t.co/XcB8TSRyIY,https://twitter.com/SenJohnKennedy/status/1438148991636680713/photo/1,NA,NA,NA,NA,NA,NA,NA,NA
SenJohnKennedy,816683274076614656,1438140961683656710,"What’s the end goal of banning books in China? In Cuba? In North Korea? In Iran? To control the way people think.

This isn’t the 7th century. If @Amazon does that on this front, a number of us in Congress would raise fresh hell. https://t.co/l0EOoz8dV9",2021-09-15 14:01:39+00:00,False,145,67,474,17,en,False,Twitter Media Studio,230,253,https://t.co/l0EOoz8dV9,https://twitter.com/SenJohnKennedy/status/1438140961683656710/video/1,NA,NA,NA,NA,NA,NA,NA,NA
SenJohnKennedy,816683274076614656,1438126018687119363,"Louisianians have been hit with all the storms nature has to offer, and we need all the help we can get—including extensions for filing taxes. 

Let’s make sure Louisiana gets the tax relief we need to recover after our state declares a natural disaster.

https://t.co/IP6rIrusi4",2021-09-15 13:02:16+00:00,False,21,17,100,0,en,False,Twitter Web App,256,279,https://t.co/IP6rIrusi4,https://www.kennedy.senate.gov/public/press-releases?id=E150993E-8C76-4400-87C8-354A2C9AA3A2,NA,NA,NA,NA,NA,NA,NA,NA
SenJohnKennedy,816683274076614656,1437855278603677704,"Friends, there’s a lot we can do to stay safe before and during potential floods from #Nicholas. 

Take care out there with these safety tips:
 
https://t.co/FE3FfeyQLq",2021-09-14 19:06:27+00:00,False,9,26,64,0,en,False,Twitter for iPhone,145,168,https://t.co/FE3FfeyQLq,https://www.cdc.gov/nceh/features/flood-safety/index.html,NA,NA,NA,NA,NA,NA,NA,NA
SenJohnKennedy,816683274076614656,1437852477617999892,"Nicholas is already bringing lots of rain to Louisiana. Flooding can make driving dangerous, and this map can help you keep your loved ones safe.

https://t.co/QvZyY0Rgyz",2021-09-14 18:55:19+00:00,False,25,16,91,2,en,False,Twitter for iPhone,147,170,https://t.co/QvZyY0Rgyz,https://www.511la.org/#:News,NA,NA,NA,NA,NA,NA,NA,NA
SenJohnKennedy,816683274076614656,1437823099710361601,Looking for sandbags in Vernon Parish ahead of Nicholas? https://t.co/NAKFzyub36,2021-09-14 16:58:35+00:00,False,23,6,46,0,en,False,Twitter for iPhone,57,80,https://t.co/NAKFzyub36,https://twitter.com/SenJohnKennedy/status/1437823099710361601/photo/1,NA,NA,NA,NA,NA,NA,NA,NA
SenJohnKennedy,816683274076614656,1437821174755508224,Looking for sandbags in Vermilion Parish ahead of Nicholas? https://t.co/8npbku3lYP,2021-09-14 16:50:56+00:00,False,17,5,40,0,en,False,Twitter for iPhone,60,83,https://t.co/8npbku3lYP,https://twitter.com/SenJohnKennedy/status/1437821174755508224/photo/1,NA,NA,NA,NA,NA,NA,NA,NA
SenJohnKennedy,816683274076614656,1437816527034662913,Looking for sandbags in St. Landry Parish ahead of Nicholas? https://t.co/iepGQ5n5gD,2021-09-14 16:32:28+00:00,False,14,6,49,0,en,False,Twitter for iPhone,61,84,https://t.co/iepGQ5n5gD,https://twitter.com/SenJohnKennedy/status/1437816527034662913/photo/1,NA,NA,NA,NA,NA,NA,NA,NA
SenJohnKennedy,816683274076614656,1437806111000866822,Looking for sandbags in Rapides Parish ahead of Nicholas? https://t.co/pr12ZS7MYQ,2021-09-14 15:51:04+00:00,False,21,7,63,1,en,False,Twitter for iPhone,58,81,https://t.co/pr12ZS7MYQ,https://twitter.com/SenJohnKennedy/status/1437806111000866822/photo/1,NA,NA,NA,NA,NA,NA,NA,NA
SenJohnKennedy,816683274076614656,1437567961674526732,Looking for sandbags in Calcasieu Parish ahead of Tropical Storm Nicholas? https://t.co/ENIYfWkVdq,2021-09-14 00:04:45+00:00,False,25,13,63,0,en,False,Twitter for iPhone,75,98,https://t.co/ENIYfWkVdq,https://twitter.com/SenJohnKennedy/status/1437567961674526732/photo/1,NA,NA,NA,NA,NA,NA,NA,NA
SenJohnKennedy,816683274076614656,1437567501668335617,Looking for sandbags in Beauregard Parish ahead of Tropical Storm Nicholas? https://t.co/xd1vcwgUgI,2021-09-14 00:02:55+00:00,False,23,9,47,0,en,False,Twitter for iPhone,76,99,https://t.co/xd1vcwgUgI,https://twitter.com/SenJohnKennedy/status/1437567501668335617/photo/1,NA,NA,NA,NA,NA,NA,NA,NA
SenJohnKennedy,816683274076614656,1437566043107512324,Looking for sandbags in Allen Parish ahead of Tropical Storm Nicholas? https://t.co/Qxdw135utZ,2021-09-13 23:57:08+00:00,False,14,6,43,1,en,False,Twitter for iPhone,71,94,https://t.co/Qxdw135utZ,https://twitter.com/SenJohnKennedy/status/1437566043107512324/photo/1,NA,NA,NA,NA,NA,NA,NA,NA
SenJohnKennedy,816683274076614656,1437563609454891008,Looking for sandbags in Cameron Parish ahead of Tropical Storm Nicholas? https://t.co/i4OZyKg5UJ,2021-09-13 23:47:27+00:00,False,33,9,56,0,en,False,Twitter for iPhone,73,96,https://t.co/i4OZyKg5UJ,https://twitter.com/SenJohnKennedy/status/1437563609454891008/photo/1,NA,NA,NA,NA,NA,NA,NA,NA
SenJohnKennedy,816683274076614656,1437561802330710022,Looking for sandbags in Jefferson Davis Parish ahead of the storm? https://t.co/F43z860jDh,2021-09-13 23:40:16+00:00,False,26,7,72,0,en,False,Twitter for iPhone,67,90,https://t.co/F43z860jDh,https://twitter.com/SenJohnKennedy/status/1437561802330710022/photo/1,67,90,https://t.co/F43z860jDh,https://twitter.com/SenJohnKennedy/status/1437561802330710022/photo/1,NA,NA,NA,NA
SenJohnKennedy,816683274076614656,1437553458157129746,"#HurricaneIda is a powerful reminder of how much Louisianians depend on flood insurance.
 
It’s vital we extend the National Flood Insurance Program by another year as Tropical Storm Nicholas is expected to bring significant flooding.

https://t.co/9TpGwRaUj6",2021-09-13 23:07:07+00:00,False,17,13,60,1,en,False,Twitter Web App,236,259,https://t.co/9TpGwRaUj6,https://www.kennedy.senate.gov/public/press-releases?id=D95804A2-F867-4089-B502-078577E021DF,NA,NA,NA,NA,NA,NA,NA,NA
SenJohnKennedy,816683274076614656,1437543042895040513,"Tropical Storm Nicholas could cause flash flooding around Louisiana. 

These tips can help Louisianians stay safe:
 
https://t.co/rObqfA57fY",2021-09-13 22:25:44+00:00,False,21,16,75,2,en,False,Twitter for iPhone,117,140,https://t.co/rObqfA57fY,https://www.ready.gov/floods?web=1&wdLOR=c518F3A83-C7AA-D94B-8F7E-AF697686A0A8,NA,NA,NA,NA,NA,NA,NA,NA
SenJohnKennedy,816683274076614656,1437499350893137923,"If you’re interested in learning more about attending a U.S. Service Academy, please RSVP to get your questions answered with us. https://t.co/m6D6o4Sfmn",2021-09-13 19:32:07+00:00,False,26,11,66,1,en,False,Twitter for iPhone,130,153,https://t.co/m6D6o4Sfmn,https://twitter.com/SenJohnKennedy/status/1437499350893137923/photo/1,NA,NA,NA,NA,NA,NA,NA,NA
SenJohnKennedy,816683274076614656,1436799215871668229,"As we clean up after Hurricane #Ida, mold is yet another enemy we have to battle.

Here are ways to keep your homes safe: https://t.co/aErHm9XX9E",2021-09-11 21:10:02+00:00,False,14,14,87,0,en,False,Twitter for iPhone,122,145,https://t.co/aErHm9XX9E,https://www.wafb.com/2021/09/09/mold-concerns-after-hurricane-ida/,NA,NA,NA,NA,NA,NA,NA,NA
SenJohnKennedy,816683274076614656,1436717700387155969,"As Louisiana begins to rebuild,  it’s sad that we have to be aware of construction scams.

Here are some tips for protecting you and your family:

https://t.co/se7dVAGiSe",2021-09-11 15:46:07+00:00,False,26,10,102,1,en,False,Twitter for iPhone,147,170,https://t.co/se7dVAGiSe,https://www.wwltv.com/mobile/article/weather/hurricane/tips-to-avoid-construction-scams-or-fraud/289-f421ebaa-870b-422e-8e6c-c52b92d09b99,NA,NA,NA,NA,NA,NA,NA,NA
SenJohnKennedy,816683274076614656,1436678161081774080,"America remembers. We remember the thousands who died and the American heroes who stood together against evil on September 11, 2001. 

We will #NeverForget. Not ever. https://t.co/RScmgAktgF",2021-09-11 13:09:00+00:00,False,85,38,532,0,en,False,Twitter for iPhone,167,190,https://t.co/RScmgAktgF,https://twitter.com/SenJohnKennedy/status/1436678161081774080/photo/1,NA,NA,NA,NA,NA,NA,NA,NA
SenJohnKennedy,816683274076614656,1436476322671431701,"Proud of the hospitality my people are showing to the men and women who are helping Louisianians recover from Hurricane #Ida.

https://t.co/OIYUpau0hh",2021-09-10 23:46:58+00:00,False,33,21,276,4,en,False,Twitter for iPhone,127,150,https://t.co/OIYUpau0hh,https://www.wafb.com/2021/09/08/communities-are-giving-back-workers-who-are-helping-with-ida-recovery-process/,NA,NA,NA,NA,NA,NA,NA,NA
SenJohnKennedy,816683274076614656,1436431017359908882,"If you are looking for food in the greater Baton Rouge area, here is a helpful list of food bank locations:

https://t.co/b6u1nxIG7Q",2021-09-10 20:46:56+00:00,False,32,8,86,1,en,False,Twitter for iPhone,109,132,https://t.co/b6u1nxIG7Q,https://www.wafb.com/2021/09/10/full-list-greater-baton-rouge-food-bank-giveaways/,NA,NA,NA,NA,NA,NA,NA,NA
SenJohnKennedy,816683274076614656,1436418087788498946,"I believe the vaccine works and have taken it myself, but I also believe in freedom and civil rights, more importantly. All the Biden vaccine mandate does is politicize the issue and sow even more distrust towards the federal government. Freedom should always win out.",2021-09-10 19:55:34+00:00,False,1017,666,5929,91,en,False,Twitter for iPhone,NA,NA,NA,NA,NA,NA,NA,NA,NA,NA,NA,NA
SenJohnKennedy,816683274076614656,1436391397477715985,I joined KPEL this morning to talk Hurricane #Ida recovery and made one thing very clear: I will fight like a hound out of hell to get the aid Louisianians need to get back on their feet. https://t.co/8oXOXUasfA,2021-09-10 18:09:30+00:00,False,29,35,164,4,en,False,Twitter Media Studio,188,211,https://t.co/8oXOXUasfA,https://twitter.com/SenJohnKennedy/status/1436391397477715985/video/1,NA,NA,NA,NA,NA,NA,NA,NA
SenJohnKennedy,816683274076614656,1436066611392299009,"If you’re in Terrebonne Parish looking for information on recovery efforts, food, water, supplies, and open stores, this list of resources is for you:

https://t.co/SqoZzoGVmh",2021-09-09 20:38:55+00:00,False,14,14,41,1,en,False,Twitter Web App,152,175,https://t.co/SqoZzoGVmh,https://www.wwltv.com/article/news/local/lafourche-terrebonne/terrebone-parish-hurricane-ida-power-water-roads-more/289-42eb527f-00b6-46a2-8825-2886a0f68f41,NA,NA,NA,NA,NA,NA,NA,NA
SenJohnKennedy,816683274076614656,1436037152459132929,"“There’s no way I could define an assault weapon” the Biden admin’s nominee to lead the ATF told me.

Americans and their liberties will be safer without this anti-gun zealot taking the helm at ATF. https://t.co/EtP3ppkhgE",2021-09-09 18:41:52+00:00,False,147,113,693,10,en,False,Twitter Media Studio,199,222,https://t.co/EtP3ppkhgE,https://twitter.com/SenJohnKennedy/status/1436037152459132929/video/1,NA,NA,NA,NA,NA,NA,NA,NA
SenJohnKennedy,816683274076614656,1436002913420292096,"If you need assistance with clean-up from Hurricane #Ida in Assumption Parish, this is for you:

https://t.co/jSl0IDwOQs",2021-09-09 16:25:48+00:00,False,18,2,48,0,en,False,Twitter Web App,97,120,https://t.co/jSl0IDwOQs,https://www.wbrz.com/news/clean-up-hotline-now-available-for-storm-victims-in-assumption-parish,NA,NA,NA,NA,NA,NA,NA,NA
SenJohnKennedy,816683274076614656,1435918718824030211,"The IRS has extended certain tax deadlines for Hurricane #Ida victims. Find out what this relief means for you here:

https://t.co/X7bADdeeNy",2021-09-09 10:51:15+00:00,False,22,9,63,1,en,False,Twitter for iPhone,118,141,https://t.co/X7bADdeeNy,https://www.irs.gov/newsroom/irs-announces-tax-relief-for-victims-of-hurricane-ida-in-louisiana,NA,NA,NA,NA,NA,NA,NA,NA
SenJohnKennedy,816683274076614656,1435748140754341888,"Looking for gas in Louisiana? Fill up your tank at one of these locations:
 
https://t.co/47oeKpVYs7",2021-09-08 23:33:26+00:00,False,31,13,74,0,en,False,Twitter for iPhone,77,100,https://t.co/47oeKpVYs7,https://www.wdsu.com/article/list-where-to-get-gas-wednesday/37511810,NA,NA,NA,NA,NA,NA,NA,NA
SenJohnKennedy,816683274076614656,1435717716862717964,"If you are looking for a warm meal, water, or supplies, this list may help you find a distribution site.
 
https://t.co/lKI6EHET7o",2021-09-08 21:32:32+00:00,False,27,4,101,1,en,False,Twitter for iPhone,107,130,https://t.co/lKI6EHET7o,https://wgno.com/hurricane-ida/list-free-meals-and-supplies-available-this-week/,NA,NA,NA,NA,NA,NA,NA,NA
SenJohnKennedy,816683274076614656,1435686729936261121,"If you and your family are using a generator, play it safe and stop by one of these New Orleans locations for a free carbon monoxide detector.
 
https://t.co/jABNpYCGcr",2021-09-08 19:29:24+00:00,False,31,14,103,1,en,False,Twitter for iPhone,145,168,https://t.co/jABNpYCGcr,https://www.wdsu.com/article/free-carbon-monoxide-detectors-available-at-new-orleans-cooling-stations/37511637#,NA,NA,NA,NA,NA,NA,NA,NA
SenJohnKennedy,816683274076614656,1435553098806829059,"Hurricane #Ida hit our people hard, and I’m thankful to get to hear their stories face to face.

https://t.co/OvQOb68a5x",2021-09-08 10:38:24+00:00,False,21,23,188,3,en,False,Twitter Web App,97,120,https://t.co/OvQOb68a5x,https://www.houmatimes.com/news/senator-kennedy-travels-to-terrebonne-and-lafourche-to-deliver-supplies-speak-with-locals/,NA,NA,NA,NA,NA,NA,NA,NA
