ScreenName,AuthorID,TweetID,Text,TweetDate,isReply,RetweetCount,ReplyCount,LikeCount,QuoteCount,Language,PossibleSensitive,Source,1stURLStart,1stURLEnd,1stURL,1stURLExp,2ndURLStart,2ndURLEnd,2ndURL,2ndURLExp,3rdURLStart,3rdURLEnd,3rdURL,3rdURLExp
SenJohnKennedy,816683274076614656,1435332293539860480,"Churches across the state are serving their neighbors after Hurricane #Ida. It was an honor to spend time today with faithful Louisianians in Houma and Thibodaux who are stepping up to deliver food, water, and aid to Bayou residents in real time. https://t.co/8arSNBASUd",2021-09-07 20:01:00+00:00,False,39,27,340,2,en,False,Twitter Web App,247,270,https://t.co/8arSNBASUd,https://twitter.com/SenJohnKennedy/status/1435332293539860480/photo/1,247,270,https://t.co/8arSNBASUd,https://twitter.com/SenJohnKennedy/status/1435332293539860480/photo/1,247,270,https://t.co/8arSNBASUd,https://twitter.com/SenJohnKennedy/status/1435332293539860480/photo/1
SenJohnKennedy,816683274076614656,1435285244605837323,"This morning, we took supplies to Hurricane #Ida victims in Houma and heard from brave Louisianians there. Thankful to meet with volunteers and local leaders in Terrebonne Parish as we work to meet needs after the storm. https://t.co/7O4B27Wuhb",2021-09-07 16:54:03+00:00,False,36,15,277,1,en,False,Twitter for iPhone,221,244,https://t.co/7O4B27Wuhb,https://twitter.com/SenJohnKennedy/status/1435285244605837323/photo/1,221,244,https://t.co/7O4B27Wuhb,https://twitter.com/SenJohnKennedy/status/1435285244605837323/photo/1,221,244,https://t.co/7O4B27Wuhb,https://twitter.com/SenJohnKennedy/status/1435285244605837323/photo/1
SenJohnKennedy,816683274076614656,1435247250695991297,Need gas? Check out the following location for a free fuel giveaway: https://t.co/dsGWtEQiwm,2021-09-07 14:23:04+00:00,False,31,13,117,4,en,False,Twitter Web App,69,92,https://t.co/dsGWtEQiwm,https://twitter.com/SenJohnKennedy/status/1435247250695991297/photo/1,NA,NA,NA,NA,NA,NA,NA,NA
SenJohnKennedy,816683274076614656,1435016201693016064,"As Louisiana picks up the pieces from Hurricane #Ida, these tips will help you make the most of debris removal efforts:

https://t.co/lZUcG6PaLt",2021-09-06 23:04:58+00:00,False,20,17,110,4,en,False,Twitter for iPhone,121,144,https://t.co/lZUcG6PaLt,https://www.katc.com/news/covering-louisiana/dotd-debris-pickup-for-areas-affected-by-ida-begins,NA,NA,NA,NA,NA,NA,NA,NA
SenJohnKennedy,816683274076614656,1434968778748710915,"Hurricane #Ida has strengthened Louisianians’ resolve to meet each other’s needs as we begin to recover together.

https://t.co/41mzw2VZSX",2021-09-06 19:56:31+00:00,False,31,18,170,1,en,False,Twitter for iPhone,115,138,https://t.co/41mzw2VZSX,https://www.wafb.com/2021/09/05/lsu-mens-basketball-partners-with-united-cajun-navy-provide-supplies-ida-victims/,NA,NA,NA,NA,NA,NA,NA,NA
SenJohnKennedy,816683274076614656,1434926745090723844,"Have you and your family applied for Operation Blue Roof? Check to see if you live in an eligible parish:

https://t.co/IXgvz4pEao",2021-09-06 17:09:30+00:00,False,32,9,70,0,en,False,Twitter for iPhone,107,130,https://t.co/IXgvz4pEao,https://www.wafb.com/2021/09/04/how-sign-up-operation-blue-roof-list-eligible-parishes/,NA,NA,NA,NA,NA,NA,NA,NA
SenJohnKennedy,816683274076614656,1434883516173627399,"Hurricane Ida hit our state hard, but it didn’t hurt Louisianians’ compassion and willingness to help each other in hard times. 

https://t.co/1tTycSE4da",2021-09-06 14:17:43+00:00,False,33,10,227,2,en,False,Twitter Web App,130,153,https://t.co/1tTycSE4da,https://www.wwltv.com/article/news/local/jefferson/cut-off-by-a-broken-bridge-barataria-neighbors-taking-care-of-their-own-after-ida/289-bed9e139-3004-4a19-ab9b-11dbad841b48,NA,NA,NA,NA,NA,NA,NA,NA
SenJohnKennedy,816683274076614656,1434655491330818052,"Looking for gas in Terrebonne or Lafourche Parishes? Fill up your tank for free at these locations:

https://t.co/iW4OTYD88y",2021-09-05 23:11:38+00:00,False,64,25,190,1,en,False,Twitter for iPhone,101,124,https://t.co/iW4OTYD88y,https://www.houmatimes.com/news/free-gas-available-to-be-residents-at-these-terrebonne-parish-locations-next-week/,NA,NA,NA,NA,NA,NA,NA,NA
SenJohnKennedy,816683274076614656,1434611383707049985,"If you are feeling overwhelmed because of Hurricane Ida, please call or text 1-800-985-5990 to speak with someone who can help.",2021-09-05 20:16:22+00:00,False,85,30,272,5,en,False,Twitter for iPhone,NA,NA,NA,NA,NA,NA,NA,NA,NA,NA,NA,NA
SenJohnKennedy,816683274076614656,1434564112705626112,"As you get back out on Louisiana roads, please be cautious and look out for debris and operational traffic signals. For a list of updated road closures visit:

https://t.co/X6YbKyv6Rv",2021-09-05 17:08:32+00:00,False,21,16,139,0,en,False,Twitter for iPhone,160,183,https://t.co/X6YbKyv6Rv,https://511la.org,NA,NA,NA,NA,NA,NA,NA,NA
SenJohnKennedy,816683274076614656,1434509079922323461,Operation Blue roof is underway. This program is a free service to Louisiana homeowners who need roof reinforcement until permanent repairs are made. Learn more and apply here: https://t.co/TEOKpTZCtN,2021-09-05 13:29:51+00:00,False,66,20,237,2,en,False,Twitter Web App,177,200,https://t.co/TEOKpTZCtN,https://www.mvn.usace.army.mil/Missions/Emergency-Operations/Blue-Roof-Information/,NA,NA,NA,NA,NA,NA,NA,NA
SenJohnKennedy,816683274076614656,1434248059333058568,"If you’re searching for gas in Louisiana, here’s a helpful list of all the places where you can fill up your tank:

https://t.co/ZUcbYAFaC3",2021-09-04 20:12:39+00:00,False,76,27,185,3,en,False,Twitter for iPhone,116,139,https://t.co/ZUcbYAFaC3,https://www.wdsu.com/article/list-where-to-get-gas-friday/37472125,NA,NA,NA,NA,NA,NA,NA,NA
SenJohnKennedy,816683274076614656,1434209500559519752,"Friends, another reminder that if you are using a generator, you should follow these helpful safety tips:
https://t.co/wsokDR6FMa",2021-09-04 17:39:25+00:00,False,35,20,119,3,en,False,Twitter Web App,106,129,https://t.co/wsokDR6FMa,https://www.popularmechanics.com/adventure/reviews/a11855/home-generator-101-how-to-power-on-when-the-power-goes-out/,NA,NA,NA,NA,NA,NA,NA,NA
SenJohnKennedy,816683274076614656,1434182782033571845,"Yesterday, we welcomed the president to Louisiana to see the devastation across our state. I made it clear in no uncertain terms we need relief funding for our people and we need it fast. Click below to see my comments after my talk with the president. 
https://t.co/CeQaa3K74u",2021-09-04 15:53:15+00:00,False,41,69,250,14,en,False,Twitter Web App,254,277,https://t.co/CeQaa3K74u,https://www.wdsu.com/article/president-biden-new-orleans-ida/37468267,NA,NA,NA,NA,NA,NA,NA,NA
SenJohnKennedy,816683274076614656,1434156039566471174,"In case you missed it, here are some resources to help guide Louisianians recovering from Hurricane Ida. Please share with family, friends, and neighbors as we work together to rebuild our communities. https://t.co/PS77t0msBg",2021-09-04 14:06:59+00:00,False,68,16,168,3,en,False,Twitter Web App,202,225,https://t.co/PS77t0msBg,https://www.kennedy.senate.gov/public/index.cfm?p=hurricane-ida-information-resources,NA,NA,NA,NA,NA,NA,NA,NA
SenJohnKennedy,816683274076614656,1433928824333422592,"If you are in the New Orleans area, don’t forget you can submit service requests by calling 3-1-1 or 504-539-3266 or by visiting https://t.co/xsd82sPWym",2021-09-03 23:04:07+00:00,False,35,11,85,1,en,False,Twitter Web App,129,152,https://t.co/xsd82sPWym,https://nola311.org/,NA,NA,NA,NA,NA,NA,NA,NA
SenJohnKennedy,816683274076614656,1433907560852168704,"If you need food or water in St. Tammany Parish, the following distribution sites are open today: https://t.co/a8Y6FWCwKS",2021-09-03 21:39:37+00:00,False,48,13,104,1,en,False,Twitter Web App,98,121,https://t.co/a8Y6FWCwKS,https://twitter.com/SenJohnKennedy/status/1433907560852168704/photo/1,NA,NA,NA,NA,NA,NA,NA,NA
SenJohnKennedy,816683274076614656,1433887422778064898,"As a reminder, if you are in search of a shelter near you, text LASHELTER to 898-211 or call 211 to find sheltering information.",2021-09-03 20:19:36+00:00,False,51,4,125,0,en,False,Twitter Web App,NA,NA,NA,NA,NA,NA,NA,NA,NA,NA,NA,NA
SenJohnKennedy,816683274076614656,1433843270522707995,"Hurricane Ida hit Louisiana hard, but we are a resilient people. We can get through anything together. https://t.co/IeZbvDiyS9",2021-09-03 17:24:09+00:00,False,27,31,221,6,en,False,Twitter Web App,103,126,https://t.co/IeZbvDiyS9,https://twitter.com/SenJohnKennedy/status/1433843270522707995/photo/1,NA,NA,NA,NA,NA,NA,NA,NA
SenJohnKennedy,816683274076614656,1433799561525477376,"Friends, if you live in a parish under the disaster declaration, register early for FEMA disaster assistance here: https://t.co/cFGeS1H8ul",2021-09-03 14:30:28+00:00,False,31,14,90,0,en,False,Twitter Web App,115,138,https://t.co/cFGeS1H8ul,https://www.disasterassistance.gov/,NA,NA,NA,NA,NA,NA,NA,NA
SenJohnKennedy,816683274076614656,1433584792734507013,"Looking for charging stations, water, or a place to cool off? Here is a helpful calendar to find resources near you: https://t.co/lP1DhkB1G3",2021-09-03 00:17:03+00:00,False,40,27,132,2,en,False,Twitter for iPhone,117,140,https://t.co/lP1DhkB1G3,https://www.trumba.com/calendars/HurricaneIda,NA,NA,NA,NA,NA,NA,NA,NA
SenJohnKennedy,816683274076614656,1433553857024598016,"I went on a helicopter tour to see the damage that Hurricane Ida caused to our state. It’s bad, but it’s nothing that Louisianians can’t get through together. We will keep fighting to rebuild and recover. https://t.co/tB09iNvNiA",2021-09-02 22:14:08+00:00,False,68,61,424,4,en,False,Twitter Web App,205,228,https://t.co/tB09iNvNiA,https://twitter.com/SenJohnKennedy/status/1433553857024598016/photo/1,205,228,https://t.co/tB09iNvNiA,https://twitter.com/SenJohnKennedy/status/1433553857024598016/photo/1,205,228,https://t.co/tB09iNvNiA,https://twitter.com/SenJohnKennedy/status/1433553857024598016/photo/1
SenJohnKennedy,816683274076614656,1433523853217652740,"If you are looking for supplies in Terrebonne Parish, the following distribution sites are open: https://t.co/0j2J2HKRCq",2021-09-02 20:14:54+00:00,False,39,6,74,1,en,False,Twitter Web App,97,120,https://t.co/0j2J2HKRCq,https://twitter.com/SenJohnKennedy/status/1433523853217652740/photo/1,NA,NA,NA,NA,NA,NA,NA,NA
SenJohnKennedy,816683274076614656,1433503422318268426,"Hurricane Ida is the latest in a long line of destructive storms that battered our state. Louisiana families will continue to suffer if we don’t get emergency funds for recovery. 

https://t.co/QPcAhxZkDc",2021-09-02 18:53:43+00:00,False,13,33,91,3,en,False,Twitter Web App,181,204,https://t.co/QPcAhxZkDc,https://www.kennedy.senate.gov/public/press-releases?id=A3F04D40-63FA-46E0-B2AE-2659C77A1E67,NA,NA,NA,NA,NA,NA,NA,NA
SenJohnKennedy,816683274076614656,1433464327676309506,"Linemen are not just technicians—they are first responders. And their work can be as dangerous as it is important.
 
I am thankful for their service to Louisiana as we recover from Hurricane Ida.",2021-09-02 16:18:22+00:00,False,75,32,663,3,en,False,Twitter for iPhone,NA,NA,NA,NA,NA,NA,NA,NA,NA,NA,NA,NA
SenJohnKennedy,816683274076614656,1433430503810474016,"Louisianians took Hurricane Ida full in the face, but we will be back. 

My people are tough as a boot. https://t.co/RArCXbe52z",2021-09-02 14:03:58+00:00,False,41,47,298,3,en,False,Twitter Media Studio,104,127,https://t.co/RArCXbe52z,https://twitter.com/SenJohnKennedy/status/1433430503810474016/video/1,NA,NA,NA,NA,NA,NA,NA,NA
SenJohnKennedy,816683274076614656,1433217919324991490,"When the going gets tough, Louisianians do what they do best—band together.
 
Proud of these folks in Ponchatoula for locking arms through the aftermath of Hurricane Ida.

https://t.co/R25DDmTggh",2021-09-01 23:59:14+00:00,False,31,21,184,0,en,False,Twitter Web App,172,195,https://t.co/R25DDmTggh,https://www.theadvertiser.com/story/news/2021/08/31/neighbors-helping-neighbors-ponchatoula-confronts-aftermath-hurricane-ida/5658229001/?amp_gsa=1&amp_js_v=a6&usqp=mq331AQKKAFQArABIIACAw==?itm_medium=recirc&itm_source=taboola&itm_campaign=internal&itm_content=SectionFrontFeed-FeedRedesign,NA,NA,NA,NA,NA,NA,NA,NA
SenJohnKennedy,816683274076614656,1433188465760428038,"I have rounded up some resources to help guide Louisianians recovering from Hurricane Ida. 

Please share with family, friends, and neighbors as we work together to rebuild our communities. 

https://t.co/PS77t0msBg",2021-09-01 22:02:12+00:00,False,70,18,184,0,en,False,Twitter Web App,192,215,https://t.co/PS77t0msBg,https://www.kennedy.senate.gov/public/index.cfm?p=hurricane-ida-information-resources,NA,NA,NA,NA,NA,NA,NA,NA
SenJohnKennedy,816683274076614656,1433151609740173313,Recharging stations are open in Baton Rouge at the following locations. Wifi and a limited supply of food and water are also available. https://t.co/fZGe62LA4w,2021-09-01 19:35:45+00:00,False,32,10,111,1,en,False,Twitter for iPhone,136,159,https://t.co/fZGe62LA4w,https://twitter.com/SenJohnKennedy/status/1433151609740173313/photo/1,NA,NA,NA,NA,NA,NA,NA,NA
SenJohnKennedy,816683274076614656,1433134901776338946,"As roads open back up, please be cautious as several traffic signals are still not operating. 

Let’s keep our communities and recovery crews safe.

https://t.co/ROcHnc8W2V",2021-09-01 18:29:21+00:00,False,12,8,58,3,en,False,Twitter for iPhone,149,172,https://t.co/ROcHnc8W2V,https://www.wbrz.com/news/navigating-a-four-way-stop,NA,NA,NA,NA,NA,NA,NA,NA
SenJohnKennedy,816683274076614656,1433123243553169416,"If you need food or water in St. Tammany Parish, the following distribution sites are open today: https://t.co/TTqHcKQGps",2021-09-01 17:43:02+00:00,False,51,5,104,1,en,False,Twitter for iPhone,98,121,https://t.co/TTqHcKQGps,https://twitter.com/SenJohnKennedy/status/1433123243553169416/photo/1,NA,NA,NA,NA,NA,NA,NA,NA
SenJohnKennedy,816683274076614656,1433110898776940551,"If you need food or water in St. John the Baptist Parish, the following distribution sites are open today from 12 pm - 5 pm: https://t.co/wh3l41E4vY",2021-09-01 16:53:58+00:00,False,36,9,94,2,en,False,Twitter for iPhone,125,148,https://t.co/wh3l41E4vY,https://twitter.com/SenJohnKennedy/status/1433110898776940551/photo/1,NA,NA,NA,NA,NA,NA,NA,NA
SenJohnKennedy,816683274076614656,1433100918812291080,The following locations in New Orleans will be giving away ice and water today at 1 pm: https://t.co/IYAkCLW7Ow,2021-09-01 16:14:19+00:00,False,48,8,125,2,en,False,Twitter for iPhone,88,111,https://t.co/IYAkCLW7Ow,https://twitter.com/SenJohnKennedy/status/1433100918812291080/photo/1,NA,NA,NA,NA,NA,NA,NA,NA
SenJohnKennedy,816683274076614656,1433082899167916040,"If you need food or water in St. James Parish, the following distribution sites are open daily from 8 am - 5 pm: https://t.co/30XDpW609t",2021-09-01 15:02:43+00:00,False,55,7,112,3,en,False,Twitter for iPhone,113,136,https://t.co/30XDpW609t,https://twitter.com/SenJohnKennedy/status/1433082899167916040/photo/1,NA,NA,NA,NA,NA,NA,NA,NA
SenJohnKennedy,816683274076614656,1432850264676052993,"Seeing the hurricane’s destruction today was tough. We know the road to recovery will be hard, but I’ll do everything I can to help you through it. https://t.co/iGW9cskeTK",2021-08-31 23:38:18+00:00,False,85,74,869,7,en,False,Twitter Web App,148,171,https://t.co/iGW9cskeTK,https://twitter.com/SenJohnKennedy/status/1432850264676052993/photo/1,NA,NA,NA,NA,NA,NA,NA,NA
SenJohnKennedy,816683274076614656,1432738489766977538,"The damage from Hurricane Ida was terrible, but Louisianians are tough and I know that we will make it through this as we have before. https://t.co/obyt6iziRH",2021-08-31 16:14:09+00:00,False,33,46,254,3,en,False,Twitter Media Studio,135,158,https://t.co/obyt6iziRH,https://twitter.com/SenJohnKennedy/status/1432738489766977538/video/1,NA,NA,NA,NA,NA,NA,NA,NA
SenJohnKennedy,816683274076614656,1432722662313365506,"If you live in Baker and your power is out, you can find bags of ice here until 11:00 AM: https://t.co/Hqe8ZrmA9w",2021-08-31 15:11:16+00:00,False,19,6,67,1,en,False,Twitter Web App,90,113,https://t.co/Hqe8ZrmA9w,https://twitter.com/SenJohnKennedy/status/1432722662313365506/photo/1,NA,NA,NA,NA,NA,NA,NA,NA
SenJohnKennedy,816683274076614656,1432709281116270607,"If you urgently need supplies, several point of distribution sites have opened today where you can find food, water, ice, and tarps. These sites are located at the following locations: https://t.co/WKhyGemiba",2021-08-31 14:18:05+00:00,False,48,9,109,0,en,False,Twitter Web App,185,208,https://t.co/WKhyGemiba,https://twitter.com/SenJohnKennedy/status/1432709281116270607/photo/1,NA,NA,NA,NA,NA,NA,NA,NA
SenJohnKennedy,816683274076614656,1432521121774067714,"Mother Nature hits our state hard, but Louisianians always get back up. It’s comforting to see neighbors help each other in such hard times. 

https://t.co/cjf8zO2cmy",2021-08-31 01:50:25+00:00,False,35,32,229,2,en,False,Twitter Web App,143,166,https://t.co/cjf8zO2cmy,https://www.ksla.com/2021/08/30/ascension-parish-neighbors-help-clean-up-after-hurricane-ida/,NA,NA,NA,NA,NA,NA,NA,NA
SenJohnKennedy,816683274076614656,1432493220278198277,"Friends, please keep Baton Rouge and all of Louisiana in your prayers this night. 

https://t.co/1I1RSou5Eq",2021-08-30 23:59:32+00:00,False,36,14,270,3,en,False,Twitter Web App,84,107,https://t.co/1I1RSou5Eq,https://www.wbrz.com/news/photos-ida-s-aftermath-in-baton-rouge-and-surrounding-areas/,NA,NA,NA,NA,NA,NA,NA,NA
