ScreenName,AuthorID,TweetID,Text,TweetDate,isReply,RetweetCount,ReplyCount,LikeCount,QuoteCount,Language,PossibleSensitive,Source,1stURLStart,1stURLEnd,1stURL,1stURLExp,2ndURLStart,2ndURLEnd,2ndURL,2ndURLExp,3rdURLStart,3rdURLEnd,3rdURL,3rdURLExp
ChuckGrassley,10615232,1467251257798807554,UNI over SDSt 59:50,2021-12-04 21:55:34+00:00,False,17,37,62,6,und,False,Twitter for iPhone,NA,NA,NA,NA,NA,NA,NA,NA,NA,NA,NA,NA
ChuckGrassley,10615232,1467243301862576139,3qtr SDSt 41/38 over UNI,2021-12-04 21:23:57+00:00,False,12,37,78,5,da,False,Twitter for iPhone,NA,NA,NA,NA,NA,NA,NA,NA,NA,NA,NA,NA
ChuckGrassley,10615232,1467233225923825664,Sorry didn’t send.  Now half scored SDST30/24 UNI,2021-12-04 20:43:55+00:00,False,14,46,142,5,en,False,Twitter for iPhone,NA,NA,NA,NA,NA,NA,NA,NA,NA,NA,NA,NA
ChuckGrassley,10615232,1467232630361972743,UNI women 13/11 over SoDKSt first qtr,2021-12-04 20:41:33+00:00,False,6,20,55,2,en,False,Twitter for iPhone,NA,NA,NA,NA,NA,NA,NA,NA,NA,NA,NA,NA
ChuckGrassley,10615232,1467194932133777412,Welcome 2 Pres Biden’s America where inflation is at a 31 yr high &amp; is a danger to the economy/ household budgets It’s a hidden tax that hurts lower-income Americans the hardest like a 6cent sales tax on every purchase,2021-12-04 18:11:45+00:00,False,215,308,817,20,en,False,Twitter for iPhone,NA,NA,NA,NA,NA,NA,NA,NA,NA,NA,NA,NA
ChuckGrassley,10615232,1466860614287044611,Dems claim 2017 tax bill mainly cut taxes for the rich but their “Build Back Better” bill would hv SMALLER tax cuts for middle-income taxpayers &amp; LARGER tax cuts for millionaires than trump tax bill had That’s why they should rename BBB to the BLUE-STATE BILLIONAIRE BAILOUT,2021-12-03 20:03:18+00:00,False,199,277,672,15,en,False,Twitter for iPhone,NA,NA,NA,NA,NA,NA,NA,NA,NA,NA,NA,NA
ChuckGrassley,10615232,1466594949424566275,2night I voted 2 prevent Pres Biden’s heavy handed federal vaccine mandates from taking effect I oppose vaccine mandates We werent successful in stopping but I’ll keep fighting thru legislation I continue 2 advocate eligible Iowans get safe &amp;effective vaccine,2021-12-03 02:27:38+00:00,False,235,544,1714,46,en,False,Twitter for iPhone,NA,NA,NA,NA,NA,NA,NA,NA,NA,NA,NA,NA
ChuckGrassley,10615232,1466518211738886147,Dems 2day tried to pass a bill that wld put huge burdens on law-abiding citizens who try to buy a firearm &amp;criminalize transfers unless govt is involved I blocked that bill It won't address root cause of violence There r better approaches tht don't harm the 2A rights of Americans,2021-12-02 21:22:42+00:00,False,353,805,1331,70,en,False,Twitter for iPhone,NA,NA,NA,NA,NA,NA,NA,NA,NA,NA,NA,NA
ChuckGrassley,10615232,1466495432712933382,No meal is complete w/out ice cream &amp; a side of Barbara inspired apple crisp https://t.co/jFL5hrs8Md,2021-12-02 19:52:11+00:00,False,128,652,2010,109,en,False,Twitter for iPhone,81,104,https://t.co/jFL5hrs8Md,https://twitter.com/ChuckGrassley/status/1466495432712933382/photo/1,NA,NA,NA,NA,NA,NA,NA,NA
ChuckGrassley,10615232,1466462380616003587,Senators are getting a treat 2day for lunch w a good Iowa meal hosted by ME: Pork chop potatoes green beans apple crisp &amp; of course ice cream https://t.co/FjrL9LLz6G,2021-12-02 17:40:51+00:00,False,66,194,1318,40,en,False,Twitter for iPhone,146,169,https://t.co/FjrL9LLz6G,https://twitter.com/ChuckGrassley/status/1466462380616003587/photo/1,NA,NA,NA,NA,NA,NA,NA,NA
ChuckGrassley,10615232,1466451426230640640,Met w Tom &amp; Meghan from the Iowa Catholic Conference https://t.co/JWMarh2nFd,2021-12-02 16:57:20+00:00,False,11,45,147,3,en,False,Twitter for iPhone,57,80,https://t.co/JWMarh2nFd,https://twitter.com/ChuckGrassley/status/1466451426230640640/photo/1,NA,NA,NA,NA,NA,NA,NA,NA
ChuckGrassley,10615232,1466437141370753028,In the partisan tax &amp; spend spree Democrats hv a state &amp; local tax cap increase (SALT) which is a giveaway to the rich in high-tax blue states at the expense of everyone else esp the middle class it’s a BLUE-STATE BILLIONAIRE BAILOUT,2021-12-02 16:00:34+00:00,False,111,150,316,14,en,False,Twitter for iPhone,NA,NA,NA,NA,NA,NA,NA,NA,NA,NA,NA,NA
ChuckGrassley,10615232,1466202427368128512,As I said in speech in Senate 2day China is still Communist &amp; Gen Scty Xi is taking country backwards. US businesses investing in China should beware U could lose your shirt,2021-12-02 00:27:54+00:00,False,126,130,678,18,en,False,Twitter for iPhone,NA,NA,NA,NA,NA,NA,NA,NA,NA,NA,NA,NA
ChuckGrassley,10615232,1466192674311086081,I enjoyed mtg you too Jackson https://t.co/MgdO5tHD2x,2021-12-01 23:49:08+00:00,False,127,101,1823,32,en,False,Twitter for iPhone,30,53,https://t.co/MgdO5tHD2x,https://twitter.com/ChuckGrassley/status/1466192674311086081/photo/1,NA,NA,NA,NA,NA,NA,NA,NA
ChuckGrassley,10615232,1466154391245832198,"Speaker Pelosi &amp; House Dems last yr were on crusade to overturn state-certified results/voice of Iowans in the 2nd cong district Just learned House Dems paid $700,000 of YOUR money 2pricey law firm for that stunt Fortunately public opposition shamed them into abandoning challenge",2021-12-01 21:17:01+00:00,False,322,214,772,29,en,False,Twitter for iPhone,NA,NA,NA,NA,NA,NA,NA,NA,NA,NA,NA,NA
ChuckGrassley,10615232,1466121481511972870,Democrats Build Back Better is more of a Blue-state Billionaire Bailout. Their SALT cap increase doesn’t give a dime to nearly 90% of households while most millionaires would see a tax cut to the tune of tens of thousands of $$$ https://t.co/V8GJ0qKH7X,2021-12-01 19:06:15+00:00,False,221,182,477,24,en,False,Twitter for iPhone,229,252,https://t.co/V8GJ0qKH7X,https://twitter.com/ChuckGrassley/status/1466121481511972870/photo/1,NA,NA,NA,NA,NA,NA,NA,NA
ChuckGrassley,10615232,1466086232040083463,Dem ldrs undermining military sexual assault protections supported by 66 senators is appalling The defense bill must hv these important measures to prevent sexual assault in the military &amp; give justice to survivors This is why we demanded a standalone vote on this bill months ago,2021-12-01 16:46:10+00:00,False,56,68,250,8,en,False,Twitter for iPhone,NA,NA,NA,NA,NA,NA,NA,NA,NA,NA,NA,NA
ChuckGrassley,10615232,1465817243355332617,Someone should let EPA know 2day is statutory deadline for 2022 renewable fuel levels &amp; this EPA has yet to even put out 2021 levels Pres Biden your EPA is breaking the law + turning their back on farmers &amp; rural America by not supporting biofuels,2021-11-30 22:57:19+00:00,False,167,124,558,9,en,False,Twitter for iPhone,NA,NA,NA,NA,NA,NA,NA,NA,NA,NA,NA,NA
ChuckGrassley,10615232,1465805148157001733,Talked trade w the International Dairy Foods Association https://t.co/qcTm5d16AI,2021-11-30 22:09:15+00:00,False,28,96,224,5,en,False,Twitter for iPhone,57,80,https://t.co/qcTm5d16AI,https://twitter.com/ChuckGrassley/status/1465805148157001733/photo/1,NA,NA,NA,NA,NA,NA,NA,NA
ChuckGrassley,10615232,1465772332488798209,I joined Sen Gillibrand in leading 65 colleagues 2demand that Sen Reed &amp;armed services committees don’t take out military sexual assault provisions in defense bill I’m hearing cmte leaders r working behind closed doors to weaken MJIIPA which has 66 bipart cosponsors That’s WRONG,2021-11-30 19:58:51+00:00,False,51,45,221,3,en,False,Twitter for iPhone,NA,NA,NA,NA,NA,NA,NA,NA,NA,NA,NA,NA
ChuckGrassley,10615232,1465722160169861124,Waiving sanctions on Nord Stream 2 pipeline furthered Russian corruption of German politics &amp; upset other European allies I support bipartisan move in Congress to reimpose sanctions,2021-11-30 16:39:29+00:00,False,88,70,343,7,en,False,Twitter for iPhone,NA,NA,NA,NA,NA,NA,NA,NA,NA,NA,NA,NA
ChuckGrassley,10615232,1465692331185782785,Thx to the American Society of Farm Managers &amp; Rural Appraisers for honoring me w their 2021 Carl Hertz Distinguished Service in Agriculture Award https://t.co/skUSRbWJJ3,2021-11-30 14:40:57+00:00,False,53,69,396,5,en,False,Twitter for iPhone,151,174,https://t.co/skUSRbWJJ3,https://twitter.com/ChuckGrassley/status/1465692331185782785/photo/1,NA,NA,NA,NA,NA,NA,NA,NA
ChuckGrassley,10615232,1465476422886117390,New doc I released recently is latest evidence of deep biz ties btwn Hunter Biden &amp; Chinese businessman linked to communist regime+ further supports findings in my report w Sen Johnson from last yr When is media going to wake up to these well documented entanglements???,2021-11-30 00:23:01+00:00,False,1329,677,3516,129,en,False,Twitter for iPhone,NA,NA,NA,NA,NA,NA,NA,NA,NA,NA,NA,NA
ChuckGrassley,10615232,1465436305953894400,Pres Biden waived sanctions on Russian pipeline company bc he said need repair relations w Germany but it’s owned by Russia &amp; German CEO was Stasi buddy w KGB Putin in commie E. Germany Congress shld reimpose sanctions,2021-11-29 21:43:36+00:00,False,133,98,419,13,en,False,Twitter for iPhone,NA,NA,NA,NA,NA,NA,NA,NA,NA,NA,NA,NA
ChuckGrassley,10615232,1465418633744687114,Pres Biden claims his agenda is completely paid for but those claims rest solely on sleights of hand &amp; budget gimmickry His agenda will result in hundreds of billions of $$$ of increased deficit spending in the near term fueling current inflation pressures,2021-11-29 20:33:23+00:00,False,163,267,555,26,en,False,Twitter for iPhone,NA,NA,NA,NA,NA,NA,NA,NA,NA,NA,NA,NA
ChuckGrassley,10615232,1465342277816139777,Zoom Q&amp;A w Lake Mills 8th grade students issues: #99countymeetings / requirements to be a senator/ favorite part of my job / Presidents I’ve worked w / representative govt/ checks &amp; balances in govt / Big Tech / my cattle bill to bring fairness to cattle market etc,2021-11-29 15:29:58+00:00,False,20,58,102,5,en,False,Twitter for iPhone,NA,NA,NA,NA,NA,NA,NA,NA,NA,NA,NA,NA
ChuckGrassley,10615232,1465108698494345217,Happy Hanukkah to all who celebrate the holiday,2021-11-29 00:01:48+00:00,False,90,50,749,12,en,False,Twitter for iPhone,NA,NA,NA,NA,NA,NA,NA,NA,NA,NA,NA,NA
ChuckGrassley,10615232,1464613451230326784,I encourage u to shop local 2day in support of small biz Saturday / Iowa has over 200k small businesses to choose from These biz are lifeblood of our communities providing good paying jobs/goods/services to towns of all sizes,2021-11-27 15:13:52+00:00,False,106,108,727,11,en,False,Twitter for iPhone,NA,NA,NA,NA,NA,NA,NA,NA,NA,NA,NA,NA
ChuckGrassley,10615232,1464273341745975302,Pres Biden should talk with any Iowa farmer about price increases in fertilizer &amp; chemicals &amp; he will find out Inflation = Gut punch to the family farmer its past time 2 rethink tax &amp; spend agenda,2021-11-26 16:42:24+00:00,False,248,410,1249,31,en,False,Twitter for iPhone,NA,NA,NA,NA,NA,NA,NA,NA,NA,NA,NA,NA
ChuckGrassley,10615232,1463914733388578820,Thx to all the farmers who put the feast on our thanksgiving tables We wouldn’t hv it without your hard work 2% of population feeds other 98% We ought to recognize food doesn’t grow in the supermarket I’m thankful for our farmers who keep our world fed,2021-11-25 16:57:25+00:00,False,1399,342,9632,76,en,False,Twitter for iPhone,NA,NA,NA,NA,NA,NA,NA,NA,NA,NA,NA,NA
ChuckGrassley,10615232,1463863980515020806,Happy Thanksgiving 🦃 https://t.co/nSBORExuBw,2021-11-25 13:35:44+00:00,False,87,97,767,20,en,False,Twitter for iPhone,21,44,https://t.co/nSBORExuBw,https://twitter.com/ChuckGrassley/status/1463863980515020806/video/1,NA,NA,NA,NA,NA,NA,NA,NA
ChuckGrassley,10615232,1463677175253671937,From one Chuck to another I’m sorry to hear of the death of Sen Schumer’s father Barbara &amp; I are praying for the Schumer family,2021-11-25 01:13:27+00:00,False,89,70,1224,17,en,False,Twitter for iPhone,NA,NA,NA,NA,NA,NA,NA,NA,NA,NA,NA,NA
ChuckGrassley,10615232,1463633704761319426,in 2000 Sen Biden pushed Pres Clinton 2sue oil cartel 4 anticompetitive price fixing Now Pres Biden begging OPEC 4help only 2b denied He shld promote domestic oil production 2lower prices but the least he can do is hold OPEC accountable by backing my bipartisan NOPEC bill,2021-11-24 22:20:42+00:00,False,82,106,318,7,en,False,Twitter for iPhone,NA,NA,NA,NA,NA,NA,NA,NA,NA,NA,NA,NA
ChuckGrassley,10615232,1463617095799820296,Build back better will add nearly $800 BILLION to the deficit over 5yrs Stoking the fires of inflation The Democrats’ partisan spending spree is unsustainable,2021-11-24 21:14:42+00:00,False,180,319,653,34,en,False,Twitter for iPhone,NA,NA,NA,NA,NA,NA,NA,NA,NA,NA,NA,NA
ChuckGrassley,10615232,1463569055294668804,Welcome 2 Pres Biden’s America where gas prices the wk of Thanksgiving are the highest they’ve been since 2012 &amp; gas prices are 32% higher than same time in 2019 b4 the pandemic,2021-11-24 18:03:49+00:00,False,221,398,878,39,en,False,Twitter for iPhone,NA,NA,NA,NA,NA,NA,NA,NA,NA,NA,NA,NA
ChuckGrassley,10615232,1463520983684460555,Matt &amp; Chuck are in Hawkeye Community College’s Trucking w the Troops program. I supported the federal grant they received which is helping our veterans succeed &amp; supports our supply chain  #99countymeetings https://t.co/utO0vKu15F,2021-11-24 14:52:48+00:00,False,27,36,162,3,en,False,Twitter for iPhone,216,239,https://t.co/utO0vKu15F,https://twitter.com/ChuckGrassley/status/1463520983684460555/photo/1,NA,NA,NA,NA,NA,NA,NA,NA
ChuckGrassley,10615232,1463240844056662016,Democrats tax &amp; spend spree is pouring gasoline on the fires of inflation Just ask former Clinton scty of treasury Larry Summers He so warned in January April August and October,2021-11-23 20:19:37+00:00,False,71,144,320,8,en,False,Twitter for iPhone,NA,NA,NA,NA,NA,NA,NA,NA,NA,NA,NA,NA
ChuckGrassley,10615232,1463228606029746181,Barbara and I wish the Muhlbauer family our condolences &amp; prayers during this holiday season. The support from neighbors during this harvest season shows how Iowans pull together thru thick &amp; thin,2021-11-23 19:30:59+00:00,False,12,10,107,2,en,False,Twitter for iPhone,NA,NA,NA,NA,NA,NA,NA,NA,NA,NA,NA,NA
ChuckGrassley,10615232,1463211793224978439,Thanksgiving Time Grassley clan gathers. Get out old reliable Beth. Called Beth bc of a reliable Atlantic family farmer/former staffer for me &amp; Iowans. I vacuum bc I don’t want to be peeling potatoes https://t.co/OvTfmPVqjl,2021-11-23 18:24:11+00:00,False,281,300,3213,248,en,False,Twitter for iPhone,204,227,https://t.co/OvTfmPVqjl,https://twitter.com/ChuckGrassley/status/1463211793224978439/photo/1,NA,NA,NA,NA,NA,NA,NA,NA
ChuckGrassley,10615232,1463163687687147529,"Something doesn't smell right abt Chinese tennis player disappeared after sexual assault allegation against commie ldr then creepy statement then weird videos &amp;a call Good 4 Women's Tennis Assn demanding proof she isn't being coerced, prioritizing womens' safety over Chinese cash",2021-11-23 15:13:02+00:00,False,137,98,586,13,en,False,Twitter for iPhone,NA,NA,NA,NA,NA,NA,NA,NA,NA,NA,NA,NA
ChuckGrassley,10615232,1462916209666670602,Hybrid Q&amp;A w 83 MercyOne employees in DSM issues: nursing shortage Medicare sequestration access to rural health care lower Rx prices etc #99countymeetings https://t.co/h5ZyOEXYu9,2021-11-22 22:49:38+00:00,False,11,35,63,0,en,False,Twitter for iPhone,160,183,https://t.co/h5ZyOEXYu9,https://twitter.com/ChuckGrassley/status/1462916209666670602/photo/1,NA,NA,NA,NA,NA,NA,NA,NA
ChuckGrassley,10615232,1462868911788072963,The Iowa Cattlemen &amp; I hv been working hard on my newly introd bipartisan Cattle Market Price Discovery &amp; Transparency Act. We talked w the local media abt why this bill is so badly needed for Iowa farmers https://t.co/0jZRepgZCq,2021-11-22 19:41:42+00:00,False,18,48,130,5,en,False,Twitter for iPhone,214,237,https://t.co/0jZRepgZCq,https://twitter.com/ChuckGrassley/status/1462868911788072963/photo/1,NA,NA,NA,NA,NA,NA,NA,NA
ChuckGrassley,10615232,1462816312812523528,Met w Hawkeye Community College students in Waterloo who are working to fill our truck driver shortage that has been exacerbated by the pandemic Issues: Trucking With the Troops infrastructure supply chain etc https://t.co/Zf9m76Nx8S,2021-11-22 16:12:41+00:00,False,26,53,219,3,en,False,Twitter for iPhone,210,233,https://t.co/Zf9m76Nx8S,https://twitter.com/ChuckGrassley/status/1462816312812523528/photo/1,210,233,https://t.co/Zf9m76Nx8S,https://twitter.com/ChuckGrassley/status/1462816312812523528/photo/1,NA,NA,NA,NA
ChuckGrassley,10615232,1462797682066530306,Evil struck in Waukesha /Barbara &amp; I are praying for those who lost their lives &amp; were injured in this senseless violence,2021-11-22 14:58:39+00:00,False,79,64,812,2,en,False,Twitter for iPhone,NA,NA,NA,NA,NA,NA,NA,NA,NA,NA,NA,NA
ChuckGrassley,10615232,1462553293692014600,Met Cali Solema + Laura Duggan at yesterday’s UNI game https://t.co/itwDQz0ujY,2021-11-21 22:47:32+00:00,False,12,39,212,7,en,False,Twitter for iPhone,55,78,https://t.co/itwDQz0ujY,https://twitter.com/ChuckGrassley/status/1462553293692014600/photo/1,NA,NA,NA,NA,NA,NA,NA,NA
ChuckGrassley,10615232,1462201940562087938,Any Democrat who voted for the reckless tax &amp; spending bill helped boost tax cuts for rich in the state &amp; local tax dedication for mainly the top 1% Dem actions ≠ rhetoric Rich ppl in CA &amp; NY don’t need more tax cuts at expense of Iowans,2021-11-20 23:31:23+00:00,False,150,262,732,25,en,False,Twitter for iPhone,NA,NA,NA,NA,NA,NA,NA,NA,NA,NA,NA,NA
ChuckGrassley,10615232,1462196770633625604,My granddaughter Carrie Grassley and fiancée Tom https://t.co/EcnBjDA5Jz,2021-11-20 23:10:51+00:00,False,53,95,1260,11,en,False,Twitter for iPhone,49,72,https://t.co/EcnBjDA5Jz,https://twitter.com/ChuckGrassley/status/1462196770633625604/photo/1,NA,NA,NA,NA,NA,NA,NA,NA
ChuckGrassley,10615232,1462187283579346948,Mrs G and I left end 3rd qtr UNI game winning over western Illinois 34/3,2021-11-20 22:33:09+00:00,False,23,43,316,11,en,False,Twitter for iPhone,NA,NA,NA,NA,NA,NA,NA,NA,NA,NA,NA,NA
ChuckGrassley,10615232,1462149616460308485,UNI recovers Western Illinois fumble,2021-11-20 20:03:28+00:00,False,18,22,96,8,en,False,Twitter for iPhone,NA,NA,NA,NA,NA,NA,NA,NA,NA,NA,NA,NA
ChuckGrassley,10615232,1462140329050656771,cheering on the Panthers w Congresswoman Ashley Hinson https://t.co/QHcgP0L6zY,2021-11-20 19:26:34+00:00,False,18,43,310,5,en,False,Twitter for iPhone,55,78,https://t.co/QHcgP0L6zY,https://twitter.com/ChuckGrassley/status/1462140329050656771/photo/1,NA,NA,NA,NA,NA,NA,NA,NA
ChuckGrassley,10615232,1462127245045157888,We r on our way to final home game for UNI football Go panthers https://t.co/oqLMM4BSY5,2021-11-20 18:34:34+00:00,False,82,83,1553,15,en,False,Twitter for iPhone,64,87,https://t.co/oqLMM4BSY5,https://twitter.com/ChuckGrassley/status/1462127245045157888/photo/1,NA,NA,NA,NA,NA,NA,NA,NA
ChuckGrassley,10615232,1461888824276041734,Sorry not report set by set. Forgot ph. UNI lost match to Valparaiso 3/1,2021-11-20 02:47:10+00:00,False,28,120,203,24,en,False,Twitter for iPhone,NA,NA,NA,NA,NA,NA,NA,NA,NA,NA,NA,NA
ChuckGrassley,10615232,1461872731012710406,This wk I met w a student group that was advocating for kids in foster care to hv more housing options. As co-chair of the foster youth caucus I will continue to work on this issue https://t.co/3EaXP2ZlQz,2021-11-20 01:43:14+00:00,False,47,64,323,7,en,False,Twitter for iPhone,181,204,https://t.co/3EaXP2ZlQz,https://twitter.com/ChuckGrassley/status/1461872731012710406/photo/1,NA,NA,NA,NA,NA,NA,NA,NA
ChuckGrassley,10615232,1461750914918887426,Turns out Democrats tax &amp; spending spree doesn’t cost $0 It's going to add almost $800 billion to deficit in first 5 yrs /All republicans oppose this reckless bill,2021-11-19 17:39:10+00:00,False,192,277,764,20,en,False,Twitter for iPhone,NA,NA,NA,NA,NA,NA,NA,NA,NA,NA,NA,NA
ChuckGrassley,10615232,1461727334940168204,Congrats to City of Clinton &amp; Iowans who drive thru the area who will benefit from $15M Dept of transportation RAISE grant that I supported for the Manufacturing Drive &amp; Bluff Boulevard Reconstruction project,2021-11-19 16:05:28+00:00,False,12,50,99,3,en,False,Twitter for iPhone,NA,NA,NA,NA,NA,NA,NA,NA,NA,NA,NA,NA
ChuckGrassley,10615232,1461722408960856066,I oppose Democrats’ reckless tax &amp; spending spree that just passed the House It’s wrong for America to spend $1.9 TRILLION on social spending when inflation is at a 30yr high The Senate should throw partisan bill in garbage &amp; do drug pricing/paid family leave etc in a bipart way,2021-11-19 15:45:54+00:00,False,187,347,862,33,en,False,Twitter for iPhone,NA,NA,NA,NA,NA,NA,NA,NA,NA,NA,NA,NA
ChuckGrassley,10615232,1461506532693229568,Spoke to Gray TV abt a law I wrote w Sen Warren to make affordable hearing aids available w/o a prescription New law helps millions of Americans w hearing loss stay connected w loved ones at affordable price https://t.co/b2cGkTQTub,2021-11-19 01:28:05+00:00,False,28,42,148,2,en,False,Twitter for iPhone,208,231,https://t.co/b2cGkTQTub,https://twitter.com/ChuckGrassley/status/1461506532693229568/photo/1,NA,NA,NA,NA,NA,NA,NA,NA
ChuckGrassley,10615232,1461502527963385859,Democrats want to spend HUNDREDS OF BILLIONS to give amnesty to illegal immigrants in their bloated budget reconciliation bill but dont want to spend A DIME to secure the border even tho we hv ongoing border crisis,2021-11-19 01:12:10+00:00,False,362,195,1007,31,en,False,Twitter for iPhone,NA,NA,NA,NA,NA,NA,NA,NA,NA,NA,NA,NA
ChuckGrassley,10615232,1461488589892640768,Democrat proposal b4 House on reconciliation has been scored by Cong Budget Office w nearly $800 billion added to deficit over 5yrs fueling inflation Several Ds hv said they want this bill paid for &amp;its NOT are those same Democrats going 2vote against reckless spending bill??,2021-11-19 00:16:47+00:00,False,127,176,375,18,en,False,Twitter for iPhone,NA,NA,NA,NA,NA,NA,NA,NA,NA,NA,NA,NA
ChuckGrassley,10615232,1461465124837990408,WOW Dem spending bill will give amnesty &amp; backdoor path to citizenship to MILLIONS of illegal immigrants according to Cong Budget Office That's going to cost American taxpayers hundreds of billions over the next 2 decades This bill is terrible for country &amp; rule of law,2021-11-18 22:43:33+00:00,False,713,396,1608,61,en,False,Twitter for iPhone,NA,NA,NA,NA,NA,NA,NA,NA,NA,NA,NA,NA
ChuckGrassley,10615232,1461458104864940032,Happy Latvian Independence Day This day in 1918 Latvia declared independence Nxt yr will be 100 yrs of continuous diplomatic relations w US Gr8 NATO ally,2021-11-18 22:15:39+00:00,False,30,32,197,4,en,False,Twitter for iPhone,NA,NA,NA,NA,NA,NA,NA,NA,NA,NA,NA,NA
ChuckGrassley,10615232,1461450615721275398,Inflation soared to a 31 year high in October Now the Biden Admin is arguing that the cure for inflation spurred by their reckless spending is to pursue even more reckless spending,2021-11-18 21:45:53+00:00,False,175,201,609,18,en,False,Twitter for iPhone,NA,NA,NA,NA,NA,NA,NA,NA,NA,NA,NA,NA
ChuckGrassley,10615232,1461425789891657728,Sen Sanders said expanding state and local tax deduction is “bad policy” because it mainly helps the top 1% AGREED,2021-11-18 20:07:14+00:00,False,163,88,908,23,en,False,Twitter for iPhone,NA,NA,NA,NA,NA,NA,NA,NA,NA,NA,NA,NA
ChuckGrassley,10615232,1461413985039929352,EPA is again kicking the can down the road on biofuel blend deadlines at the request of Big Oil /Biofuel industry needs certainty + these delays are a gut punch to Iowa farmers &amp; rural communities,2021-11-18 19:20:20+00:00,False,41,73,184,1,en,False,Twitter for iPhone,NA,NA,NA,NA,NA,NA,NA,NA,NA,NA,NA,NA
ChuckGrassley,10615232,1461381461328769030,"2day is National Rural Health Day Im strong defender of protecting access 2 rural health care Ive worked 2 expand/improve telehealth, broadband Rural Health Clinics, Critical Access Hospital program, Rural Emergency Hospital program, behavioral health clinics &amp; other legis",2021-11-18 17:11:06+00:00,False,25,100,128,5,en,False,Twitter for iPhone,NA,NA,NA,NA,NA,NA,NA,NA,NA,NA,NA,NA
ChuckGrassley,10615232,1461337028113616898,2day Pres Biden will sign the Protecting America’s First Responders Act of 2021 that I authored It will ensure law enforcement &amp; 1st responders who are disabled in the line of duty get prompt benefits Law enforcement/1st responders deserve our support BACK THE BLUE,2021-11-18 14:14:32+00:00,False,71,82,451,5,en,False,Twitter for iPhone,NA,NA,NA,NA,NA,NA,NA,NA,NA,NA,NA,NA
ChuckGrassley,10615232,1461313307449696257,"November is national adoption month: a time to celebrate the families created by adoption +reflect on the more than 120,000 kids in foster care who are waiting for adoption. Foster kids I’ve talked to say they want a mom &amp; a dad &amp;loving family Thx 2all who open their hearts",2021-11-18 12:40:17+00:00,False,117,67,494,24,en,False,Twitter for iPhone,NA,NA,NA,NA,NA,NA,NA,NA,NA,NA,NA,NA
ChuckGrassley,10615232,1461163373337497611,Gr8 news w UAW workers &amp; John Deere reaching agreement &amp; ratifying deal This brings much needed certainty for Iowa families Good for Iowa’s workers + economy + farm equipment mfg,2021-11-18 02:44:29+00:00,False,67,117,427,14,en,False,Twitter for iPhone,NA,NA,NA,NA,NA,NA,NA,NA,NA,NA,NA,NA
ChuckGrassley,10615232,1461122643676086273,I've heard from cattle producers across Iowa who struggle to make any profit when the Big Four packers make record $$ that's why I'm proud 2intro bipartisan bill w 10 Senators to bring fairness &amp; transparency to the cattle market Lets get this bill passed!,2021-11-18 00:02:39+00:00,False,194,146,1093,28,en,False,Twitter for iPhone,NA,NA,NA,NA,NA,NA,NA,NA,NA,NA,NA,NA
ChuckGrassley,10615232,1461015703750852610,Dems contend their reckless tax &amp;spending bill is about helping middle-class Yet according to official congressional scorekeeper most of the tax relief in their bill goes to wealthy ppl,2021-11-17 16:57:42+00:00,False,147,225,416,21,en,False,Twitter for iPhone,NA,NA,NA,NA,NA,NA,NA,NA,NA,NA,NA,NA
