ScreenName,AuthorID,TweetID,Text,TweetDate,isReply,RetweetCount,ReplyCount,LikeCount,QuoteCount,Language,PossibleSensitive,Source,1stURLStart,1stURLEnd,1stURL,1stURLExp,2ndURLStart,2ndURLEnd,2ndURL,2ndURLExp,3rdURLStart,3rdURLEnd,3rdURL,3rdURLExp
ChuckGrassley,10615232,1461006973936283649,Disturbing news w whistleblower disclosing Oct 20 FBI directive fr crim investigative/counterterrorism div creating a new threat tag abt school boards effectively targeting parents AG Garland testified on Oct 27 so what’s up? Did AG mislead us or not know what’s going on in Dept?,2021-11-17 16:23:01+00:00,False,328,347,1108,60,en,False,Twitter for iPhone,NA,NA,NA,NA,NA,NA,NA,NA,NA,NA,NA,NA
ChuckGrassley,10615232,1460756418861178884,Rule of Law requires ENFORCEMENT of law Scty Mayorkas said dept of homeland security might not deport 1M+ illegal immigrants w final orders of removal They had due process This refusal to do his job is one of many reasons for Biden Border Crisis,2021-11-16 23:47:24+00:00,False,263,286,870,32,en,False,Twitter for iPhone,NA,NA,NA,NA,NA,NA,NA,NA,NA,NA,NA,NA
ChuckGrassley,10615232,1460746509662797826,DHS Scty refused 2 answer my questions abt Biden Admin plan for payments 2certain illegal immigrants No one wants to take responsibility for such bad idea Easy solution DONT PAY Not right 2pay ppl who break law anything let alone more than we give to some 9/11 &amp;gold star families,2021-11-16 23:08:01+00:00,False,174,155,674,11,en,False,Twitter for iPhone,NA,NA,NA,NA,NA,NA,NA,NA,NA,NA,NA,NA
ChuckGrassley,10615232,1460721051911000069,Gr8 to meet Univ of Iowa’s new president Barbara Wilson. We got to know each other &amp; talked abt freedom of speech on college campuses among other issues https://t.co/ZEK6zXjVbf,2021-11-16 21:26:52+00:00,False,27,80,214,4,en,False,Twitter for iPhone,157,180,https://t.co/ZEK6zXjVbf,https://twitter.com/ChuckGrassley/status/1460721051911000069/photo/1,NA,NA,NA,NA,NA,NA,NA,NA
ChuckGrassley,10615232,1460717451319156737,Met w Iowans from America’s Small Business Development Centers. I got an update on the success stories of small biz &amp; entrepreneurship in Iowa https://t.co/usnORUA5Q8,2021-11-16 21:12:33+00:00,False,10,27,63,4,en,False,Twitter for iPhone,147,170,https://t.co/usnORUA5Q8,https://twitter.com/ChuckGrassley/status/1460717451319156737/photo/1,NA,NA,NA,NA,NA,NA,NA,NA
ChuckGrassley,10615232,1460695502572376067,Met w Premier Communications from Sioux County abt rural broadband infrastructure https://t.co/uwNCNSMJrr,2021-11-16 19:45:20+00:00,False,13,86,85,3,en,False,Twitter for iPhone,82,105,https://t.co/uwNCNSMJrr,https://twitter.com/ChuckGrassley/status/1460695502572376067/photo/1,NA,NA,NA,NA,NA,NA,NA,NA
ChuckGrassley,10615232,1460616138317045763,FINALLY after months &amp; multiple requests to Chair Durbin we are getting a Dept of homeland security oversight hrg 2day Each day we see thousands of ppl wading across the Rio Grande coming to America which is ILLEGAL This wouldn’t be happening if Pres Biden was enforcing our laws,2021-11-16 14:29:58+00:00,False,155,176,655,17,en,False,Twitter for iPhone,NA,NA,NA,NA,NA,NA,NA,NA,NA,NA,NA,NA
ChuckGrassley,10615232,1460379399023476739,Had a chance to get acquainted w the college interns from other offices in the Iowa congressional delegation https://t.co/npdkXjQTEW,2021-11-15 22:49:15+00:00,False,14,69,167,4,en,False,Twitter for iPhone,109,132,https://t.co/npdkXjQTEW,https://twitter.com/ChuckGrassley/status/1460379399023476739/photo/1,NA,NA,NA,NA,NA,NA,NA,NA
ChuckGrassley,10615232,1460340376225603585,Westwood HS students from Sloan asked me questions on infrastructure family farms public service etc https://t.co/itSyJyHhyJ,2021-11-15 20:14:12+00:00,False,42,93,245,8,en,False,Twitter for iPhone,101,124,https://t.co/itSyJyHhyJ,https://twitter.com/ChuckGrassley/status/1460340376225603585/photo/1,NA,NA,NA,NA,NA,NA,NA,NA
ChuckGrassley,10615232,1460320327691644930,Met w the Hill family from Story City https://t.co/hHfWcghZAT,2021-11-15 18:54:32+00:00,False,20,20,160,1,en,False,Twitter for iPhone,38,61,https://t.co/hHfWcghZAT,https://twitter.com/ChuckGrassley/status/1460320327691644930/photo/1,NA,NA,NA,NA,NA,NA,NA,NA
ChuckGrassley,10615232,1460318575063879688,Welcome 2 Pres Biden’s America where inflation is at 30 yr high / Inflation is a hidden tax on America’s families It’s highly regressive hitting low-income workers hardest,2021-11-15 18:47:34+00:00,False,196,409,843,38,en,False,Twitter for iPhone,NA,NA,NA,NA,NA,NA,NA,NA,NA,NA,NA,NA
ChuckGrassley,10615232,1460265346217172992,"Sorry 2hear of Sen Leahy’s retirement He &amp; I work together on so many major pieces of legislation False Claims Whistleblower protections EB5 Freedom of Information Act to name a few Pat, Marcelle, Barbara &amp; I are gr8 friends For the Senate his leadership will b missed",2021-11-15 15:16:03+00:00,False,72,203,685,34,en,False,Twitter for iPhone,NA,NA,NA,NA,NA,NA,NA,NA,NA,NA,NA,NA
ChuckGrassley,10615232,1460021659226853380,Finished up corn &amp; soybean harvest this wk Will keep u up-to-date on getting our crops to market to feed/fuel the world A farmers work is never done #cornwatch #soybeanwatch https://t.co/BnfYORsq7X,2021-11-14 23:07:44+00:00,False,293,251,2437,42,en,False,Twitter for iPhone,178,201,https://t.co/BnfYORsq7X,https://twitter.com/ChuckGrassley/status/1460021659226853380/photo/1,NA,NA,NA,NA,NA,NA,NA,NA
ChuckGrassley,10615232,1460013022618046468,The Steele Dossier was bought &amp; paid for by Clinton Campaign &amp;the Democrat National Cmte but many in media took fake bait hook line &amp;sinker to hurt Pres Trump / Axios called it “the media’s epic fail” I investigated this for yrs &amp; now u see why Totally discredited/Russian disinfo,2021-11-14 22:33:24+00:00,False,629,371,2052,50,en,False,Twitter for iPhone,NA,NA,NA,NA,NA,NA,NA,NA,NA,NA,NA,NA
ChuckGrassley,10615232,1459637460519075844,2day in 1942 the 5 Sullivan brothers of Waterloo lost their lives aboard the USS Juneau In WW2 #realhistorychannel The brothers are hometown heroes still to this day for their sacrifice We remember them each Veterans Day wk,2021-11-13 21:41:03+00:00,False,83,67,577,10,en,False,Twitter for iPhone,NA,NA,NA,NA,NA,NA,NA,NA,NA,NA,NA,NA
ChuckGrassley,10615232,1459545140050202625,Talked w Chad Tentinger from Cattlemen’s Heritage abt the Cattle Price Discovery and Transparency Act + how we can help farmers &amp; consumers https://t.co/FI4XmzOWkZ,2021-11-13 15:34:13+00:00,False,44,85,286,4,en,False,Twitter for iPhone,144,167,https://t.co/FI4XmzOWkZ,https://twitter.com/ChuckGrassley/status/1459545140050202625/photo/1,NA,NA,NA,NA,NA,NA,NA,NA
ChuckGrassley,10615232,1459321058314670082,Welcome 2 Pres Biden’s America where gas prices are at a 7 yr high We need energy policy back on track Drill baby drill frack baby frack Biofuels/wind/solar/oil we need it ALL to get gas prices down All right here at home.  We don’t need help fr OPEC,2021-11-13 00:43:47+00:00,False,329,447,1771,59,en,False,Twitter for iPhone,NA,NA,NA,NA,NA,NA,NA,NA,NA,NA,NA,NA
ChuckGrassley,10615232,1459297260370604038,Thx to U.S. District Judge Rebecca Goodgame Ebinger &amp; Senior District Judge James E. Gritzner for joining me at my 2nd federal judiciary youth summit w 75 central Iowa high school students 2day in Des Moines https://t.co/mrCyoBywmi,2021-11-12 23:09:13+00:00,False,19,39,127,1,en,False,Twitter for iPhone,212,235,https://t.co/mrCyoBywmi,https://twitter.com/ChuckGrassley/status/1459297260370604038/photo/1,NA,NA,NA,NA,NA,NA,NA,NA
ChuckGrassley,10615232,1459287231844302857,OPEC is not the answer to high gas prices Pres Biden your high gas prices are here because of your policies I suggest all of the above &amp; all of the below energy incl BIOFUELS,2021-11-12 22:29:22+00:00,False,205,275,911,22,en,False,Twitter for iPhone,NA,NA,NA,NA,NA,NA,NA,NA,NA,NA,NA,NA
ChuckGrassley,10615232,1459239292111364100,75 students from 18 high schools participated in my 2nd judiciary youth summit in Des Moines. Issues: public service natl debt civic engagement cameras in the courtroom criminal justice reform etc #99countymeetings https://t.co/oNoozOWm4p,2021-11-12 19:18:53+00:00,False,25,46,131,2,en,False,Twitter for iPhone,215,238,https://t.co/oNoozOWm4p,https://twitter.com/ChuckGrassley/status/1459239292111364100/photo/1,215,238,https://t.co/oNoozOWm4p,https://twitter.com/ChuckGrassley/status/1459239292111364100/photo/1,215,238,https://t.co/oNoozOWm4p,https://twitter.com/ChuckGrassley/status/1459239292111364100/photo/1
ChuckGrassley,10615232,1459177042730270725,Q&amp;A Des Moines AM rotary 125ppl issues: infrastructure Re-election Twitter Fannie Mae/Freddie Mac civic involvement SCOTUS etc #99countymeetings https://t.co/ctSQt5tCYP,2021-11-12 15:11:31+00:00,False,19,53,101,3,en,False,Twitter for iPhone,149,172,https://t.co/ctSQt5tCYP,https://twitter.com/ChuckGrassley/status/1459177042730270725/photo/1,149,172,https://t.co/ctSQt5tCYP,https://twitter.com/ChuckGrassley/status/1459177042730270725/photo/1,NA,NA,NA,NA
ChuckGrassley,10615232,1458838647315345417,2day we honor all who served our gr8 country in the armed forces. We owe them a debt of gratitude every day for protecting our freedoms &amp; liberty 🇺🇸 https://t.co/R7sP6GKwXN,2021-11-11 16:46:52+00:00,False,52,101,378,8,en,False,Twitter for iPhone,153,176,https://t.co/R7sP6GKwXN,https://twitter.com/ChuckGrassley/status/1458838647315345417/video/1,NA,NA,NA,NA,NA,NA,NA,NA
ChuckGrassley,10615232,1458493120493064195,looks like we missed a few soybeans but otherwise finished w a successful soybean harvest at Grassley Farm #soybeanwatch https://t.co/3KXggVkroI,2021-11-10 17:53:52+00:00,False,36,117,351,11,en,False,Twitter for iPhone,121,144,https://t.co/3KXggVkroI,https://twitter.com/ChuckGrassley/status/1458493120493064195/photo/1,121,144,https://t.co/3KXggVkroI,https://twitter.com/ChuckGrassley/status/1458493120493064195/photo/1,NA,NA,NA,NA
ChuckGrassley,10615232,1458464259604688897,Welcome 2 Pres Biden’s America where prices are climbing &amp; inflation is the highest its been in 31 yrs up 6.2% This will hit ur pocketbooks,2021-11-10 15:59:11+00:00,False,261,520,957,41,en,False,Twitter for iPhone,NA,NA,NA,NA,NA,NA,NA,NA,NA,NA,NA,NA
ChuckGrassley,10615232,1458180536388759560,Family farmers are sick &amp;tired of getting screwed over by the Big Four packers that are making record profits Price transparency &amp;fairness in cattle market is essential for our independent cattle producers Need 2pass new Fischer/Grassley/Tester/Wyden bill ASAP,2021-11-09 21:11:46+00:00,False,144,177,672,16,en,False,Twitter for iPhone,NA,NA,NA,NA,NA,NA,NA,NA,NA,NA,NA,NA
ChuckGrassley,10615232,1458149658706984967,Getting fair market for cattle producers is top priority of mine After input from Iowans I'm glad 2say we reached a bipart deal 2bring transparency 2 cattle market &amp;take action against anticompetitive practices Family farmers &amp;consumers deserve a fair price for quality product,2021-11-09 19:09:04+00:00,False,35,69,240,6,en,False,Twitter for iPhone,NA,NA,NA,NA,NA,NA,NA,NA,NA,NA,NA,NA
ChuckGrassley,10615232,1458095597295181836,"Max Cleland was an outstanding senator for Georgia. He was active in veterans issues, a war hero, an amputee &amp; a person who was a constant reminder to me of what our service members go thru defending freedom We enjoy everyday w/out proper appreciation God bless Max &amp; his family",2021-11-09 15:34:15+00:00,False,28,33,185,5,en,False,Twitter for iPhone,NA,NA,NA,NA,NA,NA,NA,NA,NA,NA,NA,NA
ChuckGrassley,10615232,1457887111856656386,"2day in Black Hawk County, Iowa https://t.co/Djt3FbvzNt",2021-11-09 01:45:48+00:00,False,42,67,468,12,en,False,Twitter for iPhone,32,55,https://t.co/Djt3FbvzNt,https://twitter.com/ChuckGrassley/status/1457887111856656386/photo/1,NA,NA,NA,NA,NA,NA,NA,NA
ChuckGrassley,10615232,1457859357610319879,"when will Atty General Garland give the American ppl answers on where Dept of Justice stands on payments to illegal immigrants? Ldr McConnell &amp; I asked last wk--where does DOJ stand?
 
Americans deserve 2kno",2021-11-08 23:55:31+00:00,False,154,233,649,11,en,False,Twitter for iPhone,NA,NA,NA,NA,NA,NA,NA,NA,NA,NA,NA,NA
ChuckGrassley,10615232,1457837821016911872,Stopped by Blain’s in Cedar Falls for farm supplies btwn mtgs https://t.co/e192ucl08F,2021-11-08 22:29:56+00:00,False,56,165,861,29,en,False,Twitter for iPhone,62,85,https://t.co/e192ucl08F,https://twitter.com/ChuckGrassley/status/1457837821016911872/photo/1,NA,NA,NA,NA,NA,NA,NA,NA
