ScreenName,AuthorID,TweetID,Text,TweetDate,isReply,RetweetCount,ReplyCount,LikeCount,QuoteCount,Language,PossibleSensitive,Source,1stURLStart,1stURLEnd,1stURL,1stURLExp,2ndURLStart,2ndURLEnd,2ndURL,2ndURLExp,3rdURLStart,3rdURLEnd,3rdURL,3rdURLExp
RandPaul,216881337,1465684415535849475,ICYMI this morning I joined @FoxandFriends. It's a very dangerous idea that because a government bureaucrat believes he represents science that he is now untouchable. https://t.co/1pqU2xPDfX,2021-11-30 14:09:30+00:00,False,907,470,3330,74,en,False,Twitter Media Studio,167,190,https://t.co/1pqU2xPDfX,https://twitter.com/RandPaul/status/1465684415535849475/video/1,NA,NA,NA,NA,NA,NA,NA,NA
RandPaul,216881337,1465675861089304583,I’ll be joining @foxandfriends on @foxews soon! Don’t miss it!,2021-11-30 13:35:30+00:00,False,111,184,1352,10,en,False,Twitter for iPhone,NA,NA,NA,NA,NA,NA,NA,NA,NA,NA,NA,NA
RandPaul,216881337,1465432882453913614,There’s no other way to describe it when Fauci says he alone represents science. https://t.co/JhZMpWsbn5,2021-11-29 21:30:00+00:00,False,2083,1024,10560,104,en,False,TweetDeck,81,104,https://t.co/JhZMpWsbn5,https://www.msn.com/en-us/news/politics/rand-paul-faucis-hubris-is-showing/ar-AAReqv3,NA,NA,NA,NA,NA,NA,NA,NA
RandPaul,216881337,1465384271187750919,"A must read, Scott Atlas’ behind the scenes expose’ of how Fauci botched the COVID response. 

https://t.co/eLws2t6gwB",2021-11-29 18:16:50+00:00,False,1625,349,4502,48,en,False,Twitter for iPhone,95,118,https://t.co/eLws2t6gwB,https://brownstone.org/articles/a-president-betrayed-by-bureaucrats-scott-atlass-masterpiece-on-the-covid-disaster/,NA,NA,NA,NA,NA,NA,NA,NA
RandPaul,216881337,1465016513463820296,"The absolute hubris of someone claiming THEY represent science. It’s astounding and alarming that a public health bureaucrat would even think to claim such a thing, especially one who has worked so hard to ignore the science of natural immunity. https://t.co/rcDezphVRR",2021-11-28 17:55:30+00:00,False,12933,8306,46853,1286,en,False,Twitter for iPhone,246,269,https://t.co/rcDezphVRR,https://twitter.com/FaceTheNation/status/1465003501541597191,NA,NA,NA,NA,NA,NA,NA,NA
RandPaul,216881337,1464291640093429762,A message needs to be sent to Saudi Arabia that we don’t approve of their war with Yemen… https://t.co/i8MAe6RmaN,2021-11-26 17:55:06+00:00,False,333,351,2046,54,en,False,Twitter for iPhone,90,113,https://t.co/i8MAe6RmaN,https://www.washingtonexaminer.com/opinion/sens-rand-paul-bernie-sanders-and-mike-lee-issue-joint-resolution-to-put-yemeni-people-before-profits,NA,NA,NA,NA,NA,NA,NA,NA
RandPaul,216881337,1462918969984274445,"""Paul’s bill would free drug companies to use other techniques, and also eliminate the animal-use requirement in NIH-funded experiments for new drugs and vaccines."" https://t.co/HoEKH7sbhd",2021-11-22 23:00:36+00:00,False,684,279,2857,44,en,False,Twitter for iPhone,165,188,https://t.co/HoEKH7sbhd,https://www.nationalreview.com/2021/11/faucis-kennel-of-horrors-a-study-in-animal-protection-as-a-conservative-cause/?utm_source=recirc-%5BSCREENSIZE%5D&utm_medium=article&utm_campaign=river&utm_content=native-latest&utm_term=second,NA,NA,NA,NA,NA,NA,NA,NA
RandPaul,216881337,1462866854783983619,"As private censorship grows, remember you can find the unfiltered news at https://t.co/1sAnMwUZeq
https://t.co/9utUc6x9dk",2021-11-22 19:33:31+00:00,False,167,119,710,8,en,False,Twitter for iPhone,74,97,https://t.co/1sAnMwUZeq,http://libertytree.com,98,121,https://t.co/9utUc6x9dk,https://www.washingtonexaminer.com/opinion/tiktok-censored-me-for-defending-kyle-rittenhouse,NA,NA,NA,NA
RandPaul,216881337,1462461109223440391,Kelley and I were glad to be a part of the Boone County GOP’s Let Freedom Ring Gala! We’re just under a year out from a vital election and Friday night NKY showed up in force. I hope you’ll all bring that same enthusiasm and stand with me in fighting for America next year! https://t.co/Ihz5pxiedA,2021-11-21 16:41:14+00:00,False,152,150,1753,10,en,False,Twitter for iPhone,274,297,https://t.co/Ihz5pxiedA,https://twitter.com/RandPaul/status/1462461109223440391/photo/1,274,297,https://t.co/Ihz5pxiedA,https://twitter.com/RandPaul/status/1462461109223440391/photo/1,274,297,https://t.co/Ihz5pxiedA,https://twitter.com/RandPaul/status/1462461109223440391/photo/1
RandPaul,216881337,1461747422959390723,"Spent the morning making some new furry friends and talking with staff at Kenton Co. Animal Services about my bipartisan bill to end FDA mandates on animal testing.

Be sure to visit https://t.co/XKxwC0TNAX or your local adoption agency to find your next best friend like Thanos! https://t.co/7SpRsRELma",2021-11-19 17:25:18+00:00,False,225,126,1376,18,en,False,Twitter for iPhone,183,206,https://t.co/XKxwC0TNAX,https://www.kentoncounty.org/155/Adopt-a-Pet,280,303,https://t.co/7SpRsRELma,https://twitter.com/RandPaul/status/1461747422959390723/photo/1,280,303,https://t.co/7SpRsRELma,https://twitter.com/RandPaul/status/1461747422959390723/photo/1
RandPaul,216881337,1461695210459697158,"Good news for transplant patients, particularly since vaccines don’t work as well for them.
https://t.co/7cWSQTxKTQ",2021-11-19 13:57:49+00:00,False,159,106,895,11,en,False,Twitter for iPhone,92,115,https://t.co/7cWSQTxKTQ,https://publichealth.jhu.edu/2021/covid-19-outcomes-for-patients-on-immunosuppressive-drugs-on-par-with-non-immunosuppressed-patients,NA,NA,NA,NA,NA,NA,NA,NA
RandPaul,216881337,1461380028525166602,"ICYMI: Last night I joined @FoxNews to discuss Fauci, the attacks on our rights, and the targeting of concerned parents. https://t.co/WbLFnSmj8F",2021-11-18 17:05:24+00:00,False,666,394,2733,51,en,False,Twitter Media Studio,121,144,https://t.co/WbLFnSmj8F,https://twitter.com/RandPaul/status/1461380028525166602/video/1,NA,NA,NA,NA,NA,NA,NA,NA
RandPaul,216881337,1460988186566578183,"“There's joint blame: Congress is initially to blame for spending money it doesn’t have and then the Federal Reserve says, oh, it's just our job to paper over this.” https://t.co/Y9E9cxsf3A",2021-11-17 15:08:22+00:00,False,530,195,2576,25,en,False,Twitter for iPhone,166,189,https://t.co/Y9E9cxsf3A,https://fee.org/articles/interview-rand-paul-explains-what-s-really-causing-america-s-inflation-woes/,NA,NA,NA,NA,NA,NA,NA,NA
RandPaul,216881337,1460698796967538689,Or maybe an unelected bureaucrat responsible for funding gain-of-function research and lying to the public is doing harm to our response to COVID. https://t.co/ozW8svdMDt,2021-11-16 19:58:26+00:00,False,3685,961,15734,181,en,False,Twitter Web App,147,170,https://t.co/ozW8svdMDt,https://www.newsmax.com/politics/fauci-covid-frist/2021/11/15/id/1044744/,NA,NA,NA,NA,NA,NA,NA,NA
RandPaul,216881337,1460615977389989893,"I will continue to propose commonsense, fiscally responsible solutions and oppose any and all spending that furthers our supply chain crisis, encourages inflation, and aims to hurt American taxpayers. https://t.co/flPHmSbXRY",2021-11-16 14:29:20+00:00,False,594,297,5529,32,en,False,Twitter for iPhone,201,224,https://t.co/flPHmSbXRY,https://www.westkentuckystar.com/News/State/OP-ED-Senator-Rand-Paul-on-supply-chain-issues-and?fbclid=IwAR1eJ8A48et43KMhmlJGIjRbFu3RubMaVkUIobmu62n6ar5NBq8JH_dN2DA,NA,NA,NA,NA,NA,NA,NA,NA
RandPaul,216881337,1460347232172101632,"Last week, I was thrilled to see my very good friend Dr. Meredith Evans while I was touring Eastern Kentucky.

Dr. Evans was one of my earliest supporters when I first ran in 2010. I’m honored by the trust and guidance from this outstanding patriot and Kentuckian. https://t.co/RGBWkzkh6u",2021-11-15 20:41:26+00:00,False,153,144,3106,6,en,False,Twitter Web App,265,288,https://t.co/RGBWkzkh6u,https://twitter.com/RandPaul/status/1460347232172101632/photo/1,NA,NA,NA,NA,NA,NA,NA,NA
RandPaul,216881337,1459937596541444110,"""Following his meeting with Kentuckians in Manchester at the Clay County Courthouse, Sen. Paul stopped in Hazard and met with representatives from various local law enforcement agencies at Hazard City Hall."" https://t.co/lNifsiWdtI",2021-11-14 17:33:42+00:00,False,69,120,649,6,en,False,Twitter Web App,208,231,https://t.co/lNifsiWdtI,https://www.hazard-herald.com/news/rand-paul-visits-hazard-others-to-discuss-issues-kentuckians-face/article_774d4e50-43a7-11ec-ab62-ab683b7564ce.html?utm_medium=social&utm_source=twitter&utm_campaign=user-share,NA,NA,NA,NA,NA,NA,NA,NA
RandPaul,216881337,1459533211772534792,"Earlier this week, I had the privilege to be the keynote speaker at the annual Floyd County Lincoln Dinner in Prestonsburg! 

Thanks to all who came and I hope people across Kentucky will join me as we continue to fight for this great country! https://t.co/Vbw4yZVbie",2021-11-13 14:46:49+00:00,False,92,128,1079,5,en,False,Twitter for iPhone,244,267,https://t.co/Vbw4yZVbie,https://rumble.com/vp4wu5-2021-floyd-county-republican-party-lincoln-dinner.html,NA,NA,NA,NA,NA,NA,NA,NA
RandPaul,216881337,1459502067735748608,"First hand account of how Dr. Fauci ignored the science to impose the lockdown and do harm to our children. 

Dr. Scott Atlas unloads on Fauci, Birx, Redfield in forthcoming memoir: 'I was disgusted' https://t.co/EecP7cBy0Q",2021-11-13 12:43:03+00:00,False,5527,1070,16409,228,en,False,Twitter for iPhone,200,223,https://t.co/EecP7cBy0Q,https://news.yahoo.com/dr-scott-atlas-unloads-fauci-200956081.html,NA,NA,NA,NA,NA,NA,NA,NA
RandPaul,216881337,1459145473198116864,"Dr. Eberling is right:  socialism seeks to change man’s nature which invariably requires violence. (See also p. 170 of The Case Against Socialism)

Socialism Requires a Dictator - Foundation for Economic Education https://t.co/KEMQCsy9go",2021-11-12 13:06:05+00:00,False,715,293,2609,29,en,False,Twitter for iPhone,214,237,https://t.co/KEMQCsy9go,https://fee.org/articles/socialism-requires-a-dictator/,NA,NA,NA,NA,NA,NA,NA,NA
RandPaul,216881337,1458944656369192965,Read this before submitting to any vaccine mandate for children https://t.co/MfO016dR99,2021-11-11 23:48:06+00:00,False,5183,420,13397,124,en,False,Twitter for iPhone,64,87,https://t.co/MfO016dR99,https://twitter.com/MartyMakary/status/1458090097493094405,NA,NA,NA,NA,NA,NA,NA,NA
RandPaul,216881337,1458944490459348996,"Should you vaccinate your 5-11 year old? 

This study shows 24 hospitalizations/100,000 for kids in this age group from Covid compared to 14 cases per 100,000 of myocarditis with vaccine. 

Hospitalizations Associated with COVID-19 Among Children   https://t.co/LKhyNXcKYP",2021-11-11 23:47:27+00:00,False,899,421,2211,70,en,False,Twitter for iPhone,249,272,https://t.co/LKhyNXcKYP,https://www.cdc.gov/mmwr/volumes/70/wr/mm7036e2.htm,NA,NA,NA,NA,NA,NA,NA,NA
RandPaul,216881337,1458896671996272644,Thank you to Mike and his team at @BlueCotton for letting me spend some time with you all today! https://t.co/J5z26MxdpS,2021-11-11 20:37:26+00:00,False,117,92,1754,4,en,False,Twitter for iPhone,97,120,https://t.co/J5z26MxdpS,https://twitter.com/RandPaul/status/1458896671996272644/photo/1,NA,NA,NA,NA,NA,NA,NA,NA
RandPaul,216881337,1458800202115125249,Today on #VeteransDay we thank all who have served. They have given so much of themselves to protect our country and our freedom. While we can never fully repay them for their sacrifices days like today give us a chance to show them that we will never forget. https://t.co/AjhLgsIG0W,2021-11-11 14:14:06+00:00,False,592,156,4754,20,en,False,Twitter Media Studio,260,283,https://t.co/AjhLgsIG0W,https://twitter.com/RandPaul/status/1458800202115125249/video/1,NA,NA,NA,NA,NA,NA,NA,NA
RandPaul,216881337,1458562713597194246,Been having a great time traveling throughout Eastern Kentucky this week! https://t.co/TIymxGk33g,2021-11-10 22:30:24+00:00,False,52,85,749,1,en,False,Twitter for iPhone,74,97,https://t.co/TIymxGk33g,https://www.wymt.com/2021/11/10/senator-rand-paul-tours-eastern-kentucky-meets-with-vets/,NA,NA,NA,NA,NA,NA,NA,NA
RandPaul,216881337,1458451516025712643,"Good morning Pineville, KY! https://t.co/i6NddeD0NG",2021-11-10 15:08:32+00:00,False,465,335,10922,40,en,False,Twitter for iPhone,28,51,https://t.co/i6NddeD0NG,https://twitter.com/RandPaul/status/1458451516025712643/photo/1,NA,NA,NA,NA,NA,NA,NA,NA
RandPaul,216881337,1458177635113218049,"Thanks to Kentucky Mist Distillery of Whitesburg, KY for teaching me all about moonshine today! Glad to see such wonderful small businesses succeeding in Eastern Kentucky. https://t.co/yCWnt9rWje",2021-11-09 21:00:14+00:00,False,219,164,3885,9,en,False,Twitter for iPhone,172,195,https://t.co/yCWnt9rWje,https://twitter.com/RandPaul/status/1458177635113218049/photo/1,NA,NA,NA,NA,NA,NA,NA,NA
RandPaul,216881337,1458120649793286147,"Picked up this great mug at Coal City Coffee in Jenkins, KY. Thank you Chrystal with SmileFaith Appalachia for showing us around the property and thank you for all you do for your community! https://t.co/BrvqSyFMx1",2021-11-09 17:13:48+00:00,False,134,124,2120,8,en,False,Twitter for iPhone,191,214,https://t.co/BrvqSyFMx1,https://twitter.com/RandPaul/status/1458120649793286147/photo/1,NA,NA,NA,NA,NA,NA,NA,NA
RandPaul,216881337,1458102027679158283,I joined @WYMT for Issues and Answers while visiting eastern Kentucky this week. https://t.co/4Koh2DyYbt,2021-11-09 15:59:48+00:00,False,46,59,425,5,en,False,Twitter Web App,81,104,https://t.co/4Koh2DyYbt,https://www.wymt.com/2021/11/09/issues-answers-senator-rand-paul-visits-eastern-kentucky/,NA,NA,NA,NA,NA,NA,NA,NA
RandPaul,216881337,1458069768133566466,This morning I had the opportunity to visit @PikevilleElem School and return Flat Stanley to my friend Charlotte and her entire class. Thank you to our outstanding educators for teaching about the constitution and giving me an opportunity to meet with these great students! https://t.co/FOgNMFldjM,2021-11-09 13:51:37+00:00,False,112,69,1428,8,en,False,Twitter for iPhone,274,297,https://t.co/FOgNMFldjM,https://twitter.com/RandPaul/status/1458069768133566466/photo/1,274,297,https://t.co/FOgNMFldjM,https://twitter.com/RandPaul/status/1458069768133566466/photo/1,274,297,https://t.co/FOgNMFldjM,https://twitter.com/RandPaul/status/1458069768133566466/photo/1
RandPaul,216881337,1458056622450827267,Thank you to the Floyd County GOP for having me as your keynote speaker last evening! Great turn out for the Lincoln Dinner in Prestonsburg! https://t.co/LtJFLfjWia,2021-11-09 12:59:22+00:00,False,129,76,1855,6,en,False,Twitter for iPhone,141,164,https://t.co/LtJFLfjWia,https://twitter.com/RandPaul/status/1458056622450827267/photo/1,NA,NA,NA,NA,NA,NA,NA,NA
RandPaul,216881337,1457787297114456069,"and last but not least...
10. Mountain Parkway - Sundy Best
https://t.co/MjmOQPkxVR",2021-11-08 19:09:10+00:00,True,28,49,345,4,en,False,Twitter Web App,60,83,https://t.co/MjmOQPkxVR,https://youtu.be/b69zQgMxFO0,NA,NA,NA,NA,NA,NA,NA,NA
RandPaul,216881337,1457787295654760454,"6. Coal Miner’s Daughter - Loretta Lynn
https://t.co/SWfOS0P9Ua
7. Kentucky Rain - Elvis Presley
https://t.co/pcSGDGgG2p
8. Readin’ Rightin’ Rt 23. — Dwight Yoakam
https://t.co/swJFJy3pTi
9. Kentucky Woman - Neil Diamond
https://t.co/Qic7mM0S14",2021-11-08 19:09:10+00:00,True,28,46,446,2,en,False,Twitter Web App,40,63,https://t.co/SWfOS0P9Ua,https://youtu.be/5VhOPHR47qE,97,120,https://t.co/pcSGDGgG2p,https://youtu.be/Qv_CfN3oiOU,97,120,https://t.co/pcSGDGgG2p,https://youtu.be/Qv_CfN3oiOU
RandPaul,216881337,1457787294237151240,"2. East Kentucky Home - The Steel Drivers
https://t.co/RYfhUNexot
3. Blue Moon of Kentucky - Bill Monroe
https://t.co/y2oI62cQe9
4. You’ll Never Leave Harlan Alive - Darrell Scott
https://t.co/Yx4CU7aN5E
5. Kentucky Bluebird - Keith Whitley
https://t.co/DSeksp9lWW",2021-11-08 19:09:09+00:00,True,11,10,185,2,en,False,Twitter Web App,42,65,https://t.co/RYfhUNexot,https://www.youtube.com/watch?v=VNYE2Mo24RM,105,128,https://t.co/y2oI62cQe9,https://www.youtube.com/watch?v=4syA9aNnNa0,105,128,https://t.co/y2oI62cQe9,https://www.youtube.com/watch?v=4syA9aNnNa0
RandPaul,216881337,1457787292374892549,"When driving through the winding roads of Appalachia, good music is a must. Here are the top 10 Kentucky-themed songs I’m listening to right now…tell me your favorite and maybe I’ll add it to my list!

1. Follow You to Virgie - Tyler Childers https://t.co/t3iTf5mM3L",2021-11-08 19:09:09+00:00,False,143,241,1553,18,en,False,Twitter Web App,243,266,https://t.co/t3iTf5mM3L,https://www.youtube.com/watch?v=vFL5QcYDnmw,NA,NA,NA,NA,NA,NA,NA,NA
RandPaul,216881337,1457752209517686792,Just getting into the Appalachian mountains listening to the Avett Brothers’ Head Full of Doubt. Can’t wait to spend time with friends in Eastern Kentucky this week! https://t.co/4ScwuAFTK1,2021-11-08 16:49:45+00:00,False,110,110,1656,10,en,False,Twitter for iPhone,166,189,https://t.co/4ScwuAFTK1,https://youtu.be/QeYSqZPzwr8,NA,NA,NA,NA,NA,NA,NA,NA
RandPaul,216881337,1457744638215925765,On our way to our first stop of the day. Town hall in Clay County! https://t.co/8FfUnaLhab,2021-11-08 16:19:39+00:00,False,66,69,1195,3,en,False,Twitter for iPhone,67,90,https://t.co/8FfUnaLhab,https://twitter.com/RandPaul/status/1457744638215925765/photo/1,NA,NA,NA,NA,NA,NA,NA,NA
RandPaul,216881337,1457718196526587907,Headed out for a fall trip to the mountains in Eastern Kentucky! https://t.co/VtEP9264w1,2021-11-08 14:34:35+00:00,False,276,355,8028,32,en,False,Twitter for iPhone,65,88,https://t.co/VtEP9264w1,https://twitter.com/RandPaul/status/1457718196526587907/photo/1,NA,NA,NA,NA,NA,NA,NA,NA
RandPaul,216881337,1456789950507241475,Joining @seanhannity tonight on @FoxNews - tune in!,2021-11-06 01:06:04+00:00,False,141,328,1949,13,en,False,Twitter for iPhone,NA,NA,NA,NA,NA,NA,NA,NA,NA,NA,NA,NA
RandPaul,216881337,1456629066459668482,"“The first in-person confrontation between Sen. Rand Paul and Dr. Anthony Fauci since the NIH admitted to funding gain-of-function research in China occurred today. During a Senate hearing, Paul took a blowtorch to Fauci’s lies and excuses.…” https://t.co/aYmVtTHi4E",2021-11-05 14:26:46+00:00,False,1749,776,7754,115,en,False,Twitter for iPhone,243,266,https://t.co/aYmVtTHi4E,https://redstate.com/bonchie/2021/11/04/rand-paul-takes-a-blowtorch-to-dr-faucis-lies-and-excuses-about-gain-of-function-research-n469901,NA,NA,NA,NA,NA,NA,NA,NA
RandPaul,216881337,1456403509784555530,No amount of smarmy word salad will get Fauci out of the fact that he lied before Congress. #FauciResign https://t.co/lo81FphHeq,2021-11-04 23:30:30+00:00,False,3618,1705,14985,248,en,False,Twitter Web App,105,128,https://t.co/lo81FphHeq,https://twitter.com/RandPaul/status/1456403509784555530/video/1,NA,NA,NA,NA,NA,NA,NA,NA
RandPaul,216881337,1456361432145145860,I applaud businesses who are standing up for the right to determine with their employees what workplace policies make sense for them. And I applaud groups like the Job Creators Network who are taking the challenge to this rule to court.,2021-11-04 20:43:17+00:00,True,984,250,6979,20,en,False,Twitter Web App,NA,NA,NA,NA,NA,NA,NA,NA,NA,NA,NA,NA
RandPaul,216881337,1456361430450589700,"This mandate is illegal, unconstitutional, and immoral. I applaud every worker who is standing up for the right to make his or her own medical decisions. https://t.co/VkrqZPbMyD",2021-11-04 20:43:17+00:00,False,7815,1303,32064,250,en,False,Twitter Web App,154,177,https://t.co/VkrqZPbMyD,https://twitter.com/JobCreatorsUSA/status/1456280986103259153,NA,NA,NA,NA,NA,NA,NA,NA
RandPaul,216881337,1456353471049998342,Hooray for Travis Tritt standing up to the man. https://t.co/Q4HQp78em8,2021-11-04 20:11:39+00:00,False,722,173,5177,35,en,False,Twitter for iPhone,48,71,https://t.co/Q4HQp78em8,https://www.washingtonian.com/2021/11/02/virginias-birchmere-music-hall-is-dropping-its-vaccination-mandate-to-accommodate-travis-tritt/,NA,NA,NA,NA,NA,NA,NA,NA
RandPaul,216881337,1456344326603255815,"I gave Fauci another chance today to come clean about the NIH's involvement in gain-of-function research and he chose to lie instead.

His failures to do anything to help us get to the bottom of why the pandemic happened is why I believe he should resign. https://t.co/8swITZSlBH",2021-11-04 19:35:19+00:00,False,6155,2370,25455,489,en,False,Twitter Web App,256,279,https://t.co/8swITZSlBH,https://www.foxnews.com/opinion/nih-lied-gain-of-function-covid-sen-rand-paul,NA,NA,NA,NA,NA,NA,NA,NA
RandPaul,216881337,1456250667631316995,Be sure to tune into the HELP committee hearing this morning. I’ll be continuing my efforts to get the truth from Dr. Fauci!,2021-11-04 13:23:09+00:00,False,2489,1254,16634,197,en,False,Twitter for iPhone,NA,NA,NA,NA,NA,NA,NA,NA,NA,NA,NA,NA
RandPaul,216881337,1455997893459025925,"Today I joined @FoxBusiness to discuss the VA election, Biden's policies, and my upcoming hearing with Dr. Fauci tomorrow! https://t.co/TKAT8sq66q",2021-11-03 20:38:43+00:00,False,386,216,2051,24,en,False,Twitter Media Studio,123,146,https://t.co/TKAT8sq66q,https://twitter.com/RandPaul/status/1455997893459025925/video/1,NA,NA,NA,NA,NA,NA,NA,NA
RandPaul,216881337,1455992342561820673,Joining @larry_kudlow on @FoxBusiness soon! Don’t miss it!,2021-11-03 20:16:40+00:00,False,70,84,713,5,en,False,Twitter for iPhone,NA,NA,NA,NA,NA,NA,NA,NA,NA,NA,NA,NA
RandPaul,216881337,1455923717947658244,"“We should not force COVID vaccines on anyone when the evidence shows that naturally acquired immunity is equal to or more robust and superior to existing vaccines. Instead, we should respect the right of the bodily integrity of individuals to decide…” https://t.co/V6hfj0tLWS",2021-11-03 15:43:58+00:00,False,4222,595,14559,221,en,False,Twitter for iPhone,253,276,https://t.co/V6hfj0tLWS,https://brownstone.org/articles/79-research-studies-affirm-naturally-acquired-immunity-to-covid-19-documented-linked-and-quoted/,NA,NA,NA,NA,NA,NA,NA,NA
RandPaul,216881337,1455896473917399052,"Congratulations to Dr. Donald Douglas, Sarge Pollock, and Timmy Truett on being elected to the Kentucky General Assembly last night!

With their additions, the @KYSenateGOP and @KYHouseGOP become stronger and better prepared to tackle the challenges facing our commonwealth!",2021-11-03 13:55:43+00:00,False,279,64,2877,12,en,False,Twitter for iPhone,NA,NA,NA,NA,NA,NA,NA,NA,NA,NA,NA,NA
RandPaul,216881337,1455706066348646400,I was proud to endorse @GlennYoungkin. His win tonight is a clear and much needed signal for personal freedom and that parents are the deciders of their children’s education and future.,2021-11-03 01:19:06+00:00,False,6368,696,45606,174,en,False,Twitter for iPhone,NA,NA,NA,NA,NA,NA,NA,NA,NA,NA,NA,NA
RandPaul,216881337,1455563137302810627,P.S. Don't forget to get out and vote for @GlennYoungkin if you live in Virginia! #VAGov,2021-11-02 15:51:09+00:00,True,228,67,1693,7,en,False,Twitter Web App,NA,NA,NA,NA,NA,NA,NA,NA,NA,NA,NA,NA
RandPaul,216881337,1455563135801335812,"It’s Election Day across the country, including here in Kentucky with special elections in Senate District 22 and House Districts 51 and 89! Visit https://t.co/yjGOAFouWN to see if you’re in the district and be sure to get out and vote @KYGOP if you do! #ElectionDay",2021-11-02 15:51:09+00:00,False,207,57,1493,6,en,False,Twitter Web App,147,170,https://t.co/yjGOAFouWN,http://www.govoteky.com,NA,NA,NA,NA,NA,NA,NA,NA
RandPaul,216881337,1455348142111657991,"Tomorrow is Election Day in Virginia. If you haven’t already, please vote for my friend @GlennYoungkin for Governor!",2021-11-02 01:36:50+00:00,False,3885,575,21576,79,en,False,Twitter for iPhone,NA,NA,NA,NA,NA,NA,NA,NA,NA,NA,NA,NA
RandPaul,216881337,1455329277583441921,"Great article on Fauci’s failures during pandemic.   

Read it before big tech censors it, and remember to check https://t.co/ZFP9Lcyg7d daily for uncensored liberty news. 

https://t.co/GBhy9VoUZk",2021-11-02 00:21:53+00:00,False,1025,310,2958,39,en,False,Twitter for iPhone,113,136,https://t.co/ZFP9Lcyg7d,http://LibertyTree.com,174,197,https://t.co/GBhy9VoUZk,https://libertytree.com/randpaul/1537,NA,NA,NA,NA
RandPaul,216881337,1454901105389940736,Happy Halloween everyone! https://t.co/CmYTrmF2KU,2021-10-31 20:00:28+00:00,False,2449,758,19665,88,en,False,Twitter for iPhone,26,49,https://t.co/CmYTrmF2KU,https://twitter.com/KelleyAshbyPaul/status/1454885216657498121,NA,NA,NA,NA,NA,NA,NA,NA
RandPaul,216881337,1454836293679075332,ICYMI: This morning I joined @FoxNews to discuss Fauci and my upcoming hearing. Fauci should be out of office. https://t.co/ifntTpW9L1,2021-10-31 15:42:56+00:00,False,2267,851,8830,178,en,False,Twitter Media Studio,111,134,https://t.co/ifntTpW9L1,https://twitter.com/RandPaul/status/1454836293679075332/video/1,NA,NA,NA,NA,NA,NA,NA,NA
RandPaul,216881337,1454809894461247491,Joining @MariaBartiromo live on @FoxNews at 10am et! Tune in!,2021-10-31 13:58:02+00:00,False,134,227,1368,15,en,False,Twitter for iPhone,NA,NA,NA,NA,NA,NA,NA,NA,NA,NA,NA,NA
RandPaul,216881337,1454174269374668811,"I'm not alone in wanting Fauci to resign. Now, most Americans want him to resign too. #FauciLied https://t.co/9eifxF9kXG",2021-10-29 19:52:17+00:00,False,6711,3216,30748,766,en,False,Twitter for iPhone,97,120,https://t.co/9eifxF9kXG,https://www.washingtonexaminer.com/opinion/washington-secrets/poll-fauci-lied-resign,NA,NA,NA,NA,NA,NA,NA,NA
RandPaul,216881337,1453873820574666761,Absolutely not. https://t.co/g419yTMjjR,2021-10-28 23:58:25+00:00,False,7858,2793,47916,479,en,False,Twitter for iPhone,16,39,https://t.co/g419yTMjjR,https://twitter.com/newsmax/status/1453863008065622018,NA,NA,NA,NA,NA,NA,NA,NA
RandPaul,216881337,1453495879617372169,"Did Biden’s attorney general imply that Dr. Fauci is being investigated for lying to Congress?  Watch the video where Garland says he “won’t comment on any investigations."" https://t.co/QH61R2A40L",2021-10-27 22:56:37+00:00,False,1461,535,6475,56,en,False,Twitter for iPhone,173,196,https://t.co/QH61R2A40L,https://youtu.be/vrEgGrS2oqM,NA,NA,NA,NA,NA,NA,NA,NA
