ScreenName,AuthorID,TweetID,Text,TweetDate,isReply,RetweetCount,ReplyCount,LikeCount,QuoteCount,Language,PossibleSensitive,Source,1stURLStart,1stURLEnd,1stURL,1stURLExp,2ndURLStart,2ndURLEnd,2ndURL,2ndURLExp,3rdURLStart,3rdURLEnd,3rdURL,3rdURLExp
RandPaul,216881337,1469745178038652935,If you want to help those in Kentucky recover from these devastating storms here are some resources. https://t.co/JuQoVeQByQ,2021-12-11 19:05:31+00:00,False,1899,775,4312,95,en,False,Twitter for iPhone,101,124,https://t.co/JuQoVeQByQ,https://wfpl.org/heres-how-you-can-help-tornado-victims/,NA,NA,NA,NA,NA,NA,NA,NA
RandPaul,216881337,1469651645814480899,"Our hearts are broken for all those suffering from last night’s terrible storms .

I and my team will do all we can to assist local and state officials as they lead the immediate response, and will aggressively help families, businesses, and officials access recovery resources.",2021-12-11 12:53:51+00:00,False,1431,5098,13798,430,en,False,Twitter for iPhone,NA,NA,NA,NA,NA,NA,NA,NA,NA,NA,NA,NA
RandPaul,216881337,1469408395035828229,"Inflation up 6.8% over the last 12 months and the CBO estimates Biden's trillion dollar tax-and-spend plan will add $3 trillion to the debt.

Next year would be a good year to take back the Senate and the House and end this nonsense. https://t.co/LdwFz3rcED",2021-12-10 20:47:16+00:00,False,700,684,3150,69,en,False,Twitter for iPhone,234,257,https://t.co/LdwFz3rcED,https://nypost.com/2021/12/10/cbo-finds-spending-plan-would-add-3t-to-deficit/,NA,NA,NA,NA,NA,NA,NA,NA
RandPaul,216881337,1469126623991582720,"Sorry Tony, at the Paul household Christmas (57 strong) the only requirement is having read the Constitution.

Fauci: Families Should Require Vaccination Proof Before Holiday Gatherings - Election Central https://t.co/nBHW4JrsS4",2021-12-10 02:07:36+00:00,False,2394,1959,13173,303,en,False,Twitter for iPhone,205,228,https://t.co/nBHW4JrsS4,https://www.uspresidentialelectionnews.com/2021/12/fauci-families-should-require-vaccination-proof-before-holiday-gatherings/,NA,NA,NA,NA,NA,NA,NA,NA
RandPaul,216881337,1469040753326399488,"""No evidence suggests that SEC football activities have led to COVID-19 outbreaks in the communities hosting the games. This is great news for players, fans and anyone who enjoys outdoor gatherings!"" https://t.co/dSB4W9rwEz",2021-12-09 20:26:23+00:00,False,563,152,3240,39,en,False,Twitter Web App,200,223,https://t.co/dSB4W9rwEz,https://thehill.com/opinion/healthcare/584938-what-college-football-just-taught-us-about-covid-19,NA,NA,NA,NA,NA,NA,NA,NA
RandPaul,216881337,1468988026768531456,Sen. Rand Paul blasts Fauci as omicron cases are reported around US: He 'causes hysteria and creates fear' | Fox News https://t.co/T2sLRi1lU7,2021-12-09 16:56:52+00:00,False,886,475,4552,52,en,False,Twitter for iPhone,118,141,https://t.co/T2sLRi1lU7,https://www.foxnews.com/media/sen-rand-paul-blasts-fauci-as-omicron-cases-are-reported-around-us-he-causes-hysteria-and-creates-fear,NA,NA,NA,NA,NA,NA,NA,NA
RandPaul,216881337,1468962532077436939,"India followed Fauci’s advice to vaccinate people who already had recovered from COVID.  Undoubtedly, thousands of Indians died because their vaccine went instead to someone who already had immunity.  https://t.co/7m13JNOXZt",2021-12-09 15:15:34+00:00,False,360,233,1492,29,en,False,Twitter for iPhone,201,224,https://t.co/7m13JNOXZt,https://www.spectator.co.uk/article/how-the-west-can-help-india,NA,NA,NA,NA,NA,NA,NA,NA
RandPaul,216881337,1468672567657603080,"So it turns out communism may be a bridge to far for some democrats

https://t.co/YnBfu3jLoe",2021-12-08 20:03:21+00:00,False,615,403,4183,46,en,False,Twitter for iPhone,69,92,https://t.co/YnBfu3jLoe,https://www.politico.com/news/2021/12/07/biden-bank-cop-nominee-withdraws-523907,NA,NA,NA,NA,NA,NA,NA,NA
RandPaul,216881337,1468594669294608386,"Tune into @FoxNews in just a moment, I’ll be joining @AmericaNewsroom!",2021-12-08 14:53:48+00:00,False,69,155,982,17,en,False,Twitter for iPhone,NA,NA,NA,NA,NA,NA,NA,NA,NA,NA,NA,NA
RandPaul,216881337,1468584902115442696,"ICYMI: Joined @larry_kudlow on @FoxBusiness last night and talked Russian aggression. Also, turns out Elon Musk and I might have a little more in common: we both think Biden's trillion dollar tax-and-spend plan is awful for our economy. Take a look --&gt; https://t.co/UHBF3saupy",2021-12-08 14:15:00+00:00,False,163,93,968,7,en,False,TweetDeck,256,279,https://t.co/UHBF3saupy,https://rumble.com/vqe22s-dr.-paul-joins-larry-kudlow-on-fox-business.html,NA,NA,NA,NA,NA,NA,NA,NA
RandPaul,216881337,1468554249634201604,"The default solution for big government types like Biden and Fauci is always more rules, more regulation and less of your liberty. https://t.co/64G1jJ2w5C",2021-12-08 12:13:12+00:00,False,1143,509,5732,69,en,False,Twitter for iPhone,131,154,https://t.co/64G1jJ2w5C,https://www.foxnews.com/opinion/biden-fauci-omicron-scientific-decisions-rand-paul,NA,NA,NA,NA,NA,NA,NA,NA
RandPaul,216881337,1468332518424432643,Coming up on #Kudlow on @FoxBusiness. Tune in!,2021-12-07 21:32:07+00:00,False,41,113,502,3,en,False,Twitter for iPhone,NA,NA,NA,NA,NA,NA,NA,NA,NA,NA,NA,NA
RandPaul,216881337,1468258986159968262,"Instead asking big government to breakup big tech, conservatives and libertarians should support competitors like @rumblevideo!  

https://t.co/enMuy6j932",2021-12-07 16:39:55+00:00,False,1044,266,5355,89,en,False,Twitter for iPhone,131,154,https://t.co/enMuy6j932,https://www.washingtontimes.com/news/2021/dec/6/all-americans-should-join-rumbles-free-speech-figh/,NA,NA,NA,NA,NA,NA,NA,NA
RandPaul,216881337,1468248605769314308,"80 years later, the day that would live in infamy hasn’t for a moment lost its significance.

I join all Americans in solemn remembrance of the lives lost on that fateful day and remain committed to honoring their memory and all those who serve our great nation. #PearlHarbor80",2021-12-07 15:58:41+00:00,False,608,184,5611,21,en,False,Twitter for iPhone,NA,NA,NA,NA,NA,NA,NA,NA,NA,NA,NA,NA
RandPaul,216881337,1467926155173011462,"Good news for the doctors and nurses who valiantly took care of COVID patients, got COVID themselves, and who logically decided not to get vaccinated since nature already inoculated them. https://t.co/e2IXJvCVsX",2021-12-06 18:37:22+00:00,False,3298,648,16345,127,en,False,Twitter for iPhone,188,211,https://t.co/e2IXJvCVsX,https://www.foxnews.com/us/federal-judge-blocks-biden-vaccine-mandate-for-health-care-workers-nationwide,NA,NA,NA,NA,NA,NA,NA,NA
RandPaul,216881337,1467866930560258051,To the memory of the officers who gave their lives to keep us safe. https://t.co/kJ5yGpJPCu,2021-12-06 14:42:02+00:00,False,1242,345,5277,69,en,False,Twitter for iPhone,68,91,https://t.co/kJ5yGpJPCu,https://www.breitbart.com/politics/2021/12/05/report-60-police-officers-shot-killed-year-ambush-attacks-skyrocket/,NA,NA,NA,NA,NA,NA,NA,NA
RandPaul,216881337,1467310264152436740,"Long overdue, and a small step toward CNN regaining any kind of credibility… https://t.co/bwOLKrpoCB",2021-12-05 01:50:02+00:00,False,623,1063,7897,95,en,False,Twitter for iPhone,77,100,https://t.co/bwOLKrpoCB,https://twitter.com/washingtonpost/status/1467259094486634501,NA,NA,NA,NA,NA,NA,NA,NA
RandPaul,216881337,1467151067452522497,Congratulations to President Donald Trump on his bestselling new book: Our Journey Together! Incredible sales in the first week! Get your copy now at https://t.co/jcE5nVT3V8 https://t.co/28vHVOq3hr,2021-12-04 15:17:27+00:00,False,4100,4221,26449,303,en,False,Twitter for iPhone,150,173,https://t.co/jcE5nVT3V8,http://45books.com,174,197,https://t.co/28vHVOq3hr,https://twitter.com/RandPaul/status/1467151067452522497/photo/1,NA,NA,NA,NA
RandPaul,216881337,1466589071887712262,People have the right to make their own healthcare decisions. I'm proud to stand with @SenMikeLee and @RogerMarshallMD to oppose President Biden’s unconstitutional vaccine mandates that command working Americans and private businesses to submit upon penalty of loss of livelihood.,2021-12-03 02:04:17+00:00,False,3814,1129,20355,174,en,False,Twitter for iPhone,NA,NA,NA,NA,NA,NA,NA,NA,NA,NA,NA,NA
RandPaul,216881337,1466524995706929156,"Freudian slip? Perhaps, but individual liberty remains at risk as long as Fauci is anywhere near the reins of power.

Biden jokes Fauci is real president as he shares COVID plan https://t.co/bQY5FOW8kG",2021-12-02 21:49:40+00:00,False,498,332,2219,54,en,False,Twitter for iPhone,178,201,https://t.co/bQY5FOW8kG,https://nypost.com/2021/12/02/biden-jokes-fauci-is-real-president-as-he-shares-covid-plan/,NA,NA,NA,NA,NA,NA,NA,NA
RandPaul,216881337,1466517660766814210,Fauci wants to force Americans to be vaccinated as if there is some great resistance to vaccination. Truth is the opposite: 99.9% of ppl age 65-74 have voluntarily chosen to be vaccinated! The mandates are simply about conditioning ppl to submission. https://t.co/yKv03CWMG9,2021-12-02 21:20:31+00:00,False,5313,1239,20684,254,en,False,Twitter for iPhone,251,274,https://t.co/yKv03CWMG9,https://data.cdc.gov/Vaccinations/COVID-19-Vaccination-and-Case-Trends-by-Age-Group-/gxj9-t96f,NA,NA,NA,NA,NA,NA,NA,NA
RandPaul,216881337,1466396291173335048,Joining @MariaBartiromo on @MorningsMaria shortly. Tune in!,2021-12-02 13:18:14+00:00,False,54,123,625,7,en,False,Twitter for iPhone,NA,NA,NA,NA,NA,NA,NA,NA,NA,NA,NA,NA
RandPaul,216881337,1466226505755865089,"Amen!  Next week I will force a vote to stop funding the Saudi starvation blockade of Yemen.

Senate Skeptics are Right: End Missile Sales to Saudi Arabia - The American Conservative https://t.co/eYttOaPB6z",2021-12-02 02:03:34+00:00,False,294,138,2044,21,en,False,Twitter for iPhone,183,206,https://t.co/eYttOaPB6z,https://www.theamericanconservative.com/articles/senate-skeptics-are-right-end-missile-sales-to-saudi-arabia/,NA,NA,NA,NA,NA,NA,NA,NA
RandPaul,216881337,1466124387040563204,Joining @AmericaRpts on @FoxNews shortly! Tune in!,2021-12-01 19:17:47+00:00,False,41,145,515,5,en,False,Twitter for iPhone,NA,NA,NA,NA,NA,NA,NA,NA,NA,NA,NA,NA
RandPaul,216881337,1466112361702559744,"Today, the Supreme Court heard arguments in a case that could overturn Roe vs. Wade.

I stand with the millions of Kentuckians and those across our nation who support the right to life for the unborn. https://t.co/CBxKMhxqYA",2021-12-01 18:30:00+00:00,False,517,354,4310,24,en,False,TweetDeck,201,224,https://t.co/CBxKMhxqYA,https://www.foxnews.com/live-news/supreme-court-mississippi-abortion-roe,NA,NA,NA,NA,NA,NA,NA,NA
RandPaul,216881337,1465840943689568261,"This is an important first step in ending the Biden Administration's unconstitutional mandate on private businesses. Thank you @DanielCameronAG for being an advocate for liberty in the courts! 
https://t.co/Pw1BemjM21",2021-12-01 00:31:29+00:00,False,915,223,5146,40,en,False,Twitter for iPhone,194,217,https://t.co/Pw1BemjM21,https://www.kentucky.com/news/politics-government/article256230412.html,NA,NA,NA,NA,NA,NA,NA,NA
RandPaul,216881337,1465829281418948608,"Today on #GivingTuesday @KelleyAshbyPaul and I want to highlight a great organization, @hopehousebg. Learn more here: https://t.co/kwsaT3wlKg",2021-11-30 23:45:09+00:00,False,33,31,281,2,en,False,Twitter for iPhone,118,141,https://t.co/kwsaT3wlKg,https://www.hopehousebg.com,NA,NA,NA,NA,NA,NA,NA,NA
RandPaul,216881337,1465796277388591108,"Congratulations to Elle Smith on being crowned Miss USA! You make our commonwealth proud. My family, my staff, and I can't wait to cheer you on as you compete for Miss Universe! https://t.co/ImeRHgNFFE",2021-11-30 21:34:00+00:00,False,121,49,1226,7,en,False,TweetDeck,178,201,https://t.co/ImeRHgNFFE,https://www.whas11.com/article/news/local/miss-usa-2021-elle-smith-miss-kentucky-whas-reporter-nabj-uk-grad-miss-universe/417-10dc85d8-4e2c-45ab-acc8-d75b9b0895f5,NA,NA,NA,NA,NA,NA,NA,NA
RandPaul,216881337,1465741575309475845,"""our fear as economists is that certain urban areas in the US could be stuck in a cycle of fear, with each new variant leading to more draconian measures.""
https://t.co/07xEP6eCFT",2021-11-30 17:56:38+00:00,False,109,101,619,9,en,False,Twitter for iPhone,156,179,https://t.co/07xEP6eCFT,https://www.ftportfolios.com/retail/blogs/Economics/index.aspx,NA,NA,NA,NA,NA,NA,NA,NA
RandPaul,216881337,1465722149218488321,"Federal judge blocks Biden vaccine mandate as “arbitrary and capricious.” Ruling states that “Congress did not clearly authorize [Medicare] to enact this politically and economically vast, federalism-altering, and boundary-pushing mandate…
https://t.co/giE84SySS6",2021-11-30 16:39:26+00:00,False,1289,202,5127,58,en,False,Twitter for iPhone,240,263,https://t.co/giE84SySS6,https://www.washingtonpost.com/politics/2021/11/30/biden-vaccine-mandate-judge-block/,NA,NA,NA,NA,NA,NA,NA,NA
RandPaul,216881337,1465704091405799432,"And then they came for the parents…

https://t.co/Yn5Gf2cB7P",2021-11-30 15:27:41+00:00,False,788,306,1879,97,en,False,Twitter for iPhone,37,60,https://t.co/Yn5Gf2cB7P,https://www.breitbart.com/politics/2021/11/26/armed-agents-in-texas-school-district-arrest-concerned-parents-in-their-own-homes/,NA,NA,NA,NA,NA,NA,NA,NA
