ScreenName,AuthorID,TweetID,Text,TweetDate,isReply,RetweetCount,ReplyCount,LikeCount,QuoteCount,Language,PossibleSensitive,Source,1stURLStart,1stURLEnd,1stURL,1stURLExp,2ndURLStart,2ndURLEnd,2ndURL,2ndURLExp,3rdURLStart,3rdURLEnd,3rdURL,3rdURLExp
RandPaul,216881337,1474468278105948163,"“Thinking that everyone must be vaccinated is as scientifically flawed as thinking that nobody should. ” Martin Kulldorf

Vaccines Save Lives ⋆ Brownstone Institute https://t.co/RD8v35cxZK",2021-12-24 19:53:26+00:00,False,496,316,2352,27,en,False,Twitter for iPad,165,188,https://t.co/RD8v35cxZK,https://brownstone.org/articles/vaccines-save-lives/,NA,NA,NA,NA,NA,NA,NA,NA
RandPaul,216881337,1474177352427085830,Here's the wrap up of #Festivus 2021. I hope you all have a merry Christmas and enjoy the holidays. https://t.co/UqSWrycgKx,2021-12-24 00:37:24+00:00,False,410,207,2838,38,en,False,Twitter Web App,100,123,https://t.co/UqSWrycgKx,https://twitter.com/i/events/1474175392663498771,NA,NA,NA,NA,NA,NA,NA,NA
RandPaul,216881337,1474101158209859593,Happy #Festivus and Merry Christmas everyone.,2021-12-23 19:34:38+00:00,True,164,120,1870,4,en,False,Twitter Web App,NA,NA,NA,NA,NA,NA,NA,NA,NA,NA,NA,NA
RandPaul,216881337,1474101156834123780,"Ways you can help KY tornado victims:
https://t.co/cp3g203bh2

https://t.co/Kv7YLF0tHJ

https://t.co/JuQoVeQByQ",2021-12-23 19:34:37+00:00,True,223,52,1058,9,en,False,Twitter Web App,38,61,https://t.co/cp3g203bh2,https://www.kentucky.com/news/state/kentucky/article256557261.html,63,86,https://t.co/Kv7YLF0tHJ,https://relief.randpaul.com/,63,86,https://t.co/Kv7YLF0tHJ,https://relief.randpaul.com/
RandPaul,216881337,1474101155177369600,"Look around your neighborhood or community and do what you can. If you’re so inclined, you can help those impacted by the tornadoes in Kentucky. I’ll post the links again in the next tweet.",2021-12-23 19:34:37+00:00,True,79,12,922,1,en,False,Twitter Web App,NA,NA,NA,NA,NA,NA,NA,NA,NA,NA,NA,NA
RandPaul,216881337,1474101154112024586,I hope we all take some time this Holiday season to be grateful for the good in our lives and try to lend a hand to others where we can.,2021-12-23 19:34:37+00:00,True,104,20,1072,3,en,False,Twitter Web App,NA,NA,NA,NA,NA,NA,NA,NA,NA,NA,NA,NA
RandPaul,216881337,1474101153004769290,"2021 has brought a lot of good to the world for many, but a lot of tough times for many also, whether illness, job loss or natural disasters like the one that hit my home state of Kentucky recently.",2021-12-23 19:34:37+00:00,True,71,13,877,2,en,False,Twitter Web App,NA,NA,NA,NA,NA,NA,NA,NA,NA,NA,NA,NA
RandPaul,216881337,1474101151939317762,"Even though this grand holiday of Festivus lets me get a lot out, I don’t want to end there this year.",2021-12-23 19:34:36+00:00,True,67,8,938,0,en,False,Twitter Web App,NA,NA,NA,NA,NA,NA,NA,NA,NA,NA,NA,NA
RandPaul,216881337,1474101150874050561,"1. Improper CARES Act unemployment insurance payments $36,000,000,000
2. COVID relief grant for NYC to display art projects across the city $25,000,000
3. Tax Credit incentivizing CA residents to uninstall fireplaces $2,100,000
4. Pigeons playing slot machines (NIH) $465,339",2021-12-23 19:34:36+00:00,True,516,72,1943,75,en,False,Twitter Web App,NA,NA,NA,NA,NA,NA,NA,NA,NA,NA,NA,NA
RandPaul,216881337,1474101149368295434,"It’s beyond anything we have seen before - ever. And they’re not done trying. Now, you’re seeing the first results with skyrocketing costs of food, gas, etc. There are even bigger problems to come if we don’t stop this and change course. https://t.co/KrLdGiUnta",2021-12-23 19:34:36+00:00,True,240,27,1233,7,en,False,Twitter Web App,238,261,https://t.co/KrLdGiUnta,https://www.foxnews.com/politics/sen-rand-paul-releases-annual-festivus-report-which-focuses-on-what-he-sees-as-wasteful-spending,NA,NA,NA,NA,NA,NA,NA,NA
RandPaul,216881337,1474101148277788677,"In the last 18 months, Congress and the White House have tried to spend nearly ten TRILLION dollars we don’t have. That’s the mother of all grievances right there.",2021-12-23 19:34:35+00:00,True,485,58,2643,16,en,False,Twitter Web App,NA,NA,NA,NA,NA,NA,NA,NA,NA,NA,NA,NA
RandPaul,216881337,1474101147254374412,"Let’s get back to your friendly neighborhood socialists and tyrants in DC, shall we?",2021-12-23 19:34:35+00:00,True,89,26,1117,0,en,False,Twitter Web App,NA,NA,NA,NA,NA,NA,NA,NA,NA,NA,NA,NA
RandPaul,216881337,1474101145744384006,I’m back with more #Festivus  grievances!,2021-12-23 19:34:35+00:00,False,609,182,4541,62,en,False,Twitter Web App,NA,NA,NA,NA,NA,NA,NA,NA,NA,NA,NA,NA
RandPaul,216881337,1474066499635666948,"I’ve got a few more things to say, but I’ll be back later. We need to talk more about Congress among other things. Go finish your Christmas shopping and check back here later. #Festivus",2021-12-23 17:16:55+00:00,True,221,116,2686,17,en,False,Twitter Web App,NA,NA,NA,NA,NA,NA,NA,NA,NA,NA,NA,NA
RandPaul,216881337,1474066498427699201,"1. Study verified that hearing bad news decreases happiness levels (NIA) $1,300,000
2. Getting high schoolers excited about being airplane pilots (FAA) $5,000,000
3. • Telling people to not burn their trash (USAID) $11,300,000",2021-12-23 17:16:54+00:00,True,542,74,2837,36,en,False,Twitter Web App,NA,NA,NA,NA,NA,NA,NA,NA,NA,NA,NA,NA
RandPaul,216881337,1474066497291104257,"The war on cannabis is among the many dumb things Congress does, but it’s by no means the dumbest. Every year hundreds of billions of your dollars are wasted. Let’s look at a few more of the worst examples of that.",2021-12-23 17:16:54+00:00,True,252,48,1994,13,en,False,Twitter Web App,NA,NA,NA,NA,NA,NA,NA,NA,NA,NA,NA,NA
RandPaul,216881337,1474066495823089664,"It probably doesn’t help that the two Democrat leaders are almost as old as the movie Reefer Madness, and clearly gave it two thumbs up when they watched it.",2021-12-23 17:16:54+00:00,True,266,44,2168,22,en,False,Twitter Web App,NA,NA,NA,NA,NA,NA,NA,NA,NA,NA,NA,NA
RandPaul,216881337,1474066494522904577,"I would go much further and end the federal war on a plant entirely, but at LEAST let legal business operate as legal business.",2021-12-23 17:16:53+00:00,True,204,24,2076,10,en,False,Twitter Web App,NA,NA,NA,NA,NA,NA,NA,NA,NA,NA,NA,NA
RandPaul,216881337,1474066493314940936,"Democrats control the House, Senate and White House and we still can’t get cannabis banking reform bills passed. This should be a complete no brainer, as so many states have legalized now and we need business to operate.",2021-12-23 17:16:53+00:00,True,352,54,2375,38,en,False,Twitter Web App,NA,NA,NA,NA,NA,NA,NA,NA,NA,NA,NA,NA
RandPaul,216881337,1474066492178276359,My colleagues in Congress are deserving of some grievances too so let’s move over to them.,2021-12-23 17:16:53+00:00,True,108,12,1328,0,en,False,Twitter Web App,NA,NA,NA,NA,NA,NA,NA,NA,NA,NA,NA,NA
RandPaul,216881337,1474066490806743043,Why are we all still on it? Good question. I’m starting to do something about it by posting on https://t.co/5qWtW3JxZf and Rumble. More to come on that in the new year.,2021-12-23 17:16:52+00:00,True,187,22,1552,1,en,False,Twitter Web App,95,118,https://t.co/5qWtW3JxZf,http://Libertytree.com,NA,NA,NA,NA,NA,NA,NA,NA
RandPaul,216881337,1474066489691025408,"Big tech is out of control, in league with the government, and basically a liberal government propaganda machine.",2021-12-23 17:16:52+00:00,True,418,58,2816,20,en,False,Twitter Web App,NA,NA,NA,NA,NA,NA,NA,NA,NA,NA,NA,NA
RandPaul,216881337,1474066488487260165,"Speaking of big tech censorship - this year I’ve been censored for:
- not naming a whistleblower
- telling the truth about masks
- telling the truth about natural immunity",2021-12-23 17:16:52+00:00,True,487,61,3168,10,en,False,Twitter Web App,NA,NA,NA,NA,NA,NA,NA,NA,NA,NA,NA,NA
RandPaul,216881337,1474066487627427847,It’s a good thing that ad was 12 years ago. If you ran an ad against a government health policy now YouTube would take it down.,2021-12-23 17:16:52+00:00,True,160,19,1927,1,en,False,Twitter Web App,NA,NA,NA,NA,NA,NA,NA,NA,NA,NA,NA,NA
RandPaul,216881337,1474066486167851023,President Biden thankfully saw his Build Back Better plan show down last week by Republicans and Senator Manchin. Apparently everyone forgot Manchin’s best campaign ad. https://t.co/qwP00W6R8f,2021-12-23 17:16:51+00:00,True,231,37,1870,10,en,False,Twitter Web App,169,192,https://t.co/qwP00W6R8f,https://www.youtube.com/watch?v=xIJORBRpOPM,NA,NA,NA,NA,NA,NA,NA,NA
RandPaul,216881337,1474066484016123908,President Biden also had some dog problems this year. The story was his dog got booted for bad behavior. I hope someone checked Fauci’s trunk on the way out that day.,2021-12-23 17:16:51+00:00,True,537,110,3577,95,en,False,Twitter Web App,NA,NA,NA,NA,NA,NA,NA,NA,NA,NA,NA,NA
RandPaul,216881337,1474066482543874051,"That’s an interesting tactic, but thankfully I don’t think the President remembers he said it.",2021-12-23 17:16:50+00:00,True,212,46,2798,15,en,False,Twitter Web App,NA,NA,NA,NA,NA,NA,NA,NA,NA,NA,NA,NA
RandPaul,216881337,1474066480853659656,"After Fauci, next on my naughty list is our President. President Biden is now spreading his own version of holiday cheer by telling us all we are going to die. https://t.co/WSbRLjaZhg",2021-12-23 17:16:50+00:00,True,529,124,3442,33,en,False,Twitter Web App,160,183,https://t.co/WSbRLjaZhg,https://twitter.com/RandPaul/status/1474066480853659656/photo/1,NA,NA,NA,NA,NA,NA,NA,NA
RandPaul,216881337,1474066477510766594,I’m baaaaaack and I’ve been checking some of your grievances out on Twitter - some of you are seriously on the naughty list this year. #Festivus,2021-12-23 17:16:49+00:00,False,1342,718,13849,177,en,False,Twitter Web App,NA,NA,NA,NA,NA,NA,NA,NA,NA,NA,NA,NA
RandPaul,216881337,1474029029804097536,"I’ll be back with more grievances, more waste, more holiday cheer in a little while. In the meantime, I hope you all are airing your grievances as well. Let it out! #Festivus",2021-12-23 14:48:01+00:00,True,393,202,3700,20,en,False,Twitter Web App,NA,NA,NA,NA,NA,NA,NA,NA,NA,NA,NA,NA
RandPaul,216881337,1474029028227129351,"1. Foreign countries use our aircraft for free for 4 years (DOD) $773,000,000
2. US bought Afghanistan planes that were later thrown away (DOD) $549,000,000
3. Funding Green Energy programs in Africa (State) $179,000,000
4. • Fattening eels for human consumption (FDA) $337,500",2021-12-23 14:48:01+00:00,True,1179,117,4220,85,en,False,Twitter Web App,NA,NA,NA,NA,NA,NA,NA,NA,NA,NA,NA,NA
RandPaul,216881337,1474029026188664842,That’s why every year I compile a Festivus waste report. If you want to read it all you’ll have to go to my official senate website or social media. But I’ll tell you about some of my favorites here. https://t.co/0ByVgmpo5q,2021-12-23 14:48:00+00:00,True,515,41,1967,28,en,False,Twitter Web App,200,223,https://t.co/0ByVgmpo5q,https://www.dailywire.com/news/rand-pauls-2021-festivus-report-uncovers-52-billion-of-government-waste,NA,NA,NA,NA,NA,NA,NA,NA
RandPaul,216881337,1474029024762597379,Of course Fauci is far in the lead for government officials do g dumb or evil things - but he’s far from the only one.,2021-12-23 14:48:00+00:00,True,162,35,1611,3,en,False,Twitter Web App,NA,NA,NA,NA,NA,NA,NA,NA,NA,NA,NA,NA
RandPaul,216881337,1474029023068045331,"Seriously, how unbelievable a villain is it who funded fain of function research in China, lied to the public how to protect themselves against Covid, and tortured puppies? I would shut this off if it was a movie, it’s too ridiculous",2021-12-23 14:47:59+00:00,True,498,78,2643,20,en,False,Twitter Web App,NA,NA,NA,NA,NA,NA,NA,NA,NA,NA,NA,NA
RandPaul,216881337,1474029021084143617,of course Fauci didn’t limit himself to Covid this year. He also funded torturing puppies and monkeys. And no I’m not kidding. https://t.co/CB6ErHzOVk,2021-12-23 14:47:59+00:00,True,950,107,2897,54,en,False,Twitter Web App,127,150,https://t.co/CB6ErHzOVk,https://thehill.com/changing-america/well-being/medical-advances/578086-bipartisan-legislators-demand-answers-from-fauci,NA,NA,NA,NA,NA,NA,NA,NA
RandPaul,216881337,1474029019704213515,"I’ll give Fauci one thing - he’s like a bad quarterback after an interception. Absolutely no memory of failure. Just get back out there and do it again. But instead of losing a game, he’s cost a lot of lives and fortunes this past 18 months.",2021-12-23 14:47:59+00:00,True,710,120,3596,57,en,False,Twitter Web App,NA,NA,NA,NA,NA,NA,NA,NA,NA,NA,NA,NA
RandPaul,216881337,1474029018383007747,Damn that guy is wrong a LOT...,2021-12-23 14:47:58+00:00,True,136,34,1789,5,en,False,Twitter Web App,NA,NA,NA,NA,NA,NA,NA,NA,NA,NA,NA,NA
RandPaul,216881337,1474029016512348165,"I would air my grievance at Fauci again but I try not to be in reruns. https://t.co/dnNEqHcRF2

https://t.co/T2sLRi1lU7

https://t.co/8eKhSVVOi2",2021-12-23 14:47:58+00:00,True,185,30,1479,2,en,False,Twitter Web App,71,94,https://t.co/dnNEqHcRF2,https://www.facebook.com/watch/?ref=search&v=330956271776341&external_log_id=cd041b60-4f2e-4dae-8c97-dccfcfefac21&q=rand%20paul%20fauci,96,119,https://t.co/T2sLRi1lU7,https://www.foxnews.com/media/sen-rand-paul-blasts-fauci-as-omicron-cases-are-reported-around-us-he-causes-hysteria-and-creates-fear,96,119,https://t.co/T2sLRi1lU7,https://www.foxnews.com/media/sen-rand-paul-blasts-fauci-as-omicron-cases-are-reported-around-us-he-causes-hysteria-and-creates-fear
RandPaul,216881337,1474029015090577409,"Most of the ridiculous rules I will blame squarely on our public health officials who should know better, particularly my good friend Anthony Fauci.",2021-12-23 14:47:57+00:00,True,225,32,1781,4,en,False,Twitter Web App,NA,NA,NA,NA,NA,NA,NA,NA,NA,NA,NA,NA
RandPaul,216881337,1474029013555425302,"It was never clear to me if they thought Covid gathered at entrances, or if they thought it only traveled 5 feet and above, so once you sat down you were all clear.",2021-12-23 14:47:57+00:00,True,166,21,1587,5,en,False,Twitter Web App,NA,NA,NA,NA,NA,NA,NA,NA,NA,NA,NA,NA
RandPaul,216881337,1474029012137791488,"Honestly, I’m torn on whether it’s worse that these tyrants flouted their own rules or if it’s worse if they thought they mattered. “hey you, wear some cotton underwear on your face from the host table to your dinner table.”That’ll fix everything.",2021-12-23 14:47:57+00:00,True,336,38,2087,8,en,False,Twitter Web App,NA,NA,NA,NA,NA,NA,NA,NA,NA,NA,NA,NA
RandPaul,216881337,1474029010317361154,Washington DC never likes to take a back seat to any petty tyrant. So of course their regulations were almost as bad and their mayor almost as big a hypocrite https://t.co/EaO4Yfk1uL,2021-12-23 14:47:56+00:00,True,188,18,1373,4,en,False,Twitter Web App,159,182,https://t.co/EaO4Yfk1uL,https://www.foxnews.com/politics/dc-mayor-bowser-mask-list-covid-hypocrites,NA,NA,NA,NA,NA,NA,NA,NA
RandPaul,216881337,1474029006823559182,"And by you people, I mostly mean the petty tyrants who run your local, state and federal governments. 2021 was a banner year for being a petty tyrant, with them all literally tripping over each other for the dumbest covid lockdown or mandate idea.",2021-12-23 14:47:56+00:00,True,792,231,5395,67,en,False,Twitter Web App,NA,NA,NA,NA,NA,NA,NA,NA,NA,NA,NA,NA
RandPaul,216881337,1474029005292642313,Festivus of course is highlighted by the airing of grievances. I’ve definitely got a lot of problems with you people.,2021-12-23 14:47:55+00:00,True,310,96,3266,38,en,False,Twitter Web App,NA,NA,NA,NA,NA,NA,NA,NA,NA,NA,NA,NA
RandPaul,216881337,1474029003862335492,Good morning everyone and welcome to everyone’s favorite holiday - Festivus!,2021-12-23 14:47:55+00:00,False,2323,700,19263,385,en,False,Twitter Web App,NA,NA,NA,NA,NA,NA,NA,NA,NA,NA,NA,NA
RandPaul,216881337,1473766054178574336,A LOT of problems - you’ll hear about them tomorrow #Festivus https://t.co/9gv91sYcyP,2021-12-22 21:23:03+00:00,False,1631,594,13385,167,en,False,Twitter for iPhone,62,85,https://t.co/9gv91sYcyP,https://twitter.com/RandPaul/status/1473766054178574336/photo/1,NA,NA,NA,NA,NA,NA,NA,NA
RandPaul,216881337,1473678612889022467,"…another $20,000 donation to HOTEL INC Dir. of Operations Alan Casada.

These organizations and many others are doing important work to help people recover in WKY. I’m proud to support them and will continue to do everything I can to help all KYians affected by this tragedy. https://t.co/VstazuhatS",2021-12-22 15:35:35+00:00,True,55,42,778,0,en,False,Twitter for iPhone,276,299,https://t.co/VstazuhatS,https://twitter.com/RandPaul/status/1473678612889022467/photo/1,NA,NA,NA,NA,NA,NA,NA,NA
RandPaul,216881337,1473678605330886666,"Last week, my campaign announced that we were donating $100,000 to Kentucky non-profits that are on the frontlines following the disastrous tornados in Western Kentucky.

I was proud to present a $20,000 donation to @UnitedWaySOKY CEO Debbie Hill and… https://t.co/kjdRVZMyk5",2021-12-22 15:35:33+00:00,False,206,141,2451,9,en,False,Twitter for iPhone,252,275,https://t.co/kjdRVZMyk5,https://twitter.com/RandPaul/status/1473678605330886666/photo/1,NA,NA,NA,NA,NA,NA,NA,NA
RandPaul,216881337,1473313435194638336,"In the midst of this tragedy, what amazes me is the good nature of Kentuckians helping one another and the overwhelming sense of community. https://t.co/4OVc0y6akl",2021-12-21 15:24:30+00:00,False,160,234,1857,10,en,False,Twitter for iPhone,140,163,https://t.co/4OVc0y6akl,https://www.westkentuckystar.com/News/Local-Regional/OP-ED-Update-on-disaster-relief,NA,NA,NA,NA,NA,NA,NA,NA
RandPaul,216881337,1473301794784743429,Even CNN talking heads now admit that cloth masks are “facial decoration.”  Wonder if YouTube will censor CNN? https://t.co/ysTLE55gSe,2021-12-21 14:38:15+00:00,False,4854,793,15779,259,en,False,Twitter for iPhone,111,134,https://t.co/ysTLE55gSe,https://twitter.com/TheEliKlein/status/1473080868734443525,NA,NA,NA,NA,NA,NA,NA,NA
RandPaul,216881337,1473020548548603911,“The science” indicates lockdowns didn’t change the trajectory of the pandemic. Now left wing ‘science deniers’ are insisting on another lockdown. Insane! https://t.co/B3VpJR0KsX,2021-12-20 20:00:40+00:00,False,2086,576,7583,87,en,False,Twitter for iPhone,155,178,https://t.co/B3VpJR0KsX,https://www.wsj.com/articles/lockdown-science-pandemic-imperial-college-london-quarantine-social-distance-covid-fauci-omicron-11639930605,NA,NA,NA,NA,NA,NA,NA,NA
RandPaul,216881337,1472258665293955076,"With a self-contained, professional mobile kitchen, and with dozens of staff and volunteers, Mercy Chefs provides 1500 meals a day to displaced KY residents and relief workers. Thank you for your help and hard work! You can support their efforts here:  https://t.co/ccpwUz6jnV https://t.co/Lzz0Fx9tmf",2021-12-18 17:33:13+00:00,False,352,285,2448,19,en,False,Twitter for iPhone,253,276,https://t.co/ccpwUz6jnV,https://mercychefs.com/donation/,277,300,https://t.co/Lzz0Fx9tmf,https://twitter.com/RandPaul/status/1472258665293955076/photo/1,277,300,https://t.co/Lzz0Fx9tmf,https://twitter.com/RandPaul/status/1472258665293955076/photo/1
RandPaul,216881337,1471542057512669189,"What if masks don’t add to your safety but are merely an act of submission?

https://t.co/SIrrleocU0",2021-12-16 18:05:41+00:00,False,4851,2318,20258,417,en,False,Twitter Web App,77,100,https://t.co/SIrrleocU0,https://www.cnn.com/2021/12/15/business/airline-ceos-question-masks-on-plane-rule/index.html,NA,NA,NA,NA,NA,NA,NA,NA
RandPaul,216881337,1471497186605092875,"Kentuckians feeding Kentuckians. #KentuckyStrong 

https://t.co/Kg5mwoVyrr",2021-12-16 15:07:23+00:00,False,195,272,1411,13,en,False,Twitter for iPhone,51,74,https://t.co/Kg5mwoVyrr,https://www.foxnews.com/us/food-truck-owner-tornado-free-meals-first-responders-victims,NA,NA,NA,NA,NA,NA,NA,NA
RandPaul,216881337,1471464597190324225,Now that’s just funny. https://t.co/X3rIaYHErP,2021-12-16 12:57:53+00:00,False,1014,508,6639,45,en,False,Twitter for iPhone,23,46,https://t.co/X3rIaYHErP,https://twitter.com/SenatorTimScott/status/1471186545088544777,NA,NA,NA,NA,NA,NA,NA,NA
RandPaul,216881337,1471288539535003652,"Pastor Cauley and Relevant Church real Kentucky heroes! #KentuckyStrong

You can contribute here: https://t.co/wph3Rw3PQQ https://t.co/cYPUMkTAbl",2021-12-16 01:18:17+00:00,False,61,171,344,4,en,False,Twitter for iPhone,98,121,https://t.co/wph3Rw3PQQ,http://wearerelevant.churchcenter.com/giving/to/mayfield-tornado-relief,122,145,https://t.co/cYPUMkTAbl,https://video.foxnews.com/v/6286966626001/,NA,NA,NA,NA
RandPaul,216881337,1471273843306160134,"Whoops! Cloth masks don’t really work?  Someone should inform the censors at YouTube. “The best available evidence [randomized controlled studies have] largely failed to demonstrate mask effectiveness, particularly of cloth masks...”

https://t.co/OQf2GYqAJM",2021-12-16 00:19:53+00:00,False,4320,931,14471,249,en,False,Twitter for iPhone,235,258,https://t.co/OQf2GYqAJM,https://www.cato.org/sites/cato.org/files/2021-12/regulation-how-effective-are-cloth-face-masks.pdf,NA,NA,NA,NA,NA,NA,NA,NA
RandPaul,216881337,1471200526192758795,"""Our campaign has made the decision to give $100,000 to local charities in Mayfield, in Princeton, Dawson Springs, Bowling Green, and across Western Kentucky to try to do what we can to help."" https://t.co/scuk3S9PTt",2021-12-15 19:28:33+00:00,False,319,474,2623,46,en,False,TweetDeck,193,216,https://t.co/scuk3S9PTt,https://twitter.com/RandPaul/status/1471200526192758795/video/1,NA,NA,NA,NA,NA,NA,NA,NA
RandPaul,216881337,1470879883349925902,"No words can adequately describe this scene. #KentuckyStrong 
https://t.co/atEDyw04gx",2021-12-14 22:14:26+00:00,False,184,425,1338,11,en,False,Twitter for iPhone,62,85,https://t.co/atEDyw04gx,https://www.newsobserver.com/news/nation-world/national/article256586146.html,NA,NA,NA,NA,NA,NA,NA,NA
RandPaul,216881337,1470864925488787464,"During this tragic time, it's more important than ever that you know what's available to you. Whether you're in need of assistance or are blessed to offer assistance yourself, please check out the following resources to help Western Kentuckians: https://t.co/Kv7YLF0tHJ",2021-12-14 21:15:00+00:00,False,169,321,603,14,en,False,TweetDeck,246,269,https://t.co/Kv7YLF0tHJ,https://relief.randpaul.com/,NA,NA,NA,NA,NA,NA,NA,NA
RandPaul,216881337,1470851579620343811,"Thanks to Thorntons for helping the tornado victims!
https://t.co/066XBpPD4w",2021-12-14 20:21:58+00:00,False,92,109,687,3,en,False,Twitter for iPhone,53,76,https://t.co/066XBpPD4w,https://www.tristatehomepage.com/news/top-stories/thorntons-pledging-to-raise-up-to-100000-in-disaster-aid/,NA,NA,NA,NA,NA,NA,NA,NA
RandPaul,216881337,1470767458743164932,"Who knew facebook ‘fact’ checks are simply opinion. That’s what facebook lawyers are now arguing.

https://t.co/jdCnFQ6ldQ",2021-12-14 14:47:42+00:00,False,1817,788,6166,101,en,False,Twitter for iPhone,99,122,https://t.co/jdCnFQ6ldQ,https://nypost.com/2021/12/13/facebook-bizarrely-claims-its-misquote-is-opinion/,NA,NA,NA,NA,NA,NA,NA,NA
RandPaul,216881337,1470563891012845570,We're all in this together and I'm going to do everything I can to help Western Kentucky recover. https://t.co/omnu8NvUfH,2021-12-14 01:18:48+00:00,False,618,1375,5723,74,en,False,Twitter Web App,98,121,https://t.co/omnu8NvUfH,https://www.wbko.com/2021/12/14/rand-pauls-campaign-donates-100000-tornado-relief/,NA,NA,NA,NA,NA,NA,NA,NA
RandPaul,216881337,1470494476514873350,"Thank you to @Lowes 

My staff contacted them this weekend, and they stepped up immediately with chainsaws and supplies — and then they went even further with this huge donation today.  Kentucky is very thankful. https://t.co/gkxClVR4Mz",2021-12-13 20:42:58+00:00,False,671,573,5436,44,en,False,Twitter for iPhone,213,236,https://t.co/gkxClVR4Mz,https://twitter.com/Lowes/status/1470405346892079108,NA,NA,NA,NA,NA,NA,NA,NA
RandPaul,216881337,1470140222864252936,The United Way of Southern Kentucky has set up a platform to help Kentuckians who are in need after the devastating tornados. Please visit to see how you can help:  https://t.co/83aGbEzXHn,2021-12-12 21:15:17+00:00,False,244,604,852,15,en,False,Twitter for iPhone,165,188,https://t.co/83aGbEzXHn,https://uwsk.org,NA,NA,NA,NA,NA,NA,NA,NA
RandPaul,216881337,1469833895524945922,This afternoon I joined a call w/ FEMA Director Criswell to help coordinate relief for the Commonwealth. FEMA has committed supplies &amp; resources to assist in the ongoing efforts to save lives. I look forward to Director Criswell’s visit &amp; will continue to aid fellow Kentuckians.,2021-12-12 00:58:03+00:00,False,646,4250,6350,291,en,False,Twitter for iPhone,NA,NA,NA,NA,NA,NA,NA,NA,NA,NA,NA,NA
RandPaul,216881337,1469804823671365636,Here are some resources for those affected by the devastating storms in Kentucky and for those who want to help.   https://t.co/Kv7YLF0tHJ,2021-12-11 23:02:32+00:00,False,720,1122,2114,72,en,False,Twitter for iPhone,115,138,https://t.co/Kv7YLF0tHJ,https://relief.randpaul.com/,NA,NA,NA,NA,NA,NA,NA,NA
RandPaul,216881337,1469775227630596100,Here’s a list of shelters and donation sites in the area following the devastating storms. https://t.co/0HYdcz5A3O,2021-12-11 21:04:56+00:00,True,308,205,816,17,en,False,Twitter for iPhone,91,114,https://t.co/0HYdcz5A3O,https://www.paducahsun.com/news/here-s-a-list-of-shelters-and-donation-sites-in-the-area-following-the-devastating/article_bbf9804e-5aba-11ec-bb11-df3d7a38a9dd.html,NA,NA,NA,NA,NA,NA,NA,NA
RandPaul,216881337,1469746275474157574,More ways to help Kentuckians affected by the storms. https://t.co/TvhapEijQy,2021-12-11 19:09:53+00:00,True,331,225,1106,14,en,False,Twitter for iPhone,54,77,https://t.co/TvhapEijQy,https://www.wlky.com/article/want-to-help-western-kentucky-red-cross-sets-up-online-donations-for-victims-of-tornado-outbreak/38491592,NA,NA,NA,NA,NA,NA,NA,NA
