ScreenName,AuthorID,TweetID,Text,TweetDate,isReply,RetweetCount,ReplyCount,LikeCount,QuoteCount,Language,PossibleSensitive,Source,1stURLStart,1stURLEnd,1stURL,1stURLExp,2ndURLStart,2ndURLEnd,2ndURL,2ndURLExp,3rdURLStart,3rdURLEnd,3rdURL,3rdURLExp
RandPaul,216881337,1453103559692767242,"If You’re Aghast at What Fauci Does to Dogs, You Should See What the Government Does to People | Hannah Cox https://t.co/ya2Us0D3T2",2021-10-26 20:57:40+00:00,False,4796,686,15979,186,en,False,Twitter for iPhone,108,131,https://t.co/ya2Us0D3T2,https://hannahdcox.com/2053/2021/10/26/if-youre-aghast-at-what-fauci-does-to-dogs-you-should-see-what-the-government-does-to-people/,NA,NA,NA,NA,NA,NA,NA,NA
RandPaul,216881337,1453074791003525125,Take Fauci's lying more seriously | Washington Examiner https://t.co/F5jCr3MLzW,2021-10-26 19:03:21+00:00,False,2722,539,11542,83,en,False,Twitter for iPhone,56,79,https://t.co/F5jCr3MLzW,https://www.washingtonexaminer.com/take-faucis-lying-more-seriously,NA,NA,NA,NA,NA,NA,NA,NA
RandPaul,216881337,1453009212775309320,Joining @AmericaNewsroom on @FoxNews shortly- tune in!,2021-10-26 14:42:46+00:00,False,74,145,964,6,en,False,Twitter for iPhone,NA,NA,NA,NA,NA,NA,NA,NA,NA,NA,NA,NA
RandPaul,216881337,1452784510656040963,"It was my pleasure to join @AFCYRs tonight to discuss the dangers of socialism, the need to protect the future of the GOP, and the current events happening with Fauci’s NIH. Thank you for your support and your dedication to liberty. https://t.co/Z7zLvBfj2n",2021-10-25 23:49:53+00:00,False,421,263,3311,23,en,False,Twitter for iPhone,233,256,https://t.co/Z7zLvBfj2n,https://twitter.com/RandPaul/status/1452784510656040963/photo/1,233,256,https://t.co/Z7zLvBfj2n,https://twitter.com/RandPaul/status/1452784510656040963/photo/1,NA,NA,NA,NA
RandPaul,216881337,1452735102035931138,"Dr. Fauci’s division at the National Institutes of Health @NIH wasted over $424,000 on deadly and unnecessary experiments on beagles. Thank you @WhiteCoatWaste for the expose! #BeagleGate #PaulsPups
https://t.co/o9MMBI3H7U",2021-10-25 20:33:33+00:00,False,3948,897,8953,415,en,False,Twitter for iPhone,199,222,https://t.co/o9MMBI3H7U,https://blog.whitecoatwaste.org/2021/07/30/fauci-funding-wasteful-deadly-dog-tests/,NA,NA,NA,NA,NA,NA,NA,NA
RandPaul,216881337,1452710102947991555,"Hmm…So you can take any unknown bat virus and recombine it with the back bone of a known coronavirus and it doesn’t qualify as gain of function, even if you discover that it gains function?  

Clear as mud and just as slimy.",2021-10-25 18:54:13+00:00,True,1335,238,7212,41,en,False,Twitter for iPhone,NA,NA,NA,NA,NA,NA,NA,NA,NA,NA,NA,NA
RandPaul,216881337,1452710101094182912,Dr. Fauci now maintains experiments are only ‘gain-of-function’ if experimenters knew in advance that the newly created virus would gain lethality.,2021-10-25 18:54:12+00:00,True,805,145,4576,44,en,False,Twitter for iPhone,NA,NA,NA,NA,NA,NA,NA,NA,NA,NA,NA,NA
RandPaul,216881337,1452710099575877632,"Dr. Fauci never loses! (At least according to his left wing media buds). Fauci’s latest ‘win’  involves the NIH eliminating ‘gain-of-function’ definition from their website. 

https://t.co/d9ajkjCKsB",2021-10-25 18:54:12+00:00,False,3408,530,9441,189,en,False,Twitter for iPhone,176,199,https://t.co/d9ajkjCKsB,https://townhall.com/tipsheet/leahbarkoukis/2021/10/25/nih-quietly-edits-section-of-website-on-gain-of-function-research-n2597968,NA,NA,NA,NA,NA,NA,NA,NA
RandPaul,216881337,1452692639644540932,Animal testing for drugs should not be compulsory. https://t.co/CHPfoIbgG8,2021-10-25 17:44:49+00:00,False,715,218,3736,54,en,False,Twitter for iPhone,51,74,https://t.co/CHPfoIbgG8,https://www.kentuckytoday.com/state/animal-testing-for-drugs-should-not-be-compulsory-says-paul/article_dd91537b-3147-50be-9dba-489c1f694d71.html,NA,NA,NA,NA,NA,NA,NA,NA
RandPaul,216881337,1451603007888580611,👀 https://t.co/qXbko9xTu7,2021-10-22 17:35:01+00:00,False,9173,886,24664,304,und,False,Twitter for iPhone,2,25,https://t.co/qXbko9xTu7,https://twitter.com/JeremyRedfernFL/status/1451565600673828869,NA,NA,NA,NA,NA,NA,NA,NA
RandPaul,216881337,1451519845388931084,Rand Paul blasts Anthony Fauci after NIH admits gain-of-function funding | Fox News https://t.co/e03PLKVNXW,2021-10-22 12:04:33+00:00,False,3026,1036,11814,256,en,False,Twitter for iPhone,84,107,https://t.co/e03PLKVNXW,https://www.foxnews.com/media/rand-paul-anthony-fauci-nih-gain-function-funding,NA,NA,NA,NA,NA,NA,NA,NA
RandPaul,216881337,1451242808040468483,I’ll be on with @dbongino soon. Don’t miss it! https://t.co/AfxTyczzs4,2021-10-21 17:43:42+00:00,False,320,214,2485,14,en,False,Twitter for iPhone,47,70,https://t.co/AfxTyczzs4,https://twitter.com/foxnation/status/1451217967178522633,NA,NA,NA,NA,NA,NA,NA,NA
RandPaul,216881337,1451230757498900485,"Realize that NIH is still funding Ecohealth collaboration with Wuhan thru 2025.  Fauci has publicly stated his support for Continuing US taxpayer funding of Wuhan. 
https://t.co/Aq7n8JUst0",2021-10-21 16:55:49+00:00,False,4426,918,10435,333,en,False,Twitter for iPhone,165,188,https://t.co/Aq7n8JUst0,https://www.nationalreview.com/news/nih-admits-to-funding-gain-of-function-research-in-wuhan-says-ecohealth-violated-reporting-requirements/,NA,NA,NA,NA,NA,NA,NA,NA
RandPaul,216881337,1451208671610949632,‘I Told You So’: Sen. Paul Hits Back At Critics After NIH Admits To Funding Gain-Of-Function Research | The Daily Caller https://t.co/nBIAn5HOVF,2021-10-21 15:28:04+00:00,False,3930,568,14732,204,en,False,Twitter for iPhone,121,144,https://t.co/nBIAn5HOVF,https://dailycaller.com/2021/10/21/senator-rand-paul-i-told-you-so-national-institutes-of-health-funding-gain-of-function-research/,NA,NA,NA,NA,NA,NA,NA,NA
RandPaul,216881337,1451185801333641233,"As Dr. Esvelt of MIT has written, “such research looks like a gamble that civilization can’t afford to risk.”
https://t.co/nI3W6H2mbR",2021-10-21 13:57:11+00:00,True,842,128,3518,28,en,False,Twitter Web App,110,133,https://t.co/nI3W6H2mbR,https://www.washingtonpost.com/opinions/2021/10/07/manipulating-viruses-risking-pandemics-is-too-dangerous-its-time-stop/,NA,NA,NA,NA,NA,NA,NA,NA
RandPaul,216881337,1451185798812889096,"So, if this type of experiment created a virus that had 50% mortality (like MERS which they have experimented with in Wuhan),  that result would be “unknown"" before the experiment but not “unexpected.” https://t.co/WmJsjSaCh1",2021-10-21 13:57:10+00:00,True,881,114,3796,25,en,False,Twitter Web App,202,225,https://t.co/WmJsjSaCh1,https://twitter.com/RandPaul/status/1451185798812889096/photo/1,202,225,https://t.co/WmJsjSaCh1,https://twitter.com/RandPaul/status/1451185798812889096/photo/1,NA,NA,NA,NA
RandPaul,216881337,1451185794329108481,But it is not “unexpected” that the virus gains in function it is simply ‘unknown'.,2021-10-21 13:57:09+00:00,True,407,44,2870,5,en,False,Twitter Web App,NA,NA,NA,NA,NA,NA,NA,NA,NA,NA,NA,NA
RandPaul,216881337,1451185792697528320,"HHS Deputy admits Fauci’s NIH funded gain-of-function research in Wuhan but says it was “an unexpected result.”  If the experiment combines unknown viruses and tests their ability to infect and damage humanized cells,  of course the result is ‘unknown' before the experiment.",2021-10-21 13:57:09+00:00,False,3992,643,13507,243,en,False,Twitter Web App,NA,NA,NA,NA,NA,NA,NA,NA,NA,NA,NA,NA
RandPaul,216881337,1451170467851739137,"NIH Contradicts Fauci, Admits Funding Gain-of-Function Research at Wuhan Lab https://t.co/8hIq5S3xNa via @BreitbartNews",2021-10-21 12:56:15+00:00,False,7497,1778,20288,721,en,False,Twitter Web App,77,100,https://t.co/8hIq5S3xNa,https://www.breitbart.com/politics/2021/10/20/nih-contradicts-fauci-admits-funding-gain-of-function-research-at-wuhan-lab/,NA,NA,NA,NA,NA,NA,NA,NA
RandPaul,216881337,1450996489862459394,“I told you so” doesn’t even begin to cover it here: https://t.co/9JFn85I24i,2021-10-21 01:24:56+00:00,False,24763,3347,68760,1420,en,False,Twitter for iPhone,53,76,https://t.co/9JFn85I24i,https://twitter.com/R_H_Ebright/status/1450947395508858880,NA,NA,NA,NA,NA,NA,NA,NA
RandPaul,216881337,1450905160985849862,"Who said corporations can’t act heroically? 

In-N-Out Burger clashes with San Francisco over vaccine mandate: ‘We refuse to become the vaccination police’ https://t.co/caU4Bs7YKu https://t.co/LZI5ppBFbP",2021-10-20 19:22:01+00:00,False,3728,895,24629,221,en,False,Twitter for iPhone,156,179,https://t.co/caU4Bs7YKu,https://www.washingtonpost.com/nation/2021/10/20/in-n-out-burger-san-francisco-vaccine-mandate/,180,203,https://t.co/LZI5ppBFbP,https://twitter.com/RandPaul/status/1450905160985849862/photo/1,NA,NA,NA,NA
RandPaul,216881337,1450897127018844161,"It was an honor to meet some of our nation’s heroes today. We can never fully repay them for their sacrifices, but I’m thankful for days like this to show them gratitude and that we will never forget. https://t.co/hRlnmMG03R",2021-10-20 18:50:06+00:00,False,220,82,2078,5,en,False,Twitter for iPhone,201,224,https://t.co/hRlnmMG03R,https://twitter.com/RandPaul/status/1450897127018844161/photo/1,201,224,https://t.co/hRlnmMG03R,https://twitter.com/RandPaul/status/1450897127018844161/photo/1,201,224,https://t.co/hRlnmMG03R,https://twitter.com/RandPaul/status/1450897127018844161/photo/1
RandPaul,216881337,1450857835747807236,"Billionaire Paul Jones “The No. 1 issue facing Main Street investors is inflation, and it’s pretty clear to me that inflation is not transitory. It’s probably the single biggest threat to certainly financial markets and I think to society just in general.”https://t.co/2P1qZFkPsS",2021-10-20 16:13:58+00:00,False,663,199,2543,39,en,False,Twitter for iPhone,256,279,https://t.co/2P1qZFkPsS,https://www.cnbc.com/2021/10/20/paul-tudor-jones-says-inflation-could-be-worse-than-feared-biggest-threat-to-markets-and-society.html,NA,NA,NA,NA,NA,NA,NA,NA
RandPaul,216881337,1450455011591340033,Vote for @GlennYoungkin if you believe parents should have a say in their children’s education! https://t.co/DTfNnsqV2G,2021-10-19 13:33:17+00:00,False,1850,261,5970,54,en,False,Twitter for iPhone,96,119,https://t.co/DTfNnsqV2G,https://twitter.com/GlennYoungkin/status/1450308324533092352,NA,NA,NA,NA,NA,NA,NA,NA
RandPaul,216881337,1450269875616763906,"Our founders would be proud of @dbongino courage:  “for the support of this Declaration . . . we mutually pledge to each other our Lives, our Fortunes and our sacred Honor."" https://t.co/wL4OPtZ1y1",2021-10-19 01:17:37+00:00,False,2683,614,15002,81,en,False,Twitter for iPhone,174,197,https://t.co/wL4OPtZ1y1,https://twitter.com/dcexaminer/status/1450142994066182147,NA,NA,NA,NA,NA,NA,NA,NA
RandPaul,216881337,1450214907140616201,"Don’t miss my interview with @mkibbe on @BlazeTV and @freethepeople this Wednesday! We talk Fauci, gain of function research, natural immunity, and mandates. https://t.co/64Qu6F0eoM",2021-10-18 21:39:12+00:00,False,218,171,1106,12,en,False,Twitter for iPhone,158,181,https://t.co/64Qu6F0eoM,https://twitter.com/RandPaul/status/1450214907140616201/photo/1,NA,NA,NA,NA,NA,NA,NA,NA
RandPaul,216881337,1450104758493188096,Kelley Paul visits Russellville to award USMC Ret. Major General for his service and patriotism https://t.co/Mvlwfi4RkZ,2021-10-18 14:21:30+00:00,False,63,55,550,1,en,False,Twitter Web App,96,119,https://t.co/Mvlwfi4RkZ,https://www.wbko.com/2021/10/17/kelley-paul-visits-russellville-award-usmc-ret-major-general-his-service-patriotism/,NA,NA,NA,NA,NA,NA,NA,NA
RandPaul,216881337,1449359403308699650,"U.S. Rand Paul, R-Ky., spoke out Friday night on Fox News’ ""The Ingraham Angle"" in reaction to what host Laura Ingraham called the Biden administration’s ""spend-o-rama"" agenda. https://t.co/V8Xqei2OjC",2021-10-16 12:59:44+00:00,False,491,318,2786,26,en,False,Twitter for iPhone,177,200,https://t.co/V8Xqei2OjC,https://www.foxnews.com/media/rand-paul-biden-big-government-socialism-prices-consequences-ingraham-angle,NA,NA,NA,NA,NA,NA,NA,NA
RandPaul,216881337,1449193377753337856,I'll be joining @IngrahamAngle around 10PM ET. Don't miss it!,2021-10-16 02:00:00+00:00,False,110,231,1217,9,en,False,Twitter Web App,NA,NA,NA,NA,NA,NA,NA,NA,NA,NA,NA,NA
RandPaul,216881337,1449124031274405900,"Biden's DOJ has decided it's going to treat parents who disagree with Critical Race Theory as ""domestic terrorists."" We can't let this stand.

Donate to my campaign now to keep a voice for liberty like mine in Washington so I can continue fighting for you! https://t.co/ufVZwWlyNm",2021-10-15 21:24:27+00:00,False,388,329,1947,30,en,False,Twitter Web App,257,280,https://t.co/ufVZwWlyNm,https://secure.winred.com/randpaul/doj-100921,NA,NA,NA,NA,NA,NA,NA,NA
RandPaul,216881337,1449089228122607630,And yet the Democrats are still pushing to spend trillions more. All to the detriment of average Americans. https://t.co/mYUd25WqTm,2021-10-15 19:06:09+00:00,False,350,257,1462,14,en,False,Twitter for iPhone,108,131,https://t.co/mYUd25WqTm,https://www.reuters.com/world/us/us-consumer-prices-increase-solidly-september-2021-10-13/,NA,NA,NA,NA,NA,NA,NA,NA
RandPaul,216881337,1448790080101965831,"Big tech once again silencing dissent. Visit us at https://t.co/1sAnMwUZeq to see liberty news uncensored

This Is Terrifying’: YouTube Suspends Steven Crowder For ‘Hate Speech,’ Covering ‘Transgender Community In An Offensive Manner’ https://t.co/3YJsDvGOKg",2021-10-14 23:17:26+00:00,False,958,280,3161,26,en,False,Twitter for iPhone,51,74,https://t.co/1sAnMwUZeq,http://libertytree.com,235,258,https://t.co/3YJsDvGOKg,https://www.dailywire.com/news/this-is-terrifying-youtube-suspends-steven-crowder-for-hate-speech-covering-transgender-community-in-an-offensive-manner,NA,NA,NA,NA
RandPaul,216881337,1448354309142364160,"Are our elections for sale? Did Mark Zuckerberg purchase the Wisconsin Presidential election?
https://t.co/QdyifxMGPD",2021-10-13 18:25:51+00:00,False,4224,1023,10211,240,en,False,Twitter for iPhone,94,117,https://t.co/QdyifxMGPD,https://justthenews.com/politics-policy/elections/unlike-others-wisconsins-election-probe-zeroes-democrat-machine-tactics,NA,NA,NA,NA,NA,NA,NA,NA
RandPaul,216881337,1448338759880257541,Visit https://t.co/1sAnMwUZeq to find exclusive and uncensored content! https://t.co/bRA48TVjpc,2021-10-13 17:24:03+00:00,False,229,123,993,13,en,False,Twitter for iPhone,6,29,https://t.co/1sAnMwUZeq,http://libertytree.com,72,95,https://t.co/bRA48TVjpc,https://libertytree.com/randpaul/1391,NA,NA,NA,NA
RandPaul,216881337,1448286132953833473,But I thought the science was settled? We all need to stop listening to ANYONE who says the science is settled. That’s anti-science. https://t.co/1p14XTsl03,2021-10-13 13:54:56+00:00,False,3971,1110,20366,141,en,False,Twitter for iPhone,133,156,https://t.co/1p14XTsl03,https://twitter.com/NBCNews/status/1448020176629387268,NA,NA,NA,NA,NA,NA,NA,NA
RandPaul,216881337,1448017833401651206,"I've made it my goal to stand with farmers. From fighting for our hemp industry to fighting to end overburdensome regulations, I believe in helping our farmers excel!

Happy National Farmers Day to those who feed the world, and more! #NationalFarmersDay https://t.co/2go77SHfQf",2021-10-12 20:08:49+00:00,False,350,190,2498,23,en,False,Twitter Web App,254,277,https://t.co/2go77SHfQf,https://twitter.com/RandPaul/status/1448017833401651206/video/1,NA,NA,NA,NA,NA,NA,NA,NA
RandPaul,216881337,1447684086617751559,"30 Peer reviewed journal articles confirming natural immunity after Covid infection. Will Fauci now finally apologize to the 100 million or more Americans who’ve had COVID? 

Natural Immunity and Covid-19: Twenty-Nine Scientific Studies to Share https://t.co/qJlWuS6ZOP",2021-10-11 22:02:37+00:00,False,13790,1819,32966,835,en,False,Twitter for iPhone,246,269,https://t.co/qJlWuS6ZOP,https://brownstone.org/articles/natural-immunity-and-covid-19-twenty-nine-scientific-studies-to-share-with-employers-health-officials-and-politicians/,NA,NA,NA,NA,NA,NA,NA,NA
RandPaul,216881337,1446850547584315395,Money doesn’t grow on trees… money’s got to come from somewhere. https://t.co/Z0G7fsVLor,2021-10-09 14:50:26+00:00,False,1571,892,8537,128,en,False,Twitter for iPhone,65,88,https://t.co/Z0G7fsVLor,https://fee.org/articles/rand-paul-slams-national-debt-crisis-inflation-and-socialism-in-memorable-senate-speech/,NA,NA,NA,NA,NA,NA,NA,NA
RandPaul,216881337,1446597161379061760,Bright Sheng survived the Cultural Revolution. Or so he thought. https://t.co/6v7ti3tFao,2021-10-08 22:03:34+00:00,False,285,91,1051,29,en,False,Twitter for iPhone,65,88,https://t.co/6v7ti3tFao,https://reason.com/2021/10/08/bright-sheng-university-of-michigan-othello-racism/,NA,NA,NA,NA,NA,NA,NA,NA
