ScreenName,AuthorID,TweetID,Text,TweetDate,isReply,RetweetCount,ReplyCount,LikeCount,QuoteCount,Language,PossibleSensitive,Source,1stURLStart,1stURLEnd,1stURL,1stURLExp,2ndURLStart,2ndURLEnd,2ndURL,2ndURLExp,3rdURLStart,3rdURLEnd,3rdURL,3rdURLExp
LeaderMcConnell,1249982359,1247987000105451521,"The Restaurant Workers Relief Program was created to serve fellow Kentuckians in Louisville. Now, it’s expanding to serve more than 50,000 hot meals to service industry workers and their families across the country. https://t.co/mMdRxH4JyK",2020-04-08 20:37:41+00:00,False,168,305,796,40,en,False,Twitter Web App,216,239,https://t.co/mMdRxH4JyK,https://bit.ly/2Rjmbmg,NA,NA,NA,NA,NA,NA,NA,NA
LeaderMcConnell,1249982359,1247934101941878784,"God’s Pantry has been busy during the coronavirus pandemic, and the @kentuckyguard has been there to help, packing 10k boxes of food for those in need across the Commonwealth. Thank you to our Kentucky Guard for showing that we’re all in this together. https://t.co/451WtYeFQD",2020-04-08 17:07:30+00:00,False,158,349,830,41,en,False,Twitter for iPhone,253,276,https://t.co/451WtYeFQD,https://bit.ly/34koGdr,NA,NA,NA,NA,NA,NA,NA,NA
LeaderMcConnell,1249982359,1247551023922675712,I will work with Secretary Mnuchin and Leader Schumer and hope to approve further funding for the Paycheck Protection Program by unanimous consent or voice vote during the next scheduled Senate session on Thursday. https://t.co/idRXGn22xq,2020-04-07 15:45:17+00:00,False,335,608,1624,92,en,False,Twitter Web App,215,238,https://t.co/idRXGn22xq,https://bit.ly/2V95YRV,NA,NA,NA,NA,NA,NA,NA,NA
LeaderMcConnell,1249982359,1247550719781109760,"Even as the CARES Act continues to come online, it is clear that the small-business Paycheck Protection Program will need more funding. Congress needs to act with speed and focus to provide more money for this crucial and bipartisan program. https://t.co/idRXGn22xq",2020-04-07 15:44:04+00:00,False,296,588,1349,93,en,False,Twitter Web App,242,265,https://t.co/idRXGn22xq,https://bit.ly/2V95YRV,NA,NA,NA,NA,NA,NA,NA,NA
LeaderMcConnell,1249982359,1247244542170054657,More inspiring examples of Kentuckians helping Kentuckians: Colleges and universities across the Commonwealth are stepping up to make and donate protective equipment for front line health care workers. https://t.co/v158YFNFr7,2020-04-06 19:27:26+00:00,False,154,567,893,38,en,False,Twitter for iPhone,202,225,https://t.co/v158YFNFr7,https://bit.ly/3aIwc49,NA,NA,NA,NA,NA,NA,NA,NA
LeaderMcConnell,1249982359,1247208728861999104,"Federal, state, and local officials in Kentucky are working overtime together to assist those in need. And citizens across the Commonwealth are stepping up and finding creative ways to pitch in and help others.

United we stand, divided we fall. https://t.co/Y9V0aFPW86",2020-04-06 17:05:07+00:00,False,526,1626,2775,204,en,False,Twitter for iPhone,246,269,https://t.co/Y9V0aFPW86,https://bit.ly/2XhKV23,NA,NA,NA,NA,NA,NA,NA,NA
LeaderMcConnell,1249982359,1246190527453806595,"The most important thing that we can do for our nation’s small businesses &amp; their employees is to provide them resources to weather this storm. That’s exactly why the Senate wrote and passed the CARES Act.
https://t.co/H9Dk98ASzk https://t.co/2Mz3RSFHdf",2020-04-03 21:39:09+00:00,False,186,794,726,37,en,False,Twitter Web App,210,233,https://t.co/H9Dk98ASzk,https://bit.ly/2wfg0Zg,234,257,https://t.co/2Mz3RSFHdf,https://twitter.com/senatemajldr/status/1246190527453806595/photo/1,NA,NA,NA,NA
LeaderMcConnell,1249982359,1246162846880354306,"Senate Republicans are closely tracking the implementation of our historic CARES Act as the Administration puts it into effect for the American people. We are committed to supporting American workers, families, and small businesses as our nation confronts this historic emergency.",2020-04-03 19:49:09+00:00,False,590,1171,2959,123,en,False,Twitter Web App,NA,NA,NA,NA,NA,NA,NA,NA,NA,NA,NA,NA
LeaderMcConnell,1249982359,1246159275141013507,I’m glad Speaker Pelosi is again standing down from efforts to use this crisis to push unrelated left-wing priorities. The latest proposal had been a massive tax-code giveaway for wealthy people in blue states that was instantly panned by economists across the spectrum.,2020-04-03 19:34:58+00:00,False,3897,3932,17493,613,en,False,Twitter Web App,NA,NA,NA,NA,NA,NA,NA,NA,NA,NA,NA,NA
LeaderMcConnell,1249982359,1246081323489525760,I am proud that President Trump’s search took him outside the Beltway and into the Bluegrass. Judge Walker is a brilliant and fair jurist who reveres the Constitution. He’s a leading light in a new generation of federal judges. https://t.co/1j3GYhvosc,2020-04-03 14:25:13+00:00,False,1031,1196,5076,128,en,False,Twitter Web App,228,251,https://t.co/1j3GYhvosc,https://twitter.com/LeaderMcConnell/status/1246081061601370114,NA,NA,NA,NA,NA,NA,NA,NA
LeaderMcConnell,1249982359,1246081061601370114,"Judge Justin Walker, @POTUS’s choice to serve on the U.S. Court of Appeals for the D.C. Circuit, is an outstanding legal scholar. President Trump has chosen a rising Kentucky star to refresh a crucial federal court. My statement: https://t.co/Ls6TNAQl27",2020-04-03 14:24:10+00:00,False,661,1143,2840,157,en,False,Twitter Web App,230,253,https://t.co/Ls6TNAQl27,https://bit.ly/2R92AVR,NA,NA,NA,NA,NA,NA,NA,NA
LeaderMcConnell,1249982359,1245827910331752453,"Every American is feeling the effects of the coronavirus. It’s a national health &amp; economic emergency that demanded action. I’m proud that the biggest rescue package in history, led by Senate Republicans, will help workers &amp; families respond. https://t.co/VCXGc2xeNG",2020-04-02 21:38:14+00:00,False,414,1717,2245,145,en,False,Twitter Web App,251,274,https://t.co/VCXGc2xeNG,https://bit.ly/2UAWOhV,NA,NA,NA,NA,NA,NA,NA,NA
LeaderMcConnell,1249982359,1245778381419024385,"I’m grateful to Kentuckians who are stepping up to show compassion and resolve. It’s because of stories like this that we will make it through this. We are all in this together, even if we have to stand six feet apart. https://t.co/QmOCA65Ps6",2020-04-02 18:21:26+00:00,False,1063,882,5083,141,en,False,Twitter for iPhone,219,242,https://t.co/QmOCA65Ps6,https://bit.ly/2R6nLaZ,NA,NA,NA,NA,NA,NA,NA,NA
LeaderMcConnell,1249982359,1245404302090350592,"House Democrats are still trying to use this crisis to push unrelated pet priorities.
 
Last week: Carbon regulations.
 
Now? A tax giveaway for wealthy people in blue states, panned by economists across the spectrum.
 
This is a crisis. Let's act like it. https://t.co/okeS98rSkc",2020-04-01 17:34:58+00:00,False,2302,3751,5727,492,en,False,Twitter for iPhone,257,280,https://t.co/okeS98rSkc,https://politi.co/3azRAbT,NA,NA,NA,NA,NA,NA,NA,NA
LeaderMcConnell,1249982359,1245375813551357954,I made sure the historic CARES Act did not leave states like Kentucky behind. I am glad the first federal funds are already starting to flow to local governments to help Kentuckians weather this health crisis and economic emergency. https://t.co/o5DiB1URVE,2020-04-01 15:41:46+00:00,False,241,870,1141,69,en,False,Twitter Web App,233,256,https://t.co/o5DiB1URVE,https://bit.ly/2UzNk6w,NA,NA,NA,NA,NA,NA,NA,NA
LeaderMcConnell,1249982359,1245347398513295360,ICYMI🎙: I joined @GuyBensonShow with @FoxNews to discuss the CARES Act. This was the third coronavirus bill that we've passed and the biggest one by far. It was crafted by a Republican majority in the Senate and approved without a single dissenting vote. https://t.co/aY2IqrafoV,2020-04-01 13:48:51+00:00,False,359,1357,1763,121,en,False,Twitter for iPhone,255,278,https://t.co/aY2IqrafoV,https://bit.ly/342cv4J,NA,NA,NA,NA,NA,NA,NA,NA
LeaderMcConnell,1249982359,1245070004439187456,TUNE IN 🎤: I will be joining @GuyBensonShow with @FoxNews at ~3:35PM. https://t.co/HC2JtVXHgB,2020-03-31 19:26:35+00:00,False,81,1390,411,61,en,False,Twitter Web App,70,93,https://t.co/HC2JtVXHgB,https://radio.foxnews.com/fox-news-talk/guy-benson/,NA,NA,NA,NA,NA,NA,NA,NA
LeaderMcConnell,1249982359,1245043052416303110,"ICYMI🎤: I joined @hughhewitt today to discuss the Senate’s historic 96-0 vote to pass the Coronavirus Aid, Relief, and Economic Security (CARES) Act.
 
America is facing a national emergency. I’m proud the Senate stepped up to equip our national response. https://t.co/kOPrpWB9tJ",2020-03-31 17:39:30+00:00,False,97,1144,485,53,en,False,Twitter for iPhone,256,279,https://t.co/kOPrpWB9tJ,https://bit.ly/2UNJC8c,NA,NA,NA,NA,NA,NA,NA,NA
LeaderMcConnell,1249982359,1244697184186126336,"Today is #NationalDoctorsDay. Thank you to our American heroes who wear scrubs and masks. Who rush toward the sick, wash their hands until they bleed, and work around the clock to heal our loved ones. We salute doctors along with nurses and all of our healthcare professionals.",2020-03-30 18:45:08+00:00,False,1457,1782,8853,220,en,False,Twitter for iPhone,NA,NA,NA,NA,NA,NA,NA,NA,NA,NA,NA,NA
LeaderMcConnell,1249982359,1244648837274382338,"From bourbon and spirits to hand sanitizer. I am proud of our great #Kentucky distillers and all of our job creators who are stepping up to help their neighbors during this emergency.
https://t.co/FhtjfJcnSc",2020-03-30 15:33:01+00:00,False,697,709,3869,80,en,False,Twitter for iPhone,184,207,https://t.co/FhtjfJcnSc,https://bit.ly/3byNTTR,NA,NA,NA,NA,NA,NA,NA,NA
LeaderMcConnell,1249982359,1243954556389769216,"The Senate mourns our friend Tom Coburn. Seventy-two years was far too few for someone this brilliant, this tireless, and this dedicated to serving others. We stand in prayer with his beloved wife Carolyn and the entire Coburn family. My full statement: https://t.co/gNSp5KSc0E",2020-03-28 17:34:12+00:00,False,457,425,2422,52,en,False,Twitter for iPhone,254,277,https://t.co/gNSp5KSc0E,https://bit.ly/3bxy0wL,NA,NA,NA,NA,NA,NA,NA,NA
LeaderMcConnell,1249982359,1243674210712641541,"It was an honor to join @POTUS at the White House today for the signing of the CARES Act. 

The American people needed this rescue package. They needed it quickly. And the Senate delivered, 96-0. It's a proud moment for our country. https://t.co/jk33y5D5lg",2020-03-27 23:00:12+00:00,False,1719,2424,8314,311,en,False,Twitter Media Studio,233,256,https://t.co/jk33y5D5lg,https://twitter.com/senatemajldr/status/1243674210712641541/video/1,NA,NA,NA,NA,NA,NA,NA,NA
LeaderMcConnell,1249982359,1243637711703019527,".@POTUS just signed the CARES Act. The Senate's bold legislation is now law.

It will get emergency cash to families and small businesses and surge resources to doctors, nurses, hospitals, and the race for new treatments and vaccines. #WeAreAllInThisTogether",2020-03-27 20:35:10+00:00,False,1366,1629,6952,269,en,False,Twitter Web App,NA,NA,NA,NA,NA,NA,NA,NA,NA,NA,NA,NA
LeaderMcConnell,1249982359,1243628065713946624,"ICYMI 🎤: I joined @FocusFamily to discuss how the Senate’s historic CARES Act will put emergency cash into the hands of American families who need it the most. 

As our nation battles this virus, let’s continue to pray for one another, for all of our families, &amp; for our country. https://t.co/H9bb5K15ad",2020-03-27 19:56:51+00:00,False,195,458,746,50,en,False,Twitter Media Studio,284,307,https://t.co/H9bb5K15ad,https://twitter.com/senatemajldr/status/1243628065713946624/video/1,NA,NA,NA,NA,NA,NA,NA,NA
LeaderMcConnell,1249982359,1243559620880273409,"ICYMI📺: Last night, I joined @marthamaccallum with @FoxNews to discuss the Senate’s historic response to the coronavirus, which will rush much needed aid to our brave medical professionals and relief to families and small businesses. https://t.co/eN5sCeBLBU",2020-03-27 15:24:52+00:00,False,257,665,1246,59,en,False,Twitter Media Studio,234,257,https://t.co/eN5sCeBLBU,https://twitter.com/senatemajldr/status/1243559620880273409/video/1,NA,NA,NA,NA,NA,NA,NA,NA
LeaderMcConnell,1249982359,1243032581576286208,"The Senate just pivoted from one of the most divided periods in recent memory to passing the largest rescue package in American history. And we passed it unanimously.
 
Americans deserved this outcome. I am proud the Senate stepped up.",2020-03-26 04:30:36+00:00,False,3165,6261,19801,1294,en,False,Twitter for iPhone,NA,NA,NA,NA,NA,NA,NA,NA,NA,NA,NA,NA
LeaderMcConnell,1249982359,1242886553988468738,"Our nation will meet a lot of new heroes — from first responders to grocery clerks to delivery drivers. Most of all, we'll meet a whole lot of heroes in scrubs working to heal the sick. When our nation comes through this, it will be because American heroes won this fight. https://t.co/3RVAJNuLo1",2020-03-25 18:50:20+00:00,False,1396,1583,5763,232,en,False,Twitter Media Studio,273,296,https://t.co/3RVAJNuLo1,https://twitter.com/senatemajldr/status/1242886553988468738/video/1,NA,NA,NA,NA,NA,NA,NA,NA
LeaderMcConnell,1249982359,1242690673800855552,"At last, we have a deal.
 
After days of intense discussions, the Senate has reached a bipartisan agreement on a historic relief package for this pandemic. 

We’re going to pass this legislation later today.",2020-03-25 05:51:59+00:00,False,6063,6344,32425,1657,en,False,Twitter for iPhone,NA,NA,NA,NA,NA,NA,NA,NA,NA,NA,NA,NA
LeaderMcConnell,1249982359,1242546639736365057,"Small businesses, working families, and medical responders across our country need help now.

That's why the Senate is working non-stop on a bipartisan agreement on bold, urgent relief.
 
We can’t afford to waste another moment.
https://t.co/nBgbq6mIa2 https://t.co/3TisLO4hKg",2020-03-24 20:19:38+00:00,False,836,1712,3003,218,en,False,Twitter Web App,229,252,https://t.co/nBgbq6mIa2,https://nyti.ms/3driGn8,253,276,https://t.co/3TisLO4hKg,https://twitter.com/senatemajldr/status/1242546639736365057/photo/1,NA,NA,NA,NA
LeaderMcConnell,1249982359,1242179066024857601,"Every day, this economic crisis deepens and more Americans lose their jobs.
 
Senate Democrats are blocking emergency loans to small businesses, direct checks for Americans, and even a huge expansion of unemployment benefits during the emergency. https://t.co/UdotiiXXcX",2020-03-23 19:59:02+00:00,False,5016,7266,13244,1147,en,False,Twitter Media Studio,247,270,https://t.co/UdotiiXXcX,https://twitter.com/senatemajldr/status/1242179066024857601/video/1,NA,NA,NA,NA,NA,NA,NA,NA
LeaderMcConnell,1249982359,1242158911748268034,"These are just some of the unrelated demands Senate Democrats have used to slow relief for workers and families:
 
✖️ Tax credits for solar and wind energy
✖️ Special treatment for Big Labor
✖️ Airlines' emissions standards
 
This is a crisis. Why is only one side acting like it? https://t.co/MRfnXT1HJ2",2020-03-23 18:38:57+00:00,False,10220,8809,24687,2378,en,False,Twitter Media Studio,281,304,https://t.co/MRfnXT1HJ2,https://twitter.com/senatemajldr/status/1242158911748268034/video/1,NA,NA,NA,NA,NA,NA,NA,NA
LeaderMcConnell,1249982359,1241929925923397634,"Our nation cannot afford this game of chicken. We cannot afford the cynical partisanship.

This is a national emergency. Not a partisan opportunity.

Doctors, nurses, small business employees, laid-off Americans, and vulnerable seniors need help right now. https://t.co/zXPqodt8ZI",2020-03-23 03:29:02+00:00,False,9650,15619,32821,2374,en,False,Twitter Media Studio,257,280,https://t.co/zXPqodt8ZI,https://twitter.com/senatemajldr/status/1241929925923397634/video/1,NA,NA,NA,NA,NA,NA,NA,NA
LeaderMcConnell,1249982359,1241890195676573696,"The American people expect us to act. If we fail, it will be because Senate Democrats are continuing to dither while the country expects bold, bipartisan action. https://t.co/23pFHoDtCl",2020-03-23 00:51:10+00:00,False,7002,11058,23051,1852,en,False,Twitter Media Studio,162,185,https://t.co/23pFHoDtCl,https://twitter.com/senatemajldr/status/1241890195676573696/video/1,NA,NA,NA,NA,NA,NA,NA,NA
LeaderMcConnell,1249982359,1241753730921291777,"This morning I hosted a meeting with congressional leadership and Sec. Mnuchin. It is time to come together, finalize the results of our bipartisan discussions, and get the CARES Act to the President’s desk. https://t.co/HierUIlNVC",2020-03-22 15:48:54+00:00,False,1076,2275,4988,305,en,False,Twitter Web App,208,231,https://t.co/HierUIlNVC,https://twitter.com/senatemajldr/status/1241753730921291777/photo/1,NA,NA,NA,NA,NA,NA,NA,NA
LeaderMcConnell,1249982359,1241538134699057157,"The past two days of intense bipartisan talks are very close to a resolution. An update on the Coronavirus Aid, Relief, &amp; Economic Security Act: https://t.co/KHB2RJhkJx",2020-03-22 01:32:12+00:00,False,1746,1319,8086,175,en,False,Twitter for iPhone,149,172,https://t.co/KHB2RJhkJx,https://bit.ly/3ddrZqK,NA,NA,NA,NA,NA,NA,NA,NA
LeaderMcConnell,1249982359,1241495687012978695,"More Americans are being laid off every day. More small businesses are being forced to shed payroll every day. Our nurses and doctors need key supplies.
 
Nobody should view this as political opportunity for either side. This is a national emergency.
 
It is time to come together",2020-03-21 22:43:32+00:00,False,7159,12245,38203,1772,en,False,Twitter Web App,NA,NA,NA,NA,NA,NA,NA,NA,NA,NA,NA,NA
LeaderMcConnell,1249982359,1241460610078052354,"Kentucky’s state motto is “United we stand, divided we fall.” I’m inspired by all the Kentuckians who are stepping up to serve their neighbors and showing Washington how it’s done.
 
United we stand — even if we have to stand six feet apart for a few weeks. https://t.co/Vsysj34wv1",2020-03-21 20:24:09+00:00,False,2631,2276,12711,264,en,False,Twitter Media Studio,258,281,https://t.co/Vsysj34wv1,https://twitter.com/senatemajldr/status/1241460610078052354/video/1,NA,NA,NA,NA,NA,NA,NA,NA
LeaderMcConnell,1249982359,1241439165117579265,"Small businesses, working families, and medical responders across this country have made it clear: They need help now.
 
That's why the Senate is working toward a bipartisan agreement on bold, urgent relief.",2020-03-21 18:58:56+00:00,False,2341,2370,11796,311,en,False,Twitter Web App,NA,NA,NA,NA,NA,NA,NA,NA,NA,NA,NA,NA
