ScreenName,AuthorID,TweetID,Text,TweetDate,isReply,RetweetCount,ReplyCount,LikeCount,QuoteCount,Language,PossibleSensitive,Source,1stURLStart,1stURLEnd,1stURL,1stURLExp,2ndURLStart,2ndURLEnd,2ndURL,2ndURLExp,3rdURLStart,3rdURLEnd,3rdURL,3rdURLExp
LeaderMcConnell,1249982359,1258035512717316097,"Nurses in #Kentucky and across America are rushing toward the sick, washing their hands until they bleed, and working around the clock to heal strangers and fight the coronavirus. Today and every day, we salute you. https://t.co/7MPPc8FW78",2020-05-06 14:06:54+00:00,False,216,660,1103,62,en,False,Twitter for iPhone,216,239,https://t.co/7MPPc8FW78,https://twitter.com/senatemajldr/status/1258035512717316097/photo/1,NA,NA,NA,NA,NA,NA,NA,NA
LeaderMcConnell,1249982359,1257745933934235650,Teachers in #Kentucky and across America are adapting to online learning and continuing to educate young minds. They are among the many heroes during this crisis. The entire Senate salutes and thanks all of our nation’s educators on this National Teacher Day. https://t.co/JPRAO8LY9O,2020-05-05 18:56:13+00:00,False,157,835,893,62,en,False,Twitter for iPhone,260,283,https://t.co/JPRAO8LY9O,https://twitter.com/senatemajldr/status/1257745933934235650/photo/1,NA,NA,NA,NA,NA,NA,NA,NA
LeaderMcConnell,1249982359,1257413501330632709,"I want to thank the staff who worked hard to support the Senate’s remote work and the experts who are helping us safely and smartly resume some in-person operations today. Neither the virus nor our nation’s adversaries take days off, and thanks to you, neither does the Senate.",2020-05-04 20:55:14+00:00,False,1167,1623,6738,164,en,False,Twitter Web App,NA,NA,NA,NA,NA,NA,NA,NA,NA,NA,NA,NA
LeaderMcConnell,1249982359,1257394415351541760,The Senate is back in session because we have critically important work to do for the nation. Our bosses are the American people and they are counting on us to keep serving.,2020-05-04 19:39:24+00:00,False,5389,16110,29723,2125,en,False,Twitter Web App,NA,NA,NA,NA,NA,NA,NA,NA,NA,NA,NA,NA
LeaderMcConnell,1249982359,1256324376812613633,"All across America, essential workers are following expert advice and taking new precautions while they continue reporting for duty. Starting Monday, the Senate will do the same. We will continue to stand together for the American people — even as we stand six feet apart. https://t.co/V44KNzrgRf",2020-05-01 20:47:27+00:00,True,81,407,466,24,en,False,Twitter for iPhone,273,296,https://t.co/V44KNzrgRf,https://twitter.com/senatemajldr/status/1256324376812613633/photo/1,NA,NA,NA,NA,NA,NA,NA,NA
LeaderMcConnell,1249982359,1256324369866846208,I am grateful to all the dedicated professionals who have worked to develop solutions so the Senate can smartly and safely begin resuming our critical in-person work on Monday. I strongly urge my colleagues to consult these guidelines. https://t.co/EQxAqhfkZq,2020-05-01 20:47:25+00:00,False,204,794,977,39,en,False,Twitter for iPhone,236,259,https://t.co/EQxAqhfkZq,https://bit.ly/3aRksvz,NA,NA,NA,NA,NA,NA,NA,NA
LeaderMcConnell,1249982359,1255624621518458883,"ICYMI 🎙️: I joined @kilmeade to discuss liability protections for frontline workers, reconvening the Senate next week, and Senate Republicans’ accomplishments working with President Trump: https://t.co/EXNsOtaE3l",2020-04-29 22:26:52+00:00,False,181,1294,905,64,en,False,Twitter Media Studio,189,212,https://t.co/EXNsOtaE3l,https://twitter.com/senatemajldr/status/1255624621518458883/video/1,NA,NA,NA,NA,NA,NA,NA,NA
LeaderMcConnell,1249982359,1255518614058422273,We need to provide protection – litigation protection – for those who have been on the front lines. And we have to help businesses and employees go back to work without fear of trial lawyers sharpening their pencils. https://t.co/CjbrD6dP9o,2020-04-29 15:25:38+00:00,False,642,2182,2844,253,en,False,Twitter Media Studio,217,240,https://t.co/CjbrD6dP9o,https://twitter.com/senatemajldr/status/1255518614058422273/video/1,NA,NA,NA,NA,NA,NA,NA,NA
LeaderMcConnell,1249982359,1255234613024362500,TUNE IN 📺: I will be joining Neil Cavuto on @FoxNews ~4:45 PM EST to discuss the Senate agenda.,2020-04-28 20:37:07+00:00,False,157,1267,1055,68,en,False,Twitter for iPhone,NA,NA,NA,NA,NA,NA,NA,NA,NA,NA,NA,NA
LeaderMcConnell,1249982359,1255166067892195328,"ICYMI️: I joined the @GuyBensonShow to discuss the Senate reconvening on May 4th, keeping our focus on COVID-19 relief, and legal protections for health care workers. https://t.co/DuDORUBNYK",2020-04-28 16:04:45+00:00,False,227,1157,1014,84,en,False,Twitter Web App,167,190,https://t.co/DuDORUBNYK,https://radio.foxnews.com/2020/04/27/senate-majority-leader-mitch-mcconnell-on-sexual-assault-allegations-against-biden-vs-kavanaugh-such-accusations-should-be-dealt-with-symmetrically-by-the-media/,NA,NA,NA,NA,NA,NA,NA,NA
LeaderMcConnell,1249982359,1254855764721557504,"TUNE IN: I will be joining the @GuyBensonShow
 at ~3:30 PM ET to discuss the Senate reconvening and Senate Republicans' plan to strengthen our response to the coronavirus crisis. https://t.co/HC2JtVG5S1",2020-04-27 19:31:43+00:00,False,80,909,463,40,en,False,Twitter Web App,179,202,https://t.co/HC2JtVG5S1,https://radio.foxnews.com/fox-news-talk/guy-benson/,NA,NA,NA,NA,NA,NA,NA,NA
LeaderMcConnell,1249982359,1254830745639686144,"The Senate must focus on concrete steps to strengthen our response to this crisis. The American people do not need tangential left-wing daydreams. They need commonsense steps that move us toward the response, recovery, and future readiness that Americans need. https://t.co/p1hgFAjUBm",2020-04-27 17:52:18+00:00,True,164,478,724,39,en,False,Twitter for iPhone,261,284,https://t.co/p1hgFAjUBm,https://twitter.com/senatemajldr/status/1254830745639686144/photo/1,NA,NA,NA,NA,NA,NA,NA,NA
LeaderMcConnell,1249982359,1254830739939643397,"If it is essential for doctors, nurses, healthcare workers, truck drivers, grocery-store workers, and other brave Americans to keep carefully manning their duty stations, then it is essential for Senators to carefully man ours and support them. We are reconvening next week. https://t.co/XNmJGkGjcW",2020-04-27 17:52:16+00:00,False,548,853,2184,107,en,False,Twitter for iPhone,275,298,https://t.co/XNmJGkGjcW,https://twitter.com/senatemajldr/status/1254830739939643397/photo/1,NA,NA,NA,NA,NA,NA,NA,NA
LeaderMcConnell,1249982359,1254139921209659393,"Thanks to the Paycheck Protection Program, more businesses like The Cheddar Box Cafe in Kentucky, will be able to keep their doors open and their employees on payroll. This is just one of the many success stories of this vital  job saving program. https://t.co/cQlSVJBDVJ",2020-04-25 20:07:12+00:00,False,387,1840,2124,118,en,False,Twitter for iPhone,248,271,https://t.co/cQlSVJBDVJ,https://www.whas11.com/article/money/business/small-business-help-low-funds-covid-19/417-06a68ef0-9294-4be4-b536-133c7b1135af,NA,NA,NA,NA,NA,NA,NA,NA
LeaderMcConnell,1249982359,1253723498796679172,"This new bill strengthens some of the most important parts of the CARES Act, especially the popular Paycheck Protection Program which is saving millions of American jobs as we speak. And Republicans successfully kept extraneous issues out of the bill. It’s a win for the country.",2020-04-24 16:32:29+00:00,True,356,742,1730,50,en,False,Twitter Web App,NA,NA,NA,NA,NA,NA,NA,NA,NA,NA,NA,NA
LeaderMcConnell,1249982359,1253723498087940099,"The Senate's historic CARES Act is the largest rescue package in American history. It is already sending hundreds of billions of dollars to struggling small businesses, hard-hit hospitals, testing, very targeted COVID-19 help for states and localities, and direct aid to families.",2020-04-24 16:32:29+00:00,True,333,538,1714,28,en,False,Twitter Web App,NA,NA,NA,NA,NA,NA,NA,NA,NA,NA,NA,NA
LeaderMcConnell,1249982359,1253723497274187777,".@POTUS just signed our latest relief bill. It expands funding for saving small businesses and protecting Americans’ paychecks. It strengthens support for hospitals, healthcare providers, and testing. Proud to have led the historic CARES Act and this expansion of key provisions.",2020-04-24 16:32:29+00:00,False,1553,3023,7672,279,en,False,Twitter Web App,NA,NA,NA,NA,NA,NA,NA,NA,NA,NA,NA,NA
LeaderMcConnell,1249982359,1253351930744705026,"Historic, tragic layoffs continue to pile up nationwide. This pandemic has erased a decade of job creation in just over one month.
 
Democrats should never have made the Paycheck Protection Program lapse. The House must follow the Senate’s lead and vote today to re-open it.",2020-04-23 15:56:01+00:00,False,3192,11988,11353,1078,en,False,Twitter for iPhone,NA,NA,NA,NA,NA,NA,NA,NA,NA,NA,NA,NA
LeaderMcConnell,1249982359,1253113490606370818,ICYMI 📺: I joined @FoxNews with @BillHemmer to discuss yesterday’s Senate vote to replenish the Paycheck Protection Program and the next steps to help our nation combat the pandemic. https://t.co/Lhvw4MEwsL,2020-04-23 00:08:32+00:00,False,102,1082,563,58,en,False,Twitter Web App,183,206,https://t.co/Lhvw4MEwsL,https://bit.ly/2KsOnPW,NA,NA,NA,NA,NA,NA,NA,NA
LeaderMcConnell,1249982359,1253038164400394240,TUNE IN 📺 to @FoxNews. I will be joining @BillHemmer soon to discuss Senate Republicans’ successful effort to replenish the Paycheck Protection Program.,2020-04-22 19:09:13+00:00,False,267,1425,1502,74,en,False,Twitter Web App,NA,NA,NA,NA,NA,NA,NA,NA,NA,NA,NA,NA
LeaderMcConnell,1249982359,1252999001131102209,ICYMI🎙️: I joined @hughhewitt to discuss Senate Republican's victory yesterday on more legislation to help American workers through the pandemic and the Senate’s continued focus on confirming impressive new judges. https://t.co/hmQsATvFJJ,2020-04-22 16:33:36+00:00,False,136,1007,673,74,en,False,Twitter Web App,215,238,https://t.co/hmQsATvFJJ,https://bit.ly/2zpDU5D,NA,NA,NA,NA,NA,NA,NA,NA
LeaderMcConnell,1249982359,1252738721062977540,Martin Lee is an old friend of mine. He’s a brave and steady voice for the freedom and autonomy of Hong Kong. The authorities just had him arrested. His new op-ed is essential reading: https://t.co/aJDY7U1Xx0,2020-04-21 23:19:20+00:00,False,2326,615,3475,81,en,False,Twitter for iPhone,185,208,https://t.co/aJDY7U1Xx0,https://www.washingtonpost.com/opinions/2020/04/21/i-was-arrested-hong-kong-its-part-chinas-larger-plan/,NA,NA,NA,NA,NA,NA,NA,NA
LeaderMcConnell,1249982359,1252704848497315840,"I’m proud of Congress’s new bipartisan agreement. I am just sorry that Democrats shut down emergency support for Main Street in a search for partisan “leverage” that never materialized.
 
It’s time to move forward together and get this done for the American people. https://t.co/cUkQU0MT9P",2020-04-21 21:04:44+00:00,False,1568,2478,6132,288,en,False,Twitter Media Studio,266,289,https://t.co/cUkQU0MT9P,https://twitter.com/senatemajldr/status/1252704848497315840/video/1,NA,NA,NA,NA,NA,NA,NA,NA
LeaderMcConnell,1249982359,1252676152864526337,"I am encouraged that Democrats have finally agreed to reopen the Paycheck Protection Program and abandon a number of their unrelated demands. My full statement on Congress’s new bipartisan agreement to provide additional small-business support, more funding for testing, and more: https://t.co/nDnhxbs9KB",2020-04-21 19:10:43+00:00,False,976,1237,3354,173,en,False,Twitter for iPhone,281,304,https://t.co/nDnhxbs9KB,https://twitter.com/senatemajldr/status/1252676152864526337/photo/1,NA,NA,NA,NA,NA,NA,NA,NA
LeaderMcConnell,1249982359,1252301158632357888,"It’s been four days since the Paycheck Protection Program ran dry. Republicans have been trying to fund this job-saving program for over a week, but Democrats have blocked us. The Senate will meet again tomorrow. I hope my colleagues will finally let this help move forward.",2020-04-20 18:20:37+00:00,False,9663,9921,40644,1565,en,False,Twitter for iPhone,NA,NA,NA,NA,NA,NA,NA,NA,NA,NA,NA,NA
LeaderMcConnell,1249982359,1251584555183726592,These outrageous arrests are just one more example of Beijing’s shameful efforts to strangle the freedom and autonomy of Hong Kongers. I wrote about these coordinated efforts last year: https://t.co/vpCKX4EpAA,2020-04-18 18:53:05+00:00,False,3131,1063,5610,146,en,False,Twitter for iPhone,186,209,https://t.co/vpCKX4EpAA,https://on.wsj.com/3ezpj7p,NA,NA,NA,NA,NA,NA,NA,NA
LeaderMcConnell,1249982359,1251583670818832384,The Chinese Communist Party should not be allowed to use a pandemic — which they exacerbated through secrecy and inaction — as cover for its agents to arrest peaceful pro-democracy leaders. We stand with Hong Kong. https://t.co/RpAsZ5hZvJ,2020-04-18 18:49:35+00:00,False,3189,1261,6555,209,en,False,Twitter for iPhone,215,238,https://t.co/RpAsZ5hZvJ,https://www.nytimes.com/2020/04/18/world/asia/hong-kong-arrests.html,NA,NA,NA,NA,NA,NA,NA,NA
LeaderMcConnell,1249982359,1251550591643508738,The Paycheck Protection Program ran dry on Thursday and Democrats continue to block more funding. Democrats must let us reopen this crucial program before more Americans are laid off needlessly and more small businesses are shuttered that could have survived.,2020-04-18 16:38:08+00:00,False,5244,5235,16078,1013,en,False,Twitter for iPhone,NA,NA,NA,NA,NA,NA,NA,NA,NA,NA,NA,NA
LeaderMcConnell,1249982359,1251246681783402498,"Chairman @MikeCrapo will coordinate Senate-wide oversight of the historic CARES Act, and I am appointing @SenToomey to the five-member Congressional Oversight Commission. I am grateful that these expert leaders are stepping up. https://t.co/zOW2JvNR3r",2020-04-17 20:30:30+00:00,False,224,693,902,47,en,False,Twitter Web App,228,251,https://t.co/zOW2JvNR3r,https://bit.ly/2RMkbmZ,NA,NA,NA,NA,NA,NA,NA,NA
LeaderMcConnell,1249982359,1251169088208097280,Twenty million Americans have lost their jobs in one month. We badly need the bipartisan Paycheck Protection Program to keep saving more small businesses. But Democrats have been blocking its funding for over a week and now this crucial program is shut down. https://t.co/uSGOuup5bJ,2020-04-17 15:22:10+00:00,False,2335,2373,6490,460,en,False,Twitter Web App,259,282,https://t.co/uSGOuup5bJ,https://twitter.com/senatemajldr/status/1251169088208097280/video/1,NA,NA,NA,NA,NA,NA,NA,NA
LeaderMcConnell,1249982359,1250901684349546496,"Five million more Americans lost their jobs just last week.

That makes 20 million layoffs in one month.
 
Americans need Democrats to stop blocking emergency paycheck money and let this job-saving program reopen.

I hope our colleagues come around soon. https://t.co/1IFNChRw4D",2020-04-16 21:39:36+00:00,False,1091,1966,3519,245,en,False,Twitter Media Studio,255,278,https://t.co/1IFNChRw4D,https://twitter.com/senatemajldr/status/1250901684349546496/video/1,NA,NA,NA,NA,NA,NA,NA,NA
LeaderMcConnell,1249982359,1250886374577881088,"Even now, Senate Democrats are still blocking funding for the Paycheck Protection Program. 
 
It is surreal to see Democratic leaders treat support for workers and small businesses as something they need to be goaded into supporting. https://t.co/jcgc9wxIKl",2020-04-16 20:38:46+00:00,False,1456,1444,3797,268,en,False,Twitter Media Studio,234,257,https://t.co/jcgc9wxIKl,https://twitter.com/senatemajldr/status/1250886374577881088/video/1,NA,NA,NA,NA,NA,NA,NA,NA
LeaderMcConnell,1249982359,1250868615013904385,"One week ago, I warned that the Paycheck Protection Program was running out of money and tried to a pass clean funding bill. Senate Democrats blocked it.

Here we are, a week later, with no progress. This morning, the PPP ran out of money and shut down, just as we’d warned. https://t.co/L8EGPHMfrn",2020-04-16 19:28:12+00:00,False,1297,1124,3369,237,en,False,Twitter Media Studio,275,298,https://t.co/L8EGPHMfrn,https://twitter.com/senatemajldr/status/1250868615013904385/video/1,NA,NA,NA,NA,NA,NA,NA,NA
LeaderMcConnell,1249982359,1250802661890367497,"Republicans tried to pass more money for Americans’ paychecks last week. Democrats blocked it. Speaker Pelosi said she saw “no data as to why we need it."" She said ""we have time to negotiate.”
 
Democrats did nothing and now the program has shut down. https://t.co/MSwJAEybO4",2020-04-16 15:06:08+00:00,False,8030,4551,20413,1151,en,False,Twitter Web App,252,275,https://t.co/MSwJAEybO4,https://twitter.com/CNBCnow/status/1250795951134052353,NA,NA,NA,NA,NA,NA,NA,NA
LeaderMcConnell,1249982359,1250784903802880000,"Millions more Americans are losing their jobs every week. Absolutely crushing.
 
Republicans have spent a week trying to fund the bipartisan Paycheck Protection Program so more Americans can keep their jobs.
 
Democrats are blocking the money and making the program run dry. https://t.co/TvdkUkRkOU",2020-04-16 13:55:34+00:00,False,1726,1560,3989,263,en,False,Twitter for iPhone,275,298,https://t.co/TvdkUkRkOU,https://twitter.com/WSJ/status/1250764118723891201,NA,NA,NA,NA,NA,NA,NA,NA
LeaderMcConnell,1249982359,1250591765662498826,The cost of continued Democratic obstruction on the Paycheck Protection Program will be pink slips and shuttered businesses. Funding for a bipartisan program should not be a partisan issue. My joint statement with @GOPLeader: https://t.co/U3xoahKTHo,2020-04-16 01:08:06+00:00,False,582,910,1819,79,en,False,Twitter Web App,226,249,https://t.co/U3xoahKTHo,https://bit.ly/2XD7QFb,NA,NA,NA,NA,NA,NA,NA,NA
LeaderMcConnell,1249982359,1250591742212145152,The Paycheck Protection Program will run out of money in a matter of hours. It has been stunning to watch our Democratic colleagues treat emergency funding for Americans’ paychecks like a Republican priority which they need to be goaded into supporting. https://t.co/U3xoahKTHo,2020-04-16 01:08:00+00:00,False,2264,1762,6818,345,en,False,Twitter Web App,254,277,https://t.co/U3xoahKTHo,https://bit.ly/2XD7QFb,NA,NA,NA,NA,NA,NA,NA,NA
LeaderMcConnell,1249982359,1250466103488393217,ICYMI🎤: I joined @FRCdc Washington Watch with Tony Perkins to discuss our work on the coronavirus crisis and the importance of an independent judiciary to protecting our Constitution. https://t.co/Y8jidl9iik,2020-04-15 16:48:46+00:00,False,117,539,535,38,en,False,Twitter for iPhone,184,207,https://t.co/Y8jidl9iik,https://m.soundcloud.com/family-research-council/senate-leader-mitch-mcconnell,NA,NA,NA,NA,NA,NA,NA,NA
LeaderMcConnell,1249982359,1250166157014859777,TUNE IN🎤: I will be speaking to @FRCdc Washington Watch with Tony Perkins at ~5:00 pm to discuss the coronavirus crisis and Judge Walker's ruling defending Kentuckians’ religious liberty. https://t.co/hvGhlPbUch,2020-04-14 20:56:53+00:00,False,105,670,525,39,en,False,Twitter Web App,188,211,https://t.co/hvGhlPbUch,https://www.tonyperkins.com/,NA,NA,NA,NA,NA,NA,NA,NA
LeaderMcConnell,1249982359,1250111824575500288,"Clean funding for worker pay in a crisis should not be controversial. I hope our Democratic colleagues will let Congress act this week. American workers deserve paychecks, not pink slips caused by political games. https://t.co/sSOr4atjw8",2020-04-14 17:20:59+00:00,False,683,1452,2544,174,en,False,Twitter Web App,214,237,https://t.co/sSOr4atjw8,https://bit.ly/2VqXaXK,NA,NA,NA,NA,NA,NA,NA,NA
LeaderMcConnell,1249982359,1249763486156173313,"Last week, Democrats objected to a clean funding increase for the crucial Paycheck Protection Program – even though it’s on track to run out of funding as soon as this week.
 
American workers deserve better than political games. https://t.co/cL4rNbCsjK",2020-04-13 18:16:49+00:00,False,1276,2182,4182,267,en,False,Twitter for iPhone,230,253,https://t.co/cL4rNbCsjK,https://twitter.com/SRCC/status/1249727948581675010,NA,NA,NA,NA,NA,NA,NA,NA
LeaderMcConnell,1249982359,1249294094163197953,"Today, even at a distance, Christians are united by the triumph of the Resurrection. I wish my fellow Kentuckians and all who celebrate a very happy and blessed Easter.",2020-04-12 11:11:37+00:00,False,2279,2169,17807,228,en,False,Twitter for iPhone,NA,NA,NA,NA,NA,NA,NA,NA,NA,NA,NA,NA
LeaderMcConnell,1249982359,1249111736122146818,Exactly. Elaine and I will be celebrating Easter at home. I encourage all Kentuckians to do likewise and to follow all CDC guidance. But governments need to protect citizens’ health without trampling basic constitutional principles at the same time. https://t.co/iZ5jX8SwxW,2020-04-11 23:06:59+00:00,False,305,756,1479,66,en,False,Twitter for iPhone,250,273,https://t.co/iZ5jX8SwxW,https://twitter.com/kyoag/status/1248995569722372097,NA,NA,NA,NA,NA,NA,NA,NA
LeaderMcConnell,1249982359,1249058586761846786,"Grateful for this strong, eloquent ruling defending Kentuckians’ religious liberty from Judge Justin Walker, @POTUS’s outstanding nominee for the D.C. Circuit. Of course church parking lots cannot be singled out with unfair standards that differ from other establishments. https://t.co/uS0V9lJ2uX",2020-04-11 19:35:48+00:00,False,1387,980,4496,161,en,False,Twitter for iPhone,273,296,https://t.co/uS0V9lJ2uX,https://twitter.com/courierjournal/status/1249051107940327427,NA,NA,NA,NA,NA,NA,NA,NA
LeaderMcConnell,1249982359,1248960721825775621,I issued the following statement with @GOPLeader on the urgent need to replenish the Paycheck Protection Program. There is no excuse for a lack of urgency. American jobs are literally at stake. https://t.co/3cDTkK8mQ9,2020-04-11 13:06:55+00:00,False,1168,1473,3696,190,en,False,Twitter for iPhone,194,217,https://t.co/3cDTkK8mQ9,https://twitter.com/senatemajldr/status/1248960721825775621/photo/1,NA,NA,NA,NA,NA,NA,NA,NA
LeaderMcConnell,1249982359,1248660227018424321,"Small business layoffs spiked 1,000% last month. 10% of the U.S. workforce is now jobless. This is no time for political games.

I hope Democrats stop blocking more funding for the Paycheck Protection Program very soon. American jobs depend on it. https://t.co/R1TGM8gc84",2020-04-10 17:12:51+00:00,False,6456,6757,22086,1025,en,False,Twitter Web App,248,271,https://t.co/R1TGM8gc84,https://www.cnbc.com/2020/04/09/small-business-layoffs-jump-1000percent-in-march.html,NA,NA,NA,NA,NA,NA,NA,NA
LeaderMcConnell,1249982359,1248383474941095936,"Thanks to the CARES Act, healthcare providers that participate in the Medicare program will receive a direct deposit in their bank accounts from @HHSGov. In Kentucky and across America, we must keep our hospitals and their brave workers equipped for success.",2020-04-09 22:53:08+00:00,False,450,781,2222,64,en,False,Twitter for iPhone,NA,NA,NA,NA,NA,NA,NA,NA,NA,NA,NA,NA
LeaderMcConnell,1249982359,1248267476032466947,We just found out that 16 million Americans have been laid off in three weeks. A staggering 10% of the labor force is now out of work. This is a crisis. No time for partisan maneuvering or politics as usual. I hope Democrats reverse course &amp; let us increase paycheck support soon.,2020-04-09 15:12:12+00:00,True,1344,1431,3979,220,en,False,Twitter Web App,NA,NA,NA,NA,NA,NA,NA,NA,NA,NA,NA,NA
LeaderMcConnell,1249982359,1248267381182550017,"Senate Democrats just blocked urgent money for a popular, bipartisan job-saving program which they themselves literally coauthored with us two weeks ago. I complimented both sides and asked to increase the dollar amount without changing anything else. But they blocked it. https://t.co/kihn5p6rLa",2020-04-09 15:11:50+00:00,False,7731,6113,14942,1538,en,False,Twitter Web App,273,296,https://t.co/kihn5p6rLa,https://twitter.com/LauraLitvan/status/1248258240154087424,NA,NA,NA,NA,NA,NA,NA,NA
LeaderMcConnell,1249982359,1248042215676563462,I hope none of my colleagues object to my request for these urgently-needed funds. There is no reason why this bipartisan job-saving program should be held hostage for other priorities. Let's re-fund the only program that's already running dry and keep moving forward together.,2020-04-09 00:17:06+00:00,True,424,396,2056,43,en,False,Twitter Web App,NA,NA,NA,NA,NA,NA,NA,NA,NA,NA,NA,NA
LeaderMcConnell,1249982359,1248042214984466433,"Ten million Americans were laid off in just the last two weeks. Tomorrow morning will likely bring another historic unemployment figure. This is urgent. If Senators delay this urgent paycheck support to insist on a broader bill, more Americans will lose their jobs unnecessarily.",2020-04-09 00:17:06+00:00,True,406,229,1827,24,en,False,Twitter Web App,NA,NA,NA,NA,NA,NA,NA,NA,NA,NA,NA,NA
LeaderMcConnell,1249982359,1248042214263054342,"If we want to act fast, Congress has to focus. There is no realistic chance that another sprawling bill which allocates half a trillion dollars to a number of priorities, even important ones, will be able to pass the Senate or the House by unanimous consent this week.",2020-04-09 00:17:06+00:00,True,167,58,713,8,en,False,Twitter Web App,NA,NA,NA,NA,NA,NA,NA,NA,NA,NA,NA,NA
LeaderMcConnell,1249982359,1248042213533265931,"Nobody thinks tomorrow will be the Senate’s last word on COVID-19. Other crucial parts of the CARES Act, like its historic funds for hospitals and healthcare providers, are still coming online and have not yet been exhausted. The PPP is where the lights are already flashing red.",2020-04-09 00:17:05+00:00,True,167,57,722,5,en,False,Twitter Web App,NA,NA,NA,NA,NA,NA,NA,NA,NA,NA,NA,NA
LeaderMcConnell,1249982359,1248042212753104896,"Tomorrow morning, I’ll ask unanimous consent to pass standalone emergency funding for the hugely popular Paycheck Protection Program that is saving small-business jobs as we speak. As the rest of the CARES Act continues to come online, this key part is already low on funds.",2020-04-09 00:17:05+00:00,False,2223,1643,10335,319,en,False,Twitter Web App,NA,NA,NA,NA,NA,NA,NA,NA,NA,NA,NA,NA
