ScreenName,AuthorID,TweetID,Text,TweetDate,isReply,RetweetCount,ReplyCount,LikeCount,QuoteCount,Language,PossibleSensitive,Source,1stURLStart,1stURLEnd,1stURL,1stURLExp,2ndURLStart,2ndURLEnd,2ndURL,2ndURLExp,3rdURLStart,3rdURLEnd,3rdURL,3rdURLExp
AOC,138203134,1433113302662516736,"Among many other warnings, survivors warned that sexual assault is about abuse of power,&amp; a judge credibly accused of such shouldn’t be trusted w the rights of the vulnerable.

Now Roe is upended. But we’re not going anywhere. This is a fight for our lives.https://t.co/9PhrgeYuHv",2021-09-01 17:03:31+00:00,False,3238,693,17620,262,en,False,Twitter for iPhone,261,284,https://t.co/9PhrgeYuHv,https://twitter.com/Ocasio2018/status/1048276569788239872/video/1,NA,NA,NA,NA,NA,NA,NA,NA
AOC,138203134,1433099333566664706,"I do not understand the fixation among some powerful people in politics and media constantly seeking out ways to reward a man who helped cover up the murder of a 16 year old boy. It’s shameful.

Laquan McDonald’s life mattered. The Senate should vote NO on Emanuel’s confirmation. https://t.co/2GpsFxiCPK",2021-09-01 16:08:01+00:00,False,2740,398,19325,134,en,False,Twitter for iPhone,281,304,https://t.co/2GpsFxiCPK,https://twitter.com/KevinFreyTV/status/1433037963445821444,NA,NA,NA,NA,NA,NA,NA,NA
AOC,138203134,1431366892938219520,"My monthly town hall is starting at 5:30! We’ll be discussing latest updates with our community on Afghanistan, emergency rental assistance, infrastructure + jobs legislation, and more. Check out @RepAOC for details to tune in.",2021-08-27 21:23:55+00:00,False,414,745,5081,43,en,False,Twitter for iPhone,NA,NA,NA,NA,NA,NA,NA,NA,NA,NA,NA,NA
AOC,138203134,1430669896699060226,Protip to keep your ice cream cool: stop burning fossil fuels https://t.co/GNqmQej3D7,2021-08-25 23:14:18+00:00,False,5890,2456,74616,649,en,False,Twitter for iPhone,62,85,https://t.co/GNqmQej3D7,https://twitter.com/ExxonMobil_EU/status/1430513436115578881,NA,NA,NA,NA,NA,NA,NA,NA
AOC,138203134,1430663996349329411,"Don’t assume that everyone who isn’t vaccinated yet is radicalized or too far gone in conspiracy theories.

There are lots of people who are hesitant bc they can’t afford to take a day off work, are scared it isn’t free due to our broken healthcare system, etc.

Talk to them!",2021-08-25 22:50:51+00:00,True,821,728,7833,99,en,False,Twitter for iPhone,NA,NA,NA,NA,NA,NA,NA,NA,NA,NA,NA,NA
AOC,138203134,1430663112714248193,"Back from my August Twitter break to share some resources we made on a question I am very frequently asked:

“How do I talk to friends and family about getting vaccinated?”

Here are some tips from our organizing base @TeamAOC: https://t.co/vB2B0OTmrO",2021-08-25 22:47:21+00:00,False,1483,584,8121,112,en,False,Twitter for iPhone,228,251,https://t.co/vB2B0OTmrO,https://twitter.com/AOC/status/1430663112714248193/photo/1,228,251,https://t.co/vB2B0OTmrO,https://twitter.com/AOC/status/1430663112714248193/photo/1,228,251,https://t.co/vB2B0OTmrO,https://twitter.com/AOC/status/1430663112714248193/photo/1
AOC,138203134,1427326396490305542,"For all those who lost, sacrificed, suffered, and served in the last 20 years of war and occupation, the United States has a singular responsibility in extending safe refuge to the Afghan people.

That is the absolute floor. https://t.co/j5FXjHXhAT",2021-08-16 17:48:26+00:00,False,4542,2627,42743,444,en,False,Twitter for iPhone,225,248,https://t.co/j5FXjHXhAT,https://twitter.com/RepAOC/status/1427321719056998406,NA,NA,NA,NA,NA,NA,NA,NA
AOC,138203134,1426587210497789952,Shout out to libraries and library workers. We love and appreciate you 📚 that’s all,2021-08-14 16:51:10+00:00,False,15188,2471,156912,1653,en,False,Twitter for iPhone,NA,NA,NA,NA,NA,NA,NA,NA,NA,NA,NA,NA
AOC,138203134,1426311395323297795,"I couldn’t care less about what this talking inferiority complex has to say, but I do feel for the women and survivors in his life who now see they wouldn’t be believed or safe with him.

Many survivors of assault don’t tell family, friends, etc bc of how they see others treated. https://t.co/hfB6GSIAWm",2021-08-13 22:35:10+00:00,False,16605,5234,121593,1041,en,False,Twitter for iPhone,281,304,https://t.co/hfB6GSIAWm,https://twitter.com/donwinslow/status/1425986198758064132,NA,NA,NA,NA,NA,NA,NA,NA
AOC,138203134,1426282025296834562,"I am incredibly grateful that the COVID funeral assistance program we worked w/ advocates to pass into law has helped so many people.

We have now provided over $1B in help to families who have endured the unimaginable loss of a loved one during COVID.

Help is still available ⬇️ https://t.co/k4m49buzHc",2021-08-13 20:38:28+00:00,False,1343,817,11420,241,en,False,Twitter for iPhone,281,304,https://t.co/k4m49buzHc,https://twitter.com/SenSchumer/status/1426209453666357255,NA,NA,NA,NA,NA,NA,NA,NA
AOC,138203134,1425935557667037189,Here’s an example of some of that work - pretty much everyone in this video is a local community organizer who put in a TON of work in getting their communities accurately counted. Major shout out to @JulieMenin &amp; the NYC census team who did a stellar job! https://t.co/gbxjNMBq8j,2021-08-12 21:41:44+00:00,True,286,135,3205,28,en,False,Twitter for iPhone,261,284,https://t.co/gbxjNMBq8j,https://twitter.com/AOC/status/1306631623019032576/video/1,NA,NA,NA,NA,NA,NA,NA,NA
AOC,138203134,1425934251497824259,"THANK YOU to all the organizers and advocates across the city who worked tirelessly on our Census efforts last year.

On top of official efforts, @TeamAOC dedicated an addtl $3M+ to Census organizing in our community.

It worked! The Bronx &amp; Queens were top performers nationally. https://t.co/W0lXspzKk6",2021-08-12 21:36:32+00:00,False,799,276,9020,50,en,False,Twitter for iPhone,285,308,https://t.co/W0lXspzKk6,https://twitter.com/Redistrict/status/1425903533728075781,NA,NA,NA,NA,NA,NA,NA,NA
AOC,138203134,1425791756877058049,Anyways shout out to @JoeNeguse and @CongressmanRaja as we continue plugging away at the Ban Conflicted Trading Act 📈💰,2021-08-12 12:10:19+00:00,True,790,234,13226,20,en,False,Twitter for iPhone,NA,NA,NA,NA,NA,NA,NA,NA,NA,NA,NA,NA
AOC,138203134,1425790976480657409,"It is absolutely wild that members of Congress are still allowed to buy and sell individual stock. It shouldn’t be legal.

We’ve introduced legislation to end the practice, but as one can imagine it’s a very uphill battle to pass.

This shouldn’t even be controversial though! https://t.co/lgtcASwCFz",2021-08-12 12:07:13+00:00,False,14798,3446,121957,1197,en,False,Twitter for iPhone,277,300,https://t.co/lgtcASwCFz,https://twitter.com/waltshaub/status/1425763358494560261,NA,NA,NA,NA,NA,NA,NA,NA
AOC,138203134,1425584209922609152,"It was clear from the beginning that the way a skinny bill gets a shot is if it’s part of a larger infrastructure package. Voting on the skinny lobbyist-friendly bill 1st gives conservatives leeway to hurt the larger infrastructure bill w/childcare, Medicare, climate,etc. Nope 🙅🏽‍♀️",2021-08-11 22:25:36+00:00,True,849,427,10675,49,en,False,Twitter for iPhone,NA,NA,NA,NA,NA,NA,NA,NA,NA,NA,NA,NA
AOC,138203134,1425580130693533696,"Conservative* House Democrats. 

Let’s stop pretending that Dems who threaten to tank the President’s agenda, kill childcare/Medicare expansion, and work w/ GOP to expand the cruelest parts of our immigration system are “moderate.”

They are not moderate. They’re conservative. https://t.co/EW7t1gSN8A",2021-08-11 22:09:23+00:00,False,4938,1461,36743,352,en,False,Twitter for iPhone,278,301,https://t.co/EW7t1gSN8A,https://twitter.com/lindsemcpherson/status/1425509013001809925,NA,NA,NA,NA,NA,NA,NA,NA
AOC,138203134,1425536266561589249,Also - any economic historians out there with reading material recommendations on TNEC? I’ve been studying up on the history of the original cmte but always open to new suggestions/recommendations 🤗,2021-08-11 19:15:05+00:00,True,160,118,1905,13,en,False,Twitter for iPhone,NA,NA,NA,NA,NA,NA,NA,NA,NA,NA,NA,NA
AOC,138203134,1425535649529090050,"The TNEC started w/ examining monopoly and antitrust, but found that inequality sprawled far beyond that -&amp; some credit the TNEC with advancing the economic groundwork for New Deal-era policies like Social Security &amp; more.

All of this is to say: watch this space. @FairGrowthCmte",2021-08-11 19:12:38+00:00,True,176,52,2140,3,en,False,Twitter for iPhone,NA,NA,NA,NA,NA,NA,NA,NA,NA,NA,NA,NA
AOC,138203134,1425533949305032705,"The @FairGrowthCmte is a historic temporary select committee to tackle inequality in America.

It is modeled off TNEC, (Temporary Nat’l Economic Committee) that was charged w/ investigating the extreme concentration of economic power in the US leading up to the Great Depression.",2021-08-11 19:05:53+00:00,True,136,54,1404,5,en,False,Twitter for iPhone,NA,NA,NA,NA,NA,NA,NA,NA,NA,NA,NA,NA
AOC,138203134,1425532622890049541,"The average family in the US used to double their income once every 23 years.

Today it takes over 100 years.

We are in an absolute crisis of inequality. To study it,the House launched a historic @FairGrowthCmte,a revival of TNEC that helped steer us out of the Great Depression. https://t.co/Tc3yDZuX1d",2021-08-11 19:00:37+00:00,False,2739,806,15214,118,en,False,Twitter for iPhone,281,304,https://t.co/Tc3yDZuX1d,https://twitter.com/FairGrowthCmte/status/1421151874355445764,NA,NA,NA,NA,NA,NA,NA,NA
AOC,138203134,1425216301979553797,Gov. Cuomo’s resignation is necessary and long overdue. But there is still a large amount of work ahead to account for and reverse the ways our institutions were molded over years to maximize the impunity and lack of transparency necessary for these abuses to unfold as they did.,2021-08-10 22:03:40+00:00,True,1048,396,14683,49,en,False,Twitter for iPhone,NA,NA,NA,NA,NA,NA,NA,NA,NA,NA,NA,NA
AOC,138203134,1425216300238966784,"There is a huge difference between having an awkward interaction and discussing / learning from it vs. mobilizing entire networks and institutions to bring in victims, silence coverage, and retaliate against those who report abuse.

Trying to blur that line helps abuses continue.",2021-08-10 22:03:39+00:00,True,892,104,12172,26,en,False,Twitter for iPhone,NA,NA,NA,NA,NA,NA,NA,NA,NA,NA,NA,NA
AOC,138203134,1425216298246619142,"When abusers of power blame everyone else for “misunderstanding” their abuse, it is often a way to gain sympathy from those who’ve ever been / could be involved in a misunderstanding.

But the intentional environment of fear &amp; intimidation harassers create is far from a mistake.",2021-08-10 22:03:39+00:00,False,3480,666,31658,150,en,False,Twitter for iPhone,NA,NA,NA,NA,NA,NA,NA,NA,NA,NA,NA,NA
AOC,138203134,1424193132518850565,"War was bipartisan.
Tax cuts for the rich were bipartisan.
Wall St bailouts were bipartisan.
Fossil fuel giveaways were/are bipartisan.

Just because something is “bipartisan” doesn’t make it intrinsically good for people or worthy of passage. Substance matters.",2021-08-08 02:17:57+00:00,True,3873,835,28076,199,en,False,Twitter for iPhone,NA,NA,NA,NA,NA,NA,NA,NA,NA,NA,NA,NA
AOC,138203134,1424189945455984649,"If mods want to blow up the infra deal, that’s on them.

I know this is tough for some to understand, but the US is more than a handful of suburbs- communities outside them aren’t disposable.

And just bc something is “bipartisan” doesn’t mean it’s good. Look at Wall St bailouts. https://t.co/BDTxTEcwG6",2021-08-08 02:05:17+00:00,False,2731,1280,21429,268,en,False,Twitter for iPhone,281,304,https://t.co/BDTxTEcwG6,https://twitter.com/mkraju/status/1424147337249689602,NA,NA,NA,NA,NA,NA,NA,NA
AOC,138203134,1423045000938524673,"💯%. On Capitol Hill, the norm in staff culture is to advise to pull back, not push, &amp; be cautious.

The only way this happened was with the dedicated staff surrounding us. For every member that slept out, there were staff rallying out there too.

They are major public servants. https://t.co/mMRkFTkunM",2021-08-04 22:15:41+00:00,False,739,590,8476,30,en,False,Twitter for iPhone,283,306,https://t.co/mMRkFTkunM,https://twitter.com/AyannaPressley/status/1423024163103690758,NA,NA,NA,NA,NA,NA,NA,NA
AOC,138203134,1423010425583640577,"Reminder: BOTH tenants and landlords can get help through the emergency rental assistance program. 🏡

It not only covers rent, but may also cover utilities, moving expenses, security deposits, late fees, etc.

Please share widely! Applications are here:
https://t.co/E9ppP8HZA7",2021-08-04 19:58:18+00:00,False,5018,601,10829,181,en,False,Twitter for iPhone,254,277,https://t.co/E9ppP8HZA7,https://home.treasury.gov/policy-issues/coronavirus/assistance-for-state-local-and-tribal-governments/emergency-rental-assistance-program/program-index,NA,NA,NA,NA,NA,NA,NA,NA
AOC,138203134,1422727837044379648,Donkey of the day material https://t.co/rcuNQ8HcOb,2021-08-04 01:15:24+00:00,False,1089,886,19773,80,en,False,Twitter for iPhone,27,50,https://t.co/rcuNQ8HcOb,https://twitter.com/PDEditorial/status/1422671172270006279,NA,NA,NA,NA,NA,NA,NA,NA
AOC,138203134,1422722310038081536,"Give @CoriBush her flowers 💐 she just paved the way for 11 million renters in the United States.

Servant leadership in action. https://t.co/nu4uCz4vvx",2021-08-04 00:53:26+00:00,False,9212,1855,105586,562,en,False,Twitter for iPhone,128,151,https://t.co/nu4uCz4vvx,https://twitter.com/AOC/status/1422722310038081536/photo/1,NA,NA,NA,NA,NA,NA,NA,NA
AOC,138203134,1422692582186946567,"In both small ways and large, “it always seems impossible until it’s done.” 💜 https://t.co/UQnidnGwWZ",2021-08-03 22:55:18+00:00,False,7814,1623,106183,320,en,False,Twitter for iPhone,78,101,https://t.co/UQnidnGwWZ,https://twitter.com/corinne_perkins/status/1422686336415375360,NA,NA,NA,NA,NA,NA,NA,NA
AOC,138203134,1421968938695643138,Housing is a human right. 🏡 Thank you for leading the way @CoriBush 💜 https://t.co/AwmEJoU5kv,2021-08-01 22:59:48+00:00,False,4354,2056,57163,340,en,False,Twitter for iPhone,70,93,https://t.co/AwmEJoU5kv,https://twitter.com/AOC/status/1421968938695643138/photo/1,NA,NA,NA,NA,NA,NA,NA,NA
AOC,138203134,1421843342791413760,¡Así se hace! 💜🇵🇷 Qué orgullo 🇵🇷 https://t.co/m5sGHzWMGC,2021-08-01 14:40:44+00:00,False,619,199,12701,29,es,False,Twitter for iPhone,33,56,https://t.co/m5sGHzWMGC,https://twitter.com/NBCOlympics/status/1421790778754486276,NA,NA,NA,NA,NA,NA,NA,NA
AOC,138203134,1421681394997157891,"We’re out here to extend the moratorium, so where’s Congress? It’s time we come back and #ExtendTheMoratorium https://t.co/5n2h4NMfEp",2021-08-01 03:57:12+00:00,False,3630,1867,35709,388,en,False,Twitter for iPhone,110,133,https://t.co/5n2h4NMfEp,https://twitter.com/AOC/status/1421681394997157891/photo/1,NA,NA,NA,NA,NA,NA,NA,NA
AOC,138203134,1421662360247341065,Let’s go!! @RepMaxineWaters https://t.co/z2rsQSKg3x,2021-08-01 02:41:34+00:00,False,943,534,8783,51,en,False,Twitter for iPhone,28,51,https://t.co/z2rsQSKg3x,https://twitter.com/RepMaxineWaters/status/1421515057599590406,NA,NA,NA,NA,NA,NA,NA,NA
AOC,138203134,1421236682687451138,We tried to object to the House adjourning session and force a roll call on whether we should leave. They rushed to adjourn before we could get to the floor. https://t.co/chSr2YgIGR,2021-07-30 22:30:05+00:00,False,1484,883,12283,198,en,False,Twitter for iPhone,158,181,https://t.co/chSr2YgIGR,https://twitter.com/heatherscope/status/1421232501260005376,NA,NA,NA,NA,NA,NA,NA,NA
AOC,138203134,1421181243195072517,"For some on Capitol Hill, it’s not about what we can do for our country, but what the country can do for their vacation.

Call your member of Congress and tell them to stay at work until we finish the job.

States haven’t released rent relief. We need to extend the moratorium. https://t.co/UtIbeaPKkM",2021-07-30 18:49:47+00:00,False,1462,443,8914,84,en,False,Twitter for iPhone,278,301,https://t.co/UtIbeaPKkM,https://twitter.com/sarahnferris/status/1421163562492432394,NA,NA,NA,NA,NA,NA,NA,NA
AOC,138203134,1421173490334453761,"This week I presented my amendment to remove barriers to research on therapeutic potential of psychedelic substances.

The 1st time I offered it, members laughed at me on the House floor. I got 91 votes.

This time, more understood. Support surged to 140 votes. We won’t give up! https://t.co/Ms2lg2CFxj",2021-07-30 18:18:58+00:00,False,1794,453,19412,186,en,False,Twitter for iPhone,280,303,https://t.co/Ms2lg2CFxj,https://twitter.com/MattLaslo/status/1420950135308173312,NA,NA,NA,NA,NA,NA,NA,NA
AOC,138203134,1421144718688325634,"When you accidentally let your billionaire funder-talk slip out on TV, you say things like “a healthy ruling class” https://t.co/u7sf0fGPI4",2021-07-30 16:24:39+00:00,False,10463,2480,81040,583,en,False,Twitter for iPhone,116,139,https://t.co/u7sf0fGPI4,https://twitter.com/justinbaragona/status/1420908065092669441,NA,NA,NA,NA,NA,NA,NA,NA
AOC,138203134,1421138682791317505,"Totally agree.

In fact, to further protect Medicare from socialism, let’s strengthen it to include dental, vision, hearing, &amp; mental healthcare and then allow all Americans to enjoy its benefits.

Trust me, Medicare for All is the #1 thing you can do to own the socialists. https://t.co/iqmPDV3Cy6",2021-07-30 16:00:40+00:00,False,6112,1250,43187,450,en,False,Twitter for iPhone,279,302,https://t.co/iqmPDV3Cy6,https://twitter.com/EliseStefanik/status/1421115026300186634,NA,NA,NA,NA,NA,NA,NA,NA
AOC,138203134,1420824029359915013,"Exxon lobbyists bragged about how much influence they had in this deal.

This is what that influence looks like ⬇️ https://t.co/9XfhPniCDo",2021-07-29 19:10:20+00:00,False,6517,918,28718,250,en,False,Twitter for iPhone,115,138,https://t.co/9XfhPniCDo,https://twitter.com/AdamAton/status/1420757756030570502,NA,NA,NA,NA,NA,NA,NA,NA
AOC,138203134,1420815101939027969,"For folks following along at home, recall that McConnell announced publicly that “100 percent of [his] focus” is on blocking the Biden admin. https://t.co/2E6E1Jd2WE",2021-07-29 18:34:52+00:00,False,2577,795,15879,109,en,False,Twitter for iPhone,142,165,https://t.co/2E6E1Jd2WE,https://twitter.com/hugolowell/status/1420482523260411905,NA,NA,NA,NA,NA,NA,NA,NA
AOC,138203134,1420566037435666443,"You are a champion and role model to us all. Thank you for showing us what greatness and bravery look like - on the outside *and* the inside.

You make our country proud. 💜 https://t.co/NPeGOBykoS",2021-07-29 02:05:10+00:00,False,2703,544,58665,58,en,False,Twitter for iPhone,173,196,https://t.co/NPeGOBykoS,https://twitter.com/Simone_Biles/status/1420561448883802118,NA,NA,NA,NA,NA,NA,NA,NA
AOC,138203134,1420562222317768705,"A lot of times, “bipartisan agreements” are just as defined by who people in power agree to exclude than include. https://t.co/9o4y3j60fD",2021-07-29 01:50:01+00:00,False,4506,3305,45466,1057,en,False,Twitter for iPhone,114,137,https://t.co/9o4y3j60fD,https://twitter.com/AOC/status/1420562222317768705/photo/1,NA,NA,NA,NA,NA,NA,NA,NA
AOC,138203134,1420456411256037379,"Good luck tanking your own party’s investment on childcare, climate action, and infrastructure while presuming you’ll survive a 3 vote House margin - especially after choosing to exclude members of color from negotiations and calling that a “bipartisan accomplishment.” 👍🏽👍🏽 https://t.co/0VF8Z73vAa",2021-07-28 18:49:33+00:00,False,5251,2454,40679,736,en,False,Twitter for iPhone,275,298,https://t.co/0VF8Z73vAa,https://twitter.com/dannowicki/status/1420444138734977024,NA,NA,NA,NA,NA,NA,NA,NA
AOC,138203134,1419740763324354563,"Communities cannot “out-organize” voter suppression when those they organize to elect won’t protect the vote.

&amp; Even if they DO out-organize, the ground is being set to overturn results.

The time to fight like hell for democracy is right now. We may not get another chance. #HR1 https://t.co/ePFJNMVlHD",2021-07-26 19:25:50+00:00,False,4168,1140,19800,221,en,False,Twitter for iPhone,285,308,https://t.co/ePFJNMVlHD,https://twitter.com/lizcgoodwin/status/1418532286077841414,NA,NA,NA,NA,NA,NA,NA,NA
AOC,138203134,1419727827956486159,"Help turn out the vote with a phonebank this week: https://t.co/GbF6MacINi

🎥: @androsesco",2021-07-26 18:34:26+00:00,True,271,104,1632,10,en,False,Twitter for iPhone,51,74,https://t.co/GbF6MacINi,http://www.mobilize.us/ninaturner,NA,NA,NA,NA,NA,NA,NA,NA
AOC,138203134,1419727404084436998,"Ohio, thank you for the warm welcome this weekend!

It’s time to send @ninaturner to Congress- because our democracy should belong to everyday people over big money.

Early voting is now open!
Election Day is August 3rd 🗳 

Join a phonebanking shift below
https://t.co/c3BR1JLokq",2021-07-26 18:32:45+00:00,False,1127,640,9688,95,en,False,Twitter for iPhone,256,279,https://t.co/c3BR1JLokq,https://twitter.com/AndRosesCo/status/1419691456982306828/video/1,NA,NA,NA,NA,NA,NA,NA,NA
AOC,138203134,1419036266478424065,"We’ve got 10 days, Ohio!

Time to get to work: https://t.co/4WNpHgVbDY https://t.co/F2bzMYdwSS",2021-07-24 20:46:25+00:00,False,1019,653,6417,59,en,False,Twitter for iPhone,47,70,https://t.co/4WNpHgVbDY,http://mobilize.us/ninaturner/,71,94,https://t.co/F2bzMYdwSS,https://twitter.com/OurRevolution/status/1419025417118359555,NA,NA,NA,NA
AOC,138203134,1418767127130087425,"What’s up Cleveland! Thank you for the warm welcome! 💪🏽💙

Are you ready to lace up your shoes and start knocking doors for @ninaturner?

I’ll be helping launch canvasses and community meet ups all across the city tomorrow.

Join us locally or remotely: https://t.co/p5Ys6porgb https://t.co/HhtDpbrotJ",2021-07-24 02:56:57+00:00,False,720,378,6750,67,en,False,Twitter for iPhone,253,276,https://t.co/p5Ys6porgb,https://www.mobilize.us/ninaturner/,277,300,https://t.co/HhtDpbrotJ,https://twitter.com/ninaturner/status/1418388446301798405,NA,NA,NA,NA
AOC,138203134,1418325613442736129,"Last time I intro’d this, both parties voted against it &amp; some laughed.

But I am undeterred! 🙂 I’ll keep bringing it up until the times catch up.

If you want your member lift the roadblock, call their office &amp; tell them! It really does make a difference https://t.co/t177CriorL",2021-07-22 21:42:32+00:00,True,621,353,12244,42,en,False,Twitter for iPhone,264,287,https://t.co/t177CriorL,https://www.house.gov/representatives/find-your-representative,NA,NA,NA,NA,NA,NA,NA,NA
AOC,138203134,1418324126826127360,"It is ridiculous that Congress upholds War on Drugs-era barriers on federal research into substances like psilocybin, ibogaine,&amp; MDMA when early results are indicating major promise in treating PTSD, addiction,&amp; more.

I’m trying (again) to lift them so we can pursue the science. https://t.co/e87U3UYhUS",2021-07-22 21:36:37+00:00,False,4972,1132,39510,443,en,False,Twitter for iPhone,289,312,https://t.co/e87U3UYhUS,https://twitter.com/kylejaeger/status/1418274502639718402,NA,NA,NA,NA,NA,NA,NA,NA
AOC,138203134,1418001489738489859,"Today we held the first Congressional hearing in modern history on public banking.

Apparently it is too high of a bar to expect Republican members of Congress to, you know, actually read the bills they’re talking about, but nevertheless it went very well! https://t.co/d8FrHP8WQi",2021-07-22 00:14:35+00:00,False,6636,1409,61175,320,en,False,Twitter for iPhone,257,280,https://t.co/d8FrHP8WQi,https://twitter.com/J_LaRosa415/status/1417982670915604485,NA,NA,NA,NA,NA,NA,NA,NA
AOC,138203134,1417966779415080961,The aliens can have him 👽 https://t.co/C6zmt7hj0T,2021-07-21 21:56:39+00:00,False,4949,1657,80338,324,en,False,Twitter for iPhone,26,49,https://t.co/C6zmt7hj0T,https://twitter.com/ftrain/status/1417832184979787776,NA,NA,NA,NA,NA,NA,NA,NA
