ScreenName,AuthorID,TweetID,Text,TweetDate,isReply,RetweetCount,ReplyCount,LikeCount,QuoteCount,Language,PossibleSensitive,Source,1stURLStart,1stURLEnd,1stURL,1stURLExp,2ndURLStart,2ndURLEnd,2ndURL,2ndURLExp,3rdURLStart,3rdURLEnd,3rdURL,3rdURLExp
KamalaHarris,30354991,1460622187417776131,President @JoeBiden signing the Bipartisan Infrastructure Deal is proof that Democrats and Republicans can come together and deliver results for the American people.,2021-11-16 14:54:01+00:00,False,1947,849,16551,98,en,False,Sprout Social,NA,NA,NA,NA,NA,NA,NA,NA,NA,NA,NA,NA
KamalaHarris,30354991,1460424886338428929,"Together, the Bipartisan Infrastructure Deal and Build Back Better Act will create good-paying jobs, rebuild our crumbling infrastructure, lower costs for working families, and make historic investments in our future.",2021-11-16 01:50:00+00:00,False,1287,477,9079,41,en,False,Sprout Social,NA,NA,NA,NA,NA,NA,NA,NA,NA,NA,NA,NA
KamalaHarris,30354991,1460419664761212928,Today is a historic day for our nation’s infrastructure and the American people. https://t.co/ki6D4OaJ2H,2021-11-16 01:29:16+00:00,False,1299,524,9033,86,en,False,Sprout Social,81,104,https://t.co/ki6D4OaJ2H,https://twitter.com/KamalaHarris/status/1460419664761212928/video/1,NA,NA,NA,NA,NA,NA,NA,NA
KamalaHarris,30354991,1460402739360456707,"From the start of our administration, we were determined to follow through with our promise to invest in our nation's infrastructure. Today, when President @JoeBiden signed the Bipartisan Infrastructure Deal into law, we did just that.",2021-11-16 00:22:00+00:00,False,2465,736,17536,79,en,False,Sprout Social,NA,NA,NA,NA,NA,NA,NA,NA,NA,NA,NA,NA
KamalaHarris,30354991,1460383110764408835,"The Bipartisan Infrastructure Deal is a once-in-a-generation investment in America’s infrastructure. It will deliver: 

— Repaired roads and bridges 
— Clean water
— High speed internet
— Stronger supply chains
— A more resilient electrical grid
— Good-paying jobs",2021-11-15 23:04:00+00:00,False,1915,574,10522,117,en,False,Sprout Social,NA,NA,NA,NA,NA,NA,NA,NA,NA,NA,NA,NA
KamalaHarris,30354991,1460361244897128456,"President @JoeBiden just signed the Bipartisan Infrastructure Deal into law. 

It will create good-paying jobs, strengthen our supply chains, and invest in modernizing everything from our bridges and roads to our electrical grid.",2021-11-15 21:37:07+00:00,False,2360,705,17256,107,en,False,Sprout Social,NA,NA,NA,NA,NA,NA,NA,NA,NA,NA,NA,NA
KamalaHarris,30354991,1460270369609494528,"It’s like President @JoeBiden said: Infrastructure week has arrived.
https://t.co/GkuceM9Ua2",2021-11-15 15:36:01+00:00,False,1457,555,9507,82,en,False,Sprout Social,69,92,https://t.co/GkuceM9Ua2,https://twitter.com/TheDemocrats/status/1458627836915376130/video/1,NA,NA,NA,NA,NA,NA,NA,NA
KamalaHarris,30354991,1460058722223497218,"While our economy has added 5.6 million jobs this year, people across the country are seeing higher prices on everything from gas to groceries.

The Bipartisan Infrastructure Deal and Build Back Better Act will help lower costs for working families.",2021-11-15 01:35:00+00:00,False,2793,1450,16950,138,en,False,Sprout Social,NA,NA,NA,NA,NA,NA,NA,NA,NA,NA,NA,NA
KamalaHarris,30354991,1460011209953058829,"The Bipartisan Infrastructure Deal will create good-paying, union jobs in transforming America’s infrastructure. https://t.co/T0Ir1ss4nb",2021-11-14 22:26:12+00:00,False,689,397,3988,24,en,False,Sprout Social,113,136,https://t.co/T0Ir1ss4nb,https://twitter.com/KamalaHarris/status/1460011209953058829/video/1,NA,NA,NA,NA,NA,NA,NA,NA
KamalaHarris,30354991,1459974442776473603,The Build Back Better legislation will help lower the cost of health care and help to lower costs for families across the country.,2021-11-14 20:00:06+00:00,False,1777,910,12459,81,en,False,Sprout Social,NA,NA,NA,NA,NA,NA,NA,NA,NA,NA,NA,NA
KamalaHarris,30354991,1459928112037351430,"Nearly 2M women have been locked out of the workforce during the pandemic, often due to lack of accessible, affordable child and elder care.

Our Build Back Better Framework will establish universal pre-K and lower costs for caregiving to help families get back on their feet.",2021-11-14 16:56:00+00:00,False,2414,965,15322,129,en,False,Sprout Social,NA,NA,NA,NA,NA,NA,NA,NA,NA,NA,NA,NA
KamalaHarris,30354991,1459697843862605829,"Our Bipartisan Infrastructure Deal is an unprecedented effort in investing in passenger rail, roads, and bridges, clean energy, and modernizing our ports—all while lowering costs for working families. 
https://t.co/eA2QKy2THr",2021-11-14 01:41:00+00:00,False,1001,803,6379,63,en,False,Sprout Social,202,225,https://t.co/eA2QKy2THr,https://twitter.com/TheDemocrats/status/1458602682051174402/video/1,NA,NA,NA,NA,NA,NA,NA,NA
KamalaHarris,30354991,1459626374306672653,"17 Nobel Prize winning economists agree that passing the Build Back Better legislation will help ease longer-term inflationary pressures and lower costs for working families.
 
It’s time for Congress to get this done.",2021-11-13 20:57:00+00:00,False,3321,1299,17830,167,en,False,Sprout Social,NA,NA,NA,NA,NA,NA,NA,NA,NA,NA,NA,NA
KamalaHarris,30354991,1459576802238676995,"Pre-K in the United States costs about $8,600 per year. 

President @JoeBiden’s Build Back Better Framework will deliver free, universal preschool for every 3- and 4-year old in America, easing the burden on working families and investing in our children’s future.",2021-11-13 17:40:01+00:00,False,2242,985,14129,110,en,False,Sprout Social,NA,NA,NA,NA,NA,NA,NA,NA,NA,NA,NA,NA
KamalaHarris,30354991,1459560440057712640,"The Build Back Better Act will help to reduce the cost of health care, child care, and elder care and cut taxes for middle class families.
 
Congress must pass this legislation right away to lower costs for working families and help people get back to work.",2021-11-13 16:35:00+00:00,False,1343,648,8536,63,en,False,Sprout Social,NA,NA,NA,NA,NA,NA,NA,NA,NA,NA,NA,NA
KamalaHarris,30354991,1459330171983613966,The COVID-19 vaccines are safe and effective—and the best way to protect our kids. Children between the ages of 5-11 are now eligible to get vaccinated.,2021-11-13 01:20:00+00:00,False,2543,1428,21553,136,en,False,Sprout Social,NA,NA,NA,NA,NA,NA,NA,NA,NA,NA,NA,NA
KamalaHarris,30354991,1459280596212101122,American families are feeling the burden of rising costs right now. Congress can take immediate action to help ease that burden by passing the Build Back Better Act.,2021-11-12 22:03:00+00:00,False,1882,1403,12972,186,en,False,Sprout Social,NA,NA,NA,NA,NA,NA,NA,NA,NA,NA,NA,NA
KamalaHarris,30354991,1459243098366787585,"President @JoeBiden promised to deliver a much-needed investment in our nation’s infrastructure—and that is exactly what he has done. 
https://t.co/FmXVsr2uIG",2021-11-12 19:34:00+00:00,False,703,486,4022,44,en,False,Sprout Social,135,158,https://t.co/FmXVsr2uIG,https://twitter.com/TheDemocrats/status/1458058089610031109/video/1,NA,NA,NA,NA,NA,NA,NA,NA
KamalaHarris,30354991,1459206122900971529,"President @JoeBiden’s Build Back Better Framework will create millions of good-paying jobs, ensuring that American workers, businesses, and farmers can compete and win in the 21st century.",2021-11-12 17:07:05+00:00,False,1387,834,9403,75,en,False,Sprout Social,NA,NA,NA,NA,NA,NA,NA,NA,NA,NA,NA,NA
KamalaHarris,30354991,1458604390072340483,"The Build Back Better Framework is going to bolster the middle class and grow our economy from the bottom up and the middle out.

But how will we pay for it?

It’s simple: by asking that the wealthy and corporations pay their fair share.",2021-11-11 01:16:00+00:00,False,1848,1433,12661,115,en,False,Sprout Social,NA,NA,NA,NA,NA,NA,NA,NA,NA,NA,NA,NA
KamalaHarris,30354991,1458536697612939265,"By reducing premiums for more than 9 million Americans and delivering health care coverage to up to 4 million uninsured people, the Build Back Better Framework will make health care more affordable for millions of working families.",2021-11-10 20:47:01+00:00,False,1646,689,10353,80,en,False,Sprout Social,NA,NA,NA,NA,NA,NA,NA,NA,NA,NA,NA,NA
KamalaHarris,30354991,1458490642296889346,"The Bipartisan Infrastructure Deal isn't just a historic investment in public transit, clean drinking water, and expanding broadband—it will increase access to opportunity for people across America.

But there's more work to do. Let's pass the Build Back Better Framework.",2021-11-10 17:44:01+00:00,False,1236,505,7548,43,en,False,Sprout Social,NA,NA,NA,NA,NA,NA,NA,NA,NA,NA,NA,NA
KamalaHarris,30354991,1458248544138276866,"50 years from now, people will look back on this time as the moment where America decided to win the competition for the 21st century. Let’s get to work. https://t.co/YbQJ1KMBbr",2021-11-10 01:42:00+00:00,False,1125,1179,7583,97,en,False,Sprout Social,154,177,https://t.co/YbQJ1KMBbr,https://twitter.com/JoeBiden/status/1457827354743558148/video/1,NA,NA,NA,NA,NA,NA,NA,NA
KamalaHarris,30354991,1458215335753039875,"By investing in the clean energy economy, we can create good-paying jobs, help families cut down on their home energy bills, and reduce greenhouse gas emissions. That’s what the Build Back Better Framework does.",2021-11-09 23:30:03+00:00,False,1463,986,10777,98,en,False,Sprout Social,NA,NA,NA,NA,NA,NA,NA,NA,NA,NA,NA,NA
KamalaHarris,30354991,1458085724100702214,"The Bipartisan Infrastructure Deal is a once-in-a-generation investment in America’s roads and bridges, clean drinking water, and broadband access—all while creating a more sustainable economy. 

The passage of this legislation will shape America's future for decades to come.",2021-11-09 14:55:01+00:00,False,1067,434,7697,48,en,False,Sprout Social,NA,NA,NA,NA,NA,NA,NA,NA,NA,NA,NA,NA
KamalaHarris,30354991,1457883388917002240,"The Build Back Better Act will be a once-in-a-generation investment in our people. 
https://t.co/hoWtJcMhE4",2021-11-09 01:31:00+00:00,False,827,577,5543,49,en,False,Sprout Social,84,107,https://t.co/hoWtJcMhE4,https://twitter.com/TheDemocrats/status/1457407598546886657/video/1,NA,NA,NA,NA,NA,NA,NA,NA
KamalaHarris,30354991,1457858224904888333,"If we are going to truly give people the choices and the chance to determine their own future, we must protect the right of all people to raise their voice through their vote.",2021-11-08 23:51:01+00:00,False,2071,1470,16061,138,en,False,Sprout Social,NA,NA,NA,NA,NA,NA,NA,NA,NA,NA,NA,NA
KamalaHarris,30354991,1457810912438636545,The Build Back Better Framework will be an unprecedented effort to combat climate change that will ensure the United States can meet our target of cutting greenhouse gas emissions in half by the year 2030.,2021-11-08 20:43:00+00:00,False,1280,666,9073,45,en,False,Sprout Social,NA,NA,NA,NA,NA,NA,NA,NA,NA,NA,NA,NA
KamalaHarris,30354991,1457776938773143553,"The Bipartisan Infrastructure Deal will reduce supply chain bottlenecks and make it easier for companies to get their goods to market by modernizing our ports, airports, and freight infrastructure. 
https://t.co/CmZhul9clh",2021-11-08 18:28:01+00:00,False,673,372,4281,25,en,False,Sprout Social,199,222,https://t.co/CmZhul9clh,https://twitter.com/TheDemocrats/status/1457378638849003526/video/1,NA,NA,NA,NA,NA,NA,NA,NA
KamalaHarris,30354991,1457729123716145159,President @JoeBiden’s Build Back Better Framework will provide universal preschool for all 3-and 4-year-olds—expanding access to free high-quality preschool for more than 6 million children.,2021-11-08 15:18:01+00:00,False,1745,711,12293,80,en,False,Sprout Social,NA,NA,NA,NA,NA,NA,NA,NA,NA,NA,NA,NA
KamalaHarris,30354991,1457522006790971396,"More than 193 million Americans are now fully vaccinated, children 5 and up are eligible to receive the vaccine, and the economy added more than half a million jobs in October. 

We are accelerating the path out of this pandemic.",2021-11-08 01:35:00+00:00,False,2695,1224,22256,140,en,False,Sprout Social,NA,NA,NA,NA,NA,NA,NA,NA,NA,NA,NA,NA
KamalaHarris,30354991,1457483503420026887,"The Bipartisan Infrastructure Deal will create millions of good jobs across the country. Jobs in red states, blue states, rural communities, small towns, and big cities. 

This is an investment in all of America. 
https://t.co/0J5g9bMB6N",2021-11-07 23:02:00+00:00,False,882,406,5146,44,en,False,Sprout Social,214,237,https://t.co/0J5g9bMB6N,https://twitter.com/TheDemocrats/status/1457098784844959746/video/1,NA,NA,NA,NA,NA,NA,NA,NA
