ScreenName,AuthorID,TweetID,Text,TweetDate,isReply,RetweetCount,ReplyCount,LikeCount,QuoteCount,Language,PossibleSensitive,Source,1stURLStart,1stURLEnd,1stURL,1stURLExp,2ndURLStart,2ndURLEnd,2ndURL,2ndURLExp,3rdURLStart,3rdURLEnd,3rdURL,3rdURLExp
SenSchumer,17494010,1469754843325779976,"Here’s what the infrastructure bill we passed means for New York and this country:

Jobs. Jobs. Jobs.
More local jobs.
More good-paying jobs.
More union jobs.

Watch me and @BradLander in our virtual town hall: https://t.co/7HcYPRB6WM",2021-12-11 19:43:56+00:00,False,86,186,452,18,en,False,Twitter Media Studio,211,234,https://t.co/7HcYPRB6WM,https://twitter.com/SenSchumer/status/1469754843325779976/video/1,NA,NA,NA,NA,NA,NA,NA,NA
SenSchumer,17494010,1469719137358336003,Good luck to @NYCFC today. Bring home the cup! #ForTheCity https://t.co/2ZjAyPkiRK,2021-12-11 17:22:03+00:00,False,24,51,134,0,en,False,Twitter for iPhone,59,82,https://t.co/2ZjAyPkiRK,https://twitter.com/NYCFC/status/1469663085698994185,NA,NA,NA,NA,NA,NA,NA,NA
SenSchumer,17494010,1469427319790047232,"No amount of trickery from the GOP will change the fact their tax cuts for the rich added nearly $2T to the deficit while Dems are working to lower costs, create good-paying jobs, cut middle-class taxes, and ensure the biggest corporations and wealthiest few pay their fair share.",2021-12-10 22:02:28+00:00,False,2756,993,9422,159,en,False,Twitter for iPhone,NA,NA,NA,NA,NA,NA,NA,NA,NA,NA,NA,NA
SenSchumer,17494010,1469405747889033222,"I co-hosted a town hall with the great @BradLander on how to use money from the infrastructure bill we passed to make our city more resilient and just

Brad's a tireless advocate for thoughtful infrastructure spending—I look forward to continuing to partner with him on this work https://t.co/srD1Snp18Y",2021-12-10 20:36:45+00:00,False,36,57,140,2,en,False,Twitter Web App,280,303,https://t.co/srD1Snp18Y,https://twitter.com/bradlander/status/1469376389245812744,NA,NA,NA,NA,NA,NA,NA,NA
SenSchumer,17494010,1469375429832237056,"The Supreme Court is allowing the #SB8 challenge to go ahead, but their refusal once again to block Texas’ unconstitutional abortion ban puts millions in harm's way.

The Senate will vote on the Women’s Health Protection Act to protect abortion rights.",2021-12-10 18:36:16+00:00,False,233,220,1117,25,en,False,Twitter Web App,NA,NA,NA,NA,NA,NA,NA,NA,NA,NA,NA,NA
SenSchumer,17494010,1469372902487252997,"To fight inflation and lower costs, the best thing to do is pass Build Back Better—and it's just what we're working to do

While GOP tries to undo measures that fight COVID and help families:

We're focused on raising wages, lowering costs, and creating jobs with #BuildBackBetter",2021-12-10 18:26:14+00:00,False,239,337,904,18,en,False,Twitter Web App,NA,NA,NA,NA,NA,NA,NA,NA,NA,NA,NA,NA
SenSchumer,17494010,1469141827358011393,"We're the only developed nation without national paid family &amp; medical leave standards for all families

We’re 1 of only 7 countries in the world to not guarantee paid leave for new moms

I’m working hard for national, comprehensive paid family &amp; medical leave in #BuildBackBetter https://t.co/XY70K8dFhl",2021-12-10 03:08:01+00:00,False,206,245,793,19,en,False,Twitter Media Studio,289,312,https://t.co/XY70K8dFhl,https://twitter.com/SenSchumer/status/1469141827358011393/video/1,NA,NA,NA,NA,NA,NA,NA,NA
SenSchumer,17494010,1469095842191654919,"I believed in you from day one, @SBWorkersUnited. A truly momentous day for the WNY labor community. https://t.co/ILOjm8SqZz",2021-12-10 00:05:17+00:00,False,81,106,698,11,en,False,Twitter Web App,101,124,https://t.co/ILOjm8SqZz,https://twitter.com/SenSchumer/status/1437485998452117511,NA,NA,NA,NA,NA,NA,NA,NA
SenSchumer,17494010,1469086466357841925,"Happy Birthday to my good friend @GillibrandNY! 

It has been an honor to work side-by-side with you for the people of New York.",2021-12-09 23:28:02+00:00,False,21,33,214,2,en,False,Twitter Web App,NA,NA,NA,NA,NA,NA,NA,NA,NA,NA,NA,NA
SenSchumer,17494010,1469081838345932801,"The number of Americans filing for unemployment last week was the smallest since 1969. 
 
The American Rescue Plan we passed is driving the strongest jobs recovery in modern history.",2021-12-09 23:09:39+00:00,False,392,303,1567,41,en,False,Twitter Web App,NA,NA,NA,NA,NA,NA,NA,NA,NA,NA,NA,NA
SenSchumer,17494010,1469069051196551174,"We passed the American Rescue Plan and the infrastructure bill. We’ve successfully vaccinated hundreds of millions of Americans. 
 
Jobs are up. Wages are up. Families have more money in their pockets",2021-12-09 22:18:50+00:00,False,730,643,3580,65,en,False,Twitter Web App,NA,NA,NA,NA,NA,NA,NA,NA,NA,NA,NA,NA
SenSchumer,17494010,1469066907399737356,Congratulations to @SBWorkersUnited on their groundbreaking effort in solidarity and proving Buffalo is and always will be a union town. Next up: fair contract! https://t.co/4No1QOeRuE,2021-12-09 22:10:19+00:00,False,91,30,484,2,en,False,Twitter Web App,161,184,https://t.co/4No1QOeRuE,https://twitter.com/SBWorkersUnited/status/1469016319454494727,NA,NA,NA,NA,NA,NA,NA,NA
SenSchumer,17494010,1469056914944368648,"We’ve added nearly six million jobs this year.

That’s the most jobs of any president’s first year in history.",2021-12-09 21:30:36+00:00,False,929,707,4864,85,en,False,Twitter Web App,NA,NA,NA,NA,NA,NA,NA,NA,NA,NA,NA,NA
SenSchumer,17494010,1469046843061510147,"Without action, student loan payments will resume in February

I'm standing with @SenWarren &amp; @RepPressley because new data from @RooseveltInst is showing this will undermine economic progress for so many families

@POTUS should extend the pause—and he should #CancelStudentDebt https://t.co/PTBJMLRBZZ",2021-12-09 20:50:35+00:00,False,207,136,819,26,en,False,Twitter Web App,283,306,https://t.co/PTBJMLRBZZ,https://twitter.com/rooseveltinst/status/1468711523296202758,NA,NA,NA,NA,NA,NA,NA,NA
SenSchumer,17494010,1469041422234001418,"Storms that we used to label “once-in-a-century” now slam us year after year.

We're working to pass Build Back Better to fight the climate crisis, lower emissions, make communities more resistant to disasters, and protect our planet for the next generation.",2021-12-09 20:29:03+00:00,False,127,137,639,10,en,False,Twitter Web App,NA,NA,NA,NA,NA,NA,NA,NA,NA,NA,NA,NA
SenSchumer,17494010,1469035898008485896,"New York is a union town. And I still stand with UAW Local 2110 Columbia grad student workers @SW_Columbia fighting for better pay, benefits, and working conditions.

The Columbia University administration must quickly forge a fair contract for its hard-working grad workers.",2021-12-09 20:07:06+00:00,False,99,55,631,10,en,False,Twitter Web App,NA,NA,NA,NA,NA,NA,NA,NA,NA,NA,NA,NA
SenSchumer,17494010,1469033528369180675,"I’m working with @SenBooker and @RonWyden to pass our Cannabis Administration and Opportunity Act to end federal prohibition.

It's long past time to end the federal prohibition on marijuana and ensure equity for communities impacted by the War on Drugs. https://t.co/fqhkEgqsgj",2021-12-09 19:57:41+00:00,False,154,419,783,41,en,False,Twitter Web App,255,278,https://t.co/fqhkEgqsgj,https://twitter.com/MarijuanaPolicy/status/1467194741678739460,NA,NA,NA,NA,NA,NA,NA,NA
SenSchumer,17494010,1469028190404419595,"The Child Tax Credit has helped so many families

More than 36 million families will get their next Child Tax Credit payment on December 15

We're working to pass Build Back Better by Christmas to extend the Child Tax Credit &amp; ensure they’ll get their checks in January and beyond",2021-12-09 19:36:28+00:00,False,139,124,607,11,en,False,Twitter Web App,NA,NA,NA,NA,NA,NA,NA,NA,NA,NA,NA,NA
SenSchumer,17494010,1468988267592921092,Student loan payments resume in 54 days. Today would be a great day for President Biden and Vice President Harris to #CancelStudentDebt.,2021-12-09 16:57:50+00:00,False,1466,1001,7205,147,en,False,Twitter Web App,NA,NA,NA,NA,NA,NA,NA,NA,NA,NA,NA,NA
SenSchumer,17494010,1468792353439858689,"I’m standing with @SenWarren and @RepPressley because new data from @RooseveltInst is showing that restarting student loan payments will undermine economic progress for so many families.

President Biden can #CancelStudentDebt today. https://t.co/PTBJMLRBZZ",2021-12-09 03:59:20+00:00,False,346,264,1639,42,en,False,Twitter for iPhone,234,257,https://t.co/PTBJMLRBZZ,https://twitter.com/rooseveltinst/status/1468711523296202758,NA,NA,NA,NA,NA,NA,NA,NA
SenSchumer,17494010,1468732624390828032,"President Biden is putting the full might of his admin behind clean, sustainable products and services to ensure the federal government achieves net-zero emissions by 2050.

Build Back Better is a key part of how we will get there. We are committed to getting it done. https://t.co/XAI7IX59Ec",2021-12-09 00:02:00+00:00,False,107,158,512,11,en,False,Twitter Web App,269,292,https://t.co/XAI7IX59Ec,https://twitter.com/cnnbrk/status/1468659115853594625,NA,NA,NA,NA,NA,NA,NA,NA
SenSchumer,17494010,1468656737934790667,Get vaccinated. Get boosted. And stay safe. https://t.co/QhKxiyB1Yr,2021-12-08 19:00:27+00:00,False,85,107,483,7,en,False,Twitter Web App,44,67,https://t.co/QhKxiyB1Yr,https://twitter.com/POTUS/status/1468603069579636740,NA,NA,NA,NA,NA,NA,NA,NA
SenSchumer,17494010,1468649706981105667,"Senate GOP plan to push an anti-vaccine proposal to overturn @POTUS's vaccine requirements for businesses.

No. We're in the middle of a health crisis.

We can't take away critical tools that can help us end the pandemic, but that’s what the GOP proposal would do. https://t.co/P7idruCVzd",2021-12-08 18:32:30+00:00,False,279,284,968,44,en,False,Twitter Media Studio,265,288,https://t.co/P7idruCVzd,https://twitter.com/SenSchumer/status/1468649706981105667/video/1,NA,NA,NA,NA,NA,NA,NA,NA
SenSchumer,17494010,1468644069534486542,"Americans are still pulling themselves out of a once-in-a-century economic crisis due to COVID.

We're working to pass Build Back Better to cut costs for families, for health care, prescription drugs, child care, and more.",2021-12-08 18:10:06+00:00,False,427,599,2166,53,en,False,Twitter Web App,NA,NA,NA,NA,NA,NA,NA,NA,NA,NA,NA,NA
SenSchumer,17494010,1468625623887327234,"The DOJ is taking action against the terrible maps in Texas that violate the Voting Rights Act

Because the right to vote is the beating heart of Democracy

And in the Senate, we will continue the fight for voting rights and the fight to restore the VRA

https://t.co/yanXhZlvvb",2021-12-08 16:56:49+00:00,False,163,188,593,17,en,False,Twitter Web App,255,278,https://t.co/yanXhZlvvb,https://blavity.com/justice-department-sues-texas-violating-voting-rights-act,NA,NA,NA,NA,NA,NA,NA,NA
SenSchumer,17494010,1468341432708648963,"The pause on student loan payments amid COVID has helped so many—but most say they're not financially secure enough to resume payments in February.

@POTUS can exercise his existing legal authority and #CancelStudentDebt to help millions of Americans struggling under this burden. https://t.co/fk7OLuCzv4",2021-12-07 22:07:32+00:00,False,260,234,1228,28,en,False,Twitter Web App,281,304,https://t.co/fk7OLuCzv4,https://twitter.com/kylegriffin1/status/1468226289781903360,NA,NA,NA,NA,NA,NA,NA,NA
SenSchumer,17494010,1468335768674439184,"Gil Hodges was a titan of baseball.

And he was a central part of the Brooklyn community: I remember the excitement of being able to trick-or-treat at his house when I was a kid!

I’ve been pushing for him to be inducted to @BaseballHall, and I'm thrilled that he finally is.",2021-12-07 21:45:02+00:00,False,26,55,212,3,en,False,Twitter Web App,NA,NA,NA,NA,NA,NA,NA,NA,NA,NA,NA,NA
SenSchumer,17494010,1468321176070021125,"80 years ago today, 2,403 Americans lost their lives and more were injured in the attack on Pearl Harbor.

We remember them and their families. We owe a debt to them and to all who served and sacrificed for our country in World War II.",2021-12-07 20:47:03+00:00,False,112,86,626,4,en,False,Twitter Web App,NA,NA,NA,NA,NA,NA,NA,NA,NA,NA,NA,NA
SenSchumer,17494010,1468297343854428160,"The pause on student loan payments has been critical amid COVID

But an extension on the pause is needed—89% of borrowers say they're not financially secure enough to resume payments in February

@POTUS can use his legal authority to #CancelStudentDebt and help so many Americans https://t.co/IwMlGMKIgE",2021-12-07 19:12:21+00:00,False,266,192,1341,28,en,False,Twitter Web App,280,303,https://t.co/IwMlGMKIgE,https://twitter.com/DebtCrisisOrg/status/1467941712983060480,NA,NA,NA,NA,NA,NA,NA,NA
SenSchumer,17494010,1468287950622535682,"Build Back Better will provide the largest investment in child care in American history to help make it cheaper for parents to raise kids

From free universal Pre-K for millions of families to extending the Child Tax Credit, we're working to get these things done before Christmas",2021-12-07 18:35:01+00:00,False,156,241,722,19,en,False,Twitter Web App,NA,NA,NA,NA,NA,NA,NA,NA,NA,NA,NA,NA
SenSchumer,17494010,1468282075744776193,"Creating Jobs, lowering costs, fighting climate change, and keeping more money in people’s pockets—these are things Americans want and what Americans need, and it’s what Build Back Better does.

Senate Democrats are working to get these things done before Christmas.",2021-12-07 18:11:40+00:00,False,273,564,1154,48,en,False,Twitter Web App,NA,NA,NA,NA,NA,NA,NA,NA,NA,NA,NA,NA
SenSchumer,17494010,1468275985707585546,"Breaking: We just confirmed Jessica Rosenworcel to be Chair of the @FCC

She's set herself apart as one of America’s leading champions for a more affordable and accessible high-speed internet

Under her leadership, the FCC will make immense progress to address the digital divide",2021-12-07 17:47:28+00:00,False,253,159,1303,13,en,False,Twitter Web App,NA,NA,NA,NA,NA,NA,NA,NA,NA,NA,NA,NA
SenSchumer,17494010,1468235582891515904,"More than 2.4 million New Yorkers and tens of millions of Americans across the country are struggling under the crushing burden of student loan debt.

President Biden can use his existing legal authority to lift this burden with the stroke of a pen and #CancelStudentDebt.",2021-12-07 15:06:56+00:00,False,424,503,2136,66,en,False,Twitter Web App,NA,NA,NA,NA,NA,NA,NA,NA,NA,NA,NA,NA
SenSchumer,17494010,1468003054310023168,"Americans are back to work, but 89% of borrowers say they’re not financially secure enough to resume student loan payments in Feb

Extending the pause is crucial—resuming payments will undermine families' economic progress

@POTUS can use his legal authority to #CancelStudentDebt https://t.co/IwMlGMKIgE",2021-12-06 23:42:56+00:00,False,156,214,782,20,en,False,Twitter Web App,281,304,https://t.co/IwMlGMKIgE,https://twitter.com/DebtCrisisOrg/status/1467941712983060480,NA,NA,NA,NA,NA,NA,NA,NA
SenSchumer,17494010,1467995578315460608,"Today, we'll move forward on Jessica Rosenworcel's nomination to be @FCC Chair

She's had nearly a decade of experience as an FCC Commissioner

She's a fierce advocate for closing the digital divide and protecting net neutrality

And she'd be the first-ever woman to chair the FCC",2021-12-06 23:13:14+00:00,False,96,66,491,5,en,False,Twitter Web App,NA,NA,NA,NA,NA,NA,NA,NA,NA,NA,NA,NA
SenSchumer,17494010,1467987566750322694,Student loan payments resume in 57 days. Today would be a great day for President Biden and Vice President Harris to #CancelStudentDebt.,2021-12-06 22:41:24+00:00,False,3378,1867,18845,407,en,False,Twitter Web App,NA,NA,NA,NA,NA,NA,NA,NA,NA,NA,NA,NA
SenSchumer,17494010,1467981527250358275,"American families need help affording things like child care, pre-K, prescription drugs, health care, and more.

We are working to pass the Build Back Better Act by Christmas to get them the help they need.",2021-12-06 22:17:24+00:00,False,186,306,935,29,en,False,Twitter Web App,NA,NA,NA,NA,NA,NA,NA,NA,NA,NA,NA,NA
SenSchumer,17494010,1467971829079945228,"NEW: FEMA is announcing it’s delivered over $460 million to NYC for costs incurred in the early days of COVID helping to shelter people that didn't have a safe place to isolate and quarantine.

I will keep working to quickly deliver funding to NYC as we continue to battle COVID.",2021-12-06 21:38:52+00:00,False,104,92,479,2,en,False,Twitter Web App,NA,NA,NA,NA,NA,NA,NA,NA,NA,NA,NA,NA
SenSchumer,17494010,1467692222627946501,An incredible day for NYC’s 11th City Council District in the Bronx swearing in @EricDinowitzNYC! https://t.co/p2sYmfEHFb,2021-12-06 03:07:48+00:00,False,53,62,209,3,en,False,Twitter for iPhone,98,121,https://t.co/p2sYmfEHFb,https://twitter.com/SenSchumer/status/1467692222627946501/photo/1,98,121,https://t.co/p2sYmfEHFb,https://twitter.com/SenSchumer/status/1467692222627946501/photo/1,98,121,https://t.co/p2sYmfEHFb,https://twitter.com/SenSchumer/status/1467692222627946501/photo/1
SenSchumer,17494010,1467662317177430018,The @Central_Astoria Holiday Festival and Tree Lighting Celebration in Astoria Park in Queens!🎄 https://t.co/kynhPwF7Hg,2021-12-06 01:08:58+00:00,False,55,75,381,7,en,False,Twitter for iPhone,96,119,https://t.co/kynhPwF7Hg,https://twitter.com/SenSchumer/status/1467662317177430018/photo/1,96,119,https://t.co/kynhPwF7Hg,https://twitter.com/SenSchumer/status/1467662317177430018/photo/1,96,119,https://t.co/kynhPwF7Hg,https://twitter.com/SenSchumer/status/1467662317177430018/photo/1
SenSchumer,17494010,1467659946498134020,"Gil Hodges was a great Brooklyn Dodger, an original Met, a manager of the Mets.

He was a Marine in WWII and fought in Tinian and Okinawa. He was awarded the Bronze Star with Combat V.

I’ve been pushing for him to be inducted to @BaseballHall, and tonight he finally is.",2021-12-06 00:59:33+00:00,False,69,50,497,4,en,False,Twitter for iPhone,NA,NA,NA,NA,NA,NA,NA,NA,NA,NA,NA,NA
SenSchumer,17494010,1467614278844919820,"It was an honor to help celebrate 25 years of the American Association of Physicians of Indian Origin of Queens and Long Island. So many have been on the front lines of this COVID public health crisis, and we won’t stop fighting for them. https://t.co/orWlPZ8yc3",2021-12-05 21:58:05+00:00,False,80,72,555,4,en,False,Twitter for iPhone,239,262,https://t.co/orWlPZ8yc3,https://twitter.com/SenSchumer/status/1467614278844919820/photo/1,239,262,https://t.co/orWlPZ8yc3,https://twitter.com/SenSchumer/status/1467614278844919820/photo/1,NA,NA,NA,NA
SenSchumer,17494010,1467607094413123584,"With Omicron, expanding access to at-home tests ASAP is critical.

As the admin preps to require insurers to reimburse for at-home tests:

American Rescue Plan funds can foot the cost for a surge of FREE at-home tests in the meantime to community health centers for distribution. https://t.co/xK6uLJC3wL",2021-12-05 21:29:32+00:00,False,125,169,586,12,en,False,Twitter for iPhone,280,303,https://t.co/xK6uLJC3wL,https://twitter.com/SenSchumer/status/1467607094413123584/photo/1,NA,NA,NA,NA,NA,NA,NA,NA
SenSchumer,17494010,1467587364428075009,Good luck to @NYCFC in your first-ever Eastern Conference Final today! #ForTheCity #NYCFC https://t.co/XhZnEVIpdP,2021-12-05 20:11:08+00:00,False,30,31,199,3,en,False,Twitter for iPhone,90,113,https://t.co/XhZnEVIpdP,https://twitter.com/NYCFC/status/1467483799244185602,NA,NA,NA,NA,NA,NA,NA,NA
SenSchumer,17494010,1467326181095747585,Happy to join the Queens Civic Congress’s annual legislative reception with so many leaders fighting for the community and for New York! https://t.co/ZDrwpXM9Lb,2021-12-05 02:53:17+00:00,False,65,146,455,15,en,False,Twitter for iPhone,137,160,https://t.co/ZDrwpXM9Lb,https://twitter.com/SenSchumer/status/1467326181095747585/photo/1,137,160,https://t.co/ZDrwpXM9Lb,https://twitter.com/SenSchumer/status/1467326181095747585/photo/1,137,160,https://t.co/ZDrwpXM9Lb,https://twitter.com/SenSchumer/status/1467326181095747585/photo/1
SenSchumer,17494010,1467234203788062727,"Today, we celebrated the induction of Keisha Alleyne, the next Civil Court Judge in Brooklyn’s 7th Municipal District.

A talented legal mind, she is compassionate, a woman of integrity, and someone who cares about her community and the impact she will have on it from the bench. https://t.co/j8E1OR2IWA",2021-12-04 20:47:48+00:00,False,176,116,1162,7,en,False,Twitter for iPhone,280,303,https://t.co/j8E1OR2IWA,https://twitter.com/SenSchumer/status/1467234203788062727/photo/1,NA,NA,NA,NA,NA,NA,NA,NA
SenSchumer,17494010,1467200080620961792,It was fun to visit the New York Botanical Garden @NYBG Holiday Train Show with Noah! https://t.co/FusRddULVY,2021-12-04 18:32:13+00:00,False,101,168,1774,13,en,False,Twitter for iPhone,86,109,https://t.co/FusRddULVY,https://twitter.com/SenSchumer/status/1467200080620961792/photo/1,NA,NA,NA,NA,NA,NA,NA,NA
SenSchumer,17494010,1466902395196252161,"Welcome to the family of nations, Barbados. It is right where you belong.

I can’t wait for our next Caribbean Day Parade in New York when we can all celebrate together. Here’s our celebration from this past summer! https://t.co/gtV18chUL4",2021-12-03 22:49:19+00:00,False,71,121,628,7,en,False,Twitter for iPhone,216,239,https://t.co/gtV18chUL4,https://twitter.com/SenSchumer/status/1466902395196252161/photo/1,NA,NA,NA,NA,NA,NA,NA,NA
SenSchumer,17494010,1466824047782682627,"You’re definitely going to want to watch what happened when @JohnLegend, @WeDemandJustice, and I sat down to talk about Dale Ho—an incredible voting rights lawyer I recommended to @POTUS to become a federal judge. https://t.co/M0FQc1ncuY",2021-12-03 17:37:59+00:00,False,114,119,408,7,en,False,Twitter Web App,214,237,https://t.co/M0FQc1ncuY,https://twitter.com/johnlegend/status/1466579527883051010,NA,NA,NA,NA,NA,NA,NA,NA
SenSchumer,17494010,1466546461810868224,"Thank you so much to @JohnLegend and @WeDemandJustice for sitting down to talk about Dale Ho.

Dale Ho is one of American’s foremost voting rights lawyers, just the kind federal judge we need on the bench. https://t.co/Z7dBih65LM",2021-12-02 23:14:58+00:00,False,128,89,398,8,en,False,Twitter Web App,206,229,https://t.co/Z7dBih65LM,https://twitter.com/WeDemandJustice/status/1466512582953549840,NA,NA,NA,NA,NA,NA,NA,NA
SenSchumer,17494010,1466513214590664707,"The message across the country is clear:
The vast majority of Americans support legalizing marijuana.
@RonWyden, @SenBooker, and I are working to pass our Cannabis Administration and Opportunity Act to end the federal prohibition and repair the harm done by the War on Drugs. https://t.co/fksXnspyHc",2021-12-02 21:02:51+00:00,False,210,354,911,35,en,False,Twitter Web App,276,299,https://t.co/fksXnspyHc,https://twitter.com/NORML/status/1465757640202637322,NA,NA,NA,NA,NA,NA,NA,NA
SenSchumer,17494010,1466454933251760130,"Get vaccinated.
And get your booster.

It’s the best protection against hospitalization and death from COVID. https://t.co/mDeBOnhGKg",2021-12-02 17:11:16+00:00,False,138,174,751,7,en,False,Twitter Web App,110,133,https://t.co/mDeBOnhGKg,https://twitter.com/KamalaHarris/status/1465734895892942852,NA,NA,NA,NA,NA,NA,NA,NA
SenSchumer,17494010,1466448554034139150,"Making child care and pre-K more affordable.

Fighting against the climate crisis.

Bringing costs under control.

Creating the jobs of tomorrow.

Build Back Better represents the largest investment in the American people in generations, and we're working to get this done.",2021-12-02 16:45:55+00:00,False,170,271,858,18,en,False,Twitter Web App,NA,NA,NA,NA,NA,NA,NA,NA,NA,NA,NA,NA
SenSchumer,17494010,1466218292985610244,"As the first Jewish Senate Majority Leader in history:

I was so honored to join @POTUS, @FLOTUS, @VP, @SecondGentleman, and so many more for the White House Menorah Lighting tonight!

#HappyHanukkah https://t.co/nAO3owyFfc",2021-12-02 01:30:56+00:00,False,488,179,5015,22,en,False,Twitter Web App,200,223,https://t.co/nAO3owyFfc,https://twitter.com/SenSchumer/status/1466218292985610244/photo/1,NA,NA,NA,NA,NA,NA,NA,NA
SenSchumer,17494010,1466207748366999552,"We’re standing together because this is perhaps the greatest threat to Roe v Wade we’ve seen in a generation.

#AbortionIsEssential.

And this Senate will vote on the Women’s Health Protection Act to protect abortion rights. https://t.co/V4gJrh9GXP",2021-12-02 00:49:02+00:00,False,246,295,1324,40,en,False,Twitter Web App,225,248,https://t.co/V4gJrh9GXP,https://twitter.com/SenSchumer/status/1466207748366999552/photo/1,225,248,https://t.co/V4gJrh9GXP,https://twitter.com/SenSchumer/status/1466207748366999552/photo/1,NA,NA,NA,NA
SenSchumer,17494010,1466206785895907336,"With voting rights under assault—it's only fitting that we elevate to the federal bench one America’s top voting rights experts to help safeguard democracy

Dale Ho is one of this country’s foremost voting rights lawyers

I introduced him today to the Senate Judiciary Committee https://t.co/v9BxorHZ9i",2021-12-02 00:45:13+00:00,False,143,145,602,14,en,False,Twitter Media Studio,279,302,https://t.co/v9BxorHZ9i,https://twitter.com/SenSchumer/status/1466206785895907336/video/1,NA,NA,NA,NA,NA,NA,NA,NA
SenSchumer,17494010,1466168290057805826,Thank you to @NydiaVelazquez @BrianKavanaghNY @ChrisMarteNYC @WEACT4EJ @NYCEJAlliance @LiUNA @NYLCV @NRDC @GOLESNYC @CooperSq @NMICnyc @CPHS_NY @CIRSEIU @CleanHealthyNY @NYSBCTC and the International Union of Operating Engineers for your support!,2021-12-01 22:12:15+00:00,True,14,10,83,2,en,False,Twitter Web App,NA,NA,NA,NA,NA,NA,NA,NA,NA,NA,NA,NA
SenSchumer,17494010,1466165111463231489,"With the historic $15 billion we passed in the infrastructure bill to remove toxic lead pipes across the country, we will make huge progress toward creating a #LeadFreeNY. https://t.co/rwyjTrSIH8",2021-12-01 21:59:37+00:00,False,81,65,435,9,en,False,Twitter Web App,172,195,https://t.co/rwyjTrSIH8,https://twitter.com/SenSchumer/status/1466165111463231489/photo/1,NA,NA,NA,NA,NA,NA,NA,NA
