ScreenName,AuthorID,TweetID,Text,TweetDate,isReply,RetweetCount,ReplyCount,LikeCount,QuoteCount,Language,PossibleSensitive,Source,1stURLStart,1stURLEnd,1stURL,1stURLExp,2ndURLStart,2ndURLEnd,2ndURL,2ndURLExp,3rdURLStart,3rdURLEnd,3rdURL,3rdURLExp
SenSchumer,17494010,1461472778163523592,"Senate Democrats are working to pass the #FreedomToVote Act to fortify our democracy and protect the right to vote

Thank you to @CitizenActionNY, @FairElectionsNY, @NYChange, @MakeTheRoadNY, @VOCALNewYork, @NationalAction, and all of the activists across NY for standing with us!",2021-11-18 23:13:57+00:00,False,258,199,970,26,en,False,Twitter Web App,NA,NA,NA,NA,NA,NA,NA,NA,NA,NA,NA,NA
SenSchumer,17494010,1461408267385511940,"Creating jobs, lowering costs, fighting inflation, and keeping more money in people’s pockets.
 
We're working to deliver these for American people and families in Build Back Better.",2021-11-18 18:57:37+00:00,False,183,260,833,29,en,False,Twitter Web App,NA,NA,NA,NA,NA,NA,NA,NA,NA,NA,NA,NA
SenSchumer,17494010,1461397886655242240,"Build Back Better will cut taxes for parents raising kids. It will make Pre-K universal for the first time ever. And it will create local jobs, good-paying jobs, and union jobs. We'll keep working on this important legislation until we get it done.",2021-11-18 18:16:22+00:00,False,699,311,2935,40,en,False,Twitter Web App,NA,NA,NA,NA,NA,NA,NA,NA,NA,NA,NA,NA
SenSchumer,17494010,1461390144343351303,"Build Back Better will provide the largest investment in child care in American history.
 
It will save millions of families thousands of dollars a year.
 
And it will extend the Child Tax Credit.
 
We won't stop working until it's done.",2021-11-18 17:45:36+00:00,False,342,280,1421,12,en,False,Twitter Web App,NA,NA,NA,NA,NA,NA,NA,NA,NA,NA,NA,NA
SenSchumer,17494010,1461128545141411847,"The US and Canada have a long-standing robust relationship, and NY and Canada share much more than a border.

We’re working together to ensure our border policies don't hurt communities at the Canadian border—especially over the holidays.

Thanks @JustinTrudeau for meeting today. https://t.co/wTOrhzHlzm",2021-11-18 00:26:06+00:00,False,253,205,1855,25,en,False,Twitter for iPhone,281,304,https://t.co/wTOrhzHlzm,https://twitter.com/SenSchumer/status/1461128545141411847/photo/1,NA,NA,NA,NA,NA,NA,NA,NA
SenSchumer,17494010,1461114635617292289,"I was thrilled to support the #MRTA—New York's historic marijuana legalization—and to sit down with Tremaine Wright who is leading its implementation.

We are working to bring the progress we've made in New York to the federal level. https://t.co/MfO9wk4L97",2021-11-17 23:30:49+00:00,False,60,93,257,10,en,False,Twitter Web App,234,257,https://t.co/MfO9wk4L97,https://twitter.com/blackenterprise/status/1460593521841164291,NA,NA,NA,NA,NA,NA,NA,NA
SenSchumer,17494010,1461103975604830213,"Dilawar Syed is @POTUS's nominee to serve at @SBAgov.

He’s a is a highly-experienced entrepreneur and coalition-builder.

And he’d be the highest-ranking Muslim official in government.

We'll keep fighting the GOP's hateful, bigoted campaign against him.

https://t.co/UGVemVOpYA",2021-11-17 22:48:28+00:00,False,122,57,400,12,en,False,Twitter Web App,257,280,https://t.co/UGVemVOpYA,https://www.huffpost.com/entry/dilawar-syed-gop-senators-boycott-small-business-administration-muslim_n_61940af1e4b05e93cbb64454,NA,NA,NA,NA,NA,NA,NA,NA
SenSchumer,17494010,1461091814757355523,Student loan payments resume in 76 days. Today would be a great day for President Biden and Vice President Harris to #CancelStudentDebt.,2021-11-17 22:00:09+00:00,False,3291,1512,17017,390,en,False,Twitter Web App,NA,NA,NA,NA,NA,NA,NA,NA,NA,NA,NA,NA
SenSchumer,17494010,1461073826217971714,"Build Back Better will help fight the climate crisis with investments in our economy to create good-paying jobs and spur a green, industrial revolution while lowering the cost of energy for Americans

I stood with @LCVoters, @ClimatePower, &amp; more today as we work to get this done https://t.co/mdQgMiFdIl",2021-11-17 20:48:40+00:00,False,90,86,389,5,en,False,Twitter Web App,285,308,https://t.co/mdQgMiFdIl,https://twitter.com/SenSchumer/status/1461073826217971714/photo/1,NA,NA,NA,NA,NA,NA,NA,NA
SenSchumer,17494010,1461061954093596672,Stronger economic growth and less inflation. It's simple: If we want to fight inflationary pressures —if we want to lower costs and grow the economy—the best thing we can do is to pass Build Back Better. We're working to get it done. https://t.co/PUKUBbO8B3,2021-11-17 20:01:29+00:00,False,142,150,534,9,en,False,Twitter Web App,234,257,https://t.co/PUKUBbO8B3,https://www.reuters.com/world/us/exclusive-rating-agencies-say-bidens-spending-plans-will-not-add-inflationary-2021-11-17/,NA,NA,NA,NA,NA,NA,NA,NA
SenSchumer,17494010,1461054083805106182,"The #InfrastructureBill is an investment in New York’s water. It helps address contaminants, replace lead pipes, and eliminate PFAS so that New York State can ensure communities have the clean drinking water they deserve.",2021-11-17 19:30:13+00:00,False,77,58,396,2,en,False,Twitter Web App,NA,NA,NA,NA,NA,NA,NA,NA,NA,NA,NA,NA
SenSchumer,17494010,1461044226905489419,"Republicans—who spent years under Donald Trump trying to repeal health care and give tax breaks to the ultra-rich—are opposing tax cuts for the middle class while rooting for prices to go up.
 
Democrats are working to pass Build Back Better to lower costs.",2021-11-17 18:51:03+00:00,False,956,465,4029,50,en,False,Twitter Web App,NA,NA,NA,NA,NA,NA,NA,NA,NA,NA,NA,NA
SenSchumer,17494010,1461037997470752770,"President Biden just sent the Kigali Treaty to phase down HFCs to the Senate for ratification.

Phasing out HFCs will go a long way in fighting climate change—HFCs are a potent greenhouse gas, and U.S. industries are already leading the way in manufacturing alternatives.",2021-11-17 18:26:18+00:00,False,126,56,538,5,en,False,Twitter Web App,NA,NA,NA,NA,NA,NA,NA,NA,NA,NA,NA,NA
SenSchumer,17494010,1461029091293937668,"Today, a leading economist at Moody's said Build Back Better will ""help to lift long-term economic growth via stronger productivity and labor force growth, and thus take the edge off of inflation.""

We're working to get it done and keep our historic economic recovery going. https://t.co/HfOMjjsBGs",2021-11-17 17:50:54+00:00,False,463,120,1477,22,en,False,Twitter Web App,275,298,https://t.co/HfOMjjsBGs,https://twitter.com/Reuters/status/1460923238092099585,NA,NA,NA,NA,NA,NA,NA,NA
SenSchumer,17494010,1461022678047940608,"“A Gold Mine""

That's how Senator Rick Scott talks about Americans struggling with rising costs

Republicans don’t have solutions for families

But they see political gold in exploiting their struggles

We're working to pass Build Back Better to lower costs and support families",2021-11-17 17:25:25+00:00,False,1024,332,4122,57,en,False,Twitter Web App,NA,NA,NA,NA,NA,NA,NA,NA,NA,NA,NA,NA
SenSchumer,17494010,1460966333978488833,"Sherrilyn Ifill is one of the most brilliant, forceful, and effective leaders we’ve seen in the civil rights movement in a very long time. We will miss her in this role, but we know she will continue to fight.

https://t.co/2jzw4ayikR",2021-11-17 13:41:32+00:00,False,91,35,587,11,en,False,Twitter for iPhone,211,234,https://t.co/2jzw4ayikR,https://www.washingtonpost.com/nation/2021/11/17/sherrilyn-ifill-naacp-ldf/,NA,NA,NA,NA,NA,NA,NA,NA
SenSchumer,17494010,1460781102277304325,"Key Republicans, some who spent years under Donald Trump cutting taxes for the wealthy, are now opposing relief for the middle class, and cheering for costs to go up.

Democrats are working to pass Build Back Better to lower costs for American families. https://t.co/GOaUvxM2xY",2021-11-17 01:25:29+00:00,False,417,299,1151,31,en,False,Twitter Web App,254,277,https://t.co/GOaUvxM2xY,https://www.businessinsider.in/policy/economy/news/republicans-are-ecstatic-that-biden-is-struggling-with-inflation-this-is-a-gold-mine-for-us/articleshow/87723726.cms,NA,NA,NA,NA,NA,NA,NA,NA
SenSchumer,17494010,1460755528301350918,"I am proud to champion the outstanding recommended Judge Alison Nathan to @POTUS for elevation the 2nd Circuit.

She’s now an SDNY judge, after I recommended her to President Obama.

If confirmed, she'd be the 2nd openly lesbian woman to serve as a federal appellate judge!",2021-11-16 23:43:52+00:00,False,235,155,1175,35,en,False,Twitter Web App,NA,NA,NA,NA,NA,NA,NA,NA,NA,NA,NA,NA
SenSchumer,17494010,1460736795549880324,"We kept our eye on the Big Apple with this #InfrastructureBill.

And it can be summed up by a four letter word: J-O-B-S.

More local jobs.
More good-paying jobs.
More union jobs. https://t.co/EF3BlA8jNW",2021-11-16 22:29:25+00:00,False,78,157,422,7,en,False,Twitter Media Studio,179,202,https://t.co/EF3BlA8jNW,https://twitter.com/SenSchumer/status/1460736795549880324/video/1,NA,NA,NA,NA,NA,NA,NA,NA
SenSchumer,17494010,1460729332008161288,A heartfelt thank you to @NYCMayor for his tireless advocacy for resiliency and transportation infrastructure and his critical support in getting this bill over the finish line. https://t.co/fPxmzpV2Hm,2021-11-16 21:59:46+00:00,False,37,54,215,3,en,False,Twitter Web App,178,201,https://t.co/fPxmzpV2Hm,https://twitter.com/NYCMayor/status/1460687076534407172,NA,NA,NA,NA,NA,NA,NA,NA
SenSchumer,17494010,1460718797942407175,The #InfrastructureBill delivers $25 billion for airports across America including almost $1 billion for New York.,2021-11-16 21:17:54+00:00,False,184,105,1097,12,en,False,Twitter Web App,NA,NA,NA,NA,NA,NA,NA,NA,NA,NA,NA,NA
SenSchumer,17494010,1460701999641640964,"I encouraged @SecretaryPete to support these projects

They will right the wrongs of the past—the environmental injustice of the Cross Bronx Expressway, the accessibility of Broadway Junction to ALL

And with this #InfrastructureBill, help is on the way

https://t.co/rsUVVo5y2h",2021-11-16 20:11:09+00:00,False,54,39,297,5,en,False,Twitter Web App,255,278,https://t.co/rsUVVo5y2h,https://www.nydailynews.com/new-york/ny-buttigieg-mta-feds-cross-bronx-broadway-junction-20211116-lt5w5rua2rf2blaayx35heutgq-story.html,NA,NA,NA,NA,NA,NA,NA,NA
SenSchumer,17494010,1460695841191116802,"Build Back Better will create jobs, lower costs, and expand health care and family investments that have long been overdue in America.

It will deliver on home-and-community-based services.
It will deliver on child care.
It will deliver to help families in America.

#CareCantWait https://t.co/ClSyI15pYX",2021-11-16 19:46:41+00:00,False,100,88,328,9,en,False,Twitter Web App,281,304,https://t.co/ClSyI15pYX,https://twitter.com/MomsRising/status/1460652465938857992,NA,NA,NA,NA,NA,NA,NA,NA
SenSchumer,17494010,1460675515237470213,"Build Back Better will finally empower Medicare to directly negotiate drug prices and lower costs for millions of seniors and American families for vital drugs like insulin, cancer treatments, and so much more. This is so important, and we're working to pass it.",2021-11-16 18:25:55+00:00,False,376,197,1557,28,en,False,Twitter Web App,NA,NA,NA,NA,NA,NA,NA,NA,NA,NA,NA,NA
SenSchumer,17494010,1460669343990226954,"Build Back Better will provide the largest investment in child care ever.
 
It will save many parents thousands of dollars a year.
 
And it will extend the Child Tax Credit.
 
We won't stop working until it's done.",2021-11-16 18:01:24+00:00,False,220,153,1064,13,en,False,Twitter Web App,NA,NA,NA,NA,NA,NA,NA,NA,NA,NA,NA,NA
SenSchumer,17494010,1460663191365685257,"It's very simple: If we want to create more jobs, fight inflation, and help families lower costs—the best thing we can do is pass Build Back Better.
 
We're working to get it done.",2021-11-16 17:36:57+00:00,False,540,581,3407,50,en,False,Twitter Web App,NA,NA,NA,NA,NA,NA,NA,NA,NA,NA,NA,NA
SenSchumer,17494010,1460657582566264833,"Our country took a major step forward to prepare our economy for the challenges of the 21st century.
 
We can now tell the American people that an infrastructure bill is finally here!
 
And we will keep working to pass President Biden's Build Back Better Act.",2021-11-16 17:14:40+00:00,False,144,147,730,14,en,False,Twitter Web App,NA,NA,NA,NA,NA,NA,NA,NA,NA,NA,NA,NA
SenSchumer,17494010,1460425996100943883,"The #InfrastructureBill means major New York projects—like Gateway, Cross Bronx Expressway, Second Avenue Subway, I-81 in Syracuse, the Inner Loop in Rochester, and more—will be able to get going.

And there are projects as important as these in every state across the country. https://t.co/xKUVmmU6Ap",2021-11-16 01:54:25+00:00,False,119,144,561,15,en,False,Twitter Media Studio,278,301,https://t.co/xKUVmmU6Ap,https://twitter.com/SenSchumer/status/1460425996100943883/video/1,NA,NA,NA,NA,NA,NA,NA,NA
SenSchumer,17494010,1460420696476168193,"Today's #InfrastructureBill can be summed up by a four letter word: J-O-B-S.

More local jobs
More good-paying jobs
More union jobs https://t.co/XpOPoNZaH7",2021-11-16 01:33:22+00:00,False,159,158,677,21,en,False,Twitter Media Studio,132,155,https://t.co/XpOPoNZaH7,https://twitter.com/SenSchumer/status/1460420696476168193/video/1,NA,NA,NA,NA,NA,NA,NA,NA
SenSchumer,17494010,1460399624963993608,"Our whole city came together behind @NYTWA and our taxi drivers, and we won. Next up: Winning just conditions for #LosDeliveristas. https://t.co/PEqerN8TZG",2021-11-16 00:09:38+00:00,False,59,45,265,2,en,False,Twitter Web App,132,155,https://t.co/PEqerN8TZG,https://twitter.com/workersjusticep/status/1460292134704193536,NA,NA,NA,NA,NA,NA,NA,NA
