ScreenName,AuthorID,TweetID,Text,TweetDate,isReply,RetweetCount,ReplyCount,LikeCount,QuoteCount,Language,PossibleSensitive,Source,1stURLStart,1stURLEnd,1stURL,1stURLExp,2ndURLStart,2ndURLEnd,2ndURL,2ndURLExp,3rdURLStart,3rdURLEnd,3rdURL,3rdURLExp
SenSchumer,17494010,1466158588917956614,"Marijuana prohibition has disproportionately harmed young people of color. NY's taken important steps to address these harms.

We're working to pass the Cannabis Administration &amp; Opportunity Act to bring the progress we've made in NY to the federal level

https://t.co/iDoxidzBnq",2021-12-01 21:33:42+00:00,False,84,205,445,16,en,False,Twitter Web App,260,283,https://t.co/iDoxidzBnq,https://www.niagara-gazette.com/news/local_news/steep-drop-in-ny-marijuana-arrests/article_0a8ce6ee-ab20-5344-ad01-90862055806e.html,NA,NA,NA,NA,NA,NA,NA,NA
SenSchumer,17494010,1466150563792531470,#SpotifyWrapped https://t.co/TpTLevKYrt,2021-12-01 21:01:48+00:00,False,1640,2004,11838,790,und,False,Twitter Web App,16,39,https://t.co/TpTLevKYrt,https://twitter.com/SenSchumer/status/1466150563792531470/photo/1,NA,NA,NA,NA,NA,NA,NA,NA
SenSchumer,17494010,1466136660110979073,"The best protection against hospitalization and death from COVID is getting vaccinated.

So to New Yorkers and Americans: Get vaccinated. And get the booster. https://t.co/ZQv24XaXTU",2021-12-01 20:06:33+00:00,False,111,104,507,9,en,False,Twitter Media Studio,159,182,https://t.co/ZQv24XaXTU,https://twitter.com/SenSchumer/status/1466136660110979073/video/1,NA,NA,NA,NA,NA,NA,NA,NA
SenSchumer,17494010,1466128106201223177,"Dale Ho has set himself apart as one of America's best election and voting rights lawyers. He’s worked for @NAACP_LDF and @ACLU.

It’s why I recommended him to @POTUS.

I was proud to introduce him today to the Senate Judiciary Committee to serve as an SDNY district court judge. https://t.co/dIALATd6KX",2021-12-01 19:32:34+00:00,False,123,65,546,6,en,False,Twitter Media Studio,280,303,https://t.co/dIALATd6KX,https://twitter.com/SenSchumer/status/1466128106201223177/video/1,NA,NA,NA,NA,NA,NA,NA,NA
SenSchumer,17494010,1466120991638269953,"HBCUs are essential to making higher education accessible for ALL Americans.

We must ensure they have the support they need so that their doors remain open for generations to come.

We'll keep working on this important legislation until we get it done.

https://t.co/An4CTfaw71",2021-12-01 19:04:18+00:00,False,71,40,239,5,en,False,Twitter Web App,255,278,https://t.co/An4CTfaw71,https://www.bet.com/article/b8g0qd/hbcu-leaders-urge-senate-approval-build-back-better,NA,NA,NA,NA,NA,NA,NA,NA
SenSchumer,17494010,1466084344074756107,"Abortion is a fundamental right.

We're rallying at SCOTUS because they’re hearing arguments in a case that's perhaps the greatest threat to Roe v Wade in a generation.

The Senate will vote on the Women’s Health Protection Act to protect abortion rights.

https://t.co/VaLqWJC1LN",2021-12-01 16:38:40+00:00,False,229,240,1160,26,en,False,Twitter Web App,257,280,https://t.co/VaLqWJC1LN,https://youtu.be/g49ozI0GUDw,NA,NA,NA,NA,NA,NA,NA,NA
SenSchumer,17494010,1465883843647479808,Noah’s helping light the menorah and eating a jelly donut for Hanukkah! https://t.co/IMtcTWcRBZ,2021-12-01 03:21:57+00:00,False,97,137,2685,5,en,False,Twitter for iPhone,72,95,https://t.co/IMtcTWcRBZ,https://twitter.com/SenSchumer/status/1465883843647479808/photo/1,72,95,https://t.co/IMtcTWcRBZ,https://twitter.com/SenSchumer/status/1465883843647479808/photo/1,NA,NA,NA,NA
SenSchumer,17494010,1465748759611117569,"With the infrastructure bill we passed, New York City is getting tens of millions in federal funds to expand our biking infrastructure.

It’s a #BikeBoom! https://t.co/2SEJBXk6Jr",2021-11-30 18:25:11+00:00,False,121,189,571,26,en,False,Twitter Media Studio,155,178,https://t.co/2SEJBXk6Jr,https://twitter.com/SenSchumer/status/1465748759611117569/video/1,NA,NA,NA,NA,NA,NA,NA,NA
SenSchumer,17494010,1465737467848540171,"Lowering child care costs and making pre-K universally accessible

Cutting taxes for parents and families

Taking bold steps to fight the climate crisis

Build Back Better will be largest investment in the American people we’ve seen in generations",2021-11-30 17:40:19+00:00,False,219,320,1023,18,en,False,Twitter Web App,NA,NA,NA,NA,NA,NA,NA,NA,NA,NA,NA,NA
SenSchumer,17494010,1465502693137567744,It was an honor to help light the menorah tonight at the Israeli Embassy with @SenatorCardin and the new Ambassador @AmbHerzog! #HappyHanukkah https://t.co/yjiLRlJlPY,2021-11-30 02:07:24+00:00,False,102,71,790,5,en,False,Twitter Web App,143,166,https://t.co/yjiLRlJlPY,https://twitter.com/SenSchumer/status/1465502693137567744/photo/1,NA,NA,NA,NA,NA,NA,NA,NA
SenSchumer,17494010,1465486719520755714,"We secured a historic $15B in the infrastructure bill we passed to remove toxic lead pipes in NY and the US. I stood with @NydiaVelazquez, labor unions, and environmental justice groups to explain how with this $$$ we can GET THE LEAD OUT and create thousands of union jobs. https://t.co/TXFsiNluOv",2021-11-30 01:03:56+00:00,False,114,136,534,17,en,False,Twitter Web App,275,298,https://t.co/TXFsiNluOv,https://twitter.com/SenSchumer/status/1465486719520755714/photo/1,275,298,https://t.co/TXFsiNluOv,https://twitter.com/SenSchumer/status/1465486719520755714/photo/1,275,298,https://t.co/TXFsiNluOv,https://twitter.com/SenSchumer/status/1465486719520755714/photo/1
SenSchumer,17494010,1465448829336133635,I am so thankful for my dear friend and the tireless fighter for working people in New York — La Luchadora! — @NydiaVelazquez! https://t.co/17xHi0gE3D,2021-11-29 22:33:22+00:00,False,42,51,242,5,en,False,Twitter Web App,127,150,https://t.co/17xHi0gE3D,https://twitter.com/NydiaVelazquez/status/1463224733189693459,NA,NA,NA,NA,NA,NA,NA,NA
SenSchumer,17494010,1465445401092317185,"We've lost over 100,000 Americans to overdose in just 12 months.

NYers of all backgrounds are united in a vision of a NY free from overdose, grounded in evidence, compassion, and care.

Thank you to the leadership of NY groups like @VOCALNewYork, @DPA_NY, and @EndOverdoseNY.",2021-11-29 22:19:44+00:00,False,67,144,332,16,en,False,Twitter Web App,NA,NA,NA,NA,NA,NA,NA,NA,NA,NA,NA,NA
SenSchumer,17494010,1465442627600498698,"Build Back Better represents the largest investment in the American people in generations.

We will make child care and pre-K more affordable.

We will fight against the climate crisis.

We will bring costs under control.

We will create the jobs of tomorrow.",2021-11-29 22:08:43+00:00,False,344,555,1645,44,en,False,Twitter Web App,NA,NA,NA,NA,NA,NA,NA,NA,NA,NA,NA,NA
SenSchumer,17494010,1465436766475857930,Get vaccinated. And get your booster. https://t.co/Iz44P1XMUS,2021-11-29 21:45:26+00:00,False,238,334,1504,26,en,False,Twitter Web App,38,61,https://t.co/Iz44P1XMUS,https://twitter.com/POTUS/status/1465367679439720457,NA,NA,NA,NA,NA,NA,NA,NA
SenSchumer,17494010,1464957903169798154,"This is the eulogy I gave for my dad, Abe, at his funeral. He was the quiet, strong glue that kept our family so close, the kind of person that keeps our society strong. He was a shining example of the Greatest Generation. We love him and will miss him.
https://t.co/q3ARoNM7Io",2021-11-28 14:02:36+00:00,False,248,228,3472,22,en,False,Twitter Web App,254,277,https://t.co/q3ARoNM7Io,https://senschumer.medium.com/my-eulogy-for-my-dad-abe-schumer-b6f21386bef4,NA,NA,NA,NA,NA,NA,NA,NA
SenSchumer,17494010,1464780805318795265,"Hate has no place in Nassau County, in New York, or across this country. I will keep working to fight racism and hatred. https://t.co/1T6IgSjj2Q",2021-11-28 02:18:52+00:00,False,1257,1208,5174,179,en,False,Twitter for iPhone,121,144,https://t.co/1T6IgSjj2Q,https://twitter.com/toddkaminsky/status/1464709037593923591,NA,NA,NA,NA,NA,NA,NA,NA
SenSchumer,17494010,1463899066723717127,Wishing you and your family a Happy Thanksgiving!,2021-11-25 15:55:10+00:00,False,379,416,5789,38,en,False,Twitter for iPhone,NA,NA,NA,NA,NA,NA,NA,NA,NA,NA,NA,NA
SenSchumer,17494010,1463672287387922435,"My father Abe, 98, passed away this evening

In so many ways—he personified the greatest generation. He took whatever was thrown at him no matter how difficult, did his job, never complained. An amazing husband, parent, grandparent, great-grandparent. We love him &amp; will miss him. https://t.co/gUbdAp3Jr1",2021-11-25 00:54:01+00:00,False,2999,9569,67679,670,en,False,Twitter for iPhone,285,308,https://t.co/gUbdAp3Jr1,https://twitter.com/SenSchumer/status/1463672287387922435/photo/1,NA,NA,NA,NA,NA,NA,NA,NA
SenSchumer,17494010,1463606636954755073,"This is a step forward in Ahmaud Arbery’s family receiving the justice they deserve.

He should still be alive today.

One single verdict in a single trial will never be enough. https://t.co/czVtB6lhAZ",2021-11-24 20:33:09+00:00,False,163,148,1140,16,en,False,Twitter Web App,178,201,https://t.co/czVtB6lhAZ,https://twitter.com/nytimes/status/1463580209169551365,NA,NA,NA,NA,NA,NA,NA,NA
SenSchumer,17494010,1463539215589908483,"I've long pushed for expanded US investment in electric vehicle infrastructure

The infrastructure bill delivers over $12B to build out EV charging infrastructure &amp; purchase electric transit, school buses—meaning more accessible EV chargers &amp; less air pollution across NY &amp; the US",2021-11-24 16:05:14+00:00,False,207,310,1017,26,en,False,Twitter Web App,NA,NA,NA,NA,NA,NA,NA,NA,NA,NA,NA,NA
SenSchumer,17494010,1463324052647514116,"Did ya hear the one about the girl, the scholarship, and the trip around the world? https://t.co/eeTiklFn22",2021-11-24 01:50:16+00:00,False,77,165,554,17,en,False,Twitter for iPhone,84,107,https://t.co/eeTiklFn22,https://twitter.com/JimmyVielkind/status/1463262544794202119,NA,NA,NA,NA,NA,NA,NA,NA
SenSchumer,17494010,1463300994109001732,"The Broadway Junction station will soon become more accessible for all to use, thanks to the infrastructure bill and a $15M RAISE grant I fought to deliver.

I advocated for these upgrades so that New Yorkers with disabilities have the access to mass transit that they deserve. https://t.co/qK4OSYJYdJ",2021-11-24 00:18:38+00:00,False,79,79,364,10,en,False,Twitter Media Studio,278,301,https://t.co/qK4OSYJYdJ,https://twitter.com/SenSchumer/status/1463300994109001732/video/1,NA,NA,NA,NA,NA,NA,NA,NA
SenSchumer,17494010,1463241026475335682,"A disproportionate burden of student debt falls on Black borrowers.

President Biden can use executive authority to #CancelStudentDebt and help close the racial wealth gap.
https://t.co/LKh25oqafK",2021-11-23 20:20:21+00:00,False,137,196,540,24,en,False,Twitter Web App,173,196,https://t.co/LKh25oqafK,https://news.yahoo.com/jim-crow-debt-most-black-110100658.html,NA,NA,NA,NA,NA,NA,NA,NA
SenSchumer,17494010,1463222113087766539,"I have been riding my bike around New York City for a long time. And I’m so proud of the changes we’re about to make.

With this infrastructure bill, we’re getting tens of millions in federal funds to expand our biking infrastructure! #BikeBoom https://t.co/GFJ5Bb78Kp",2021-11-23 19:05:11+00:00,False,229,372,2038,50,en,False,Twitter for iPhone,245,268,https://t.co/GFJ5Bb78Kp,https://twitter.com/SenSchumer/status/1463222113087766539/photo/1,NA,NA,NA,NA,NA,NA,NA,NA
SenSchumer,17494010,1463215123720388611,"It’s a #BikeBoom!

New York City is poised to land tens of millions in federal funds from our infrastructure bill to expand our biking infrastructure to help with bike lanes and jobs and climate and equality. https://t.co/0u3v2UtB1d",2021-11-23 18:37:25+00:00,False,83,102,477,10,en,False,Twitter Web App,209,232,https://t.co/0u3v2UtB1d,https://twitter.com/SenSchumer/status/1463215123720388611/photo/1,NA,NA,NA,NA,NA,NA,NA,NA
SenSchumer,17494010,1463204575561895936,"The War on Drugs has been a war on people—particularly people of color.
 
We must end the federal prohibition on marijuana and make criminal justice reforms—I’m working with @SenBooker and @RonWyden to pass our Cannabis Administration and Opportunity Act to do just that. https://t.co/tDsMlr7o7I",2021-11-23 17:55:30+00:00,False,214,349,959,25,en,False,Twitter Web App,272,295,https://t.co/tDsMlr7o7I,https://twitter.com/lastprisonerprj/status/1462835302456778752,NA,NA,NA,NA,NA,NA,NA,NA
SenSchumer,17494010,1463132518677368832,"Good news for families.

I called for this to provide relief at the pump and signal to OPEC they can't manipulate supply to inflate gas prices.

Of course—the only long term solution is to keep working to eliminate fossil fuel dependence and create a robust green energy economy. https://t.co/KvjmwmSbGz",2021-11-23 13:09:10+00:00,False,455,576,2257,64,en,False,Twitter Web App,280,303,https://t.co/KvjmwmSbGz,https://twitter.com/WhiteHouse/status/1463131467421212672,NA,NA,NA,NA,NA,NA,NA,NA
SenSchumer,17494010,1462976994782625793,"I worked with @RepBowman to secure a nearly $12M RAISE Grant for New Rochelle. This will transform the unfinished Memorial Highway into open green space, reconnect the community to the downtown, and improve access to new job opportunities. https://t.co/2vjcMLGfjo",2021-11-23 02:51:11+00:00,False,71,81,375,7,en,False,Twitter Web App,240,263,https://t.co/2vjcMLGfjo,https://twitter.com/SenSchumer/status/1462976994782625793/photo/1,240,263,https://t.co/2vjcMLGfjo,https://twitter.com/SenSchumer/status/1462976994782625793/photo/1,240,263,https://t.co/2vjcMLGfjo,https://twitter.com/SenSchumer/status/1462976994782625793/photo/1
SenSchumer,17494010,1462904266717380619,"I was proud to stand with @RepJeffries, @SenatorPersaud, @JabariBrisport, @SandyforCouncil, @TheRealLatriceW, @RidersAlliance, @BrooklynBCID, @DIA_NewYork, @RiseAndResistNY, and so many more who advocated for these improvements to Broadway Junction!",2021-11-22 22:02:11+00:00,True,21,24,145,0,en,False,Twitter Web App,NA,NA,NA,NA,NA,NA,NA,NA,NA,NA,NA,NA
SenSchumer,17494010,1462904263802241027,"With the infrastructure bill and because I encouraged @SecretaryPete to support this:

MTA's been awarded a $15M grant to make Broadway Junction station more accessible for ALL to use, and disabled New Yorkers will have the access and accommodations they need and deserve. https://t.co/gVQAQjF2FU",2021-11-22 22:02:10+00:00,False,95,68,494,8,en,False,Twitter Web App,273,296,https://t.co/gVQAQjF2FU,https://twitter.com/SenSchumer/status/1462904263802241027/photo/1,273,296,https://t.co/gVQAQjF2FU,https://twitter.com/SenSchumer/status/1462904263802241027/photo/1,273,296,https://t.co/gVQAQjF2FU,https://twitter.com/SenSchumer/status/1462904263802241027/photo/1
SenSchumer,17494010,1462879343638687746,"On Long Island, 13 school districts were hit by cyber-attacks &amp; data breaches between 2018 and 2020

I worked hard to include a new $1B cybersecurity grant program in the infrastructure bill to help protect &amp; prevent future cyber-attacks on schools in Long Island, NY, and the US https://t.co/yhlsOe0jQf",2021-11-22 20:23:09+00:00,False,78,80,414,10,en,False,Twitter Web App,288,311,https://t.co/yhlsOe0jQf,https://twitter.com/SenSchumer/status/1462879343638687746/photo/1,288,311,https://t.co/yhlsOe0jQf,https://twitter.com/SenSchumer/status/1462879343638687746/photo/1,288,311,https://t.co/yhlsOe0jQf,https://twitter.com/SenSchumer/status/1462879343638687746/photo/1
SenSchumer,17494010,1462860293055389696,"With the passage of the infrastructure bill, over $65B is on its way to households nationwide, ensuring communities in NY and across America have access to affordable high-speed internet, digital skills and digital literacy education, and existing programs to connect rural areas.",2021-11-22 19:07:27+00:00,False,313,230,1427,17,en,False,Twitter Web App,NA,NA,NA,NA,NA,NA,NA,NA,NA,NA,NA,NA
SenSchumer,17494010,1462599491261980673,We’re praying for the victims of horrific violence at the Waukesha Christmas Parade. https://t.co/4Vg0fOGjjQ,2021-11-22 01:51:07+00:00,False,356,258,2585,18,en,False,Twitter Web App,85,108,https://t.co/4Vg0fOGjjQ,https://twitter.com/SenatorBaldwin/status/1462577424265363459,NA,NA,NA,NA,NA,NA,NA,NA
SenSchumer,17494010,1462564698319200260,"Happy Birthday Noah, turning 3 years old this week! And wishing you so many more! https://t.co/LK6zdNHXQn",2021-11-21 23:32:51+00:00,False,145,234,4578,20,en,False,Twitter for iPhone,82,105,https://t.co/LK6zdNHXQn,https://twitter.com/SenSchumer/status/1462564698319200260/photo/1,NA,NA,NA,NA,NA,NA,NA,NA
SenSchumer,17494010,1462505403074465792,"I stood at @SAVEEastHarlem with @RepEspaillat, @AlvinBraggNYC, &amp; families who've lost loved ones to gun violence &amp; were helped by these Community Violence Intervention programs

These proven programs work

I'm working for billions to fund them in NY &amp; the US in Build Back Better https://t.co/1GB3urLDQ8",2021-11-21 19:37:14+00:00,False,120,148,493,13,en,False,Twitter Web App,292,315,https://t.co/1GB3urLDQ8,https://twitter.com/SenSchumer/status/1462505403074465792/photo/1,NA,NA,NA,NA,NA,NA,NA,NA
SenSchumer,17494010,1462215587711664128,"The first mezuzah ever hung on the doorpost of the Vice President’s Residence, by the @VP and @SecondGentleman! https://t.co/Z1Bogh98Ld",2021-11-21 00:25:37+00:00,False,400,169,3874,13,en,False,Twitter for iPhone,112,135,https://t.co/Z1Bogh98Ld,https://twitter.com/CNN/status/1462122088743981056,NA,NA,NA,NA,NA,NA,NA,NA
SenSchumer,17494010,1462174777750269952,"Happy Birthday, President Biden! https://t.co/1NZ9Y3ryhb",2021-11-20 21:43:27+00:00,False,546,367,7098,47,en,False,Twitter for iPhone,33,56,https://t.co/1NZ9Y3ryhb,https://twitter.com/SenSchumer/status/1462174777750269952/photo/1,NA,NA,NA,NA,NA,NA,NA,NA
SenSchumer,17494010,1462097728926793729,"I was incredibly honored to speak at the historic swearing-in of Damian Williams as US Attorney for the Southern District of NY—the first Black US Attorney in the role.

He's immensely talented, committed to equal justice under the law.

I was so proud to recommend him to @POTUS! https://t.co/EXuHHRQ0ii",2021-11-20 16:37:17+00:00,False,230,112,1483,9,en,False,Twitter Web App,281,304,https://t.co/EXuHHRQ0ii,https://twitter.com/SenSchumer/status/1462097728926793729/photo/1,281,304,https://t.co/EXuHHRQ0ii,https://twitter.com/SenSchumer/status/1462097728926793729/photo/1,281,304,https://t.co/EXuHHRQ0ii,https://twitter.com/SenSchumer/status/1462097728926793729/photo/1
SenSchumer,17494010,1461760382121435141,"In August, I called on the Texas School Board urging them to remove their funds from Greenbrook Partners, a predatory private equity backed landlord displacing Brooklyn tenants. These practices are ongoing, and action is needed. I'm proud to stand with @BradLander in this fight. https://t.co/6369Ojk07j",2021-11-19 18:16:47+00:00,False,66,69,303,2,en,False,Twitter Web App,280,303,https://t.co/6369Ojk07j,https://twitter.com/SenSchumer/status/1449107369632407564,NA,NA,NA,NA,NA,NA,NA,NA
SenSchumer,17494010,1461710320217604098,"The House has taken an important step to advance Build Back Better to cut middle-class taxes; invest in child care, universal pre-K, affordable housing; lower Rx costs; fight climate change; create jobs; more.

We will act as quickly as possible to get this bill to @POTUS’s desk.",2021-11-19 14:57:52+00:00,False,851,652,5558,78,en,False,Twitter Web App,NA,NA,NA,NA,NA,NA,NA,NA,NA,NA,NA,NA
SenSchumer,17494010,1461554964677996544,If only Kevin McCarthy cared as much about helping people as he did about auditioning to speak at a Trump rally,2021-11-19 04:40:32+00:00,False,3874,989,25925,179,en,False,Twitter for iPhone,NA,NA,NA,NA,NA,NA,NA,NA,NA,NA,NA,NA
