ScreenName,AuthorID,TweetID,Text,TweetDate,isReply,RetweetCount,ReplyCount,LikeCount,QuoteCount,Language,PossibleSensitive,Source,1stURLStart,1stURLEnd,1stURL,1stURLExp,2ndURLStart,2ndURLEnd,2ndURL,2ndURLExp,3rdURLStart,3rdURLEnd,3rdURL,3rdURLExp
SenSchumer,17494010,1494003715833016323,"Our economy created 6.6 million jobs in President Biden's first year.

6.6 MILLION JOBS

And Dems remain laser-focused on lowering costs for the American people:

—Lowering childcare costs
—Lowering insulin costs
—Fixing supply chains
—Boosting US manufacturing
—And so much more!",2022-02-16 17:40:17+00:00,False,449,657,1435,51,en,False,Twitter Web App,NA,NA,NA,NA,NA,NA,NA,NA,NA,NA,NA,NA
SenSchumer,17494010,1493998023663366154,"I'm honored to introduce Nina Morrison to @JudiciaryDems

On my recommendation, she’s @POTUS’s nominee for District Judge for NY's Eastern District

Not from a big corporate firm, she’s dedicated her career to the @Innocence Project—representing people wrongly convicted of crimes https://t.co/y164QTeXR0",2022-02-16 17:17:40+00:00,False,174,97,828,16,en,False,Twitter Web App,281,304,https://t.co/y164QTeXR0,https://twitter.com/SenSchumer/status/1493998023663366154/photo/1,NA,NA,NA,NA,NA,NA,NA,NA
SenSchumer,17494010,1493723820594630656,"We had 6.6M new jobs in one year!

And now whether it’s child care, insulin, supply chains, semiconductor chips, American manufacturing, what’s on the dinner table, or more:

Democrats are moving forward with solutions to bring down costs for Americans.

https://t.co/T5ThPDr3pU",2022-02-15 23:08:05+00:00,False,243,465,999,32,en,False,Twitter Web App,255,278,https://t.co/T5ThPDr3pU,https://www.dataforprogress.org/blog/2022/2/14/senator-schumer-make-it-in-america,NA,NA,NA,NA,NA,NA,NA,NA
SenSchumer,17494010,1493701783121764355,"The Senate stands with the people of Ukraine and our NATO allies and partners most threatened by Russian aggression

Our troops stand ready to reinforce our allies' defenses

We are prepared to respond decisively to Russian efforts to undermine US security
https://t.co/Qi4M1l0WNu",2022-02-15 21:40:31+00:00,False,113,130,403,7,en,False,Twitter Web App,257,280,https://t.co/Qi4M1l0WNu,https://www.democrats.senate.gov/newsroom/press-releases/schumer-mcconnell-durbin-thune-reed-inhofe-brown-toomey-menendez-risch-warner-rubio-message-of-solidarity-with-the-people-of-ukraine,NA,NA,NA,NA,NA,NA,NA,NA
SenSchumer,17494010,1493632600585523200,"The economy added 6.6 million new jobs last year—the most ever for a President’s first year!

But Americans still need us to find ways to lower prices

We are working on legislation to cut costs, fix supply chains, and boost American manufacturing

https://t.co/T5ThPDIEOu",2022-02-15 17:05:36+00:00,False,137,281,505,19,en,False,Twitter Web App,249,272,https://t.co/T5ThPDIEOu,https://www.dataforprogress.org/blog/2022/2/14/senator-schumer-make-it-in-america,NA,NA,NA,NA,NA,NA,NA,NA
SenSchumer,17494010,1493623292204359680,"Alvin Ailey was a trailblazing dancer, choreographer, &amp; activist.

He founded the Alvin Ailey American Dance Theater in New York City in 1958.

His revolutionary art honored the Black American experience through dance, and his impact continues to be felt today. #BlackHistoryMonth https://t.co/ydNcVvusYe",2022-02-15 16:28:37+00:00,True,52,21,356,1,en,False,Twitter Web App,285,308,https://t.co/ydNcVvusYe,https://twitter.com/SenSchumer/status/1493623292204359680/photo/1,NA,NA,NA,NA,NA,NA,NA,NA
SenSchumer,17494010,1493398013158608896,"Our constituents want us to fix the USPS. They can’t have prescriptions or Social Security checks coming late.

GOP Senator Rick Scott has decided to use a technical detail to try to hold up postal reform.

But he won’t stop us. We will pass it. https://t.co/71LDNXtBf9",2022-02-15 01:33:26+00:00,False,956,592,3427,117,en,False,Twitter Media Studio,246,269,https://t.co/71LDNXtBf9,https://twitter.com/SenSchumer/status/1493398013158608896/video/1,NA,NA,NA,NA,NA,NA,NA,NA
SenSchumer,17494010,1493395009105707008,"I stand with the hardworking immigrant workers in New York and across the country who are taking part today in the #DayWithoutImmigrants protest.

Senate Democrats will continue to pursue every means to achieve immigration reform with a pathway to citizenship. https://t.co/uVKZ6FsvhB",2022-02-15 01:21:30+00:00,False,138,155,416,15,en,False,Twitter Web App,261,284,https://t.co/uVKZ6FsvhB,https://twitter.com/FEWCoalition/status/1493265158478651394,NA,NA,NA,NA,NA,NA,NA,NA
SenSchumer,17494010,1493344307285315594,"Under @POTUS, the Senate has confirmed 46 federal judges.
3/4 have been women.
2/3 have been people of color.

ALL have been highly qualified.

They are public defenders, civil rights and election lawyers, people with public-service experience.

And we’re going to keep going.",2022-02-14 22:00:02+00:00,False,595,251,3767,44,en,False,Twitter Web App,NA,NA,NA,NA,NA,NA,NA,NA,NA,NA,NA,NA
SenSchumer,17494010,1493342770026668043,"President Biden has promised that he will nominate a Black Woman to serve as a Supreme Court Justice for the first time ever.

That will be an important moment in the history of the Supreme Court and in the history of our country.",2022-02-14 21:53:55+00:00,False,219,450,1598,29,en,False,Twitter Web App,NA,NA,NA,NA,NA,NA,NA,NA,NA,NA,NA,NA
SenSchumer,17494010,1493335973937229832,"A leading figure of the Stonewall Uprising, and an activist for trans rights, for all LGBTQ rights, in the fight against AIDS, and more:
 
We honor and remember Marsha P. Johnson's legacy. #BlackHistoryMonth
 
https://t.co/E4kOmZpqRt",2022-02-14 21:26:55+00:00,True,67,26,391,0,en,False,Twitter Web App,210,233,https://t.co/E4kOmZpqRt,https://www.cnn.com/2019/06/26/us/marsha-p-johnson-biography/index.html,NA,NA,NA,NA,NA,NA,NA,NA
SenSchumer,17494010,1493296219883462661,"4 years ago—17 lives were taken in the horrific shooting at Marjory Stoneman Douglas High School

We remember the students and educators who were killed

We stand with the survivors

We stand with the families, loved ones

We continue to work for meaningful gun safety legislation",2022-02-14 18:48:57+00:00,False,201,157,904,14,en,False,Twitter Web App,NA,NA,NA,NA,NA,NA,NA,NA,NA,NA,NA,NA
SenSchumer,17494010,1493001626872860675,"Happy 190th Birthday to @CityofUtica!

I hope you’re celebrating with tomato pie, riggies, @SaranacBrewery and so much more!",2022-02-13 23:18:21+00:00,False,28,43,223,5,en,False,Twitter Web App,NA,NA,NA,NA,NA,NA,NA,NA,NA,NA,NA,NA
SenSchumer,17494010,1492967473246875657,"I’m standing together today with postal workers from NYC, postal workers from Long Island, and an Etsy entrepreneur who depends on the USPS.

We will move forward in the Senate to pass the Postal Service Reform Act and help strengthen one of America’s most important institutions. https://t.co/kSDiilHkV4",2022-02-13 21:02:38+00:00,False,249,196,1107,26,en,False,Twitter Web App,281,304,https://t.co/kSDiilHkV4,https://twitter.com/SenSchumer/status/1492967473246875657/photo/1,NA,NA,NA,NA,NA,NA,NA,NA
SenSchumer,17494010,1492966343292948483,"Hattie Carthan worked to change conservation in Brooklyn.

An environmentalist who co-founded the Bedford-Stuyvesant Beautification Committee, she also created the Magnolia Tree Earth Center and planted over 1,500 trees in the area.

#BlackHistoryMonth

https://t.co/4GPuN1l4Pf",2022-02-13 20:58:08+00:00,True,32,13,214,0,en,False,Twitter Web App,254,277,https://t.co/4GPuN1l4Pf,https://www.outdoors.org/resources/amc-outdoors/history/save-a-tree-save-a-neighborhood-hattie-carthan-brooklyns-tree-lady/,NA,NA,NA,NA,NA,NA,NA,NA
SenSchumer,17494010,1492917809482981381,"Wish the @BuffaloBills were playing in the Super Bowl, but at least Yonkers' own @MaryJBlige will be repping New York at halftime!",2022-02-13 17:45:17+00:00,False,70,178,781,12,en,False,Twitter for iPhone,NA,NA,NA,NA,NA,NA,NA,NA,NA,NA,NA,NA
SenSchumer,17494010,1492642706589368334,Today would be a great day for President Biden and Vice President Harris to #CancelStudentDebt.,2022-02-12 23:32:07+00:00,False,1446,2465,10933,360,en,False,Twitter for iPhone,NA,NA,NA,NA,NA,NA,NA,NA,NA,NA,NA,NA
SenSchumer,17494010,1492616815956176901,"I'm honored to work with unions as we fight to #CancelStudentDebt.

I stood this week with staunch allies @UUPinfo, @PSC_Cuny, @SW_Columbia, @UAWRegion9A, and @NYTWA to work for President Biden to #CancelStudentDebt.

This will help young people to be able to follow their dreams. https://t.co/ZvqfdPJOZ6",2022-02-12 21:49:15+00:00,False,127,188,589,12,en,False,Twitter Web App,281,304,https://t.co/ZvqfdPJOZ6,https://twitter.com/SenSchumer/status/1492616815956176901/photo/1,NA,NA,NA,NA,NA,NA,NA,NA
SenSchumer,17494010,1492614371503218694,Thank you to NYC Council Member Shekar Krishnan @VoteShekar for having me at your Lunar New Year celebration today in Queens! #YearOfTheTiger https://t.co/RMgbQHVnRo,2022-02-12 21:39:32+00:00,False,43,30,290,3,en,False,Twitter Web App,142,165,https://t.co/RMgbQHVnRo,https://twitter.com/SenSchumer/status/1492614371503218694/photo/1,NA,NA,NA,NA,NA,NA,NA,NA
SenSchumer,17494010,1492603435098812417,We have a great coalition fighting side-by-side to work for President Biden to #CancelStudentDebt! https://t.co/lAVrQ4w8By,2022-02-12 20:56:04+00:00,False,230,363,1167,42,en,False,Twitter Media Studio,99,122,https://t.co/lAVrQ4w8By,https://twitter.com/SenSchumer/status/1492603435098812417/video/1,NA,NA,NA,NA,NA,NA,NA,NA
SenSchumer,17494010,1492554719960748033,"Lena Horne was a groundbreaking performer and civil rights activist

Starting her career at the historic Cotton Club in Harlem:

She became the first Black woman to sign a long-term Hollywood agency contract, and she refused roles that stereotyped Black women

#BlackHistoryMonth https://t.co/Wwsv2ah8dS",2022-02-12 17:42:30+00:00,True,89,26,608,2,en,False,Twitter Web App,280,303,https://t.co/Wwsv2ah8dS,https://twitter.com/SenSchumer/status/1492554719960748033/photo/1,NA,NA,NA,NA,NA,NA,NA,NA
SenSchumer,17494010,1492320992559042563,"I’m incredibly proud to have WNY native Kaitlin Hawayek competing in ice dancing at the Olympics!

Good luck Kaitlin. We’re all cheering for you! 

https://t.co/qn8ba5QUHG",2022-02-12 02:13:45+00:00,False,46,42,292,2,en,False,Twitter for iPhone,148,171,https://t.co/qn8ba5QUHG,https://www.wkbw.com/sports/ice-dancer-and-wny-native-kaitlin-hawayek-making-olympic-debut-this-weekend,NA,NA,NA,NA,NA,NA,NA,NA
SenSchumer,17494010,1492310489296220161,"I was proud to stand with @NAACPNYS, @NYUrbanLeague, @NAACP, and @NatUrbanLeague today in New York to fight back against predatory for-profit colleges.

Many of these for-profit schools systematically target Black communities.

We need @POTUS to act to #CancelStudentDebt now. https://t.co/oLbcDB32FT",2022-02-12 01:32:01+00:00,False,78,121,349,8,en,False,Twitter Web App,277,300,https://t.co/oLbcDB32FT,https://twitter.com/SenSchumer/status/1492310489296220161/photo/1,277,300,https://t.co/oLbcDB32FT,https://twitter.com/SenSchumer/status/1492310489296220161/photo/1,277,300,https://t.co/oLbcDB32FT,https://twitter.com/SenSchumer/status/1492310489296220161/photo/1
SenSchumer,17494010,1492289183909568515,"This entire team is incredible, Ashley Caldwell, Justin Schoenefeld, and Chris Lillis!

And I’m proud to say that Chris Lillis is from Rochester, New York! All of New York is beaming with pride! https://t.co/cNstC8BkhS",2022-02-12 00:07:21+00:00,False,30,28,235,1,en,False,Twitter Web App,195,218,https://t.co/cNstC8BkhS,https://twitter.com/usskiteam/status/1491765654319353859,NA,NA,NA,NA,NA,NA,NA,NA
SenSchumer,17494010,1492259933026410502,"Born into slavery in NY—Sojourner Truth was a fierce advocate for abolition and suffrage

She helped enslaved people escape

She helped recruit Black troops to the Union Army

She worked for women's rights—including giving her famous ""Ain't I A Woman?"" speech

#BlackHistoryMonth https://t.co/DKQEuhN5OB",2022-02-11 22:11:07+00:00,True,117,37,618,2,en,False,Twitter Web App,280,303,https://t.co/DKQEuhN5OB,https://twitter.com/SenSchumer/status/1492259933026410502/photo/1,NA,NA,NA,NA,NA,NA,NA,NA
SenSchumer,17494010,1492238301784383497,"In New York, 2.4 million people owe almost $93 billion in federal student loan debt.

That is a crisis.

President Biden must take action now and use his existing legal authority to #CancelStudentDebt.",2022-02-11 20:45:10+00:00,False,584,824,2763,70,en,False,Twitter Web App,NA,NA,NA,NA,NA,NA,NA,NA,NA,NA,NA,NA
SenSchumer,17494010,1492211653802438667,"Without action, student loan payments will resume on May 1.

Today would be a great day for President Biden and Vice President Harris to #CancelStudentDebt.",2022-02-11 18:59:16+00:00,False,878,915,4471,96,en,False,Twitter Web App,NA,NA,NA,NA,NA,NA,NA,NA,NA,NA,NA,NA
SenSchumer,17494010,1492201376914591751,"One of the worst drivers of the student debt crisis is FOR-PROFIT COLLEGES.

Many of these schools are predatory institutions that target communities of color, veterans, low-income people, and more.

To help people who've been impacted, @POTUS needs to #CancelStudentDebt now. https://t.co/dAiJZ8oscY",2022-02-11 18:18:26+00:00,False,252,291,1127,38,en,False,Twitter Web App,277,300,https://t.co/dAiJZ8oscY,https://twitter.com/SenSchumer/status/1492201376914591751/photo/1,NA,NA,NA,NA,NA,NA,NA,NA
SenSchumer,17494010,1491969018936410112,I’m so proud to join the swearing-in ceremony for our newest New York State Assemblymember @AMEddieGibbs! https://t.co/TMBnlFysDW,2022-02-11 02:55:08+00:00,False,41,69,321,6,en,False,Twitter Web App,106,129,https://t.co/TMBnlFysDW,https://twitter.com/SenSchumer/status/1491969018936410112/photo/1,NA,NA,NA,NA,NA,NA,NA,NA
SenSchumer,17494010,1491903601387753472,"Hundreds of millions of Americans live in states where cannabis has been legalized in some way.

It’s long past time for the federal government to catch up.

The Senate will move forward on cannabis legalization with justice for the communities most impacted by the War on Drugs.",2022-02-10 22:35:11+00:00,False,376,412,2054,58,en,False,Twitter Web App,NA,NA,NA,NA,NA,NA,NA,NA,NA,NA,NA,NA
SenSchumer,17494010,1491876195918651401,Today would be a great day for President Biden and Vice President Harris to #CancelStudentDebt,2022-02-10 20:46:17+00:00,False,979,1296,5980,117,en,False,Twitter Web App,NA,NA,NA,NA,NA,NA,NA,NA,NA,NA,NA,NA
SenSchumer,17494010,1491867478875648010,"A major figure of the Harlem Renaissance.
 
Singer, pianist, and comedian, Gladys Bentley helped break barriers for LGBTQ+ performers.
 
We remember and honor Gladys Bentley’s story. #BlackHistoryMonth
 
https://t.co/dHamOS0Jgf",2022-02-10 20:11:39+00:00,True,68,21,357,2,en,False,Twitter Web App,204,227,https://t.co/dHamOS0Jgf,https://www.smithsonianmag.com/smithsonian-institution/great-blues-singer-gladys-bentley-broke-rules-180971708/,NA,NA,NA,NA,NA,NA,NA,NA
SenSchumer,17494010,1491862917402316812,"Americans rely on the postal service every single day.

Passing the Postal Service Reform Act is one of the best steps we can take to strengthen one of our country’s most important institutions.

The Senate will take its first vote to move forward on this bill on Monday!",2022-02-10 19:53:31+00:00,False,190,152,909,10,en,False,Twitter Web App,NA,NA,NA,NA,NA,NA,NA,NA,NA,NA,NA,NA
SenSchumer,17494010,1491859491876478982,"The Violence Against Women Act must be reauthorized.

Survivors of domestic violence and abuse have waited too long for Congress to act.

We cannot allow inaction to persist for a moment longer. With this announcement—we are closer to achieving that goal and taking Senate action. https://t.co/Ep3mNjDwNs",2022-02-10 19:39:54+00:00,False,124,66,502,6,en,False,Twitter Web App,281,304,https://t.co/Ep3mNjDwNs,https://twitter.com/JudiciaryDems/status/1491533564655120387,NA,NA,NA,NA,NA,NA,NA,NA
SenSchumer,17494010,1491854307507027970,"This is big news:

The Senate just passed the bill to eliminate for good the awful practice of forcing victims of workplace sexual harassment and assault into arbitration.

The House has acted. The Senate has acted. And now it's on to President Biden’s desk.",2022-02-10 19:19:18+00:00,False,1006,271,6193,52,en,False,Twitter Web App,NA,NA,NA,NA,NA,NA,NA,NA,NA,NA,NA,NA
SenSchumer,17494010,1491802728565145605,"As Senate Majority Leader, I can set priorities.

And comprehensive federal cannabis legalization with justice for the communities most impacted by the War on Drugs—especially communities of color—is a Senate priority.

We will move forward.",2022-02-10 15:54:21+00:00,False,391,564,2360,93,en,False,Twitter Web App,NA,NA,NA,NA,NA,NA,NA,NA,NA,NA,NA,NA
SenSchumer,17494010,1491796399762993162,"Since 2010, 37 states have legalized medical use of cannabis and 18 states have legalized both medical and adult use.

It’s long past time for the Senate to act. @SenBooker, @RonWyden, and I plan to introduce comprehensive cannabis legalization soon.",2022-02-10 15:29:12+00:00,False,315,351,1519,51,en,False,Twitter Web App,NA,NA,NA,NA,NA,NA,NA,NA,NA,NA,NA,NA
SenSchumer,17494010,1491789196763095044,"Here’s what @SenBooker, @RonWyden, and I just told the Senate:

As more and more states legalize cannabis, the Senate's long overdue in addressing this issue and righting the wrongs of the past.

With your help, we plan to introduce comprehensive cannabis legalization soon. https://t.co/6aG7RDO4VU",2022-02-10 15:00:35+00:00,False,236,230,1004,60,en,False,Twitter Web App,275,298,https://t.co/6aG7RDO4VU,https://twitter.com/SenSchumer/status/1491789196763095044/photo/1,275,298,https://t.co/6aG7RDO4VU,https://twitter.com/SenSchumer/status/1491789196763095044/photo/1,NA,NA,NA,NA
SenSchumer,17494010,1491471909107773442,"Today, the Senate is voting on confirming more of President Biden’s highly-qualified nominees for his administration!",2022-02-09 17:59:47+00:00,False,751,632,7167,52,en,False,Twitter Web App,NA,NA,NA,NA,NA,NA,NA,NA,NA,NA,NA,NA
SenSchumer,17494010,1491464431057965059,"Americans rely on the Postal Service for medicines, essential goods, voting, correspondence, and their livelihoods.

But it needs reform and it has for over a decade.

With the overwhelming House vote for postal reform—I intend for the Senate to quickly take up and pass the bill!",2022-02-09 17:30:05+00:00,False,251,210,1244,24,en,False,Twitter Web App,NA,NA,NA,NA,NA,NA,NA,NA,NA,NA,NA,NA
SenSchumer,17494010,1491458329293377540,"Writer. Feminist. Civil Rights Activist.
 
Lorde’s work spoke to issues of race, gender, sexuality, class, and more.
 
Audre Lorde’s legacy is one that must be celebrated and continued. #BlackHistoryMonth https://t.co/H2vw420rGL",2022-02-09 17:05:50+00:00,True,70,27,337,2,en,False,Twitter Web App,205,228,https://t.co/H2vw420rGL,https://twitter.com/SenSchumer/status/1491458329293377540/photo/1,NA,NA,NA,NA,NA,NA,NA,NA
SenSchumer,17494010,1491219881353953284,"With the House voting overwhelmingly for postal reform

I intend for the Senate to take up and pass the bill before this work period ends

It’ll improve service for millions who rely on the Postal Service for medicines, essential goods, voting, correspondence, &amp; their livelihoods",2022-02-09 01:18:19+00:00,False,701,588,3890,84,en,False,Twitter for iPhone,NA,NA,NA,NA,NA,NA,NA,NA,NA,NA,NA,NA
SenSchumer,17494010,1491163735003652098,"Today, I introduced Assemblymember Nick Perry to @SFRCdems to be Ambassador to Jamaica.

Not only is he Jamaican-born—he is a Brooklynite through and through.

I am so proud to support him, and I was proud to recommend him to President Biden for this role. https://t.co/Qz5Lc29rN0",2022-02-08 21:35:13+00:00,False,56,73,333,13,en,False,Twitter Media Studio,257,280,https://t.co/Qz5Lc29rN0,https://twitter.com/SenSchumer/status/1491163735003652098/video/1,NA,NA,NA,NA,NA,NA,NA,NA
SenSchumer,17494010,1491158731111137280,"A big step to eliminating forced arbitration for victims of sexual harassment and assault!

This is about making workplaces safer, holding abusive employers accountable, ensuring people can exercise their right to seek justice in court

We'll take up the bill as soon as this week https://t.co/5DbctD4aMQ",2022-02-08 21:15:20+00:00,False,95,61,455,2,en,False,Twitter Web App,281,304,https://t.co/5DbctD4aMQ,https://twitter.com/HouseDailyPress/status/1490844841651351554,NA,NA,NA,NA,NA,NA,NA,NA
SenSchumer,17494010,1491143565866848261,"Edmonia Lewis was born in Greenbush, NY in 1844

She was a sculptor whose work explored literature, history, abolitionism, race, and more

She broke down barriers to become the first Black and Native American sculptors to receive international recognition
https://t.co/7y7W9gwfrI",2022-02-08 20:15:04+00:00,True,67,24,291,3,en,False,Twitter Web App,256,279,https://t.co/7y7W9gwfrI,https://www.cnn.com/2022/01/23/us/edmonia-lewis-stamp/index.html,NA,NA,NA,NA,NA,NA,NA,NA
SenSchumer,17494010,1491116418838183936,"A top scholar on the Holocaust and on modern-day antisemitism, Dr. Deborah Lipstadt is @POTUS’s nominee for Special Envoy to Monitor and Combat Antisemitism

I'm proud to speak at her @SFRCDems confirmation hearing

Antisemitism must be confronted whenever it rears its ugly head",2022-02-08 18:27:12+00:00,False,129,89,712,6,en,False,Twitter Web App,NA,NA,NA,NA,NA,NA,NA,NA,NA,NA,NA,NA
SenSchumer,17494010,1491113486063058945,"I'm honored to introduce NY's Nick Perry to @SFRCDems

Immigrant from Jamaica
Veteran
Public servant
He was my rec to @POTUS to be Amb. to Jamaica

I know he’ll make America and his family proud—his wife Joyce, son Nickolas Alexander, daughter Novalie, granddaughter Justine Skye https://t.co/q8bZhgV95A",2022-02-08 18:15:33+00:00,False,39,35,226,5,en,False,Twitter Web App,280,303,https://t.co/q8bZhgV95A,https://twitter.com/SenSchumer/status/1491113486063058945/photo/1,NA,NA,NA,NA,NA,NA,NA,NA
SenSchumer,17494010,1490859522725859330,"Ahead of his confirmation hearing with @SFRCdems tomorrow:

I was honored to meet tonight with Brooklyn Assemblymember Nick Perry.

I recommended him to President Biden to be the next U.S. Ambassador to Jamaica. He’d be the first-ever U.S. Ambassador to Jamaica born in Jamaica! https://t.co/U0xg5iDxnK",2022-02-08 01:26:23+00:00,False,69,55,425,9,en,False,Twitter for iPhone,279,302,https://t.co/U0xg5iDxnK,https://twitter.com/SenSchumer/status/1490859522725859330/photo/1,NA,NA,NA,NA,NA,NA,NA,NA
SenSchumer,17494010,1490816657714937856,"January 6th was an armed insurrection

An attempt to reverse, through violent means, the outcome of a free and fair election

Rooted in Donald Trump’s Big Lie

A Big Lie the RNC seems to now be officially giving its blessing

It’s chilling and dangerous https://t.co/ddJaqrOo5E",2022-02-07 22:36:03+00:00,False,237,338,884,19,en,False,Twitter Web App,254,277,https://t.co/ddJaqrOo5E,https://twitter.com/nytimes/status/1489670105768370177,NA,NA,NA,NA,NA,NA,NA,NA
SenSchumer,17494010,1490813987143000065,"At least 26 HBCUs have reported bomb threats in 2022.

Using fear, violence, and racism to try to steal the promise of a good education from millions of Black Americans is sickening.

We’re working with all relevant agencies to ensure those responsible are prosecuted.",2022-02-07 22:25:27+00:00,False,119,83,453,6,en,False,Twitter Web App,NA,NA,NA,NA,NA,NA,NA,NA,NA,NA,NA,NA
SenSchumer,17494010,1490810834959884288,"Once the House passes legislation today to end forced arbitration for sexual assault &amp; harassment:

We'll move as soon as this week to quickly take up this bill

It's a chance to finally act to nullify forced arbitration clauses that force survivors into a secret &amp; biased process",2022-02-07 22:12:55+00:00,False,117,68,557,4,en,False,Twitter Web App,NA,NA,NA,NA,NA,NA,NA,NA,NA,NA,NA,NA
SenSchumer,17494010,1490808418499764231,"In one year alone, the economy has added an incredible 6.6 million jobs.

That’s the most ever recorded for a President’s first year.

And President Biden and Democrats won’t stop working for people across this country. https://t.co/1FXoMB0phj",2022-02-07 22:03:19+00:00,False,127,207,467,16,en,False,Twitter Web App,220,243,https://t.co/1FXoMB0phj,https://twitter.com/POTUS/status/1489643363083161608,NA,NA,NA,NA,NA,NA,NA,NA
SenSchumer,17494010,1490807153413828608,"Langston Hughes’ poems, novels, plays, and more made him a leading figure in the Harlem Renaissance.
 
Hughes dedicated his work to telling the stories of Black life in America and was known as the people’s poet. #BlackHistoryMonth https://t.co/0RawRggBiA",2022-02-07 21:58:17+00:00,True,74,27,304,2,en,False,Twitter Web App,232,255,https://t.co/0RawRggBiA,https://twitter.com/SenSchumer/status/1490807153413828608/photo/1,NA,NA,NA,NA,NA,NA,NA,NA
SenSchumer,17494010,1490772630844194820,"Intolerance and violence like this has no place in New York or anywhere else, and it must be confronted and overcome. I will continue to work with organizations like @UnitedJewish to keep the community safe. https://t.co/JWXfiyeTKd",2022-02-07 19:41:07+00:00,False,100,118,326,19,en,False,Twitter Web App,208,231,https://t.co/JWXfiyeTKd,https://twitter.com/LincolnRestler/status/1490440099225645057,NA,NA,NA,NA,NA,NA,NA,NA
SenSchumer,17494010,1490752478132027398,"Student debt has created both an economic and a mental health crisis for millions of Americans.
 
President Biden can #CancelStudentDebt today and provide much needed relief.
 
https://t.co/ULUPV0lFes",2022-02-07 18:21:02+00:00,False,363,606,1502,53,en,False,Twitter Web App,177,200,https://t.co/ULUPV0lFes,https://www.cnbc.com/2022/01/29/student-loan-debt-hurts-the-mental-health-of-most-borrowers.html,NA,NA,NA,NA,NA,NA,NA,NA
