ScreenName,AuthorID,TweetID,Text,TweetDate,isReply,RetweetCount,ReplyCount,LikeCount,QuoteCount,Language,PossibleSensitive,Source,1stURLStart,1stURLEnd,1stURL,1stURLExp,2ndURLStart,2ndURLEnd,2ndURL,2ndURLExp,3rdURLStart,3rdURLEnd,3rdURL,3rdURLExp
SenSchumer,17494010,1490738177832890368,"Gun Violence Survivors Week helps share the stories of the survivors of gun violence and how they've lived with the trauma they’ve endured.

As we honor #GVSurvivorsWeek, Senate Democrats continue to work for meaningful, commonsense gun safety legislation. https://t.co/CCculoPIaf",2022-02-07 17:24:12+00:00,False,65,79,194,4,en,False,Twitter Web App,257,280,https://t.co/CCculoPIaf,https://momentsthatsurvive.org/national-gun-violence-survivors-week/gunshot-wounds/,NA,NA,NA,NA,NA,NA,NA,NA
SenSchumer,17494010,1490446352190525441,"It was so fun to celebrate our successful work in securing $75M in funding to help complete Bushwick Inlet Park.

Community engagement and activism from @BushwickInlet, @RepMaloney, @EmilyAssembly, @LincolnRestler, @BrianKavanaghNY, and so many more led to this moment! https://t.co/laa1BYxJb5",2022-02-06 22:04:36+00:00,False,44,81,281,3,en,False,Twitter Web App,270,293,https://t.co/laa1BYxJb5,https://twitter.com/SenSchumer/status/1490446352190525441/photo/1,NA,NA,NA,NA,NA,NA,NA,NA
SenSchumer,17494010,1490438953908023296,I was so proud to help open the United Chinese Association of Brooklyn’s new Sheepshead Bay branch today as we celebrate the Lunar New Year together! #YearOfTheTiger https://t.co/azHccq3eiQ,2022-02-06 21:35:12+00:00,False,54,91,402,5,en,False,Twitter for iPhone,166,189,https://t.co/azHccq3eiQ,https://twitter.com/SenSchumer/status/1490438953908023296/photo/1,166,189,https://t.co/azHccq3eiQ,https://twitter.com/SenSchumer/status/1490438953908023296/photo/1,NA,NA,NA,NA
SenSchumer,17494010,1490378266343059459,"El Caño Martín Peña es uno de los peores ejemplos de injusticia ambiental. Por años, Trump se rehusó a actuar.

Trabajamos junto al presidente Biden para asegurar los fondos para restaurar el Caño.

Seguiremos luchando por igualdad y justicia para nuestros compatriotas de PR. https://t.co/EuAi5En6DH",2022-02-06 17:34:03+00:00,False,27,37,107,1,es,False,Twitter Media Studio,277,300,https://t.co/EuAi5En6DH,https://twitter.com/SenSchumer/status/1490378266343059459/video/1,NA,NA,NA,NA,NA,NA,NA,NA
SenSchumer,17494010,1490374761419055108,"Ernestine Eckstein was a true trailblazer—leading the NY chapter of the Daughters of Bilitis and organizing some of the first public demonstrations for LGBTQ+ rights.

We honor her visionary leadership in the fight for equal rights and protections for all. #BlackHistoryMonth https://t.co/de1jHN85wq",2022-02-06 17:20:07+00:00,True,79,29,384,0,en,False,Twitter Web App,276,299,https://t.co/de1jHN85wq,https://twitter.com/SenSchumer/status/1490374761419055108/photo/1,NA,NA,NA,NA,NA,NA,NA,NA
SenSchumer,17494010,1490364610389622793,Thank you to the Korean American Association of Greater New York @TheKAAGNY for having me yesterday to celebrate the Lunar New Year together in Queens! #YearOfTheTiger https://t.co/lIPfl9InR3,2022-02-06 16:39:47+00:00,False,54,64,400,6,en,False,Twitter Web App,168,191,https://t.co/lIPfl9InR3,https://twitter.com/SenSchumer/status/1490364610389622793/photo/1,NA,NA,NA,NA,NA,NA,NA,NA
SenSchumer,17494010,1490046735279955974,I was honored to join the Flushing Lunar New Year Parade today! I’m wishing everyone good fortune and happiness. #YearOfTheTiger https://t.co/nFTN2yg1f3,2022-02-05 19:36:40+00:00,False,61,64,450,5,en,False,Twitter for iPhone,129,152,https://t.co/nFTN2yg1f3,https://twitter.com/SenSchumer/status/1490046735279955974/photo/1,NA,NA,NA,NA,NA,NA,NA,NA
SenSchumer,17494010,1490027835821596678,"Austin Steward was not only a distinguished author, but also a successful entrepreneur in Rochester

Steward dedicated his life to working for Black suffrage, and in 1857 he published his famed autobiography: Twenty-Two Years a Slave, and Forty Years a Freeman

#BlackHistoryMonth https://t.co/6jX14lrsou",2022-02-05 18:21:34+00:00,True,94,39,447,2,en,False,Twitter Web App,281,304,https://t.co/6jX14lrsou,https://twitter.com/SenSchumer/status/1490027835821596678/photo/1,NA,NA,NA,NA,NA,NA,NA,NA
SenSchumer,17494010,1489810322198310920,"I am pleased to fight for marijuana reform with @DPA_NY, @VOCALNewYork, @ImmDefense, @BronxDefenders, @LegalAidNYC, @RWDSU, @Local338, and more.

I’ll keep working with them for marijuana justice at the federal level! https://t.co/xR4W4MA3eq",2022-02-05 03:57:14+00:00,False,128,307,642,18,en,False,Twitter Web App,218,241,https://t.co/xR4W4MA3eq,https://twitter.com/SenSchumer/status/1489810322198310920/photo/1,218,241,https://t.co/xR4W4MA3eq,https://twitter.com/SenSchumer/status/1489810322198310920/photo/1,218,241,https://t.co/xR4W4MA3eq,https://twitter.com/SenSchumer/status/1489810322198310920/photo/1
SenSchumer,17494010,1489701001032613888,"As Majority Leader—I can set priorities

Comprehensive federal marijuana legalization with justice for the communities most impacted by the War on Drugs—especially communities of color—is a Senate priority

With marijuana justice, the people are on our side. We will move forward. https://t.co/gtt6YVpHHG",2022-02-04 20:42:50+00:00,False,394,560,1666,97,en,False,Twitter Web App,281,304,https://t.co/gtt6YVpHHG,https://twitter.com/SenSchumer/status/1489701001032613888/photo/1,NA,NA,NA,NA,NA,NA,NA,NA
SenSchumer,17494010,1489690458636836868,#BidenBoom https://t.co/OtTrW0Tfkt,2022-02-04 20:00:57+00:00,False,263,212,990,9,und,False,Twitter for iPhone,11,34,https://t.co/OtTrW0Tfkt,https://twitter.com/POTUS/status/1489643363083161608,NA,NA,NA,NA,NA,NA,NA,NA
SenSchumer,17494010,1489680992314998796,"I stood with an extraordinary group of organizers, advocates, and legislators to renew our work in the Senate for comprehensive federal marijuana legalization.

We need to bring the spirit of New York’s groundbreaking legalization and address the wrongs of the War on Drugs. https://t.co/C9eyenSqA1",2022-02-04 19:23:20+00:00,False,153,212,675,40,en,False,Twitter Web App,275,298,https://t.co/C9eyenSqA1,https://twitter.com/SenSchumer/status/1489680992314998796/photo/1,NA,NA,NA,NA,NA,NA,NA,NA
SenSchumer,17494010,1489649980176543745,"""You must never be fearful of what you're doing when it is right."" —Rosa Parks https://t.co/MN9raF5Qpa",2022-02-04 17:20:06+00:00,False,136,83,642,4,en,False,Twitter Web App,79,102,https://t.co/MN9raF5Qpa,https://twitter.com/civilrightsorg/status/1489596860125884419,NA,NA,NA,NA,NA,NA,NA,NA
SenSchumer,17494010,1489635533068423169,"Connie Mitchell was the first Black woman elected in Monroe County, NY.

Her fight for better living and working conditions in Rochester blazed a trail for generations of leaders, earning her the Frederick Douglass Medal in 2017.

#BlackHistoryMonth

https://t.co/5j29CN3Gsi",2022-02-04 16:22:41+00:00,True,56,21,381,1,en,False,Twitter Web App,251,274,https://t.co/5j29CN3Gsi,https://www.democratandchronicle.com/story/news/2018/12/14/connie-mitchell-first-african-american-elected-monroe-county-dies-constance/2311321002/,NA,NA,NA,NA,NA,NA,NA,NA
SenSchumer,17494010,1489622696858210305,"With President Biden and Democrats in the Senate and House:

Jobs are ⬆️⬆️⬆️

https://t.co/NeE3DcJmNJ",2022-02-04 15:31:41+00:00,False,152,205,617,15,en,False,Twitter Web App,78,101,https://t.co/NeE3DcJmNJ,https://www.nbcnews.com/business/economy/economy-gained-surprise-467000-jobs-last-month-rcna14621,NA,NA,NA,NA,NA,NA,NA,NA
SenSchumer,17494010,1489580659513438213,"Good luck to @TeamUSA and our New York athletes competing at the Olympics—we’re rooting for you!

https://t.co/OvwgiG0VWt",2022-02-04 12:44:38+00:00,False,31,47,225,4,en,False,Twitter for iPhone,98,121,https://t.co/OvwgiG0VWt,https://www.amny.com/sports/olympics/2022-winter-olympics-schedule-new-york/,NA,NA,NA,NA,NA,NA,NA,NA
SenSchumer,17494010,1489430767147044866,"WATCH: It was exciting to talk with @NYCPA, @NydiaVelazquez, @ReynosoBrooklyn, and @yeampierre about the green jobs that are on their way to Sunset Park!

We are celebrating a $25 million federal grant and more that will support thousands of wind power jobs in South Brooklyn! https://t.co/5milX2EHUK",2022-02-04 02:49:01+00:00,False,55,56,147,5,en,False,Twitter Media Studio,277,300,https://t.co/5milX2EHUK,https://twitter.com/SenSchumer/status/1489430767147044866/video/1,NA,NA,NA,NA,NA,NA,NA,NA
SenSchumer,17494010,1489429085629652992,"The House this week will vote on their bill for the Senate-passed U.S. Innovation and Competition Act.

With this next step, we will be closer to passing this bill into law, to help fix supply chains, lower costs, and bring manufacturing back home.",2022-02-04 02:42:20+00:00,False,134,162,686,18,en,False,Twitter Web App,NA,NA,NA,NA,NA,NA,NA,NA,NA,NA,NA,NA
SenSchumer,17494010,1489426508498223106,"Thanks to the skill and bravery of our Armed Forces, we have taken off the battle­field the leader of ISIS.

I want to thank the incredible work of our brave military servicemembers, who work day and night to keep Americans safe.",2022-02-04 02:32:06+00:00,False,167,133,1027,9,en,False,Twitter Web App,NA,NA,NA,NA,NA,NA,NA,NA,NA,NA,NA,NA
SenSchumer,17494010,1489379111390883842,"For years, I’ve worked to get the federal government to help rebuild Puerto Rico’s failing power grid.

I’m happy to see the Biden administration has heeded my call and is supporting a renewable, distributed, reliable, and resilient energy grid for our fellow Americans. https://t.co/b3pOZ29rQ6",2022-02-03 23:23:46+00:00,False,134,126,609,16,en,False,Twitter Web App,271,294,https://t.co/b3pOZ29rQ6,https://twitter.com/ENERGY/status/1488935178848419844,NA,NA,NA,NA,NA,NA,NA,NA
SenSchumer,17494010,1489315669548146689,"Sorry that I misspoke earlier today. Of course, I remember the dedication and legal excellence that Thurgood Marshall brought to the Supreme Court.",2022-02-03 19:11:40+00:00,False,317,2323,3009,347,en,False,Twitter Web App,NA,NA,NA,NA,NA,NA,NA,NA,NA,NA,NA,NA
SenSchumer,17494010,1489314438016548866,"A quarter of all Black women who sit on the federal bench today were nominated by President Biden.

In fact, nearly 70% of all of the President’s nominees have been non-white, surpassing the records of every single president since at least Jimmy Carter.

https://t.co/RjlBSxhdKG",2022-02-03 19:06:46+00:00,False,103,162,485,13,en,False,Twitter Web App,255,278,https://t.co/RjlBSxhdKG,https://fivethirtyeight.com/features/what-bidens-appointees-can-tell-us-about-his-supreme-court-nominee/,NA,NA,NA,NA,NA,NA,NA,NA
SenSchumer,17494010,1489308980375703554,"President Biden’s judicial nominees are both more diverse AND more qualified than almost any president's in recent history!

https://t.co/RjlBSxhdKG",2022-02-03 18:45:05+00:00,False,98,120,435,5,en,False,Twitter Web App,125,148,https://t.co/RjlBSxhdKG,https://fivethirtyeight.com/features/what-bidens-appointees-can-tell-us-about-his-supreme-court-nominee/,NA,NA,NA,NA,NA,NA,NA,NA
SenSchumer,17494010,1489302250942083079,"Under President Biden and this Senate Democratic Majority, we’re taking historic steps to make our courts look more like the country they serve by confirming highly-qualified, diverse nominees.",2022-02-03 18:18:21+00:00,False,566,502,3881,52,en,False,Twitter Web App,NA,NA,NA,NA,NA,NA,NA,NA,NA,NA,NA,NA
SenSchumer,17494010,1489297017826328577,Thank you to President Biden for meeting yesterday to talk about a broad range of issues on the Democratic agenda—including his intention to nominate the first Black Woman to the Supreme Court!,2022-02-03 17:57:33+00:00,False,262,315,2793,33,en,False,Twitter Web App,NA,NA,NA,NA,NA,NA,NA,NA,NA,NA,NA,NA
SenSchumer,17494010,1489267777290579972,"Ethel Waters, known for her unique vocal style, rose to fame performing in Harlem and on Broadway in the 1920s.

She was the first African American to star in her own TV show in 1939 &amp; the first African American woman to be nominated for a Primetime Emmy Award. #BlackHistoryMonth https://t.co/hCi7xp0Dpa",2022-02-03 16:01:22+00:00,True,76,20,461,3,en,False,Twitter Web App,285,308,https://t.co/hCi7xp0Dpa,https://twitter.com/SenSchumer/status/1489267777290579972/photo/1,NA,NA,NA,NA,NA,NA,NA,NA
SenSchumer,17494010,1489057261800599557,"Breathing clean air shouldn’t be a luxury. I’m proud President Biden’s @EPA is taking action to limit mercury and other toxic air pollution will protect kids and vulnerable communities!

https://t.co/zqQdU4M0wr",2022-02-03 02:04:51+00:00,False,120,135,541,6,en,False,Twitter Web App,187,210,https://t.co/zqQdU4M0wr,https://www.washingtonpost.com/climate-environment/2022/01/31/mercury-power-plants-epa-climate/,NA,NA,NA,NA,NA,NA,NA,NA
SenSchumer,17494010,1489036817282347013,"Caño Martín Peña is one of the worst examples of environmental injustice. For years, Trump refused to act.

We worked with President Biden to secure the funds we need restore the Caño.

And we'll keep fighting for equality and fairness for our fellow citizens in Puerto Rico. https://t.co/taiEAHChxm",2022-02-03 00:43:36+00:00,False,50,46,177,6,en,False,Twitter Media Studio,276,299,https://t.co/taiEAHChxm,https://twitter.com/SenSchumer/status/1489036817282347013/video/1,NA,NA,NA,NA,NA,NA,NA,NA
SenSchumer,17494010,1489031540466147328,"In 2021, U.S. economic growth beat all expectations. This didn’t happen by accident.

Last year’s historic turnaround is a reminder that the right leadership in government matters.

We will keep working to lower costs and grow the economy for the American people. https://t.co/fQyys1YHHC",2022-02-03 00:22:38+00:00,False,105,183,317,17,en,False,Twitter Media Studio,264,287,https://t.co/fQyys1YHHC,https://twitter.com/SenSchumer/status/1489031540466147328/video/1,NA,NA,NA,NA,NA,NA,NA,NA
SenSchumer,17494010,1488983351247753229,Today would be a great day for President Biden and Vice President Harris to #CancelStudentDebt.,2022-02-02 21:11:09+00:00,False,1204,1575,8183,231,en,False,Twitter Web App,NA,NA,NA,NA,NA,NA,NA,NA,NA,NA,NA,NA
SenSchumer,17494010,1488945790299033606,"I stand with @SaneEnergy, @RepMaloney, and @NydiaVelazquez in working to get @NYSDEC to reject unneeded new gas infrastructure for the North Brooklyn Pipeline.

The community is speaking loud and clear: They don't want this project.

https://t.co/Ve9nUDq0wI",2022-02-02 18:41:54+00:00,False,42,37,138,5,en,False,Twitter Web App,234,257,https://t.co/Ve9nUDq0wI,https://www.bkmag.com/2021/08/09/sen-schumer-speaks-out-in-opposition-to-the-north-brooklyn-pipeline/,NA,NA,NA,NA,NA,NA,NA,NA
SenSchumer,17494010,1488931945291685888,"Dr. Anna Arnold Hedgeman was a civil rights leader, politician, educator, and writer.

She was the first African-American woman to serve on the cabinet of an NYC Mayor and was a champion for African-American women in her field #BlackHistoryMonth. https://t.co/138rq32zHw",2022-02-02 17:46:53+00:00,True,86,21,418,2,en,False,Twitter Web App,247,270,https://t.co/138rq32zHw,https://twitter.com/SenSchumer/status/1488931945291685888/photo/1,NA,NA,NA,NA,NA,NA,NA,NA
SenSchumer,17494010,1488920775625220102,"Today, the Senate will confirm more of President Biden’s nominees, including associate judges for the District of Columbia!",2022-02-02 17:02:30+00:00,False,1265,395,10020,48,en,False,Twitter Web App,NA,NA,NA,NA,NA,NA,NA,NA,NA,NA,NA,NA
SenSchumer,17494010,1488631517802860547,My thoughts are with Senator Ben Ray Luján and his family. I’m so glad to hear that he will make a full recovery. We look forward to his quick return to the Senate. https://t.co/vDSXG6JF72,2022-02-01 21:53:05+00:00,False,113,66,647,12,en,False,Twitter Web App,165,188,https://t.co/vDSXG6JF72,https://twitter.com/SenatorLujan/status/1488618483017523205,NA,NA,NA,NA,NA,NA,NA,NA
SenSchumer,17494010,1488595621716107272,The Senate will continue today confirming President Biden’s highly-qualified nominees so they can carry out their mission of serving the American people!,2022-02-01 19:30:27+00:00,False,686,602,5519,49,en,False,Twitter Web App,NA,NA,NA,NA,NA,NA,NA,NA,NA,NA,NA,NA
SenSchumer,17494010,1488590320241721347,"After Congress passed the American Rescue Plan, I said “help is on the way.”

And that help is getting America on a path to historic growth. https://t.co/WDPMOpU0lW",2022-02-01 19:09:23+00:00,False,114,129,384,10,en,False,Twitter Web App,141,164,https://t.co/WDPMOpU0lW,https://twitter.com/SenateDems/status/1487181796135555075,NA,NA,NA,NA,NA,NA,NA,NA
SenSchumer,17494010,1488584548053094405,Last year’s historic turnaround is a reminder that the right leadership in government matters. https://t.co/WDPMOpU0lW,2022-02-01 18:46:27+00:00,False,130,173,440,7,en,False,Twitter Web App,95,118,https://t.co/WDPMOpU0lW,https://twitter.com/SenateDems/status/1487181796135555075,NA,NA,NA,NA,NA,NA,NA,NA
SenSchumer,17494010,1488579132111953922,"115 individuals have been chosen to sit on the U.S. Supreme Court—but never has a Black woman sat on the Highest Court in the Land.

@POTUS will have an opportunity to make SCOTUS look more like America by nominating the first Black woman in U.S. history to serve as a Justice.",2022-02-01 18:24:56+00:00,False,320,330,2177,25,en,False,Twitter Web App,NA,NA,NA,NA,NA,NA,NA,NA,NA,NA,NA,NA
SenSchumer,17494010,1488576422532816906,"Happy Lunar New Year to everyone celebrating in New York, across America, and around the world!

I wish you good fortune, happiness, and a flourishing #YearOfTheTiger. #LunarNewYear",2022-02-01 18:14:10+00:00,False,62,48,344,1,en,False,Twitter Web App,NA,NA,NA,NA,NA,NA,NA,NA,NA,NA,NA,NA
SenSchumer,17494010,1488535192755134480,"Aaron Douglas was a major figure in the Harlem Renaissance.

An iconic graphic artist and painter, his images of African American life and struggles, including his illustrations for Alain Locke, earned him international acclaim. #BlackHistoryMonth https://t.co/U2RKaY10kn",2022-02-01 15:30:20+00:00,True,69,40,381,1,en,False,Twitter Web App,248,271,https://t.co/U2RKaY10kn,https://twitter.com/SenSchumer/status/1488535192755134480/photo/1,NA,NA,NA,NA,NA,NA,NA,NA
SenSchumer,17494010,1488529602242883586,"Today marks the beginning of #BlackHistoryMonth!

Every day this month I'll be honoring the achievements and contributions of Black Americans who have helped shape New York's history. Follow along as we celebrate the perseverance and legacy of Black Americans in New York!",2022-02-01 15:08:07+00:00,False,365,458,2216,42,en,False,Twitter Web App,NA,NA,NA,NA,NA,NA,NA,NA,NA,NA,NA,NA
SenSchumer,17494010,1488338180168368132,"Inadequate charging infrastructure for e-bike batteries is leading to dangerous fires across our city

Delivery workers are most at risk

That’s why I am working with #LosDeliveristasUnidos and @workersjusticep for hubs to provide safe charging and more

https://t.co/43HpQIaIQM",2022-02-01 02:27:28+00:00,False,42,95,170,5,en,False,Twitter for iPhone,255,278,https://t.co/43HpQIaIQM,https://www.curbed.com/2022/01/ebike-battery-fires-delivery-workers-charging-stations.html,NA,NA,NA,NA,NA,NA,NA,NA
SenSchumer,17494010,1488315329482797056,"Earlier this month, I stood with Rochester’s frontline healthcare workers to work to get them the help they desperately needed to combat this COVID surge.

Today, I am pleased to say the Biden admin has listened to us and will provide the needed help.

https://t.co/AJICna97Wv",2022-02-01 00:56:40+00:00,False,40,61,199,5,en,False,Twitter for iPhone,253,276,https://t.co/AJICna97Wv,https://13wham.com/news/local/military-medical-teams-coming-to-upstate-hospitals-including-in-rochester,NA,NA,NA,NA,NA,NA,NA,NA
SenSchumer,17494010,1488302510104317953,President Biden will have an opportunity to make history by nominating the first-ever black woman to serve on the Supreme Court!,2022-02-01 00:05:44+00:00,False,717,944,6168,76,en,False,Twitter Web App,NA,NA,NA,NA,NA,NA,NA,NA,NA,NA,NA,NA
SenSchumer,17494010,1488297335453016064,The Senate just voted to move forward on the nomination of Bridget Brennan to serve as a District Judge for the Northern District of Ohio!,2022-01-31 23:45:10+00:00,False,569,162,5247,13,en,False,Twitter Web App,NA,NA,NA,NA,NA,NA,NA,NA,NA,NA,NA,NA
