ScreenName,AuthorID,TweetID,Text,TweetDate,isReply,RetweetCount,ReplyCount,LikeCount,QuoteCount,Language,PossibleSensitive,Source,1stURLStart,1stURLEnd,1stURL,1stURLExp,2ndURLStart,2ndURLEnd,2ndURL,2ndURLExp,3rdURLStart,3rdURLEnd,3rdURL,3rdURLExp
SpeakerPelosi,15764644,1502333309308784643,"This law saved lives with vaccinations, testing, tracing, PPE &amp; more. It put Americans on the road to financial security with direct payments, housing assistance, investments in small businesses, measures to lift millions of children out of poverty &amp; help for cities &amp; states.",2022-03-11 17:19:07+00:00,True,87,31,493,1,en,False,Twitter for iPhone,NA,NA,NA,NA,NA,NA,NA,NA,NA,NA,NA,NA
SpeakerPelosi,15764644,1502333231777173509,"One year ago, in the darkness of the pandemic, @POTUS proudly signed into law @HouseDemocrats’ #AmericanRescuePlan, putting our nation on the path to crush the pandemic by getting shots in arms, money in pockets, workers safely back on the job and children safely back at school.",2022-03-11 17:18:49+00:00,False,1176,1022,5790,83,en,False,Twitter for iPhone,NA,NA,NA,NA,NA,NA,NA,NA,NA,NA,NA,NA
SpeakerPelosi,15764644,1502313414131175429,"Putin’s premeditated, unprovoked war is an attack on the Ukrainian people &amp; an attack on democracy. The House remains steadfast in our commitment to partnering with @POTUS &amp; our allies to level swift, severe punishment &amp; stand with the Ukrainian people. https://t.co/1NEmY2hKtk",2022-03-11 16:00:04+00:00,True,156,98,805,7,en,False,Twitter for iPhone,266,289,https://t.co/1NEmY2hKtk,https://speaker.gov/newsroom/31122-0,NA,NA,NA,NA,NA,NA,NA,NA
SpeakerPelosi,15764644,1502313413099364353,"When the House returns next week, we will take up legislation to formalize this revocation, and it is our hope that it will receive a strong, bipartisan vote. This measure builds on the bipartisan package the House passed on Wednesday that bans Russian oil &amp; energy products.",2022-03-11 16:00:03+00:00,True,128,95,965,3,en,False,Twitter for iPhone,NA,NA,NA,NA,NA,NA,NA,NA,NA,NA,NA,NA
SpeakerPelosi,15764644,1502313411660685318,"Today, America &amp; our allies take a strong step to further isolate Russia from the global economy by revoking permanent normal trade relations from Russia. In doing so with coordination with our partners abroad, we further counter Putin‘s aggression against the people of Ukraine.",2022-03-11 16:00:03+00:00,False,672,507,4337,42,en,False,Twitter for iPhone,NA,NA,NA,NA,NA,NA,NA,NA,NA,NA,NA,NA
SpeakerPelosi,15764644,1501958040542760963,"Congress is proud to stand with the people of Tibet, for if we do not speak out against human rights abuses in China due to commercial interests, then we will lose all moral authority to speak out for human rights anywhere else in the world. https://t.co/5UkjwKv2oX",2022-03-10 16:27:56+00:00,True,98,108,576,12,en,False,Twitter Web App,242,265,https://t.co/5UkjwKv2oX,https://www.speaker.gov/newsroom/31022,NA,NA,NA,NA,NA,NA,NA,NA
SpeakerPelosi,15764644,1501958037854031873,"The U.S. is committed to holding Beijing accountable &amp; will work to facilitate a productive dialogue. In 2020, the House proudly led the way in enacting the Tibet Policy and Support Act, promoting the distinct religious, linguistic &amp; cultural identity of the Tibetan people.",2022-03-10 16:27:55+00:00,True,97,95,726,2,en,False,Twitter Web App,NA,NA,NA,NA,NA,NA,NA,NA,NA,NA,NA,NA
SpeakerPelosi,15764644,1501958032527400964,"63 years ago, thousands of Tibetans put their lives on the line to defend their families, faith &amp; way of life from violent occupation. Today, we commemorate the courage &amp; resilience of the people of #Tibet &amp; recommit to supporting their struggle for liberty &amp; autonomy.",2022-03-10 16:27:54+00:00,False,483,458,3048,57,en,False,Twitter Web App,NA,NA,NA,NA,NA,NA,NA,NA,NA,NA,NA,NA
SpeakerPelosi,15764644,1501943978698051584,"We paid tribute to all trailblazing women in sports, especially those who fought for Title IX and blazed a trail for our daughters.  We also welcomed to the U.S. Capitol Dr. Wendy Mink, daughter of the legendary Congresswoman Patsy Mink who was the godmother of Title IX. https://t.co/DQwPZOZ8cn",2022-03-10 15:32:03+00:00,True,79,65,690,4,en,False,Twitter for iPhone,272,295,https://t.co/DQwPZOZ8cn,https://twitter.com/SpeakerPelosi/status/1501943978698051584/photo/1,272,295,https://t.co/DQwPZOZ8cn,https://twitter.com/SpeakerPelosi/status/1501943978698051584/photo/1,NA,NA,NA,NA
SpeakerPelosi,15764644,1501943960054341644,"During #WomensHistoryMonth and nearly 50 years after we enacted Title IX, Congress had the privilege of honoring an all-American icon, @BillieJeanKing.
 
She is a game-changing athlete, a devoted champion for women and a fearless voice for LGBTQ Americans. https://t.co/1Q1zUH8ahC",2022-03-10 15:31:59+00:00,False,152,124,1074,8,en,False,Twitter for iPhone,257,280,https://t.co/1Q1zUH8ahC,https://twitter.com/SpeakerPelosi/status/1501943960054341644/photo/1,257,280,https://t.co/1Q1zUH8ahC,https://twitter.com/SpeakerPelosi/status/1501943960054341644/photo/1,NA,NA,NA,NA
SpeakerPelosi,15764644,1501747789612605443,"Today, the House will proudly pass our government funding legislation, which includes $13.6 billion in assistance for Ukraine.
 
We will also pass our strong, bipartisan bill to ban Russian oil and energy products and taking further actions to diminish Russia’s economy.",2022-03-10 02:32:28+00:00,True,431,379,2951,54,en,False,Twitter for iPhone,NA,NA,NA,NA,NA,NA,NA,NA,NA,NA,NA,NA
SpeakerPelosi,15764644,1501747786223599619,"It was an honor to speak with @ZelenskyyUa today, who has been so courageous, determined and strategic in protecting his country.
 
We talked about a range of issues, including Putin’s heinous murder of babies, children and mothers, and America's unwavering support for Ukraine. https://t.co/sRXAlnQxxB",2022-03-10 02:32:28+00:00,False,977,764,6271,77,en,False,Twitter for iPhone,279,302,https://t.co/sRXAlnQxxB,https://twitter.com/SpeakerPelosi/status/1501747786223599619/photo/1,NA,NA,NA,NA,NA,NA,NA,NA
SpeakerPelosi,15764644,1501660121386168327,Join me live at the U.S. Capitol for my weekly press conference. https://t.co/U6QAmuF247,2022-03-09 20:44:07+00:00,False,186,417,862,21,en,False,Twitter Media Studio,65,88,https://t.co/U6QAmuF247,https://twitter.com/i/broadcasts/1BRKjnVPgMRKw,NA,NA,NA,NA,NA,NA,NA,NA
SpeakerPelosi,15764644,1501590771618693120,"Join @BobbyScott, @BillieJeanKing, Dr. Gwendolyn Mink &amp; me for an annual #WomensHistoryMonth event celebrating the 50th anniversary of Title IX — landmark legislation helping women chase their dreams in the classroom, on the field &amp; in every arena. https://t.co/oqSJ7KcrQQ",2022-03-09 16:08:32+00:00,False,152,185,608,16,en,False,Twitter Media Studio,257,280,https://t.co/oqSJ7KcrQQ,https://twitter.com/i/broadcasts/1BdxYwgrNMEGX,NA,NA,NA,NA,NA,NA,NA,NA
SpeakerPelosi,15764644,1501540057223680010,We thank @POTUS for his bold vision and all the members of the Appropriations Committee and the Republican leadership for working together on this historic legislation. Read the Full Joint Statement on Historic Omnibus Appropriations Agreement: https://t.co/O21d8wwP3S,2022-03-09 12:47:01+00:00,True,280,137,1361,15,en,False,Twitter for iPhone,245,268,https://t.co/O21d8wwP3S,https://www.speaker.gov/newsroom/3922,NA,NA,NA,NA,NA,NA,NA,NA
SpeakerPelosi,15764644,1501540055315140608,This historic legislation will carry major bipartisan legislation that has been in the making for years including reauthorization of the Violence Against Women Act &amp; new cybersecurity protections to fight against cyber attacks to our infrastructure by Russia &amp; other bad actors.,2022-03-09 12:47:01+00:00,True,218,72,1381,5,en,False,Twitter for iPhone,NA,NA,NA,NA,NA,NA,NA,NA,NA,NA,NA,NA
SpeakerPelosi,15764644,1501540054195486726,"And enacting the omnibus unlocks more federal funding under our Bipartisan Infrastructure Law – bringing transformational investments to roads, bridges, transit, water systems, airports, broadband and more across America.",2022-03-09 12:47:00+00:00,True,154,13,1002,3,en,False,Twitter for iPhone,NA,NA,NA,NA,NA,NA,NA,NA,NA,NA,NA,NA
SpeakerPelosi,15764644,1501540052660363267,"This Omnibus will increase funding for key domestic priorities, including a $400 increase to the maximum Pell Grant award, the establishment of President Biden’s new cancer research initiative known as ARPA-H, and so much more.",2022-03-09 12:47:00+00:00,True,149,21,926,7,en,False,Twitter for iPhone,NA,NA,NA,NA,NA,NA,NA,NA,NA,NA,NA,NA
SpeakerPelosi,15764644,1501540051120971777,"The agreement will also invest $15.6 billion in Emergency Supplemental funding for President Biden’s COVID-19 response to protect and treat against new variants, avoid shutdowns and fight the virus abroad.",2022-03-09 12:47:00+00:00,True,145,23,892,6,en,False,Twitter for iPhone,NA,NA,NA,NA,NA,NA,NA,NA,NA,NA,NA,NA
SpeakerPelosi,15764644,1501540050252840969,"The agreement will invest $13.6 billion in Emergency Supplemental funding for Ukraine security &amp; humanitarian needs. The brave, freedom-loving people of Ukraine &amp; our allies in the region will receive urgently needed investments to fight the Russians’ illegal &amp; immoral invasion.",2022-03-09 12:46:59+00:00,True,195,395,1140,21,en,False,Twitter for iPhone,NA,NA,NA,NA,NA,NA,NA,NA,NA,NA,NA,NA
SpeakerPelosi,15764644,1501540046134030340,.@SenSchumer and I are pleased to announce that the Congress has reached an historic bipartisan omnibus appropriations agreement #ForThePeople. This bipartisan agreement will help us address many of the major challenges we face at home and abroad.,2022-03-09 12:46:58+00:00,False,1123,663,6197,90,en,False,Twitter for iPhone,NA,NA,NA,NA,NA,NA,NA,NA,NA,NA,NA,NA
SpeakerPelosi,15764644,1501287501343846401,"On a bipartisan &amp; bicameral basis, the Congress will continue to work with the Administration to take every potential action to limit the costs of Putin’s aggression on American families — focusing on ensuring the stability of global oil markets &amp; diversifying our energy supply.",2022-03-08 20:03:27+00:00,True,229,132,1332,8,en,False,Twitter for iPhone,NA,NA,NA,NA,NA,NA,NA,NA,NA,NA,NA,NA
SpeakerPelosi,15764644,1501287500236656640,"Our bill has three major provisions: it will ban the import of Russian oil &amp; energy products into the U.S., it will take steps to review Russia’s access to the WTO and explore how we can diminish Russia in the global economy &amp; it will reauthorize &amp; strengthen the Magnitsky Act.",2022-03-08 20:03:27+00:00,True,576,185,2849,31,en,False,Twitter for iPhone,NA,NA,NA,NA,NA,NA,NA,NA,NA,NA,NA,NA
SpeakerPelosi,15764644,1501287492322041861,"Today, the House will pass strong, bipartisan legislation to hold Putin accountable for his unprovoked war against Ukraine. In doing so, we support @POTUS actions to ban Russian energy products and demonstrate America’s strength and determination.",2022-03-08 20:03:25+00:00,False,1182,693,7014,55,en,False,Twitter for iPhone,NA,NA,NA,NA,NA,NA,NA,NA,NA,NA,NA,NA
SpeakerPelosi,15764644,1501217277668175882,Read My Full Statement On International Women's Day: https://t.co/9NxypTlNcr,2022-03-08 15:24:24+00:00,True,80,69,438,5,en,False,Twitter for iPhone,53,76,https://t.co/9NxypTlNcr,https://www.speaker.gov/newsroom/3822,NA,NA,NA,NA,NA,NA,NA,NA
SpeakerPelosi,15764644,1501217276325945346,"Today, and every day, let us summon the extraordinary courage and resilience of the many women who came before us. Democrats will never relent as we carry on the fight for full equality – not only for our nation’s daughters, but for women and girls all over the world.",2022-03-08 15:24:24+00:00,True,124,129,996,9,en,False,Twitter for iPhone,NA,NA,NA,NA,NA,NA,NA,NA,NA,NA,NA,NA
SpeakerPelosi,15764644,1501217274941825024,"Guided by the leadership of more than 120 women Members, the Democratic House is building a more just future – from strengthening women's rights in the workplace to defending reproductive health freedoms to advancing investments in maternal care, child care and more.",2022-03-08 15:24:24+00:00,True,122,59,913,2,en,False,Twitter for iPhone,NA,NA,NA,NA,NA,NA,NA,NA,NA,NA,NA,NA
SpeakerPelosi,15764644,1501217272593063938,"Today, on #InternationalWomensDay, we celebrate the generations of trailblazing women who have paved a path toward gender justice. This day also serves as a global rallying cry, calling on us to advance the rights and dignities of women at home, at work and in every part of life. https://t.co/ephwwYU3v5",2022-03-08 15:24:23+00:00,False,289,145,1415,13,en,False,Twitter for iPhone,281,304,https://t.co/ephwwYU3v5,https://twitter.com/SpeakerPelosi/status/1501217272593063938/photo/1,NA,NA,NA,NA,NA,NA,NA,NA
SpeakerPelosi,15764644,1500958445700329476,"Here we go again: even in the wake of a pandemic, the GOP just can’t quit their obsession with ripping health care away from Americans with pre-existing conditions.
 
Meanwhile, Democrats are working to lower costs, expand access and #ProtectOurCare. 
https://t.co/ifZZ0p1BGS",2022-03-07 22:15:54+00:00,False,1043,889,3327,104,en,False,Twitter for iPhone,252,275,https://t.co/ifZZ0p1BGS,https://www.washingtonpost.com/politics/2022/03/07/sen-ron-johnson-obamacare-repeal-gop-majority-midterms-2024/,NA,NA,NA,NA,NA,NA,NA,NA
SpeakerPelosi,15764644,1500920182868520972,"In his State of the Union Address, @POTUS delivered a powerful message of progress, empathy and hope for America’s working families. Together, he and Democrats are focused on Building a Better America. https://t.co/fKnjqkO4sB",2022-03-07 19:43:52+00:00,False,729,1852,4570,160,en,False,Twitter for iPhone,202,225,https://t.co/fKnjqkO4sB,https://twitter.com/SpeakerPelosi/status/1500920182868520972/photo/1,202,225,https://t.co/fKnjqkO4sB,https://twitter.com/SpeakerPelosi/status/1500920182868520972/photo/1,NA,NA,NA,NA
SpeakerPelosi,15764644,1500669124082638851,"Click the link below for more behind-the-scenes content from my recent post on ‘Madam Speaker.’
https://t.co/DwA0QIEQjq",2022-03-07 03:06:14+00:00,True,122,223,791,8,en,False,Twitter for iPhone,96,119,https://t.co/DwA0QIEQjq,https://speakerpelosi.medium.com/madam-speaker-a-behind-the-scenes-look-at-the-u-s-speaker-of-the-house-873f4449bba9,NA,NA,NA,NA,NA,NA,NA,NA
SpeakerPelosi,15764644,1500669119661850632,"Democrats are focused on Building a Better America: making more goods in America, lowering the costs of energy, child care, prescription drugs and more, bolstering competition to deliver better prices for consumers, and creating more good-paying union jobs across the country. https://t.co/66qU8Qhkzo",2022-03-07 03:06:13+00:00,False,956,2011,5342,140,en,False,Twitter for iPhone,277,300,https://t.co/66qU8Qhkzo,https://twitter.com/SpeakerPelosi/status/1500669119661850632/photo/1,NA,NA,NA,NA,NA,NA,NA,NA
SpeakerPelosi,15764644,1500301353389801475,"The voices of women have weathered adversity to move America closer to realizing its greatest ideals. We stand on the shoulders of trailblazing pioneers &amp; everyday heroes alike, &amp; honor the legacy of those women by reaffirming a simple truth: when women succeed, America succeeds. https://t.co/NnpRVjEJBR",2022-03-06 02:44:51+00:00,False,736,701,4292,52,en,False,Twitter for iPhone,289,312,https://t.co/NnpRVjEJBR,https://twitter.com/SpeakerPelosi/status/1500301353389801475/photo/1,NA,NA,NA,NA,NA,NA,NA,NA
SpeakerPelosi,15764644,1499794817865371648,"President Biden and the Democratic Congress are focused on #BuildingABetterAmerica: with lower costs, bigger paychecks and more jobs. Read my full statement here: https://t.co/DbfD1yJhem",2022-03-04 17:12:04+00:00,True,125,234,592,11,en,False,Twitter Web App,163,186,https://t.co/DbfD1yJhem,https://www.speaker.gov/newsroom/3422,NA,NA,NA,NA,NA,NA,NA,NA
SpeakerPelosi,15764644,1499794816615559169,"More must be done to help ease the burdens of American families who are under pressure from rising prices. That is why Democrats are working to make more goods here in America, lower costs, promote fair competition, and ensure every American can find a good-paying job.",2022-03-04 17:12:03+00:00,True,173,312,1210,14,en,False,Twitter Web App,NA,NA,NA,NA,NA,NA,NA,NA,NA,NA,NA,NA
SpeakerPelosi,15764644,1499794815185260546,"Today’s jobs report is further evidence of a record-breaking jobs recovery. Under the leadership of @POTUS Biden &amp; @HouseDemocrats over the last 13 months, our nation has created 7.4 million jobs while slashing unemployment from 6.4 percent to 3.8 percent. #BuildingABetterAmerica",2022-03-04 17:12:03+00:00,False,1042,1236,4793,93,en,False,Twitter Web App,NA,NA,NA,NA,NA,NA,NA,NA,NA,NA,NA,NA
SpeakerPelosi,15764644,1499576704490213378,"After decades of little recognition, this act will properly recognize the 6888th's heroism. I was proud to stand with Representatives @RepGwenMoore, @RepBarbaraLee and @RepBeatty in honoring these American patriots. https://t.co/FmXUL7Z9sA",2022-03-04 02:45:21+00:00,True,153,137,1020,13,en,False,Twitter for iPhone,216,239,https://t.co/FmXUL7Z9sA,https://twitter.com/SpeakerPelosi/status/1499576704490213378/photo/1,NA,NA,NA,NA,NA,NA,NA,NA
SpeakerPelosi,15764644,1499576693601751051,"The 6888th Battalion has inspired generations of Americans. Battling prejudice and the hardships of war alike, the unit sorted millions of pieces of mail to ensure that Servicemembers received letters from their loved ones. https://t.co/M690ZCGdQg",2022-03-04 02:45:19+00:00,True,160,108,1043,5,en,False,Twitter for iPhone,224,247,https://t.co/M690ZCGdQg,https://twitter.com/SpeakerPelosi/status/1499576693601751051/photo/1,224,247,https://t.co/M690ZCGdQg,https://twitter.com/SpeakerPelosi/status/1499576693601751051/photo/1,NA,NA,NA,NA
SpeakerPelosi,15764644,1499576681656373269,"As Speaker of the House, it was my honor to sign the Six Triple Eight Congressional Gold Medal Act today in order to honor the 6888th Central Postal Directory Battalion – the only all-female, Black unit in Europe during World War II. https://t.co/3hqwq2SGRE",2022-03-04 02:45:16+00:00,False,759,414,5342,48,en,False,Twitter for iPhone,234,257,https://t.co/3hqwq2SGRE,https://twitter.com/SpeakerPelosi/status/1499576681656373269/photo/1,NA,NA,NA,NA,NA,NA,NA,NA
SpeakerPelosi,15764644,1499521485362409473,It amazes me that anyone willing to spend $2 trillion on the GOP Tax Scam for the rich would now vote against paying for the health care our heroic veterans have earned. https://t.co/O19Mjeyo83,2022-03-03 23:05:56+00:00,False,2926,1561,11104,276,en,False,Twitter Media Studio,170,193,https://t.co/O19Mjeyo83,https://twitter.com/SpeakerPelosi/status/1499521485362409473/video/1,NA,NA,NA,NA,NA,NA,NA,NA
SpeakerPelosi,15764644,1499448729652367365,Best wishes for the Tibetan New Year to His Holiness the @DalaiLama and all Tibetans. #Losar Tashi Delek!,2022-03-03 18:16:50+00:00,False,338,310,2343,20,en,False,Twitter for iPhone,NA,NA,NA,NA,NA,NA,NA,NA,NA,NA,NA,NA
SpeakerPelosi,15764644,1499415221903007745,Join me live at the U.S. Capitol for my weekly press conference. https://t.co/606PIHqZ4B,2022-03-03 16:03:41+00:00,False,192,557,915,28,en,False,Twitter Media Studio,65,88,https://t.co/606PIHqZ4B,https://twitter.com/i/broadcasts/1gqxvlZAnqkGB,NA,NA,NA,NA,NA,NA,NA,NA
SpeakerPelosi,15764644,1499245171166355461,"I was proud to join @RepCheri, @RepJerryNadler, @RepJayapal &amp; @RepCicilline to enroll the Ending Forced Arbitration of Sexual Assault and Sexual Harassment Act – a bipartisan victory for justice and freedom. https://t.co/dywjv0Oda3",2022-03-03 04:47:58+00:00,False,355,577,2201,35,en,False,Twitter for iPhone,212,235,https://t.co/dywjv0Oda3,https://twitter.com/SpeakerPelosi/status/1499245171166355461/photo/1,212,235,https://t.co/dywjv0Oda3,https://twitter.com/SpeakerPelosi/status/1499245171166355461/photo/1,212,235,https://t.co/dywjv0Oda3,https://twitter.com/SpeakerPelosi/status/1499245171166355461/photo/1
