ScreenName,AuthorID,TweetID,Text,TweetDate,isReply,RetweetCount,ReplyCount,LikeCount,QuoteCount,Language,PossibleSensitive,Source,1stURLStart,1stURLEnd,1stURL,1stURLExp,2ndURLStart,2ndURLEnd,2ndURL,2ndURLExp,3rdURLStart,3rdURLEnd,3rdURL,3rdURLExp
SpeakerPelosi,15764644,1506740168597942278,"Secretary Albright truly blessed our nation with her pioneering and patriotic service. Read my full statement on the passing of Secretary Madeleine Albright:
https://t.co/itDDUQhpaF",2022-03-23 21:10:24+00:00,True,76,18,664,4,en,False,Twitter for iPhone,158,181,https://t.co/itDDUQhpaF,https://www.speaker.gov/newsroom/32322-0,NA,NA,NA,NA,NA,NA,NA,NA
SpeakerPelosi,15764644,1506740167356334092,"Secretary Albright’s family arrived in Ellis Island as refugees in 1948, and she rose to become a barrier-breaking leader on the world stage.  She was a force in advancing America’s security, and her warnings about the rise of autocracy remain a guide for us today.",2022-03-23 21:10:24+00:00,True,92,18,874,2,en,False,Twitter for iPhone,NA,NA,NA,NA,NA,NA,NA,NA,NA,NA,NA,NA
SpeakerPelosi,15764644,1506740165351518211,"Today, we lost a towering champion for peace, diplomacy and democracy: Secretary Madeleine Albright.
 
As the first woman to serve as our top diplomat, she paved the way for generations of women serving at the highest levels of government and representing our nation abroad.",2022-03-23 21:10:23+00:00,False,368,111,2339,25,en,False,Twitter for iPhone,NA,NA,NA,NA,NA,NA,NA,NA,NA,NA,NA,NA
SpeakerPelosi,15764644,1506651614429515785,"In the face of these cruel Republican attacks, Democrats will never relent in our fight to defend working families. Today, werenew our commitment to #BuildingaBetterAmerica and lowering health care costs and prescription drug prices.
https://t.co/BRYBOWmi3f",2022-03-23 15:18:31+00:00,True,86,67,465,3,en,False,Twitter for iPhone,234,257,https://t.co/BRYBOWmi3f,https://www.speaker.gov/newsroom/32322,NA,NA,NA,NA,NA,NA,NA,NA
SpeakerPelosi,15764644,1506651613599047689,"Meanwhile, Republicans continue to promise to wage a shameful assault on the Affordable Care Act, threatening to rip away protections and coverage from millions of working families.",2022-03-23 15:18:31+00:00,True,84,37,524,2,en,False,Twitter for iPhone,NA,NA,NA,NA,NA,NA,NA,NA,NA,NA,NA,NA
SpeakerPelosi,15764644,1506651612693073929,"Last year, amid the darkness of the pandemic, Democrats took action to expand the promise of the Affordable Care Act to lower health costs even further for millions more families.",2022-03-23 15:18:31+00:00,True,43,24,276,2,en,False,Twitter for iPhone,NA,NA,NA,NA,NA,NA,NA,NA,NA,NA,NA,NA
SpeakerPelosi,15764644,1506651611745165316,"The Affordable Care Act stands alongside Medicare, Medicaid and Social Security as a pillar of health and financial security – especially for the 130 million Americans living with pre-existing conditions, who now enjoy life-saving protections.",2022-03-23 15:18:31+00:00,True,41,12,210,3,en,False,Twitter for iPhone,NA,NA,NA,NA,NA,NA,NA,NA,NA,NA,NA,NA
SpeakerPelosi,15764644,1506651610956578824,"Today, our nation celebrates this landmark law’s essential role in safeguarding Americans’ health and preserving families’ hard-earned savings through quality, affordable insurance.",2022-03-23 15:18:30+00:00,True,39,17,257,2,en,False,Twitter for iPhone,NA,NA,NA,NA,NA,NA,NA,NA,NA,NA,NA,NA
SpeakerPelosi,15764644,1506651605671809027,"Twelve years ago, when President Obama signed the #AffordableCareAct into law, our nation took an historic step toward fulfilling a fundamental promise: that health care is a right, not a privilege.",2022-03-23 15:18:29+00:00,False,430,327,2428,30,en,False,Twitter for iPhone,NA,NA,NA,NA,NA,NA,NA,NA,NA,NA,NA,NA
SpeakerPelosi,15764644,1506405289213452292,"Join me and @MarkKUpdegrove live in conversation at the LBJ Presidential Library in Austin, Texas, on the state of democracy at home and abroad, as well as House Democrats’ legislative agenda. https://t.co/9866jQwt2n",2022-03-22 22:59:43+00:00,False,102,136,462,5,en,False,Twitter Media Studio,193,216,https://t.co/9866jQwt2n,https://twitter.com/i/broadcasts/1YqGopkPnpQJv,NA,NA,NA,NA,NA,NA,NA,NA
SpeakerPelosi,15764644,1506288815660490764,"Democrats are fighting to #ProtectOurCare, working to strengthen the ACA &amp; extend coverage to more Americans.
 
Meanwhile, Republicans happily admit that they want to hike costs, terminate protections &amp; endanger more than 130 million Americans’ health care.https://t.co/ifZZ0p1BGS",2022-03-22 15:16:53+00:00,False,326,338,1129,27,en,False,Twitter for iPhone,265,288,https://t.co/ifZZ0p1BGS,https://www.washingtonpost.com/politics/2022/03/07/sen-ron-johnson-obamacare-repeal-gop-majority-midterms-2024/,NA,NA,NA,NA,NA,NA,NA,NA
SpeakerPelosi,15764644,1505896535330066433,"See what happened behind-the-scenes last week with my Medium post, ‘Madam Speaker.’ https://t.co/D9HiQZopre",2022-03-21 13:18:06+00:00,False,128,378,705,14,en,False,Twitter Web App,84,107,https://t.co/D9HiQZopre,https://speakerpelosi.medium.com/madam-speaker-a-behind-the-scenes-look-at-the-u-s-speaker-of-the-house-592a9ffc1e8,NA,NA,NA,NA,NA,NA,NA,NA
SpeakerPelosi,15764644,1505604365985456130,"For thousands of years, Nowruz has been a time to gather with loved ones and joyfully face all that the future may bring. May all who celebrate today be blessed with the love of family and friends.  #NowruzMobarak!
https://t.co/bjHvXlHG6Q",2022-03-20 17:57:08+00:00,True,78,69,459,6,en,False,Twitter for iPhone,215,238,https://t.co/bjHvXlHG6Q,https://www.speaker.gov/newsroom/32022,NA,NA,NA,NA,NA,NA,NA,NA
SpeakerPelosi,15764644,1505604365243097088,"As we welcome this season of renewal, we recognize Iranian Americans’ innumerable contributions in California and across the nation.  From enriching our culture to blazing trails as leaders, generations of Iranian Americans have proudly made America more American.",2022-03-20 17:57:08+00:00,True,98,75,725,9,en,False,Twitter for iPhone,NA,NA,NA,NA,NA,NA,NA,NA,NA,NA,NA,NA
SpeakerPelosi,15764644,1505604364391571463,"Today, Iranian Americans and millions around the globe celebrate #Nowruz and the promise of a new year.  Arriving amid the warmth of spring, Norwuz offers a moment to reflect on the progress of the past year while drawing hope for all that still lies ahead.",2022-03-20 17:57:07+00:00,False,261,309,1682,20,en,False,Twitter for iPhone,NA,NA,NA,NA,NA,NA,NA,NA,NA,NA,NA,NA
SpeakerPelosi,15764644,1505323446049329162,"Republicans are still plotting to terminate protections for more than 130 Americans with pre-existing conditions – shamelessly ignoring their constituents, health experts and common sense.
https://t.co/ifZZ0p1BGS",2022-03-19 23:20:51+00:00,False,1952,1638,5502,184,en,False,Twitter for iPhone,189,212,https://t.co/ifZZ0p1BGS,https://www.washingtonpost.com/politics/2022/03/07/sen-ron-johnson-obamacare-repeal-gop-majority-midterms-2024/,NA,NA,NA,NA,NA,NA,NA,NA
SpeakerPelosi,15764644,1504568782802587650,"For generations, America’s postal workers have bound our Republic closer together. Congress is ensuring that @USPS remains a pillar of our democracy – delivering prescriptions, Social Security benefits, paychecks, tax returns, absentee ballots and more to Americans everywhere. https://t.co/VkT6dZViry",2022-03-17 21:22:06+00:00,True,155,156,848,10,en,False,Twitter for iPhone,278,301,https://t.co/VkT6dZViry,https://twitter.com/SpeakerPelosi/status/1504568782802587650/photo/1,NA,NA,NA,NA,NA,NA,NA,NA
SpeakerPelosi,15764644,1504568742453420036,"Today, I was proud to send the #PostalServiceReformAct to @POTUS – a historic, bipartisan legislation that will strengthen @USPS, providing more predictability for small businesses, more reliable service for families, and a more secure future for postal workers. https://t.co/CkDbJCnNKS",2022-03-17 21:21:56+00:00,False,800,846,4856,98,en,False,Twitter for iPhone,263,286,https://t.co/CkDbJCnNKS,https://twitter.com/SpeakerPelosi/status/1504568742453420036/photo/1,NA,NA,NA,NA,NA,NA,NA,NA
SpeakerPelosi,15764644,1504555575383891971,Looking forward to cheering on @USFDonsMBB for their return to the Big Dance tonight. Go Dons!,2022-03-17 20:29:37+00:00,False,87,206,657,33,en,False,Twitter Web App,NA,NA,NA,NA,NA,NA,NA,NA,NA,NA,NA,NA
SpeakerPelosi,15764644,1504526075031924739,"Join @WhipClyburn, @RepMaloney, @FrankPallone, @RepStephenLynch, @RepLawrence and me at the U.S. Capitol for a bill enrollment ceremony for the #PostalServiceReform Act.  https://t.co/69ZZFE8o0h",2022-03-17 18:32:23+00:00,False,136,141,630,8,en,False,Twitter Media Studio,171,194,https://t.co/69ZZFE8o0h,https://twitter.com/i/broadcasts/1LyxBojAbWrKN,NA,NA,NA,NA,NA,NA,NA,NA
SpeakerPelosi,15764644,1504507298470899713,Join me at the U.S. Capitol for the Annual Friends of Ireland Luncheon. https://t.co/WgoI8CaSE6,2022-03-17 17:17:47+00:00,False,127,314,823,14,en,False,Twitter Media Studio,72,95,https://t.co/WgoI8CaSE6,https://twitter.com/i/broadcasts/1djGXPvpyakGZ,NA,NA,NA,NA,NA,NA,NA,NA
SpeakerPelosi,15764644,1504494635879743488,Join @POTUS Biden and me at the U.S. Capitol for the Annual Friends of Ireland Luncheon. https://t.co/dzbMPJ0foI,2022-03-17 16:27:28+00:00,False,146,176,882,13,en,False,Twitter Media Studio,89,112,https://t.co/dzbMPJ0foI,https://twitter.com/i/broadcasts/1OdKrBgRWNkKX,NA,NA,NA,NA,NA,NA,NA,NA
SpeakerPelosi,15764644,1504474663988051971,Join me live at the U.S. Capitol for my weekly press conference. https://t.co/Pq5eGtdtUp,2022-03-17 15:08:06+00:00,False,147,260,758,15,en,False,Twitter Media Studio,65,88,https://t.co/Pq5eGtdtUp,https://twitter.com/i/broadcasts/1rmGPgnQerQKN,NA,NA,NA,NA,NA,NA,NA,NA
SpeakerPelosi,15764644,1504457839162671112,"From my family to yours, Happy St. Patrick's Day! https://t.co/4UlwKWtyrC",2022-03-17 14:01:14+00:00,False,295,284,2724,26,en,False,Twitter Media Studio,50,73,https://t.co/4UlwKWtyrC,https://twitter.com/SpeakerPelosi/status/1504457839162671112/photo/1,NA,NA,NA,NA,NA,NA,NA,NA
SpeakerPelosi,15764644,1504289936664576004,"With @POTUS’ signature for the government funding bill, Democrats in Congress took another step in the fight to #BuildABetterAmerica yesterday with federal investments to help lower costs and create jobs for America’s families. https://t.co/owcStl80OB",2022-03-17 02:54:03+00:00,False,597,585,2925,51,en,False,Twitter for iPhone,228,251,https://t.co/owcStl80OB,https://twitter.com/SpeakerPelosi/status/1504289936664576004/photo/1,NA,NA,NA,NA,NA,NA,NA,NA
SpeakerPelosi,15764644,1504238803367645187,"Our AAPI communities have long been subjected to hateful violence – and this crisis has surged during the pandemic. With the COVID-19 Hate Crimes Act, Congress took historic action to continue combating racist violence, stamping out hate and holding offenders accountable. https://t.co/XgwbDL79kE",2022-03-16 23:30:52+00:00,True,79,84,566,6,en,False,Twitter for iPhone,273,296,https://t.co/XgwbDL79kE,https://twitter.com/SpeakerPelosi/status/1504238803367645187/photo/1,273,296,https://t.co/XgwbDL79kE,https://twitter.com/SpeakerPelosi/status/1504238803367645187/photo/1,NA,NA,NA,NA
SpeakerPelosi,15764644,1504238793716637698,"Earlier today, Members of Congress paid tribute to the eight Americans murdered in an act of bigotry in Georgia one year ago – six of whom were Asian American women. We must never relent in our fight to #StopAsianHate https://t.co/KAYMx1eI2k",2022-03-16 23:30:50+00:00,False,269,145,1748,8,en,False,Twitter for iPhone,218,241,https://t.co/KAYMx1eI2k,https://twitter.com/SpeakerPelosi/status/1504238793716637698/photo/1,NA,NA,NA,NA,NA,NA,NA,NA
SpeakerPelosi,15764644,1504186200948711431,"On behalf of the United States Congress, I salute our partners in the G7 and the EU for the unity, commitment and determination they bring to our shared effort to advance our shared values and promote peace. Read my full statement here: https://t.co/Vo4dNUVvBB",2022-03-16 20:01:51+00:00,True,103,49,499,2,en,False,Twitter Web App,237,260,https://t.co/Vo4dNUVvBB,https://www.speaker.gov/newsroom/31622-3,NA,NA,NA,NA,NA,NA,NA,NA
SpeakerPelosi,15764644,1504186199803629570,"We also conveyed our heartbreak at the humanitarian catastrophe unfolding in Ukraine, with more than 3 million refugees forced to flee &amp; countless civilians facing Russian attacks. We reaffirmed our commitment to providing humanitarian, security &amp; economic assistance to Ukraine.",2022-03-16 20:01:51+00:00,True,101,93,568,3,en,False,Twitter Web App,NA,NA,NA,NA,NA,NA,NA,NA,NA,NA,NA,NA
SpeakerPelosi,15764644,1504186198390198280,"In addition, we called on the Russian government to immediately end its brutal, violent invasion and reiterated our support for negotiations that can achieve a lasting diplomatic solution.",2022-03-16 20:01:50+00:00,True,60,14,421,3,en,False,Twitter Web App,NA,NA,NA,NA,NA,NA,NA,NA,NA,NA,NA,NA
SpeakerPelosi,15764644,1504186197152874501,The Speakers unequivocally condemned the Russian Federation for its illegal attack on Ukraine’s sovereignty &amp; territorial integrity. We expressed our intention to continue to contribute to Russia’s international &amp; economic isolation as well as combat its disinformation.,2022-03-16 20:01:50+00:00,True,62,15,372,3,en,False,Twitter Web App,NA,NA,NA,NA,NA,NA,NA,NA,NA,NA,NA,NA
SpeakerPelosi,15764644,1504186195902971906,"This morning, the Speakers &amp; Presidents of Parliament of the G7 &amp; the EU met virtually with @R_Stefanchuk. Following the meeting, we issued a strong &amp; unified Declaration making clear the @G7's commitment to Ukraine &amp; against the Russian government’s cruel, unprovoked war.",2022-03-16 20:01:50+00:00,False,309,161,1531,13,en,False,Twitter Web App,NA,NA,NA,NA,NA,NA,NA,NA,NA,NA,NA,NA
SpeakerPelosi,15764644,1504176176901861383,"Democrats will continue combating hate whenever and wherever it arises – because it is an attack on our democracy’s basic promise of life, liberty and the pursuit of happiness. https://t.co/eqHTyEFJHw",2022-03-16 19:22:01+00:00,True,138,97,916,7,en,False,Twitter for iPhone,177,200,https://t.co/eqHTyEFJHw,https://twitter.com/SpeakerPelosi/status/1504176176901861383/photo/1,NA,NA,NA,NA,NA,NA,NA,NA
SpeakerPelosi,15764644,1504176073046695937,"Nearly seven decades later, the lynching of Emmett Till is seared into America’s collective memory. Tragically, bigoted violence is not yet a relic of the past: from the scourge of police brutality to assaults on houses of worship and more. https://t.co/AWJqDA0EdR",2022-03-16 19:21:36+00:00,True,165,54,1030,7,en,False,Twitter for iPhone,241,264,https://t.co/AWJqDA0EdR,https://twitter.com/SpeakerPelosi/status/1504176073046695937/photo/1,241,264,https://t.co/AWJqDA0EdR,https://twitter.com/SpeakerPelosi/status/1504176073046695937/photo/1,NA,NA,NA,NA
SpeakerPelosi,15764644,1504176035520262149,"This afternoon, we prepared to send the Emmett Till Antilynching Act to President Biden for his signature. This landmark legislation will designate lynching as a federal hate crime: action that has long been overdue. https://t.co/2MOTRirROG",2022-03-16 19:21:27+00:00,False,980,719,5554,110,en,False,Twitter for iPhone,217,240,https://t.co/2MOTRirROG,https://twitter.com/SpeakerPelosi/status/1504176035520262149/photo/1,NA,NA,NA,NA,NA,NA,NA,NA
SpeakerPelosi,15764644,1504147410095943683,"Join @LeaderHoyer, @RepBobbyRush, @RepBeatty, @BennieGThompson and me at the U.S. Capitol for an enrollment ceremony for H.R. 55 the Emmett Till Antilynching Act, landmark legislation that will designate lynching as a federal hate crime. https://t.co/fdkhXhH8qu",2022-03-16 17:27:42+00:00,False,194,118,723,14,en,False,Twitter Media Studio,238,261,https://t.co/fdkhXhH8qu,https://twitter.com/i/broadcasts/1mrxmaeZywMxy,NA,NA,NA,NA,NA,NA,NA,NA
SpeakerPelosi,15764644,1504111946190229509,Join Representatives from @CAPAC and me at the U.S. Capitol to join in honoring the eight Americans murdered out of hate one year ago and to continue fighting to #StopAsianHate and combat racist violence in all its forms. https://t.co/YIQ5rFs0MM,2022-03-16 15:06:47+00:00,False,152,136,707,16,en,False,Twitter Media Studio,222,245,https://t.co/YIQ5rFs0MM,https://twitter.com/i/broadcasts/1ynJOZWoXpXGR,NA,NA,NA,NA,NA,NA,NA,NA
SpeakerPelosi,15764644,1504086275158155272,"This morning, Members of the House and Senate had the distinct privilege of receiving a virtual address by President @ZelenskyyUa. Congress and the country remain unwavering in our commitment to the people of Ukraine as they courageously defend democracy. https://t.co/EH146nPKAW",2022-03-16 13:24:47+00:00,False,1197,816,8476,84,en,False,Twitter for iPhone,256,279,https://t.co/EH146nPKAW,https://twitter.com/SpeakerPelosi/status/1504086275158155272/photo/1,256,279,https://t.co/EH146nPKAW,https://twitter.com/SpeakerPelosi/status/1504086275158155272/photo/1,NA,NA,NA,NA
SpeakerPelosi,15764644,1504081248695865344,Join Members of Congress and me at the U.S. Capitol as we hear a virtual address by @ZelenskyyUa and convey our unwavering support for the people of Ukraine as they face Putin's cruel and diabolical aggression and bravely defend democracy. https://t.co/5OE4GfFDIp,2022-03-16 13:04:48+00:00,False,495,264,1870,50,en,False,Twitter Media Studio,240,263,https://t.co/5OE4GfFDIp,https://twitter.com/i/broadcasts/1BdGYwPWEyyxX,NA,NA,NA,NA,NA,NA,NA,NA
SpeakerPelosi,15764644,1503919407734706177,"From President Kennedy’s Equal Pay Act to President Obama’s Lilly Ledbetter Act, Democrats have long led the fight to guarantee equal pay for equal work.
 
@HouseDemocrats are building on that legacy — fighting alongside the Biden Administration to unleash women’s full potential. https://t.co/GaLiBLrGGz",2022-03-16 02:21:42+00:00,True,150,122,774,13,en,False,Twitter for iPhone,281,304,https://t.co/GaLiBLrGGz,https://twitter.com/SpeakerPelosi/status/1503919407734706177/photo/1,NA,NA,NA,NA,NA,NA,NA,NA
SpeakerPelosi,15764644,1503919392782008324,"Today, I was proud to join the House Democratic Women’s Caucus, @SecMartyWalsh and advocates to mark #EqualPayDay. https://t.co/OZAZxqLJWd",2022-03-16 02:21:39+00:00,False,293,256,1809,13,en,False,Twitter for iPhone,115,138,https://t.co/OZAZxqLJWd,https://twitter.com/SpeakerPelosi/status/1503919392782008324/photo/1,115,138,https://t.co/OZAZxqLJWd,https://twitter.com/SpeakerPelosi/status/1503919392782008324/photo/1,NA,NA,NA,NA
SpeakerPelosi,15764644,1503801222079340551,"Join @POTUS, Congressional Leaders and me at the @WhiteHouse for the signing of a historic omnibus funding package which lowers costs for working families, creates jobs and tackles some of our nation’s biggest challenges. https://t.co/K1sGElpTaV",2022-03-15 18:32:05+00:00,False,295,399,1328,22,en,False,Twitter Media Studio,222,245,https://t.co/K1sGElpTaV,https://twitter.com/i/broadcasts/1MnxnkLLpkEKO,NA,NA,NA,NA,NA,NA,NA,NA
SpeakerPelosi,15764644,1503795174538948620,"Join me at the @LeagueOfCities Congressional City Conference as I share how @HouseDemocrats are fighting for our cities, towns and villages – which are the engines of education, community and opportunity for so many American families. https://t.co/qSEJua6TRS",2022-03-15 18:08:03+00:00,False,130,160,557,11,en,False,Twitter Media Studio,235,258,https://t.co/qSEJua6TRS,https://twitter.com/i/broadcasts/1zqKVBbblmaKB,NA,NA,NA,NA,NA,NA,NA,NA
SpeakerPelosi,15764644,1503764415866363920,"Join @DemWomenCaucus, @SecMartyWalsh, @RepSpeier, @RepLawrence, equal pay advocates and me at the U.S. Capitol for an event on #EqualPayDay marking all the extra days women must work to reach the amount men made in the previous year. https://t.co/bDO1O1B5PG",2022-03-15 16:05:49+00:00,False,153,161,589,11,en,False,Twitter Media Studio,234,257,https://t.co/bDO1O1B5PG,https://twitter.com/i/broadcasts/1vOGwyYYpmLxB,NA,NA,NA,NA,NA,NA,NA,NA
SpeakerPelosi,15764644,1503749854031495177,"Fairness is an all-American value. This Equal Pay Day, during #WomensHistoryMonth, &amp; every day, let us reaffirm our commitment to advancing the fundamental fairness of our economy &amp; building a future where all can earn a fair wage &amp; chase their dreams. https://t.co/JYL4L9frB5",2022-03-15 15:07:58+00:00,True,73,43,436,5,en,False,Twitter Web App,265,288,https://t.co/JYL4L9frB5,https://www.speaker.gov/newsroom/31522-0,NA,NA,NA,NA,NA,NA,NA,NA
SpeakerPelosi,15764644,1503749852085329943,"Democrats are continuing to fight for the bedrock principle of equal pay for equal work – passing the Paycheck Fairness Act, which will strengthen and modernize the #EqualPay Act so that American women are empowered to take home every dollar they have earned.",2022-03-15 15:07:57+00:00,True,243,84,1167,12,en,False,Twitter Web App,NA,NA,NA,NA,NA,NA,NA,NA,NA,NA,NA,NA
SpeakerPelosi,15764644,1503749848323010578,"#EqualPayDay reminds us of the systemic economic barriers holding back women &amp; our entire nation. More than 4 in 10 women are their families’ primary breadwinners, yet they take home only 83 cents for every $1 made by their male colleagues – a gap even wider for women of color. https://t.co/SRJRfoqjDz",2022-03-15 15:07:56+00:00,False,525,426,2061,39,en,False,Twitter Web App,283,306,https://t.co/SRJRfoqjDz,https://twitter.com/SpeakerPelosi/status/1503749848323010578/photo/1,NA,NA,NA,NA,NA,NA,NA,NA
SpeakerPelosi,15764644,1503386592261644293,"Join @RepJeffries, @NydiaVelazquez, @RepYvetteClarke, local labor leaders and me at Pier One in Brooklyn Bridge Park for a press conference on Building a Better America through investing in our nation’s infrastructure. https://t.co/y1n5rrompA",2022-03-14 15:04:29+00:00,False,179,356,785,25,en,False,Twitter Media Studio,219,242,https://t.co/y1n5rrompA,https://twitter.com/i/broadcasts/1OyKADovPkexb,NA,NA,NA,NA,NA,NA,NA,NA
SpeakerPelosi,15764644,1503175013582712844,"See what happened behind-the-scenes this past week with my Medium post, ‘Madam Speaker.’ https://t.co/M3Soc8gy4x",2022-03-14 01:03:45+00:00,False,182,434,904,21,en,False,Twitter for iPhone,89,112,https://t.co/M3Soc8gy4x,https://speakerpelosi.medium.com/madam-speaker-a-behind-the-scenes-look-at-the-u-s-speaker-of-the-house-9636abda67e5,NA,NA,NA,NA,NA,NA,NA,NA
SpeakerPelosi,15764644,1502740197422907398,"Join @RepKClark, @RepPressley, @RepLoriTrahan, @CHAlliance &amp; me for a discussion on how the #AmericanRescuePlan has helped support hospitals, increased access to affordable health care &amp; strengthened behavioral health services. https://t.co/aovOiFIylv",2022-03-12 20:15:57+00:00,False,214,397,845,20,en,False,Twitter Media Studio,236,259,https://t.co/aovOiFIylv,https://twitter.com/i/broadcasts/1yNGaYPERLjGj,NA,NA,NA,NA,NA,NA,NA,NA
SpeakerPelosi,15764644,1502432965095313411,"The House salutes @RosaDeLauro for her masterful leadership in negotiating this package, which will serve as a strong foundation as @HouseDemocrats continue our focus on #BuildingABetterAmerica.",2022-03-11 23:55:07+00:00,True,139,126,828,9,en,False,Twitter Web App,NA,NA,NA,NA,NA,NA,NA,NA,NA,NA,NA,NA
SpeakerPelosi,15764644,1502432962998149129,"Finally, this legislation also secures $13.6 billion in deeply needed humanitarian, military and economic assistance for Ukraine. The Congress remains ironclad in our commitment to supporting the Ukrainian people as they face Putin's diabolical aggression.",2022-03-11 23:55:06+00:00,True,206,265,1152,21,en,False,Twitter Web App,NA,NA,NA,NA,NA,NA,NA,NA,NA,NA,NA,NA
SpeakerPelosi,15764644,1502432961043615746,"This bill makes crucial investments in meeting the urgent needs of American families, workers, veterans and national security. 

Proudly, during #WomensHistoryMonth, this legislation also finally reauthorizes the Violence Against Women Act.",2022-03-11 23:55:06+00:00,True,152,53,811,6,en,False,Twitter Web App,NA,NA,NA,NA,NA,NA,NA,NA,NA,NA,NA,NA
SpeakerPelosi,15764644,1502432959223283714,"Today, I signed an historic omnibus government funding bill to continue to deliver #ForThePeople through the end of the fiscal year. 

This bill now heads to @POTUS to become law. https://t.co/Fwomgzqcpa",2022-03-11 23:55:05+00:00,False,1244,1391,6919,129,en,False,Twitter Web App,180,203,https://t.co/Fwomgzqcpa,https://twitter.com/SpeakerPelosi/status/1502432959223283714/photo/1,180,203,https://t.co/Fwomgzqcpa,https://twitter.com/SpeakerPelosi/status/1502432959223283714/photo/1,NA,NA,NA,NA
SpeakerPelosi,15764644,1502333321254211585,"While Republicans want to hike taxes and rip away health care from families, Democrats are focusing on Building a Better America: lowering families’ costs, increasing their paychecks and creating good-paying jobs. Read my full statement here: https://t.co/kMZpYVm1DA",2022-03-11 17:19:10+00:00,True,201,260,744,17,en,False,Twitter for iPhone,243,266,https://t.co/kMZpYVm1DA,https://www.speaker.gov/newsroom/31122,NA,NA,NA,NA,NA,NA,NA,NA
SpeakerPelosi,15764644,1502333320138571781,"Because of the success of the #AmericanRescuePlan, @POTUS &amp; @HouseDemocrats helped our nation power an extraordinary economic recovery, which has created more than 7 million good-paying jobs &amp; slashed unemployment to 3.8%. Now, Democrats are hard at work to build on these gains.",2022-03-11 17:19:10+00:00,True,162,175,860,8,en,False,Twitter for iPhone,NA,NA,NA,NA,NA,NA,NA,NA,NA,NA,NA,NA
SpeakerPelosi,15764644,1502333317395451908,"Proudly, in the Rescue Plan, Democrats took action to honor our frontline heroes – health care workers, police officers, firefighters, teachers, and food, sanitation and transportation workers — who are the backbone of our economy.",2022-03-11 17:19:09+00:00,True,113,51,656,3,en,False,Twitter for iPhone,NA,NA,NA,NA,NA,NA,NA,NA,NA,NA,NA,NA
