ScreenName,AuthorID,TweetID,Text,TweetDate,isReply,RetweetCount,ReplyCount,LikeCount,QuoteCount,Language,PossibleSensitive,Source,1stURLStart,1stURLEnd,1stURL,1stURLExp,2ndURLStart,2ndURLEnd,2ndURL,2ndURLExp,3rdURLStart,3rdURLEnd,3rdURL,3rdURLExp
EWarren,357606935,1408421295742726150,"In 2020, the American people voted to put our government on the side of working families.

In March, Democrats passed the #AmericanRescuePlan.

Now, it’s touching people’s lives:
https://t.co/oKQ7BcPkPr",2021-06-25 13:46:18+00:00,False,154,59,961,5,en,False,Twitter Web App,179,202,https://t.co/oKQ7BcPkPr,https://www.huffpost.com/entry/child-tax-credit-monthly-parents-checks-budget_n_60d35643e4b06005129d98fa,NA,NA,NA,NA,NA,NA,NA,NA
EWarren,357606935,1408178220692905993,"Millions of families are barrelling towards the edge of a cliff on September 30, when the pause on federal student loan payments expires. I’m calling on the Biden administration to extend this badly needed relief—and to #CancelStudentDebt.
https://t.co/Lmg6HVpw5t",2021-06-24 21:40:25+00:00,False,624,177,3626,35,en,False,Twitter Web App,240,263,https://t.co/Lmg6HVpw5t,https://www.forbes.com/sites/adamminsky/2021/06/23/elizabeth-warren-to-biden-extend-student-loan-pause-to-2022-or-later/?sh=3e3a35883ce6,NA,NA,NA,NA,NA,NA,NA,NA
EWarren,357606935,1408099580596604928,"I came within about an inch of not being able to finish my education because I couldn’t find child care. I’m staying in the fight for universal child care because if we don’t get this done, millions of parents will keep getting knocked off track.",2021-06-24 16:27:55+00:00,False,1742,368,17479,63,en,False,Twitter Web App,NA,NA,NA,NA,NA,NA,NA,NA,NA,NA,NA,NA
EWarren,357606935,1408068314576789507,"Someone has to keep this country running. Someone has to pay for roads, bridges, child care, and everything else we need to create jobs. It’s time to make billionaires and giant corporations pay their fair share.",2021-06-24 14:23:41+00:00,False,3177,564,19406,150,en,False,Twitter Web App,NA,NA,NA,NA,NA,NA,NA,NA,NA,NA,NA,NA
EWarren,357606935,1407833365219266562,"If Mitch McConnell believes that he will get even the tiniest advantage from removing the filibuster in the future, he will do it. Regardless of what Democrats have done in the past. That's who he is.

In the meantime, the filibuster gives him veto power. And it’s got to go.",2021-06-23 22:50:05+00:00,False,5051,1051,26040,386,en,False,Twitter Web App,NA,NA,NA,NA,NA,NA,NA,NA,NA,NA,NA,NA
EWarren,357606935,1407754785168805897,We can’t let the infrastructure train leave the station without investing in child care and clean energy—or without making billionaires and giant corporations pay their fair share in taxes.,2021-06-23 17:37:50+00:00,False,751,169,5094,32,en,False,Twitter Web App,NA,NA,NA,NA,NA,NA,NA,NA,NA,NA,NA,NA
EWarren,357606935,1407703342030245890,"The clock is ticking. #CancelStudentDebt
https://t.co/S1RlqD0SRO",2021-06-23 14:13:25+00:00,False,532,185,3708,39,en,False,Twitter Web App,41,64,https://t.co/S1RlqD0SRO,https://www.cnbc.com/2021/06/21/senators-warn-of-financial-hardship-when-student-loan-payments-resume.html,NA,NA,NA,NA,NA,NA,NA,NA
EWarren,357606935,1407483594537324544,"Mitch McConnell and the Senate Republican minority just used the filibuster to keep Congress from protecting our democracy. 

We cannot throw our democracy over a cliff in order to protect a Senate rule that isn’t even part of the Constitution. #EndTheFilibuster",2021-06-22 23:40:13+00:00,False,7260,1323,31542,408,en,False,Twitter Web App,NA,NA,NA,NA,NA,NA,NA,NA,NA,NA,NA,NA
EWarren,357606935,1407468556967624705,Here’s what Mitch McConnell just blocked. https://t.co/KTLEodOB9A,2021-06-22 22:40:28+00:00,False,4595,805,25820,323,en,False,Twitter Media Studio,42,65,https://t.co/KTLEodOB9A,https://twitter.com/ewarren/status/1407468556967624705/video/1,NA,NA,NA,NA,NA,NA,NA,NA
EWarren,357606935,1407328712048230400,"Our broken student debt system is saddling older Americans with an impossible burden. With one stroke of the pen, President Biden can—and must—deliver badly needed relief. #CancelStudentDebt
https://t.co/1Jdnd8GES0",2021-06-22 13:24:46+00:00,False,707,291,4541,54,en,False,Twitter Web App,191,214,https://t.co/1Jdnd8GES0,https://www.bloomberg.com/news/articles/2021-06-17/student-loan-growing-share-of-1-7-trillion-debt-pile-held-by-older-americans,NA,NA,NA,NA,NA,NA,NA,NA
EWarren,357606935,1407054281631543297,We can fund universal child care. Or we can keep handing Jeff Bezos enough tax savings to build a superyacht.,2021-06-21 19:14:17+00:00,False,7968,1304,50443,425,en,False,Twitter Web App,NA,NA,NA,NA,NA,NA,NA,NA,NA,NA,NA,NA
EWarren,357606935,1406975622681923588,"The #ForThePeopleAct would help beat back Washington corruption. It would make presidential candidates release their tax returns, make Super PACs disclose their big donors, make Supreme Court justices follow a basic code of ethics, and more. Let’s get this done.",2021-06-21 14:01:43+00:00,False,1909,239,8270,100,en,False,Twitter Web App,NA,NA,NA,NA,NA,NA,NA,NA,NA,NA,NA,NA
EWarren,357606935,1406615494266863616,"Whatever I did, my daddy believed in me. “That’s my Betsy,” he’d say. I wish I could call him today. And I want to wish a happy #FathersDay to all the dads and father figures who are working hard so their kids can dream big. https://t.co/1s7UFAfFla",2021-06-20 14:10:42+00:00,False,640,252,14535,21,en,False,Twitter Media Studio,225,248,https://t.co/1s7UFAfFla,https://twitter.com/ewarren/status/1406615494266863616/photo/1,NA,NA,NA,NA,NA,NA,NA,NA
EWarren,357606935,1406250465638195200,"For the first time ever, #Juneteenth is a federal holiday. It’s an important step. But we can’t stop here. We have to root out systemic racism in every aspect of our economy and society—including health care, housing, education, banking, policing, and voting.",2021-06-19 14:00:12+00:00,False,2096,404,15447,106,en,False,Twitter Web App,NA,NA,NA,NA,NA,NA,NA,NA,NA,NA,NA,NA
EWarren,357606935,1405981265577267202,"Big Pharma’s lobbyists strut around Washington like they own the place. They twist every rule they can find to gobble up bigger profits and squeeze higher drug prices out of the pockets of working families. I’m fighting back.
https://t.co/aVzW4Hp1xJ",2021-06-18 20:10:30+00:00,False,561,138,3128,30,en,False,Twitter Web App,226,249,https://t.co/aVzW4Hp1xJ,https://www.cnbc.com/2021/06/17/covid-sen-warren-presses-phrma-lobbying-group-on-efforts-to-block-vaccine-patent-waivers.html,NA,NA,NA,NA,NA,NA,NA,NA
EWarren,357606935,1405948159398973445,"Jeff Bezos is the second-richest person in the world. His net worth is nearly $195 billion dollars. But his salary is about the same as the average public school teacher in Massachusetts: $80,000. Taxing income alone won’t make him pay his fair share. It’s time for a #WealthTax.",2021-06-18 17:58:57+00:00,False,7318,1550,43480,395,en,False,Twitter Web App,NA,NA,NA,NA,NA,NA,NA,NA,NA,NA,NA,NA
EWarren,357606935,1405889525797228551,"If you hear someone say they oppose the #ForThePeopleAct, here are some pieces of what they’re against: https://t.co/QUMwyRHvjC",2021-06-18 14:05:57+00:00,False,1579,172,4397,102,en,False,Twitter Media Studio,104,127,https://t.co/QUMwyRHvjC,https://twitter.com/ewarren/status/1405889525797228551/video/1,NA,NA,NA,NA,NA,NA,NA,NA
EWarren,357606935,1405665638652207109,"On today’s anniversary, we remember the nine Black worshippers gunned down at Mother Emanuel AME Church. The Senate must act to close the Charleston loophole. And as a country, we must commit to tackling the threat of white nationalist violence. #Emanuel9",2021-06-17 23:16:18+00:00,False,791,107,4812,16,en,False,Twitter Web App,NA,NA,NA,NA,NA,NA,NA,NA,NA,NA,NA,NA
EWarren,357606935,1405646361563914248,"Our democracy is not for sale. Wall Street shouldn’t be able to write its own rules or pick its own prosecutors.
https://t.co/DrOPACXtMJ",2021-06-17 21:59:42+00:00,False,1402,226,4585,130,en,False,Twitter Web App,113,136,https://t.co/DrOPACXtMJ,https://theintercept.com/2021/06/15/manhattan-district-attorney-primary-tali-farhadian-weinstein/,NA,NA,NA,NA,NA,NA,NA,NA
EWarren,357606935,1405605363974651910,"Republicans have tried every trick in the book to rip health care away from tens of millions of Americans. They keep failing because we keep fighting back. Health care is a basic human right, and we fight for basic human rights.
https://t.co/Zh6o2vux1b",2021-06-17 19:16:48+00:00,False,271,94,1629,14,en,False,Twitter Web App,229,252,https://t.co/Zh6o2vux1b,https://www.nytimes.com/2021/06/17/us/obamacare-supreme-court.html,NA,NA,NA,NA,NA,NA,NA,NA
EWarren,357606935,1405584285503873026,Joe Biden and Kamala Harris won the popular vote by over 7 million—the biggest margin in U.S. history. Republicans lie about fraud to hide how badly they came up short. We need to pass the #ForThePeopleAct to stop the GOP from weaponizing those myths by suppressing votes.,2021-06-17 17:53:02+00:00,False,3786,413,19952,123,en,False,Twitter Web App,NA,NA,NA,NA,NA,NA,NA,NA,NA,NA,NA,NA
EWarren,357606935,1405296532677660677,"Families are trying to get back on their feet. But Republican governors are knocking them down—taking money out of their pockets while they look for jobs or struggle to find child care so they can get back to work. It’s appalling.
https://t.co/ymclSrpkSc",2021-06-16 22:49:37+00:00,False,598,233,2568,43,en,False,Twitter Web App,231,254,https://t.co/ymclSrpkSc,https://www.cnn.com/2021/06/15/politics/pandemic-unemployment-benefits-lawsuit-indiana/index.html,NA,NA,NA,NA,NA,NA,NA,NA
EWarren,357606935,1405205395493228550,"Giant corporations like Amazon have too much power over the lives of working people. We need big, structural change to level the playing field—like making it easier to join a union and making sure workers’ voices are heard on corporate boards. https://t.co/AVyeYFgZ95",2021-06-16 16:47:28+00:00,False,295,99,1548,16,en,False,Twitter Web App,244,267,https://t.co/AVyeYFgZ95,https://www.nytimes.com/interactive/2021/06/15/us/amazon-workers.html,NA,NA,NA,NA,NA,NA,NA,NA
EWarren,357606935,1405165081239994370,Voting is the beating heart of our democracy. Any law that makes it harder for someone with a disability to cast their ballot is an attack on the principle of free and fair elections. https://t.co/VGeN3qwDK0,2021-06-16 14:07:16+00:00,False,1040,109,4208,24,en,False,Twitter Web App,184,207,https://t.co/VGeN3qwDK0,https://www.nytimes.com/2021/06/14/us/politics/disability-voting-rights.html?action=click&module=Top%20Stories&pgtype=Homepage,NA,NA,NA,NA,NA,NA,NA,NA
EWarren,357606935,1404950132827754501,"Well, we know our job for the next year and a half: We’ve got to make it “highly unlikely” that Mitch McConnell gets to be Majority Leader again.
https://t.co/XPG1sEMx2h",2021-06-15 23:53:09+00:00,False,839,204,5097,43,en,False,Twitter Web App,146,169,https://t.co/XPG1sEMx2h,https://www.yahoo.com/lifestyle/mitch-mcconnell-says-highly-unlikely-211500387.html,NA,NA,NA,NA,NA,NA,NA,NA
EWarren,357606935,1404894810868174849,Republican lawmakers are targeting trans kids with hateful new laws. It’s despicable. Here’s how we can draw inspiration from the history of #Pride to fight back: https://t.co/oy0jUc5Sf0,2021-06-15 20:13:19+00:00,False,404,140,1924,30,en,False,Twitter Media Studio,163,186,https://t.co/oy0jUc5Sf0,https://twitter.com/ewarren/status/1404894810868174849/video/1,NA,NA,NA,NA,NA,NA,NA,NA
EWarren,357606935,1404789802382278662,"Roads, bridges, buses, trains, and broadband internet all make it possible for people to go to work and do their jobs.

So does child care.

We can’t invest in creating jobs without investing in quality, affordable child care.",2021-06-15 13:16:03+00:00,False,2152,301,14590,65,en,False,Twitter Web App,NA,NA,NA,NA,NA,NA,NA,NA,NA,NA,NA,NA
EWarren,357606935,1404542433074061312,Here’s why we need to pass the #ForThePeopleAct: https://t.co/XISDa0pra2,2021-06-14 20:53:05+00:00,False,1069,191,3523,72,en,False,Twitter Media Studio,49,72,https://t.co/XISDa0pra2,https://twitter.com/ewarren/status/1404542433074061312/video/1,NA,NA,NA,NA,NA,NA,NA,NA
EWarren,357606935,1404507125850775559,"When nurses speak out, I listen—and I fight by their side. https://t.co/4i5OBeeOdP",2021-06-14 18:32:47+00:00,False,169,60,1167,2,en,False,Twitter Web App,59,82,https://t.co/4i5OBeeOdP,https://spectrumnews1.com/ma/worcester/news/2021/06/13/saint-vs-rally-june-12,NA,NA,NA,NA,NA,NA,NA,NA
EWarren,357606935,1404429259217805323,"The rich and powerful have rigged the rules to make themselves richer and more powerful. That leads to the income gap. But income inequality doesn’t hold a candle to wealth inequality. It is long past time for a #WealthTax in America.
https://t.co/uypcbUMvLb",2021-06-14 13:23:23+00:00,False,584,189,2677,30,en,False,Twitter Web App,235,258,https://t.co/uypcbUMvLb,https://elizabethwarren.com/covid-wealth-growth,NA,NA,NA,NA,NA,NA,NA,NA
EWarren,357606935,1404195414627258370,"Student loan debt is holding back tens of millions of people across this country who can’t buy homes, buy cars, or start small businesses. President Biden needs to #CancelStudentDebt not only for those people individually but also for our whole economy.",2021-06-13 21:54:10+00:00,False,3321,1000,21148,227,en,False,Twitter Web App,NA,NA,NA,NA,NA,NA,NA,NA,NA,NA,NA,NA
EWarren,357606935,1404105770384379911,"Our tax code is littered with loopholes. They’re so big that Jeff Bezos could drive an Amazon truck or fly a rocket ship through them. Let’s raise opportunity for everyone in America by making billionaires and giant corporations pay their fair share.
https://t.co/BzB8zdsXdP",2021-06-13 15:57:57+00:00,False,1613,357,8667,89,en,False,Twitter Web App,251,274,https://t.co/BzB8zdsXdP,https://www.cnbc.com/2021/06/10/how-wealthy-americans-like-bezos-buffett-musk-pay-little-in-income-taxes.html,NA,NA,NA,NA,NA,NA,NA,NA
EWarren,357606935,1403800004016365569,Democrats didn’t ask people to put us in office so we could enshrine a Senate rule that empowers Mitch McConnell. We asked people to vote for us so we could deliver results. Now is the time to deliver on our promises to the American people. #EndTheFilibuster,2021-06-12 19:42:56+00:00,False,8745,1132,43510,604,en,False,Twitter Web App,NA,NA,NA,NA,NA,NA,NA,NA,NA,NA,NA,NA
EWarren,357606935,1403709441648758788,"I’m grateful for @BJoeWolf and everybody who’s stayed in this fight to honor the memory of the Pulse victims with action—to ensure full equality, end gun violence, and make sure we don’t forget what happened five years ago.
https://t.co/r6iHsjwBhq",2021-06-12 13:43:05+00:00,False,302,47,2059,9,en,False,Twitter Web App,224,247,https://t.co/r6iHsjwBhq,https://www.cnn.com/2021/06/10/politics/pulse-lgbtq-activism-race-deconstructed-newsletter/index.html,NA,NA,NA,NA,NA,NA,NA,NA
EWarren,357606935,1403396933394259969,"If we don’t make the ultra-rich pay their fair share, what are we supposed to say to all the working people who pay their taxes on time, as owed, and pick up the tab for these billionaires? https://t.co/7yATMnbNaz",2021-06-11 17:01:17+00:00,False,1134,315,5903,79,en,False,Twitter Web App,190,213,https://t.co/7yATMnbNaz,https://www.nytimes.com/2021/06/09/us/politics/propublica-taxes-jeff-bezos-elon-musk.html,NA,NA,NA,NA,NA,NA,NA,NA
EWarren,357606935,1403342707586736129,"I’m pushing for three changes to our tax laws—a #WealthTax, a Real Corporate Profits Tax, and long-term funding for the IRS to go after wealthy tax cheats—to bring in about $6 trillion. More than enough to pay for the entire Biden-Harris jobs plan, with trillions left over.",2021-06-11 13:25:48+00:00,False,3272,657,16952,232,en,False,Twitter Web App,NA,NA,NA,NA,NA,NA,NA,NA,NA,NA,NA,NA
EWarren,357606935,1403101600378507265,"When you look at the right numbers, the truth stands out: Canceling $50,000 of student debt would give the most help to people who’ve had the rules rigged against them. #CancelStudentDebt https://t.co/KxaIziJ4sT",2021-06-10 21:27:44+00:00,False,982,386,5902,79,en,False,Twitter Web App,188,211,https://t.co/KxaIziJ4sT,https://finance.yahoo.com/news/student-loan-forgiveness-low-income-borrowers-191613215.html,NA,NA,NA,NA,NA,NA,NA,NA
EWarren,357606935,1403040905280512002,Voting is the foundation of our democracy. The filibuster is not.,2021-06-10 17:26:33+00:00,False,6151,828,39121,281,en,False,Twitter Web App,NA,NA,NA,NA,NA,NA,NA,NA,NA,NA,NA,NA
EWarren,357606935,1402986017414553604,"Republicans across the country are passing law after law after law to make it harder to vote. 

They’re gearing up to gerrymander as many safe GOP seats as possible.

The message is clear: They’re scared to face the will of the people in a free and fair election.",2021-06-10 13:48:27+00:00,False,2409,642,10744,144,en,False,Twitter Web App,NA,NA,NA,NA,NA,NA,NA,NA,NA,NA,NA,NA
EWarren,357606935,1402748408897708032,"It’s one thing to know in the abstract that the ultra-rich play by a different set of rules.

It’s another thing to have the facts shoved in your face.

Let’s start to level the playing field here with a #WealthTax. https://t.co/oDu7PbRW27",2021-06-09 22:04:17+00:00,False,1128,262,5097,49,en,False,Twitter Web App,216,239,https://t.co/oDu7PbRW27,https://www.cbsnews.com/news/income-tax-wealthy-bezos-buffett/,NA,NA,NA,NA,NA,NA,NA,NA
