ScreenName,AuthorID,TweetID,Text,TweetDate,isReply,RetweetCount,ReplyCount,LikeCount,QuoteCount,Language,PossibleSensitive,Source,1stURLStart,1stURLEnd,1stURL,1stURLExp,2ndURLStart,2ndURLEnd,2ndURL,2ndURLExp,3rdURLStart,3rdURLEnd,3rdURL,3rdURLExp
EWarren,357606935,1472971074119864320,"The American people elected a Democratic House, a Democratic Senate, and a Democratic president to defend our basic rights and put Washington on the side of working people. So enough with the delays. We’ve got to vote on voting rights and #BuildBackBetter.",2021-12-20 16:44:05+00:00,False,2031,797,14028,105,en,False,Twitter Web App,NA,NA,NA,NA,NA,NA,NA,NA,NA,NA,NA,NA
EWarren,357606935,1472945811143155717,"You know how I know that President Biden has the power to #CancelStudentDebt? Because he’s already used it. So did President Obama, and so did Donald Trump. It’s time for the administration to cancel $50,000 in student debt and give relief to people who are getting crushed.",2021-12-20 15:03:42+00:00,False,4772,1667,34623,373,en,False,Twitter Web App,NA,NA,NA,NA,NA,NA,NA,NA,NA,NA,NA,NA
EWarren,357606935,1472247268506050560,"A win for kids. A win for parents. A win for our whole economy. Let’s get this done so we can #BuildBackBetter. 
https://t.co/AWV430D0Z0",2021-12-18 16:47:56+00:00,False,307,246,2086,25,en,False,Twitter Web App,113,136,https://t.co/AWV430D0Z0,https://www.reuters.com/world/us/us-rollout-free-preschool-could-put-more-moms-into-us-workforce-2021-12-14/,NA,NA,NA,NA,NA,NA,NA,NA
EWarren,357606935,1472049324112683009,Walking between votes https://t.co/7s5FgRItwf,2021-12-18 03:41:22+00:00,False,452,590,18019,61,en,False,Twitter Web App,22,45,https://t.co/7s5FgRItwf,https://twitter.com/ewarren/status/1472049324112683009/photo/1,NA,NA,NA,NA,NA,NA,NA,NA
EWarren,357606935,1471932639066087434,"Protecting voting rights isn’t about giving one side or the other an advantage. It's about protecting democracy, so every American citizen gets the right to vote and right to have that vote counted. The Senate must act. Now.",2021-12-17 19:57:42+00:00,False,2337,493,11587,126,en,False,Twitter Web App,NA,NA,NA,NA,NA,NA,NA,NA,NA,NA,NA,NA
EWarren,357606935,1471891725694210055,"Families are using the child tax credit to buy diapers and school shoes. To put food on the table and keep a roof over their heads. We need to get this out every single month. Families can't afford for us to fall behind.
https://t.co/EDKF2q73vs",2021-12-17 17:15:08+00:00,False,326,202,1892,27,en,False,Twitter Web App,221,244,https://t.co/EDKF2q73vs,https://www.cleveland.com/news/2021/12/child-tax-credit-should-be-extended-to-help-fight-hunger-greater-cleveland-food-bank-and-other-advocates-say.html,NA,NA,NA,NA,NA,NA,NA,NA
EWarren,357606935,1471844440079798277,Working families are paying the price for corporate greed. We need more competition and strong antitrust enforcement so these meatpacking monopolies can’t jack up prices so casually. https://t.co/uLmjPmrn8s,2021-12-17 14:07:14+00:00,False,575,584,2330,65,en,False,Twitter Web App,183,206,https://t.co/uLmjPmrn8s,https://www.reuters.com/business/meat-packers-profit-margins-jumped-300-during-pandemic-white-house-economics-2021-12-10/,NA,NA,NA,NA,NA,NA,NA,NA
EWarren,357606935,1471597989957357572,"Republican state legislatures are competing to see who can stop the most Americans from voting. If we don’t take action in Congress to protect the right to vote and the right to have that vote counted, we lose our democracy. And we can’t let the filibuster get in the way.",2021-12-16 21:47:56+00:00,False,1320,418,5904,75,en,False,Twitter Web App,NA,NA,NA,NA,NA,NA,NA,NA,NA,NA,NA,NA
EWarren,357606935,1471525340535218179,"If we don’t respond to the radical takeover of the Supreme Court, we’ll just embolden right-wing extremists and corporate interests to do even more damage to the rule of law and our basic constitutional rights. We must act. We must #ExpandTheCourt.
https://t.co/RvIoyIAkQk",2021-12-16 16:59:15+00:00,False,601,302,2626,52,en,False,Twitter Web App,249,272,https://t.co/RvIoyIAkQk,https://www.thenation.com/article/politics/elizabeth-warren-supreme-court/,NA,NA,NA,NA,NA,NA,NA,NA
EWarren,357606935,1471492569083252746,Restarting federal student loan payments is going to be a hard blow to people who’ve struggled throughout the pandemic. Now is the time to #CancelStudentDebt so we can lift this anchor from our economy.,2021-12-16 14:49:02+00:00,False,4376,2319,29792,438,en,False,Twitter Web App,NA,NA,NA,NA,NA,NA,NA,NA,NA,NA,NA,NA
EWarren,357606935,1471249658374770692,"Americans deserve a Supreme Court that values constitutional rights, protects democracy, and gives working parents and millionaire executives the same fair shake. To get there, Congress must use our constitutional authority to #ExpandTheCourt. https://t.co/sWHEPJ4gbC",2021-12-15 22:43:47+00:00,False,581,324,2728,53,en,False,Twitter Web App,244,267,https://t.co/sWHEPJ4gbC,https://www.bostonglobe.com/2021/12/15/opinion/expand-supreme-court/,NA,NA,NA,NA,NA,NA,NA,NA
EWarren,357606935,1471202424341868552,"Republicans have hijacked America’s Supreme Court to threaten basic liberties, settled law, and the very foundations of our democracy. There’s only one way to rebalance this broken institution and restore its integrity: We must #ExpandTheCourt. https://t.co/N6WIEHLAqn",2021-12-15 19:36:06+00:00,False,1136,546,4214,110,en,False,Twitter Media Studio,245,268,https://t.co/N6WIEHLAqn,https://twitter.com/ewarren/status/1471202424341868552/video/1,NA,NA,NA,NA,NA,NA,NA,NA
EWarren,357606935,1471123508822429696,"Congratulations, @LydiaMEdwards! Your victory is a victory for Massachusetts families, and you’re going to keep being a powerhouse for change. https://t.co/8Gs0NNMJu7",2021-12-15 14:22:31+00:00,False,84,49,790,3,en,False,Twitter Web App,143,166,https://t.co/8Gs0NNMJu7,https://twitter.com/BostonGlobe/status/1470939354348544012,NA,NA,NA,NA,NA,NA,NA,NA
EWarren,357606935,1470835404144357381,"When workers fight, workers win—and every win inspires more people to join the fight. I stand with these workers fighting for a more just economy for all. https://t.co/eLUUKkUUsM",2021-12-14 19:17:41+00:00,False,157,97,934,5,en,False,Twitter Web App,155,178,https://t.co/eLUUKkUUsM,https://twitter.com/SBWorkersUnited/status/1470558028218998786,NA,NA,NA,NA,NA,NA,NA,NA
EWarren,357606935,1470776976671715332,"Vote today for @LydiaMEdwards in the special MA Senate election! She'll fight from the heart for MA families to champion housing, environmental justice, &amp; child care. Polls are open until 8pm. Find your polling location here &amp; bring your friends! https://t.co/HCNqE4YwLb",2021-12-14 15:25:31+00:00,False,116,48,487,9,en,False,Twitter Web App,255,278,https://t.co/HCNqE4YwLb,http://wheredoivotema.com,NA,NA,NA,NA,NA,NA,NA,NA
EWarren,357606935,1470761267182850053,I was able to get my college degree from a public university that cost $50 a semester. That kind of opportunity simply isn’t available today. We need to make technical schools and two- and four-year public colleges tuition-free and #CancelStudentDebt. https://t.co/Th1Q9jzG9i,2021-12-14 14:23:06+00:00,False,1475,815,8974,160,en,False,Twitter Web App,252,275,https://t.co/Th1Q9jzG9i,https://www.insidehighered.com/news/2021/12/13/elizabeth-warren-explains-why-she-wants-fix-student-debt,NA,NA,NA,NA,NA,NA,NA,NA
EWarren,357606935,1470436771150323714,"When someone makes it big in America—millionaire big, billionaire big, Person of the Year big—part of it has to include paying it forward so the next kid can get a chance, too. https://t.co/OQUYXf5kIq",2021-12-13 16:53:40+00:00,False,3940,2045,21486,294,en,False,Twitter Web App,177,200,https://t.co/OQUYXf5kIq,https://twitter.com/4TaxFairness/status/1470406328610922502,NA,NA,NA,NA,NA,NA,NA,NA
EWarren,357606935,1470403587926904833,"Before we passed the American Rescue Plan, experts said unemployment wouldn’t drop to 4.2% until the end of 2024. But Democrats took action to lift up working families. And the unemployment rate right now? 4.2%—with 1.3 million more jobs than predicted. https://t.co/94m8nQDVqi",2021-12-13 14:41:48+00:00,False,322,118,1116,10,en,False,Twitter Web App,254,277,https://t.co/94m8nQDVqi,https://rooseveltinstitute.org/2021/12/09/the-year-the-american-rescue-plan-made-2021-in-review/,NA,NA,NA,NA,NA,NA,NA,NA
EWarren,357606935,1470085203544662019,"When giant corporations get to call all the shots, they pass on costs to consumers while raking in record profits. We’ve got to level the playing field—and that includes taking on the big monopolies that lead to price-gouging.
https://t.co/7XiP8rIYqJ",2021-12-12 17:36:40+00:00,False,397,148,1745,22,en,False,Twitter Web App,227,250,https://t.co/7XiP8rIYqJ,https://www.seattletimes.com/business/economy/fattest-corporate-profits-since-1950-debunk-inflation-story-spun-by-ceos/,NA,NA,NA,NA,NA,NA,NA,NA
EWarren,357606935,1469800130257817618,Great to be with my partners in state and local government to support our friend @LydiaMEdwards for State Senate. Go vote this Tuesday! https://t.co/4HiSvdndoE,2021-12-11 22:43:53+00:00,False,130,50,893,4,en,False,Twitter Web App,136,159,https://t.co/4HiSvdndoE,https://twitter.com/ewarren/status/1469800130257817618/photo/1,136,159,https://t.co/4HiSvdndoE,https://twitter.com/ewarren/status/1469800130257817618/photo/1,136,159,https://t.co/4HiSvdndoE,https://twitter.com/ewarren/status/1469800130257817618/photo/1
EWarren,357606935,1469712664381247497,Woo-hoo! A win for unions is a win for workers everywhere. I’m standing in solidarity with everyone fighting to grow the labor movement and put power in the hands of working people for the long haul. #MACoffeeUnion https://t.co/sw4VMvktxf,2021-12-11 16:56:19+00:00,False,277,105,2238,12,en,False,Twitter Web App,215,238,https://t.co/sw4VMvktxf,https://twitter.com/DbfUnited/status/1469146484725669888,NA,NA,NA,NA,NA,NA,NA,NA
EWarren,357606935,1469434583884124168,Here’s one piece of the inflation issue that a lot of people aren’t talking about—and how we can fight back. https://t.co/yMhr06dKgg,2021-12-10 22:31:20+00:00,False,498,241,1661,58,en,False,Twitter Media Studio,109,132,https://t.co/yMhr06dKgg,https://twitter.com/ewarren/status/1469434583884124168/video/1,NA,NA,NA,NA,NA,NA,NA,NA
EWarren,357606935,1469362913366482950,"You want to help families manage rising costs? Then you want the #BuildBackBetter Act—bringing down big expenses like housing, child care, health care, prescription drugs, home and community care, and more. https://t.co/Qew15Sazn0",2021-12-10 17:46:32+00:00,False,233,93,981,5,en,False,Twitter Web App,207,230,https://t.co/Qew15Sazn0,https://twitter.com/InvestNowUSA/status/1469312434057920525,NA,NA,NA,NA,NA,NA,NA,NA
EWarren,357606935,1469320213149765634,"The richest of the rich use every trick in the book to make it look like they don’t have any income and shouldn’t pay any federal income taxes. So let’s put a #WealthTax on their heaps of cash and get them to pay a fair share.
https://t.co/ZLKrO6pmcH",2021-12-10 14:56:52+00:00,False,416,107,1655,14,en,False,Twitter Web App,227,250,https://t.co/ZLKrO6pmcH,https://www.propublica.org/article/a-massive-oil-spill-helped-one-billionaire-avoid-paying-income-tax-for-14-years,NA,NA,NA,NA,NA,NA,NA,NA
EWarren,357606935,1469094431928332296,Parents need child care so they can go back to work. Families need lower costs on prescription drugs so they can get the care they need. Our kids &amp; grandkids need us to fight climate change so our planet can have a future. We can’t wait—we need to pass the #BuildBackBetter Act.,2021-12-09 23:59:41+00:00,False,555,143,3508,18,en,False,Twitter Web App,NA,NA,NA,NA,NA,NA,NA,NA,NA,NA,NA,NA
EWarren,357606935,1469014388506038278,"Ending the pause on student loan payments would stifle our economy and shove a huge burden onto millions of borrowers. President Biden must extend the pause and #CancelStudentDebt.
https://t.co/6SkOL1CYhV",2021-12-09 18:41:37+00:00,False,493,329,2818,67,en,False,Twitter Web App,181,204,https://t.co/6SkOL1CYhV,https://www.businessinsider.com/student-loan-payment-restart-will-strip-85-billion-from-families-2021-12,NA,NA,NA,NA,NA,NA,NA,NA
EWarren,357606935,1468965314691932170,"We can’t run an economy in the 21st century without supporting caregiving. The #BuildBackBetter plan will help moms and dads get child care for their babies, and home and community care for their parents. https://t.co/RdULlBkECJ",2021-12-09 15:26:37+00:00,False,170,66,979,9,en,False,Twitter Web App,205,228,https://t.co/RdULlBkECJ,https://twitter.com/nytopinion/status/1468252528185946120,NA,NA,NA,NA,NA,NA,NA,NA
EWarren,357606935,1468721362512584704,"I’m tired of rich people getting away with cheating on their taxes. The #BuildBackBetter plan will increase enforcement on those at the top, say ""party’s over"" to wealthy tax cheats, and raise billions we can use to support hard-working families.",2021-12-08 23:17:15+00:00,False,1352,873,9282,95,en,False,Twitter Web App,NA,NA,NA,NA,NA,NA,NA,NA,NA,NA,NA,NA
EWarren,357606935,1468675344001642498,"A “toddler takeover”? That’s the best they’ve got? Clearly these guys like Mitch McConnell haven’t had to worry about finding child care so they could make it to work every day. Families need quality, affordable child care—and Democrats will deliver.
https://t.co/e0YAwjHJkP",2021-12-08 20:14:23+00:00,False,1074,343,5542,87,en,False,Twitter Web App,251,274,https://t.co/e0YAwjHJkP,https://www.huffpost.com/entry/child-care-costs-democrats_n_61afd943e4b02df7c6ade143,NA,NA,NA,NA,NA,NA,NA,NA
EWarren,357606935,1468619441747472384,"I’m endorsing @JCisnerosTX for Congress in Texas’ 28th District because she’s fighting for working families, not big money—and she knows that when progressives are unapologetic about who we’re in this battle for, we win. https://t.co/oyi1YgHiSD",2021-12-08 16:32:15+00:00,False,389,63,2138,16,en,False,Twitter Web App,221,244,https://t.co/oyi1YgHiSD,https://twitter.com/JCisnerosTX/status/1468615106955202568,NA,NA,NA,NA,NA,NA,NA,NA
EWarren,357606935,1468583621011386368,"People have had to pay record-high prices for car rentals. But instead of investing in more inventory so they could bring down prices, Hertz shelled out $2 billion to reward executives, company insiders, and big shareholders. I’m demanding answers.
https://t.co/h96JrbTPNi",2021-12-08 14:09:54+00:00,False,940,366,4899,83,en,False,Twitter Web App,249,272,https://t.co/h96JrbTPNi,https://www.cnn.com/2021/12/07/business/elizabeth-warren-hertz-buybacks/index.html,NA,NA,NA,NA,NA,NA,NA,NA
EWarren,357606935,1468352270500827138,"We see it around the world, and we see it here at home: women have paid an extra price during this pandemic. We need to level the playing field—and that includes paid leave and universal child care. https://t.co/rJIgDaPblz",2021-12-07 22:50:36+00:00,False,205,86,1180,7,en,False,Twitter Web App,199,222,https://t.co/rJIgDaPblz,https://www.reuters.com/markets/funds/gender-equality-takes-one-step-forward-three-back-during-covid-2021-12-02/,NA,NA,NA,NA,NA,NA,NA,NA
EWarren,357606935,1468315722636013573,"It is time for a #WealthTax in America.
https://t.co/I7KVsR3xyA",2021-12-07 20:25:22+00:00,False,498,256,2801,45,en,False,Twitter Web App,40,63,https://t.co/I7KVsR3xyA,https://www.cnn.com/2021/12/07/business/global-wealth-income-gap/index.html,NA,NA,NA,NA,NA,NA,NA,NA
EWarren,357606935,1468265509481238530,"A few giants have gobbled up huge chunks of our economy.
It’s bad for consumers, who pay higher prices.
It’s bad for workers, who get lower wages.
It’s bad for small businesses, who don’t get to compete.
It’s bad for our economy—and Washington must act. https://t.co/jlfdfkJMGK",2021-12-07 17:05:51+00:00,False,363,129,1884,33,en,False,Twitter Web App,254,277,https://t.co/jlfdfkJMGK,https://www.washingtonpost.com/politics/2021/12/07/sen-warren-says-tech-giants-like-amazon-are-helping-drive-up-prices/,NA,NA,NA,NA,NA,NA,NA,NA
EWarren,357606935,1467962601116209153,"We can’t let a procedural quirk in the U.S. Senate prevent us from doing what the American people elected us to do. We must #EndTheFilibuster so we can protect the right to vote, get commonsense gun safety laws on the books, ensure abortion rights, and more.",2021-12-06 21:02:12+00:00,False,2304,393,11582,124,en,False,Twitter Web App,NA,NA,NA,NA,NA,NA,NA,NA,NA,NA,NA,NA
EWarren,357606935,1467893355938033670,"Giant corporations are trying to run the same play they pulled off in California: spend millions on misleading ads so they can boost their profits by slashing protections for workers. Massachusetts, let’s be loud and clear: our laws are not for sale. https://t.co/UYmIDehW3r",2021-12-06 16:27:02+00:00,False,240,44,1107,3,en,False,Twitter Web App,251,274,https://t.co/UYmIDehW3r,https://twitter.com/Massnotforsale/status/1466489901818523652,NA,NA,NA,NA,NA,NA,NA,NA
EWarren,357606935,1467858158173536273,"Parents are stuck on waiting lists trying to get their kids into child care so they can go back to work.

Early educators are making poverty wages. 

People are getting crushed by the cost of prescriptions like insulin.

They need relief—and #BuildBackBetter will deliver it.",2021-12-06 14:07:11+00:00,False,1515,311,8885,61,en,False,Twitter Web App,NA,NA,NA,NA,NA,NA,NA,NA,NA,NA,NA,NA
EWarren,357606935,1467238885117861892,"My plan for a Corporate Minimum Tax will stop billion-dollar corporations from fooling around with loopholes in the tax code to get out of paying anything. They’ll have to pitch in—and we’ll use that money for child care, pre-k, fighting climate change, and more.",2021-12-04 21:06:24+00:00,False,969,316,6412,43,en,False,Twitter Web App,NA,NA,NA,NA,NA,NA,NA,NA,NA,NA,NA,NA
EWarren,357606935,1467133396224811013,"Here’s what happens when we underfund the IRS: they focus on the simplest audits, which means targeting people who don’t make a lot of money. So my plan beefs up enforcement specifically for the IRS to go after the complex schemes of wealthy tax cheats.
https://t.co/yOJ4R2Zid4",2021-12-04 14:07:14+00:00,False,1065,266,6537,47,en,False,Twitter Web App,254,277,https://t.co/yOJ4R2Zid4,https://www.npr.org/2021/12/02/1060773437/sen-elizabeth-warren-is-focused-on-bringing-in-more-tax-revenue-for-the-irs,NA,NA,NA,NA,NA,NA,NA,NA
EWarren,357606935,1466884827014221833,"Corporate profit margins haven’t been this high since December 1950. And because so many big corporations have gobbled up so many competitors, they hold consumers hostage to higher prices. We need an economy that works for working people, not just CEOs.
https://t.co/zeGtBvuRQa",2021-12-03 21:39:30+00:00,False,438,124,1655,13,en,False,Twitter Web App,254,277,https://t.co/zeGtBvuRQa,https://www.businessinsider.com/companies-pocket-largest-profits-in-70-years-amid-inflation-complaints-2021-12,NA,NA,NA,NA,NA,NA,NA,NA
EWarren,357606935,1466822202247065600,"When someone’s deciding whether to continue a pregnancy, they should be able to consult with anyone they want—a partner, a parent, a doctor—but it’s not the government’s job to interfere in that decision. I’m going to keep fighting to protect this fundamental right.",2021-12-03 17:30:39+00:00,False,3652,707,34856,134,en,False,Twitter Web App,NA,NA,NA,NA,NA,NA,NA,NA,NA,NA,NA,NA
EWarren,357606935,1466777994530283523,"Four years ago, when Republicans got into power, they pulled out all the stops to try to rip health care away from tens of millions. Now that the American people have put Democrats in control, our toes are on the line to expand health care. https://t.co/2nrvYUyVqB",2021-12-03 14:34:59+00:00,False,223,106,1368,9,en,False,Twitter Web App,241,264,https://t.co/2nrvYUyVqB,https://www.nytimes.com/2021/12/01/us/politics/build-back-better-act-health-coverage.html,NA,NA,NA,NA,NA,NA,NA,NA
EWarren,357606935,1466552979616452609,"#BuildBackBetter goes directly to the heart of what working families need—not just reducing costs a little at the margin, but reducing big costs that families are working through now.
https://t.co/Z9Rv7KvEkx",2021-12-02 23:40:52+00:00,False,130,74,709,6,en,False,Twitter Web App,184,207,https://t.co/Z9Rv7KvEkx,https://www.npr.org/2021/12/01/1059861219/center-left-group-claims-democrats-spending-package-would-save-families-thousand,NA,NA,NA,NA,NA,NA,NA,NA
